EU27+UK,Activity,Production of electricity by solar photovoltaic,1.5070517344436544e-06,2.8112525985151922e-08,2.8047847456130344e-08,7.732913490547888e-09,9.247422600258405e-09,3.132852518193209e-08,8.512338760808293e-09,5.211840746692101e-09,4.8596991625544504e-09,7.470969931647849e-09,0.0004535119307989052,6.4208312537985234e-09,4.800343756647117e-09,9.485257171685673e-09,7.62253750108634e-09
EU27+UK,Activity,Production of electricity by solar thermal,7.249714133029706e-08,1.3612302980632329e-09,1.5891516927489477e-09,4.4485245579832565e-10,4.767684047974269e-10,2.2796598122991396e-09,4.5933900702065314e-10,2.7773539572970293e-10,2.464314373773176e-10,3.671808487086418e-10,2.3368682345176157e-08,0.01606362378622104,2.402834272820602e-10,5.100945346323132e-10,4.185293872588479e-10
EU27+UK,Activity,"Production of electricity by tide, wave, ocean",3.6564417570128494e-10,5.262255220821383e-11,5.156607703309419e-11,4.949884317636952e-11,6.59232349346111e-11,5.945303043690402e-11,5.536794301140572e-11,3.3537336571827555e-11,4.013127004798315e-11,4.3487542984116135e-11,1.3485835566202793e-10,3.406670387034397e-11,1.8407904125031656e-05,4.126862783863401e-11,4.744066515671933e-11
EU27+UK,Activity,Production of electricity by wind,1.0671554343421624e-06,5.8692646180213196e-08,6.115826216589657e-08,7.119074963128636e-08,1.0324854158166434e-07,6.274895583720176e-08,7.667096401455039e-08,4.767164997906484e-08,6.426498135175781e-08,5.83622504236814e-08,3.6416830449396426e-07,4.477374862249807e-08,8.907285304829914e-08,6.93111173720068e-05,7.114996807199795e-08
EU27+UK,Activity,Production of electricity nec,5.853957488530786e-11,3.3442368949332984e-11,3.469881618477703e-11,3.151149362318549e-11,4.4065600558844976e-11,3.24456222340043e-11,3.5187542356199565e-11,2.1109513289050816e-11,2.6960691732043993e-11,2.699247907751066e-11,2.939529757935341e-11,2.163965002867469e-11,3.650142312427398e-11,2.3698657230465314e-11,1.5101365330826837e-07
EU27+UK,Activity,Production of meat products nec,0.0,0.0,0.0,0.0,0.0,0.0,0.0,0.0,0.0,0.0,0.0,0.0,0.0,0.0,0.0
EU27+UK,Activity,Production of offshore wind plants,0.0,0.0,0.0,0.0,0.0,0.0,0.0,0.0,0.0,0.0,0.0,0.0,0.0,0.0,0.0
EU27+UK,Activity,Production of onshore wind plants,0.0,0.0,0.0,0.0,0.0,0.0,0.0,0.0,0.0,0.0,0.0,0.0,0.0,0.0,0.0
EU27+UK,Activity,Production of photovoltaic plants,0.0,0.0,0.0,0.0,0.0,0.0,0.0,0.0,0.0,0.0,0.0,0.0,0.0,0.0,0.0
EU27+UK,Activity,Public administration and defence; compulsory social security (75),0.0,0.0,0.0,0.0,0.0,0.0,0.0,0.0,0.0,0.0,0.0,0.0,0.0,0.0,0.0
EU27+UK,Activity,"Publishing, printing and reproduction of recorded media (22)",0.0,0.0,0.0,0.0,0.0,0.0,0.0,0.0,0.0,0.0,0.0,0.0,0.0,0.0,0.0
EU27+UK,Activity,Pulp,7.461488944313182e-09,1.1450053708710436e-08,1.0485584616330155e-08,1.1355047205577972e-08,7.0230581550102005e-09,6.988014323461024e-09,9.116553070691055e-09,5.055168035857435e-09,3.509572136389398e-09,6.290289193577304e-09,4.1953666440981465e-09,3.7023875089287795e-09,2.8548246036647427e-09,5.326589806914086e-09,7.211807296319832e-09
EU27+UK,Activity,Quarrying of sand and clay,0.0,0.0,0.0,0.0,0.0,0.0,0.0,0.0,0.0,0.0,0.0,0.0,0.0,0.0,0.0
EU27+UK,Activity,Quarrying of stone,0.0,0.0,0.0,0.0,0.0,0.0,0.0,0.0,0.0,0.0,0.0,0.0,0.0,0.0,0.0
EU27+UK,Activity,Raw milk,0.0,0.0,0.0,0.0,0.0,0.0,0.0,0.0,0.0,0.0,0.0,0.0,0.0,0.0,0.0
EU27+UK,Activity,Re-processing of ash into clinker,0.0,0.0,0.0,0.0,0.0,0.0,0.0,0.0,0.0,0.0,0.0,0.0,0.0,0.0,0.0
EU27+UK,Activity,Re-processing of secondary aluminium into new aluminium,0.0,0.0,0.0,0.0,0.0,0.0,0.0,0.0,0.0,0.0,0.0,0.0,0.0,0.0,0.0
EU27+UK,Activity,Re-processing of secondary construction material into aggregates,0.0,0.0,0.0,0.0,0.0,0.0,0.0,0.0,0.0,0.0,0.0,0.0,0.0,0.0,0.0
EU27+UK,Activity,Re-processing of secondary copper into new copper,0.0,0.0,0.0,0.0,0.0,0.0,0.0,0.0,0.0,0.0,0.0,0.0,0.0,0.0,0.0
EU27+UK,Activity,Re-processing of secondary glass into new glass,0.0,0.0,0.0,0.0,0.0,0.0,0.0,0.0,0.0,0.0,0.0,0.0,0.0,0.0,0.0
EU27+UK,Activity,"Re-processing of secondary lead into new lead, zinc and tin",0.0,0.0,0.0,0.0,0.0,0.0,0.0,0.0,0.0,0.0,0.0,0.0,0.0,0.0,0.0
EU27+UK,Activity,Re-processing of secondary other non-ferrous metals into new other non-ferrous metals,0.0,0.0,0.0,0.0,0.0,0.0,0.0,0.0,0.0,0.0,0.0,0.0,0.0,0.0,0.0
EU27+UK,Activity,Re-processing of secondary paper into new pulp,6.7796345591384055e-09,1.2111094208367965e-08,1.1078847509756459e-08,1.2131985087484742e-08,7.136885324941131e-09,7.329136301354661e-09,9.679323437649196e-09,5.3341747991930145e-09,3.6141119429327465e-09,6.490494048602542e-09,4.0123286378108025e-09,3.74385633056101e-09,2.80894325508117e-09,5.584858121081416e-09,7.598735539303153e-09
EU27+UK,Activity,Re-processing of secondary plastic into new plastic,0.0,0.0,0.0,0.0,0.0,0.0,0.0,0.0,0.0,0.0,0.0,0.0,0.0,0.0,0.0
EU27+UK,Activity,Re-processing of secondary preciuos metals into new preciuos metals,0.0,0.0,0.0,0.0,0.0,0.0,0.0,0.0,0.0,0.0,0.0,0.0,0.0,0.0,0.0
EU27+UK,Activity,Re-processing of secondary steel into new steel,0.0,0.0,0.0,0.0,0.0,0.0,0.0,0.0,0.0,0.0,0.0,0.0,0.0,0.0,0.0
EU27+UK,Activity,Re-processing of secondary wood material into new wood material,1.5694360278637967e-08,1.2967618218366447e-08,1.660917317528737e-08,5.619050142878919e-09,1.953499179700868e-08,9.22296206931818e-09,7.587962801013552e-09,1.1030382032814828e-08,6.330117034112315e-09,4.318108917913624e-09,7.359228775911929e-09,3.2625847824770952e-09,2.022559181820581e-09,6.0889604477567165e-09,6.979720463575571e-09
EU27+UK,Activity,Real estate activities (70),0.0,0.0,0.0,0.0,0.0,0.0,0.0,0.0,0.0,0.0,0.0,0.0,0.0,0.0,0.0
EU27+UK,Activity,"Recreational, cultural and sporting activities (92)",0.0,0.0,0.0,0.0,0.0,0.0,0.0,0.0,0.0,0.0,0.0,0.0,0.0,0.0,0.0
EU27+UK,Activity,Recycling of bottles by direct reuse,0.0,0.0,0.0,0.0,0.0,0.0,0.0,0.0,0.0,0.0,0.0,0.0,0.0,0.0,0.0
EU27+UK,Activity,Recycling of waste and scrap,0.0,0.0,0.0,0.0,0.0,0.0,0.0,0.0,0.0,0.0,0.0,0.0,0.0,0.0,0.0
EU27+UK,Activity,Renting of machinery and equipment without operator and of personal and household goods (71),0.0,0.0,0.0,0.0,0.0,0.0,0.0,0.0,0.0,0.0,0.0,0.0,0.0,0.0,0.0
EU27+UK,Activity,Research and development (73),0.0,0.0,0.0,0.0,0.0,0.0,0.0,0.0,0.0,0.0,0.0,0.0,0.0,0.0,0.0
EU27+UK,Activity,Retail sale of automotive fuel,0.0,0.0,0.0,0.0,0.0,0.0,0.0,0.0,0.0,0.0,0.0,0.0,0.0,0.0,0.0
EU27+UK,Activity,"Retail trade, except of motor vehicles and motorcycles; repair of personal and household goods (52)",0.0,0.0,0.0,0.0,0.0,0.0,0.0,0.0,0.0,0.0,0.0,0.0,0.0,0.0,0.0
EU27+UK,Activity,"Sale, maintenance, repair of motor vehicles, motor vehicles parts, motorcycles, motor cycles parts and accessoiries",0.0,0.0,0.0,0.0,0.0,0.0,0.0,0.0,0.0,0.0,0.0,0.0,0.0,0.0,0.0
EU27+UK,Activity,Sea and coastal water transport,0.0,0.0,0.0,0.0,0.0,0.0,0.0,0.0,0.0,0.0,0.0,0.0,0.0,0.0,0.0
EU27+UK,Activity,Steam and hot water supply,1.7375743763269116e-07,1.9223743481960802e-07,1.8771802323441236e-07,1.752415574442854e-07,2.4633289049733906e-07,2.1753070590548964e-07,2.072045383171546e-07,1.2929974324235063e-07,1.518135059712112e-07,2.469824586267174e-07,1.2369375096395866e-07,1.233459496422593e-07,1.7886639241460344e-07,1.5497329839401814e-07,1.8349781479634026e-07
EU27+UK,Activity,Sugar refining,2.7612828975919655e-10,5.48143107256828e-10,5.617085368299678e-10,3.539276869700947e-10,4.140325285596208e-10,2.9442137951841586e-10,3.958911885605981e-10,1.8473017709959785e-10,1.7948588458643845e-10,2.739896667148695e-10,2.080033671640342e-10,2.9863721716095705e-10,2.3208338967668306e-10,2.5380156976090345e-10,3.3739819523283285e-10
EU27+UK,Activity,Supporting and auxiliary transport activities; activities of travel agencies (63),0.0,0.0,0.0,0.0,0.0,0.0,0.0,0.0,0.0,0.0,0.0,0.0,0.0,0.0,0.0
EU27+UK,Activity,"Tanning and dressing of leather; manufacture of luggage, handbags, saddlery, harness and footwear (19)",0.0,0.0,0.0,0.0,0.0,0.0,0.0,0.0,0.0,0.0,0.0,0.0,0.0,0.0,0.0
EU27+UK,Activity,Transmission of electricity,0.0,0.0,0.0,0.0,0.0,0.0,0.0,0.0,0.0,0.0,0.0,0.0,0.0,0.0,0.0
EU27+UK,Activity,Transport via pipelines,0.0,0.0,0.0,0.0,0.0,0.0,0.0,0.0,0.0,0.0,0.0,0.0,0.0,0.0,0.0
EU27+UK,Activity,Transport via railways,0.0,0.0,0.0,0.0,0.0,0.0,0.0,0.0,0.0,0.0,0.0,0.0,0.0,0.0,0.0
EU27+UK,Activity,"Waste water treatment, food",0.0,0.0,0.0,0.0,0.0,0.0,0.0,0.0,0.0,0.0,0.0,0.0,0.0,0.0,0.0
EU27+UK,Activity,"Waste water treatment, other",0.0,0.0,0.0,0.0,0.0,0.0,0.0,0.0,0.0,0.0,0.0,0.0,0.0,0.0,0.0
EU27+UK,Activity,"Wholesale trade and commission trade, except of motor vehicles and motorcycles (51)",0.0,0.0,0.0,0.0,0.0,0.0,0.0,0.0,0.0,0.0,0.0,0.0,0.0,0.0,0.0
EU27+UK,Activity,"Wool, silk-worm cocoons",0.0,0.0,0.0,0.0,0.0,0.0,0.0,0.0,0.0,0.0,0.0,0.0,0.0,0.0,0.0
RoW,Activity,Activities auxiliary to financial intermediation (67),0.0,0.0,0.0,0.0,0.0,0.0,0.0,0.0,0.0,0.0,0.0,0.0,0.0,0.0,0.0
RoW,Activity,Activities of membership organisation n.e.c. (91),0.0,0.0,0.0,0.0,0.0,0.0,0.0,0.0,0.0,0.0,0.0,0.0,0.0,0.0,0.0
RoW,Activity,Air transport (62),0.0,0.0,0.0,0.0,0.0,0.0,0.0,0.0,0.0,0.0,0.0,0.0,0.0,0.0,0.0
RoW,Activity,Aluminium production,0.0,0.0,0.0,0.0,0.0,0.0,0.0,0.0,0.0,0.0,0.0,0.0,0.0,0.0,0.0
RoW,Activity,Animal products nec,0.0,0.0,0.0,0.0,0.0,0.0,0.0,0.0,0.0,0.0,0.0,0.0,0.0,0.0,0.0
RoW,Activity,"Biogasification of food waste, incl. land application",0.0,0.0,0.0,0.0,0.0,0.0,0.0,0.0,0.0,0.0,0.0,0.0,0.0,0.0,0.0
RoW,Activity,"Biogasification of paper, incl. land application",0.0,0.0,0.0,0.0,0.0,0.0,0.0,0.0,0.0,0.0,0.0,0.0,0.0,0.0,0.0
RoW,Activity,"Biogasification of sewage slugde, incl. land application",0.0,0.0,0.0,0.0,0.0,0.0,0.0,0.0,0.0,0.0,0.0,0.0,0.0,0.0,0.0
RoW,Activity,Casting of metals,0.0,0.0,0.0,0.0,0.0,0.0,0.0,0.0,0.0,0.0,0.0,0.0,0.0,0.0,0.0
RoW,Activity,Cattle farming,0.0,0.0,0.0,0.0,0.0,0.0,0.0,0.0,0.0,0.0,0.0,0.0,0.0,0.0,0.0
RoW,Activity,Chemicals nec,3.758324729062872e-08,3.907564520824381e-08,3.582560719192979e-08,5.666045218520087e-08,2.8173443652605745e-08,2.2079273231983302e-08,3.070132620689285e-08,1.8842340824841386e-08,1.1230245092199719e-08,3.6307829893159164e-08,1.643050343172366e-08,7.74957287460131e-09,1.099958410582797e-08,1.5484435192854438e-08,1.939374549299079e-08
RoW,Activity,"Collection, purification and distribution of water (41)",0.0,0.0,0.0,0.0,0.0,0.0,0.0,0.0,0.0,0.0,0.0,0.0,0.0,0.0,0.0
RoW,Activity,"Composting of food waste, incl. land application",0.0,0.0,0.0,0.0,0.0,0.0,0.0,0.0,0.0,0.0,0.0,0.0,0.0,0.0,0.0
RoW,Activity,"Composting of paper and wood, incl. land application",0.0,0.0,0.0,0.0,0.0,0.0,0.0,0.0,0.0,0.0,0.0,0.0,0.0,0.0,0.0
RoW,Activity,Computer and related activities (72),0.0,0.0,0.0,0.0,0.0,0.0,0.0,0.0,0.0,0.0,0.0,0.0,0.0,0.0,0.0
RoW,Activity,Construction (45),0.0,0.0,0.0,0.0,0.0,0.0,0.0,0.0,0.0,0.0,0.0,0.0,0.0,0.0,0.0
RoW,Activity,Copper production,0.0,0.0,0.0,0.0,0.0,0.0,0.0,0.0,0.0,0.0,0.0,0.0,0.0,0.0,0.0
RoW,Activity,Cultivation of cereal grains nec,0.0,0.0,0.0,0.0,0.0,0.0,0.0,0.0,0.0,0.0,0.0,0.0,0.0,0.0,0.0
RoW,Activity,Cultivation of crops nec,3.445474917179746e-08,3.091621442158399e-08,2.7868431003057296e-08,1.8396783773316956e-08,1.8630907078111247e-07,2.0915943861016054e-08,2.029889124528703e-08,9.770399658218473e-09,7.772716730641405e-09,2.854462969241945e-08,1.5329904462542625e-08,9.490833922866975e-09,8.362827991004371e-09,1.2050214700867702e-08,1.3618416008915065e-08
RoW,Activity,Cultivation of oil seeds,0.0,0.0,0.0,0.0,0.0,0.0,0.0,0.0,0.0,0.0,0.0,0.0,0.0,0.0,0.0
RoW,Activity,Cultivation of paddy rice,0.0,0.0,0.0,0.0,0.0,0.0,0.0,0.0,0.0,0.0,0.0,0.0,0.0,0.0,0.0
RoW,Activity,Cultivation of plant-based fibers,0.0,0.0,0.0,0.0,0.0,0.0,0.0,0.0,0.0,0.0,0.0,0.0,0.0,0.0,0.0
RoW,Activity,"Cultivation of sugar cane, sugar beet",0.0,0.0,0.0,0.0,0.0,0.0,0.0,0.0,0.0,0.0,0.0,0.0,0.0,0.0,0.0
RoW,Activity,"Cultivation of vegetables, fruit, nuts",0.0,0.0,0.0,0.0,0.0,0.0,0.0,0.0,0.0,0.0,0.0,0.0,0.0,0.0,0.0
RoW,Activity,Cultivation of wheat,0.0,0.0,0.0,0.0,0.0,0.0,0.0,0.0,0.0,0.0,0.0,0.0,0.0,0.0,0.0
RoW,Activity,Distribution and trade of electricity,0.0,0.0,0.0,0.0,0.0,0.0,0.0,0.0,0.0,0.0,0.0,0.0,0.0,0.0,0.0
RoW,Activity,Education (80),0.0,0.0,0.0,0.0,0.0,0.0,0.0,0.0,0.0,0.0,0.0,0.0,0.0,0.0,0.0
RoW,Activity,Extra-territorial organizations and bodies,0.0,0.0,0.0,0.0,0.0,0.0,0.0,0.0,0.0,0.0,0.0,0.0,0.0,0.0,0.0
RoW,Activity,"Extraction of crude petroleum and services related to crude oil extraction, excluding surveying",1.9836422369637505e-06,1.5355760280249661e-06,1.4681608102897578e-06,1.5686551405514765e-06,2.3991894880709625e-06,2.740514830234757e-06,3.090516266125884e-06,1.2177999904356781e-06,1.0477404270716392e-06,2.3108262969966975e-05,1.1010195566177559e-06,1.4134999584425937e-06,1.4676660338769746e-06,1.3859858530718373e-06,1.7940994659492956e-06
RoW,Activity,"Extraction of natural gas and services related to natural gas extraction, excluding surveying",2.7070233895317827e-06,2.044076058141959e-06,1.7940444550369676e-06,4.714022535138065e-06,7.096360615062158e-06,6.4391898187617344e-06,4.05043847059796e-05,3.135637035767426e-06,4.228546855994636e-06,2.316616557123618e-05,2.2578237040450078e-06,3.026992741027799e-06,1.0625230624011564e-05,3.07622929134277e-06,1.2706537026333923e-05
RoW,Activity,"Extraction, liquefaction, and regasification of other petroleum and gaseous materials",2.068892780894035e-08,1.7152922089785476e-08,1.6073709623411702e-08,1.236301137060629e-08,1.6385533983348774e-08,2.442335805456203e-08,1.7831071468527112e-08,8.29538456953378e-09,5.7776077651736005e-09,1.4147749639460958e-07,9.693888598181045e-09,9.727439177164734e-09,6.951385261412722e-09,9.59345654766965e-09,1.0199047692695005e-08
RoW,Activity,"Financial intermediation, except insurance and pension funding (65)",0.0,0.0,0.0,0.0,0.0,0.0,0.0,0.0,0.0,0.0,0.0,0.0,0.0,0.0,0.0
RoW,Activity,"Fishing, operating of fish hatcheries and fish farms; service activities incidental to fishing (05)",0.0,0.0,0.0,0.0,0.0,0.0,0.0,0.0,0.0,0.0,0.0,0.0,0.0,0.0,0.0
RoW,Activity,"Forestry, logging and related service activities (02)",1.5411458297516394e-08,1.1021646409068948e-08,9.571544760307345e-09,6.155735264477674e-09,2.551811000975267e-08,8.63152544030732e-09,6.667234134800643e-09,4.224233834040829e-09,2.9211088009712144e-09,6.800140539227554e-09,6.304992601848015e-09,2.3884677969588997e-09,2.1724429067110425e-09,4.038692725408006e-09,4.495919761623797e-09
RoW,Activity,Health and social work (85),0.0,0.0,0.0,0.0,0.0,0.0,0.0,0.0,0.0,0.0,0.0,0.0,0.0,0.0,0.0
RoW,Activity,Hotels and restaurants (55),0.0,0.0,0.0,0.0,0.0,0.0,0.0,0.0,0.0,0.0,0.0,0.0,0.0,0.0,0.0
RoW,Activity,Incineration of waste: Food,1.6807509646122636e-10,1.7221361078597626e-10,1.616438002308979e-10,1.0976670482955702e-10,9.973863411329986e-11,5.651478928874685e-10,1.56419258746161e-10,5.868744491267305e-11,5.1704522797553704e-11,1.663263346654983e-10,7.841907898706598e-11,5.077378782967955e-11,5.07269179531389e-11,7.135257106419e-11,8.492035933259686e-11
RoW,Activity,Incineration of waste: Metals and Inert materials,6.017845073040955e-10,7.111089912521169e-10,7.408200676446179e-10,4.635595757288545e-10,4.992887429947168e-10,6.48222606575235e-10,1.1511188410728653e-09,2.915855987204527e-10,2.7712390867220355e-10,8.05640812912892e-10,3.256019722903244e-10,3.554448607140148e-10,2.9016741881520514e-10,3.483489567975856e-10,4.4411623944775314e-10
RoW,Activity,Incineration of waste: Oil/Hazardous waste,4.46939620862173e-10,4.132521306333468e-10,3.815911556414575e-10,2.696714940094692e-10,2.784517649727218e-10,1.7742983970257884e-09,4.119323446719566e-10,1.5804192581198582e-10,1.6397977331007685e-10,4.752909282337922e-10,2.1163361156151982e-10,1.247853398232028e-10,1.3797743435246288e-10,1.860097536741043e-10,2.4083263930672577e-10
RoW,Activity,Incineration of waste: Paper,1.7152355941591382e-10,1.427197326295445e-10,1.3312884271574302e-10,1.1300215817174696e-10,1.0323847108382493e-10,6.276867608029803e-10,1.5830753148808872e-10,6.017024319746677e-11,5.332920508532677e-11,1.7615855971489327e-10,8.013848993712794e-11,5.243440728621403e-11,5.29760722868547e-11,6.663088320764341e-11,8.79666931366081e-11
RoW,Activity,Incineration of waste: Plastic,6.761033492629759e-10,5.440743040965381e-10,5.081619234969927e-10,4.318480573426737e-10,3.599443339667311e-10,1.9936348905233095e-09,9.732959969130446e-10,2.2480118952498204e-10,1.8912960794857837e-10,5.40603766274328e-10,3.0060476720849505e-10,1.6292247616392354e-10,1.67650835764708e-10,2.3825409318577916e-10,3.106337031799651e-10
RoW,Activity,Incineration of waste: Textiles,6.641509009997215e-10,7.218210699335279e-10,7.24901010536962e-10,5.375990408720379e-10,4.2309482171633365e-10,1.922528852922626e-09,5.738480394488209e-10,2.562600985700516e-10,2.0581796192765186e-10,6.53812544258963e-10,3.136168432274337e-10,1.8277541820650165e-10,1.9330048395220627e-10,3.014499093857053e-10,3.5028231875934396e-10
RoW,Activity,Incineration of waste: Wood,6.786475664887937e-11,6.958128788436846e-11,6.356765068822433e-11,4.722272120632301e-11,4.460678262009588e-11,6.81991244121875e-11,6.100776668835843e-11,2.579051089537616e-11,2.310480136048791e-11,7.132993334880546e-11,3.266759187402855e-11,2.1145924505567584e-11,2.1660433444128746e-11,3.027720897992809e-11,3.8201691039123305e-11
RoW,Activity,Inland water transport,0.0,0.0,0.0,0.0,0.0,0.0,0.0,0.0,0.0,0.0,0.0,0.0,0.0,0.0,0.0
RoW,Activity,"Insurance and pension funding, except compulsory social security (66)",0.0,0.0,0.0,0.0,0.0,0.0,0.0,0.0,0.0,0.0,0.0,0.0,0.0,0.0,0.0
RoW,Activity,Landfill of waste: Food,0.0,0.0,0.0,0.0,0.0,0.0,0.0,0.0,0.0,0.0,0.0,0.0,0.0,0.0,0.0
RoW,Activity,Landfill of waste: Inert/metal/hazardous,0.0,0.0,0.0,0.0,0.0,0.0,0.0,0.0,0.0,0.0,0.0,0.0,0.0,0.0,0.0
RoW,Activity,Landfill of waste: Paper,0.0,0.0,0.0,0.0,0.0,0.0,0.0,0.0,0.0,0.0,0.0,0.0,0.0,0.0,0.0
RoW,Activity,Landfill of waste: Plastic,0.0,0.0,0.0,0.0,0.0,0.0,0.0,0.0,0.0,0.0,0.0,0.0,0.0,0.0,0.0
RoW,Activity,Landfill of waste: Textiles,0.0,0.0,0.0,0.0,0.0,0.0,0.0,0.0,0.0,0.0,0.0,0.0,0.0,0.0,0.0
RoW,Activity,Landfill of waste: Wood,0.0,0.0,0.0,0.0,0.0,0.0,0.0,0.0,0.0,0.0,0.0,0.0,0.0,0.0,0.0
RoW,Activity,"Lead, zinc and tin production",0.0,0.0,0.0,0.0,0.0,0.0,0.0,0.0,0.0,0.0,0.0,0.0,0.0,0.0,0.0
RoW,Activity,Manufacture of basic iron and steel and of ferro-alloys and first products thereof,1.284755586300014e-08,2.5793266854350554e-08,2.246928677445204e-08,5.6359794415345435e-09,6.771476450535628e-09,1.2860379621626458e-08,1.0343777646658922e-08,3.976482823720205e-09,3.76299297982132e-09,1.3420421082189225e-08,6.133707413004675e-09,3.097265127222148e-09,3.186381950529392e-09,7.7587609476495e-09,6.314277921421261e-09
RoW,Activity,Manufacture of beverages,0.0,0.0,0.0,0.0,0.0,0.0,0.0,0.0,0.0,0.0,0.0,0.0,0.0,0.0,0.0
RoW,Activity,"Manufacture of bricks, tiles and construction products, in baked clay",0.0,0.0,0.0,0.0,0.0,0.0,0.0,0.0,0.0,0.0,0.0,0.0,0.0,0.0,0.0
RoW,Activity,"Manufacture of cement, lime and plaster",0.0,0.0,0.0,0.0,0.0,0.0,0.0,0.0,0.0,0.0,0.0,0.0,0.0,0.0,0.0
RoW,Activity,Manufacture of ceramic goods,0.0,0.0,0.0,0.0,0.0,0.0,0.0,0.0,0.0,0.0,0.0,0.0,0.0,0.0,0.0
RoW,Activity,Manufacture of coke oven products,5.582225256920678e-08,6.280406226990714e-08,5.548936385449072e-08,3.0159203658255694e-08,3.328405867935799e-08,1.2101950716262434e-07,4.440067980434661e-08,1.74243641862966e-08,1.6222522635145084e-08,1.225254697732557e-07,2.5279743179429454e-08,1.4551974922691054e-08,1.701554658195253e-08,2.4119265832413186e-08,3.73053709384161e-08
RoW,Activity,Manufacture of electrical machinery and apparatus n.e.c. (31),0.0,0.0,0.0,0.0,0.0,0.0,0.0,0.0,0.0,0.0,0.0,0.0,0.0,0.0,0.0
RoW,Activity,"Manufacture of fabricated metal products, except machinery and equipment (28)",0.0,0.0,0.0,0.0,0.0,0.0,0.0,0.0,0.0,0.0,0.0,0.0,0.0,0.0,0.0
RoW,Activity,Manufacture of fish products,0.0,0.0,0.0,0.0,0.0,0.0,0.0,0.0,0.0,0.0,0.0,0.0,0.0,0.0,0.0
RoW,Activity,Manufacture of furniture; manufacturing n.e.c. (36),0.0,0.0,0.0,0.0,0.0,0.0,0.0,0.0,0.0,0.0,0.0,0.0,0.0,0.0,0.0
RoW,Activity,Manufacture of gas; distribution of gaseous fuels through mains,3.1303385439619564e-09,1.7628771472111568e-09,1.552885815665937e-09,1.1928010111104749e-09,1.1814919184075209e-09,2.9033426299585934e-09,2.0841078417218514e-09,6.512668374883483e-10,5.588295371258572e-10,3.8184541715690635e-09,1.2823043467604532e-09,5.652445250736741e-10,6.91891945717907e-10,7.834726982562446e-10,1.0424849955493928e-09
RoW,Activity,Manufacture of glass and glass products,0.0,0.0,0.0,0.0,0.0,0.0,0.0,0.0,0.0,0.0,0.0,0.0,0.0,0.0,0.0
RoW,Activity,Manufacture of machinery and equipment n.e.c. (29),0.0,0.0,0.0,0.0,0.0,0.0,0.0,0.0,0.0,0.0,0.0,0.0,0.0,0.0,0.0
RoW,Activity,"Manufacture of medical, precision and optical instruments, watches and clocks (33)",0.0,0.0,0.0,0.0,0.0,0.0,0.0,0.0,0.0,0.0,0.0,0.0,0.0,0.0,0.0
RoW,Activity,"Manufacture of motor vehicles, trailers and semi-trailers (34)",0.0,0.0,0.0,0.0,0.0,0.0,0.0,0.0,0.0,0.0,0.0,0.0,0.0,0.0,0.0
RoW,Activity,Manufacture of office machinery and computers (30),0.0,0.0,0.0,0.0,0.0,0.0,0.0,0.0,0.0,0.0,0.0,0.0,0.0,0.0,0.0
RoW,Activity,Manufacture of other non-metallic mineral products n.e.c.,0.0,0.0,0.0,0.0,0.0,0.0,0.0,0.0,0.0,0.0,0.0,0.0,0.0,0.0,0.0
RoW,Activity,Manufacture of other transport equipment (35),0.0,0.0,0.0,0.0,0.0,0.0,0.0,0.0,0.0,0.0,0.0,0.0,0.0,0.0,0.0
RoW,Activity,"Manufacture of radio, television and communication equipment and apparatus (32)",0.0,0.0,0.0,0.0,0.0,0.0,0.0,0.0,0.0,0.0,0.0,0.0,0.0,0.0,0.0
RoW,Activity,Manufacture of rubber and plastic products (25),0.0,0.0,0.0,0.0,0.0,0.0,0.0,0.0,0.0,0.0,0.0,0.0,0.0,0.0,0.0
RoW,Activity,Manufacture of textiles (17),0.0,0.0,0.0,0.0,0.0,0.0,0.0,0.0,0.0,0.0,0.0,0.0,0.0,0.0,0.0
RoW,Activity,Manufacture of tobacco products (16),0.0,0.0,0.0,0.0,0.0,0.0,0.0,0.0,0.0,0.0,0.0,0.0,0.0,0.0,0.0
RoW,Activity,Manufacture of wearing apparel; dressing and dyeing of fur (18),0.0,0.0,0.0,0.0,0.0,0.0,0.0,0.0,0.0,0.0,0.0,0.0,0.0,0.0,0.0
RoW,Activity,"Manufacture of wood and of products of wood and cork, except furniture; manufacture of articles of straw and plaiting materials (20)",7.031558897405726e-12,5.410339742065927e-12,5.716684172535035e-12,2.64160105666052e-12,4.7118650474450796e-12,5.138780601438905e-12,3.667594339080818e-12,3.084870114447143e-12,1.988647358283318e-12,3.641305772588275e-12,3.128039978408116e-12,1.377553900885769e-12,1.093225239054552e-12,2.3070774550302283e-12,2.6143704704844596e-12
RoW,Activity,"Manure treatment (biogas), storage and land application",0.0,0.0,0.0,0.0,0.0,0.0,0.0,0.0,0.0,0.0,0.0,0.0,0.0,0.0,0.0
RoW,Activity,"Manure treatment (conventional), storage and land application",0.0,0.0,0.0,0.0,0.0,0.0,0.0,0.0,0.0,0.0,0.0,0.0,0.0,0.0,0.0
RoW,Activity,Meat animals nec,0.0,0.0,0.0,0.0,0.0,0.0,0.0,0.0,0.0,0.0,0.0,0.0,0.0,0.0,0.0
RoW,Activity,Mining of aluminium ores and concentrates,0.0,0.0,0.0,0.0,0.0,0.0,0.0,0.0,0.0,0.0,0.0,0.0,0.0,0.0,0.0
RoW,Activity,"Mining of chemical and fertilizer minerals, production of salt, other mining and quarrying n.e.c.",0.0,0.0,0.0,0.0,0.0,0.0,0.0,0.0,0.0,0.0,0.0,0.0,0.0,0.0,0.0
RoW,Activity,Mining of coal and lignite; extraction of peat (10),2.6039600594630556e-06,8.655059736782536e-07,7.653664667644266e-07,4.2480149568666824e-07,9.364097686956762e-07,3.843645819758785e-05,6.342576759244925e-07,2.7421498501352277e-07,3.0834727314140224e-07,7.47571505405342e-07,9.60953903584555e-07,2.317907190642427e-07,4.643043526753323e-07,5.209918202543688e-07,4.988765204091633e-07
RoW,Activity,Mining of copper ores and concentrates,0.0,0.0,0.0,0.0,0.0,0.0,0.0,0.0,0.0,0.0,0.0,0.0,0.0,0.0,0.0
RoW,Activity,Mining of iron ores,0.0,0.0,0.0,0.0,0.0,0.0,0.0,0.0,0.0,0.0,0.0,0.0,0.0,0.0,0.0
RoW,Activity,"Mining of lead, zinc and tin ores and concentrates",0.0,0.0,0.0,0.0,0.0,0.0,0.0,0.0,0.0,0.0,0.0,0.0,0.0,0.0,0.0
RoW,Activity,Mining of nickel ores and concentrates,0.0,0.0,0.0,0.0,0.0,0.0,0.0,0.0,0.0,0.0,0.0,0.0,0.0,0.0,0.0
RoW,Activity,Mining of other non-ferrous metal ores and concentrates,0.0,0.0,0.0,0.0,0.0,0.0,0.0,0.0,0.0,0.0,0.0,0.0,0.0,0.0,0.0
RoW,Activity,Mining of precious metal ores and concentrates,0.0,0.0,0.0,0.0,0.0,0.0,0.0,0.0,0.0,0.0,0.0,0.0,0.0,0.0,0.0
RoW,Activity,Mining of uranium and thorium ores (12),1.2889232360686194e-07,1.3380641348452925e-07,1.201886757715789e-07,1.5285632268172526e-07,9.000303155507911e-08,1.1014388988227655e-07,1.1514847334528033e-07,5.705401347134718e-08,4.111623638709039e-08,1.4853670839560282e-07,5.791390966887586e-08,2.9383653359388055e-08,3.9330436095250253e-08,5.4093487389073626e-08,6.82393922805367e-08
RoW,Activity,N-fertiliser,0.0,0.0,0.0,0.0,0.0,0.0,0.0,0.0,0.0,0.0,0.0,0.0,0.0,0.0,0.0
RoW,Activity,Other business activities (74),0.0,0.0,0.0,0.0,0.0,0.0,0.0,0.0,0.0,0.0,0.0,0.0,0.0,0.0,0.0
RoW,Activity,Other land transport,0.0,0.0,0.0,0.0,0.0,0.0,0.0,0.0,0.0,0.0,0.0,0.0,0.0,0.0,0.0
RoW,Activity,Other non-ferrous metal production,0.0,0.0,0.0,0.0,0.0,0.0,0.0,0.0,0.0,0.0,0.0,0.0,0.0,0.0,0.0
RoW,Activity,Other service activities (93),0.0,0.0,0.0,0.0,0.0,0.0,0.0,0.0,0.0,0.0,0.0,0.0,0.0,0.0,0.0
RoW,Activity,P- and other fertiliser,0.0,0.0,0.0,0.0,0.0,0.0,0.0,0.0,0.0,0.0,0.0,0.0,0.0,0.0,0.0
RoW,Activity,Paper,0.0,0.0,0.0,0.0,0.0,0.0,0.0,0.0,0.0,0.0,0.0,0.0,0.0,0.0,0.0
RoW,Activity,Petroleum Refinery,7.157657413804344e-07,5.949609707087708e-07,5.795977737913314e-07,5.347834230185685e-07,7.883347178288983e-07,1.1110417245417318e-06,7.684239312013625e-07,3.87652507050311e-07,2.5665082801790993e-07,7.732681308565987e-06,3.688075561242545e-07,4.912505453895984e-07,3.1879802195761923e-07,4.2057383790769587e-07,4.3767620320855966e-07
RoW,Activity,Pigs farming,0.0,0.0,0.0,0.0,0.0,0.0,0.0,0.0,0.0,0.0,0.0,0.0,0.0,0.0,0.0
RoW,Activity,"Plastics, basic",7.69305387652921e-09,8.822388185084136e-09,6.587025286312449e-09,3.7099249119048473e-09,3.2007619526392337e-09,2.0523826434698132e-08,4.275993654374287e-09,1.8598692612864906e-09,1.5533287957444162e-09,5.9276022480725815e-09,3.2522377295940338e-09,1.4915923431220651e-09,1.6325515737897498e-09,2.6753233769083264e-09,2.6706067282210586e-09
