RoW,Activity,Real estate activities (70),5.577328164972332e-13,5.83044725974565e-13,5.723285165249577e-13,2.411665718292932e-13,1.8677908219825386e-13
RoW,Activity,"Recreational, cultural and sporting activities (92)",1.7313199459461626e-12,1.972449726297569e-12,1.8086280097902502e-12,8.941519663947897e-13,5.435488926434961e-13
RoW,Activity,Recycling of bottles by direct reuse,0.0,0.0,0.0,0.0,0.0
RoW,Activity,Recycling of waste and scrap,6.885142942318726e-13,8.508017084609199e-13,7.069740928152942e-13,1.139439820792264e-13,7.282230063619172e-14
RoW,Activity,Renting of machinery and equipment without operator and of personal and household goods (71),2.0567908550020584e-12,2.04167193178695e-12,1.962694729241389e-12,9.850372440005693e-13,5.890042278104649e-13
RoW,Activity,Research and development (73),1.0019083727665331e-11,1.6410684018083453e-11,1.310625431559535e-11,3.5389713334793325e-12,1.882701539798524e-12
RoW,Activity,Retail sale of automotive fuel,1.6640122515458314e-13,1.5734844002884566e-13,1.4939146451253002e-13,5.5790861722790905e-14,7.937222741256727e-13
RoW,Activity,"Retail trade, except of motor vehicles and motorcycles; repair of personal and household goods (52)",1.527950222847273e-11,1.4125041602420876e-11,1.2703624769518036e-11,4.04298040161204e-12,4.4069340795170605e-12
RoW,Activity,"Sale, maintenance, repair of motor vehicles, motor vehicles parts, motorcycles, motor cycles parts and accessoiries",7.61691152060435e-12,7.230141247830755e-12,6.786674195371634e-12,2.2732669095678963e-12,3.868469130750425e-12
RoW,Activity,Sea and coastal water transport,1.2138520813576272e-11,4.626647915210384e-12,9.763192949664701e-12,8.891269426567413e-13,8.782991419985711e-13
RoW,Activity,Steam and hot water supply,1.7839890026854284e-13,1.7099264067396928e-13,1.5273131595824627e-13,4.977681593565881e-14,2.9816581491197454e-14
RoW,Activity,Sugar refining,6.222590074004887e-14,5.436470557673326e-14,4.810963640078694e-14,1.2363426442735947e-14,8.626726495557731e-15
RoW,Activity,Supporting and auxiliary transport activities; activities of travel agencies (63),4.98768913388471e-12,4.97264572040656e-12,6.1308513326543015e-12,1.419606736690005e-12,1.0879570067082633e-12
RoW,Activity,"Tanning and dressing of leather; manufacture of luggage, handbags, saddlery, harness and footwear (19)",3.902029591893366e-13,4.1017126364442556e-13,3.5080950644116734e-13,7.880919781577923e-14,5.035517103746637e-14
RoW,Activity,Transmission of electricity,1.7943449172850401e-13,1.7281359066792782e-13,1.5070883713559726e-13,5.152907911875449e-14,2.983134757718739e-14
RoW,Activity,Transport via pipelines,3.161844386841897e-13,2.829117304230423e-13,2.8042221448765437e-13,1.5891523750513378e-13,1.4228665128322105e-13
RoW,Activity,Transport via railways,6.926563404750521e-13,7.146289658817234e-13,7.048594793756432e-13,2.2557040217311812e-13,1.93245804318713e-13
RoW,Activity,"Waste water treatment, food",5.686419026679191e-14,6.10315758312841e-14,5.4237357451634746e-14,1.479803026977908e-14,9.48627846265042e-15
RoW,Activity,"Waste water treatment, other",9.409976022675059e-14,8.716003178035226e-14,7.79073799838721e-14,2.11641248185205e-14,1.3529109381636495e-14
RoW,Activity,"Wholesale trade and commission trade, except of motor vehicles and motorcycles (51)",1.7995165097798226e-11,1.773116128828517e-11,1.556576386141992e-11,4.838973129408554e-12,6.243621395003195e-12
RoW,Activity,"Wool, silk-worm cocoons",2.443991281027605e-14,2.4654912247908943e-14,2.201972478238508e-14,8.753320155250093e-15,6.135039861809407e-15
USA,Activity,Activities auxiliary to financial intermediation (67),8.652972823191905e-13,4.1608316907284206e-13,3.3625863206409293e-13,1.1267119836278417e-13,6.754199171764896e-14
USA,Activity,Activities of membership organisation n.e.c. (91),2.855883023461387e-13,1.3110360604800554e-13,1.1699672693055373e-13,4.488431318122035e-14,2.803359118527951e-14
USA,Activity,Air transport (62),6.49081933089114e-14,5.876277500001321e-14,4.66481841335391e-14,1.5219528053708068e-14,9.780552557746976e-15
USA,Activity,Aluminium production,1.58938573570528e-13,5.4124814419724336e-14,3.7188681650267966e-14,3.9080041965619e-15,2.5378441939912925e-15
USA,Activity,Animal products nec,1.7315903123554286e-15,1.6618609459716585e-15,1.505415389990816e-15,3.643022944274309e-16,2.2854545321387595e-16
USA,Activity,"Biogasification of food waste, incl. land application",0.0,0.0,0.0,0.0,0.0
USA,Activity,"Biogasification of paper, incl. land application",0.0,0.0,0.0,0.0,0.0
USA,Activity,"Biogasification of sewage slugde, incl. land application",4.2989882137816326e-14,1.462511798725892e-14,1.272039760746207e-14,2.5761190376162303e-15,1.5756118610122756e-15
USA,Activity,Casting of metals,2.5926996176881422e-14,1.797785221059077e-14,1.5011248815202883e-14,3.4286294392003818e-15,2.204930182324917e-15
USA,Activity,Cattle farming,4.179667583594195e-15,2.284084584681754e-15,2.045976864325836e-15,5.475597215105956e-16,3.2649132782249715e-16
USA,Activity,Chemicals nec,3.658021716798404e-12,1.1973891242797667e-12,1.105366522010365e-12,2.8674553038284563e-13,1.4930731877626966e-13
USA,Activity,"Collection, purification and distribution of water (41)",4.520807611373846e-15,1.2730076571968177e-15,1.1572265805144705e-15,3.10955181138588e-16,1.9200616352451389e-16
USA,Activity,"Composting of food waste, incl. land application",8.868897555966776e-16,5.189015077150093e-16,5.110564364844616e-16,1.2634157924666674e-16,7.227752181149629e-17
USA,Activity,"Composting of paper and wood, incl. land application",8.785101598862857e-15,2.691662941229916e-15,2.5278189776862504e-15,6.505623937797458e-16,4.1293285293961603e-16
USA,Activity,Computer and related activities (72),1.422664226712884e-12,7.743207144618878e-13,6.818853040902911e-13,2.7685708014114094e-13,1.9246583460111458e-13
USA,Activity,Construction (45),1.713098192434124e-13,2.1186211473157013e-14,2.1076794695745714e-14,8.23302577970102e-15,5.851499088354921e-15
USA,Activity,Copper production,4.371996266414777e-14,6.308660711091735e-14,4.14659699609226e-14,4.101577787484261e-15,2.8405261756014e-15
USA,Activity,Cultivation of cereal grains nec,7.14095790520776e-15,3.4469392180937106e-15,2.93665792685038e-15,7.004390139843787e-16,4.3075442525271045e-16
USA,Activity,Cultivation of crops nec,1.5037974653738164e-13,5.794743125773465e-14,5.172551654403631e-14,1.3569648337275616e-14,7.762194298154196e-15
USA,Activity,Cultivation of oil seeds,4.374745852150993e-14,3.4695235697874243e-14,1.9695720884921777e-14,2.1308610827942545e-15,1.3259781626617633e-15
USA,Activity,Cultivation of paddy rice,8.667379622571657e-16,5.5584990084518e-16,5.000292647107603e-16,1.298080048655261e-16,8.762055504724963e-17
USA,Activity,Cultivation of plant-based fibers,2.122212141055664e-14,1.3902704878802662e-14,9.5812387510168e-15,1.4734207390852855e-15,8.863731779880715e-16
USA,Activity,"Cultivation of sugar cane, sugar beet",2.516174506757153e-16,1.5246248540484286e-16,1.3492866642245798e-16,3.463720231115911e-17,2.425639157077455e-17
USA,Activity,"Cultivation of vegetables, fruit, nuts",3.5123523793115645e-14,2.5835358316483075e-14,2.316167051647993e-14,6.043782059222312e-15,3.983939889167833e-15
USA,Activity,Cultivation of wheat,8.748132742382547e-15,7.291755860517415e-15,6.601843995284503e-15,1.7055725690076336e-15,1.138684026174392e-15
USA,Activity,Distribution and trade of electricity,4.17058094415285e-14,9.42316166784564e-15,8.224098865801282e-15,2.3751289826583265e-15,1.5652509765404696e-15
USA,Activity,Education (80),5.369035293238918e-13,1.619815749283911e-13,1.4482398523690275e-13,7.745985549794729e-14,4.564023600721172e-14
USA,Activity,Extra-territorial organizations and bodies,0.0,0.0,0.0,0.0,0.0
USA,Activity,"Extraction of crude petroleum and services related to crude oil extraction, excluding surveying",1.0651083499222188e-14,4.4447655496372075e-15,4.278874959333533e-15,2.305112961741799e-15,9.984901442392972e-16
USA,Activity,"Extraction of natural gas and services related to natural gas extraction, excluding surveying",3.3214205476192672e-15,1.9147845263569566e-15,1.8891854821710654e-15,1.0868025658666773e-15,4.837481755961789e-16
USA,Activity,"Extraction, liquefaction, and regasification of other petroleum and gaseous materials",3.7030774691500126e-17,7.531324849290356e-18,7.054729557430102e-18,3.1218587125523985e-18,1.4941933366409493e-18
USA,Activity,"Financial intermediation, except insurance and pension funding (65)",1.6159978748240898e-12,1.0395046732478903e-12,9.745563177884449e-13,5.251561810375528e-13,3.4036574308373107e-13
USA,Activity,"Fishing, operating of fish hatcheries and fish farms; service activities incidental to fishing (05)",1.9855520894143685e-14,1.8822321784957086e-14,1.7620648595115482e-14,4.345972481839848e-15,2.969024186463578e-15
USA,Activity,"Forestry, logging and related service activities (02)",2.615887997192595e-13,1.0252517705361391e-13,8.740820344036632e-14,1.9471649382908686e-14,1.2338716327126666e-14
USA,Activity,Health and social work (85),3.6699914341812636e-14,9.114249034003206e-15,8.62233175903456e-15,5.848723864155343e-15,2.9884243692777897e-15
USA,Activity,Hotels and restaurants (55),1.4126927903416e-12,1.0174274488744966e-12,9.039848301648808e-13,2.592057294078494e-13,2.2689374543318552e-13
USA,Activity,Incineration of waste: Food,2.803365409837711e-15,1.7292084784376062e-15,1.67556196365796e-15,3.0482709059772977e-16,1.8726401529673913e-16
USA,Activity,Incineration of waste: Metals and Inert materials,4.849312736734465e-15,3.666617818216759e-15,4.567613902424209e-15,1.1921054641645235e-15,8.853434683443226e-16
USA,Activity,Incineration of waste: Oil/Hazardous waste,9.28065992632165e-16,6.510904683757983e-16,6.430698972429399e-16,1.899007106292397e-16,1.2534447930937783e-16
USA,Activity,Incineration of waste: Paper,4.736284654182331e-15,1.6383927658143124e-15,1.5846566986657345e-15,4.4000904210513217e-16,2.7483550134219986e-16
USA,Activity,Incineration of waste: Plastic,1.2142150050386687e-14,4.118369872457859e-15,3.9309920373485115e-15,9.23425472037116e-16,5.764526834735344e-16
USA,Activity,Incineration of waste: Textiles,1.215342567034819e-15,5.106871599986545e-16,5.047415946289928e-16,1.1855802513192477e-16,7.864503236902794e-17
USA,Activity,Incineration of waste: Wood,1.595468079232053e-15,7.150603874441908e-16,6.756754576658697e-16,1.968162326583407e-16,1.2424649291773583e-16
USA,Activity,Inland water transport,2.6573240307575614e-16,1.8890104767298954e-16,1.6033078092714659e-16,3.6076572415590786e-17,2.4846101534709233e-17
USA,Activity,"Insurance and pension funding, except compulsory social security (66)",4.895848169432833e-13,3.1107140120338205e-13,2.7234909568882106e-13,1.4286089338282091e-13,9.349021140383098e-14
USA,Activity,Landfill of waste: Food,7.17947552527299e-15,2.6470935360679523e-15,2.4692836364101176e-15,6.121719860602244e-16,3.7251561598270783e-16
USA,Activity,Landfill of waste: Inert/metal/hazardous,1.2457778575460737e-14,3.825342200891743e-15,3.379289816152884e-15,8.418720424888657e-16,5.213151341598567e-16
USA,Activity,Landfill of waste: Paper,8.926797218216107e-15,3.034284577817471e-15,2.86025242688587e-15,7.198889909021856e-16,4.4216480709576434e-16
USA,Activity,Landfill of waste: Plastic,6.573896908371799e-15,2.0195118952381086e-15,1.8974051367946995e-15,4.663917758448233e-16,2.9718781348709303e-16
USA,Activity,Landfill of waste: Textiles,2.007237857241407e-15,6.5939431734298085e-16,6.242341481989388e-16,1.5545295174142973e-16,9.820250941697096e-17
USA,Activity,Landfill of waste: Wood,2.6131982387190014e-15,8.498473874426789e-16,8.076054618631931e-16,2.0306221514219769e-16,1.277659856515271e-16
USA,Activity,"Lead, zinc and tin production",1.6855748243942132e-15,3.1293797572713802e-15,3.1382369721355207e-15,4.446546619954605e-16,3.23215249068082e-16
USA,Activity,Manufacture of basic iron and steel and of ferro-alloys and first products thereof,7.615565873283383e-14,7.377544037982386e-14,6.257305058333136e-14,9.762922250846276e-15,6.22656966654183e-15
USA,Activity,Manufacture of beverages,5.967105855711636e-15,6.499725188873082e-15,4.7859824856447e-15,1.1066483897116104e-15,6.803078095455467e-16
USA,Activity,"Manufacture of bricks, tiles and construction products, in baked clay",5.3638933613307094e-14,2.970999596387339e-15,2.4205168721194234e-15,3.9797329506844856e-16,2.657435327369294e-16
USA,Activity,"Manufacture of cement, lime and plaster",3.6794022145420546e-14,6.696080574866343e-15,6.2579823222724136e-15,1.676348614932511e-15,1.1297212067243584e-15
USA,Activity,Manufacture of ceramic goods,4.102829973917581e-15,2.05524488457163e-15,2.2883371135819142e-15,7.404878635893587e-16,6.523563779632326e-16
USA,Activity,Manufacture of coke oven products,8.261644213923786e-18,8.324460967752924e-18,7.203357918740497e-18,1.0503826249216965e-18,6.8155937338881515e-19
USA,Activity,Manufacture of electrical machinery and apparatus n.e.c. (31),9.64388973850891e-13,8.348926815821099e-13,5.84523869340771e-13,2.1957583742890882e-13,1.4200378154916896e-13
USA,Activity,"Manufacture of fabricated metal products, except machinery and equipment (28)",3.4170842635876706e-13,2.1470628171657275e-13,1.871327530351191e-13,3.634659055786596e-14,2.2020338349033445e-14
USA,Activity,Manufacture of fish products,2.8392859312639626e-15,3.5097805890423563e-15,3.3057773921220638e-15,9.435296989085183e-16,5.35014946097507e-16
USA,Activity,Manufacture of furniture; manufacturing n.e.c. (36),2.337537541394191e-13,1.0312366351348525e-13,8.911374626531272e-14,2.818911998670828e-14,1.3673322659356466e-14
USA,Activity,Manufacture of gas; distribution of gaseous fuels through mains,1.4571651251357105e-13,9.567060700581464e-15,8.281509944371771e-15,2.2552314571325698e-15,1.3977744289963842e-15
USA,Activity,Manufacture of glass and glass products,4.274565514356092e-12,6.540366277626131e-14,4.9121901997649896e-14,4.26417796463237e-15,3.143361721445785e-15
USA,Activity,Manufacture of machinery and equipment n.e.c. (29),2.6371488488584985e-13,1.946063115702153e-13,1.6692656161902532e-13,3.7748151904166396e-14,2.3483070390776232e-14
USA,Activity,"Manufacture of medical, precision and optical instruments, watches and clocks (33)",9.38376490165558e-14,1.2452890319483706e-13,9.178153373071032e-14,2.3817343516927215e-14,1.5299605262784963e-14
USA,Activity,"Manufacture of motor vehicles, trailers and semi-trailers (34)",1.1836328298637808e-13,6.503154233860066e-14,5.696355832057275e-14,1.225919015540349e-14,1.007027552641001e-14
USA,Activity,Manufacture of office machinery and computers (30),1.0143618257917065e-14,1.1066788812566385e-14,8.524032928109308e-15,2.2052698059227784e-15,1.4890656130617697e-15
USA,Activity,Manufacture of other non-metallic mineral products n.e.c.,3.6367979190970277e-13,1.5628074823411342e-14,1.624758686122861e-14,2.418005062566071e-15,1.6003313176827409e-15
USA,Activity,Manufacture of other transport equipment (35),1.043010478132046e-13,1.059529765184989e-13,9.18019120141234e-14,1.9091114274577776e-14,1.4476932762350047e-14
USA,Activity,"Manufacture of radio, television and communication equipment and apparatus (32)",1.0974137761191607e-13,1.1430038088957977e-13,7.679663205139735e-14,1.9114538653913007e-14,1.1080037363462733e-14
USA,Activity,Manufacture of rubber and plastic products (25),3.0047009379291144e-13,1.3440021846676522e-13,1.1806348342675344e-13,2.6698591804434863e-14,1.7388470944448923e-14
USA,Activity,Manufacture of textiles (17),1.1264189034415362e-13,5.414253489543813e-14,4.7839172850236914e-14,1.14227461561031e-14,6.6474878372488956e-15
USA,Activity,Manufacture of tobacco products (16),1.9749084773613388e-16,9.831524992604177e-17,8.090760271788325e-17,1.5312117447414252e-17,9.917375728971726e-18
USA,Activity,Manufacture of wearing apparel; dressing and dyeing of fur (18),4.954204174072871e-15,3.1509531319853644e-15,2.884892537687479e-15,8.994356422294744e-16,5.947069734520146e-16
USA,Activity,"Manufacture of wood and of products of wood and cork, except furniture; manufacture of articles of straw and plaiting materials (20)",6.724634380291151e-14,2.2874879651236815e-14,2.1182346970518357e-14,4.660905886413253e-15,3.1447041636502405e-15
USA,Activity,"Manure treatment (biogas), storage and land application",0.0,0.0,0.0,0.0,0.0
USA,Activity,"Manure treatment (conventional), storage and land application",0.0,0.0,0.0,0.0,0.0
USA,Activity,Meat animals nec,2.117661404217903e-17,1.4424446916865652e-17,1.3496263873608002e-17,3.4567257656045654e-18,2.1744833050119285e-18
USA,Activity,Mining of aluminium ores and concentrates,1.2647227057569768e-14,4.730819677855047e-16,3.645560654621833e-16,3.8145413828627684e-17,2.5512118654913688e-17
USA,Activity,"Mining of chemical and fertilizer minerals, production of salt, other mining and quarrying n.e.c.",2.7743162018857394e-14,2.056453988665652e-14,1.9093027633232676e-14,3.1433873139780675e-15,1.7309057908481102e-15
USA,Activity,Mining of coal and lignite; extraction of peat (10),1.255427760585054e-12,1.317686141285979e-13,1.316633704069132e-13,5.617359882794915e-14,3.1180965680262415e-14
USA,Activity,Mining of copper ores and concentrates,5.1154184310432865e-14,3.991986771855748e-14,2.7690712028036036e-14,2.867425288309816e-15,1.97339668348318e-15
USA,Activity,Mining of iron ores,6.245910618442903e-14,3.613319334149482e-14,2.6998147820902265e-14,4.286279025064342e-15,2.6233979627925995e-15
USA,Activity,"Mining of lead, zinc and tin ores and concentrates",2.3664780855799947e-15,2.0604441462607733e-15,1.959226951763857e-15,2.0859718063547915e-16,1.4685550899868907e-16
USA,Activity,Mining of nickel ores and concentrates,0.0,0.0,0.0,0.0,0.0
USA,Activity,Mining of other non-ferrous metal ores and concentrates,2.1850388806593125e-15,2.789692017919281e-15,2.481826486770476e-15,5.122383109667727e-16,3.402673684005194e-16
USA,Activity,Mining of precious metal ores and concentrates,6.942466785255561e-13,3.241724724109668e-14,2.6341174667720248e-14,4.120464858699676e-15,2.913665081252269e-15
USA,Activity,Mining of uranium and thorium ores (12),1.7256173143718906e-14,6.861391311969985e-15,5.95137582889237e-15,1.3224622087323157e-15,7.134082048144741e-16
USA,Activity,N-fertiliser,1.906130046011602e-16,6.596729062690968e-17,5.091208848492059e-17,1.3895777788582376e-17,8.764723947652121e-18
USA,Activity,Other business activities (74),9.913834737476484e-12,5.58481784148508e-12,5.005357184369317e-12,2.08176505997038e-12,1.256115968400411e-12
USA,Activity,Other land transport,2.7245313788884745e-13,8.862073198998836e-14,8.384135337478948e-14,2.9838077250007383e-14,2.4883058967635333e-14
USA,Activity,Other non-ferrous metal production,1.434661485842035e-14,2.0992204824266622e-14,1.8505996901963714e-14,3.693508547482778e-15,2.3986357435765607e-15
USA,Activity,Other service activities (93),1.1631844634287378e-13,3.601835136583366e-14,3.175040822353879e-14,1.2250357848897632e-14,7.72350677380174e-15
USA,Activity,P- and other fertiliser,1.7854213179352303e-17,7.47294745985794e-18,6.600227109065961e-18,1.8033135092465397e-18,9.46152586236921e-19
USA,Activity,Paper,1.910088550502781e-13,5.6532921341886275e-14,4.775177780110417e-14,1.2900706389214136e-14,7.6550005147611e-15
USA,Activity,Petroleum Refinery,3.571102477796239e-14,1.7591534636200166e-14,1.763319793475449e-14,1.1721002578924512e-14,4.795417642053486e-15
USA,Activity,Pigs farming,8.065419684705606e-15,4.264010098906198e-15,3.666796506045936e-15,9.30036915290489e-16,6.006484676424912e-16
USA,Activity,"Plastics, basic",7.535351178024697e-14,6.522385278800934e-14,4.9640066700333456e-14,8.962846668831923e-15,5.3626680739153845e-15
USA,Activity,Post and telecommunications (64),2.180661045859771e-13,1.165593316537338e-13,1.0682264375719545e-13,4.735499659783068e-14,2.992931031257487e-14
USA,Activity,Poultry farming,1.0565600738164913e-14,7.516106348344206e-15,6.490737309106757e-15,1.6262449761071492e-15,1.216464134315264e-15
USA,Activity,Precious metals production,4.793563036483715e-13,1.4133834907029747e-14,1.1863489538508405e-14,1.9277742211143423e-15,1.3794855031783932e-15
USA,Activity,Private households with employed persons (95),2.770704982117148e-16,3.5351641950638787e-16,3.6767241271546836e-16,1.9716865736846146e-16,1.7460046385284314e-16
USA,Activity,Processed rice,7.168062734657288e-17,6.667442425372606e-17,6.100027800109785e-17,1.5081107688436484e-17,8.876066673566187e-18
USA,Activity,Processing of Food products nec,4.9579353144932774e-14,2.3450530108678795e-14,2.0556163424643276e-14,5.130955508398019e-15,2.96688704294209e-15
USA,Activity,Processing of dairy products,5.3587526073521025e-15,5.1795029357201126e-15,3.2249028224227436e-15,4.951103480244039e-16,3.0730764081709743e-16
USA,Activity,Processing of meat cattle,5.631532569974778e-16,2.788904413698391e-16,2.5256860181226207e-16,6.519135213051944e-17,4.0167365397685904e-17
USA,Activity,Processing of meat pigs,4.466277399766304e-15,2.3898006207083854e-15,2.058786687972866e-15,5.203157224206602e-16,3.3721607688484903e-16
USA,Activity,Processing of meat poultry,5.00005058650646e-15,3.44539586622527e-15,2.9285449058573908e-15,7.47762243243505e-16,6.004056559921112e-16
USA,Activity,Processing of nuclear fuel,5.3246717013740834e-17,4.819081773112425e-17,3.4500227683253635e-17,5.151681839994923e-18,3.1992502421671378e-18
USA,Activity,Processing vegetable oils and fats,1.8646563608617916e-14,8.295471341481985e-15,7.326632953570257e-15,1.800013418526875e-15,1.040836922072158e-15
USA,Activity,Production of electricity by Geothermal,1.2971385502463496e-14,1.1751100579670605e-16,1.0224042467420098e-16,2.5850546161104498e-17,1.607220433973406e-17
USA,Activity,Production of electricity by biomass and waste,1.0491068404505695e-16,1.144855176722223e-18,1.0011986928877074e-18,2.5558012313872423e-19,1.5245879966943667e-19
USA,Activity,Production of electricity by coal,2.0837342979410494e-12,5.1458053879167947e-14,4.4348529684668865e-14,1.1111350017234957e-14,6.590828596148529e-15
USA,Activity,Production of electricity by gas,1.5639152341114045e-12,1.4270613814696408e-14,1.2328235720469005e-14,3.09980965409153e-15,1.84062443294329e-15
USA,Activity,Production of electricity by hydro,2.9039860766981953e-13,3.522440079392492e-15,3.061067108884086e-15,7.695636635441003e-16,4.589587049053394e-16
USA,Activity,Production of electricity by nuclear,1.2643757457958861e-12,1.165504942318093e-14,9.750100219872711e-15,2.418564188574715e-15,1.5332914028221866e-15
USA,Activity,Production of electricity by petroleum and other oil derivatives,4.845178763052964e-17,7.398156833533374e-19,6.573928119340261e-19,1.7643023034025607e-19,1.0344786996689809e-19
USA,Activity,Production of electricity by solar photovoltaic,1.3035445396073756e-14,8.872765377293281e-18,7.712679398768057e-18,1.9297901885335715e-18,1.19379094957362e-18
USA,Activity,Production of electricity by solar thermal,2.9799848687863153e-15,7.090154426780198e-18,6.154914525339821e-18,1.5529019530677254e-18,9.947444480408988e-19
USA,Activity,"Production of electricity by tide, wave, ocean",0.0,0.0,0.0,0.0,0.0
USA,Activity,Production of electricity by wind,1.8569442394894783e-13,7.432158396169339e-16,6.425548689223621e-16,1.58494899034957e-16,9.510395027149931e-17
USA,Activity,Production of electricity nec,2.5542269678113345e-15,2.4157956698045063e-17,2.097303200657014e-17,5.296691890275823e-18,3.3916950671268152e-18
USA,Activity,Production of meat products nec,2.3041194062984458e-14,1.0618588122351332e-14,8.982301086723216e-15,2.1243452076451815e-15,1.2975235015037572e-15
USA,Activity,Production of offshore wind plants,0.0,0.0,0.0,0.0,0.0
USA,Activity,Production of onshore wind plants,0.0,0.0,0.0,0.0,0.0
USA,Activity,Production of photovoltaic plants,0.0,0.0,0.0,0.0,0.0
USA,Activity,Public administration and defence; compulsory social security (75),6.19721949215112e-13,5.55507210426144e-14,4.6828028675408434e-14,1.8668384898962144e-14,1.4822435427159743e-14
USA,Activity,"Publishing, printing and reproduction of recorded media (22)",1.5430075485356528e-13,9.085261692259433e-14,8.070654729215739e-14,3.360216269931816e-14,2.073146031816693e-14
USA,Activity,Pulp,9.290365396673562e-15,5.621801558544278e-15,3.923582873949012e-15,8.145245072118057e-16,4.695988285852392e-16
USA,Activity,Quarrying of sand and clay,3.094100398333512e-13,3.8440882486901287e-14,3.459134623616435e-14,5.916687089218969e-15,4.320244736483562e-15
USA,Activity,Quarrying of stone,7.583031487610239e-14,1.116286167966298e-14,1.1847216929495802e-14,3.2465678130010914e-15,1.9156686118304287e-15
USA,Activity,Raw milk,8.397453570548295e-15,8.106749184122631e-15,5.049775655361878e-15,7.765697726252141e-16,4.81956534463964e-16
USA,Activity,Re-processing of ash into clinker,0.0,0.0,0.0,0.0,0.0
USA,Activity,Re-processing of secondary aluminium into new aluminium,0.0,0.0,0.0,0.0,0.0
USA,Activity,Re-processing of secondary construction material into aggregates,0.0,0.0,0.0,0.0,0.0
USA,Activity,Re-processing of secondary copper into new copper,0.0,0.0,0.0,0.0,0.0
USA,Activity,Re-processing of secondary glass into new glass,0.0,0.0,0.0,0.0,0.0
USA,Activity,"Re-processing of secondary lead into new lead, zinc and tin",0.0,0.0,0.0,0.0,0.0
USA,Activity,Re-processing of secondary other non-ferrous metals into new other non-ferrous metals,0.0,0.0,0.0,0.0,0.0
USA,Activity,Re-processing of secondary paper into new pulp,0.0,0.0,0.0,0.0,0.0
USA,Activity,Re-processing of secondary plastic into new plastic,0.0,0.0,0.0,0.0,0.0
USA,Activity,Re-processing of secondary preciuos metals into new preciuos metals,0.0,0.0,0.0,0.0,0.0
USA,Activity,Re-processing of secondary steel into new steel,0.0,0.0,0.0,0.0,0.0
USA,Activity,Re-processing of secondary wood material into new wood material,0.0,0.0,0.0,0.0,0.0
USA,Activity,Real estate activities (70),2.2056694153962266e-13,1.3152350000969567e-13,1.2001332583941902e-13,4.8012951496458283e-14,3.59127732303619e-14
