EU27+UK,Activity,Retail sale of automotive fuel,4.929927056459248e-12,5.926542430343996e-12,6.395669124563106e-12,5.6379031777377625e-12,1.1379861061204825e-11
EU27+UK,Activity,"Retail trade, except of motor vehicles and motorcycles; repair of personal and household goods (52)",1.5273201099362914e-10,2.3632757465334934e-10,2.332430760881785e-10,1.790748022265295e-10,2.3226509647855514e-10
EU27+UK,Activity,"Sale, maintenance, repair of motor vehicles, motor vehicles parts, motorcycles, motor cycles parts and accessoiries",2.951330041587344e-11,4.0922024480547156e-11,4.4502643683060646e-11,4.639269519358752e-11,5.194647144553628e-11
EU27+UK,Activity,Sea and coastal water transport,1.8866213391448756e-12,4.034589355451265e-12,1.511305040636443e-11,5.315924269474559e-12,2.0000928038048065e-12
EU27+UK,Activity,Steam and hot water supply,1.0571586721821596e-13,1.1429664271448648e-13,1.1433807359252118e-13,1.2136892947495114e-13,9.507251194716527e-14
EU27+UK,Activity,Sugar refining,3.0459507461309124e-13,5.9422198781402e-13,5.854105969881815e-13,4.1107708378382146e-13,2.9138387587092236e-13
EU27+UK,Activity,Supporting and auxiliary transport activities; activities of travel agencies (63),1.3638468578642847e-11,2.1128260621826576e-11,2.9659940377577985e-11,2.0316598418954277e-11,1.403461987031279e-11
EU27+UK,Activity,"Tanning and dressing of leather; manufacture of luggage, handbags, saddlery, harness and footwear (19)",1.4810480689736743e-12,2.4155712946622903e-12,2.271705420320824e-12,1.5968005843580913e-12,1.1974841040568536e-12
EU27+UK,Activity,Transmission of electricity,2.763818667186852e-13,3.7849654677551384e-13,3.9644274961209803e-13,3.516209170322888e-13,2.679442263298832e-13
EU27+UK,Activity,Transport via pipelines,4.981811599859344e-13,6.087683037647839e-13,7.012934740139554e-13,8.470656630860421e-13,1.8126582721626567e-12
EU27+UK,Activity,Transport via railways,1.3192326025203025e-12,2.283635748791632e-12,2.588814624907692e-12,2.058627822963426e-12,1.8560043849209642e-12
EU27+UK,Activity,"Waste water treatment, food",1.7730638579117386e-13,2.1125244222215208e-13,2.2898651124130013e-13,1.881583751367603e-13,1.4116820853591447e-13
EU27+UK,Activity,"Waste water treatment, other",3.411155007007466e-13,3.937859499988538e-13,4.205197022591692e-13,3.359150249398739e-13,2.6193733859926666e-13
EU27+UK,Activity,"Wholesale trade and commission trade, except of motor vehicles and motorcycles (51)",1.616236221713379e-10,3.186696060422971e-10,3.041953792137091e-10,2.1466469212530448e-10,1.981590077950076e-10
EU27+UK,Activity,"Wool, silk-worm cocoons",9.354857324033271e-15,7.79641523150697e-15,7.070062619927305e-15,5.1879439383754724e-15,6.867638703788905e-15
RoW,Activity,Activities auxiliary to financial intermediation (67),3.72222222184261e-12,3.5167323321953936e-12,3.1661224733487153e-12,2.712788083806542e-12,2.8140690753028558e-12
RoW,Activity,Activities of membership organisation n.e.c. (91),1.459006883425087e-12,1.4410219744413544e-12,1.2764244870112658e-12,8.999421439179111e-13,1.017563998419863e-12
RoW,Activity,Air transport (62),1.201011071067404e-12,1.3888432989536743e-12,1.3280983543187904e-12,1.119417922868535e-12,1.0061440100995252e-12
RoW,Activity,Aluminium production,2.2666905895297124e-12,2.8293771949199456e-12,2.37005142213206e-12,1.325861268251763e-12,1.401115065499785e-12
RoW,Activity,Animal products nec,2.652956942989084e-12,2.5150018214970354e-12,2.2401155705353337e-12,1.562391002645909e-12,1.8186776344654166e-12
RoW,Activity,"Biogasification of food waste, incl. land application",3.4328959385214887e-14,3.346664991951703e-14,2.9099947432081945e-14,2.061940307259636e-14,2.285801514061302e-14
RoW,Activity,"Biogasification of paper, incl. land application",3.542672057521436e-14,3.3333799831713937e-14,2.9058054396357086e-14,1.998590694074289e-14,2.2850245515864023e-14
RoW,Activity,"Biogasification of sewage slugde, incl. land application",7.312763603998233e-14,8.502010357689735e-14,7.586706575374275e-14,5.4114369244969986e-14,5.194501101386485e-14
RoW,Activity,Casting of metals,5.427396582590682e-13,7.030101414198417e-13,5.620055686832979e-13,3.9055910744770203e-13,3.726163450800436e-13
RoW,Activity,Cattle farming,6.551772106819044e-12,5.345251652463851e-12,4.69535103583358e-12,3.2626239781422087e-12,4.316734187417178e-12
RoW,Activity,Chemicals nec,2.207854505125053e-11,1.9072501923143646e-11,1.7301590999907875e-11,1.1180121446106748e-11,1.3761310220574588e-11
RoW,Activity,"Collection, purification and distribution of water (41)",7.379061701200294e-14,4.5659063968464625e-14,3.952278483116455e-14,2.742676081000173e-14,4.684141840085111e-14
RoW,Activity,"Composting of food waste, incl. land application",4.595501170075592e-14,4.8431765932969516e-14,4.6338847980639606e-14,3.5329511855481823e-14,3.3734822825552197e-14
RoW,Activity,"Composting of paper and wood, incl. land application",3.621991964812906e-14,3.452410356805754e-14,3.1194229533721383e-14,2.1053237973767166e-14,2.390669858394092e-14
RoW,Activity,Computer and related activities (72),4.2289135093696105e-12,4.746708381608843e-12,4.156156859148354e-12,3.461097814043044e-12,3.345271530058979e-12
RoW,Activity,Construction (45),1.6038120431735623e-12,1.0948562270071855e-12,1.1247238754260262e-12,9.156958395137088e-13,1.1897783624847146e-12
RoW,Activity,Copper production,1.137841671123145e-12,3.440627914215177e-12,2.0959830039358476e-12,1.3050369185252487e-12,7.589529937229789e-13
RoW,Activity,Cultivation of cereal grains nec,1.0109937443811198e-11,7.435446497789632e-12,6.550562712359475e-12,4.4761060964742515e-12,6.48506974300396e-12
RoW,Activity,Cultivation of crops nec,2.5141200191013227e-11,2.140648448551989e-11,1.8883122697030018e-11,1.2758252782052665e-11,1.659599063085118e-11
RoW,Activity,Cultivation of oil seeds,5.606109326676506e-11,4.1121448058044205e-11,3.150926956100855e-11,2.062861679936846e-11,3.452305363229317e-11
RoW,Activity,Cultivation of paddy rice,2.2443872814579742e-11,1.8426684030774586e-11,1.6298402461897395e-11,1.1023888793238124e-11,1.4563904342998297e-11
RoW,Activity,Cultivation of plant-based fibers,3.013762438749211e-11,2.837969349676272e-11,2.4940803721722915e-11,1.5919387227591563e-11,1.921541461359899e-11
RoW,Activity,"Cultivation of sugar cane, sugar beet",9.124031037873843e-12,7.572736338567814e-12,6.777352565049688e-12,4.55337286273649e-12,5.861531482546366e-12
RoW,Activity,"Cultivation of vegetables, fruit, nuts",7.796607874516469e-11,4.8432530182481524e-11,4.0406848158878114e-11,2.7067063212950486e-11,4.82739369209122e-11
RoW,Activity,Cultivation of wheat,1.753888050588805e-11,1.4667638800201864e-11,1.3133628153642498e-11,9.0052759577405e-12,1.1456323426953949e-11
RoW,Activity,Distribution and trade of electricity,2.467469170845611e-13,2.3551760345082946e-13,2.0774335571974913e-13,1.4958658161916784e-13,1.7425368642475514e-13
RoW,Activity,Education (80),5.71419299894591e-13,5.511764113903034e-13,4.901135500548198e-13,4.21235067432458e-13,4.2907115127164087e-13
RoW,Activity,Extra-territorial organizations and bodies,0.0,0.0,0.0,0.0,0.0
RoW,Activity,"Extraction of crude petroleum and services related to crude oil extraction, excluding surveying",6.769312509857772e-12,4.901712345987999e-12,4.82363036339809e-12,6.416408264740233e-12,5.369203402794925e-12
RoW,Activity,"Extraction of natural gas and services related to natural gas extraction, excluding surveying",1.73623301858127e-11,9.640809754064097e-12,8.375136705454611e-12,1.613704881114786e-11,1.6235272283321307e-11
RoW,Activity,"Extraction, liquefaction, and regasification of other petroleum and gaseous materials",6.853359773909553e-14,5.79249038978552e-14,5.336967564350883e-14,5.1137732014338236e-14,5.0521274175403405e-14
RoW,Activity,"Financial intermediation, except insurance and pension funding (65)",1.1274973838781307e-11,1.0418030003673473e-11,9.416080994739415e-12,8.027417078745071e-12,8.641178913743474e-12
RoW,Activity,"Fishing, operating of fish hatcheries and fish farms; service activities incidental to fishing (05)",5.240437106071666e-12,6.014736772022781e-12,5.916146488253795e-12,3.978257941422835e-12,3.858259438310657e-12
RoW,Activity,"Forestry, logging and related service activities (02)",1.9077537552681554e-11,1.1668057226861752e-11,9.662294963211219e-12,6.306156287661816e-12,1.1695351469154041e-11
RoW,Activity,Health and social work (85),6.174852567114978e-13,6.090628491834663e-13,5.537564329880912e-13,4.214200257582823e-13,4.500742994783768e-13
RoW,Activity,Hotels and restaurants (55),2.293706164496876e-11,2.801133784600823e-11,2.704228858010802e-11,2.111053547832828e-11,1.9369914551085646e-11
RoW,Activity,Incineration of waste: Food,7.689062954560557e-14,7.368452198952571e-14,6.609548126343888e-14,4.586043681891212e-14,5.258523061403104e-14
RoW,Activity,Incineration of waste: Metals and Inert materials,7.489966354988851e-14,9.061534282837331e-14,1.014802821054619e-13,7.186800019346573e-14,6.097421042203729e-14
RoW,Activity,Incineration of waste: Oil/Hazardous waste,5.139963777255967e-14,6.557572489671648e-14,5.674215439775686e-14,3.852287546272768e-14,3.5665056763962046e-14
RoW,Activity,Incineration of waste: Paper,8.274617895159402e-14,7.989426825358941e-14,7.102005989519126e-14,4.9099277117428166e-14,5.639970909748107e-14
RoW,Activity,Incineration of waste: Plastic,6.004765127620153e-14,5.269159889062164e-14,4.923672499056674e-14,3.7799630824370555e-14,4.185311916931495e-14
RoW,Activity,Incineration of waste: Textiles,4.5704576072903773e-14,3.336543740630081e-14,2.954090050996593e-14,2.0238244603470342e-14,2.933291603175582e-14
RoW,Activity,Incineration of waste: Wood,5.6631694429451534e-14,4.58540366560642e-14,4.148670111915409e-14,3.1993672497701615e-14,3.8263176868101745e-14
RoW,Activity,Inland water transport,9.771196744841754e-14,8.949756512364742e-14,8.568143096862456e-14,6.845845444791542e-14,7.366261489533558e-14
RoW,Activity,"Insurance and pension funding, except compulsory social security (66)",2.536689658441383e-12,2.4886543423164736e-12,2.2830403428272533e-12,1.9060106207526984e-12,2.0392165041769376e-12
RoW,Activity,Landfill of waste: Food,5.301202928809228e-13,4.014382130943387e-13,3.737793914830788e-13,2.6217814672465567e-13,3.655846022515743e-13
RoW,Activity,Landfill of waste: Inert/metal/hazardous,2.3432278750609076e-13,1.9746508228679646e-13,1.8001731983966568e-13,1.285449251748674e-13,1.6312467700159287e-13
RoW,Activity,Landfill of waste: Paper,2.63061246748041e-13,2.1901795172471784e-13,1.999486096843289e-13,1.3980146449011992e-13,1.8194065674087957e-13
RoW,Activity,Landfill of waste: Plastic,1.896289703260215e-13,1.4787007963863654e-13,1.3613165295563607e-13,9.661920479064586e-14,1.3085260130241739e-13
RoW,Activity,Landfill of waste: Textiles,1.1588488436584565e-13,9.640398969477964e-14,8.765147590136294e-14,6.14023106014325e-14,7.976682904842444e-14
RoW,Activity,Landfill of waste: Wood,1.2965121651337176e-13,1.0879408899361972e-13,9.932995887644846e-14,6.944996441643777e-14,8.956825788834207e-14
RoW,Activity,"Lead, zinc and tin production",2.1882195493830474e-13,3.1837438674314907e-13,3.0809576736364413e-13,1.8282669967908258e-13,1.5248904355385709e-13
RoW,Activity,Manufacture of basic iron and steel and of ferro-alloys and first products thereof,3.00644408880933e-12,7.100562371270297e-12,6.30779223770848e-12,3.5431370229081314e-12,2.0874137164288143e-12
RoW,Activity,Manufacture of beverages,5.516333036097892e-13,5.813808994593985e-13,5.032757728458225e-13,3.584508566079618e-13,3.94186304866214e-13
RoW,Activity,"Manufacture of bricks, tiles and construction products, in baked clay",1.121333406512099e-13,8.764806412904249e-14,8.528813480163573e-14,5.545573860702418e-14,7.38546434669641e-14
RoW,Activity,"Manufacture of cement, lime and plaster",1.5472290395767883e-12,6.118946604298841e-13,7.435633984562534e-13,5.021989498624156e-13,9.932791476412314e-13
RoW,Activity,Manufacture of ceramic goods,1.4519438090385007e-12,8.95276050496215e-13,9.733000010774657e-13,6.677994725156774e-13,9.96559471213661e-13
RoW,Activity,Manufacture of coke oven products,2.400272700697397e-13,3.1820193033753795e-13,2.8817169168790385e-13,1.8025795487956268e-13,1.6146551875683944e-13
RoW,Activity,Manufacture of electrical machinery and apparatus n.e.c. (31),2.7905905642992404e-11,4.016373767531571e-11,2.7522702578186412e-11,2.5275642779538425e-11,2.124263383432128e-11
RoW,Activity,"Manufacture of fabricated metal products, except machinery and equipment (28)",9.118614837439081e-12,1.5413839437806737e-11,1.3904119782638037e-11,8.30593567333816e-12,6.2745326183001786e-12
RoW,Activity,Manufacture of fish products,6.051297098822888e-13,7.779601111454359e-13,7.714295956303567e-13,5.249071620977647e-13,4.566409640287089e-13
RoW,Activity,Manufacture of furniture; manufacturing n.e.c. (36),3.546109659020555e-12,4.088822238874276e-12,3.38753656676781e-12,2.5596872979440535e-12,2.4502382074958146e-12
RoW,Activity,Manufacture of gas; distribution of gaseous fuels through mains,6.690478842611081e-13,3.697906756539051e-13,3.1975972753205416e-13,2.2346563242310486e-13,4.159514095246537e-13
RoW,Activity,Manufacture of glass and glass products,1.4778541297261212e-11,6.831098142574491e-12,5.153295016546304e-12,2.8674859869069564e-12,8.424950974743577e-12
RoW,Activity,Manufacture of machinery and equipment n.e.c. (29),1.6698407466429146e-11,1.9149949211242835e-11,1.4822028711108957e-11,9.992411889053425e-12,1.092482675348634e-11
RoW,Activity,"Manufacture of medical, precision and optical instruments, watches and clocks (33)",7.459067165618831e-12,1.543423893538517e-11,1.0073665257129432e-11,7.381442529583829e-12,5.537211243404334e-12
RoW,Activity,"Manufacture of motor vehicles, trailers and semi-trailers (34)",3.7717475177302094e-12,3.6259057733589587e-12,3.247690133202823e-12,2.2491359023468813e-12,2.6693521030660513e-12
RoW,Activity,Manufacture of office machinery and computers (30),1.8552617577271975e-12,2.3131728962501075e-12,1.4886180743060707e-12,1.0494230784886665e-12,1.2035195599045296e-12
RoW,Activity,Manufacture of other non-metallic mineral products n.e.c.,1.003650175988609e-11,2.0135016364481877e-12,2.0688174181445203e-12,1.1625545202899018e-12,5.723735054658579e-12
RoW,Activity,Manufacture of other transport equipment (35),1.4665204561165066e-12,1.9253835991572836e-12,1.7050273184240827e-12,1.1620223840234563e-12,1.1114366153896208e-12
RoW,Activity,"Manufacture of radio, television and communication equipment and apparatus (32)",2.2737563388338103e-11,4.9210354545918474e-11,2.9059428536405722e-11,2.1361375932167235e-11,1.5755651028294368e-11
RoW,Activity,Manufacture of rubber and plastic products (25),1.4658406605185856e-11,1.758682554773451e-11,1.5638638456510336e-11,1.0068923051088667e-11,1.0080989191008589e-11
RoW,Activity,Manufacture of textiles (17),7.46159653151779e-12,8.614657918729659e-12,7.470580304884721e-12,4.6218925607767825e-12,4.9918244522277074e-12
RoW,Activity,Manufacture of tobacco products (16),2.412255350220726e-12,8.674946154630003e-13,6.982655977756179e-13,4.33861722235612e-13,1.4035445714426527e-12
RoW,Activity,Manufacture of wearing apparel; dressing and dyeing of fur (18),2.5102677538116263e-12,2.6668875273359887e-12,2.5149934525121463e-12,1.7274664742557643e-12,1.8000881009738246e-12
RoW,Activity,"Manufacture of wood and of products of wood and cork, except furniture; manufacture of articles of straw and plaiting materials (20)",3.638442245595418e-12,2.689862852112113e-12,2.7423775995613912e-12,1.7067186039240808e-12,2.3653259527052668e-12
RoW,Activity,"Manure treatment (biogas), storage and land application",0.0,0.0,0.0,0.0,0.0
RoW,Activity,"Manure treatment (conventional), storage and land application",0.0,0.0,0.0,0.0,0.0
RoW,Activity,Meat animals nec,4.5979691290065753e-11,4.252203130695887e-11,3.749468804080634e-11,2.5929513540677406e-11,3.07302116489298e-11
RoW,Activity,Mining of aluminium ores and concentrates,2.7769168268802215e-12,1.979193047936189e-12,1.5046860939484336e-12,8.791312110950098e-13,1.6298102118405444e-12
RoW,Activity,"Mining of chemical and fertilizer minerals, production of salt, other mining and quarrying n.e.c.",8.536969599438216e-12,1.2584595420903403e-11,1.499894328212306e-11,7.21558563607638e-12,5.3410181889794945e-12
RoW,Activity,Mining of coal and lignite; extraction of peat (10),3.8679979385605206e-11,1.8178610558401382e-11,1.5440534979214947e-11,1.2316215950111937e-11,2.358993879136911e-11
RoW,Activity,Mining of copper ores and concentrates,1.544818627360611e-10,2.5504244074519486e-10,1.6758572184436676e-10,1.0109385302239269e-10,9.57411837204612e-11
RoW,Activity,Mining of iron ores,7.107519422860495e-12,1.8309332348905336e-11,1.233589597133578e-11,7.291287326872518e-12,4.611586284819264e-12
RoW,Activity,"Mining of lead, zinc and tin ores and concentrates",8.458445161258899e-12,1.155557596896675e-11,1.1229735463713398e-11,6.262684712553926e-12,5.5554116775886494e-12
RoW,Activity,Mining of nickel ores and concentrates,9.150971227644705e-11,1.2157866944696075e-10,1.3435823738834734e-10,6.895631774225234e-11,5.852511024369481e-11
RoW,Activity,Mining of other non-ferrous metal ores and concentrates,1.7573123047395805e-11,2.3467698494583315e-11,1.7765243468853947e-11,1.1116166403262552e-11,1.128673504104977e-11
RoW,Activity,Mining of precious metal ores and concentrates,1.31246743129155e-11,4.028681549577191e-12,3.0335321652971475e-12,1.8718324997995904e-12,7.518944142870317e-12
RoW,Activity,Mining of uranium and thorium ores (12),8.688836344875075e-14,7.631118051833174e-14,6.79916687302126e-14,4.500716009706906e-14,5.506961223406058e-14
RoW,Activity,N-fertiliser,1.422910343132476e-13,1.2561261795371578e-13,1.1106813404544257e-13,8.904331573622608e-14,9.355633992329513e-14
RoW,Activity,Other business activities (74),2.223443697726349e-11,2.6226162633849763e-11,2.3086447912508098e-11,2.0024441917045557e-11,1.7577865519529722e-11
RoW,Activity,Other land transport,9.878850045892469e-12,9.635493978604445e-12,9.029101679066141e-12,6.750264682300682e-12,8.341601709358805e-12
RoW,Activity,Other non-ferrous metal production,6.127567878785801e-13,1.0660793802561129e-12,8.030809176737147e-13,5.06466016486476e-13,4.109898741762206e-13
RoW,Activity,Other service activities (93),2.612899887359985e-12,2.307556067634893e-12,1.9962294109301004e-12,1.6480797695914352e-12,1.825907621337438e-12
RoW,Activity,P- and other fertiliser,1.0246098775239988e-12,8.399959199513699e-13,7.473704778006895e-13,6.141007729123717e-13,6.68664815605894e-13
RoW,Activity,Paper,4.050752196001991e-12,4.318023306040303e-12,3.682382560125116e-12,2.68595684298103e-12,2.852734039149532e-12
RoW,Activity,Petroleum Refinery,4.532643734104414e-12,3.8848202120122225e-12,3.667901116140917e-12,3.997444364881833e-12,3.574734267630443e-12
RoW,Activity,Pigs farming,4.8220084009983785e-11,3.944336263136451e-11,3.5107816745451014e-11,2.4647687449267998e-11,3.2176202156187536e-11
RoW,Activity,"Plastics, basic",2.173690869317521e-12,2.40268785558526e-12,1.838161867734716e-12,1.2150376508631445e-12,1.4039627776623985e-12
RoW,Activity,Post and telecommunications (64),6.588296519979612e-12,6.931156622961404e-12,6.2256274238053195e-12,5.3626236435449666e-12,5.327018019054517e-12
RoW,Activity,Poultry farming,1.8171249777859956e-11,1.489886966719668e-11,1.3411735056568701e-11,9.536861953769766e-12,1.217562125748637e-11
RoW,Activity,Precious metals production,1.3717518619744327e-12,6.321283154266347e-13,4.685502872394537e-13,2.9201397139342756e-13,8.029225278987278e-13
RoW,Activity,Private households with employed persons (95),3.9616177229385425e-12,5.021202916821876e-12,4.437856487253797e-12,3.4729854650708312e-12,3.105101439683478e-12
RoW,Activity,Processed rice,6.407774393678608e-13,5.290172283807656e-13,4.534405139550709e-13,3.036543860751485e-13,4.099197825926683e-13
RoW,Activity,Processing of Food products nec,2.0396880874623858e-12,1.7551613956878693e-12,1.5804067148963067e-12,1.103127096367994e-12,1.3797086507344629e-12
RoW,Activity,Processing of dairy products,3.1947507474084135e-13,3.751138047487437e-13,2.6974438595162384e-13,1.8290924951131096e-13,2.0910743367539414e-13
RoW,Activity,Processing of meat cattle,1.5528341379559525e-12,1.178518189000673e-12,1.0254436299945319e-12,7.22921448459773e-13,1.0286834121932917e-12
RoW,Activity,Processing of meat pigs,6.783254903062332e-13,5.233891049696941e-13,4.662398152447418e-13,3.435457725653716e-13,4.60432727575305e-13
RoW,Activity,Processing of meat poultry,1.0870569671184207e-12,7.785857362394082e-13,6.817885808333375e-13,5.021589745202929e-13,7.163508992844083e-13
RoW,Activity,Processing of nuclear fuel,1.938600894719805e-13,1.7479540642493143e-13,1.3358595959313703e-13,8.630285181269732e-14,1.1892945946360026e-13
RoW,Activity,Processing vegetable oils and fats,2.8583716530534066e-12,2.5417492472255535e-12,2.101257369599257e-12,1.3609617000404958e-12,1.8102383698600247e-12
RoW,Activity,Production of electricity by Geothermal,1.3586465510333792e-13,3.0256954431070727e-14,2.685104528072161e-14,1.915968773694521e-14,7.911233426098487e-14
RoW,Activity,Production of electricity by biomass and waste,1.652219488636261e-13,2.717208275642906e-14,2.3536031846405962e-14,1.6858634811323117e-14,9.505087669741389e-14
RoW,Activity,Production of electricity by coal,3.3088852740726758e-12,5.117303484179353e-13,4.349271876217704e-13,3.02039062575057e-13,1.889686870283469e-12
RoW,Activity,Production of electricity by gas,3.0511309775151896e-12,4.806979129896687e-13,4.1178153622177747e-13,3.0179724663070723e-13,1.7528185549769801e-12
RoW,Activity,Production of electricity by hydro,1.1423968566498448e-12,1.9470174887596524e-13,1.6859218734540012e-13,1.1880026127255074e-13,6.560203126930208e-13
RoW,Activity,Production of electricity by nuclear,5.546789549972279e-13,1.5725638437087582e-13,1.3599719624183403e-13,9.278427965978455e-14,3.2579322554791346e-13
RoW,Activity,Production of electricity by petroleum and other oil derivatives,1.7103288400104066e-13,4.5141216119554817e-14,3.878059104420707e-14,2.8831699483139526e-14,1.0100494666819932e-13
RoW,Activity,Production of electricity by solar photovoltaic,8.215743717352676e-13,2.6699354219403522e-14,2.3471217190179646e-14,1.648527968354955e-14,4.568987734292708e-13
RoW,Activity,Production of electricity by solar thermal,2.2981544345361732e-11,2.1475596606175015e-14,1.8066870553690698e-14,1.2233658341612236e-14,1.2693414412494906e-11
RoW,Activity,"Production of electricity by tide, wave, ocean",1.6263270003917123e-18,1.0839858454484178e-18,8.454604217669101e-19,5.671232897250768e-19,9.914939465571748e-19
RoW,Activity,Production of electricity by wind,2.992501975081654e-13,3.028574968984014e-14,2.5641949225910797e-14,2.0401652771137286e-14,1.7037681496514697e-13
RoW,Activity,Production of electricity nec,6.6034778235539455e-15,3.001130422397857e-15,2.539252047734321e-15,1.7195654624507862e-15,3.9697094817988195e-15
RoW,Activity,Production of meat products nec,8.260245765464161e-12,6.4043736152220165e-12,5.4887955899000565e-12,3.778228680368756e-12,5.341305720107445e-12
RoW,Activity,Production of offshore wind plants,0.0,0.0,0.0,0.0,0.0
RoW,Activity,Production of onshore wind plants,0.0,0.0,0.0,0.0,0.0
RoW,Activity,Production of photovoltaic plants,0.0,0.0,0.0,0.0,0.0
RoW,Activity,Public administration and defence; compulsory social security (75),7.131463354324984e-12,6.314686870534043e-12,5.701265388585186e-12,4.287920485308066e-12,5.1132013308673185e-12
RoW,Activity,"Publishing, printing and reproduction of recorded media (22)",4.3965377134951605e-12,4.699922118746979e-12,4.091042548674534e-12,3.351656762344287e-12,3.3925660312130655e-12
RoW,Activity,Pulp,9.80248052567036e-13,7.237701154167904e-13,5.742293740061552e-13,4.0440562626155226e-13,6.176981687188221e-13
RoW,Activity,Quarrying of sand and clay,1.4053266978313213e-11,1.0598899398029889e-11,9.998556544896724e-12,6.023203860394222e-12,8.835251612208536e-12
RoW,Activity,Quarrying of stone,5.440012390081693e-11,1.851555121202502e-11,2.6714331029496336e-11,1.2787758825673942e-11,3.176030873909327e-11
RoW,Activity,Raw milk,1.232615140239558e-11,1.1931045457116919e-11,9.886399781481483e-12,6.938947654611354e-12,8.351659851805954e-12
RoW,Activity,Re-processing of ash into clinker,1.9789934141392325e-15,6.771768511789955e-16,8.576173328390677e-16,5.780115713084587e-16,1.256324601117702e-15
RoW,Activity,Re-processing of secondary aluminium into new aluminium,2.332004222454911e-14,2.9521997023343565e-14,2.475778263470624e-14,1.3840467469361662e-14,1.4433722198137118e-14
RoW,Activity,Re-processing of secondary construction material into aggregates,7.111758249409494e-19,4.570298987347632e-19,4.753455682493522e-19,3.850287485034056e-19,5.206889210888637e-19
RoW,Activity,Re-processing of secondary copper into new copper,4.377432692187214e-15,1.3718112048583112e-14,8.298057939737257e-15,5.16085223866235e-15,2.9235713052954174e-15
RoW,Activity,Re-processing of secondary glass into new glass,5.011008618023265e-14,2.3022906539261105e-14,1.7368377800153094e-14,9.636283709826759e-15,2.854544191254322e-14
RoW,Activity,"Re-processing of secondary lead into new lead, zinc and tin",5.23605925589957e-15,6.830902576305294e-15,6.559198765078391e-15,3.876881441893054e-15,3.5469072063875744e-15
RoW,Activity,Re-processing of secondary other non-ferrous metals into new other non-ferrous metals,5.831349199035124e-15,1.0626150825279475e-14,8.133084991468992e-15,5.066274904609199e-15,3.931341891698806e-15
RoW,Activity,Re-processing of secondary paper into new pulp,1.249749032603922e-13,8.497680056255322e-14,6.773825024673861e-14,4.7951064173405566e-14,7.81965348841616e-14
RoW,Activity,Re-processing of secondary plastic into new plastic,8.548016066166128e-15,9.550605483005266e-15,7.264020050250518e-15,4.7673943462901185e-15,5.507008736509138e-15
RoW,Activity,Re-processing of secondary preciuos metals into new preciuos metals,0.0,0.0,0.0,0.0,0.0
