RoW,Activity,Re-processing of secondary steel into new steel,8.574915701631794e-14,2.0475068238513444e-13,1.8192282661847592e-13,1.0204222336459544e-13,5.958979120054507e-14
RoW,Activity,Re-processing of secondary wood material into new wood material,1.221337874439923e-13,9.069583356116135e-14,9.276278802665979e-14,5.762165056990604e-14,7.946349738333387e-14
RoW,Activity,Real estate activities (70),5.080452705141395e-13,4.985000142202889e-13,4.712409354616524e-13,3.923234721150231e-13,4.143216483207581e-13
RoW,Activity,"Recreational, cultural and sporting activities (92)",2.3924817566133435e-12,2.553683015456525e-12,2.2437985766703614e-12,1.8712877495063635e-12,1.845098862667369e-12
RoW,Activity,Recycling of bottles by direct reuse,0.0,0.0,0.0,0.0,0.0
RoW,Activity,Recycling of waste and scrap,1.97829525722294e-12,2.4640305695536646e-12,2.0158282779475088e-12,1.2100139611997134e-12,1.2603351491647258e-12
RoW,Activity,Renting of machinery and equipment without operator and of personal and household goods (71),1.5113144012997474e-12,1.4470796621208226e-12,1.3431451885490862e-12,1.126480781885211e-12,1.1532924711503316e-12
RoW,Activity,Research and development (73),5.927201067483664e-12,7.745930113671202e-12,6.1499431322184665e-12,4.376951866836895e-12,4.073773536671321e-12
RoW,Activity,Retail sale of automotive fuel,1.8919560162104786e-12,1.4791721503814452e-12,1.372989978383971e-12,9.90712299690974e-13,1.6548828423016887e-12
RoW,Activity,"Retail trade, except of motor vehicles and motorcycles; repair of personal and household goods (52)",6.127821808854438e-11,5.682624120576055e-11,5.066259472006407e-11,3.9178285354000983e-11,6.701774029426645e-11
RoW,Activity,"Sale, maintenance, repair of motor vehicles, motor vehicles parts, motorcycles, motor cycles parts and accessoiries",2.908668116995348e-11,2.7692758586939374e-11,2.514966226493218e-11,1.8306135772288662e-11,2.1756677218279734e-11
RoW,Activity,Sea and coastal water transport,5.719992415847774e-12,4.055285439904905e-12,9.560584098253799e-12,4.141162438851785e-12,4.88660958521648e-12
RoW,Activity,Steam and hot water supply,3.8035079153900866e-14,3.4175981854640195e-14,3.003803575099264e-14,2.2020945253092722e-14,2.623885624298212e-14
RoW,Activity,Sugar refining,7.366783259762346e-13,5.8821941868721e-13,5.052704349465117e-13,3.4634248548205477e-13,4.807321670162619e-13
RoW,Activity,Supporting and auxiliary transport activities; activities of travel agencies (63),5.7436109153758446e-12,5.833550407927676e-12,6.816256063409772e-12,4.338389426626213e-12,4.571360153702267e-12
RoW,Activity,"Tanning and dressing of leather; manufacture of luggage, handbags, saddlery, harness and footwear (19)",3.284067486080501e-12,3.565349351547771e-12,3.0136157470613926e-12,2.00025264202828e-12,2.1942302881044406e-12
RoW,Activity,Transmission of electricity,1.1340372355864391e-13,1.042661856148676e-13,8.910489764650184e-14,6.46516194243313e-14,7.719983402019501e-14
RoW,Activity,Transport via pipelines,3.2107369779060016e-13,2.785230867361847e-13,2.57304253348599e-13,2.393633289155003e-13,3.6590708538802527e-13
RoW,Activity,Transport via railways,1.2210740629198282e-12,1.1923514314547428e-12,1.1097040255087752e-12,8.013953501691578e-13,1.2886819166131887e-12
RoW,Activity,"Waste water treatment, food",7.953158970370016e-13,8.112003456766096e-13,6.98411076085893e-13,4.852686968541914e-13,5.522740362990366e-13
RoW,Activity,"Waste water treatment, other",8.475605917030761e-13,8.264971833798519e-13,7.209089457120445e-13,4.914099381589369e-13,5.790680349035306e-13
RoW,Activity,"Wholesale trade and commission trade, except of motor vehicles and motorcycles (51)",8.014681142677419e-11,8.385748441819119e-11,7.222605309600676e-11,5.633767912834311e-11,7.634809570351355e-11
RoW,Activity,"Wool, silk-worm cocoons",5.058098572324646e-13,4.883370644727973e-13,4.4576543254358503e-13,3.213316893658259e-13,3.6709961799116347e-13
USA,Activity,Activities auxiliary to financial intermediation (67),1.2201630355791437e-12,5.69131110558053e-13,4.683262406339213e-13,3.687525994620086e-13,7.563517407091736e-13
USA,Activity,Activities of membership organisation n.e.c. (91),5.618116821880537e-13,3.220844005987514e-13,2.880430563326852e-13,2.4326938521122677e-13,3.7182426947880854e-13
USA,Activity,Air transport (62),1.3933462788257213e-13,7.155940227532782e-14,6.676655885742611e-14,5.566383394715692e-14,9.2548098891245e-14
USA,Activity,Aluminium production,1.0248357689532183e-13,3.102117495365636e-14,2.1355132497249175e-14,1.2976838400018082e-14,5.806041966145159e-14
USA,Activity,Animal products nec,4.1487906715459126e-15,4.121090850131399e-15,3.6415200504920165e-15,2.425495787106665e-15,2.767186142305648e-15
USA,Activity,"Biogasification of food waste, incl. land application",0.0,0.0,0.0,0.0,0.0
USA,Activity,"Biogasification of paper, incl. land application",0.0,0.0,0.0,0.0,0.0
USA,Activity,"Biogasification of sewage slugde, incl. land application",4.941117956936331e-14,1.7241728305131997e-14,1.5084544119208037e-14,1.0856089054611724e-14,2.938127250413956e-14
USA,Activity,Casting of metals,8.332020070585525e-14,5.566662543812378e-14,4.5094160178058234e-14,3.064771882979097e-14,5.183859789368746e-14
USA,Activity,Cattle farming,5.253830961475843e-15,3.606966635879003e-15,3.226509775020173e-15,2.2134521089264216e-15,3.3440685504706737e-15
USA,Activity,Chemicals nec,1.0599828742030144e-11,4.1317436061654064e-12,3.703475320339396e-12,2.3414446503567685e-12,6.1682535069562825e-12
USA,Activity,"Collection, purification and distribution of water (41)",9.3891828318692e-15,2.5050156004017087e-15,2.2599380271495874e-15,1.5757549260980393e-15,5.51214879753922e-15
USA,Activity,"Composting of food waste, incl. land application",3.113892690064255e-16,2.6608173429256957e-16,2.9767229304525503e-16,3.1080331303149325e-16,2.442271236235467e-16
USA,Activity,"Composting of paper and wood, incl. land application",1.3402356675459364e-14,4.1699988762786825e-15,3.969152995841172e-15,2.7206376742106078e-15,7.978592162635963e-15
USA,Activity,Computer and related activities (72),1.5458130818508086e-12,9.881925516039308e-13,8.673200541425904e-13,7.398615858563042e-13,1.0632186035036412e-12
USA,Activity,Construction (45),5.925797801990955e-13,6.312618518916409e-14,6.557020044885267e-14,5.767727673863505e-14,3.443406601570612e-13
USA,Activity,Copper production,7.636844082732538e-14,7.825675679379785e-14,5.3182413945301945e-14,3.3150523069064176e-14,4.647161436220476e-14
USA,Activity,Cultivation of cereal grains nec,2.2414186316692483e-14,1.11228426232678e-14,9.23906332804382e-15,6.1071267129738834e-15,1.346090542259654e-14
USA,Activity,Cultivation of crops nec,2.5529969994568934e-14,1.1345773950502407e-14,9.646778538549734e-15,6.400897962953486e-15,1.515481111054213e-14
USA,Activity,Cultivation of oil seeds,1.6461151369321736e-13,8.986725015395386e-14,5.518222466978244e-14,3.5265775595117394e-14,9.463209447716621e-14
USA,Activity,Cultivation of paddy rice,1.3712178766336369e-14,8.58381200347752e-15,7.640194706376644e-15,5.11031123105268e-15,8.432573189790489e-15
USA,Activity,Cultivation of plant-based fibers,6.734807408052019e-14,5.465963533836149e-14,4.4629745018153466e-14,2.84976354652129e-14,4.120739463059776e-14
USA,Activity,"Cultivation of sugar cane, sugar beet",8.64167772663083e-15,4.698470458678419e-15,4.074570610376202e-15,2.671829451574854e-15,5.2517253970072336e-15
USA,Activity,"Cultivation of vegetables, fruit, nuts",1.2555956009212848e-14,8.806854865324643e-15,7.766344311934782e-15,5.238434730943963e-15,7.908435783421468e-15
USA,Activity,Cultivation of wheat,2.318405391759241e-14,1.821595420525894e-14,1.621654771237376e-14,1.0849232709203894e-14,1.4808099474049178e-14
USA,Activity,Distribution and trade of electricity,4.2173952170729184e-14,1.2009287096681871e-14,1.0656437841232071e-14,7.662514100693017e-15,2.4929156015272358e-14
USA,Activity,Education (80),1.981562101967394e-13,5.885698778770661e-14,5.350484165563595e-14,7.373555506855389e-14,1.3009999599074066e-13
USA,Activity,Extra-territorial organizations and bodies,0.0,0.0,0.0,0.0,0.0
USA,Activity,"Extraction of crude petroleum and services related to crude oil extraction, excluding surveying",2.8735204235371966e-14,1.57423447162161e-14,1.4647859624538348e-14,1.8331540529217685e-14,2.0359935215913357e-14
USA,Activity,"Extraction of natural gas and services related to natural gas extraction, excluding surveying",3.8715120637273616e-15,2.3820136444557305e-15,2.221944352110303e-15,2.5244196658029994e-15,2.918347281557208e-15
USA,Activity,"Extraction, liquefaction, and regasification of other petroleum and gaseous materials",-8.057289331590724e-17,-2.1016996101787367e-17,-1.952354228576139e-17,-1.827940151487131e-17,-4.942214992721801e-17
USA,Activity,"Financial intermediation, except insurance and pension funding (65)",2.5928285379508538e-12,2.0163928447174522e-12,1.8913142322278496e-12,1.861935506248682e-12,2.0103470826025125e-12
USA,Activity,"Fishing, operating of fish hatcheries and fish farms; service activities incidental to fishing (05)",1.643181806340534e-14,1.4326785353716513e-14,1.305181016771667e-14,8.689590539497481e-15,1.0758448609172784e-14
USA,Activity,"Forestry, logging and related service activities (02)",2.1476206834436395e-13,9.161552679646763e-14,7.839881426507915e-14,5.0775339515005437e-14,1.2774993945144884e-13
USA,Activity,Health and social work (85),5.4498433919228935e-14,9.967309037312615e-15,9.28480574502119e-15,1.0114723167496349e-14,3.293576989698895e-14
USA,Activity,Hotels and restaurants (55),5.436387693996393e-12,2.6883363523659887e-12,2.3595443749592597e-12,1.8230181374656867e-12,3.4747468098073778e-12
USA,Activity,Incineration of waste: Food,5.908212361069023e-15,5.985051236368092e-15,5.297328249599436e-15,3.303949227637339e-15,3.859789349152815e-15
USA,Activity,Incineration of waste: Metals and Inert materials,1.0208120856260043e-14,9.633740716594596e-15,1.2704021355318135e-14,8.841083075414718e-15,8.325650538227188e-15
USA,Activity,Incineration of waste: Oil/Hazardous waste,6.069755805422207e-16,9.320584252165937e-16,8.287187430957162e-16,5.472472743875778e-16,4.3290476878741574e-16
USA,Activity,Incineration of waste: Paper,9.21593033735119e-15,7.407907099464314e-15,6.5973477082614565e-15,4.172604986171333e-15,5.852426613384398e-15
USA,Activity,Incineration of waste: Plastic,1.4820311573308356e-14,5.029592969133951e-15,4.937401585603379e-15,3.929655838111228e-15,9.039099875955205e-15
USA,Activity,Incineration of waste: Textiles,1.870408067101516e-15,6.441115791122493e-16,5.936051521123549e-16,3.519546756876941e-16,1.0894069928767614e-15
USA,Activity,Incineration of waste: Wood,1.852132978731364e-15,9.091371466939726e-16,9.527201875196643e-16,1.0421354609184122e-15,1.2539823456256774e-15
USA,Activity,Inland water transport,1.332378369205423e-15,1.182575475295104e-15,9.55922632974246e-16,6.431093932786609e-16,8.413583487891831e-16
USA,Activity,"Insurance and pension funding, except compulsory social security (66)",6.984835676528323e-13,5.547650139832178e-13,5.24897832861922e-13,4.805649756218785e-13,5.398471771017287e-13
USA,Activity,Landfill of waste: Food,1.1572489619799664e-14,4.714140945525697e-15,4.584043516266124e-15,3.154463279014872e-15,7.075807957046953e-15
USA,Activity,Landfill of waste: Inert/metal/hazardous,1.8249439939356467e-14,7.135203791977345e-15,6.8626346634801924e-15,4.913347854694611e-15,1.1096888850077906e-14
USA,Activity,Landfill of waste: Paper,1.4012346522728662e-14,5.52092906254949e-15,5.281242269542185e-15,3.604276287668547e-15,8.491816341531434e-15
USA,Activity,Landfill of waste: Plastic,1.0420712075110453e-14,3.5417262834750024e-15,3.338972553158209e-15,2.282457297525849e-15,6.2405033957045345e-15
USA,Activity,Landfill of waste: Textiles,3.3048559080318084e-15,1.2086175499591563e-15,1.1603883984565479e-15,7.984755530109166e-16,2.0022869225952062e-15
USA,Activity,Landfill of waste: Wood,4.2789771267478275e-15,1.6215489802302865e-15,1.5339069277044105e-15,1.054489365282874e-15,2.5927280232040467e-15
USA,Activity,"Lead, zinc and tin production",4.220997991092315e-16,6.749364307769145e-16,6.863463714108815e-16,3.945189063366281e-16,3.013364045930885e-16
USA,Activity,Manufacture of basic iron and steel and of ferro-alloys and first products thereof,9.728788264062325e-14,9.138103282143543e-14,7.950344754579372e-14,4.667568856497357e-14,6.009141334372392e-14
USA,Activity,Manufacture of beverages,1.2292513271203244e-14,1.3996971802892071e-14,1.3032324673691369e-14,9.281563626553519e-15,9.142113417647583e-15
USA,Activity,"Manufacture of bricks, tiles and construction products, in baked clay",8.705154040771922e-14,5.972182424536949e-15,4.94926992690816e-15,3.0033453447298e-15,4.853311442411093e-14
USA,Activity,"Manufacture of cement, lime and plaster",6.367075571740381e-14,1.1843576891421222e-14,1.1604859605107603e-14,7.76487187474806e-15,3.6902311424264566e-14
USA,Activity,Manufacture of ceramic goods,4.672274381427831e-14,5.486930302182488e-15,6.266597517462378e-15,4.458539200265203e-15,2.730195231804068e-14
USA,Activity,Manufacture of coke oven products,-9.138220277672616e-17,-9.413387719780891e-17,-8.068243197808788e-17,-4.8505022306951797e-17,-5.715839450308856e-17
USA,Activity,Manufacture of electrical machinery and apparatus n.e.c. (31),2.394175136871297e-12,2.0507350194543285e-12,1.4463542300469914e-12,1.197666643786598e-12,1.6160290018968505e-12
USA,Activity,"Manufacture of fabricated metal products, except machinery and equipment (28)",1.139645342241006e-12,7.132222111066652e-13,6.12046534965366e-13,3.8898404430573096e-13,6.930669644128964e-13
USA,Activity,Manufacture of fish products,8.35958256645206e-15,9.986716645766486e-15,9.835012756345868e-15,6.60166657783063e-15,6.085546992419146e-15
USA,Activity,Manufacture of furniture; manufacturing n.e.c. (36),5.137395697399704e-13,2.7183438339341386e-13,2.3395836960327877e-13,1.7932361553001343e-13,3.176180731808562e-13
USA,Activity,Manufacture of gas; distribution of gaseous fuels through mains,2.632379619492166e-13,2.6696664721772135e-14,2.293969318389153e-14,1.594399746447882e-14,1.4825175402400666e-13
USA,Activity,Manufacture of glass and glass products,6.434115264616863e-12,1.4001537529223906e-13,1.0453385645432162e-13,5.728503770188607e-14,3.558130618284426e-12
USA,Activity,Manufacture of machinery and equipment n.e.c. (29),8.384667522981942e-13,5.289151290423033e-13,4.344538611439782e-13,2.897976791156926e-13,5.145389728176028e-13
USA,Activity,"Manufacture of medical, precision and optical instruments, watches and clocks (33)",1.7214149856795302e-13,2.7052448621608867e-13,1.9341346836938902e-13,1.3902824639085146e-13,1.2311913263405713e-13
USA,Activity,"Manufacture of motor vehicles, trailers and semi-trailers (34)",2.580815035328854e-13,1.2345637115763035e-13,1.0557966214873161e-13,7.094667528081001e-14,1.5917453471342702e-13
USA,Activity,Manufacture of office machinery and computers (30),1.71297360579968e-14,2.1042486116523763e-14,1.4610898149830178e-14,1.0318700760003532e-14,1.1401135128903368e-14
USA,Activity,Manufacture of other non-metallic mineral products n.e.c.,7.619839302595235e-13,4.0996482324582466e-14,4.711789771297215e-14,2.5436475645776308e-14,4.24843349492935e-13
USA,Activity,Manufacture of other transport equipment (35),3.5779972637221044e-13,3.770082314126849e-13,3.125476060182033e-13,2.0992339073334442e-13,2.469716397709271e-13
USA,Activity,"Manufacture of radio, television and communication equipment and apparatus (32)",2.031987046031089e-13,2.312496618255527e-13,1.5130364016817535e-13,1.1371767328356155e-13,1.3201875766800031e-13
USA,Activity,Manufacture of rubber and plastic products (25),6.069858603872775e-13,3.0499756556855353e-13,2.689800928234086e-13,1.7551049708506892e-13,3.6961766543223956e-13
USA,Activity,Manufacture of textiles (17),2.0966188005276026e-13,1.1197958736361723e-13,9.732646960746384e-14,6.273881612169765e-14,1.2604919718846961e-13
USA,Activity,Manufacture of tobacco products (16),3.873258641140339e-16,3.919601375016797e-16,3.1287108236010966e-16,1.9904425991484483e-16,2.44325380714776e-16
USA,Activity,Manufacture of wearing apparel; dressing and dyeing of fur (18),8.930901533281975e-15,5.634782079520683e-15,5.0086287933399445e-15,3.649138202221678e-15,5.797726428453025e-15
USA,Activity,"Manufacture of wood and of products of wood and cork, except furniture; manufacture of articles of straw and plaiting materials (20)",1.5177485084804172e-13,6.262303850756421e-14,5.955941692215748e-14,3.7203458680558745e-14,9.085792454371841e-14
USA,Activity,"Manure treatment (biogas), storage and land application",0.0,0.0,0.0,0.0,0.0
USA,Activity,"Manure treatment (conventional), storage and land application",0.0,0.0,0.0,0.0,0.0
USA,Activity,Meat animals nec,4.114983638131655e-15,1.968855286361576e-15,1.8133586073222643e-15,1.2401914002979937e-15,2.5440466603249947e-15
USA,Activity,Mining of aluminium ores and concentrates,-3.7855164093985525e-16,-1.3571871588669387e-17,-1.0319166318433169e-17,-6.013939633589728e-18,-2.097294709376985e-16
USA,Activity,"Mining of chemical and fertilizer minerals, production of salt, other mining and quarrying n.e.c.",1.3882339167354682e-13,8.246279735843798e-14,9.037199597859522e-14,4.543814975311698e-14,8.124547200724811e-14
USA,Activity,Mining of coal and lignite; extraction of peat (10),2.9947464009098206e-12,2.641115435783856e-13,2.604042936489196e-13,2.1122293333278455e-13,1.7076542364618709e-12
USA,Activity,Mining of copper ores and concentrates,5.202306357287381e-13,2.884218325716286e-13,2.0767759449503233e-13,1.261527431975489e-13,3.0353688843494074e-13
USA,Activity,Mining of iron ores,2.015645399712569e-16,1.0558506328227883e-16,9.278381017552678e-17,5.598302251172835e-17,1.1965812949700367e-16
USA,Activity,"Mining of lead, zinc and tin ores and concentrates",-6.940065521612715e-16,-5.18550811268174e-16,-4.701076225597628e-16,-2.6861999109493417e-16,-4.22083846428359e-16
USA,Activity,Mining of nickel ores and concentrates,0.0,0.0,0.0,0.0,0.0
USA,Activity,Mining of other non-ferrous metal ores and concentrates,5.870825780132945e-17,7.476333368944626e-17,6.525898240436458e-17,4.3253790318315306e-17,4.0282106794859196e-17
USA,Activity,Mining of precious metal ores and concentrates,1.3131592733158452e-11,7.017867343297133e-13,5.407035291344983e-13,3.333088088948466e-13,7.305149512582146e-12
USA,Activity,Mining of uranium and thorium ores (12),7.54806283746971e-14,3.6557414701776464e-14,3.0612552706881896e-14,1.9114161226479374e-14,4.421621945299309e-14
USA,Activity,N-fertiliser,2.519183555129268e-16,6.724295134251919e-17,5.3529873171278564e-17,3.866420799605284e-17,1.4586940039078794e-16
USA,Activity,Other business activities (74),1.125300694944403e-11,7.037581655742711e-12,6.375890289329484e-12,5.565558201123428e-12,7.655209242799956e-12
USA,Activity,Other land transport,8.226838512220473e-13,2.149740711473745e-13,1.924845552085595e-13,1.4445848910183526e-13,5.048824541497357e-13
USA,Activity,Other non-ferrous metal production,-2.376806054544272e-16,-3.4453809073119e-16,-3.026229343035173e-16,-1.9691142306708703e-16,-1.6456827482909057e-16
USA,Activity,Other service activities (93),1.8724008367662153e-13,7.714004311225905e-14,6.851128019600771e-14,6.448314995899615e-14,1.1729963584859013e-13
USA,Activity,P- and other fertiliser,5.633376743811193e-14,2.4248503582554214e-14,2.1194333563566467e-14,1.502202481451307e-14,3.3400486332944976e-14
USA,Activity,Paper,3.6044306426988573e-13,1.1322289029597262e-13,9.555659597185513e-14,6.727828447140424e-14,2.1218479878427972e-13
USA,Activity,Petroleum Refinery,5.447133834101745e-14,2.966307456322828e-14,2.737903703056483e-14,3.6726040578966095e-14,3.9585537971407245e-14
USA,Activity,Pigs farming,4.891024495148692e-15,2.4443799066749183e-15,2.1038882615028773e-15,1.4326306717522806e-15,2.982191076507763e-15
USA,Activity,"Plastics, basic",4.690182405177057e-14,3.5577778708328804e-14,2.778689290141553e-14,1.8144868513264273e-14,2.92585215904345e-14
USA,Activity,Post and telecommunications (64),1.4701902466208296e-12,7.541088985737488e-13,6.822485812806972e-13,5.997256723062518e-13,9.767516648460454e-13
USA,Activity,Poultry farming,5.7396172286191815e-15,4.137414838577231e-15,3.68230451237863e-15,2.4947484094515366e-15,3.62167998574136e-15
USA,Activity,Precious metals production,1.0221685815633394e-12,4.577839404654148e-14,3.663918538080746e-14,2.2521677325464612e-14,5.682868412127267e-13
USA,Activity,Private households with employed persons (95),2.2687112012815198e-13,2.773962378172343e-13,2.445257602684527e-13,1.826759211865252e-13,1.665600421566512e-13
USA,Activity,Processed rice,9.282673504277887e-17,7.875321292502744e-17,7.021181069315828e-17,4.6800643782122945e-17,5.958614163520589e-17
USA,Activity,Processing of Food products nec,1.2255424512511695e-13,7.012920572986794e-14,6.228628321649005e-14,4.166375255538821e-14,7.559054788956181e-14
USA,Activity,Processing of dairy products,1.979617682791934e-14,1.9115557415717987e-14,1.2038747409054018e-14,7.96909240370271e-15,1.1968436933122255e-14
USA,Activity,Processing of meat cattle,2.691185670287271e-15,1.7741456712423406e-15,1.6159623466487703e-15,1.1130260111766188e-15,1.7156263815877992e-15
USA,Activity,Processing of meat pigs,5.535114727252117e-15,2.7384741371019863e-15,2.334474679588859e-15,1.5903382556057423e-15,3.3702092401756136e-15
USA,Activity,Processing of meat poultry,8.141549241458977e-15,5.865105561055735e-15,5.263452140321945e-15,3.604129483709208e-15,5.1822130432376024e-15
USA,Activity,Processing of nuclear fuel,-1.0700202675544678e-15,-7.1267142108599655e-16,-4.2290583071884695e-16,-2.6908053881906263e-16,-6.165130010924657e-16
USA,Activity,Processing vegetable oils and fats,-2.689358689163193e-17,-1.578550790994479e-17,-1.4110227652075233e-17,-9.24416465115571e-18,-1.6400195856948304e-17
USA,Activity,Production of electricity by Geothermal,-2.9940882213410353e-14,-1.4428873133252183e-16,-1.2625074687395853e-16,-8.606509606249423e-17,-1.6551318630350128e-14
USA,Activity,Production of electricity by biomass and waste,2.0013475785262076e-13,1.0482454394696974e-15,9.111186348095e-16,6.1565412167544965e-16,1.1063606658609915e-13
USA,Activity,Production of electricity by coal,3.3504087685135947e-12,4.0588774840022707e-14,3.4737726211262906e-14,2.3589017074943958e-14,1.8545103035271645e-12
USA,Activity,Production of electricity by gas,4.123519252294876e-12,1.89084574354211e-14,1.619815536060928e-14,1.0969786901434279e-14,2.2791081700735236e-12
USA,Activity,Production of electricity by hydro,6.472671818417188e-13,4.411923964675091e-15,3.8175441678479284e-15,2.603436089747639e-15,3.5793740766204e-13
USA,Activity,Production of electricity by nuclear,1.9448165075375963e-12,1.3177773207289605e-14,1.128853931222286e-14,7.652080276578163e-15,1.0753878767984432e-12
USA,Activity,Production of electricity by petroleum and other oil derivatives,5.767126906535573e-15,3.2280492090506127e-17,2.8223727717042025e-17,1.924585746799642e-17,3.1885757838568765e-15
USA,Activity,Production of electricity by solar photovoltaic,-4.816676867992536e-13,-2.0044666434431454e-16,-1.77572609737899e-16,-1.1850595911268269e-16,-2.66011309700996e-13
USA,Activity,Production of electricity by solar thermal,-9.046154417152332e-15,-1.19134860784227e-17,-1.0443199226836717e-17,-7.033315932662985e-18,-4.9969749370822594e-15
USA,Activity,"Production of electricity by tide, wave, ocean",0.0,0.0,0.0,0.0,0.0
USA,Activity,Production of electricity by wind,7.024247342601812e-13,1.2436621700160314e-15,1.0675870471042953e-15,7.072741202022629e-16,3.880229534118766e-13
USA,Activity,Production of electricity nec,-9.080336758709332e-15,-4.828958181746508e-17,-4.215980646493846e-17,-2.85429612787769e-17,-5.020503792194626e-15
USA,Activity,Production of meat products nec,1.9443751428393813e-15,1.1322821212283514e-15,9.10323512653703e-16,5.940578861367575e-16,1.1637798367060322e-15
USA,Activity,Production of offshore wind plants,0.0,0.0,0.0,0.0,0.0
USA,Activity,Production of onshore wind plants,0.0,0.0,0.0,0.0,0.0
USA,Activity,Production of photovoltaic plants,0.0,0.0,0.0,0.0,0.0
USA,Activity,Public administration and defence; compulsory social security (75),1.1310355193692905e-12,7.138380111289176e-14,6.329138237067488e-14,4.846628472086555e-14,6.368952602470509e-13
USA,Activity,"Publishing, printing and reproduction of recorded media (22)",1.7899579095473754e-13,1.149963398661919e-13,1.0349200611914439e-13,9.108026705288281e-14,1.230329976586679e-13
USA,Activity,Pulp,3.6164619969126485e-15,1.973910107038249e-15,1.4549365374662758e-15,1.0246227714271164e-15,2.1700518533182226e-15
USA,Activity,Quarrying of sand and clay,2.0337778349256876e-14,2.3294614926932582e-15,2.054923238766111e-15,1.2539480703138563e-15,1.1464121910232864e-14
USA,Activity,Quarrying of stone,1.2013634450398964e-14,1.81199095269451e-15,2.4572087562753828e-15,1.4023993547785405e-15,6.933038725827024e-15
USA,Activity,Raw milk,6.899268000251712e-15,6.656473160609939e-15,4.193644774224127e-15,2.7763773727753626e-15,4.171349851482011e-15
USA,Activity,Re-processing of ash into clinker,0.0,0.0,0.0,0.0,0.0
USA,Activity,Re-processing of secondary aluminium into new aluminium,0.0,0.0,0.0,0.0,0.0
USA,Activity,Re-processing of secondary construction material into aggregates,0.0,0.0,0.0,0.0,0.0
USA,Activity,Re-processing of secondary copper into new copper,0.0,0.0,0.0,0.0,0.0
USA,Activity,Re-processing of secondary glass into new glass,0.0,0.0,0.0,0.0,0.0
USA,Activity,"Re-processing of secondary lead into new lead, zinc and tin",0.0,0.0,0.0,0.0,0.0
USA,Activity,Re-processing of secondary other non-ferrous metals into new other non-ferrous metals,0.0,0.0,0.0,0.0,0.0
USA,Activity,Re-processing of secondary paper into new pulp,0.0,0.0,0.0,0.0,0.0
USA,Activity,Re-processing of secondary plastic into new plastic,0.0,0.0,0.0,0.0,0.0
USA,Activity,Re-processing of secondary preciuos metals into new preciuos metals,0.0,0.0,0.0,0.0,0.0
