Region,,,EU27+UK,EU27+UK,EU27+UK,EU27+UK,EU27+UK
Level,,,Activity,Activity,Activity,Activity,Activity
Item,,,Production of photovoltaic plants,Production of onshore wind plants,Production of offshore wind plants,Production of electricity by wind,Production of electricity by solar photovoltaic
Region,Level,Item,,,,,
China,Activity,Activities auxiliary to financial intermediation (67),8.445871010918438e-12,4.467837418475341e-12,2.3088525729618896e-12,1.4367320463940033e-12,4.745686352248975e-12
China,Activity,Activities of membership organisation n.e.c. (91),2.1854303220968063e-14,3.2170583179558742e-15,1.7956862606556914e-15,1.0866722182381555e-15,1.2151789629444295e-14
China,Activity,Air transport (62),9.297610465154727e-12,4.4187749129313215e-12,2.319077846548762e-12,1.4780402186486055e-12,5.2477679546207355e-12
China,Activity,Aluminium production,2.9887127578886976e-12,2.490936270853897e-12,1.2006127251669237e-12,7.497684182459792e-13,1.6791161946294532e-12
China,Activity,Animal products nec,1.0656944468906239e-12,3.6230170960200757e-13,2.117818480326521e-13,1.3152611341569512e-13,6.017957421193878e-13
China,Activity,"Biogasification of food waste, incl. land application",0.0,0.0,0.0,0.0,0.0
China,Activity,"Biogasification of paper, incl. land application",0.0,0.0,0.0,0.0,0.0
China,Activity,"Biogasification of sewage slugde, incl. land application",0.0,0.0,0.0,0.0,0.0
China,Activity,Casting of metals,4.713163655542835e-13,1.959068811343352e-12,8.867874878688217e-13,5.592697973239198e-13,2.7485326478772414e-13
China,Activity,Cattle farming,6.838508376394992e-12,2.350882640722854e-12,1.3603363970965748e-12,8.281469407847336e-13,3.8466175244765706e-12
China,Activity,Chemicals nec,4.3789133205829473e-11,8.973546785934373e-12,5.426439989852996e-12,3.456221860168632e-12,2.4485552455926656e-11
China,Activity,"Collection, purification and distribution of water (41)",8.33982808329197e-14,1.7859818131291664e-14,9.662509182922824e-15,5.839858721405122e-15,4.638220693408668e-14
China,Activity,"Composting of food waste, incl. land application",1.6311153141413169e-13,2.2260953139467188e-14,1.3193618749450024e-14,8.019922045204439e-15,9.094438063290734e-14
China,Activity,"Composting of paper and wood, incl. land application",1.4771584353382727e-14,2.1774574726990877e-15,1.2617059831487352e-15,7.528230440050748e-16,8.233529727898592e-15
China,Activity,Computer and related activities (72),1.3195741248171086e-12,9.13483795201866e-13,5.0567849257097e-13,2.9993219662084716e-13,7.441508181306367e-13
China,Activity,Construction (45),3.150462947930213e-12,6.093331063039991e-13,3.6217939697029034e-13,2.5418277015539775e-13,1.8018891793387467e-12
China,Activity,Copper production,4.0194478576426103e-13,2.1893948059735342e-12,9.909274000924895e-13,6.267777804635625e-13,2.394414364896361e-13
China,Activity,Cultivation of cereal grains nec,1.1281366795874057e-10,2.4493455987128778e-11,1.3935342145154207e-11,8.375221932403507e-12,6.308635139141567e-11
China,Activity,Cultivation of crops nec,9.169434897258787e-11,2.672963481917073e-11,1.512769263439773e-11,9.297996023722667e-12,5.1383942460637505e-11
China,Activity,Cultivation of oil seeds,1.3706062127103452e-12,6.98163275818193e-13,3.773999933553626e-13,2.3842502368383153e-13,7.751177522769098e-13
China,Activity,Cultivation of paddy rice,4.8045621830858746e-11,1.6439794261922952e-11,8.847946084845221e-12,5.571125638458723e-12,2.6931310018411038e-11
China,Activity,Cultivation of plant-based fibers,6.710915194454394e-11,4.243008903237946e-11,2.407425819290576e-11,1.5005474249627163e-11,3.8395920007999174e-11
China,Activity,"Cultivation of sugar cane, sugar beet",2.1137431244044645e-11,8.038131782990103e-12,4.26189802672144e-12,2.6078947467578474e-12,1.1848707469350204e-11
China,Activity,"Cultivation of vegetables, fruit, nuts",5.642084704583036e-10,1.6109686837882772e-10,9.051444990187631e-11,5.4916344022266454e-11,3.1615701419749575e-10
China,Activity,Cultivation of wheat,3.944874222281325e-11,1.623904454881975e-11,8.857595100855812e-12,5.505927026435042e-12,2.2209827953572117e-11
China,Activity,Distribution and trade of electricity,6.967074320254417e-15,1.8582294556892995e-15,1.0887157808725932e-15,6.231769601835627e-16,3.877605061428962e-15
China,Activity,Education (80),1.903452161805852e-13,8.343397745051596e-14,4.25742128391044e-14,2.6380431851446316e-14,1.0656592498601256e-13
China,Activity,Extra-territorial organizations and bodies,0.0,0.0,0.0,0.0,0.0
China,Activity,"Extraction of crude petroleum and services related to crude oil extraction, excluding surveying",3.3947917859927147e-12,1.1663800913221318e-12,6.57836842845288e-13,4.051320824283914e-13,1.9069008834553715e-12
China,Activity,"Extraction of natural gas and services related to natural gas extraction, excluding surveying",9.242124007021067e-14,6.65093239646039e-14,3.5164763629892407e-14,2.2252384306452125e-14,5.255947989410665e-14
China,Activity,"Extraction, liquefaction, and regasification of other petroleum and gaseous materials",0.0,0.0,0.0,0.0,0.0
China,Activity,"Financial intermediation, except insurance and pension funding (65)",4.281771792951247e-11,1.8045237627743517e-11,9.044117898059676e-12,5.646921202101606e-12,2.3931886951411044e-11
China,Activity,"Fishing, operating of fish hatcheries and fish farms; service activities incidental to fishing (05)",2.05230699984631e-11,1.4101267098705341e-11,7.308805857808374e-12,4.5500988261292925e-12,1.1607390157680597e-11
China,Activity,"Forestry, logging and related service activities (02)",3.551442247690186e-11,1.4697158923153657e-11,8.255714486595015e-12,5.215383259954419e-12,2.0043063475633634e-11
China,Activity,Health and social work (85),2.421778159921098e-12,1.0627917869085107e-12,5.050812919363256e-13,3.153186113358724e-13,1.3482418654323516e-12
China,Activity,Hotels and restaurants (55),2.0787644171862734e-10,1.1074891243587167e-10,5.989699913559685e-11,3.607926549370374e-11,1.1673356670531075e-10
China,Activity,Incineration of waste: Food,7.677950506903325e-13,1.305518267793603e-13,7.393342565006281e-14,4.452039798221109e-14,4.2790135234355343e-13
China,Activity,Incineration of waste: Metals and Inert materials,1.0379949037634828e-13,1.5227252799322044e-14,1.0624252066312277e-14,6.954493038439012e-15,5.847241252886864e-14
China,Activity,Incineration of waste: Oil/Hazardous waste,1.7202078615802548e-13,3.0283579003816014e-14,1.8020721134721922e-14,1.1070918367298542e-14,9.613400377029623e-14
China,Activity,Incineration of waste: Paper,8.073246466500007e-13,1.385875054866985e-13,7.826789463144707e-14,4.713736441867863e-14,4.4992956987633745e-13
China,Activity,Incineration of waste: Plastic,1.267018927103278e-13,1.760272565419823e-14,1.0364436294882679e-14,6.259559988351679e-15,7.062834473448159e-14
China,Activity,Incineration of waste: Textiles,1.4902302852109293e-13,2.5894196897739e-14,1.4676410596948055e-14,8.843194482299044e-15,8.308212787171179e-14
China,Activity,Incineration of waste: Wood,1.7212438251357873e-13,3.143783503861921e-14,1.7711094798626826e-14,1.0805225219085991e-14,9.600846196662372e-14
China,Activity,Inland water transport,3.0682864017443465e-13,1.5222101259419142e-13,7.959034326653537e-14,4.918396817491091e-14,1.724761834721309e-13
China,Activity,"Insurance and pension funding, except compulsory social security (66)",8.076840372066585e-12,3.2726759350518683e-12,1.6839200118206221e-12,1.0509940796167986e-12,4.535524804231684e-12
China,Activity,Landfill of waste: Food,2.52088603666477e-12,3.9704844142381865e-13,2.259141024756605e-13,1.3575159723393705e-13,1.404347887079099e-12
China,Activity,Landfill of waste: Inert/metal/hazardous,9.29593282447653e-13,1.6863255768850906e-13,9.48007993832059e-14,5.725802163749601e-14,5.182186920515024e-13
China,Activity,Landfill of waste: Paper,1.127085289538279e-12,1.874279593612622e-13,1.0627078602087976e-13,6.393924496671702e-14,6.280335117935549e-13
China,Activity,Landfill of waste: Plastic,8.446690628084622e-13,1.368994132630863e-13,7.79667487395261e-14,4.676410901042068e-14,4.70640212091456e-13
China,Activity,Landfill of waste: Textiles,3.5690381355944616e-13,5.80355121173904e-14,3.309956899346247e-14,1.986416148020394e-14,1.9888334446550501e-13
China,Activity,Landfill of waste: Wood,4.3060073468747487e-13,7.186927821206634e-14,4.0847229125536255e-14,2.453289173954181e-14,2.399733543513688e-13
China,Activity,"Lead, zinc and tin production",7.419564408307391e-14,9.206064269179758e-14,4.5012282360856294e-14,2.8327664481643543e-14,4.237687173226676e-14
China,Activity,Manufacture of basic iron and steel and of ferro-alloys and first products thereof,5.269659866684747e-12,1.639110696598887e-11,7.981100568047604e-12,4.956497098519637e-12,3.099175549847201e-12
China,Activity,Manufacture of beverages,7.548229114858416e-13,5.628465446584245e-13,2.8611063031813266e-13,1.7725931982412647e-13,4.259413553131286e-13
China,Activity,"Manufacture of bricks, tiles and construction products, in baked clay",1.2861648266428033e-14,6.246402844833059e-15,6.140452374680116e-15,4.000641710166259e-15,7.893800506722695e-15
China,Activity,"Manufacture of cement, lime and plaster",1.2801506906124852e-13,3.288915867507918e-14,4.064421151394081e-14,2.6838562776417573e-14,7.861363594389869e-14
China,Activity,Manufacture of ceramic goods,4.574143256094251e-13,1.5866879540902498e-13,1.6295052852931108e-13,1.1188606974392263e-13,2.861631359852438e-13
China,Activity,Manufacture of coke oven products,5.527423198237795e-13,8.863324263415651e-13,4.442666824858059e-13,2.7288334603175617e-13,3.162868671537413e-13
China,Activity,Manufacture of electrical machinery and apparatus n.e.c. (31),4.114290526948063e-11,4.069211299065178e-10,1.76510622821287e-10,1.1209374314354799e-10,2.465272811872282e-11
China,Activity,"Manufacture of fabricated metal products, except machinery and equipment (28)",1.3245994699306017e-11,1.6941339616886433e-11,9.0624116466889e-12,5.546571599538269e-12,7.608534568424914e-12
China,Activity,Manufacture of fish products,1.864343098804868e-12,1.376082584586749e-12,7.050124339559329e-13,4.395386070544108e-13,1.0553403493740388e-12
China,Activity,Manufacture of furniture; manufacturing n.e.c. (36),2.4468724852681354e-11,2.2326098100490568e-11,1.136645739972875e-11,7.255133479659383e-12,1.388444347698994e-11
China,Activity,Manufacture of gas; distribution of gaseous fuels through mains,1.1606794270336723e-12,4.4820805823370023e-13,2.4935572982025973e-13,1.448855735131405e-13,6.469837701438123e-13
China,Activity,Manufacture of glass and glass products,1.6403421993229923e-10,1.6148431442363196e-12,1.1868452038238397e-12,6.45535799512032e-13,9.063359939900041e-11
China,Activity,Manufacture of machinery and equipment n.e.c. (29),4.4383517039091755e-11,4.871478326445937e-11,2.5984963433342073e-11,1.5951492116361506e-11,2.538020388592294e-11
China,Activity,"Manufacture of medical, precision and optical instruments, watches and clocks (33)",5.367979407799388e-12,1.2118856421671234e-11,6.4765425862378335e-12,4.787751141954346e-12,3.708879513081392e-12
China,Activity,"Manufacture of motor vehicles, trailers and semi-trailers (34)",6.51913127827934e-12,1.66089011025558e-12,9.791233999306094e-13,6.028483710410462e-13,3.657971216408589e-12
China,Activity,Manufacture of office machinery and computers (30),2.218196100538261e-11,2.380652637395997e-11,1.356659899802037e-11,8.98464846556909e-12,1.3327636322690298e-11
China,Activity,Manufacture of other non-metallic mineral products n.e.c.,6.038123475821604e-11,1.9567275941755448e-12,1.110342031353054e-12,6.652642685191443e-13,3.3387488567558214e-11
China,Activity,Manufacture of other transport equipment (35),1.6725772735420693e-12,6.955945067805238e-13,3.9054695159405504e-13,2.430589517589044e-13,9.475168293639072e-13
China,Activity,"Manufacture of radio, television and communication equipment and apparatus (32)",2.6312962234001403e-11,8.296501188550179e-11,4.251928432577037e-11,2.929602887707153e-11,1.7352069724657003e-11
China,Activity,Manufacture of rubber and plastic products (25),4.969086054844292e-11,4.019665320256989e-11,2.1215852245935005e-11,1.334467870648363e-11,2.8368094032319432e-11
China,Activity,Manufacture of textiles (17),6.101247392229996e-11,4.0324231678429805e-11,2.187274797832632e-11,1.3692232885045885e-11,3.4778284749968537e-11
China,Activity,Manufacture of tobacco products (16),3.9499941779268824e-13,1.571373871923379e-13,8.267725650549317e-14,4.930404659646603e-14,2.1997980761838163e-13
China,Activity,Manufacture of wearing apparel; dressing and dyeing of fur (18),4.4826641859695346e-11,1.84634184723515e-11,9.873052318439685e-12,6.120275192782588e-12,2.5239577613956838e-11
China,Activity,"Manufacture of wood and of products of wood and cork, except furniture; manufacture of articles of straw and plaiting materials (20)",2.368899742921371e-13,1.5360922179910393e-13,1.844322702803813e-13,1.067427673691738e-13,1.5314735255121133e-13
China,Activity,"Manure treatment (biogas), storage and land application",0.0,0.0,0.0,0.0,0.0
China,Activity,"Manure treatment (conventional), storage and land application",0.0,0.0,0.0,0.0,0.0
China,Activity,Meat animals nec,2.0042751438016184e-10,9.538983117917003e-12,7.284692735616e-12,3.8827992550303575e-12,1.1172517732285217e-10
China,Activity,Mining of aluminium ores and concentrates,1.4338917995282953e-13,7.67812011852417e-14,5.028455069120417e-14,2.888770159899515e-14,8.115657935927631e-14
China,Activity,"Mining of chemical and fertilizer minerals, production of salt, other mining and quarrying n.e.c.",5.219833018657107e-13,2.3100072944221837e-13,2.337158303780669e-13,1.1901499246962914e-13,3.0003460118447777e-13
China,Activity,Mining of coal and lignite; extraction of peat (10),2.798365662177732e-12,2.9561036784431336e-12,1.5292780092886805e-12,9.390519832149959e-13,1.5937443878181607e-12
China,Activity,Mining of copper ores and concentrates,5.297042084946843e-12,1.3419240696190446e-11,6.514626777579343e-12,3.9702804034055015e-12,3.0357505631530225e-12
China,Activity,Mining of iron ores,1.043678148955735e-12,3.1585622538992114e-12,1.5822411937854571e-12,9.715642594807873e-13,6.151877758748052e-13
China,Activity,"Mining of lead, zinc and tin ores and concentrates",4.175753276502138e-13,1.9453139895879386e-13,1.3577311750227084e-13,7.132091877518182e-14,2.335716360944517e-13
China,Activity,Mining of nickel ores and concentrates,1.3795339956374577e-12,8.745824088001545e-13,2.432462207797316e-12,8.379101921596393e-13,7.812011790673257e-13
China,Activity,Mining of other non-ferrous metal ores and concentrates,5.730601478095574e-13,4.3461405924554454e-13,1.1240031362436777e-12,3.9201397496305837e-13,3.2561566699466115e-13
China,Activity,Mining of precious metal ores and concentrates,2.454685956046562e-10,1.8118604619205806e-11,8.860182419303944e-12,5.412803213879429e-12,1.3572155930837606e-10
China,Activity,Mining of uranium and thorium ores (12),1.5210769337528868e-12,2.0388821107754644e-12,9.982926594870274e-13,6.45580473225198e-13,8.786069412882413e-13
China,Activity,N-fertiliser,4.905686617172284e-15,1.8997016672511544e-15,1.1481047147400875e-15,2.0905055544709734e-15,2.785814158277912e-15
China,Activity,Other business activities (74),1.6804283762096184e-11,1.1468237102658998e-11,5.677651056775399e-12,3.5373393219369857e-12,9.448885926163594e-12
China,Activity,Other land transport,1.5649981537723324e-11,6.050119078993377e-12,3.29141044209076e-12,2.0102670751682925e-12,8.823247702936253e-12
China,Activity,Other non-ferrous metal production,2.044261574038199e-13,1.7942300152169332e-13,5.295122226639798e-13,1.8063369909550496e-13,1.1701705463488574e-13
China,Activity,Other service activities (93),4.768059697531732e-12,5.258152710802003e-13,3.1320248028129374e-13,1.817263248665076e-13,2.6569649238048343e-12
China,Activity,P- and other fertiliser,1.8711147712494407e-12,6.376822794748025e-13,3.818504113472776e-13,2.4192776437153646e-13,1.0562148638030108e-12
China,Activity,Paper,7.485458979544242e-12,2.7654209861766604e-12,1.5207915963854475e-12,9.769982760948125e-13,4.218926597035509e-12
China,Activity,Petroleum Refinery,4.563497575304878e-12,1.3835363036718104e-12,7.869722535742929e-13,4.819731178318703e-13,2.5607370457998254e-12
China,Activity,Pigs farming,1.1167088024479728e-09,5.170992281183447e-11,4.007367523454931e-11,2.124034597014634e-11,6.224483957082024e-10
China,Activity,"Plastics, basic",1.9916102854310506e-13,2.1149660843629538e-13,1.0942524978599709e-13,6.938805700536555e-14,1.1469718493653355e-13
China,Activity,Post and telecommunications (64),5.749462868363635e-12,6.717445514696376e-12,3.3915401431357265e-12,2.118372528903791e-12,3.2892642154986098e-12
China,Activity,Poultry farming,1.0794953774005666e-10,2.5235948291080614e-11,1.4322639360771937e-11,8.489327153626478e-12,6.031638807524852e-11
China,Activity,Precious metals production,2.880533099034777e-12,2.0631862114157525e-13,9.39626356656101e-14,5.963720024966237e-14,1.5925693834359463e-12
China,Activity,Private households with employed persons (95),3.109371100311258e-15,2.5737202165252613e-15,2.1402331674006582e-15,1.4531535923413842e-15,2.021693491127915e-15
China,Activity,Processed rice,2.4184910427470093e-14,9.82174400326465e-15,5.2220303848933185e-15,3.280018880275043e-15,1.3574229861642703e-14
China,Activity,Processing of Food products nec,3.4275404298419836e-11,7.246680396245257e-12,4.13219148959359e-12,2.4801413101734805e-12,1.916543946648767e-11
China,Activity,Processing of dairy products,4.49132828368401e-14,1.5045336939584103e-14,8.179628413670813e-15,5.007808927501946e-15,2.5171847481882484e-14
China,Activity,Processing of meat cattle,8.257814452775285e-15,3.396887334102648e-15,1.8521182759077254e-15,1.1140473172778886e-15,4.626285468034992e-15
China,Activity,Processing of meat pigs,9.355192260550882e-15,3.1692009202659847e-15,1.755836964909805e-15,1.0567389305172937e-15,5.233300784990298e-15
China,Activity,Processing of meat poultry,1.1638727364518843e-12,3.8638757992146963e-13,2.1304666052557693e-13,1.280959121521493e-13,6.505664049719133e-13
China,Activity,Processing of nuclear fuel,-6.902301036234192e-17,-4.973974589685419e-17,-2.953370591175044e-17,-1.9867135340607556e-17,-4.049876546651525e-17
China,Activity,Processing vegetable oils and fats,2.0465924511361e-15,5.994474252711261e-16,3.2985395629144493e-16,2.0718154358802323e-16,1.1459680292169902e-15
China,Activity,Production of electricity by Geothermal,-1.1317539756880695e-15,-1.0772613234164817e-16,-6.094226345503739e-17,-3.560134578400436e-17,-6.267479652792774e-16
China,Activity,Production of electricity by biomass and waste,6.091253786674523e-13,1.0012616611144531e-15,1.1179579412823434e-15,5.035860725569553e-16,3.364104556839724e-13
China,Activity,Production of electricity by coal,5.093916498521299e-11,2.710151554827648e-12,1.660355529032371e-12,9.331048713923117e-13,2.8174976876012333e-11
China,Activity,Production of electricity by gas,3.2160033785236177e-12,1.0348081448197103e-13,6.196398977981864e-14,3.510540103786433e-14,1.7776287410038905e-12
China,Activity,Production of electricity by hydro,8.723930266893226e-12,4.886257892490823e-13,2.780850619039933e-13,1.6101220343854333e-13,4.8247519611412875e-12
China,Activity,Production of electricity by nuclear,4.117135014440955e-12,1.4936098198877813e-13,8.332926616997904e-14,4.884313344107237e-14,2.2758181005692222e-12
China,Activity,Production of electricity by petroleum and other oil derivatives,4.708225301425968e-14,8.941480109841325e-15,4.7479268088812544e-15,2.8870214414695578e-15,2.6144944837128015e-14
China,Activity,Production of electricity by solar photovoltaic,1.4952338539875317e-12,1.3376711750563974e-16,1.1687655250821534e-16,6.43684759218648e-17,8.257042044965523e-13
China,Activity,Production of electricity by solar thermal,1.0027416617892086e-15,2.993622918150792e-19,1.8218646119040487e-19,1.083710223167214e-19,5.537406922332147e-16
China,Activity,"Production of electricity by tide, wave, ocean",-1.0819082558764461e-16,-1.558285274162029e-17,-8.611064158774812e-18,-5.1318799285631586e-18,-6.001158882243815e-17
China,Activity,Production of electricity by wind,1.1103050456959452e-11,1.1504519839950709e-14,8.306499760681111e-15,4.472462890776597e-15,6.131705726503516e-12
China,Activity,Production of electricity nec,2.7712948655096155e-14,1.0035690560006317e-14,5.559065518768385e-15,3.2656166404318396e-15,1.5454752895342836e-14
China,Activity,Production of meat products nec,2.2198384825528613e-12,8.292932819477033e-13,4.559817529894981e-13,2.8132632071424585e-13,1.2480257965871401e-12
China,Activity,Production of offshore wind plants,0.0,0.0,0.0,0.0,0.0
China,Activity,Production of onshore wind plants,0.0,0.0,0.0,0.0,0.0
China,Activity,Production of photovoltaic plants,0.0,0.0,0.0,0.0,0.0
China,Activity,Public administration and defence; compulsory social security (75),1.5675033738596538e-12,7.467710699223422e-13,3.880008784902789e-13,2.401811583120518e-13,8.797583662811523e-13
China,Activity,"Publishing, printing and reproduction of recorded media (22)",1.1589999379915452e-11,6.081838451993745e-12,3.193158214952267e-12,2.0305983432966815e-12,6.544256165251131e-12
China,Activity,Pulp,1.7453356146419675e-15,6.923656823921802e-16,3.9832230959017336e-16,2.5978213032395063e-16,9.901752016251145e-16
China,Activity,Quarrying of sand and clay,4.961299079474161e-13,1.9764806009507368e-13,1.0817320595118006e-13,6.655555754919485e-14,2.788501190592587e-13
China,Activity,Quarrying of stone,3.528922115377056e-14,1.1142817921867247e-15,7.619170098417194e-16,4.258112366717477e-16,1.952022412245342e-14
China,Activity,Raw milk,8.904109642253724e-12,2.389113314145604e-12,1.3221977924567682e-12,8.060208799409876e-13,4.9893558783818166e-12
China,Activity,Re-processing of ash into clinker,0.0,0.0,0.0,0.0,0.0
China,Activity,Re-processing of secondary aluminium into new aluminium,0.0,0.0,0.0,0.0,0.0
China,Activity,Re-processing of secondary construction material into aggregates,0.0,0.0,0.0,0.0,0.0
China,Activity,Re-processing of secondary copper into new copper,0.0,0.0,0.0,0.0,0.0
China,Activity,Re-processing of secondary glass into new glass,0.0,0.0,0.0,0.0,0.0
China,Activity,"Re-processing of secondary lead into new lead, zinc and tin",0.0,0.0,0.0,0.0,0.0
China,Activity,Re-processing of secondary other non-ferrous metals into new other non-ferrous metals,0.0,0.0,0.0,0.0,0.0
China,Activity,Re-processing of secondary paper into new pulp,2.3849483007420287e-12,7.450755894544571e-15,4.156355082729347e-15,2.4765568572902753e-15,1.3171472187111008e-12
China,Activity,Re-processing of secondary plastic into new plastic,0.0,0.0,0.0,0.0,0.0
China,Activity,Re-processing of secondary preciuos metals into new preciuos metals,0.0,0.0,0.0,0.0,0.0
China,Activity,Re-processing of secondary steel into new steel,0.0,0.0,0.0,0.0,0.0
China,Activity,Re-processing of secondary wood material into new wood material,0.0,0.0,0.0,0.0,0.0
China,Activity,Real estate activities (70),1.9760037487434284e-12,7.657509278541237e-13,3.944926387594793e-13,2.439538903435824e-13,1.1085785650496438e-12
China,Activity,"Recreational, cultural and sporting activities (92)",6.536075759787538e-13,2.2581670567908375e-13,1.1852483599675812e-13,7.225015771965931e-14,3.648369255125467e-13
China,Activity,Recycling of bottles by direct reuse,0.0,0.0,0.0,0.0,0.0
China,Activity,Recycling of waste and scrap,3.36882909851894e-11,1.3342391571025922e-11,6.6670000775515e-12,4.0894435016854936e-12,1.876947764445831e-11
China,Activity,Renting of machinery and equipment without operator and of personal and household goods (71),2.648963857426688e-13,2.4234212091489647e-13,1.1930331909114847e-13,7.323417355885796e-14,1.4912454843004644e-13
China,Activity,Research and development (73),2.4481408965538386e-13,4.5084104093684615e-13,2.2017909824890735e-13,1.4262628049985605e-13,1.4374160833829518e-13
China,Activity,Retail sale of automotive fuel,2.5930150931786464e-12,1.0064049491093131e-12,5.235034658970632e-13,3.2384451395507955e-13,1.4562862236067381e-12
China,Activity,"Retail trade, except of motor vehicles and motorcycles; repair of personal and household goods (52)",2.2906481493174556e-10,8.477299590616163e-11,4.589456142710121e-11,2.8102787565172554e-11,1.3245960798510248e-10
China,Activity,"Sale, maintenance, repair of motor vehicles, motor vehicles parts, motorcycles, motor cycles parts and accessoiries",1.3036898623584735e-10,4.2282160055794245e-11,2.3199886259482555e-11,1.3865628338619444e-11,7.278824849224559e-11
China,Activity,Sea and coastal water transport,2.9323089756974145e-10,3.6736596577430775e-12,5.3419356740267094e-12,2.3225270124209995e-12,1.6329247345248027e-10
China,Activity,Steam and hot water supply,9.17320393089307e-14,3.894612652235646e-14,2.1649599357633538e-14,1.2672174011582645e-14,5.1256230471629906e-14
China,Activity,Sugar refining,1.254777148267957e-15,4.035530067309457e-16,2.1657136906513047e-16,1.3176494863775652e-16,7.02350751102826e-16
China,Activity,Supporting and auxiliary transport activities; activities of travel agencies (63),5.017220619418308e-11,2.0448647280655117e-11,1.1086741969573087e-11,6.685551594310474e-12,2.811960569691523e-11
China,Activity,"Tanning and dressing of leather; manufacture of luggage, handbags, saddlery, harness and footwear (19)",1.1215862129463311e-11,9.85096453484313e-12,5.8215990297694745e-12,3.6967225139326125e-12,6.54353305213678e-12
China,Activity,Transmission of electricity,2.8147962219522018e-15,1.2077021987851754e-15,6.571380856774191e-16,3.899653425592672e-16,1.5722116230958896e-15
China,Activity,Transport via pipelines,8.933585432178572e-13,3.1133765794644957e-13,1.811450362373798e-13,1.0741078268293366e-13,5.180309757662842e-13
China,Activity,Transport via railways,4.604686688096422e-12,1.8232964179603667e-12,9.98459610274843e-13,5.987818765708962e-13,2.601368742575365e-12
China,Activity,"Waste water treatment, food",2.860844034486648e-12,4.298014571950749e-13,2.4579061220539234e-13,1.4736707901597102e-13,1.5933478526114294e-12
