RoW,Activity,"Sale, maintenance, repair of motor vehicles, motor vehicles parts, motorcycles, motor cycles parts and accessoiries",1.5599691963642224e-08,1.508689041053575e-08,1.4043540219818998e-08,1.0867617910768799e-08,1.2851699569267047e-08
RoW,Activity,Sea and coastal water transport,1.9395198342113642e-07,1.7389333622302553e-07,4.2018220011986795e-07,1.9193015912691115e-07,2.6099611733830254e-07
RoW,Activity,Steam and hot water supply,5.33891640888881e-07,5.006058735639853e-07,4.4739913659556764e-07,3.559290505592196e-07,4.099031409260466e-07
RoW,Activity,Sugar refining,1.567887688639929e-09,1.2649803590979416e-09,1.1050896692629378e-09,8.313867670748976e-10,1.1502207487237794e-09
RoW,Activity,Supporting and auxiliary transport activities; activities of travel agencies (63),2.991112557520573e-08,3.136117295923414e-08,3.9696340982070966e-08,2.6151980121295027e-08,2.9136205148562124e-08
RoW,Activity,"Tanning and dressing of leather; manufacture of luggage, handbags, saddlery, harness and footwear (19)",7.877264020720624e-10,8.515670879102401e-10,7.517980150481111e-10,5.484860668815758e-10,5.937084629210591e-10
RoW,Activity,Transmission of electricity,9.787021567777932e-10,9.166743496941376e-10,8.086749096119657e-10,6.393955770629615e-10,7.399349357695439e-10
RoW,Activity,Transport via pipelines,1.2237376950027467e-07,9.757184133385711e-08,9.119342685159415e-08,9.293998668713316e-08,1.2892473739902044e-07
RoW,Activity,Transport via railways,9.162431882119396e-09,6.598624673393965e-09,6.093594718297074e-09,4.670246292791313e-09,7.17409639745031e-09
RoW,Activity,"Waste water treatment, food",5.22489918058624e-10,5.295293815947644e-10,4.757511965385866e-10,3.50373252398084e-10,4.094781372519981e-10
RoW,Activity,"Waste water treatment, other",6.680021004104692e-10,6.594780563054975e-10,5.837720044463171e-10,4.3109822495800367e-10,5.259604548686527e-10
RoW,Activity,"Wholesale trade and commission trade, except of motor vehicles and motorcycles (51)",5.116816085368761e-08,5.3000813345948e-08,4.7240474575069683e-08,5.034050456587455e-08,8.710050042404073e-08
RoW,Activity,"Wool, silk-worm cocoons",1.166269891291207e-08,1.0415340988076392e-08,9.303799878056079e-09,7.007598776642744e-09,8.663821932945118e-09
USA,Activity,Activities auxiliary to financial intermediation (67),6.544923761254144e-09,3.1020216817828472e-09,2.7115948428421146e-09,2.27429492413887e-09,4.435792992428834e-09
USA,Activity,Activities of membership organisation n.e.c. (91),4.975561346767492e-10,2.540063436704523e-10,2.2866407932084593e-10,2.0374581238809164e-10,3.498564294952091e-10
USA,Activity,Air transport (62),3.4587073297545915e-09,1.6342194423056236e-09,1.5362211256595074e-09,1.3354102312550597e-09,2.4663672831543258e-09
USA,Activity,Aluminium production,2.27721224473844e-08,5.450090462360403e-09,4.084234317807405e-09,2.5733716579837693e-09,1.3662179689751114e-08
USA,Activity,Animal products nec,1.67579310526277e-10,1.9752375217836297e-10,1.7595880844236569e-10,1.2777663941199757e-10,1.313973229576557e-10
USA,Activity,"Biogasification of food waste, incl. land application",0.0,0.0,0.0,0.0,0.0
USA,Activity,"Biogasification of paper, incl. land application",0.0,0.0,0.0,0.0,0.0
USA,Activity,"Biogasification of sewage slugde, incl. land application",7.719606555521057e-10,2.5515738251046595e-10,2.2419489770754492e-10,1.6674296090958537e-10,4.904282402646793e-10
USA,Activity,Casting of metals,7.616695875782822e-09,4.874594209933546e-09,4.089190833320148e-09,2.9052481085659332e-09,5.065361899369524e-09
USA,Activity,Cattle farming,7.111974775086208e-10,5.159115210141131e-10,4.6263271061858604e-10,3.4888290796543687e-10,5.012452389049526e-10
USA,Activity,Chemicals nec,6.287805566323199e-07,2.081967770451814e-07,1.882924863389938e-07,1.4405528379825674e-07,3.9739560566016985e-07
USA,Activity,"Collection, purification and distribution of water (41)",2.0883380532190308e-10,5.2575271863475926e-11,4.904655354201573e-11,3.701454598663633e-11,1.3146699415788574e-10
USA,Activity,"Composting of food waste, incl. land application",1.9317247166153238e-11,1.642257707043129e-11,1.876388152732807e-11,1.922778179254784e-11,1.679243753527926e-11
USA,Activity,"Composting of paper and wood, incl. land application",1.7492171011420207e-10,4.89493196287889e-11,4.392997987363276e-11,3.432083668194414e-11,1.1134140085046455e-10
USA,Activity,Computer and related activities (72),3.806466134555479e-09,2.252160589851394e-09,2.0193691175320016e-09,1.813491015439301e-09,2.8082177937312934e-09
USA,Activity,Construction (45),1.1840983369910349e-11,1.3926429309293557e-12,1.464330494803267e-12,1.3989592402569145e-12,7.384301976458758e-12
USA,Activity,Copper production,2.3655960668577208e-08,2.7402299855057733e-08,2.0257244124618845e-08,1.2697868429585819e-08,1.5503480315227696e-08
USA,Activity,Cultivation of cereal grains nec,1.8077456747021628e-09,1.209054455131885e-09,1.0651675621064446e-09,7.912841773941379e-10,1.2583841526509425e-09
USA,Activity,Cultivation of crops nec,1.6169623255427178e-09,6.711015241794135e-10,5.777368108123716e-10,4.309604844321491e-10,1.0378696102676971e-09
USA,Activity,Cultivation of oil seeds,2.6329749569246455e-09,1.9464546845772844e-09,1.52826923231834e-09,1.1036255908399755e-09,1.7684216966606656e-09
USA,Activity,Cultivation of paddy rice,5.190466576871185e-10,2.8782940849740665e-10,2.5516771888045916e-10,1.9353485009094065e-10,3.4715194904551685e-10
USA,Activity,Cultivation of plant-based fibers,2.8124927337379966e-09,2.4786349638954565e-09,2.1263136003006026e-09,1.5339787999574028e-09,1.940195141659577e-09
USA,Activity,"Cultivation of sugar cane, sugar beet",4.0784133799785863e-10,2.0824391849067488e-10,1.821676530705516e-10,1.350227872712741e-10,2.7228321382421117e-10
USA,Activity,"Cultivation of vegetables, fruit, nuts",3.763000880132994e-10,2.4986295527982433e-10,2.2013462437877533e-10,1.6412087001225956e-10,2.599641648027526e-10
USA,Activity,Cultivation of wheat,1.1068969337628855e-09,9.273330158130378e-10,8.373367494715093e-10,6.267820167677326e-10,7.982109214221652e-10
USA,Activity,Distribution and trade of electricity,2.0177394719626828e-11,5.055110410315398e-12,4.5794594048826186e-12,3.510334605016803e-12,1.2694141227941578e-11
USA,Activity,Education (80),2.0436673678333553e-10,5.618647838280792e-11,5.159768381225923e-11,7.327871835413126e-11,1.428411002463118e-10
USA,Activity,Extra-territorial organizations and bodies,0.0,0.0,0.0,0.0,0.0
USA,Activity,"Extraction of crude petroleum and services related to crude oil extraction, excluding surveying",7.383637022928061e-08,4.923899588718953e-08,4.7445723383053625e-08,6.221665508938045e-08,5.960352502276676e-08
USA,Activity,"Extraction of natural gas and services related to natural gas extraction, excluding surveying",2.4163524733349195e-08,1.4589573288898356e-08,1.3742967185484716e-08,1.6052580344458938e-08,1.8763582190357368e-08
USA,Activity,"Extraction, liquefaction, and regasification of other petroleum and gaseous materials",1.6114373887506916e-14,2.651852516893646e-15,2.463739315639595e-15,2.4052451407661203e-15,1.0011237890087008e-14
USA,Activity,"Financial intermediation, except insurance and pension funding (65)",1.0621255989138703e-08,7.571706285861479e-09,7.264828415839487e-09,7.362076894462759e-09,8.709142355014955e-09
USA,Activity,"Fishing, operating of fish hatcheries and fish farms; service activities incidental to fishing (05)",1.2158068675367214e-13,9.91676269436221e-14,8.565033512730176e-14,6.219059566598331e-14,8.501908422538535e-14
USA,Activity,"Forestry, logging and related service activities (02)",4.266041898031157e-09,1.7275145430985199e-09,1.5500905221920807e-09,1.0692683835753319e-09,2.7170637273655232e-09
USA,Activity,Health and social work (85),7.319606215657944e-11,1.1323639076474154e-11,1.0041894503471029e-11,1.2298596225452688e-11,4.720311905351171e-11
USA,Activity,Hotels and restaurants (55),7.485572540873913e-09,3.4528360643544298e-09,3.033083492654368e-09,2.4787141876402294e-09,5.113855779327739e-09
USA,Activity,Incineration of waste: Food,3.2946486415583476e-10,1.7980344365465487e-10,1.67049817128927e-10,1.241870264952545e-10,2.2210349561050732e-10
USA,Activity,Incineration of waste: Metals and Inert materials,6.4182984926273e-10,5.70518111555878e-10,7.264999934717979e-10,5.380178223225584e-10,5.71979094473164e-10
USA,Activity,Incineration of waste: Oil/Hazardous waste,6.76752217605747e-11,6.610412661208036e-11,6.948909026783769e-11,5.499816400188828e-11,5.2060361515620024e-11
USA,Activity,Incineration of waste: Paper,5.41391173734955e-10,2.4453688543220605e-10,2.3564304140751303e-10,1.7206131780604245e-10,3.5933695829155427e-10
USA,Activity,Incineration of waste: Plastic,9.905872129473487e-10,2.921035525773524e-10,2.641612004653495e-10,2.0408187060589738e-10,6.314968940574876e-10
USA,Activity,Incineration of waste: Textiles,1.9475795851047534e-10,1.3286719774618788e-10,1.3187545953586185e-10,8.625238210893904e-11,1.3467825678644633e-10
USA,Activity,Incineration of waste: Wood,2.1993702981650642e-10,9.98989479366929e-11,1.0742055520542817e-10,1.1947180052482183e-10,1.5853513100787072e-10
USA,Activity,Inland water transport,5.51226241156558e-10,5.799700983498462e-10,4.543340540144392e-10,3.0140322768494576e-10,3.726596262050804e-10
USA,Activity,"Insurance and pension funding, except compulsory social security (66)",1.8874616311415308e-09,1.4521273628759565e-09,1.3681819941225787e-09,1.3094607783207823e-09,1.57552835051133e-09
USA,Activity,Landfill of waste: Food,1.5110379825829483e-10,5.275364927233647e-11,4.9580054349549257e-11,3.8986447173124337e-11,9.933204328808169e-11
USA,Activity,Landfill of waste: Inert/metal/hazardous,2.5025333075997357e-10,1.0254942988400646e-10,9.389492224850364e-11,6.94157275194184e-11,1.6263588221991613e-10
USA,Activity,Landfill of waste: Paper,1.888209948461623e-10,6.719553110819934e-11,6.294376446745103e-11,4.703243273256263e-11,2.2619324105862405e-10
USA,Activity,Landfill of waste: Plastic,1.4072486937712518e-10,4.3405048929370763e-11,3.8859311274005334e-11,2.941325561007727e-11,8.976260004342174e-11
USA,Activity,Landfill of waste: Textiles,4.4793652795177896e-11,1.578261178297154e-11,1.5653906083849022e-11,1.1331324454343474e-11,2.9405970318765796e-11
USA,Activity,Landfill of waste: Wood,6.282690428103178e-11,2.164074603335445e-11,1.9702046470977653e-11,1.49082076236555e-11,4.0705874989783025e-11
USA,Activity,"Lead, zinc and tin production",2.7615949287562413e-10,4.93217043347126e-10,4.991720995313279e-10,2.9508986081130304e-10,2.1124016922852203e-10
USA,Activity,Manufacture of basic iron and steel and of ferro-alloys and first products thereof,1.9054861638394978e-08,1.6031919265998873e-08,1.3957918204092639e-08,8.927185302987368e-09,1.2599814741361508e-08
USA,Activity,Manufacture of beverages,3.0307866457067936e-10,3.3870883963191395e-10,3.324766302871757e-10,2.50937163694421e-10,2.6507203654134484e-10
USA,Activity,"Manufacture of bricks, tiles and construction products, in baked clay",9.457567523888879e-09,6.442092920316933e-10,5.365894305609831e-10,3.464566520509139e-10,5.589942913779546e-09
USA,Activity,"Manufacture of cement, lime and plaster",7.2640061765563085e-09,1.1119935361523953e-09,1.1212201729762011e-09,8.367751796951833e-10,4.461843681504174e-09
USA,Activity,Manufacture of ceramic goods,4.288078543017759e-09,4.671164663501935e-10,5.554701737503614e-10,4.1189678812787724e-10,2.65304766470675e-09
USA,Activity,Manufacture of coke oven products,4.699308934086867e-10,4.84422513756096e-10,4.3266205284754405e-10,3.5801235131616234e-10,3.4880664080674623e-10
USA,Activity,Manufacture of electrical machinery and apparatus n.e.c. (31),7.341013310138881e-09,5.727886083523816e-09,4.277939709985402e-09,3.666888800011626e-09,5.268533900605846e-09
USA,Activity,"Manufacture of fabricated metal products, except machinery and equipment (28)",8.334255597830577e-09,5.097431578705599e-09,4.514774935402836e-09,2.993853742441388e-09,5.409684728295635e-09
USA,Activity,Manufacture of fish products,2.1455882119933966e-10,2.1175502511660684e-10,2.007059739458972e-10,1.4203166238971929e-10,1.6278251291811582e-10
USA,Activity,Manufacture of furniture; manufacturing n.e.c. (36),1.4997288074250446e-08,7.789822493237681e-09,6.869358848028594e-09,5.5346588126699155e-09,9.969122336320383e-09
USA,Activity,Manufacture of gas; distribution of gaseous fuels through mains,6.958141344735707e-09,7.059926806722864e-10,6.204684447829034e-10,4.768427980556229e-10,4.1744258960842295e-09
USA,Activity,Manufacture of glass and glass products,6.581606147856087e-07,1.4484127889610838e-08,1.077732348680158e-08,6.226820536722331e-09,3.85619008750438e-07
USA,Activity,Manufacture of machinery and equipment n.e.c. (29),1.0247335132954262e-08,6.225669873310139e-09,5.298402825460974e-09,3.717169342606066e-09,6.7396951684065304e-09
USA,Activity,"Manufacture of medical, precision and optical instruments, watches and clocks (33)",2.7628520304366975e-10,3.948432282079938e-10,2.853974487043192e-10,2.165634304701917e-10,2.0852143190635715e-10
USA,Activity,"Manufacture of motor vehicles, trailers and semi-trailers (34)",2.795022597106422e-09,1.4475786684839603e-09,1.2778702278459558e-09,8.898053825485254e-10,1.869099607439868e-09
USA,Activity,Manufacture of office machinery and computers (30),6.837332385111186e-10,8.867097726570015e-10,7.071821295583412e-10,5.387869708333834e-10,5.292054319408749e-10
USA,Activity,Manufacture of other non-metallic mineral products n.e.c.,9.504636046309291e-08,5.0950878826629216e-09,6.0028767303019465e-09,3.386560602839233e-09,5.616262288409169e-08
USA,Activity,Manufacture of other transport equipment (35),1.869526010384755e-09,1.605730786451762e-09,1.404381223876302e-09,9.511647854177057e-10,1.3260557204579797e-09
USA,Activity,"Manufacture of radio, television and communication equipment and apparatus (32)",3.921967811109794e-09,4.2595621647782376e-09,2.8075075912833932e-09,2.180934199233374e-09,2.7045392925056337e-09
USA,Activity,Manufacture of rubber and plastic products (25),2.0475473949340213e-09,9.774409740564357e-10,8.752060401497178e-10,6.121878332826928e-10,1.33308499763609e-09
USA,Activity,Manufacture of textiles (17),2.398012246483649e-09,1.1659486307026794e-09,1.032419154757281e-09,7.544713385259052e-10,1.5660324688417402e-09
USA,Activity,Manufacture of tobacco products (16),2.8652102475152898e-11,3.282610104426827e-11,2.5941616441474463e-11,1.777222807758874e-11,2.0158855602139296e-11
USA,Activity,Manufacture of wearing apparel; dressing and dyeing of fur (18),5.050822905755693e-11,2.8852342055016843e-11,2.4909688893197427e-11,1.9241056611869698e-11,3.486138894376844e-11
USA,Activity,"Manufacture of wood and of products of wood and cork, except furniture; manufacture of articles of straw and plaiting materials (20)",4.3345830806175815e-09,1.7020299677693158e-09,1.6867852808934758e-09,1.1102205074193259e-09,2.767994684733897e-09
USA,Activity,"Manure treatment (biogas), storage and land application",0.0,0.0,0.0,0.0,0.0
USA,Activity,"Manure treatment (conventional), storage and land application",0.0,0.0,0.0,0.0,0.0
USA,Activity,Meat animals nec,1.2798169622706579e-12,6.049575464340328e-13,5.670449394302923e-13,4.1625923630086115e-13,8.604154664177981e-13
USA,Activity,Mining of aluminium ores and concentrates,1.0919743116657884e-10,4.139386871839876e-12,3.196087337752046e-12,1.9196751483681057e-12,6.410523643867406e-11
USA,Activity,"Mining of chemical and fertilizer minerals, production of salt, other mining and quarrying n.e.c.",1.4439084987770784e-09,8.825586961397459e-10,9.141145063796083e-10,5.203178881203929e-10,9.099950682549525e-10
USA,Activity,Mining of coal and lignite; extraction of peat (10),2.9587890520369856e-09,2.295355041576512e-10,2.2310833853755969e-10,1.90048694058474e-10,1.7846627983425224e-09
USA,Activity,Mining of copper ores and concentrates,2.3447576311722144e-10,1.2950313610165193e-10,9.646593231801108e-11,6.150534718100763e-11,1.4563144000988661e-10
USA,Activity,Mining of iron ores,5.32654950063468e-11,3.039181384253242e-11,2.64079228059102e-11,1.6853300981900737e-11,3.3867250438275015e-11
USA,Activity,"Mining of lead, zinc and tin ores and concentrates",4.0440455876927477e-11,4.3993296525943584e-11,4.2107781472408524e-11,2.5204745811801612e-11,2.7685596260030314e-11
USA,Activity,Mining of nickel ores and concentrates,0.0,0.0,0.0,0.0,0.0
USA,Activity,Mining of other non-ferrous metal ores and concentrates,1.8670758685115813e-10,1.8592200082793317e-10,1.7135191264814267e-10,1.1098914964602022e-10,1.2839026799908362e-10
USA,Activity,Mining of precious metal ores and concentrates,7.960262097192136e-09,4.6157064216164007e-10,3.6615681190198246e-10,2.3675787934805774e-10,4.698148325013205e-09
USA,Activity,Mining of uranium and thorium ores (12),1.6534871854693135e-11,7.402077969140947e-12,6.276946071864325e-12,4.493292452093463e-12,1.0493488554930172e-11
USA,Activity,N-fertiliser,1.7096006717932424e-10,4.6497949603591457e-11,3.8478081181986646e-11,2.9032450304833505e-11,1.0560477127579057e-10
USA,Activity,Other business activities (74),7.63746953893375e-08,4.028618440056078e-08,3.688393592679179e-08,3.487984704536565e-08,5.5567559125893455e-08
USA,Activity,Other land transport,3.2937570901589876e-13,8.054648367259829e-14,7.351504744748485e-14,5.853451765022037e-14,2.1269342085363635e-13
USA,Activity,Other non-ferrous metal production,5.516508042931534e-10,6.021919198152055e-10,5.505871562728513e-10,3.465950028516885e-10,3.7280014498026825e-10
USA,Activity,Other service activities (93),3.0178849634370927e-10,1.229866850368527e-10,1.1345419990286718e-10,9.668796031121956e-11,2.04318963523289e-10
USA,Activity,P- and other fertiliser,4.6342033694320416e-09,1.813684122700548e-09,1.5924677830157916e-09,1.3143539205268557e-09,2.9730278070736724e-09
USA,Activity,Paper,5.140858947363599e-08,1.4865753576732878e-08,1.2641804294255762e-08,9.467923326629314e-09,3.2167668147724896e-08
USA,Activity,Petroleum Refinery,5.099942856205854e-08,2.7391959521243973e-08,2.6662827324311346e-08,3.699854077242984e-08,3.992788602239467e-08
USA,Activity,Pigs farming,4.640879243747871e-10,2.58930528397631e-10,2.2496746797924582e-10,1.685330416980195e-10,3.107512664243098e-10
USA,Activity,"Plastics, basic",8.101619192284387e-09,6.198706363588006e-09,5.078462426958427e-09,3.6161090035758827e-09,5.479038263634208e-09
USA,Activity,Post and telecommunications (64),1.1651620170247065e-08,5.821130647921813e-09,5.380093513747198e-09,5.026888691004225e-09,8.392429123156484e-09
USA,Activity,Poultry farming,5.340818521656095e-10,3.543747088136497e-10,3.17826654006989e-10,2.404669646229122e-10,3.6947125215787444e-10
USA,Activity,Precious metals production,2.159711182945224e-07,1.068863190717266e-08,8.618496124251077e-09,5.558010710477551e-09,1.2734114191085424e-07
USA,Activity,Private households with employed persons (95),2.223133266322179e-10,2.6931461775222114e-10,2.275284533248634e-10,1.796638227095112e-10,1.735852612101688e-10
USA,Activity,Processed rice,1.5561454560633267e-10,1.3772358116803645e-10,1.2556022254851335e-10,9.394279115927628e-11,1.1308955579496084e-10
USA,Activity,Processing of Food products nec,2.38596050040098e-09,1.1543903562320593e-09,1.0138107889135e-09,7.646926903412598e-10,1.5824297816468514e-09
USA,Activity,Processing of dairy products,7.088912416682626e-10,4.280520027405298e-10,3.2018483231442306e-10,2.3876705878851813e-10,4.669003856035682e-10
USA,Activity,Processing of meat cattle,3.34529198598822e-10,2.3408509005924377e-10,2.135585683504351e-10,1.6261376385750653e-10,2.3703115642033434e-10
USA,Activity,Processing of meat pigs,1.8800963683057934e-10,1.0806157999637668e-10,9.356466456977081e-11,7.012398755948285e-11,1.2627705052771783e-10
USA,Activity,Processing of meat poultry,1.0012073727173828e-10,6.219904772222078e-11,5.5670797546476175e-11,4.331048821749016e-11,6.999787260350771e-11
USA,Activity,Processing of nuclear fuel,3.36353260731395e-13,3.830167355994779e-13,3.70033721492311e-13,2.345902829302668e-13,2.411788855679972e-13
USA,Activity,Processing vegetable oils and fats,3.294069591278947e-10,1.9312863110107718e-10,1.7601258359434746e-10,1.320010445112739e-10,2.2248292171169277e-10
USA,Activity,Production of electricity by Geothermal,4.5314801037527117e-10,2.040410545110722e-12,1.8347167126643054e-12,1.3528392506289599e-12,2.6543397242273456e-10
USA,Activity,Production of electricity by biomass and waste,0.0,0.0,0.0,0.0,0.0
USA,Activity,Production of electricity by coal,3.8136120112250133e-07,4.512505547570149e-09,3.956351322168474e-09,2.9147704179169934e-09,2.237499163188174e-07
USA,Activity,Production of electricity by gas,2.3158897296386503e-05,1.0379406804526453e-07,9.122610568857387e-08,6.705749069476287e-08,1.356333824118308e-05
USA,Activity,Production of electricity by hydro,0.0,0.0,0.0,0.0,0.0
USA,Activity,Production of electricity by nuclear,1.1688417750549526e-08,7.716956630164122e-11,6.771572111284631e-11,4.97077089832327e-11,6.848980768257867e-09
USA,Activity,Production of electricity by petroleum and other oil derivatives,1.768054584651442e-08,8.469366160313093e-11,7.629309287648836e-11,5.692717372136861e-11,1.0357517500692454e-08
USA,Activity,Production of electricity by solar photovoltaic,0.0,0.0,0.0,0.0,0.0
USA,Activity,Production of electricity by solar thermal,0.0,0.0,0.0,0.0,0.0
USA,Activity,"Production of electricity by tide, wave, ocean",0.0,0.0,0.0,0.0,0.0
USA,Activity,Production of electricity by wind,0.0,0.0,0.0,0.0,0.0
USA,Activity,Production of electricity nec,2.9439155725065634e-10,1.4070268880900307e-12,1.2605531963474004e-12,9.337008604645927e-13,1.724717515394243e-10
USA,Activity,Production of meat products nec,2.4654529214044616e-10,1.416401690729591e-10,1.2131540036904214e-10,9.054044401179381e-11,1.6295189005443602e-10
USA,Activity,Production of offshore wind plants,0.0,0.0,0.0,0.0,0.0
USA,Activity,Production of onshore wind plants,0.0,0.0,0.0,0.0,0.0
USA,Activity,Production of photovoltaic plants,0.0,0.0,0.0,0.0,0.0
USA,Activity,Public administration and defence; compulsory social security (75),1.0913176074700768e-08,6.883679708673633e-10,6.11430382438142e-10,4.84107811943697e-10,6.527371730015892e-09
USA,Activity,"Publishing, printing and reproduction of recorded media (22)",5.3992081709475444e-09,2.9843170116109595e-09,2.706701429811052e-09,2.5481082475059314e-09,3.954280134408533e-09
USA,Activity,Pulp,3.834714017045246e-09,2.248573419560241e-09,1.6956102016812652e-09,1.2619559501684423e-09,2.485558438915902e-09
USA,Activity,Quarrying of sand and clay,4.248444136462877e-09,4.81913341991686e-10,4.265269588801495e-10,2.7460985191877675e-10,2.5377248983199665e-09
USA,Activity,Quarrying of stone,8.239185538081478e-10,1.4161131221324168e-10,1.6033733394764638e-10,1.03997494519281e-10,5.027409064779562e-10
USA,Activity,Raw milk,1.6717735384331084e-10,1.008985528329345e-10,7.549353060648792e-11,5.6305624996259346e-11,1.1011245927471122e-10
USA,Activity,Re-processing of ash into clinker,0.0,0.0,0.0,0.0,0.0
USA,Activity,Re-processing of secondary aluminium into new aluminium,0.0,0.0,0.0,0.0,0.0
USA,Activity,Re-processing of secondary construction material into aggregates,0.0,0.0,0.0,0.0,0.0
USA,Activity,Re-processing of secondary copper into new copper,0.0,0.0,0.0,0.0,0.0
USA,Activity,Re-processing of secondary glass into new glass,0.0,0.0,0.0,0.0,0.0
USA,Activity,"Re-processing of secondary lead into new lead, zinc and tin",0.0,0.0,0.0,0.0,0.0
USA,Activity,Re-processing of secondary other non-ferrous metals into new other non-ferrous metals,0.0,0.0,0.0,0.0,0.0
USA,Activity,Re-processing of secondary paper into new pulp,0.0,0.0,0.0,0.0,0.0
USA,Activity,Re-processing of secondary plastic into new plastic,0.0,0.0,0.0,0.0,0.0
USA,Activity,Re-processing of secondary preciuos metals into new preciuos metals,0.0,0.0,0.0,0.0,0.0
USA,Activity,Re-processing of secondary steel into new steel,0.0,0.0,0.0,0.0,0.0
USA,Activity,Re-processing of secondary wood material into new wood material,0.0,0.0,0.0,0.0,0.0
USA,Activity,Real estate activities (70),4.3276927466658744e-09,2.5504119411565268e-09,2.4197896244091055e-09,2.115826418763244e-09,3.2404718831736234e-09
USA,Activity,"Recreational, cultural and sporting activities (92)",2.903708365235612e-09,1.4839849652388705e-09,1.3617949674466706e-09,1.2732294072249038e-09,2.098415668310831e-09
USA,Activity,Recycling of bottles by direct reuse,0.0,0.0,0.0,0.0,0.0
USA,Activity,Recycling of waste and scrap,5.90656908971036e-09,1.926881824883646e-09,1.645828064945426e-09,1.1763589221851378e-09,3.691377287255677e-09
USA,Activity,Renting of machinery and equipment without operator and of personal and household goods (71),6.098507225340094e-09,2.8425292413282556e-09,2.5934470279634898e-09,2.1649476534773293e-09,4.18298638807477e-09
USA,Activity,Research and development (73),6.8225078063824664e-09,1.4642522128362791e-08,1.1127183258538367e-08,7.180056068982425e-09,4.860650149110899e-09
USA,Activity,Retail sale of automotive fuel,3.149429300734651e-11,2.928011353860464e-11,3.289385012315246e-11,2.894564299535953e-11,3.524916667015439e-11
USA,Activity,"Retail trade, except of motor vehicles and motorcycles; repair of personal and household goods (52)",8.665164957410563e-10,1.947869748377008e-10,1.7599940982598795e-10,1.4427763969965718e-10,5.976849746340724e-10
USA,Activity,"Sale, maintenance, repair of motor vehicles, motor vehicles parts, motorcycles, motor cycles parts and accessoiries",8.870939129175222e-09,1.7827347175712321e-09,1.5339965978696648e-09,1.1527902092360586e-09,5.459254965265465e-09
USA,Activity,Sea and coastal water transport,2.637329253241769e-09,3.045884979027948e-09,7.442591364255563e-09,3.2918191235289094e-09,2.782415460893302e-09
USA,Activity,Steam and hot water supply,5.6364303467017745e-08,1.652940624147022e-08,1.5091294304990598e-08,1.2004789438184662e-08,3.601303408014906e-08
USA,Activity,Sugar refining,2.4162684692422663e-11,1.5579762462663573e-11,1.4010541189615466e-11,1.0527407373611214e-11,1.7710466124666995e-11
