RoW,Activity,"Sale, maintenance, repair of motor vehicles, motor vehicles parts, motorcycles, motor cycles parts and accessoiries",4.965941133966312e-10,4.513615116252724e-10,4.2135426626145237e-10,1.2806887640824383e-10,9.881702529989632e-11
RoW,Activity,Sea and coastal water transport,3.313705371225535e-08,2.3489050554203935e-08,5.500358138474914e-08,5.59727428410309e-09,1.18941844352802e-08
RoW,Activity,Steam and hot water supply,3.0641359366296594e-08,2.7914548567391555e-08,2.4927955406734162e-08,8.196785298364551e-09,4.928845338467884e-09
RoW,Activity,Sugar refining,7.047851091025408e-10,5.357002517666721e-10,4.5599902361186414e-10,1.1862681247196388e-10,8.29526925742528e-11
RoW,Activity,Supporting and auxiliary transport activities; activities of travel agencies (63),1.1075576096252129e-08,1.101485784693642e-08,1.2920750566839651e-08,3.1934552144420573e-09,2.944530372500169e-09
RoW,Activity,"Tanning and dressing of leather; manufacture of luggage, handbags, saddlery, harness and footwear (19)",3.1616778510752046e-10,3.358338122098023e-10,2.9540613019769673e-10,7.289461236180645e-11,4.759900733618241e-11
RoW,Activity,Transmission of electricity,8.205467651935798e-10,7.466635543269361e-10,6.591884932409296e-10,2.0697666648362717e-10,1.249682207580698e-10
RoW,Activity,Transport via pipelines,7.235007090702722e-09,5.915736662517018e-09,5.633236129481365e-09,3.2844978504303636e-09,3.194472066245183e-09
RoW,Activity,Transport via railways,4.313197458827173e-09,4.330130555571626e-09,4.135889347125899e-09,1.254320591581263e-09,1.3564828442130775e-09
RoW,Activity,"Waste water treatment, food",1.8406018438713393e-11,1.8415041060568995e-11,1.6465780788830515e-11,4.3421498769241715e-12,2.9863663103300797e-12
RoW,Activity,"Waste water treatment, other",2.9020458113208743e-11,2.773179814849967e-11,2.479471576389408e-11,6.419965954657887e-12,4.3931809835274266e-12
RoW,Activity,"Wholesale trade and commission trade, except of motor vehicles and motorcycles (51)",3.1559100314064097e-09,3.2729692415642734e-09,2.8980337102143923e-09,8.341275062678715e-10,7.936252862656742e-10
RoW,Activity,"Wool, silk-worm cocoons",1.7363967087295781e-09,4.634999608889125e-09,4.099096105834278e-09,5.635073690592528e-10,3.556819897502705e-10
USA,Activity,Activities auxiliary to financial intermediation (67),2.2370960903999313e-11,1.0839663717292259e-11,9.421230647364119e-12,3.2106321662014568e-12,2.024550939007139e-12
USA,Activity,Activities of membership organisation n.e.c. (91),3.3954662954119775e-12,1.8180550817139977e-12,1.624628419832677e-12,5.914906824090826e-13,3.9334381884546363e-13
USA,Activity,Air transport (62),3.902126879837061e-08,1.7076836262303666e-08,1.5809162562635946e-08,5.826941872674618e-09,4.004763096289176e-09
USA,Activity,Aluminium production,5.742107284820703e-10,1.544127765524566e-10,1.1299681724817449e-10,1.475441577061489e-11,9.270604484984921e-12
USA,Activity,Animal products nec,2.938662396883996e-11,3.296952265031602e-11,2.8939027487126843e-11,7.29023996573658e-12,5.959783176706516e-12
USA,Activity,"Biogasification of food waste, incl. land application",0.0,0.0,0.0,0.0,0.0
USA,Activity,"Biogasification of paper, incl. land application",0.0,0.0,0.0,0.0,0.0
USA,Activity,"Biogasification of sewage slugde, incl. land application",2.5116895275007255e-11,9.074210005011493e-12,8.199866935982679e-12,2.1079038650905937e-12,1.2669382307338292e-12
USA,Activity,Casting of metals,2.318428044328535e-10,1.6827904292258658e-10,1.370983390601507e-10,2.991866555294543e-11,1.959832417003849e-11
USA,Activity,Cattle farming,2.621541109664816e-10,1.77918744286861e-10,1.572830824753132e-10,4.347780323032599e-11,2.787562413392465e-11
USA,Activity,Chemicals nec,1.1015228356568203e-08,4.40241253068941e-09,3.900892475308204e-09,1.063632007872757e-09,5.47104708701869e-10
USA,Activity,"Collection, purification and distribution of water (41)",1.900288370691499e-12,5.281944576706137e-13,4.762102067835708e-13,1.2978789119597206e-13,8.319108102494718e-14
USA,Activity,"Composting of food waste, incl. land application",8.623175380148382e-13,7.598991452136985e-13,8.435721450962926e-13,5.118806724141965e-13,2.297342257897782e-13
USA,Activity,"Composting of paper and wood, incl. land application",9.286839196669106e-12,2.932394126682478e-12,2.725972381114015e-12,7.496476251994154e-13,4.67390646239508e-13
USA,Activity,Computer and related activities (72),5.0792166810160773e-11,3.050753228298795e-11,2.6973916035514615e-11,1.0227417567170475e-11,7.251005074129732e-12
USA,Activity,Construction (45),6.53978752392905e-12,6.986730651829238e-13,7.698206020767025e-13,3.624101009203811e-13,2.1341967379471445e-13
USA,Activity,Copper production,9.99003635734224e-10,1.122094707644187e-09,9.096986138368929e-10,1.282189824316672e-10,8.384490343171695e-11
USA,Activity,Cultivation of cereal grains nec,6.867882900161333e-10,4.292528910328677e-10,3.688283222045147e-10,9.39227790948112e-11,6.152714212810256e-11
USA,Activity,Cultivation of crops nec,7.713801679796667e-10,3.4590614589923284e-10,2.959522897806733e-10,7.568450295179323e-11,4.449701286951401e-11
USA,Activity,Cultivation of oil seeds,1.0600735734383741e-09,7.512097562907008e-10,5.846274611564298e-10,1.2942363123595034e-10,8.08932169339652e-11
USA,Activity,Cultivation of paddy rice,8.17313354933951e-10,4.498720937992364e-10,3.950771554738188e-10,1.080853244069374e-10,6.323541292551708e-11
USA,Activity,Cultivation of plant-based fibers,8.141884955377645e-10,7.296396164217422e-10,6.206301605833235e-10,1.5034297200581415e-10,8.158211681600866e-11
USA,Activity,"Cultivation of sugar cane, sugar beet",1.8282775277724834e-10,1.0156304405552761e-10,8.810605689061335e-11,2.24070658927371e-11,1.4350275865767696e-11
USA,Activity,"Cultivation of vegetables, fruit, nuts",9.084048028205142e-11,6.340003034055924e-11,5.5245180922572224e-11,1.4176775822139704e-11,8.963773396553191e-12
USA,Activity,Cultivation of wheat,4.884520015012067e-10,4.0416607200926387e-10,3.5917429137492017e-10,9.645515398860881e-11,5.977830455717757e-11
USA,Activity,Distribution and trade of electricity,3.578140930161521e-11,9.301439742211318e-12,8.186703000208153e-12,2.2153436831499632e-12,1.4720855167082104e-12
USA,Activity,Education (80),4.147520623047091e-12,1.0742902701403796e-12,9.771290639185707e-13,7.591161739476285e-13,3.716710514203882e-13
USA,Activity,Extra-territorial organizations and bodies,0.0,0.0,0.0,0.0,0.0
USA,Activity,"Extraction of crude petroleum and services related to crude oil extraction, excluding surveying",1.021745044275849e-09,6.720979223832508e-10,6.528467094017993e-10,5.840444909473806e-10,2.2861230781751208e-10
USA,Activity,"Extraction of natural gas and services related to natural gas extraction, excluding surveying",3.799855336993297e-10,2.2847088418931678e-10,2.1557940940773553e-10,1.5944043969369746e-10,7.198175397416012e-11
USA,Activity,"Extraction, liquefaction, and regasification of other petroleum and gaseous materials",8.35879457974384e-15,1.909935941140015e-15,1.7983895871775323e-15,8.654126511790522e-16,4.006077808845647e-16
USA,Activity,"Financial intermediation, except insurance and pension funding (65)",7.360761458128105e-11,5.336261511555848e-11,5.1517126861767795e-11,2.6064876582333754e-11,1.6313761557559327e-11
USA,Activity,"Fishing, operating of fish hatcheries and fish farms; service activities incidental to fishing (05)",9.368479772278872e-14,7.758614659749987e-14,6.695111790153011e-14,1.628635088402507e-14,1.0401449314351748e-14
USA,Activity,"Forestry, logging and related service activities (02)",6.543196778647818e-09,2.6909064796739525e-09,2.4175764475853125e-09,5.204428248222015e-10,3.3899661406955616e-10
USA,Activity,Health and social work (85),9.63684240193323e-13,1.0597656864401927e-13,9.374555405210819e-14,7.431146728898056e-14,3.852254203722895e-14
USA,Activity,Hotels and restaurants (55),3.62349239792531e-11,1.626772984589704e-11,1.4319951867934723e-11,4.494575408214044e-12,3.2511953437393315e-12
USA,Activity,Incineration of waste: Food,1.6366109208225372e-10,8.321787512655359e-11,9.397790383237265e-11,2.793366392915799e-11,2.0771428073074405e-11
USA,Activity,Incineration of waste: Metals and Inert materials,3.011823306179569e-10,2.615659850316334e-10,3.374689314325354e-10,1.0467987355980997e-10,8.297327651486993e-11
USA,Activity,Incineration of waste: Oil/Hazardous waste,2.7151508736285056e-11,2.4379888484753004e-11,2.8977964119586726e-11,1.1397710787420666e-11,6.996839710372571e-12
USA,Activity,Incineration of waste: Paper,3.092034623107998e-10,2.2248003519444234e-10,2.0231270980027944e-10,4.0777379718215205e-11,2.6038044117300024e-11
USA,Activity,Incineration of waste: Plastic,4.094120096008424e-10,1.5397192685682493e-10,1.443617667658201e-10,4.0648105942116837e-11,2.491017370162737e-11
USA,Activity,Incineration of waste: Textiles,8.939171980488068e-11,6.183004864212179e-11,5.660099953849439e-11,1.2597344387920674e-11,8.737912919367328e-12
USA,Activity,Incineration of waste: Wood,1.0097781927107088e-10,4.690390539260467e-11,4.837038561212905e-11,3.199882580215324e-11,1.228255116160844e-11
USA,Activity,Inland water transport,9.927993812199014e-10,1.0121578576786883e-09,8.01307673294735e-10,1.485780708660588e-10,8.999606712333637e-11
USA,Activity,"Insurance and pension funding, except compulsory social security (66)",1.0823965346465747e-11,6.963606496632911e-12,6.675011294379332e-12,3.040007754366915e-12,2.2530159810245536e-12
USA,Activity,Landfill of waste: Food,8.11621439728437e-12,3.1970785092102065e-12,3.1020827054294197e-12,9.65848808605573e-13,5.992357234230312e-13
USA,Activity,Landfill of waste: Inert/metal/hazardous,1.2400843519935097e-11,5.356308057098715e-12,5.0159953587124456e-12,1.29822327766577e-12,7.744246481626158e-13
USA,Activity,Landfill of waste: Paper,9.622232759730624e-12,3.9770379047968775e-12,3.774571273957787e-12,9.684744120842227e-13,6.038475571934923e-13
USA,Activity,Landfill of waste: Plastic,7.04363714606021e-12,2.3532346091900666e-12,2.1821894241896874e-12,5.930234557103117e-13,3.6827253615526873e-13
USA,Activity,Landfill of waste: Textiles,2.496849271165084e-12,9.249005530753339e-13,8.722869759086262e-13,2.4052812618860246e-13,1.520034292669394e-13
USA,Activity,Landfill of waste: Wood,3.2904612655937553e-12,1.2377126972597024e-12,1.159646747126493e-12,3.135597649993175e-13,1.9787786631479736e-13
USA,Activity,"Lead, zinc and tin production",3.824491255129378e-11,5.646499460768288e-11,5.907968692733192e-11,9.509282315329982e-12,6.779054251452909e-12
USA,Activity,Manufacture of basic iron and steel and of ferro-alloys and first products thereof,1.0605584421731703e-09,9.58244669417552e-10,8.327923781121608e-10,1.322289592528719e-10,8.204314162140583e-11
USA,Activity,Manufacture of beverages,2.2770905831020716e-11,2.1105572990124713e-11,2.0332346943102414e-11,5.669601829774489e-12,4.930796776461323e-12
USA,Activity,"Manufacture of bricks, tiles and construction products, in baked clay",5.39962718867234e-10,3.609889370085719e-11,3.029422140913929e-11,4.7975207234212555e-12,3.1156525613107944e-12
USA,Activity,"Manufacture of cement, lime and plaster",2.2459867313572935e-09,4.4166837084273426e-10,4.3036685706715256e-10,1.1345179572529333e-10,7.273968262704405e-11
USA,Activity,Manufacture of ceramic goods,2.2470475983324527e-10,2.386846415931742e-11,2.829180992336209e-11,8.26301399956482e-12,7.035385290148137e-12
USA,Activity,Manufacture of coke oven products,2.2143145687829266e-11,2.1287507590320782e-11,1.8622739259423163e-11,3.885912216911117e-12,2.1143793000666003e-12
USA,Activity,Manufacture of electrical machinery and apparatus n.e.c. (31),3.819771625775709e-10,3.4296189221775747e-10,2.427071545743343e-10,7.884469059765941e-11,5.0112065833699156e-11
USA,Activity,"Manufacture of fabricated metal products, except machinery and equipment (28)",8.957105195091528e-11,5.980371230387135e-11,5.27456871224473e-11,9.790852479785696e-12,6.0448671638664505e-12
USA,Activity,Manufacture of fish products,7.381032548979311e-11,7.518551030311973e-11,6.942094356476742e-11,1.7066355467173624e-11,1.235230080692633e-11
USA,Activity,Manufacture of furniture; manufacturing n.e.c. (36),6.720817835871928e-10,3.639983562547556e-10,3.182735214947557e-10,1.0141813755247162e-10,5.316943905987956e-11
USA,Activity,Manufacture of gas; distribution of gaseous fuels through mains,1.169418141462334e-10,1.2189573271075912e-11,1.0536209013144382e-11,2.9289460155130717e-12,1.6559776454290198e-12
USA,Activity,Manufacture of glass and glass products,4.153473384148758e-08,9.760595474501842e-10,7.255725905003475e-10,5.240676632703279e-11,3.76513446154319e-11
USA,Activity,Manufacture of machinery and equipment n.e.c. (29),1.4509024308490412e-10,1.0699709230022485e-10,8.82972799161289e-11,1.7756070648311418e-11,1.1462352819866601e-11
USA,Activity,"Manufacture of medical, precision and optical instruments, watches and clocks (33)",2.521732364278949e-10,4.2198270183298303e-10,2.8355119951708853e-10,6.279423055828936e-11,4.061129535047907e-11
USA,Activity,"Manufacture of motor vehicles, trailers and semi-trailers (34)",9.292869924020507e-10,4.815618950763439e-10,4.2585146142872794e-10,9.47216289626324e-11,7.367015769466173e-11
USA,Activity,Manufacture of office machinery and computers (30),8.197846701205597e-11,1.0279233331666048e-10,7.618130202890628e-11,1.8766750852015484e-11,1.2592814993815201e-11
USA,Activity,Manufacture of other non-metallic mineral products n.e.c.,3.328272400241482e-09,1.7991268863056516e-10,2.1375659691664885e-10,2.8999574081601406e-11,1.9613074200183548e-11
USA,Activity,Manufacture of other transport equipment (35),1.2065672765706812e-09,1.107664905727955e-09,9.576080339459126e-10,2.0084518374827213e-10,1.5237297416845074e-10
USA,Activity,"Manufacture of radio, television and communication equipment and apparatus (32)",6.053568046881767e-11,4.5873578598869506e-11,3.6255868576873373e-11,1.1473092471954621e-11,6.70908932037985e-12
USA,Activity,Manufacture of rubber and plastic products (25),1.612132294510248e-10,8.486225951075536e-11,7.651807676686667e-11,1.6774086298901253e-11,1.1373342695088795e-11
USA,Activity,Manufacture of textiles (17),1.0777573287501157e-09,6.096702304727182e-10,5.33453953777595e-10,1.2987616911288203e-10,7.640481905702184e-11
USA,Activity,Manufacture of tobacco products (16),6.655941590170443e-12,6.583955204547956e-12,5.445191311248999e-12,1.1092342400320327e-12,7.029577618553356e-13
USA,Activity,Manufacture of wearing apparel; dressing and dyeing of fur (18),5.541805378063603e-12,3.0615312357480174e-12,2.729564544712279e-12,7.437509768959921e-13,5.466688517312062e-13
USA,Activity,"Manufacture of wood and of products of wood and cork, except furniture; manufacture of articles of straw and plaiting materials (20)",2.9332581493795935e-09,1.1068046227138243e-09,1.0935747292146342e-09,2.1522882426370165e-10,1.4699554883690645e-10
USA,Activity,"Manure treatment (biogas), storage and land application",0.0,0.0,0.0,0.0,0.0
USA,Activity,"Manure treatment (conventional), storage and land application",0.0,0.0,0.0,0.0,0.0
USA,Activity,Meat animals nec,1.0620108702407034e-12,4.708851039684025e-13,4.3805793069759675e-13,1.1255967360509834e-13,8.148995496920128e-14
USA,Activity,Mining of aluminium ores and concentrates,8.349196544038276e-11,3.40311201113833e-12,2.6272990113422482e-12,2.8969094391137013e-13,1.8364929642356119e-13
USA,Activity,"Mining of chemical and fertilizer minerals, production of salt, other mining and quarrying n.e.c.",6.591698080283917e-10,5.034276696041891e-10,5.241172578220972e-10,6.222149352612856e-11,3.534816674737804e-11
USA,Activity,Mining of coal and lignite; extraction of peat (10),1.28845689117121e-08,1.4075122584259967e-09,1.4061531749163318e-09,5.587452744212906e-10,3.279463985348057e-10
USA,Activity,Mining of copper ores and concentrates,3.545714535647808e-10,2.1722019948660628e-10,1.6430041842771158e-10,2.387619336037021e-11,1.535466591160099e-11
USA,Activity,Mining of iron ores,2.0740464821497268e-10,1.2116159665744e-10,1.0542841359350836e-10,1.728449692038905e-11,1.058045196236745e-11
USA,Activity,"Mining of lead, zinc and tin ores and concentrates",2.730701385443876e-11,2.984031832450953e-11,2.857521571294862e-11,4.448944538290667e-12,2.9992523559506694e-12
USA,Activity,Mining of nickel ores and concentrates,0.0,0.0,0.0,0.0,0.0
USA,Activity,Mining of other non-ferrous metal ores and concentrates,9.327932034186093e-11,1.0498000949658057e-10,9.50105695036209e-11,1.746591152441685e-11,1.0589166454393668e-11
USA,Activity,Mining of precious metal ores and concentrates,3.1489225788029318e-09,2.0703280516404312e-10,1.6285480627529016e-10,2.5923233352070637e-11,1.8181104988167036e-11
USA,Activity,Mining of uranium and thorium ores (12),3.6127932703811107e-11,1.8807086747639958e-11,1.593202455084076e-11,3.628172976550146e-12,1.968952532534476e-12
USA,Activity,N-fertiliser,1.2748529512022178e-10,3.695753988226024e-11,3.200102807308439e-11,9.510480868200157e-12,4.680849040009164e-12
USA,Activity,Other business activities (74),4.032084856576059e-10,2.3142894235817036e-10,2.1057042834428546e-10,7.563645867273389e-11,5.817927157241728e-11
USA,Activity,Other land transport,4.37110769519478e-13,1.0793474446197246e-13,9.732532719592805e-14,2.8973660336178905e-14,2.5654482651028554e-14
USA,Activity,Other non-ferrous metal production,3.738276843087844e-10,4.5009945288715885e-10,4.0078765975856525e-10,6.556660328599716e-11,3.5920046844589467e-11
USA,Activity,Other service activities (93),3.2906471112412467e-12,1.1440093365288186e-12,1.0332495346539787e-12,3.2918215541029177e-13,2.427930718570014e-13
USA,Activity,P- and other fertiliser,1.7729231343120233e-10,7.685990487701368e-11,6.655615174401715e-11,2.1562907601118406e-11,1.0169773718043382e-11
USA,Activity,Paper,5.544243866798093e-08,1.7237535537921117e-08,1.4818067315100138e-08,3.840279973502603e-09,2.3773900390690504e-09
USA,Activity,Petroleum Refinery,3.190716654412129e-09,1.6238712191251305e-09,1.5646817372091459e-09,1.5080136224685332e-09,6.067318175213327e-10
USA,Activity,Pigs farming,2.3953944804686105e-10,1.3326043625420204e-10,1.1573742666388494e-10,3.102407569800655e-11,1.9388823318655152e-11
USA,Activity,"Plastics, basic",4.3054315540153124e-10,3.842323515834667e-10,3.108221191047686e-10,6.500881508479722e-11,5.060698250605314e-11
USA,Activity,Post and telecommunications (64),6.243124740600112e-11,3.027890392774623e-11,2.8026814200494756e-11,1.1109771112631957e-11,7.46174228453802e-12
USA,Activity,Poultry farming,1.9549845940410804e-10,1.3678131457001896e-10,1.211114424273171e-10,3.362307832238346e-11,1.9829137471399446e-11
USA,Activity,Precious metals production,7.585662812887589e-09,4.304375322491394e-10,3.4691815284116327e-10,5.559852263281952e-11,3.9470803735906536e-11
USA,Activity,Private households with employed persons (95),9.390674626149586e-13,1.1435602238102168e-12,9.619866719299742e-13,2.898954999067072e-13,1.6371216303492683e-13
USA,Activity,Processed rice,1.0122907592457545e-10,9.236184057988374e-11,8.299364716590968e-11,2.3059621300072165e-11,1.4076728523553609e-11
USA,Activity,Processing of Food products nec,7.624937650203001e-11,4.086340985080415e-11,3.569266858420598e-11,9.467932294921416e-12,6.002200523514039e-12
USA,Activity,Processing of dairy products,3.088245356001879e-10,1.5306747927893987e-10,1.2435049116048764e-10,3.1071443948122646e-11,1.9902385962325834e-11
USA,Activity,Processing of meat cattle,3.613405844864397e-11,2.295373177205008e-11,2.0662722957120092e-11,5.938234968272698e-12,3.881465043702752e-12
USA,Activity,Processing of meat pigs,3.061154391988799e-12,1.7240671793702098e-12,1.4925818565969255e-12,4.013634852227975e-13,2.4946540282206324e-13
USA,Activity,Processing of meat poultry,1.7151366368038471e-12,1.173827023994174e-12,1.044396399591863e-12,2.9552339626984097e-13,1.8087676407895014e-13
USA,Activity,Processing of nuclear fuel,1.726461178670852e-13,1.6727553833935554e-13,1.365442813635115e-13,3.0427129274318493e-14,1.986097867625356e-14
USA,Activity,Processing vegetable oils and fats,2.8936738467691193e-10,1.757477500673913e-10,1.5808214220012458e-10,4.3026678002348095e-11,2.48607360668053e-11
USA,Activity,Production of electricity by Geothermal,2.3277365652736159e-10,1.1084783216272502e-12,9.782598886003142e-13,2.4441443542380176e-13,1.5826144730276085e-13
USA,Activity,Production of electricity by biomass and waste,0.0,0.0,0.0,0.0,0.0
USA,Activity,Production of electricity by coal,2.1271417206853145e-06,3.090200657367049e-08,2.6592429907379348e-08,6.463545085122529e-09,4.005567292496209e-09
USA,Activity,Production of electricity by gas,3.0885755383130835e-07,1.4972358851659195e-09,1.2888212452557754e-09,3.160101901919209e-10,1.9651429531521651e-10
USA,Activity,Production of electricity by hydro,0.0,0.0,0.0,0.0,0.0
USA,Activity,Production of electricity by nuclear,5.5430054862579075e-09,4.1585830909575736e-11,3.577936311821973e-11,8.795250408182751e-12,5.46838408147682e-12
USA,Activity,Production of electricity by petroleum and other oil derivatives,2.4257322083619404e-08,2.5287276748295465e-10,2.2340205981469748e-10,5.975442487148525e-11,3.673381183439703e-11
USA,Activity,Production of electricity by solar photovoltaic,0.0,0.0,0.0,0.0,0.0
USA,Activity,Production of electricity by solar thermal,0.0,0.0,0.0,0.0,0.0
USA,Activity,"Production of electricity by tide, wave, ocean",0.0,0.0,0.0,0.0,0.0
USA,Activity,Production of electricity by wind,0.0,0.0,0.0,0.0,0.0
USA,Activity,Production of electricity nec,5.404194135067669e-10,2.5860346493308354e-12,2.2837717259272095e-12,5.851999201016618e-13,3.764914799377162e-13
USA,Activity,Production of meat products nec,5.885587350664327e-10,3.3603340152470943e-10,2.854772923425452e-10,7.395901282581272e-11,4.147727605431979e-11
USA,Activity,Production of offshore wind plants,0.0,0.0,0.0,0.0,0.0
USA,Activity,Production of onshore wind plants,0.0,0.0,0.0,0.0,0.0
USA,Activity,Production of photovoltaic plants,0.0,0.0,0.0,0.0,0.0
USA,Activity,Public administration and defence; compulsory social security (75),3.637461883694148e-10,2.072014748647428e-11,1.8361780301524774e-11,5.362811712137106e-12,3.67713310520943e-12
USA,Activity,"Publishing, printing and reproduction of recorded media (22)",3.560608130123267e-10,2.1029721479323123e-10,1.9018352343488106e-10,7.079068640987995e-11,5.2756742454827354e-11
USA,Activity,Pulp,5.355216443195926e-09,3.2248328681140932e-09,2.5094637749559457e-09,6.320944178753968e-10,3.6522881949898446e-10
USA,Activity,Quarrying of sand and clay,3.001694317132995e-09,3.785602488560867e-10,3.3924112147141786e-10,6.083489972392636e-11,4.528718396029123e-11
USA,Activity,Quarrying of stone,5.247255739814035e-10,1.1195772005422512e-10,1.2786878795536703e-10,2.5271004929774058e-11,1.500429996954552e-11
USA,Activity,Raw milk,8.627773467211721e-11,4.2490586609289396e-11,3.453092596196574e-11,8.633895364483199e-12,5.530807882289557e-12
USA,Activity,Re-processing of ash into clinker,0.0,0.0,0.0,0.0,0.0
USA,Activity,Re-processing of secondary aluminium into new aluminium,0.0,0.0,0.0,0.0,0.0
USA,Activity,Re-processing of secondary construction material into aggregates,0.0,0.0,0.0,0.0,0.0
USA,Activity,Re-processing of secondary copper into new copper,0.0,0.0,0.0,0.0,0.0
USA,Activity,Re-processing of secondary glass into new glass,0.0,0.0,0.0,0.0,0.0
USA,Activity,"Re-processing of secondary lead into new lead, zinc and tin",0.0,0.0,0.0,0.0,0.0
USA,Activity,Re-processing of secondary other non-ferrous metals into new other non-ferrous metals,0.0,0.0,0.0,0.0,0.0
USA,Activity,Re-processing of secondary paper into new pulp,0.0,0.0,0.0,0.0,0.0
USA,Activity,Re-processing of secondary plastic into new plastic,0.0,0.0,0.0,0.0,0.0
USA,Activity,Re-processing of secondary preciuos metals into new preciuos metals,0.0,0.0,0.0,0.0,0.0
USA,Activity,Re-processing of secondary steel into new steel,0.0,0.0,0.0,0.0,0.0
USA,Activity,Re-processing of secondary wood material into new wood material,0.0,0.0,0.0,0.0,0.0
USA,Activity,Real estate activities (70),4.321601921558836e-11,2.4576224554928275e-11,2.3051654276634535e-11,8.30430121185013e-12,5.743127128941549e-12
USA,Activity,"Recreational, cultural and sporting activities (92)",3.527616330838357e-11,1.9347770393667004e-11,1.7644084896730952e-11,6.463110263141796e-12,4.85559283142739e-12
USA,Activity,Recycling of bottles by direct reuse,0.0,0.0,0.0,0.0,0.0
USA,Activity,Recycling of waste and scrap,1.1918155132539741e-08,4.691907970212085e-09,4.014979819515456e-09,9.363381445595832e-10,5.511625462508554e-10
USA,Activity,Renting of machinery and equipment without operator and of personal and household goods (71),1.522991866725531e-10,7.35307315536837e-11,6.610666691541886e-11,2.2019469878837608e-11,1.488271603966224e-11
USA,Activity,Research and development (73),9.490511243480315e-11,1.965769653357215e-10,1.509093744257761e-10,2.5494479871714923e-11,1.369575972651541e-11
USA,Activity,Retail sale of automotive fuel,1.0920802310634023e-11,8.112550366625122e-12,9.678836837142375e-12,3.743629355479135e-12,4.07757629697579e-12
USA,Activity,"Retail trade, except of motor vehicles and motorcycles; repair of personal and household goods (52)",7.342797503945708e-12,1.511755814772626e-12,1.341060534530297e-12,3.9651688245137324e-13,2.43899866596452e-13
USA,Activity,"Sale, maintenance, repair of motor vehicles, motor vehicles parts, motorcycles, motor cycles parts and accessoiries",4.8124674965060235e-11,1.0104134338266462e-11,8.691650752547948e-12,2.2314571592350473e-12,1.4403430722352109e-12
USA,Activity,Sea and coastal water transport,9.296632700438617e-10,8.953583622857337e-10,2.060082648809684e-09,1.8957770484212014e-10,3.146430368596667e-10
USA,Activity,Steam and hot water supply,4.667920614470627e-09,1.5076566849976156e-09,1.3542200641362755e-09,4.1489148066073324e-10,2.507790836707952e-10
USA,Activity,Sugar refining,2.2884391633484747e-11,1.4891440464359826e-11,1.3275379844542616e-11,3.506587344782231e-12,2.868716850051916e-12
