Region,,,EU27+UK,EU27+UK,EU27+UK,EU27+UK,EU27+UK
Level,,,Activity,Activity,Activity,Activity,Activity
Item,,,Production of photovoltaic plants,Production of onshore wind plants,Production of offshore wind plants,Production of electricity by wind,Production of electricity by solar photovoltaic
Region,Level,Item,,,,,
China,Activity,Activities auxiliary to financial intermediation (67),5.008844427390202e-11,2.4100929134385125e-11,1.2754307092244626e-11,9.003717988637412e-13,5.781600257066814e-13
China,Activity,Activities of membership organisation n.e.c. (91),1.741831391706637e-10,2.8612809683306683e-11,1.5651827189968406e-11,1.0776238824699913e-12,7.738608496561653e-13
China,Activity,Air transport (62),7.07278727021608e-08,3.102948987165757e-08,1.670424958438525e-08,1.4118068438898934e-09,9.291011722764606e-10
China,Activity,Aluminium production,9.999438538018862e-09,8.00048781745328e-09,3.9244431733987615e-09,1.875699533437887e-10,1.1138397779699335e-10
China,Activity,Animal products nec,1.5904064745443702e-10,5.31069413278114e-11,3.2330351412173186e-11,3.767791664191096e-12,2.9366097883547694e-12
China,Activity,"Biogasification of food waste, incl. land application",0.0,0.0,0.0,0.0,0.0
China,Activity,"Biogasification of paper, incl. land application",0.0,0.0,0.0,0.0,0.0
China,Activity,"Biogasification of sewage slugde, incl. land application",0.0,0.0,0.0,0.0,0.0
China,Activity,Casting of metals,8.58096202677981e-09,3.837489520450913e-08,1.7227742649805555e-08,5.117468762875834e-10,2.984185467700342e-10
China,Activity,Cattle farming,7.877627924663672e-11,2.782132180792218e-11,1.62918295666339e-11,1.4437438671118226e-12,1.0170736913982657e-12
China,Activity,Chemicals nec,2.1316898944494107e-07,4.765892381640385e-08,2.9183684972281777e-08,4.404871263697809e-09,2.340896530741388e-09
China,Activity,"Collection, purification and distribution of water (41)",1.6280572191860835e-10,3.82759698934017e-11,2.0838811938989657e-11,1.5366596314890841e-12,9.609320555015853e-13
China,Activity,"Composting of food waste, incl. land application",1.839489655864145e-11,2.857084955460623e-12,1.657680610256723e-12,1.4229125746224496e-13,1.1552310732382033e-13
China,Activity,"Composting of paper and wood, incl. land application",7.825502619210653e-13,1.0297265407731264e-13,6.023034375559522e-14,4.527737550057786e-15,4.50142146463753e-15
China,Activity,Computer and related activities (72),4.415289367889646e-11,2.6156618496644942e-11,1.650172538691679e-11,8.345773035199502e-13,5.448170397926513e-13
China,Activity,Construction (45),3.16888908952485e-10,5.330553777837705e-11,3.119096099415226e-11,4.8387542518053695e-12,4.826644564691463e-12
China,Activity,Copper production,3.839890538888441e-09,2.321978109705535e-08,1.0523188232464496e-08,3.4563088631007453e-10,2.0360961478890557e-10
China,Activity,Cultivation of cereal grains nec,3.3900166057020335e-09,7.954381339248716e-10,4.542599261498592e-10,3.166929511193758e-11,2.8918619548864447e-11
China,Activity,Cultivation of crops nec,1.5909025476896134e-09,4.4974136536989885e-10,2.62382362141207e-10,2.2383384027453707e-11,1.5410945797815692e-11
China,Activity,Cultivation of oil seeds,2.5260272135787874e-09,1.289171635624547e-09,7.076292554408825e-10,6.769708411311648e-11,4.417869752790294e-11
China,Activity,Cultivation of paddy rice,7.496114550949158e-10,2.8920974401935436e-10,1.5590440932316174e-10,1.398805793570643e-11,8.53013315185735e-12
China,Activity,Cultivation of plant-based fibers,2.2942283804436476e-09,1.5639153523025125e-09,9.229728801520513e-10,9.446483415669293e-11,6.598220957562583e-11
China,Activity,"Cultivation of sugar cane, sugar beet",2.282035109805702e-09,7.659369497567042e-10,4.128342729666752e-10,2.659997251893043e-11,2.048379143624308e-11
China,Activity,"Cultivation of vegetables, fruit, nuts",4.918335321704008e-09,1.4608915310061088e-09,8.268398383800822e-10,6.000381317078102e-11,4.728424366920651e-11
China,Activity,Cultivation of wheat,4.415418149052065e-10,1.836275264372562e-10,1.0214976380526927e-10,8.970875489185533e-12,6.053766068130458e-12
China,Activity,Distribution and trade of electricity,2.411614840379085e-10,6.67834551687043e-11,3.8132634821614686e-11,1.9694892832547543e-12,1.2893811376439092e-12
China,Activity,Education (80),2.5281493147060665e-11,8.155072980421181e-12,4.289035153200234e-12,2.767499514124557e-13,1.868938099051848e-13
China,Activity,Extra-territorial organizations and bodies,0.0,0.0,0.0,0.0,0.0
China,Activity,"Extraction of crude petroleum and services related to crude oil extraction, excluding surveying",3.759973227900119e-09,1.6499606904032453e-09,9.270550641824056e-10,8.118467167343497e-11,4.884005993649974e-11
China,Activity,"Extraction of natural gas and services related to natural gas extraction, excluding surveying",7.328018431424646e-11,5.65417191664261e-11,3.059894154860679e-11,2.747067831478369e-12,1.6586811703718284e-12
China,Activity,"Extraction, liquefaction, and regasification of other petroleum and gaseous materials",0.0,0.0,0.0,0.0,0.0
China,Activity,"Financial intermediation, except insurance and pension funding (65)",8.468491094560231e-09,2.855659331877192e-09,1.4652725816912658e-09,8.947968500401615e-11,6.404526315594276e-11
China,Activity,"Fishing, operating of fish hatcheries and fish farms; service activities incidental to fishing (05)",6.5960680140192616e-15,4.551226870097088e-15,2.3503074691895754e-15,1.4757861002902473e-16,9.697356856260167e-17
China,Activity,"Forestry, logging and related service activities (02)",5.3295676445634104e-08,2.1929535002661572e-08,1.2429717754485709e-08,1.295097056364036e-09,7.905139920953206e-10
China,Activity,Health and social work (85),2.0116375302164395e-09,8.971111797003722e-10,4.263892433102455e-10,1.7524452236439086e-11,1.0400129077388386e-11
China,Activity,Hotels and restaurants (55),9.090509558541113e-10,4.535708063607349e-10,2.51498261575427e-10,1.443798034513242e-11,9.349368053977815e-12
China,Activity,Incineration of waste: Food,1.1799513289137294e-10,1.0890736171317064e-11,6.3160780031941e-12,4.1911131740718695e-13,3.363745510498103e-13
China,Activity,Incineration of waste: Metals and Inert materials,7.1603738490989035e-09,1.196235916243792e-09,7.937338588398102e-10,1.1531022865489006e-10,8.43062385966522e-11
China,Activity,Incineration of waste: Oil/Hazardous waste,1.0358658527194493e-08,1.570936701571268e-09,9.344242103249938e-10,1.039930660807196e-10,7.226245524647558e-11
China,Activity,Incineration of waste: Paper,1.1630070675582633e-10,1.0802176496153123e-11,6.2699001845988965e-12,4.1422759766307055e-13,3.3147903076644847e-13
China,Activity,Incineration of waste: Plastic,7.205332600044622e-09,1.255672957066246e-09,7.18112067366645e-10,5.893498275438974e-11,4.367744998409002e-11
China,Activity,Incineration of waste: Textiles,8.053400406003546e-09,1.3535625862454487e-09,7.654237955045225e-10,5.7680352470428805e-11,4.878369429103954e-11
China,Activity,Incineration of waste: Wood,7.98314173652246e-12,1.181881356179312e-12,6.90156656074744e-13,5.748148227173357e-14,4.7606639668368856e-14
China,Activity,Inland water transport,2.2100341521634916e-08,9.031925913600433e-09,4.8052057711841436e-09,3.216719494146241e-10,2.3506267011439387e-10
China,Activity,"Insurance and pension funding, except compulsory social security (66)",1.2079765272450423e-10,5.26031138729033e-11,2.6961851267775605e-11,1.7771548574851201e-12,1.337802906192003e-12
China,Activity,Landfill of waste: Food,2.866342450909244e-10,4.2432432409521784e-11,2.4090486071945078e-11,1.8120487531220454e-12,1.5573114139707158e-12
China,Activity,Landfill of waste: Inert/metal/hazardous,1.788864837991686e-10,1.6087125381248324e-11,9.40027873567079e-12,6.59887464535914e-13,5.129890239368806e-13
China,Activity,Landfill of waste: Paper,1.0497982019297552e-10,1.6421064188434733e-11,9.29213401211334e-12,6.859392467896512e-13,5.805328151213967e-13
China,Activity,Landfill of waste: Plastic,1.2761109894140013e-10,1.243778680812962e-11,7.121254034865568e-12,4.597849957162999e-13,3.6600086854974096e-13
China,Activity,Landfill of waste: Textiles,2.347775389659881e-11,3.4567213382335406e-12,2.000728170222864e-12,1.4986312183710513e-13,1.3261737958484875e-13
China,Activity,Landfill of waste: Wood,2.5196592195772272e-11,3.4765303417249293e-12,2.0361692741518917e-12,1.5515913946494695e-13,1.3960494088121137e-13
China,Activity,"Lead, zinc and tin production",5.111587381696856e-10,8.180201154257446e-10,3.948675075197337e-10,1.9953093357844755e-11,1.2251727115903841e-11
China,Activity,Manufacture of basic iron and steel and of ferro-alloys and first products thereof,6.453979629740868e-08,1.8919300369640212e-07,9.058924483914796e-08,3.8639636687783365e-09,2.2755547401780284e-09
China,Activity,Manufacture of beverages,5.38991963734148e-11,3.659581845987275e-11,1.9042870028733988e-11,1.1416113833218714e-12,7.290333736379777e-13
China,Activity,"Manufacture of bricks, tiles and construction products, in baked clay",4.0324457216559486e-10,2.004071564583577e-10,1.4647508593484993e-10,2.8864650500575902e-11,1.7917274716335235e-11
China,Activity,"Manufacture of cement, lime and plaster",5.120570177591897e-09,1.276018286085638e-09,1.6614342694812617e-09,4.5556467824946873e-10,3.5961805525876496e-10
China,Activity,Manufacture of ceramic goods,4.5561330715557175e-10,7.609617984135489e-10,4.0848221136955683e-10,4.396126976264909e-11,3.287873140555946e-11
China,Activity,Manufacture of coke oven products,6.037250543020094e-08,7.43198647809409e-08,3.828540469769632e-08,1.8590676376101668e-09,1.0962265188261094e-09
China,Activity,Manufacture of electrical machinery and apparatus n.e.c. (31),9.615491539388231e-10,1.164944455621461e-08,5.0590195164963046e-09,1.0791857209129011e-10,6.144813083127006e-11
China,Activity,"Manufacture of fabricated metal products, except machinery and equipment (28)",5.4408865443975894e-08,6.931619330952169e-08,3.731167740699455e-08,2.4044786592363073e-09,1.3833935157062304e-09
China,Activity,Manufacture of fish products,2.361860197707525e-10,1.6347618018417076e-10,8.406301063289674e-11,5.110305252422771e-12,3.378006820922277e-12
China,Activity,Manufacture of furniture; manufacturing n.e.c. (36),3.716456592014976e-09,3.452815470838727e-09,1.7862592527773608e-09,1.3455629100454056e-10,6.663528458443417e-11
China,Activity,Manufacture of gas; distribution of gaseous fuels through mains,4.257119041134637e-09,1.5712464320894462e-09,7.715194934442386e-10,3.868946734133588e-11,2.4428373189287363e-11
China,Activity,Manufacture of glass and glass products,1.397675164058855e-07,4.780217676569967e-09,2.608175326124618e-09,1.321786112803089e-10,8.461077101132397e-11
China,Activity,Manufacture of machinery and equipment n.e.c. (29),5.184375393906931e-09,5.190545992454657e-09,2.782744210233767e-09,1.846496609462274e-10,1.078056754180928e-10
China,Activity,"Manufacture of medical, precision and optical instruments, watches and clocks (33)",5.694709252600389e-11,1.2091134455151786e-10,6.409831874983004e-11,1.1050559234446852e-11,6.876671475158705e-12
China,Activity,"Manufacture of motor vehicles, trailers and semi-trailers (34)",8.220965267231989e-10,2.2514888117218505e-10,1.3765824279326758e-10,1.4224159984086639e-11,1.0411597794521624e-11
China,Activity,Manufacture of office machinery and computers (30),3.910697523995789e-10,4.2689038186093593e-10,2.570361281446237e-10,4.290846267385541e-11,2.849191864249427e-11
China,Activity,Manufacture of other non-metallic mineral products n.e.c.,7.044408704876944e-07,4.1557239721571075e-08,2.184429675369436e-08,1.1955574824747768e-09,7.697298789519092e-10
China,Activity,Manufacture of other transport equipment (35),6.795087991766172e-10,2.4962052461094493e-10,1.45856967448617e-10,1.4256887463980016e-11,1.1275276845442848e-11
China,Activity,"Manufacture of radio, television and communication equipment and apparatus (32)",1.1423152365715662e-09,1.2826128480541112e-09,9.186536879379733e-10,2.5180469767578993e-10,1.4515850517453555e-10
China,Activity,Manufacture of rubber and plastic products (25),8.74423825450848e-09,6.999452198798168e-09,3.7017462103589602e-09,3.039815131416416e-10,1.9396306390007093e-10
China,Activity,Manufacture of textiles (17),2.093128460690832e-09,1.4736643040224484e-09,8.247926937491533e-10,7.788968304516461e-11,5.4101734647229285e-11
China,Activity,Manufacture of tobacco products (16),4.264239679278095e-08,1.2849831423290989e-08,7.481883938850025e-09,2.9001231099560236e-10,1.7043167363791657e-10
China,Activity,Manufacture of wearing apparel; dressing and dyeing of fur (18),1.232330846580868e-09,4.6238528279631457e-10,2.5538575062688986e-10,2.2557068759697203e-11,1.7891904603642926e-11
China,Activity,"Manufacture of wood and of products of wood and cork, except furniture; manufacture of articles of straw and plaiting materials (20)",3.0871819295445376e-09,1.944419984444331e-09,1.7242940493554432e-09,2.442587620544578e-10,1.8177483520886888e-10
China,Activity,"Manure treatment (biogas), storage and land application",0.0,0.0,0.0,0.0,0.0
China,Activity,"Manure treatment (conventional), storage and land application",0.0,0.0,0.0,0.0,0.0
China,Activity,Meat animals nec,1.6863957461143592e-09,7.298920277347987e-11,5.829763315287527e-11,4.1979415738366366e-12,1.0948726110142741e-11
China,Activity,Mining of aluminium ores and concentrates,5.86910129968554e-09,3.4159821391047876e-09,2.2167217926002134e-09,1.7252135869918885e-10,1.0275886027516166e-10
China,Activity,"Mining of chemical and fertilizer minerals, production of salt, other mining and quarrying n.e.c.",1.5295362969159052e-09,1.184133402495895e-09,1.0490140927125865e-09,9.39771659448559e-11,6.168475489671533e-11
China,Activity,Mining of coal and lignite; extraction of peat (10),2.478552680925653e-07,3.112211048335565e-08,1.6820838616753396e-08,8.751839566432625e-10,5.505307211257504e-10
China,Activity,Mining of copper ores and concentrates,1.1237396589826934e-09,2.9290094357132514e-09,1.3359729334545256e-09,4.4481817405895355e-11,2.6177615507086153e-11
China,Activity,Mining of iron ores,3.3311712627366024e-10,7.744630896368527e-10,3.80210801097358e-10,1.7560226484555724e-11,1.0382882771040837e-11
China,Activity,"Mining of lead, zinc and tin ores and concentrates",2.3533411721823305e-09,1.5693716760721895e-09,8.170134995436245e-10,4.398164313157672e-11,2.728050995261876e-11
China,Activity,Mining of nickel ores and concentrates,3.1661302816669945e-09,4.442524925495978e-09,8.289852110483906e-09,1.252319583457412e-10,7.515565281980442e-11
China,Activity,Mining of other non-ferrous metal ores and concentrates,3.472356757225025e-09,3.658715208151253e-09,1.772580553048935e-09,8.409563781405222e-11,4.871582355295003e-11
China,Activity,Mining of precious metal ores and concentrates,4.16163628312506e-08,2.820518428767883e-09,1.2922738131437642e-09,5.0571867295733475e-11,2.889942583513826e-11
China,Activity,Mining of uranium and thorium ores (12),3.301513326363112e-10,3.798451423212727e-10,1.9076895173441903e-10,1.5705227003011888e-11,9.545728754045254e-12
China,Activity,N-fertiliser,3.05195909631986e-11,8.964373854065596e-12,5.202404740843165e-12,1.8784528000555927e-12,3.653425406987828e-13
China,Activity,Other business activities (74),2.0602387883057427e-09,1.3840441638854684e-09,6.791889186195206e-10,3.679695325714192e-11,2.306499750342261e-11
China,Activity,Other land transport,2.3575158855677736e-09,8.860106962696874e-10,4.818490035930921e-10,3.38833318475457e-11,2.9132404942716204e-11
China,Activity,Other non-ferrous metal production,1.591415338344956e-08,2.7784679015867303e-08,5.3217318180794644e-08,7.902651884506429e-10,4.744800875609686e-10
China,Activity,Other service activities (93),4.3909312258038374e-10,5.593581919998036e-11,3.281449887665809e-11,1.9429612222366157e-12,2.7197294317983024e-12
China,Activity,P- and other fertiliser,2.1742277218289902e-09,7.567306786867682e-10,4.4449584064836075e-10,5.895379443174383e-11,3.4028463594245747e-11
China,Activity,Paper,9.72523365828921e-09,3.6842783608668987e-09,2.0511564332329682e-09,2.1560776864779147e-10,1.3557191793797524e-10
China,Activity,Petroleum Refinery,4.87352886262798e-09,2.211543192208171e-09,1.2486629105176799e-09,1.0776882393443592e-10,6.623369370305945e-11
China,Activity,Pigs farming,2.5315443157558227e-09,1.3268026467090996e-10,9.935324494557926e-11,6.736258913927896e-12,1.6421965768969884e-11
China,Activity,"Plastics, basic",1.5040430881660487e-10,1.6124243807917776e-10,8.473644588813417e-11,7.20433564301801e-12,5.065958396012542e-12
China,Activity,Post and telecommunications (64),1.1218788221882445e-11,8.076809600934077e-12,4.314738734063419e-12,2.8827921229469337e-13,1.8127693626939012e-13
China,Activity,Poultry farming,1.8188509279232322e-09,4.585711174098204e-10,2.6375750953786226e-10,1.6028939483039628e-11,1.4622803366243806e-11
China,Activity,Precious metals production,1.5823828594650897e-07,1.0550966963093879e-08,4.811832476911252e-09,1.8907000275547583e-10,1.0797453153045367e-10
China,Activity,Private households with employed persons (95),2.9982824936871436e-12,1.846579838851067e-12,1.5631042999948012e-12,5.049599328964403e-13,3.0019342703060457e-13
China,Activity,Processed rice,1.5132021461069553e-09,6.670433173303083e-10,3.558100591532842e-10,3.049336282633845e-11,1.846537424635125e-11
China,Activity,Processing of Food products nec,6.640118865399729e-10,1.5172246410145902e-10,8.674508068934912e-11,6.013136089381008e-12,5.623403812531891e-12
China,Activity,Processing of dairy products,2.954226012604267e-10,9.234110438012503e-11,5.095568400619984e-11,3.581703935105271e-12,2.7167459488402267e-12
China,Activity,Processing of meat cattle,5.002324119475008e-10,2.0597345302753341e-10,1.145988854473579e-10,6.708276190701938e-12,4.622879357119262e-12
China,Activity,Processing of meat pigs,1.5819266769936877e-11,5.810784458466325e-12,3.2491374896369167e-12,1.9905394863944736e-13,1.3806405161824791e-13
China,Activity,Processing of meat poultry,1.9226879847943724e-11,6.911121284101326e-12,3.8768510694023e-12,2.436064995536789e-13,1.6492180252276985e-13
China,Activity,Processing of nuclear fuel,1.108052011917737e-10,9.817390385106967e-11,5.886493200830953e-11,6.216933539760078e-12,4.173870080541248e-12
China,Activity,Processing vegetable oils and fats,2.270478747684085e-12,7.576108532128847e-13,4.224592499324102e-13,4.0317490200123406e-14,2.486276175387414e-14
China,Activity,Production of electricity by Geothermal,1.9134690715225263e-08,1.964376687988898e-09,1.0556115336221948e-09,5.7189694562498846e-11,3.6034287538957364e-11
China,Activity,Production of electricity by biomass and waste,0.0,0.0,0.0,0.0,0.0
China,Activity,Production of electricity by coal,2.391141019752526e-05,1.5350644667698545e-06,8.896185382817812e-07,4.376682128815471e-08,2.7736185620007534e-08
China,Activity,Production of electricity by gas,3.247566936168364e-08,1.0698064623702894e-09,6.269758000792189e-10,3.082837446159997e-11,1.979446870353597e-11
China,Activity,Production of electricity by hydro,0.0,0.0,0.0,0.0,0.0
China,Activity,Production of electricity by nuclear,8.591129757745645e-11,2.7558467216545693e-12,1.5675116247401685e-12,9.245823980665443e-14,5.651577011925192e-14
China,Activity,Production of electricity by petroleum and other oil derivatives,8.359362710139389e-10,1.4254064986386621e-10,7.56517406429251e-11,4.74031699857292e-12,2.831672880954188e-12
China,Activity,Production of electricity by solar photovoltaic,0.0,0.0,0.0,0.0,0.0
China,Activity,Production of electricity by solar thermal,0.0,0.0,0.0,0.0,0.0
China,Activity,"Production of electricity by tide, wave, ocean",0.0,0.0,0.0,0.0,0.0
China,Activity,Production of electricity by wind,0.0,0.0,0.0,0.0,0.0
China,Activity,Production of electricity nec,4.2730816015489905e-08,1.0418374049512551e-08,5.861414511131464e-09,4.0207821388341663e-10,2.4765674128545667e-10
China,Activity,Production of meat products nec,2.670583797867877e-11,9.611131269937252e-12,5.496184701324486e-12,5.038001196995151e-13,3.539438477101421e-13
China,Activity,Production of offshore wind plants,0.0,0.0,0.0,0.0,0.0
China,Activity,Production of onshore wind plants,0.0,0.0,0.0,0.0,0.0
China,Activity,Production of photovoltaic plants,0.0,0.0,0.0,0.0,0.0
China,Activity,Public administration and defence; compulsory social security (75),6.308375269721677e-11,2.789170647295181e-11,1.463565440344399e-11,1.0182990222526675e-12,6.449198754390558e-13
China,Activity,"Publishing, printing and reproduction of recorded media (22)",1.784432437401123e-10,9.085346197065975e-11,4.821359750682962e-11,4.238963430923933e-12,2.6211241869988938e-12
China,Activity,Pulp,2.20184952270237e-09,8.807494505157788e-10,5.109231641850271e-10,6.442598083293316e-11,3.933178290687297e-11
China,Activity,Quarrying of sand and clay,1.3159429409676498e-08,1.3108593692965274e-09,7.359148129664506e-10,6.953184185624195e-11,3.935763731324245e-11
China,Activity,Quarrying of stone,6.8056410971991685e-09,3.8543259556756534e-10,2.2257994871615983e-10,1.3480053572317393e-11,9.287429452566677e-12
China,Activity,Raw milk,6.4380409406351766e-09,1.4860820415103047e-09,8.388252341622055e-10,6.197612586451405e-11,5.563706889561997e-11
China,Activity,Re-processing of ash into clinker,0.0,0.0,0.0,0.0,0.0
China,Activity,Re-processing of secondary aluminium into new aluminium,0.0,0.0,0.0,0.0,0.0
China,Activity,Re-processing of secondary construction material into aggregates,0.0,0.0,0.0,0.0,0.0
China,Activity,Re-processing of secondary copper into new copper,0.0,0.0,0.0,0.0,0.0
China,Activity,Re-processing of secondary glass into new glass,0.0,0.0,0.0,0.0,0.0
China,Activity,"Re-processing of secondary lead into new lead, zinc and tin",0.0,0.0,0.0,0.0,0.0
China,Activity,Re-processing of secondary other non-ferrous metals into new other non-ferrous metals,0.0,0.0,0.0,0.0,0.0
China,Activity,Re-processing of secondary paper into new pulp,2.0875270809100394e-06,6.503567316738852e-09,3.5088038296576105e-09,2.1333647954954605e-10,1.3060125673962566e-10
China,Activity,Re-processing of secondary plastic into new plastic,0.0,0.0,0.0,0.0,0.0
China,Activity,Re-processing of secondary preciuos metals into new preciuos metals,0.0,0.0,0.0,0.0,0.0
China,Activity,Re-processing of secondary steel into new steel,0.0,0.0,0.0,0.0,0.0
China,Activity,Re-processing of secondary wood material into new wood material,0.0,0.0,0.0,0.0,0.0
China,Activity,Real estate activities (70),3.507942433659855e-10,1.3408679889589355e-10,7.006332746377675e-11,4.384553383768347e-12,3.46386497572591e-12
China,Activity,"Recreational, cultural and sporting activities (92)",1.1755472590135339e-10,4.152667096420132e-11,2.1642305136389095e-11,1.2687885910352783e-12,8.460424211312481e-13
China,Activity,Recycling of bottles by direct reuse,0.0,0.0,0.0,0.0,0.0
China,Activity,Recycling of waste and scrap,1.1265981127798475e-10,4.8780415356298154e-11,2.407202470190005e-11,1.1440376613797025e-12,7.098678898720818e-13
China,Activity,Renting of machinery and equipment without operator and of personal and household goods (71),1.4674651870431908e-09,1.104013424708075e-09,5.640002422978249e-10,2.917257526381258e-11,1.7414030044764053e-11
China,Activity,Research and development (73),1.9068142322759007e-11,2.9877618416162915e-11,1.4971817161491812e-11,1.2397944761767865e-12,7.527959024457826e-13
China,Activity,Retail sale of automotive fuel,1.8019964350464383e-10,7.150764906106418e-11,3.6479026156794973e-11,2.3323797946933566e-12,1.5481575540231063e-12
China,Activity,"Retail trade, except of motor vehicles and motorcycles; repair of personal and household goods (52)",1.3224606109655587e-09,4.675014898787854e-10,2.530636350670146e-10,1.475907983824178e-11,9.534205660341101e-12
China,Activity,"Sale, maintenance, repair of motor vehicles, motor vehicles parts, motorcycles, motor cycles parts and accessoiries",3.324996329489902e-11,1.1480490318192735e-11,6.2234052597769026e-12,3.526744021331244e-13,2.368555242109241e-13
China,Activity,Sea and coastal water transport,2.3770993493396526e-07,3.184301496927124e-09,4.441160653992332e-09,2.6113326890823403e-10,1.4006150138155076e-09
China,Activity,Steam and hot water supply,4.0825949651099703e-07,1.6005021330143387e-07,7.994174270947971e-08,4.665781664404257e-09,3.0306345343917153e-09
China,Activity,Sugar refining,3.970275513009596e-12,1.1626298005793483e-12,6.36227533431925e-13,4.1485034939035636e-14,3.463214643920946e-14
China,Activity,Supporting and auxiliary transport activities; activities of travel agencies (63),6.244169264641698e-10,2.417990616105625e-10,1.306663813684258e-10,7.949910684622458e-12,5.4867806349375045e-12
China,Activity,"Tanning and dressing of leather; manufacture of luggage, handbags, saddlery, harness and footwear (19)",1.6761078365936409e-09,1.481481421257601e-09,8.822089579681331e-10,1.1574594032704172e-10,6.891214093217306e-11
China,Activity,Transmission of electricity,3.605949484885209e-09,1.3497525019207889e-09,7.384567326433629e-10,4.087962200196097e-11,2.4646069629425273e-11
China,Activity,Transport via pipelines,3.637784551536249e-10,1.402163490599897e-10,7.395912985821806e-11,5.938855374901277e-12,7.0053994839715384e-12
China,Activity,Transport via railways,1.141117836223669e-08,5.12344558458031e-09,2.6954579980598304e-09,1.5585404592617344e-10,1.2002026032988163e-10
China,Activity,"Waste water treatment, food",3.423370476517831e-10,4.327881288932438e-11,2.478210483788976e-11,1.7904751807300196e-12,1.672223781610498e-12
China,Activity,"Waste water treatment, other",6.605935661164795e-10,8.761567205576293e-11,5.0561346168356134e-11,3.821487802030972e-12,3.403499446414276e-12
China,Activity,"Wholesale trade and commission trade, except of motor vehicles and motorcycles (51)",4.949644994574494e-11,2.050861117440389e-11,1.1143112847149854e-11,7.069941650606758e-13,5.091638712460046e-13
China,Activity,"Wool, silk-worm cocoons",3.565900890608264e-10,1.9380378404923436e-10,1.3324149973050862e-10,1.4023579611117198e-11,1.01703488870741e-11
