EU27+UK,Activity,Activities auxiliary to financial intermediation (67),1.487471647140683e-09,2.003326208025076e-09,2.133083791538241e-09,2.382060839801373e-09,1.5914374204457028e-09
EU27+UK,Activity,Activities of membership organisation n.e.c. (91),2.6723050881160816e-11,3.6567046977076826e-11,3.825679256548761e-11,7.48798860695258e-11,5.481290407178656e-11
EU27+UK,Activity,Air transport (62),1.0106092797611228e-07,1.4596679068920949e-07,1.5184934356774765e-07,1.3254038945687022e-07,9.925073849466928e-08
EU27+UK,Activity,Aluminium production,1.0796264976735796e-08,3.746197344520427e-09,3.4082507829682287e-09,1.3316093460880434e-09,4.696027956030099e-09
EU27+UK,Activity,Animal products nec,5.282811254458614e-10,6.557973568409528e-10,7.11154402560807e-10,4.794679216019438e-10,4.423397217064075e-10
EU27+UK,Activity,"Biogasification of food waste, incl. land application",1.3046390720173901e-11,1.8927238544183667e-11,2.0138488195264295e-11,1.5659507596729057e-11,9.207210767062903e-12
EU27+UK,Activity,"Biogasification of paper, incl. land application",2.202471913468798e-12,3.1976014870813683e-12,3.3501839759149272e-12,2.4922699031220634e-12,1.5057734096612124e-12
EU27+UK,Activity,"Biogasification of sewage slugde, incl. land application",1.0912755293243428e-10,1.6458700511342745e-10,1.7045879360581456e-10,1.0327704108620747e-10,7.483570941301948e-11
EU27+UK,Activity,Casting of metals,5.87286042017069e-09,1.3214157253853227e-08,1.2235725514028131e-08,5.765906734733292e-09,4.179388181127218e-09
EU27+UK,Activity,Cattle farming,7.712205558963109e-10,9.8898537021094e-10,9.89166782117198e-10,9.647945663127465e-10,7.576511201749609e-10
EU27+UK,Activity,Chemicals nec,5.584279323649069e-09,5.142558145745295e-08,3.725294409907503e-08,1.396413829938775e-08,3.2415957085962416e-09
EU27+UK,Activity,"Collection, purification and distribution of water (41)",3.039649710374081e-09,2.4244557742217037e-09,2.4749076174478093e-09,4.470195257280537e-09,2.8498014775697113e-09
EU27+UK,Activity,"Composting of food waste, incl. land application",1.1272690639503266e-10,1.3747247056840293e-10,1.4569246698160965e-10,1.205468865428967e-10,7.776521900721721e-11
EU27+UK,Activity,"Composting of paper and wood, incl. land application",3.096666273090457e-13,3.647663717331967e-13,3.854136823672901e-13,2.503780151168739e-13,2.0436861979376337e-13
EU27+UK,Activity,Computer and related activities (72),8.413524165702963e-10,1.2719284492742016e-09,1.2449085118260533e-09,1.1157029050648472e-09,7.527861284135945e-10
EU27+UK,Activity,Construction (45),5.4409295708528164e-08,8.039347183681849e-09,2.841112255344267e-08,1.1648869315551163e-08,2.730268072928347e-08
EU27+UK,Activity,Copper production,3.4284051248276506e-09,7.988552433926908e-09,6.879717299756968e-09,3.077044042551683e-09,2.108437992694046e-09
EU27+UK,Activity,Cultivation of cereal grains nec,1.8198925767510833e-09,2.5604755278332765e-09,2.5301305185224425e-09,1.4964029664039612e-09,1.3079997863004026e-09
EU27+UK,Activity,Cultivation of crops nec,3.378467968992732e-10,2.7185141093316904e-10,3.2583352655370336e-10,1.9204714900456195e-10,2.1244891426209074e-10
EU27+UK,Activity,Cultivation of oil seeds,5.337946580990128e-10,1.0559422581832098e-09,1.07792881587818e-09,5.622132184439083e-10,4.212319859852333e-10
EU27+UK,Activity,Cultivation of paddy rice,2.183188876269668e-10,4.3805033686061865e-10,4.374052001383891e-10,2.313824044904087e-10,1.6042008897285536e-10
EU27+UK,Activity,Cultivation of plant-based fibers,7.47707493710046e-11,1.101759742247849e-10,1.0557522131144499e-10,5.518413165839963e-11,5.086698451106274e-11
EU27+UK,Activity,"Cultivation of sugar cane, sugar beet",1.968295159743956e-10,4.6554630323161424e-10,4.2817316597044805e-10,2.2071814743149973e-10,1.5080429104688802e-10
EU27+UK,Activity,"Cultivation of vegetables, fruit, nuts",7.259783870593812e-10,9.714047216156863e-10,9.642330250394127e-10,5.310207907221732e-10,4.703212861486816e-10
EU27+UK,Activity,Cultivation of wheat,1.4408820061683027e-09,2.454029441024253e-09,2.347295380873071e-09,1.3501278680971378e-09,1.0699205968434074e-09
EU27+UK,Activity,Distribution and trade of electricity,6.54185583246516e-09,8.226335608698173e-09,8.684875364039795e-09,6.848510725292783e-09,5.515187914887229e-09
EU27+UK,Activity,Education (80),8.622520756213673e-11,1.3664136460683714e-10,1.2758227327372446e-10,1.7096746550986912e-10,8.81634051629342e-11
EU27+UK,Activity,Extra-territorial organizations and bodies,7.71732465835849e-17,7.993598360031019e-18,8.00719940177975e-18,6.287077526847173e-18,3.447309860265345e-17
EU27+UK,Activity,"Extraction of crude petroleum and services related to crude oil extraction, excluding surveying",2.17822489488233e-09,1.7899984315567767e-09,1.8207127119045983e-09,4.6851700343856316e-09,3.1975943245055884e-09
EU27+UK,Activity,"Extraction of natural gas and services related to natural gas extraction, excluding surveying",4.725982280567685e-09,3.5867598285059873e-09,3.5285217390136053e-09,5.0584324111250434e-09,4.162597286663499e-09
EU27+UK,Activity,"Extraction, liquefaction, and regasification of other petroleum and gaseous materials",1.1354940675592023e-10,2.9240421207507955e-11,3.383061811744967e-11,2.9212343728152343e-11,5.907644086657977e-11
EU27+UK,Activity,"Financial intermediation, except insurance and pension funding (65)",6.5098154872362276e-09,8.454004677173854e-09,8.724442723384894e-09,1.145269564042567e-08,6.9687079132330044e-09
EU27+UK,Activity,"Fishing, operating of fish hatcheries and fish farms; service activities incidental to fishing (05)",2.3415346872557406e-10,1.8752517110289094e-10,2.6402905678682877e-10,1.396549428513211e-10,1.4777881437485743e-10
EU27+UK,Activity,"Forestry, logging and related service activities (02)",4.2120756018549994e-08,3.166351453641443e-08,3.964254642139137e-08,1.9695259996701927e-08,2.3309669524384342e-08
EU27+UK,Activity,Health and social work (85),3.8244945486780126e-11,6.801773337355785e-11,6.335131279953191e-11,6.418433226389158e-11,3.916291386672737e-11
EU27+UK,Activity,Hotels and restaurants (55),1.6270432294599134e-09,2.3824666067547545e-09,2.4959336266013373e-09,1.6917977700431644e-09,1.3841634151561673e-09
EU27+UK,Activity,Incineration of waste: Food,1.2691762900671627e-08,1.1460648656854692e-08,1.18623418253675e-08,7.556112055182614e-09,7.123480382253584e-09
EU27+UK,Activity,Incineration of waste: Metals and Inert materials,1.0850993668258169e-08,1.4101143689295506e-08,1.5692758307878036e-08,1.1694000717613498e-08,7.48772111710549e-09
EU27+UK,Activity,Incineration of waste: Oil/Hazardous waste,1.122403839734922e-09,9.147380478730586e-10,9.52306039560387e-10,6.313041563691382e-10,6.314261338654988e-10
EU27+UK,Activity,Incineration of waste: Paper,1.1686949847538423e-08,1.097656328610597e-08,1.140054187870486e-08,7.616452013192347e-09,6.844624579952036e-09
EU27+UK,Activity,Incineration of waste: Plastic,4.6795022761308065e-09,5.371929934805583e-09,5.678531544492853e-09,4.4739112295060965e-09,3.12013420443839e-09
EU27+UK,Activity,Incineration of waste: Textiles,4.333707094012544e-09,4.249694610799042e-09,4.36491638026919e-09,2.787036299156468e-09,2.5064316560734745e-09
EU27+UK,Activity,Incineration of waste: Wood,3.8136827356697395e-09,3.1550984404403584e-09,3.283244111422428e-09,2.1573247972917226e-09,2.1551556502149364e-09
EU27+UK,Activity,Inland water transport,1.1837266526575635e-08,1.6968923394979116e-08,2.0126927072880318e-08,1.2817198083518688e-08,1.0645732071992388e-08
EU27+UK,Activity,"Insurance and pension funding, except compulsory social security (66)",1.2367398770758254e-09,1.618110044343942e-09,1.8246071053943888e-09,2.309270760436399e-09,2.022655735377644e-09
EU27+UK,Activity,Landfill of waste: Food,1.2745736545758077e-10,1.445429053589011e-10,1.5640379122906037e-10,1.0967108301120074e-10,8.323767590010841e-11
EU27+UK,Activity,Landfill of waste: Inert/metal/hazardous,1.698578978828559e-10,2.4296162104478116e-10,2.5733913487747303e-10,1.6738243061058194e-10,1.1482677905962327e-10
EU27+UK,Activity,Landfill of waste: Paper,8.400863374509915e-11,9.765370269596986e-11,1.0530176059987929e-10,7.345424880187749e-11,5.526943949009022e-11
EU27+UK,Activity,Landfill of waste: Plastic,2.1135367740736363e-11,2.832406268207402e-11,2.967718013534002e-11,2.017989900266948e-11,1.4011255610733463e-11
EU27+UK,Activity,Landfill of waste: Textiles,2.0817961815095402e-11,2.623039018552889e-11,2.8040583785259007e-11,1.9614703924074415e-11,1.41118050888366e-11
EU27+UK,Activity,Landfill of waste: Wood,3.4033010430120894e-11,4.493842518853816e-11,4.793986876958769e-11,3.247320424423846e-11,2.3105808098758455e-11
EU27+UK,Activity,"Lead, zinc and tin production",5.242373506127603e-10,1.4207325103259626e-09,1.4411634969421243e-09,5.883707520481831e-10,3.368174240434837e-10
EU27+UK,Activity,Manufacture of basic iron and steel and of ferro-alloys and first products thereof,1.656800796061962e-08,5.658155448278552e-08,5.323708623220311e-08,2.148577972552023e-08,1.0919403226729246e-08
EU27+UK,Activity,Manufacture of beverages,2.742721080475072e-10,4.84796522455491e-10,4.797082388982562e-10,2.651703357441546e-10,1.96323887122486e-10
EU27+UK,Activity,"Manufacture of bricks, tiles and construction products, in baked clay",1.4696148288077648e-08,4.9198027991082194e-09,1.0332689069036783e-08,7.158406421055446e-09,9.61886464915036e-09
EU27+UK,Activity,"Manufacture of cement, lime and plaster",5.6752035983866334e-08,1.6922655698426914e-08,3.649752796127444e-08,2.0899401358129957e-08,3.3442201575821776e-08
EU27+UK,Activity,Manufacture of ceramic goods,7.808173287452172e-09,4.965629321574024e-09,6.821611617799337e-09,3.8587579021405885e-09,4.862957789990909e-09
EU27+UK,Activity,Manufacture of coke oven products,3.88038452078746e-09,7.539501694000214e-09,7.205752329827051e-09,3.0093501570283913e-09,2.250186900642868e-09
EU27+UK,Activity,Manufacture of electrical machinery and apparatus n.e.c. (31),1.5545375018236618e-08,1.8717940093971622e-08,1.1137277759930992e-08,5.829823987441374e-09,7.781028525671553e-09
EU27+UK,Activity,"Manufacture of fabricated metal products, except machinery and equipment (28)",4.560726927348914e-09,4.4666730312649945e-08,4.3128478541552164e-08,1.3653316399072222e-08,2.6553771184510063e-09
EU27+UK,Activity,Manufacture of fish products,3.8954535929190654e-10,8.917791947627834e-10,9.236621044408329e-10,4.2085224603473323e-10,2.713499215500722e-10
EU27+UK,Activity,Manufacture of furniture; manufacturing n.e.c. (36),4.41286295517668e-09,1.13237465617785e-08,1.1473390677711683e-08,5.6807080668081696e-09,2.749653560090693e-09
EU27+UK,Activity,Manufacture of gas; distribution of gaseous fuels through mains,7.086084277096931e-08,2.7638703403722874e-08,2.89758257461171e-08,2.6309373983262224e-07,1.8583513516437215e-07
EU27+UK,Activity,Manufacture of glass and glass products,2.3438220202732878e-08,5.783198805647303e-07,3.901005080161592e-07,1.282976770065501e-07,1.1672974545518952e-08
EU27+UK,Activity,Manufacture of machinery and equipment n.e.c. (29),1.5506916278822313e-09,2.919171181718002e-09,2.4425608898132825e-09,1.0839698474789556e-09,8.370507600052195e-10
EU27+UK,Activity,"Manufacture of medical, precision and optical instruments, watches and clocks (33)",4.0812790771851195e-09,7.53656398135766e-09,6.289964515518536e-09,3.4871813363127627e-09,2.6832180229813397e-09
EU27+UK,Activity,"Manufacture of motor vehicles, trailers and semi-trailers (34)",9.038127189523363e-10,2.0103888197079294e-09,1.8153501356451196e-09,8.181843813475879e-10,5.830438873960969e-10
EU27+UK,Activity,Manufacture of office machinery and computers (30),1.7778298706447372e-10,3.1436549170132207e-10,2.620815199256329e-10,1.4355163167827722e-10,1.139730996484557e-10
EU27+UK,Activity,Manufacture of other non-metallic mineral products n.e.c.,7.404793959797251e-08,3.004825870580936e-07,9.1126417856907e-07,2.0497671826032812e-07,3.738183314065907e-08
EU27+UK,Activity,Manufacture of other transport equipment (35),4.176639960767468e-09,8.855649937666203e-09,7.48987828624406e-09,3.2339068465113938e-09,2.3675338232307678e-09
EU27+UK,Activity,"Manufacture of radio, television and communication equipment and apparatus (32)",6.798632178567817e-09,1.0434809515135067e-08,8.193271227164813e-09,5.072935798598018e-09,4.062514399852653e-09
EU27+UK,Activity,Manufacture of rubber and plastic products (25),2.0665094037695497e-09,3.7426258541954376e-09,3.5661206004895655e-09,1.694446360164875e-09,1.2926283226999073e-09
EU27+UK,Activity,Manufacture of textiles (17),2.2923791785093745e-10,4.709626033157765e-10,4.312928052403647e-10,1.8799330665392536e-10,1.3638695408561236e-10
EU27+UK,Activity,Manufacture of tobacco products (16),5.090606357247631e-10,7.195597001652637e-10,6.767214273947212e-10,3.6229561358087497e-10,3.2970282550667535e-10
EU27+UK,Activity,Manufacture of wearing apparel; dressing and dyeing of fur (18),1.5710845958218268e-10,3.264207776618504e-10,3.173083915481184e-10,1.634294714012688e-10,1.1262595022419038e-10
EU27+UK,Activity,"Manufacture of wood and of products of wood and cork, except furniture; manufacture of articles of straw and plaiting materials (20)",5.333985795856936e-08,4.086060701425189e-08,5.3556722253827596e-08,2.4656452555732326e-08,2.925286608859369e-08
EU27+UK,Activity,"Manure treatment (biogas), storage and land application",0.0,0.0,0.0,0.0,0.0
EU27+UK,Activity,"Manure treatment (conventional), storage and land application",0.0,0.0,0.0,0.0,0.0
EU27+UK,Activity,Meat animals nec,2.372690365976954e-10,4.145299065711552e-10,4.2382529165532156e-10,2.7561904205211887e-10,2.0887718041017486e-10
EU27+UK,Activity,Mining of aluminium ores and concentrates,3.046034569870544e-09,1.224017727694998e-08,1.0156089686380693e-08,3.358974139435378e-09,1.5073713801643346e-09
EU27+UK,Activity,"Mining of chemical and fertilizer minerals, production of salt, other mining and quarrying n.e.c.",4.949108870836659e-10,2.568038047336485e-09,2.609314511298357e-09,8.813584377270729e-10,3.0505218743809677e-10
EU27+UK,Activity,Mining of coal and lignite; extraction of peat (10),1.6035091456885333e-07,4.4048970393116054e-08,4.62831238067607e-08,3.680020951014381e-08,8.059801395348414e-08
EU27+UK,Activity,Mining of copper ores and concentrates,2.697923488227858e-09,3.934731325093442e-09,4.3443142130967465e-09,1.6848731466751092e-09,1.4706157544144596e-09
EU27+UK,Activity,Mining of iron ores,2.9257611310688413e-09,7.0591687360360205e-09,6.866098870903703e-09,5.042065731640103e-09,3.138371241744383e-09
EU27+UK,Activity,"Mining of lead, zinc and tin ores and concentrates",5.799328491406552e-10,1.275335876215923e-09,1.333407960843606e-09,5.261870977556161e-10,3.466188395424807e-10
EU27+UK,Activity,Mining of nickel ores and concentrates,1.9424997049119977e-10,4.882893903611046e-10,5.747952622640744e-10,2.3627270168191604e-10,1.3377359581564522e-10
EU27+UK,Activity,Mining of other non-ferrous metal ores and concentrates,4.220334070018212e-09,5.970837276330043e-09,5.9650273737947e-09,5.5253997776815825e-09,4.124188851488543e-09
EU27+UK,Activity,Mining of precious metal ores and concentrates,2.316962112101922e-09,1.6800053769204473e-09,1.8124867177780143e-09,7.572445842122547e-10,1.1383088538552663e-09
EU27+UK,Activity,Mining of uranium and thorium ores (12),1.66157288857903e-09,1.1477657558573e-09,1.1910793160441614e-09,4.859116739054104e-09,3.4566719819309894e-09
EU27+UK,Activity,N-fertiliser,2.0748552619291353e-10,2.5611742101216485e-10,2.8532098070341296e-10,4.2983838271525826e-10,1.2886069626104594e-10
EU27+UK,Activity,Other business activities (74),5.609004169958813e-09,1.2281310735395234e-08,1.089945436424163e-08,7.013459015404566e-09,4.127578601635718e-09
EU27+UK,Activity,Other land transport,5.986402299653284e-09,7.624569816480886e-09,1.3885603778814565e-08,9.449151491690729e-09,6.810334421693313e-09
EU27+UK,Activity,Other non-ferrous metal production,1.5249892971040941e-09,2.3354695704086995e-09,2.1752406869884207e-09,1.364655837750836e-09,1.0838597561722037e-09
EU27+UK,Activity,Other service activities (93),1.3018504869787484e-10,1.7720232829905577e-10,1.7136690419157621e-10,1.6338301731893216e-10,1.3254411164488455e-10
EU27+UK,Activity,P- and other fertiliser,5.063766685591119e-10,6.58122572332533e-10,6.607078776379968e-10,5.622114680070538e-10,3.3523447227845736e-10
EU27+UK,Activity,Paper,6.965205378238889e-08,1.323391864826119e-07,1.203591137200253e-07,7.69358709693957e-08,4.840038238588843e-08
EU27+UK,Activity,Petroleum Refinery,1.136334600752053e-08,1.1907730942519542e-08,1.444104745938047e-08,2.0883530877412627e-08,9.898429230032681e-09
EU27+UK,Activity,Pigs farming,9.919215287645882e-10,1.5980876195114747e-09,1.4909471441885376e-09,1.0938632371095523e-09,8.43460278358966e-10
EU27+UK,Activity,"Plastics, basic",3.6851088690638963e-09,7.859426182793472e-09,7.184149106357567e-09,3.7066335077814687e-09,2.3063208443476145e-09
EU27+UK,Activity,Post and telecommunications (64),4.127565599659802e-09,4.950811092950242e-09,5.0584190494975665e-09,7.2918588982703824e-09,4.243401151699334e-09
EU27+UK,Activity,Poultry farming,4.142481846787787e-10,6.707810112457238e-10,6.752736586845017e-10,4.1121750793612024e-10,3.227642540230928e-10
EU27+UK,Activity,Precious metals production,4.029249871524363e-09,3.0516306643295024e-09,2.7677321921625723e-09,1.3428942892452413e-09,2.0454573192821306e-09
EU27+UK,Activity,Private households with employed persons (95),7.134678904114098e-11,1.5320908329260227e-10,1.2754498862182518e-10,7.514533836509359e-11,4.962157914827092e-11
EU27+UK,Activity,Processed rice,4.7715956702938824e-11,8.947045754281864e-11,8.940613788792333e-11,5.003182643342509e-11,3.905822347547892e-11
EU27+UK,Activity,Processing of Food products nec,9.07949141213267e-10,2.091101977815411e-09,2.1433315081496116e-09,9.650135468633378e-10,6.22206897414025e-10
EU27+UK,Activity,Processing of dairy products,1.650061112819257e-10,4.2680480102852273e-10,4.177202830706604e-10,1.9993153736273925e-10,1.2254533025572083e-10
EU27+UK,Activity,Processing of meat cattle,5.234679659066596e-11,1.0559102075888605e-10,1.0439856283745476e-10,5.931001598407736e-11,4.3415938134052494e-11
EU27+UK,Activity,Processing of meat pigs,1.2904290643191653e-10,2.678544420616723e-10,2.376398238117324e-10,1.4249617768118635e-10,1.0383653313965464e-10
EU27+UK,Activity,Processing of meat poultry,3.0787168137247027e-11,6.41671710125971e-11,6.040770640154138e-11,3.402180591511621e-11,2.5433473882389116e-11
EU27+UK,Activity,Processing of nuclear fuel,2.092712036786647e-10,4.143018425254713e-10,3.8914546553364384e-10,1.7946261563408242e-10,1.3158735859526178e-10
EU27+UK,Activity,Processing vegetable oils and fats,3.559195801383623e-11,6.683836649878675e-11,6.990526582099133e-11,3.467793370796686e-11,2.6844926835833408e-11
EU27+UK,Activity,Production of electricity by Geothermal,3.875684912513817e-10,3.012448265238243e-11,3.133278208852742e-11,1.332980138648683e-11,1.6335428118864737e-10
EU27+UK,Activity,Production of electricity by biomass and waste,0.0,0.0,0.0,0.0,0.0
EU27+UK,Activity,Production of electricity by coal,7.3456655279775216e-06,1.180856979022201e-06,1.2188937894366128e-06,9.126261817172157e-07,3.39603224957867e-06
EU27+UK,Activity,Production of electricity by gas,6.245394554438736e-08,1.0657354255063749e-08,1.09289659329564e-08,9.92130872886195e-09,3.009660998814334e-08
EU27+UK,Activity,Production of electricity by hydro,0.0,0.0,0.0,0.0,0.0
EU27+UK,Activity,Production of electricity by nuclear,1.2155267625750246e-08,1.3250250203885053e-09,1.3490514907933541e-09,1.0363760189213178e-09,5.44439329908894e-09
EU27+UK,Activity,Production of electricity by petroleum and other oil derivatives,5.270509107864512e-08,1.3138173329752405e-08,1.3252397624404284e-08,1.417542859578836e-08,2.828516143562185e-08
EU27+UK,Activity,Production of electricity by solar photovoltaic,0.0,0.0,0.0,0.0,0.0
EU27+UK,Activity,Production of electricity by solar thermal,0.0,0.0,0.0,0.0,0.0
EU27+UK,Activity,"Production of electricity by tide, wave, ocean",0.0,0.0,0.0,0.0,0.0
EU27+UK,Activity,Production of electricity by wind,0.0,0.0,0.0,0.0,0.0
EU27+UK,Activity,Production of electricity nec,2.1912657442399977e-08,1.2315639886117306e-08,1.2801152709972412e-08,9.482572370250586e-09,1.2777202103397786e-08
EU27+UK,Activity,Production of meat products nec,2.959210096008896e-11,4.999474469408661e-11,4.991410477674015e-11,2.8179833070053733e-11,2.180228982036008e-11
EU27+UK,Activity,Production of offshore wind plants,0.0,0.0,0.0,0.0,0.0
EU27+UK,Activity,Production of onshore wind plants,0.0,0.0,0.0,0.0,0.0
EU27+UK,Activity,Production of photovoltaic plants,0.0,0.0,0.0,0.0,0.0
EU27+UK,Activity,Public administration and defence; compulsory social security (75),4.98109420944891e-10,6.334342374456886e-10,6.346680752774079e-10,8.927310646576708e-10,9.585265528771595e-10
EU27+UK,Activity,"Publishing, printing and reproduction of recorded media (22)",2.37332871669942e-09,4.331330020073361e-09,4.126550665769817e-09,3.867271946624422e-09,2.4151451606816517e-09
EU27+UK,Activity,Pulp,2.9403879291587443e-08,4.211223978990119e-08,3.870679535242361e-08,2.4128599233438632e-08,1.898827516399898e-08
EU27+UK,Activity,Quarrying of sand and clay,2.5447048207421147e-09,5.668468265015855e-09,5.453945776225808e-09,2.1862155650720573e-09,1.5551515773050583e-09
EU27+UK,Activity,Quarrying of stone,4.2837680380510255e-09,7.91941037534229e-09,1.0836340747136338e-08,3.730477818371855e-09,2.578293174205199e-09
EU27+UK,Activity,Raw milk,8.206433884496728e-10,1.6482752795937818e-09,1.637726875727778e-09,1.0645968988966849e-09,7.241289435128096e-10
EU27+UK,Activity,Re-processing of ash into clinker,2.191858029082889e-08,7.1494262930955344e-09,1.4530650030101953e-08,8.241241197732575e-09,1.2920618663733344e-08
EU27+UK,Activity,Re-processing of secondary aluminium into new aluminium,1.0978673538543642e-08,3.87193020121227e-09,3.5185340009145295e-09,1.388588927791999e-09,4.786431361642934e-09
EU27+UK,Activity,Re-processing of secondary construction material into aggregates,1.2838381307810974e-08,1.8606039843216902e-09,6.713559818626918e-09,2.7597857595703394e-09,6.456272600303873e-09
EU27+UK,Activity,Re-processing of secondary copper into new copper,3.107252085394514e-09,7.408760057160692e-09,6.391713017594059e-09,2.8381049217864412e-09,1.9139277503190427e-09
EU27+UK,Activity,Re-processing of secondary glass into new glass,1.4358125133193304e-08,3.540081838645144e-07,2.3878785901324595e-07,7.853143128329006e-08,7.146165954511015e-09
EU27+UK,Activity,"Re-processing of secondary lead into new lead, zinc and tin",1.509991413638744e-09,3.9342846527048074e-09,4.034614382370131e-09,1.6739900284640477e-09,9.838734995323715e-10
EU27+UK,Activity,Re-processing of secondary other non-ferrous metals into new other non-ferrous metals,4.442411571196609e-11,5.2229671804540855e-11,4.893746109569277e-11,3.095242232215485e-11,2.844835803945072e-11
EU27+UK,Activity,Re-processing of secondary paper into new pulp,1.119362170294549e-08,1.8575232283141734e-08,1.7058837112085354e-08,1.0529473177202914e-08,7.531820884861905e-09
EU27+UK,Activity,Re-processing of secondary plastic into new plastic,2.0426603029220355e-09,4.3258687023594505e-09,3.981065176788044e-09,2.1206925234116888e-09,1.3195381875870784e-09
EU27+UK,Activity,Re-processing of secondary preciuos metals into new preciuos metals,8.573422449199182e-12,1.0983848150509516e-11,1.0332229637600418e-11,5.125868161870716e-12,4.353215258494741e-12
EU27+UK,Activity,Re-processing of secondary steel into new steel,4.872201534675156e-09,1.6892006297676728e-08,1.5917609875035574e-08,6.464303615221405e-09,3.247717894441832e-09
EU27+UK,Activity,Re-processing of secondary wood material into new wood material,3.912789850815866e-09,3.122669903786696e-09,4.034093432474187e-09,1.8462447629362889e-09,2.1469704227612744e-09
EU27+UK,Activity,Real estate activities (70),9.962564709980205e-10,1.2926016303419233e-09,1.3455189587816813e-09,1.0901978270036632e-09,9.61419124739749e-10
EU27+UK,Activity,"Recreational, cultural and sporting activities (92)",2.4663423251644393e-10,4.2211441084363505e-10,4.001345000981635e-10,2.988780207609713e-10,1.9921693583392087e-10
EU27+UK,Activity,Recycling of bottles by direct reuse,3.440757693540123e-08,4.8789864640798303e-08,4.73468458240371e-08,5.682115281203173e-08,4.059690685489983e-08
EU27+UK,Activity,Recycling of waste and scrap,4.945881349536464e-08,8.588176792249109e-08,7.432212915982522e-08,3.054425645877106e-08,2.601166498066672e-08
EU27+UK,Activity,Renting of machinery and equipment without operator and of personal and household goods (71),1.6708603542761816e-09,2.196870867148883e-09,2.4549194457966915e-09,2.066164134791148e-09,1.7544709415611153e-09
EU27+UK,Activity,Research and development (73),4.587087703919024e-10,1.0047200167907993e-09,8.590366730923585e-10,5.522062937808449e-10,3.1837365508431204e-10
EU27+UK,Activity,Retail sale of automotive fuel,4.388076938390857e-09,5.29196201462402e-09,5.7108851336363785e-09,4.2126423745888755e-09,9.54856696251131e-09
EU27+UK,Activity,"Retail trade, except of motor vehicles and motorcycles; repair of personal and household goods (52)",5.623154249438579e-09,8.73403774125454e-09,8.6199851483279e-09,5.338889273524779e-09,7.795955940270161e-09
EU27+UK,Activity,"Sale, maintenance, repair of motor vehicles, motor vehicles parts, motorcycles, motor cycles parts and accessoiries",2.773999789800344e-09,3.8603342594350605e-09,4.198132492639371e-09,3.774095927390294e-09,4.511983111185342e-09
EU27+UK,Activity,Sea and coastal water transport,5.5333623668680836e-08,1.199507160455619e-07,4.494292374010482e-07,1.0886713388676403e-07,5.1397613130409815e-08
EU27+UK,Activity,Steam and hot water supply,6.631351444838143e-07,7.18953058523794e-07,7.192100573592347e-07,6.572440121367283e-07,5.054503293249504e-07
EU27+UK,Activity,Sugar refining,2.5007628410476627e-11,4.901625751967134e-11,4.828908976883848e-11,2.6737682850277524e-11,2.0516684502648606e-11
