RoW,Activity,"Sale, maintenance, repair of motor vehicles, motor vehicles parts, motorcycles, motor cycles parts and accessoiries",5.297901425966562e-10,5.055936254261098e-10,4.591555809188468e-10,2.639682366051098e-10,3.233705668815836e-10
RoW,Activity,Sea and coastal water transport,4.323449415300886e-08,3.075099317313589e-08,7.250699041782406e-08,2.287190076838589e-08,3.1008706880570094e-08
RoW,Activity,Steam and hot water supply,3.001747499303086e-08,2.7031569708198204e-08,2.3758130172472374e-08,1.373702002613312e-08,1.657198830558449e-08
RoW,Activity,Sugar refining,8.207347883932246e-10,6.56635656980313e-10,5.640246173991002e-10,2.9846828468327995e-10,4.224169687927376e-10
RoW,Activity,Supporting and auxiliary transport activities; activities of travel agencies (63),1.0238804570515646e-08,1.0428948272717567e-08,1.2185973993960006e-08,6.047566645370214e-09,6.742427640880382e-09
RoW,Activity,"Tanning and dressing of leather; manufacture of luggage, handbags, saddlery, harness and footwear (19)",2.922171814671544e-10,3.180561902260682e-10,2.6883019774805093e-10,1.3615300832058545e-10,1.5497520509609686e-10
RoW,Activity,Transmission of electricity,9.174159359482058e-10,8.453732123810397e-10,7.224294972759652e-10,4.1104601150750074e-10,4.981116177947811e-10
RoW,Activity,Transport via pipelines,6.6599427888525705e-09,5.7900506693728384e-09,5.34886197959127e-09,4.162946553716796e-09,6.679257812206042e-09
RoW,Activity,Transport via railways,4.8399815347640906e-09,4.737698327677e-09,4.409242825403591e-09,2.515785012986e-09,4.445776999003184e-09
RoW,Activity,"Waste water treatment, food",1.951454378014912e-11,1.9952919207261484e-11,1.717824638428809e-11,9.253493101968679e-12,1.0863046318488265e-11
RoW,Activity,"Waste water treatment, other",2.979464107484494e-11,2.91229131706751e-11,2.540176778054488e-11,1.3368757407999684e-11,1.6251078236318093e-11
RoW,Activity,"Wholesale trade and commission trade, except of motor vehicles and motorcycles (51)",3.192655441982564e-09,3.3488137046340367e-09,2.8842471515594983e-09,1.7995146057861964e-09,2.6037398145506267e-09
RoW,Activity,"Wool, silk-worm cocoons",8.933632085026782e-10,8.645720769636911e-10,7.8918811960708e-10,4.4838286710795967e-10,5.253835920435422e-10
USA,Activity,Activities auxiliary to financial intermediation (67),3.0492603197002136e-11,1.4241010835415978e-11,1.1718250516753824e-11,7.364364838829734e-12,1.469417475038459e-11
USA,Activity,Activities of membership organisation n.e.c. (91),2.7531873756652406e-12,1.5808265600506454e-12,1.413718839462105e-12,9.764535435603523e-13,1.4424718106400214e-12
USA,Activity,Air transport (62),3.061626163581854e-08,1.5746548370174875e-08,1.4691671370337113e-08,1.0023637980944654e-08,1.6113564986264155e-08
USA,Activity,Aluminium production,7.444084539517832e-10,2.255274981865584e-10,1.5524443991362299e-10,6.773661597044851e-11,3.189634408856483e-10
USA,Activity,Animal products nec,3.627777559111097e-11,3.6122727853475835e-11,3.1918456569366683e-11,1.6325471543295354e-11,1.9197101055913686e-11
USA,Activity,"Biogasification of food waste, incl. land application",0.0,0.0,0.0,0.0,0.0
USA,Activity,"Biogasification of paper, incl. land application",0.0,0.0,0.0,0.0,0.0
USA,Activity,"Biogasification of sewage slugde, incl. land application",2.5622233215044323e-11,8.950133805842682e-12,7.830148650103844e-12,4.420199353511798e-12,1.1699231215645523e-11
USA,Activity,Casting of metals,3.140851517415318e-10,2.101919845891277e-10,1.7026564960923128e-10,8.848487251483156e-11,1.5207919956319465e-10
USA,Activity,Cattle farming,2.3649127749328477e-10,1.6265041341212175e-10,1.4549139311795146e-10,7.74232690002376e-11,1.1790743316008695e-10
USA,Activity,Chemicals nec,1.4582049039177446e-08,5.6905274299387685e-09,5.100578268102282e-09,2.440473645495664e-09,6.472710049715946e-09
USA,Activity,"Collection, purification and distribution of water (41)",1.7251469948293625e-12,4.606722940291808e-13,4.155935602107593e-13,2.2603447674857626e-13,7.746608828951714e-13
USA,Activity,"Composting of food waste, incl. land application",8.711742127846774e-13,7.462058374949063e-13,8.348074159490113e-13,7.529764515793864e-13,5.6347259716508e-13
USA,Activity,"Composting of paper and wood, incl. land application",8.235753267844344e-12,2.5650289532999997e-12,2.4414541977365352e-12,1.3063934217853881e-12,3.766121830304945e-12
USA,Activity,Computer and related activities (72),4.575824524894338e-11,2.930071280869054e-11,2.5716158852231356e-11,1.795190281479919e-11,2.516518432755783e-11
USA,Activity,Construction (45),4.874559190897937e-12,5.195377280218186e-13,5.396531343611677e-13,3.9605078555267463e-13,2.1596550751348717e-12
USA,Activity,Copper production,1.320608804337249e-09,1.3562329422217112e-09,9.216300798017742e-10,4.156640223749468e-10,6.214074463195621e-10
USA,Activity,Cultivation of cereal grains nec,7.943710866722477e-10,3.9472678518443376e-10,3.2786513247412776e-10,1.6480213300599233e-10,3.6743072728658986e-10
USA,Activity,Cultivation of crops nec,7.898136668179145e-10,3.5143709143400924e-10,2.9880199740161813e-10,1.5137824170057724e-10,3.598288486813287e-10
USA,Activity,Cultivation of oil seeds,1.871224805650332e-09,1.022878445939409e-09,6.280437593792525e-10,2.8799523243465795e-10,8.174146541360811e-10
USA,Activity,Cultivation of paddy rice,6.949348406954539e-10,4.3574703718196343e-10,3.878372999244563e-10,1.9962271684224584e-10,3.3147870632828937e-10
USA,Activity,Cultivation of plant-based fibers,7.896508767216273e-10,6.421377119330692e-10,5.24290571334221e-10,2.5117926322428175e-10,3.742035586468911e-10
USA,Activity,"Cultivation of sugar cane, sugar beet",1.7224809255591033e-10,9.37878565946856e-11,8.133194767146815e-11,4.066772272971223e-11,8.090920341389344e-11
USA,Activity,"Cultivation of vegetables, fruit, nuts",9.549130918222874e-11,6.709920872102224e-11,5.91702851480402e-11,3.075639165465763e-11,4.6973370965862955e-11
USA,Activity,Cultivation of wheat,5.362990993751808e-10,4.222141991290718e-10,3.758637203565159e-10,1.9352047856178274e-10,2.6858116601878065e-10
USA,Activity,Distribution and trade of electricity,2.7438313969211333e-11,7.820398900274961e-12,6.9392632191677154e-12,3.918711704180737e-12,1.2431582487800112e-11
USA,Activity,Education (80),2.9525521686334744e-12,8.778120259176393e-13,7.979724453808311e-13,9.77745474504376e-13,1.531180630151515e-12
USA,Activity,Extra-territorial organizations and bodies,0.0,0.0,0.0,0.0,0.0
USA,Activity,"Extraction of crude petroleum and services related to crude oil extraction, excluding surveying",7.52602867628282e-10,4.1293179723438743e-10,3.8421693397163225e-10,4.226188772253877e-10,4.2951666461579287e-10
USA,Activity,"Extraction of natural gas and services related to natural gas extraction, excluding surveying",2.441135607899089e-10,1.5044491078831479e-10,1.4033308691824315e-10,1.3818862579274758e-10,1.5039173403151288e-10
USA,Activity,"Extraction, liquefaction, and regasification of other petroleum and gaseous materials",7.811004741248716e-15,2.039246201614392e-15,1.8943063502221035e-15,1.486289890901762e-15,3.713175427168243e-15
USA,Activity,"Financial intermediation, except insurance and pension funding (65)",6.43151291746766e-11,5.0117830628341436e-11,4.7008337140144556e-11,3.9173894925611555e-11,4.101573408238348e-11
USA,Activity,"Fishing, operating of fish hatcheries and fish farms; service activities incidental to fishing (05)",9.112456708660771e-14,7.96253774361688e-14,7.25380656263061e-14,3.720901931120316e-14,4.709939123223781e-14
USA,Activity,"Forestry, logging and related service activities (02)",6.8950272186620196e-09,2.944908468691852e-09,2.5199983561516912e-09,1.2376606024812631e-09,3.1498107068650206e-09
USA,Activity,Health and social work (85),7.540004990042757e-13,1.3799637570316902e-13,1.285448730927493e-13,1.205632400726112e-13,3.51607592333495e-13
USA,Activity,Hotels and restaurants (55),3.126334102837075e-11,1.5481054318001223e-11,1.3587354202008255e-11,8.392090172090084e-12,1.5669592226772175e-11
USA,Activity,Incineration of waste: Food,1.880883179289297e-10,1.9100362860263808e-10,1.6905248565886948e-10,7.931945512492463e-11,9.694905167710973e-11
USA,Activity,Incineration of waste: Metals and Inert materials,2.9773779374590356e-10,2.8179468558992945e-10,3.7161499188260824e-10,2.0840840231686275e-10,2.0194665709754412e-10
USA,Activity,Incineration of waste: Oil/Hazardous waste,4.200099848839133e-11,6.47260053768291e-11,5.7548525940472794e-11,2.9126744689572295e-11,2.417883362574793e-11
USA,Activity,Incineration of waste: Paper,2.9116884593483555e-10,2.3452071723205467e-10,2.0885563316548368e-10,9.990207536907572e-11,1.447440510510798e-10
USA,Activity,Incineration of waste: Plastic,3.7773911478182017e-10,1.2833196732567927e-10,1.259786454061931e-10,8.153599755982818e-11,1.782584206482212e-10
USA,Activity,Incineration of waste: Textiles,1.8306532936713575e-10,6.310912470484558e-11,5.815956177940843e-11,2.56332144879648e-11,8.135527590632162e-11
USA,Activity,Incineration of waste: Wood,9.767489919456317e-11,4.80148962587374e-11,5.0316745756015604e-11,4.772936849381254e-11,5.2662785680907274e-11
USA,Activity,Inland water transport,8.311818605265929e-10,7.392826522133397e-10,5.975718372841083e-10,3.063584945474344e-10,4.102274605701045e-10
USA,Activity,"Insurance and pension funding, except compulsory social security (66)",8.33599416811603e-12,6.6344902450310886e-12,6.2772274375602194e-12,4.801354603840769e-12,5.295605834096107e-12
USA,Activity,Landfill of waste: Food,7.244232163664936e-12,2.9546163004204405e-12,2.873050137622894e-12,1.5484066340593289e-12,3.429681801269242e-12
USA,Activity,Landfill of waste: Inert/metal/hazardous,1.1186239182521526e-11,4.378803955814294e-12,4.211484807880256e-12,2.3844212250872215e-12,5.258250131485462e-12
USA,Activity,Landfill of waste: Paper,8.660947684941024e-12,3.416513253945254e-12,3.2681496535980933e-12,1.7399023404124339e-12,4.0534798665959966e-12
USA,Activity,Landfill of waste: Plastic,6.419442639547157e-12,2.184116251759826e-12,2.0590527258272208e-12,1.0968470754336895e-12,2.9583213828945256e-12
USA,Activity,Landfill of waste: Textiles,2.218275889028572e-12,8.121595223160459e-13,7.797419659950668e-13,4.1967658813077756e-13,1.0378300507062285e-12
USA,Activity,Landfill of waste: Wood,2.8041799394897598e-12,1.063886956522652e-12,1.0063721093150682e-12,5.401752695074566e-13,1.3121187937841527e-12
USA,Activity,"Lead, zinc and tin production",3.846866018351674e-11,6.175686666067503e-11,6.280069822500341e-11,2.6875155638571465e-11,2.2173982255752055e-11
USA,Activity,Manufacture of basic iron and steel and of ferro-alloys and first products thereof,1.1319813337749177e-09,1.065685319136182e-09,9.271474380952893e-10,4.0012239857179926e-10,5.430329229304736e-10
USA,Activity,Manufacture of beverages,1.687748081164657e-11,1.927148039795732e-11,1.7943067333216273e-11,1.005921129256577e-11,1.023038588521071e-11
USA,Activity,"Manufacture of bricks, tiles and construction products, in baked clay",4.983048450885475e-10,3.419875911316683e-11,2.833959090645123e-11,1.2705021377633525e-11,2.0902183481203298e-10
USA,Activity,"Manufacture of cement, lime and plaster",2.039579095116837e-09,3.7965831238208446e-10,3.720025429687196e-10,1.9355803514643135e-10,9.005523234848072e-10
USA,Activity,Manufacture of ceramic goods,2.239830131540732e-10,2.631805339394181e-11,3.005832700656499e-11,1.7141040860943864e-11,9.996385976362562e-11
USA,Activity,Manufacture of coke oven products,2.3708161277076305e-11,2.448208853495741e-11,2.0983148144364963e-11,9.332366653838856e-12,1.1559319492552844e-11
USA,Activity,Manufacture of electrical machinery and apparatus n.e.c. (31),4.3591662130038507e-10,3.741028494603093e-10,2.638360019474621e-10,1.737524082153639e-10,2.341472951941663e-10
USA,Activity,"Manufacture of fabricated metal products, except machinery and equipment (28)",1.2399776150398905e-10,7.772735280402326e-11,6.669944534747115e-11,3.19621268751972e-11,5.829786052308816e-11
USA,Activity,Manufacture of fish products,5.788168221319935e-11,6.935612206737177e-11,6.830208303359701e-11,3.570254344220807e-11,3.417340341209911e-11
USA,Activity,Manufacture of furniture; manufacturing n.e.c. (36),6.390183399437247e-10,3.386049032971582e-10,2.9141786100268977e-10,1.7785948064366623e-10,3.0689926101297397e-10
USA,Activity,Manufacture of gas; distribution of gaseous fuels through mains,1.201204926458215e-10,1.2187992320820685e-11,1.04723864739712e-11,5.642381884923568e-12,5.106705493818678e-11
USA,Activity,Manufacture of glass and glass products,3.768650709539939e-08,8.201046871450127e-10,6.121644208650412e-10,2.3416680562180316e-10,1.5638163183944732e-08
USA,Activity,Manufacture of machinery and equipment n.e.c. (29),2.2646322739452017e-10,1.4308488935668502e-10,1.175270000101302e-10,5.970070671460201e-11,1.0772519863532532e-10
USA,Activity,"Manufacture of medical, precision and optical instruments, watches and clocks (33)",2.4713567742766907e-10,3.896446748933485e-10,2.785662243182945e-10,1.5329483560508417e-10,1.4275539572178944e-10
USA,Activity,"Manufacture of motor vehicles, trailers and semi-trailers (34)",1.0594490478678464e-09,5.074669839412779e-10,4.3397303685509963e-10,2.2367802904923303e-10,5.072363142610511e-10
USA,Activity,Manufacture of office machinery and computers (30),6.848909429835109e-11,8.435091196783181e-11,5.856623553915567e-11,3.1365253880997866e-11,3.614641737606445e-11
USA,Activity,Manufacture of other non-metallic mineral products n.e.c.,3.3802934595908887e-09,1.8192204979420973e-10,2.0909248117101786e-10,8.340303625463459e-11,1.418010300662547e-09
USA,Activity,Manufacture of other transport equipment (35),1.4240763264625488e-09,1.5042277637650724e-09,1.246999438962413e-09,6.399246149592815e-10,7.867999023089239e-10
USA,Activity,"Manufacture of radio, television and communication equipment and apparatus (32)",7.075939683221391e-11,8.07174527964915e-11,5.280924017715652e-11,3.0434538555957325e-11,3.621725512501077e-11
USA,Activity,Manufacture of rubber and plastic products (25),2.1731507784651045e-10,1.0934731604628647e-10,9.643218800941726e-11,4.8003419836487905e-11,1.0234308646853082e-10
USA,Activity,Manufacture of textiles (17),9.900606575226843e-10,5.295498058764753e-10,4.6024411661196076e-10,2.2507924876623427e-10,4.5859186242569317e-10
USA,Activity,Manufacture of tobacco products (16),9.829572070781942e-12,9.970439550649001e-12,7.958349281620079e-12,3.782379063365569e-12,4.844873952860157e-12
USA,Activity,Manufacture of wearing apparel; dressing and dyeing of fur (18),5.143794656909987e-12,3.250769449449759e-12,2.8894735406857983e-12,1.659528360538702e-12,2.6298179832036557e-12
USA,Activity,"Manufacture of wood and of products of wood and cork, except furniture; manufacture of articles of straw and plaiting materials (20)",2.4609995819840166e-09,1.0166679698699827e-09,9.669188195513016e-10,4.5854558298633236e-10,1.1335890592259357e-09
USA,Activity,"Manure treatment (biogas), storage and land application",0.0,0.0,0.0,0.0,0.0
USA,Activity,"Manure treatment (conventional), storage and land application",0.0,0.0,0.0,0.0,0.0
USA,Activity,Meat animals nec,8.86738691357246e-13,4.248447345989489e-13,3.9128468400869945e-13,2.0805680855594902e-13,4.258622596493846e-13
USA,Activity,Mining of aluminium ores and concentrates,1.0540730912367337e-10,3.779758370090819e-12,2.873530039836474e-12,1.2028760427060695e-12,4.3846808935848565e-11
USA,Activity,"Mining of chemical and fertilizer minerals, production of salt, other mining and quarrying n.e.c.",7.467150714749085e-10,4.4433244830172294e-10,4.869530390937322e-10,1.7511444210673002e-10,3.33941666901985e-10
USA,Activity,Mining of coal and lignite; extraction of peat (10),1.7240577717238492e-08,1.5211462684237157e-09,1.4997796261131221e-09,9.93919973074117e-10,7.450827007136967e-09
USA,Activity,Mining of copper ores and concentrates,5.332544897433544e-10,2.9604894049989374e-10,2.1315871946957077e-10,9.366833928353295e-11,2.37528170691706e-10
USA,Activity,Mining of iron ores,2.1695764640482032e-10,1.1381053342099286e-10,1.0000970312696809e-10,4.484854887029749e-11,9.885200265921418e-11
USA,Activity,"Mining of lead, zinc and tin ores and concentrates",2.3379440034462468e-11,1.75023737312095e-11,1.5867007697479817e-11,6.637008565305237e-12,1.0993093024279427e-11
USA,Activity,Mining of nickel ores and concentrates,0.0,0.0,0.0,0.0,0.0
USA,Activity,Mining of other non-ferrous metal ores and concentrates,8.13342132811219e-11,1.0388631818381969e-10,9.067765472370106e-11,4.6017225935133254e-11,4.460645465172286e-11
USA,Activity,Mining of precious metal ores and concentrates,4.1034354304347915e-09,2.1936360996453216e-10,1.6899723034534204e-10,7.658372534965655e-11,1.7162519170344219e-09
USA,Activity,Mining of uranium and thorium ores (12),3.8022710824450595e-11,1.843973457727405e-11,1.5440653207932267e-11,7.2035370242909694e-12,1.7025195134128774e-11
USA,Activity,N-fertiliser,7.74738087430231e-11,2.0697170891534565e-11,1.6475645882938677e-11,9.2464173586703e-12,3.41653455309409e-11
USA,Activity,Other business activities (74),3.962819481592727e-10,2.4824527123365574e-10,2.24900444500838e-10,1.618836118896942e-10,2.1495187108633968e-10
USA,Activity,Other land transport,3.3383283520129777e-13,8.730905285514204e-14,7.817342645805078e-14,4.664552110007478e-14,1.58802504156703e-13
USA,Activity,Other non-ferrous metal production,3.4605324784031157e-10,5.033217711050321e-10,4.4208013331277817e-10,2.1915336767369575e-10,1.9197270758981703e-10
USA,Activity,Other service activities (93),2.1542098331175796e-12,8.88561395157362e-13,7.891507068524095e-13,6.210269070442913e-13,1.0523051354538845e-12
USA,Activity,P- and other fertiliser,1.5887360081525923e-10,6.846995897192158e-11,5.984450273679969e-11,3.312652037392216e-11,7.226852774622681e-11
USA,Activity,Paper,5.1342696756247236e-08,1.6143420344316017e-08,1.3624121210843285e-08,7.448418636094281e-09,2.3137396437254783e-08
USA,Activity,Petroleum Refinery,2.691387294274385e-09,1.467831522256963e-09,1.3547874168349836e-09,1.6114089340038306e-09,1.5850179182792327e-09
USA,Activity,Pigs farming,1.92849483114727e-10,9.651155859347902e-11,8.306574103488432e-11,4.3591413693441796e-11,9.097319998463915e-11
USA,Activity,"Plastics, basic",4.725934735356128e-10,3.59142138043616e-10,2.8048593100825287e-10,1.3762029846158024e-10,2.2961933767559734e-10
USA,Activity,Post and telecommunications (64),5.4754502487758124e-11,2.81252944800795e-11,2.544470041845663e-11,1.846924610183061e-11,2.8826163657410623e-11
USA,Activity,Poultry farming,2.0732709273750219e-10,1.497289812669204e-10,1.3325622867588934e-10,6.973679123307631e-11,1.0222444905002169e-10
USA,Activity,Precious metals production,8.153454147180353e-09,3.652475747918186e-10,2.923043386375773e-10,1.3269093849559916e-10,3.4073795452391745e-09
USA,Activity,Private households with employed persons (95),5.855274515903065e-13,7.180006477579351e-13,6.329066996760653e-13,3.7489485855590344e-13,3.493199406516288e-13
USA,Activity,Processed rice,1.0393897469295486e-10,8.836797412601801e-11,7.878218500697149e-11,4.0375503349738983e-11,5.2386082861332754e-11
USA,Activity,Processing of Food products nec,5.766375097084407e-11,3.304760377819441e-11,2.935108518180864e-11,1.5104574007979962e-11,2.7610223053396594e-11
USA,Activity,Processing of dairy products,3.215547589663672e-10,3.1112711123693284e-10,1.9593131051121787e-10,9.474500827855519e-11,1.5003650149500393e-10
USA,Activity,Processing of meat cattle,2.8467519431798105e-11,1.879967673725287e-11,1.7123188398500797e-11,9.177081433879445e-12,1.4221423491991891e-11
USA,Activity,Processing of meat pigs,1.9010319854524408e-12,9.41795412974151e-13,8.028328739307087e-13,4.2108014516928587e-13,8.951588954890785e-13
USA,Activity,Processing of meat poultry,1.7737162673514715e-12,1.280145444803981e-12,1.1488032476490438e-12,6.100879305276149e-13,8.843531162289306e-13
USA,Activity,Processing of nuclear fuel,4.361838669024418e-13,2.909412022778708e-13,1.7263403300166238e-13,7.816722945228582e-14,1.9110246913796838e-13
USA,Activity,Processing vegetable oils and fats,3.033297585111164e-10,1.7832279048312782e-10,1.593945277465233e-10,7.989207321255894e-11,1.431198628070397e-10
USA,Activity,Production of electricity by Geothermal,2.2107105784706523e-10,1.0637618677972299e-12,9.30474692180639e-13,4.900869854299862e-13,9.168799243080851e-11
USA,Activity,Production of electricity by biomass and waste,0.0,0.0,0.0,0.0,0.0
USA,Activity,Production of electricity by coal,2.3084226909269706e-06,2.7955401882504798e-08,2.3921586584388628e-08,1.2501953386189538e-08,9.590621155693609e-07
USA,Activity,Production of electricity by gas,3.143119058633527e-07,1.4389723457286128e-09,1.2322288335375106e-09,6.419357603926143e-10,1.3033066574042113e-07
USA,Activity,Production of electricity by hydro,0.0,0.0,0.0,0.0,0.0
USA,Activity,Production of electricity by nuclear,5.580986975468737e-09,3.777954232141628e-11,3.235443098506048e-11,1.6873931397101353e-11,2.3155251030536107e-09
USA,Activity,Production of electricity by petroleum and other oil derivatives,2.7732401157652358e-08,1.5503395609789922e-10,1.3551190056760052e-10,7.139314792144918e-11,1.1504303245234607e-08
USA,Activity,Production of electricity by solar photovoltaic,0.0,0.0,0.0,0.0,0.0
USA,Activity,Production of electricity by solar thermal,0.0,0.0,0.0,0.0,0.0
USA,Activity,"Production of electricity by tide, wave, ocean",0.0,0.0,0.0,0.0,0.0
USA,Activity,Production of electricity by wind,0.0,0.0,0.0,0.0,0.0
USA,Activity,Production of electricity nec,4.4669261415445076e-10,2.3723672746667076e-12,2.0705995942450523e-12,1.0805771266277499e-12,1.853072651444024e-10
USA,Activity,Production of meat products nec,5.600123313994548e-10,3.266027177381171e-10,2.625703696116118e-10,1.2922002354761085e-10,2.579007358919732e-10
USA,Activity,Production of offshore wind plants,0.0,0.0,0.0,0.0,0.0
USA,Activity,Production of onshore wind plants,0.0,0.0,0.0,0.0,0.0
USA,Activity,Production of photovoltaic plants,0.0,0.0,0.0,0.0,0.0
USA,Activity,Public administration and defence; compulsory social security (75),3.2353247666233176e-10,2.0426340029363882e-11,1.8109978317673925e-11,1.1072654184950629e-11,1.3751933507609234e-10
USA,Activity,"Publishing, printing and reproduction of recorded media (22)",2.919433008353652e-10,1.87877663453361e-10,1.6907893735604573e-10,1.2284951779781644e-10,1.6042509204729495e-10
USA,Activity,Pulp,5.920146714072127e-09,3.2357206972284105e-09,2.384883458603463e-09,1.2828627753114634e-09,2.7353334135857936e-09
USA,Activity,Quarrying of sand and clay,3.2075427481994593e-09,3.6757675288175693e-10,3.242456866639368e-10,1.47699645476657e-10,1.365234643732747e-09
USA,Activity,Quarrying of stone,5.043147503903365e-10,7.61162033389322e-11,1.0322491200153561e-10,4.507769382895152e-11,2.214211189288711e-10
USA,Activity,Raw milk,8.67420367508649e-11,8.385859462817296e-11,5.282830839610939e-11,2.555210030454584e-11,4.047569220901206e-11
USA,Activity,Re-processing of ash into clinker,0.0,0.0,0.0,0.0,0.0
USA,Activity,Re-processing of secondary aluminium into new aluminium,0.0,0.0,0.0,0.0,0.0
USA,Activity,Re-processing of secondary construction material into aggregates,0.0,0.0,0.0,0.0,0.0
USA,Activity,Re-processing of secondary copper into new copper,0.0,0.0,0.0,0.0,0.0
USA,Activity,Re-processing of secondary glass into new glass,0.0,0.0,0.0,0.0,0.0
USA,Activity,"Re-processing of secondary lead into new lead, zinc and tin",0.0,0.0,0.0,0.0,0.0
USA,Activity,Re-processing of secondary other non-ferrous metals into new other non-ferrous metals,0.0,0.0,0.0,0.0,0.0
USA,Activity,Re-processing of secondary paper into new pulp,0.0,0.0,0.0,0.0,0.0
USA,Activity,Re-processing of secondary plastic into new plastic,0.0,0.0,0.0,0.0,0.0
USA,Activity,Re-processing of secondary preciuos metals into new preciuos metals,0.0,0.0,0.0,0.0,0.0
USA,Activity,Re-processing of secondary steel into new steel,0.0,0.0,0.0,0.0,0.0
USA,Activity,Re-processing of secondary wood material into new wood material,0.0,0.0,0.0,0.0,0.0
USA,Activity,Real estate activities (70),3.7995250803553054e-11,2.2181708229544712e-11,2.0466027161837963e-11,1.424722418342869e-11,2.056820567355337e-11
USA,Activity,"Recreational, cultural and sporting activities (92)",2.93529654952655e-11,1.731040452556782e-11,1.5689973803377195e-11,1.122392682285442e-11,1.5719115619726304e-11
USA,Activity,Recycling of bottles by direct reuse,0.0,0.0,0.0,0.0,0.0
USA,Activity,Recycling of waste and scrap,1.40567864598963e-08,5.591006762167618e-09,4.653013087692399e-09,2.3167790324990797e-09,6.33800859762968e-09
USA,Activity,Renting of machinery and equipment without operator and of personal and household goods (71),1.278584712705059e-10,6.633471508316389e-11,6.000785087217644e-11,3.8375766253289295e-11,6.476953503793897e-11
USA,Activity,Research and development (73),8.664084770528444e-11,1.5845150206469688e-10,1.2274680978732403e-10,5.934089359477056e-11,4.63564642710282e-11
USA,Activity,Retail sale of automotive fuel,1.1421943801446104e-11,7.463854378934595e-12,8.11013144785641e-12,5.188257750364356e-12,1.405030625924563e-11
USA,Activity,"Retail trade, except of motor vehicles and motorcycles; repair of personal and household goods (52)",5.85169641284292e-12,1.1910058595638017e-12,1.0405345702414687e-12,5.76729465824145e-13,2.7897231952040046e-12
USA,Activity,"Sale, maintenance, repair of motor vehicles, motor vehicles parts, motorcycles, motor cycles parts and accessoiries",4.273759170197461e-11,9.074848274110247e-12,7.629225965909975e-12,4.1815326889709365e-12,1.8827893868537158e-11
USA,Activity,Sea and coastal water transport,7.396257063873193e-10,6.627429402583789e-10,1.578777860143017e-09,4.862345873232508e-10,5.264975280169706e-10
USA,Activity,Steam and hot water supply,4.267632077196502e-09,1.352449233238779e-09,1.2126036224240937e-09,6.757325036444798e-10,1.9446567353694435e-09
USA,Activity,Sugar refining,1.8931137016549635e-11,1.3209269372979663e-11,1.1465937029267783e-11,6.03947624439933e-12,9.740960337947001e-12
