RoW,Activity,"Retail trade, except of motor vehicles and motorcycles; repair of personal and household goods (52)",2.5544222051082454e-09,2.3664520250796803e-09,2.118280457626125e-09,1.6180354570191858e-09,1.8300245103323846e-09
RoW,Activity,"Sale, maintenance, repair of motor vehicles, motor vehicles parts, motorcycles, motor cycles parts and accessoiries",6.970076493071324e-10,6.663567784423135e-10,6.177930352551193e-10,4.659300313673003e-10,5.13372431183458e-10
RoW,Activity,Sea and coastal water transport,7.631202414808577e-08,2.9427030821606165e-08,6.265608234468727e-08,2.698740102718995e-08,4.636825281206417e-08
RoW,Activity,Steam and hot water supply,5.2067550622914795e-08,5.106333146841588e-08,4.549413690814343e-08,3.3389550797968794e-08,3.608875657456729e-08
RoW,Activity,Sugar refining,1.1455129663667482e-09,9.793520738536507e-10,8.57475768527382e-10,5.719992286556516e-10,7.581545878416491e-10
RoW,Activity,Supporting and auxiliary transport activities; activities of travel agencies (63),1.711375495329927e-08,1.6684098616493966e-08,1.937524072404184e-08,1.2458169367475984e-08,1.2950560006398154e-08
RoW,Activity,"Tanning and dressing of leather; manufacture of luggage, handbags, saddlery, harness and footwear (19)",2.9082709443192917e-10,3.4258375419367607e-10,3.0299814521843053e-10,1.9751885954468106e-10,2.00155542170594e-10
RoW,Activity,Transmission of electricity,1.1919727350714966e-09,1.1519463069549427e-09,1.0066302682424757e-09,7.550403359441031e-10,8.264449703357357e-10
RoW,Activity,Transport via pipelines,1.3156062621920568e-08,1.1113037943365801e-08,1.1094895491709919e-08,1.027575990657396e-08,1.2559436742575164e-08
RoW,Activity,Transport via railways,6.7654350509793275e-09,7.036232352845054e-09,6.833037081015551e-09,4.9849796278649965e-09,5.48947624462203e-09
RoW,Activity,"Waste water treatment, food",2.9348104412453804e-11,2.9025927453730024e-11,2.5691098604179257e-11,1.7777340046052788e-11,2.0073553554343854e-11
RoW,Activity,"Waste water treatment, other",4.078069634726943e-11,3.8655664822593705e-11,3.435222051956561e-11,2.3803817182042553e-11,2.7755718661934557e-11
RoW,Activity,"Wholesale trade and commission trade, except of motor vehicles and motorcycles (51)",4.146819883744817e-09,4.1795522804654545e-09,3.637608727973552e-09,2.7221397863684322e-09,3.5323486345639434e-09
RoW,Activity,"Wool, silk-worm cocoons",1.0127644507337815e-09,1.0986140217013107e-09,1.0164271967495463e-09,7.14577104858189e-10,7.410291869473236e-10
USA,Activity,Activities auxiliary to financial intermediation (67),7.55079649345396e-11,3.497577741785005e-11,2.8155492215294177e-11,2.165084349161071e-11,4.712645937358479e-11
USA,Activity,Activities of membership organisation n.e.c. (91),6.493280174406867e-12,2.8809645024724013e-12,2.5392386609723125e-12,2.063722758336219e-12,4.204006071730525e-12
USA,Activity,Air transport (62),5.938994166201396e-08,4.617021567512917e-08,4.2952931873013614e-08,3.429482801684662e-08,4.369540832571117e-08
USA,Activity,Aluminium production,1.5676325083799704e-09,4.646095480317779e-10,3.4959839499077373e-10,2.0268383924607097e-10,8.899215569471945e-10
USA,Activity,Animal products nec,2.7698889730419442e-11,2.8501073742345277e-11,2.560136176468868e-11,1.6692369708161995e-11,1.9117041622645338e-11
USA,Activity,"Biogasification of food waste, incl. land application",0.0,0.0,0.0,0.0,0.0
USA,Activity,"Biogasification of paper, incl. land application",0.0,0.0,0.0,0.0,0.0
USA,Activity,"Biogasification of sewage slugde, incl. land application",6.463415812488144e-11,2.3323373867670207e-11,2.168409562376127e-11,1.4009106764269573e-11,3.842476112231041e-11
USA,Activity,Casting of metals,5.118050992689547e-10,3.311984264429754e-10,2.717846412948338e-10,1.8686154660225629e-10,3.216542150850938e-10
USA,Activity,Cattle farming,3.2978407537854187e-10,2.0943268148823248e-10,1.8613588529627424e-10,1.297353771399056e-10,2.173650397922129e-10
USA,Activity,Chemicals nec,3.574615645339034e-08,1.1725803309126064e-08,1.0718749259598511e-08,6.765441367916951e-09,2.080320440510332e-08
USA,Activity,"Collection, purification and distribution of water (41)",3.169822508173934e-12,8.093131208568874e-13,7.609100989103446e-13,5.105541754836512e-13,1.8710761715179052e-12
USA,Activity,"Composting of food waste, incl. land application",3.0326275693060748e-12,1.979596048650664e-12,2.046030419415377e-12,1.5530204039125136e-12,2.0382372575176626e-12
USA,Activity,"Composting of paper and wood, incl. land application",1.7795907318231916e-11,5.641633537835807e-12,5.704216262195235e-12,3.6133122806415985e-12,1.0628894524258104e-11
USA,Activity,Computer and related activities (72),8.768558911014432e-11,4.7480476749695125e-11,4.127164813074272e-11,3.492497666962402e-11,5.98346812372436e-11
USA,Activity,Construction (45),1.5209199981456263e-10,1.1764403772603879e-11,1.1607909991185917e-11,9.308355135780229e-12,8.717217735579886e-11
USA,Activity,Copper production,2.0755290928496083e-09,3.078283258247866e-09,2.0588110343565263e-09,1.217558146344158e-09,1.2757249778292716e-09
USA,Activity,Cultivation of cereal grains nec,7.792237749699679e-10,4.890552447563208e-10,4.24191335524684e-10,2.759285674722639e-10,4.842889272271399e-10
USA,Activity,Cultivation of crops nec,7.647995097924047e-10,3.15980399317485e-10,2.67630797357184e-10,1.809758856670569e-10,4.6033941777274603e-10
USA,Activity,Cultivation of oil seeds,3.8182185589223994e-09,2.5699281570478392e-09,1.4856672237670958e-09,9.1661700158769e-10,2.1911016975757617e-09
USA,Activity,Cultivation of paddy rice,1.3695825013204732e-09,8.396871570239007e-10,7.432077501322401e-10,4.916152009465771e-10,8.806983940842879e-10
USA,Activity,Cultivation of plant-based fibers,1.8081067620111134e-09,1.3948445287928404e-09,1.1246190541071514e-09,6.905893050330279e-10,1.1033230614314256e-09
USA,Activity,"Cultivation of sugar cane, sugar beet",8.662152977664168e-11,5.428345492909605e-11,4.7309799562396024e-11,3.1630633889289845e-11,5.5203141920627e-11
USA,Activity,"Cultivation of vegetables, fruit, nuts",7.34112338635334e-11,5.532878994227644e-11,4.9173986307724064e-11,3.275765981796588e-11,4.747957923187201e-11
USA,Activity,Cultivation of wheat,1.676555643544643e-09,1.745945845832721e-09,1.582278106588943e-09,1.0291144626996073e-09,1.1126750934208798e-09
USA,Activity,Distribution and trade of electricity,5.757719958290569e-11,1.3234989431409814e-11,1.168730871937383e-11,8.272061989913523e-12,3.380606910183202e-11
USA,Activity,Education (80),3.2891609000308034e-12,9.866626298291322e-13,8.894801361967968e-13,8.265541703017296e-13,2.0771787943239258e-12
USA,Activity,Extra-territorial organizations and bodies,0.0,0.0,0.0,0.0,0.0
USA,Activity,"Extraction of crude petroleum and services related to crude oil extraction, excluding surveying",9.098115727459926e-10,3.7713601244273896e-10,3.6986821854971433e-10,3.679559050146429e-10,5.932895173817034e-10
USA,Activity,"Extraction of natural gas and services related to natural gas extraction, excluding surveying",3.475577202747287e-10,1.9257626809450566e-10,1.8390265133770077e-10,1.8787196347456357e-10,2.4603286308924124e-10
USA,Activity,"Extraction, liquefaction, and regasification of other petroleum and gaseous materials",3.039990925292699e-14,8.03142093252036e-15,7.373384855138825e-15,6.022949916463445e-15,1.8129942195124854e-14
USA,Activity,"Financial intermediation, except insurance and pension funding (65)",8.421414109780491e-11,5.717787964787382e-11,5.308305147386574e-11,5.067113410269129e-11,6.408666199199109e-11
USA,Activity,"Fishing, operating of fish hatcheries and fish farms; service activities incidental to fishing (05)",2.069649181110935e-13,1.928098444240338e-13,1.7421595854917681e-13,1.154718628234119e-13,1.435816606065578e-13
USA,Activity,"Forestry, logging and related service activities (02)",1.063078821202257e-08,4.1113071052665165e-09,3.369004513701095e-09,2.2113534550114445e-09,6.2987341467912054e-09
USA,Activity,Health and social work (85),6.487660014027139e-13,1.8868135825704986e-13,1.6678302472939302e-13,1.4808156649824853e-13,4.0312601456076206e-13
USA,Activity,Hotels and restaurants (55),1.088574065219552e-10,8.084795251103414e-11,6.941708230963499e-11,4.944655612009514e-11,8.064727354307097e-11
USA,Activity,Incineration of waste: Food,2.272683446791475e-10,9.716581736442e-11,9.950019159503798e-11,6.700046273144672e-11,1.405819327804897e-10
USA,Activity,Incineration of waste: Metals and Inert materials,6.228125206882833e-10,4.27408952952163e-10,5.31261162365563e-10,3.6983226050338825e-10,4.46036926416685e-10
USA,Activity,Incineration of waste: Oil/Hazardous waste,8.249634428895608e-11,6.009120372362167e-11,6.047690225603811e-11,4.5187509476911995e-11,5.5347577814119436e-11
USA,Activity,Incineration of waste: Paper,3.610670238266172e-10,1.290527564192044e-10,1.3555009282236413e-10,8.921884362176459e-11,2.1973406443701711e-10
USA,Activity,Incineration of waste: Plastic,9.584794838220388e-10,3.229703790121652e-10,3.2883636385828185e-10,2.2656865486252602e-10,5.827347776192298e-10
USA,Activity,Incineration of waste: Textiles,2.2274651386601393e-10,8.055661258086751e-11,8.13054764779236e-11,5.0201983777515635e-11,1.3351860217121225e-10
USA,Activity,Incineration of waste: Wood,3.9976529586349827e-10,1.45509563356791e-10,1.3823962906613985e-10,7.878072755743939e-11,2.337460482323481e-10
USA,Activity,Inland water transport,1.1474875910154063e-09,8.245514633718393e-10,7.083331001853955e-10,4.625151494127318e-10,7.419573391478556e-10
USA,Activity,"Insurance and pension funding, except compulsory social security (66)",1.5375834517293602e-11,1.0095396504137594e-11,8.302488046382064e-12,7.774614787115656e-12,1.1139275542953903e-11
USA,Activity,Landfill of waste: Food,1.5683923299963417e-11,5.678915546626819e-12,5.673603595291611e-12,3.664594735396525e-12,9.464106780046473e-12
USA,Activity,Landfill of waste: Inert/metal/hazardous,2.6750679286491552e-11,1.0793726583395784e-11,1.0489821226899536e-11,6.886496538020567e-12,1.6285946995081053e-11
USA,Activity,Landfill of waste: Paper,1.890928972023653e-11,6.4252326839571075e-12,6.412510533466713e-12,4.1122591767011264e-12,1.1327827856019146e-11
USA,Activity,Landfill of waste: Plastic,1.43659183735831e-11,4.455826303705322e-12,4.433160202624461e-12,2.8552823862025293e-12,8.583145854666078e-12
USA,Activity,Landfill of waste: Textiles,7.52738237006678e-12,2.479427602227102e-12,2.569548681844037e-12,1.607712238620262e-12,4.512047930429126e-12
USA,Activity,Landfill of waste: Wood,8.941234504885423e-12,3.0560304361821717e-12,3.178814018397781e-12,1.980226581710731e-12,5.3680540075209445e-12
USA,Activity,"Lead, zinc and tin production",9.577786899932985e-11,2.2056764196987542e-10,2.1984598026830381e-10,1.2110509582722557e-10,7.199946582626778e-11
USA,Activity,Manufacture of basic iron and steel and of ferro-alloys and first products thereof,2.7912385142530117e-09,2.737957163905898e-09,2.285907647572905e-09,1.331928796927576e-09,1.7247986977429873e-09
USA,Activity,Manufacture of beverages,3.828796439285954e-11,4.3246150705810476e-11,3.647660571980452e-11,2.681463876974136e-11,2.757272714491629e-11
USA,Activity,"Manufacture of bricks, tiles and construction products, in baked clay",4.405929184320973e-09,2.568643925340289e-10,2.080080913094737e-10,1.2626410272021493e-10,2.4553198393907937e-09
USA,Activity,"Manufacture of cement, lime and plaster",1.5867499437898445e-09,2.492432353314047e-10,2.2899660057935587e-10,1.5743358684633308e-10,9.150743968794929e-10
USA,Activity,Manufacture of ceramic goods,2.6173573945267063e-10,1.2696749478687026e-10,1.401102760610027e-10,1.0632084869860834e-10,1.8647393352313432e-10
USA,Activity,Manufacture of coke oven products,6.1191609861991e-11,6.149376681557773e-11,5.296387321323602e-11,3.1309481044874914e-11,3.835157913210657e-11
USA,Activity,Manufacture of electrical machinery and apparatus n.e.c. (31),7.104980947103369e-10,6.207282125902998e-10,4.2923481061529794e-10,3.6454081020551954e-10,4.867785875417301e-10
USA,Activity,"Manufacture of fabricated metal products, except machinery and equipment (28)",1.8307388250297345e-10,1.0147487562702011e-10,8.765742475602457e-11,5.547780134583585e-11,1.1082739769273583e-10
USA,Activity,Manufacture of fish products,1.6667523562343453e-10,1.7977440921514158e-10,1.6061173392844943e-10,1.1369401450831683e-10,1.1533931720880096e-10
USA,Activity,Manufacture of furniture; manufacturing n.e.c. (36),8.918833144509428e-10,3.7109476718298406e-10,3.2072719106923137e-10,2.3782306324417165e-10,5.391267028969315e-10
USA,Activity,Manufacture of gas; distribution of gaseous fuels through mains,2.2864761301507314e-10,1.1579253346159164e-11,9.968633487401316e-12,7.004348081774841e-12,1.2799037526954454e-10
USA,Activity,Manufacture of glass and glass products,1.6201939596580385e-07,2.7136119716850054e-09,2.027314911434529e-09,1.122082891702422e-09,8.966628241610513e-08
USA,Activity,Manufacture of machinery and equipment n.e.c. (29),2.2090256653689706e-10,1.4922963934358766e-10,1.2603335720492665e-10,8.706286349101742e-11,1.398657732696755e-10
USA,Activity,"Manufacture of medical, precision and optical instruments, watches and clocks (33)",3.1297189423360886e-10,4.1434558747765833e-10,3.0650905238389117e-10,2.342862270466129e-10,2.2856342625711057e-10
USA,Activity,"Manufacture of motor vehicles, trailers and semi-trailers (34)",1.4574439166204843e-09,7.776094089013912e-10,6.765345600580525e-10,4.4809295699907715e-10,9.158575465957853e-10
USA,Activity,Manufacture of office machinery and computers (30),1.363114273723519e-10,1.8271951534660034e-10,1.4221688619535318e-10,9.994600421505236e-11,9.771761955625544e-11
USA,Activity,Manufacture of other non-metallic mineral products n.e.c.,1.3298171182932593e-08,5.532047982321507e-10,5.756626937829236e-10,3.238777092345481e-10,7.4034150615826165e-09
USA,Activity,Manufacture of other transport equipment (35),1.5947701993208669e-09,1.7307621347416912e-09,1.5324958833214053e-09,9.903556622804883e-10,1.1200923361523192e-09
USA,Activity,"Manufacture of radio, television and communication equipment and apparatus (32)",1.4958222477429855e-10,1.5580952541687468e-10,1.0191225187547895e-10,7.551005416854907e-11,9.566936433050503e-11
USA,Activity,Manufacture of rubber and plastic products (25),4.67538236512564e-10,2.0455893952780077e-10,1.7611295241031369e-10,1.1508807108255962e-10,2.8144083015195074e-10
USA,Activity,Manufacture of textiles (17),1.468544554147353e-09,6.977242728572919e-10,6.142863979993728e-10,3.9530269328291525e-10,8.84283466744451e-10
USA,Activity,Manufacture of tobacco products (16),1.0919986066327141e-11,9.144527469415113e-12,7.832276767216486e-12,4.878545503960547e-12,6.924751496413729e-12
USA,Activity,Manufacture of wearing apparel; dressing and dyeing of fur (18),9.394623012929832e-12,5.815694580048749e-12,5.331323793614032e-12,3.9141391846301894e-12,6.232825658507634e-12
USA,Activity,"Manufacture of wood and of products of wood and cork, except furniture; manufacture of articles of straw and plaiting materials (20)",4.330471508888646e-09,1.4100375821749484e-09,1.2628173814190553e-09,8.206922323604279e-10,2.5690387128216246e-09
USA,Activity,"Manure treatment (biogas), storage and land application",0.0,0.0,0.0,0.0,0.0
USA,Activity,"Manure treatment (conventional), storage and land application",0.0,0.0,0.0,0.0,0.0
USA,Activity,Meat animals nec,3.3427373959095443e-12,2.3698429046226286e-12,2.193484584092534e-12,1.4620666829975678e-12,2.1684520929657394e-12
USA,Activity,Mining of aluminium ores and concentrates,1.0192808160033149e-10,6.702799866028832e-12,5.34113731637146e-12,3.1297311133497456e-12,5.6724530873849034e-11
USA,Activity,"Mining of chemical and fertilizer minerals, production of salt, other mining and quarrying n.e.c.",8.101834969968944e-10,7.682100201120398e-10,7.383783919469199e-10,3.9748494386581524e-10,4.921570924362403e-10
USA,Activity,Mining of coal and lignite; extraction of peat (10),4.229171522557034e-08,4.967956231434971e-09,4.9354518162929105e-09,4.1052095271674245e-09,2.4433902285955803e-08
USA,Activity,Mining of copper ores and concentrates,1.1404347270565042e-09,6.578710889382977e-10,4.1235784123547133e-10,2.4915855325010766e-10,6.551439115632277e-10
USA,Activity,Mining of iron ores,1.5582965609549653e-10,1.1024968982285734e-10,8.945749350508824e-11,5.350430022253919e-11,9.365964031466216e-11
USA,Activity,"Mining of lead, zinc and tin ores and concentrates",5.0331124875680046e-11,5.742171367792755e-11,5.562939841427166e-11,3.004870308470424e-11,3.198449988245628e-11
USA,Activity,Mining of nickel ores and concentrates,0.0,0.0,0.0,0.0,0.0
USA,Activity,Mining of other non-ferrous metal ores and concentrates,1.8633366723051277e-10,2.096366941238565e-10,1.8589489381154524e-10,1.1312261907777277e-10,1.2241924635638055e-10
USA,Activity,Mining of precious metal ores and concentrates,6.7999418400687084e-09,3.636496170092653e-10,2.841519454392186e-10,1.7213935843558945e-10,3.785900620881602e-09
USA,Activity,Mining of uranium and thorium ores (12),8.738072456817957e-11,3.494497088412569e-11,2.956829567843738e-11,1.8367725510021867e-11,5.0940260415370356e-11
USA,Activity,N-fertiliser,5.07093307556362e-10,1.604125968434831e-10,1.2266293492894329e-10,9.274405900615587e-11,2.9474857828605465e-10
USA,Activity,Other business activities (74),9.11119711741475e-10,5.078841583610631e-10,4.490704534224135e-10,3.8207812083384716e-10,6.136860949184749e-10
USA,Activity,Other land transport,7.008092062275698e-10,2.1943068928917804e-10,2.0842258030437194e-10,1.6362097212941956e-10,4.508903276416754e-10
USA,Activity,Other non-ferrous metal production,1.1496794304993762e-09,1.3596393288348549e-09,1.1937952450852579e-09,7.140136765642433e-10,7.507212487297669e-10
USA,Activity,Other service activities (93),5.161656648250519e-12,1.7391210955656774e-12,1.5152190033682848e-12,1.1899230788800643e-12,3.1890106034265718e-12
USA,Activity,P- and other fertiliser,3.962662827578109e-10,1.7269484696566186e-10,1.5048298359043263e-10,1.017728341526675e-10,2.3689197426692075e-10
USA,Activity,Paper,9.046072032024649e-08,2.5283757518183578e-08,2.094881028528388e-08,1.477198546177017e-08,5.309965077504265e-08
USA,Activity,Petroleum Refinery,7.490071564298232e-09,3.613216392593203e-09,3.6764452560294314e-09,4.007931411888381e-09,5.153512772982798e-09
USA,Activity,Pigs farming,4.2873242243788247e-10,2.2141054475402522e-10,1.7834137402957957e-10,1.172696834118622e-10,2.593368203737654e-10
USA,Activity,"Plastics, basic",9.84987163723348e-10,8.107828796123338e-10,6.091373139667375e-10,3.925661687797562e-10,6.063576155978254e-10
USA,Activity,Post and telecommunications (64),1.0387171280735956e-10,5.6910695428082014e-11,5.423619974329366e-11,4.613573823692689e-11,7.199120276399447e-11
USA,Activity,Poultry farming,1.885561935285754e-10,1.4669825636542068e-10,1.257034873788706e-10,8.035250297586052e-11,1.1876232745011996e-10
USA,Activity,Precious metals production,1.6481808690999797e-08,6.630709377696409e-10,5.353309502079992e-10,3.2254271040081934e-10,9.163306717929172e-09
USA,Activity,Private households with employed persons (95),1.0821074639326245e-15,1.2027647770680858e-15,1.2324215554177513e-15,1.1618719424049033e-15,1.1563558144206882e-15
USA,Activity,Processed rice,2.738127836239764e-10,2.6860505952354214e-10,2.4255444898548844e-10,1.5568387554690136e-10,1.806791949746327e-10
USA,Activity,Processing of Food products nec,1.824109391150411e-10,8.641676405267892e-11,7.406250518207423e-11,4.8695725894172333e-11,1.099015054258096e-10
USA,Activity,Processing of dairy products,5.058007797317658e-10,5.019617173950736e-10,3.0182674397223523e-10,1.9368512906568743e-10,3.016220538808673e-10
USA,Activity,Processing of meat cattle,4.929757673151432e-11,3.0037531336069915e-11,2.663952539129162e-11,1.796570200136815e-11,3.235331014661802e-11
USA,Activity,Processing of meat pigs,1.8832795038483566e-11,9.800279974449874e-12,7.841306280643958e-12,5.1268177017897014e-12,1.1362020483986549e-11
USA,Activity,Processing of meat poultry,4.818925924345405e-12,3.634584201550067e-12,3.0377609490108547e-12,1.9518292280839924e-12,3.019383571741502e-12
USA,Activity,Processing of nuclear fuel,2.0179120520807164e-13,2.1395448716271521e-13,1.6573299702939647e-13,1.0381098973634992e-13,1.2684870324178867e-13
USA,Activity,Processing vegetable oils and fats,1.566870893574969e-09,7.744728584597363e-10,6.837524742212083e-10,4.378381397663723e-10,9.416291536977822e-10
USA,Activity,Production of electricity by Geothermal,1.7511307596323458e-10,1.565930842677391e-12,1.3635351482995716e-12,9.210016068321685e-13,9.698065046373773e-11
USA,Activity,Production of electricity by biomass and waste,0.0,0.0,0.0,0.0,0.0
USA,Activity,Production of electricity by coal,3.6499729604656737e-06,7.288454867674351e-08,6.27843651370525e-08,4.2416874768468856e-08,2.025792331892158e-06
USA,Activity,Production of electricity by gas,2.3278104455658712e-07,1.7657039805681674e-09,1.5315864396323382e-09,1.0339767913306424e-09,1.2886848732664193e-07
USA,Activity,Production of electricity by hydro,0.0,0.0,0.0,0.0,0.0
USA,Activity,Production of electricity by nuclear,5.153420891215796e-09,3.999958055346119e-11,3.419936673604727e-11,2.4005214663481184e-11,2.853715664047775e-09
USA,Activity,Production of electricity by petroleum and other oil derivatives,4.547442916577173e-08,4.1562483582959225e-10,3.609489218674847e-10,2.439856372657755e-10,2.5186430513593523e-08
USA,Activity,Production of electricity by solar photovoltaic,0.0,0.0,0.0,0.0,0.0
USA,Activity,Production of electricity by solar thermal,0.0,0.0,0.0,0.0,0.0
USA,Activity,"Production of electricity by tide, wave, ocean",0.0,0.0,0.0,0.0,0.0
USA,Activity,Production of electricity by wind,0.0,0.0,0.0,0.0,0.0
USA,Activity,Production of electricity nec,6.09030614356957e-10,5.5018732253367095e-12,4.7777151147359895e-12,3.2253678380365058e-12,3.372942300558076e-10
USA,Activity,Production of meat products nec,3.814359719926995e-10,2.066465186153969e-10,1.7929236614251287e-10,1.1627393970258194e-10,2.3357331008795433e-10
USA,Activity,Production of offshore wind plants,0.0,0.0,0.0,0.0,0.0
USA,Activity,Production of onshore wind plants,0.0,0.0,0.0,0.0,0.0
USA,Activity,Production of photovoltaic plants,0.0,0.0,0.0,0.0,0.0
USA,Activity,Public administration and defence; compulsory social security (75),5.146367462879549e-10,4.719517189937736e-11,4.102301960573731e-11,3.25361682887088e-11,2.9502346056981726e-10
USA,Activity,"Publishing, printing and reproduction of recorded media (22)",6.675890088478283e-10,3.9014235555169954e-10,3.420872694277946e-10,2.9218902389892986e-10,4.5451220483983867e-10
USA,Activity,Pulp,1.0945264335759395e-08,6.834636162672277e-09,4.621865278470093e-09,3.1463917097451385e-09,6.5344663684180115e-09
USA,Activity,Quarrying of sand and clay,5.280743313014584e-09,6.355427580107215e-10,5.712263024340392e-10,3.425141770705892e-10,2.983925978910081e-09
USA,Activity,Quarrying of stone,1.421806170025002e-09,1.9890713859223607e-10,2.0487847062161003e-10,1.55340075840852e-10,8.233314988498275e-10
USA,Activity,Raw milk,1.2061098050984937e-10,1.1960111034713153e-10,7.193901146491815e-11,4.617334325938166e-11,7.193082221871044e-11
USA,Activity,Re-processing of ash into clinker,0.0,0.0,0.0,0.0,0.0
USA,Activity,Re-processing of secondary aluminium into new aluminium,0.0,0.0,0.0,0.0,0.0
USA,Activity,Re-processing of secondary construction material into aggregates,0.0,0.0,0.0,0.0,0.0
USA,Activity,Re-processing of secondary copper into new copper,0.0,0.0,0.0,0.0,0.0
USA,Activity,Re-processing of secondary glass into new glass,0.0,0.0,0.0,0.0,0.0
USA,Activity,"Re-processing of secondary lead into new lead, zinc and tin",0.0,0.0,0.0,0.0,0.0
USA,Activity,Re-processing of secondary other non-ferrous metals into new other non-ferrous metals,0.0,0.0,0.0,0.0,0.0
USA,Activity,Re-processing of secondary paper into new pulp,0.0,0.0,0.0,0.0,0.0
USA,Activity,Re-processing of secondary plastic into new plastic,0.0,0.0,0.0,0.0,0.0
USA,Activity,Re-processing of secondary preciuos metals into new preciuos metals,0.0,0.0,0.0,0.0,0.0
USA,Activity,Re-processing of secondary steel into new steel,0.0,0.0,0.0,0.0,0.0
USA,Activity,Re-processing of secondary wood material into new wood material,0.0,0.0,0.0,0.0,0.0
USA,Activity,Real estate activities (70),5.559508480368961e-11,3.153863032878263e-11,2.874769843871612e-11,2.3940808793652476e-11,4.11341336843721e-11
USA,Activity,"Recreational, cultural and sporting activities (92)",3.7557936004337885e-11,1.9968362847857295e-11,1.7763757718388654e-11,1.5074783679435716e-11,2.521339554915028e-11
USA,Activity,Recycling of bottles by direct reuse,0.0,0.0,0.0,0.0,0.0
USA,Activity,Recycling of waste and scrap,1.8170302930375586e-08,5.579794521930748e-09,4.643204033266488e-09,3.079496357867141e-09,1.0630209136302484e-08
USA,Activity,Renting of machinery and equipment without operator and of personal and household goods (71),2.2929135514589944e-10,9.931521599569099e-11,8.765962293736761e-11,6.786322637784626e-11,1.4768413917065332e-10
USA,Activity,Research and development (73),1.28765030386402e-10,1.5268081786183329e-10,1.2083988054190802e-10,7.576668394221971e-11,8.241552021177544e-11
USA,Activity,Retail sale of automotive fuel,1.6925818573243337e-11,1.4722313605743903e-11,1.4450389457833062e-11,1.0232195352063394e-11,1.9958416883639232e-11
USA,Activity,"Retail trade, except of motor vehicles and motorcycles; repair of personal and household goods (52)",2.169287579330397e-12,9.50997788387747e-13,8.694430352663208e-13,6.765849590960652e-13,1.3680254266468223e-12
USA,Activity,"Sale, maintenance, repair of motor vehicles, motor vehicles parts, motorcycles, motor cycles parts and accessoiries",7.639384160838207e-11,1.5689767825084945e-11,1.3119579072722824e-11,9.083935303021273e-12,4.419684631983661e-11
USA,Activity,Sea and coastal water transport,5.400227050229801e-09,1.8166892644566817e-09,4.065504742730777e-09,1.6735815999494833e-09,3.2221303930839074e-09
