EU27+UK,Activity,Sugar refining,2.261828263484841e-11,4.5141646866030635e-11,4.508692777846264e-11,3.0387749591654786e-11,2.2754599309527086e-11
EU27+UK,Activity,Supporting and auxiliary transport activities; activities of travel agencies (63),1.6877749144496598e-08,2.632993175293021e-08,3.6102439133841005e-08,2.3138111850899425e-08,1.7122567315235036e-08
EU27+UK,Activity,"Tanning and dressing of leather; manufacture of luggage, handbags, saddlery, harness and footwear (19)",8.001975468164353e-11,1.3357356251475275e-10,1.2937539132438816e-10,8.684793650297411e-11,6.544816996809564e-11
EU27+UK,Activity,Transmission of electricity,1.2788888064708196e-08,1.6830258711764444e-08,1.739960821897794e-08,1.7813288515745135e-08,1.3451858211149276e-08
EU27+UK,Activity,Transport via pipelines,2.0190186797126134e-08,2.423557904761011e-08,2.8849764062024786e-08,2.8836817696839272e-08,2.679973012925012e-08
EU27+UK,Activity,Transport via railways,1.641617525131701e-08,2.9570648968394e-08,3.273298820829253e-08,2.462107274547066e-08,2.224172069230895e-08
EU27+UK,Activity,"Waste water treatment, food",6.070648577958231e-11,6.986058173278278e-11,7.60153695619377e-11,6.012159193613823e-11,4.834853543553491e-11
EU27+UK,Activity,"Waste water treatment, other",1.1600653699815533e-10,1.3760888030597054e-10,1.4752368036314183e-10,1.1730497146052495e-10,9.229977187619473e-11
EU27+UK,Activity,"Wholesale trade and commission trade, except of motor vehicles and motorcycles (51)",7.4036240940235115e-09,1.4429312223903845e-08,1.360217190731676e-08,1.0058909151659673e-08,1.1009685935895916e-08
EU27+UK,Activity,"Wool, silk-worm cocoons",4.3652532656744713e-10,4.5120330965934284e-10,4.355365006322473e-10,3.6866917982309455e-10,3.733514011195546e-10
RoW,Activity,Activities auxiliary to financial intermediation (67),9.261198643009332e-10,9.266843753126007e-10,8.556526084809905e-10,7.607239698598104e-10,7.332819607826016e-10
RoW,Activity,Activities of membership organisation n.e.c. (91),6.820166168709225e-11,6.914799005657528e-11,6.183293779465811e-11,4.46159500206512e-11,4.809572023702803e-11
RoW,Activity,Air transport (62),6.371122475265789e-08,7.772167050711662e-08,7.55468698062968e-08,6.005479773727995e-08,5.3516901227782545e-08
RoW,Activity,Aluminium production,1.7979287922744128e-08,2.343917166722405e-08,2.0108278473301685e-08,1.1056177816823408e-08,1.1240115409998376e-08
RoW,Activity,Animal products nec,1.520044692083151e-10,1.5770721257857493e-10,1.417094788897837e-10,9.695005013125751e-11,1.0824803135324686e-10
RoW,Activity,"Biogasification of food waste, incl. land application",2.7288208922143254e-12,2.952544393964109e-12,2.658310751844906e-12,1.872972175361555e-12,1.8808733084033995e-12
RoW,Activity,"Biogasification of paper, incl. land application",3.846486826671999e-12,4.5541391617539075e-12,3.920002791137247e-12,2.534457466093139e-12,2.5361307891085255e-12
RoW,Activity,"Biogasification of sewage slugde, incl. land application",1.525445641056322e-11,1.686130088604911e-11,1.551511275529473e-11,1.082441011039057e-11,1.062293872228259e-11
RoW,Activity,Casting of metals,3.5753552541961033e-09,4.336538110287004e-09,3.5285589440684083e-09,2.5272593917452797e-09,2.4999485198434266e-09
RoW,Activity,Cattle farming,1.3596057560052937e-09,1.2632184105928106e-09,1.128940111275509e-09,7.723892346122739e-10,9.12688218771173e-10
RoW,Activity,Chemicals nec,9.059505882032956e-08,9.927801876591187e-08,9.048530001533665e-08,5.629700681966255e-08,5.854640271982322e-08
RoW,Activity,"Collection, purification and distribution of water (41)",1.8628262783272326e-09,1.377530791299112e-09,1.2193642230062287e-09,8.643819372035114e-10,1.224007738216578e-09
RoW,Activity,"Composting of food waste, incl. land application",1.4092320344603483e-11,1.4041604434482592e-11,1.3194414756325367e-11,9.727864755533586e-12,1.0014005408116233e-11
RoW,Activity,"Composting of paper and wood, incl. land application",3.4962907134641633e-12,3.745191930852653e-12,3.2798490565879256e-12,2.1664997827989286e-12,2.337510032330607e-12
RoW,Activity,Computer and related activities (72),4.702971595972153e-10,5.556989632592024e-10,5.013552995649327e-10,4.495215272247446e-10,4.000702652357021e-10
RoW,Activity,Construction (45),2.239713727910959e-09,1.57518452029079e-09,1.6273006851555983e-09,1.3606479192323056e-09,1.7091173622103664e-09
RoW,Activity,Copper production,2.6157635478442345e-09,7.544687560057445e-09,4.9237887682058206e-09,2.962883401769897e-09,1.760952793755033e-09
RoW,Activity,Cultivation of cereal grains nec,1.846480829722634e-09,1.8144769096889909e-09,1.640316351704719e-09,1.087606353514347e-09,1.2482578346294388e-09
RoW,Activity,Cultivation of crops nec,3.438321341950114e-09,2.809093917769848e-09,2.5271961886809794e-09,1.6391876624877022e-09,2.2621864370180808e-09
RoW,Activity,Cultivation of oil seeds,4.711146179979611e-09,3.942421917089842e-09,3.252467042249119e-09,1.9637248459912782e-09,2.902920963313619e-09
RoW,Activity,Cultivation of paddy rice,2.337282171454699e-09,2.2446543833936563e-09,2.057215953938859e-09,1.3368101497647733e-09,1.5613625246978577e-09
RoW,Activity,Cultivation of plant-based fibers,1.0131608785307594e-09,9.263262409504002e-10,7.872467225411167e-10,4.838512746790754e-10,6.374400668763764e-10
RoW,Activity,"Cultivation of sugar cane, sugar beet",8.988048526145304e-10,8.893726504162469e-10,8.042165287132499e-10,5.226217853777448e-10,5.940101055269501e-10
RoW,Activity,"Cultivation of vegetables, fruit, nuts",1.9535966497186326e-09,1.7701537867977844e-09,1.566673440572741e-09,1.0404522447853297e-09,1.3083033627411686e-09
RoW,Activity,Cultivation of wheat,4.651516408286885e-09,4.506652216676198e-09,4.068632676085022e-09,2.7310637451717698e-09,3.123141553647692e-09
RoW,Activity,Distribution and trade of electricity,2.471392554791011e-09,2.4119749244387855e-09,2.156047607608695e-09,1.6153336746977509e-09,1.7489922793768704e-09
RoW,Activity,Education (80),5.5594882855796815e-11,5.64771657291374e-11,5.097007712982996e-11,4.6051276841776517e-11,4.348429378223274e-11
RoW,Activity,Extra-territorial organizations and bodies,0.0,0.0,0.0,0.0,0.0
RoW,Activity,"Extraction of crude petroleum and services related to crude oil extraction, excluding surveying",1.631784623413105e-08,1.2064835334292251e-08,1.1633880188221959e-08,1.3086738807565795e-08,1.2549158148518763e-08
RoW,Activity,"Extraction of natural gas and services related to natural gas extraction, excluding surveying",3.1250844008897144e-08,2.1670935390381218e-08,1.9413297682645314e-08,3.936621509379702e-08,3.3259652350340863e-08
RoW,Activity,"Extraction, liquefaction, and regasification of other petroleum and gaseous materials",3.3938793511328347e-09,3.0741003769465893e-09,2.8610193469417238e-09,2.245538720078501e-09,2.3668809667582213e-09
RoW,Activity,"Financial intermediation, except insurance and pension funding (65)",3.197362936673986e-09,3.0661334944543003e-09,2.8460695576755104e-09,2.646528786317179e-09,2.491386541652886e-09
RoW,Activity,"Fishing, operating of fish hatcheries and fish farms; service activities incidental to fishing (05)",3.92904754481454e-10,4.4649892144677943e-10,4.311677675105359e-10,2.899079748324182e-10,2.8857920233039097e-10
RoW,Activity,"Forestry, logging and related service activities (02)",2.728053055097266e-08,1.8850721990542657e-08,1.5682454282426907e-08,1.0245170456741488e-08,1.7028953095913205e-08
RoW,Activity,Health and social work (85),8.856038839603704e-11,8.309907860238571e-11,7.511932913859824e-11,5.946378775400254e-11,6.494188579200587e-11
RoW,Activity,Hotels and restaurants (55),4.394530714515051e-09,5.14872791203855e-09,4.866834268372745e-09,3.6171267063530673e-09,3.825350222558716e-09
RoW,Activity,Incineration of waste: Food,6.147253253459754e-10,5.769365541567803e-10,5.321348063317052e-10,3.818055720193469e-10,4.257324393152265e-10
RoW,Activity,Incineration of waste: Metals and Inert materials,2.1441411697679486e-09,2.267297724583754e-09,2.436118697378815e-09,2.4976663600196175e-09,1.5650984693247205e-09
RoW,Activity,Incineration of waste: Oil/Hazardous waste,8.263310341670114e-10,8.495224802060447e-10,7.630741896809023e-10,5.378346571118928e-10,5.700136209972436e-10
RoW,Activity,Incineration of waste: Paper,5.019749326967447e-10,4.703313756200755e-10,4.350570407358274e-10,3.140415251436113e-10,3.468483204270508e-10
RoW,Activity,Incineration of waste: Plastic,1.6152132897761387e-09,1.5579295575473891e-09,1.403514138802462e-09,9.923731286400872e-10,1.1093415052685432e-09
RoW,Activity,Incineration of waste: Textiles,2.610978758766983e-09,2.1652243803880054e-09,1.9319110724701973e-09,1.267607752915359e-09,1.6836408745708761e-09
RoW,Activity,Incineration of waste: Wood,3.6873922954439424e-10,2.630965542650782e-10,2.361237846822018e-10,1.5317534194924026e-10,2.335225410989105e-10
RoW,Activity,Inland water transport,1.2436702522569802e-08,1.2218876217557185e-08,1.1917970552445296e-08,9.173013149570973e-09,9.792843324203249e-09
RoW,Activity,"Insurance and pension funding, except compulsory social security (66)",4.417876734859879e-10,4.501084269286404e-10,4.3089778100598647e-10,4.094289663720889e-10,3.968413831425091e-10
RoW,Activity,Landfill of waste: Food,8.175608743725498e-11,7.267566109512499e-11,6.797843593880192e-11,4.8730180736819735e-11,5.658062192181219e-11
RoW,Activity,Landfill of waste: Inert/metal/hazardous,3.426757562314617e-11,2.9580844425942167e-11,2.7383795330836602e-11,2.028149561957445e-11,2.3356540622185896e-11
RoW,Activity,Landfill of waste: Paper,3.369526168146541e-11,2.8929127880710825e-11,2.711359174977158e-11,1.9128913299913775e-11,2.2883842482423757e-11
RoW,Activity,Landfill of waste: Plastic,1.680281889891325e-11,1.4951029625519715e-11,1.3960920912588283e-11,9.940508639961383e-12,1.1612060903154983e-11
RoW,Activity,Landfill of waste: Textiles,9.292470620428522e-12,8.522661870902722e-12,7.891234097266475e-12,5.5576784525626505e-12,6.3593689340581225e-12
RoW,Activity,Landfill of waste: Wood,1.0455706396286954e-11,9.589593592094934e-12,8.940682497665527e-12,6.266713342635658e-12,7.185470300730699e-12
RoW,Activity,"Lead, zinc and tin production",6.507071022528117e-10,1.043784317191189e-09,1.0134581714279164e-09,5.801061230998738e-10,4.541378254389726e-10
RoW,Activity,Manufacture of basic iron and steel and of ferro-alloys and first products thereof,4.067250835827669e-08,8.383096090622604e-08,7.329753536010938e-08,4.233001157217649e-08,2.8341517659803082e-08
RoW,Activity,Manufacture of beverages,1.3951152350290638e-09,1.5267321030904657e-09,1.3927406288035976e-09,1.0113748846719467e-09,1.0493579871629309e-09
RoW,Activity,"Manufacture of bricks, tiles and construction products, in baked clay",1.0157637011934847e-09,9.69151486782735e-10,9.015726373881091e-10,5.92531200110372e-10,6.88046202389476e-10
RoW,Activity,"Manufacture of cement, lime and plaster",1.014388315338534e-08,4.302280077074086e-09,4.972783244153218e-09,3.4479620988931364e-09,6.561698018063899e-09
RoW,Activity,Manufacture of ceramic goods,2.4698984976500223e-09,1.7532916840109683e-09,1.8379582009350464e-09,1.2683242853085625e-09,1.734915468604498e-09
RoW,Activity,Manufacture of coke oven products,1.3309104751987575e-09,1.6267354371257824e-09,1.4649116622811729e-09,9.464220922745756e-10,9.013824448097946e-10
RoW,Activity,Manufacture of electrical machinery and apparatus n.e.c. (31),2.4398910560789787e-09,3.1300796307858776e-09,2.1604834087862e-09,1.932184405022349e-09,1.8431390479847949e-09
RoW,Activity,"Manufacture of fabricated metal products, except machinery and equipment (28)",1.0730542498010325e-08,1.6228148302786392e-08,1.4692720326065693e-08,9.182425427120831e-09,7.485879530172456e-09
RoW,Activity,Manufacture of fish products,4.53112964475095e-10,5.750628956781311e-10,5.379976182504364e-10,3.8759359668577283e-10,3.380839050479282e-10
RoW,Activity,Manufacture of furniture; manufacturing n.e.c. (36),1.1324069255015236e-09,1.2530954643868117e-09,1.0912664582552966e-09,8.167536689973324e-10,7.912799779104505e-10
RoW,Activity,Manufacture of gas; distribution of gaseous fuels through mains,2.488587022149476e-09,1.6555424981664115e-09,1.4490109440811915e-09,1.014390607982818e-09,1.584795906540107e-09
RoW,Activity,Manufacture of glass and glass products,3.792364037989717e-08,1.4440612271690125e-08,1.0892676046526886e-08,6.218540445542469e-09,2.1639549698976193e-08
RoW,Activity,Manufacture of machinery and equipment n.e.c. (29),1.902493491073843e-09,1.9336439328813557e-09,1.5852884585052126e-09,1.1511020441342573e-09,1.2912610935716406e-09
RoW,Activity,"Manufacture of medical, precision and optical instruments, watches and clocks (33)",2.5732532642567753e-09,4.331242073393342e-09,2.7948473544358744e-09,2.1195334057171422e-09,1.8568921279008275e-09
RoW,Activity,"Manufacture of motor vehicles, trailers and semi-trailers (34)",1.363929853368988e-09,1.1523140898642946e-09,1.069640452987537e-09,7.182985304271231e-10,9.401552289558741e-10
RoW,Activity,Manufacture of office machinery and computers (30),3.350135540479438e-10,4.5281549055173894e-10,3.1305035308753335e-10,2.20763766902467e-10,2.2913140665188554e-10
RoW,Activity,Manufacture of other non-metallic mineral products n.e.c.,5.820128540403176e-08,1.177730152846232e-08,1.1832652381301644e-08,6.917514643885196e-09,3.336696444506812e-08
RoW,Activity,Manufacture of other transport equipment (35),8.863229918309932e-10,1.0839573389431783e-09,9.929067310453906e-10,6.614838506625953e-10,6.586300490344401e-10
RoW,Activity,"Manufacture of radio, television and communication equipment and apparatus (32)",3.146784844240597e-09,5.894661854929568e-09,3.6620369038185876e-09,2.7076685252502287e-09,2.1852404454735704e-09
RoW,Activity,Manufacture of rubber and plastic products (25),4.742848772522711e-09,5.614517183010889e-09,4.848641234484742e-09,3.097374001525231e-09,3.2256081082502806e-09
RoW,Activity,Manufacture of textiles (17),2.209071782495237e-09,2.835035974790362e-09,2.494523810541858e-09,1.5093748644418342e-09,1.4872479334731588e-09
RoW,Activity,Manufacture of tobacco products (16),2.7260516932071103e-09,1.2189024188279902e-09,1.0256605858966228e-09,6.527530467767775e-10,1.630940623644691e-09
RoW,Activity,Manufacture of wearing apparel; dressing and dyeing of fur (18),3.176460420892583e-10,3.308768648350323e-10,3.175825884740422e-10,2.1883180275029232e-10,2.2921529468325901e-10
RoW,Activity,"Manufacture of wood and of products of wood and cork, except furniture; manufacture of articles of straw and plaiting materials (20)",9.167075187175644e-09,7.399879678289046e-09,7.663725708721761e-09,4.840404144635199e-09,6.1322926042914905e-09
RoW,Activity,"Manure treatment (biogas), storage and land application",0.0,0.0,0.0,0.0,0.0
RoW,Activity,"Manure treatment (conventional), storage and land application",0.0,0.0,0.0,0.0,0.0
RoW,Activity,Meat animals nec,6.557207164977918e-10,6.692772272737534e-10,5.951112084317749e-10,4.0423947065853974e-10,4.4545184479370374e-10
RoW,Activity,Mining of aluminium ores and concentrates,1.9509554438739996e-08,1.5521335483536386e-08,1.2843845763848716e-08,7.04289569885164e-09,1.1534175654624649e-08
RoW,Activity,"Mining of chemical and fertilizer minerals, production of salt, other mining and quarrying n.e.c.",2.4297123168361933e-09,6.195803474585541e-09,6.607053498230945e-09,3.118698263795302e-09,1.5621240679764574e-09
RoW,Activity,Mining of coal and lignite; extraction of peat (10),4.0841240978797055e-07,1.3714467972470024e-07,1.246930500584657e-07,1.0956572896142836e-07,2.464904721878741e-07
RoW,Activity,Mining of copper ores and concentrates,1.8860785479202458e-08,2.9933800746434164e-08,2.074956473589037e-08,1.2351245843807162e-08,1.184387294411359e-08
RoW,Activity,Mining of iron ores,2.2522562321195524e-08,5.077042381064018e-08,3.593473279209269e-08,2.0926313234271316e-08,1.4636810703492843e-08
RoW,Activity,"Mining of lead, zinc and tin ores and concentrates",6.149586032217567e-09,7.810854076918401e-09,7.134035711375152e-09,4.040496753161959e-09,3.978180975324229e-09
RoW,Activity,Mining of nickel ores and concentrates,7.555445839018987e-09,1.1010183791374253e-08,9.47578544001184e-09,5.444736523928925e-09,4.912360164499683e-09
RoW,Activity,Mining of other non-ferrous metal ores and concentrates,2.9111437862356957e-08,2.9570867014215368e-08,2.745236374341312e-08,1.5476351331528032e-08,1.8265348120721287e-08
RoW,Activity,Mining of precious metal ores and concentrates,2.1348567576635237e-08,1.019488462356954e-08,8.330710830016352e-09,5.106196102952256e-09,1.2646858253318137e-08
RoW,Activity,Mining of uranium and thorium ores (12),2.9710622488528996e-09,3.0701896647894376e-09,2.738501953160558e-09,2.2282515894466293e-09,2.2002778387614927e-09
RoW,Activity,N-fertiliser,1.0358679069289276e-09,1.0365853196433703e-09,9.249465057619402e-10,7.561332801776502e-10,6.969963651958653e-10
RoW,Activity,Other business activities (74),6.450746191544284e-10,7.538470364558941e-10,6.80404909698051e-10,6.681191492389441e-10,5.522101884370795e-10
RoW,Activity,Other land transport,3.950022601173865e-09,4.241352654000186e-09,4.163218584591021e-09,3.214538624810314e-09,3.3415226674681283e-09
RoW,Activity,Other non-ferrous metal production,5.419013094478736e-09,7.411085681329536e-09,6.252050848448738e-09,3.810224379811975e-09,3.5954351237117905e-09
RoW,Activity,Other service activities (93),1.1192149430240495e-10,1.0408339811359456e-10,9.297064575526711e-11,6.831508019582686e-11,7.917616632248859e-11
RoW,Activity,P- and other fertiliser,2.5474989464702795e-09,2.2504982211261344e-09,2.0077258789305158e-09,1.5148380230881154e-09,1.6855558616985632e-09
RoW,Activity,Paper,2.7987661826600405e-08,3.211810715153985e-08,2.7750490509865988e-08,1.997146751388423e-08,1.9888243291509857e-08
RoW,Activity,Petroleum Refinery,2.042171645187703e-08,1.6917434474593773e-08,1.6311554943744516e-08,1.4958064550446695e-08,1.5043670825385435e-08
RoW,Activity,Pigs farming,8.871561317778582e-10,7.884977759732852e-10,7.118615231915944e-10,4.92521754977466e-10,6.006192130614603e-10
RoW,Activity,"Plastics, basic",4.062731274440193e-09,4.971157897240586e-09,3.662609166388848e-09,2.4066736969608825e-09,2.640562835858687e-09
RoW,Activity,Post and telecommunications (64),6.896589588563964e-10,7.440822773307556e-10,6.863383612822024e-10,6.054044866014472e-10,5.604287767884323e-10
RoW,Activity,Poultry farming,4.984671341841595e-10,4.6139788743830326e-10,4.146511718360986e-10,2.8570025132259705e-10,3.3935431568193e-10
RoW,Activity,Precious metals production,7.328302023108644e-09,4.082798207691823e-09,3.2962405874011157e-09,2.0273190432428378e-09,4.406531032308555e-09
RoW,Activity,Private households with employed persons (95),1.6128118149500694e-11,1.5307686397036288e-11,1.3781600956538552e-11,1.0773723902390775e-11,1.1714981740628494e-11
RoW,Activity,Processed rice,4.0268322231260433e-10,3.9726028952242224e-10,3.7077203445111125e-10,2.367383004942261e-10,2.699336910077908e-10
RoW,Activity,Processing of Food products nec,5.64604038312348e-09,5.1475397040316854e-09,4.626678930975851e-09,3.196012945182096e-09,3.882877728236192e-09
RoW,Activity,Processing of dairy products,1.0425271446016399e-09,1.2420717765821678e-09,9.167352911401241e-10,6.241404289441561e-10,6.978239479638183e-10
RoW,Activity,Processing of meat cattle,4.768556528156608e-10,4.304279462588721e-10,3.9459431582231955e-10,2.7117597761879684e-10,3.293240709122785e-10
RoW,Activity,Processing of meat pigs,1.6645272872565903e-10,1.344684908475468e-10,1.1907140209840218e-10,8.483299495463056e-11,1.1311414957107456e-10
RoW,Activity,Processing of meat poultry,1.5514137830572192e-10,1.1810321403834715e-10,1.015918317715985e-10,7.218476937432271e-11,1.0302649870975524e-10
RoW,Activity,Processing of nuclear fuel,8.164683525641994e-10,6.052532290039834e-10,4.2804985198291373e-10,2.72292608493539e-10,4.86773984954453e-10
RoW,Activity,Processing vegetable oils and fats,2.1894574129884495e-09,1.983820554606691e-09,1.6878315229957685e-09,1.0823287886817352e-09,1.4022702211642322e-09
RoW,Activity,Production of electricity by Geothermal,1.0064742193689664e-09,2.8755948066042384e-10,2.458550086676515e-10,1.7891961345008052e-10,5.944517074615868e-10
RoW,Activity,Production of electricity by biomass and waste,0.0,0.0,0.0,0.0,0.0
RoW,Activity,Production of electricity by coal,1.329674336048959e-06,2.546444789877734e-07,2.1917649076305456e-07,1.548742813287175e-07,7.670704503620841e-07
RoW,Activity,Production of electricity by gas,5.525165565717589e-08,1.3096010036200986e-08,1.1468336489043283e-08,8.811959399333537e-09,3.2552086059349574e-08
RoW,Activity,Production of electricity by hydro,0.0,0.0,0.0,0.0,0.0
RoW,Activity,Production of electricity by nuclear,7.233869800330036e-10,2.529120728646069e-10,2.1989984726640764e-10,1.5199776602289526e-10,4.3036023261862546e-10
RoW,Activity,Production of electricity by petroleum and other oil derivatives,8.960864790583561e-08,3.3602656913984446e-08,2.933616029514329e-08,2.3022076752004225e-08,5.486767821562666e-08
RoW,Activity,Production of electricity by solar photovoltaic,0.0,0.0,0.0,0.0,0.0
RoW,Activity,Production of electricity by solar thermal,0.0,0.0,0.0,0.0,0.0
RoW,Activity,"Production of electricity by tide, wave, ocean",0.0,0.0,0.0,0.0,0.0
RoW,Activity,Production of electricity by wind,0.0,0.0,0.0,0.0,0.0
RoW,Activity,Production of electricity nec,1.5655609444384572e-08,7.880539204111506e-09,6.734276122005207e-09,4.634431345596701e-09,9.56850357308871e-09
RoW,Activity,Production of meat products nec,1.0080820774081659e-09,9.396640124871122e-10,8.365615602581062e-10,5.686338564756349e-10,6.858465019368154e-10
RoW,Activity,Production of offshore wind plants,0.0,0.0,0.0,0.0,0.0
RoW,Activity,Production of onshore wind plants,0.0,0.0,0.0,0.0,0.0
RoW,Activity,Production of photovoltaic plants,0.0,0.0,0.0,0.0,0.0
RoW,Activity,Public administration and defence; compulsory social security (75),4.891482643381845e-10,4.4941419945005776e-10,4.0308832683231826e-10,3.2383978857601864e-10,3.607113955289183e-10
RoW,Activity,"Publishing, printing and reproduction of recorded media (22)",1.1193299355216808e-09,1.2117948063955842e-09,1.051374749661754e-09,8.903564317201309e-10,8.679687665930614e-10
RoW,Activity,Pulp,1.4742662380310408e-08,1.2667374248285683e-08,9.830774817675243e-09,6.7790670724970434e-09,9.414530064998037e-09
RoW,Activity,Quarrying of sand and clay,2.1350271928227794e-09,1.9560185101908548e-09,1.8333786835048816e-09,1.1066685262771305e-09,1.3764561088334469e-09
RoW,Activity,Quarrying of stone,6.426841546206197e-09,4.0240619299765755e-09,4.574328241669221e-09,2.3688508843841717e-09,3.8830558601517895e-09
RoW,Activity,Raw milk,8.792920081982137e-10,8.958669947763095e-10,7.564407787059954e-10,5.236700721911838e-10,6.004659084296703e-10
RoW,Activity,Re-processing of ash into clinker,1.9996860344917918e-09,7.214997412924633e-10,8.616431239052052e-10,5.977318152348064e-10,1.2753930263256345e-09
RoW,Activity,Re-processing of secondary aluminium into new aluminium,1.224791211462585e-08,1.6127824830010094e-08,1.3845270977412232e-08,7.612097556287485e-09,7.667136142809153e-09
RoW,Activity,Re-processing of secondary construction material into aggregates,6.91906496136637e-10,4.677893860634158e-10,4.86531296906728e-10,4.0409491361226305e-10,5.224670596340058e-10
RoW,Activity,Re-processing of secondary copper into new copper,3.332897861724075e-09,9.808281201617278e-09,6.374152254560531e-09,3.8278472408152956e-09,2.2432436615647982e-09
RoW,Activity,Re-processing of secondary glass into new glass,1.1061097000220328e-08,4.17833925738127e-09,3.150480674028799e-09,1.792225195154884e-09,6.30649995571381e-09
RoW,Activity,"Re-processing of secondary lead into new lead, zinc and tin",5.406873554881844e-09,7.82922241418801e-09,7.540465281652078e-09,4.328238305002724e-09,3.6899248408703624e-09
RoW,Activity,Re-processing of secondary other non-ferrous metals into new other non-ferrous metals,2.4640180137793216e-09,3.4615401128702306e-09,2.9259114056040187e-09,1.7762803725384922e-09,1.6393498135017532e-09
RoW,Activity,Re-processing of secondary paper into new pulp,8.925609301557725e-09,7.131240805394503e-09,5.559885114418119e-09,3.860619300330272e-09,5.665963796358797e-09
RoW,Activity,Re-processing of secondary plastic into new plastic,8.060559530727851e-10,9.929623499824414e-10,7.251468299377807e-10,4.751505039791966e-10,5.227396282842581e-10
RoW,Activity,Re-processing of secondary preciuos metals into new preciuos metals,4.943450544024684e-10,5.137330307140024e-10,4.74835447285652e-10,3.3906471135088216e-10,3.4649338764240483e-10
RoW,Activity,Re-processing of secondary steel into new steel,7.1002389693306236e-09,1.4656556405145203e-08,1.2815758656470665e-08,7.389613981570055e-09,4.9434486922396826e-09
RoW,Activity,Re-processing of secondary wood material into new wood material,6.34281551559355e-10,5.142139789021105e-10,5.350994124061717e-10,3.3749579266445524e-10,4.2515353757681123e-10
RoW,Activity,Real estate activities (70),3.1783940048994944e-10,3.152333280665024e-10,3.1182636553679543e-10,2.5987595159185686e-10,2.885866124146772e-10
RoW,Activity,"Recreational, cultural and sporting activities (92)",1.2157898555435133e-10,1.3645651746657966e-10,1.2395303441655505e-10,1.1335623497559415e-10,1.0066234311476881e-10
RoW,Activity,Recycling of bottles by direct reuse,0.0,0.0,0.0,0.0,0.0
RoW,Activity,Recycling of waste and scrap,2.1324142491964305e-08,2.704201935477052e-08,2.2425805338831277e-08,1.3461427304191276e-08,1.3783561935896878e-08
RoW,Activity,Renting of machinery and equipment without operator and of personal and household goods (71),7.121494470220703e-10,7.630373068483347e-10,7.093588351403913e-10,6.310477369163222e-10,6.105526542857548e-10
RoW,Activity,Research and development (73),2.526892061269397e-09,4.118620271600955e-09,3.304498471446451e-09,2.3520787549824273e-09,1.8203564180961041e-09
RoW,Activity,Retail sale of automotive fuel,2.307134035439081e-09,2.220258932225105e-09,2.0642783308049618e-09,1.5726612175072835e-09,2.390019795877594e-09
