Region,,,EU27+UK,EU27+UK,EU27+UK,EU27+UK,EU27+UK
Level,,,Activity,Activity,Activity,Activity,Activity
Item,,,Production of photovoltaic plants,Production of onshore wind plants,Production of offshore wind plants,Production of electricity by wind,Production of electricity by solar photovoltaic
Region,Level,Item,,,,,
China,Activity,Activities auxiliary to financial intermediation (67),1.150272333638576e-12,5.358414276191271e-13,2.7981616696605427e-13,1.2104057316057305e-13,4.885796932920042e-13
China,Activity,Activities of membership organisation n.e.c. (91),1.240238205470891e-14,2.4163737346684425e-15,1.3155444548458085e-15,5.771874712886803e-16,5.204202959805761e-15
China,Activity,Air transport (62),8.879273997253677e-12,4.200344188006564e-12,2.3423745926988755e-12,1.0780679424429776e-12,3.843638283665485e-12
China,Activity,Aluminium production,9.669612543096121e-12,6.816344702929754e-12,3.306359894110355e-12,1.38433459019477e-12,4.090539663264778e-12
China,Activity,Animal products nec,1.0490912870690545e-12,3.999183285455602e-13,2.514098619043092e-13,1.1303960112299531e-13,4.557048136618824e-13
China,Activity,"Biogasification of food waste, incl. land application",0.0,0.0,0.0,0.0,0.0
China,Activity,"Biogasification of paper, incl. land application",0.0,0.0,0.0,0.0,0.0
China,Activity,"Biogasification of sewage slugde, incl. land application",0.0,0.0,0.0,0.0,0.0
China,Activity,Casting of metals,1.2554748444988736e-12,4.406226814111613e-12,1.9742878275146085e-12,8.252185754680634e-13,5.505268341384729e-13
China,Activity,Cattle farming,7.031654546734511e-13,2.632579644352962e-13,1.5597444213620913e-13,6.82086065809629e-14,3.0173998577810277e-13
China,Activity,Chemicals nec,2.452019587668353e-11,5.759707875804727e-12,3.3253632289554393e-12,1.458894983897751e-12,1.0334389354473228e-11
China,Activity,"Collection, purification and distribution of water (41)",4.2636040826220337e-13,1.2881593882385852e-13,6.839702577384463e-14,2.8359437551607535e-14,1.790085351610156e-13
China,Activity,"Composting of food waste, incl. land application",2.3605792450187533e-14,3.3993666800611936e-15,1.9960623484277796e-15,8.496610770190192e-16,9.88910001855874e-15
China,Activity,"Composting of paper and wood, incl. land application",8.025416552926814e-15,1.0119803704868187e-15,5.944385434829461e-16,2.4443870806634787e-16,3.3542267093269067e-15
China,Activity,Computer and related activities (72),5.640922924365983e-13,2.7884453902562493e-13,1.6103332894885162e-13,7.194650572996664e-14,2.449171971213993e-13
China,Activity,Construction (45),1.835812379592577e-11,5.035356529275457e-12,3.359719075207476e-12,2.030618576437223e-12,8.53550577295358e-12
China,Activity,Copper production,1.0972410628361004e-12,5.605395796550958e-12,2.5335734051726956e-12,1.0604648556882762e-12,4.979785365865515e-13
China,Activity,Cultivation of cereal grains nec,1.0607558627297029e-11,2.765079105111838e-12,1.5675873474678912e-12,6.658039118690345e-13,4.483366055152547e-12
China,Activity,Cultivation of crops nec,5.1292863261625896e-11,1.5699035819711188e-11,8.834874456767702e-12,3.796748664159432e-12,2.1707023160069513e-11
China,Activity,Cultivation of oil seeds,2.0797022792230237e-11,1.2919449661590545e-11,6.791249590168127e-12,2.9111830519167086e-12,8.906416872289964e-12
China,Activity,Cultivation of paddy rice,9.832494822462775e-12,3.3150483402439794e-12,1.7521083617275094e-12,7.595313057353751e-13,4.152830373038972e-12
China,Activity,Cultivation of plant-based fibers,9.316899665075419e-12,4.95891336855717e-12,2.967465447500579e-12,1.2974998452803019e-12,4.045600342258312e-12
China,Activity,"Cultivation of sugar cane, sugar beet",7.439627266059757e-12,2.7534817737875668e-12,1.4803115381780888e-12,6.364379987545574e-13,3.155519138864071e-12
China,Activity,"Cultivation of vegetables, fruit, nuts",6.275215737738645e-11,2.137977241297745e-11,1.2002193499801094e-11,5.19004639025496e-12,2.6724541730173998e-11
China,Activity,Cultivation of wheat,7.2568704616093295e-12,2.843828234270166e-12,1.5909821534337832e-12,6.917309885715998e-13,3.0935988277815174e-12
China,Activity,Distribution and trade of electricity,9.201471132340449e-15,3.531850877833951e-15,1.9109078602720723e-15,7.8157904092015265e-16,3.874489753583086e-15
China,Activity,Education (80),3.9942456428962685e-13,1.4833164191160313e-13,7.828380455485336e-14,3.437435389749313e-14,1.6927865512743025e-13
China,Activity,Extra-territorial organizations and bodies,0.0,0.0,0.0,0.0,0.0
China,Activity,"Extraction of crude petroleum and services related to crude oil extraction, excluding surveying",2.8899731809660883e-11,1.0970622129516337e-11,5.998255611301249e-12,2.5511352885365386e-12,1.2233788857663871e-11
China,Activity,"Extraction of natural gas and services related to natural gas extraction, excluding surveying",9.293105538968605e-13,7.005811682166103e-13,3.7228956554878046e-13,1.6307322057484451e-13,4.013472039372108e-13
China,Activity,"Extraction, liquefaction, and regasification of other petroleum and gaseous materials",0.0,0.0,0.0,0.0,0.0
China,Activity,"Financial intermediation, except insurance and pension funding (65)",4.8928172341756695e-12,1.5752590186237012e-12,8.080650711350827e-13,3.468821693849479e-13,2.0592728344900505e-12
China,Activity,"Fishing, operating of fish hatcheries and fish farms; service activities incidental to fishing (05)",5.460620387376824e-11,3.527850632334337e-11,1.839050218786434e-11,7.956941070332973e-12,2.3516431251082676e-11
China,Activity,"Forestry, logging and related service activities (02)",6.077442005085614e-11,2.802826229584849e-11,1.500271452815433e-11,6.530894416332876e-12,2.588048041757302e-11
China,Activity,Health and social work (85),1.6565277790941045e-12,5.983894130162889e-13,2.9535997171235157e-13,1.224541661032255e-13,6.93949454010821e-13
China,Activity,Hotels and restaurants (55),1.7980237042178268e-10,9.280749452405919e-11,5.0987451541675785e-11,2.2178670324883017e-11,7.78571493342276e-11
China,Activity,Incineration of waste: Food,1.2916290386459692e-13,2.3798975183716086e-14,1.3339970070756878e-14,5.733834229153938e-15,5.417715503856322e-14
China,Activity,Incineration of waste: Metals and Inert materials,1.4217672114370803e-14,2.9757683809570083e-15,1.924819593995032e-15,1.3308782419353807e-15,6.044964492700868e-15
China,Activity,Incineration of waste: Oil/Hazardous waste,2.6451185356585534e-14,5.140555436699657e-15,2.95759980145486e-15,1.2768183122046901e-15,1.1117747966012637e-14
China,Activity,Incineration of waste: Paper,1.2540615671171748e-13,2.1565060029244168e-14,1.2141939821601369e-14,5.136889654714975e-15,5.2532445105618314e-14
China,Activity,Incineration of waste: Plastic,3.0516412308035764e-14,4.8813330030843e-15,2.8480804419923805e-15,1.2164718809481127e-15,1.279722061649508e-14
China,Activity,Incineration of waste: Textiles,2.451888736445412e-14,4.8420528789666555e-15,2.7308780777952985e-15,1.1729945238246208e-15,1.0295587811459502e-14
China,Activity,Incineration of waste: Wood,2.8933086358855176e-14,5.369863030999172e-15,3.051912683973939e-15,1.2942024596671074e-15,1.2137998119327569e-14
China,Activity,Inland water transport,3.3739748748850547e-13,1.77557105633931e-13,9.321081432071546e-14,3.9556551967578284e-14,1.437772091686754e-13
China,Activity,"Insurance and pension funding, except compulsory social security (66)",1.4961367534664553e-12,6.222885387257394e-13,3.2349225452447096e-13,1.4482678113442399e-13,6.382179280573934e-13
China,Activity,Landfill of waste: Food,4.993671091643061e-13,9.671175000567479e-14,5.3421543949050365e-14,2.239070786545657e-14,2.0919185874477125e-13
China,Activity,Landfill of waste: Inert/metal/hazardous,1.8192614786081835e-13,3.186086401131949e-14,1.777732277504771e-14,7.642176377145731e-15,7.617901039380291e-14
China,Activity,Landfill of waste: Paper,2.269600283509492e-13,3.585399077151092e-14,2.047943341520713e-14,8.642640567760373e-15,9.502891348530043e-14
China,Activity,Landfill of waste: Plastic,1.6551345276538928e-13,3.310309722908933e-14,1.8280609739459216e-14,7.685275142421451e-15,6.936905576698891e-14
China,Activity,Landfill of waste: Textiles,7.611795742989635e-14,1.3628428141427071e-14,7.570897918963601e-15,3.199285846015384e-15,3.1879117219803545e-14
China,Activity,Landfill of waste: Wood,9.191202469076013e-14,1.642557572729601e-14,9.116055022745036e-15,3.8548690831569105e-15,3.8492905893047926e-14
China,Activity,"Lead, zinc and tin production",2.2367394993920968e-13,3.209220895861015e-13,1.5975478129504144e-13,6.782066269564446e-14,9.827439027281697e-14
China,Activity,Manufacture of basic iron and steel and of ferro-alloys and first products thereof,2.3937942622543297e-11,5.603953214570068e-11,2.7040578842959324e-11,1.1285272513783558e-11,1.056008005975026e-11
China,Activity,Manufacture of beverages,2.1927471038005378e-13,1.4299212194700522e-13,7.461672862071656e-14,3.235666557291879e-14,9.479048717047283e-14
China,Activity,"Manufacture of bricks, tiles and construction products, in baked clay",1.8787357356513037e-14,1.077149444275467e-14,6.636525843762571e-15,3.1634975953782973e-15,8.446853115671892e-15
China,Activity,"Manufacture of cement, lime and plaster",9.21227163585921e-14,2.5567407701631028e-14,2.6767251857774493e-14,1.4979603399169404e-14,4.4724670595159375e-14
China,Activity,Manufacture of ceramic goods,8.408341308418405e-13,1.1509818993642064e-12,6.000711284090382e-13,2.771569983837868e-13,3.923753094758012e-13
China,Activity,Manufacture of coke oven products,1.5920907657339373e-12,1.3643565589704186e-12,6.930869494132227e-13,2.851338705446576e-13,6.779974620278378e-13
China,Activity,Manufacture of electrical machinery and apparatus n.e.c. (31),1.2650704034636389e-11,1.3272871203352452e-10,5.735799660595856e-11,2.3836251043226813e-11,5.780716097099015e-12
China,Activity,"Manufacture of fabricated metal products, except machinery and equipment (28)",1.6208521007968803e-11,1.7843239303118735e-11,9.427071977191646e-12,3.9899541996740755e-12,7.051044434026078e-12
China,Activity,Manufacture of fish products,9.11934321571124e-13,6.287516084353608e-13,3.2393911052331983e-13,1.3990320104223007e-13,3.927525423077267e-13
China,Activity,Manufacture of furniture; manufacturing n.e.c. (36),1.1029364596389306e-11,1.0890418351038013e-11,5.4833491657990224e-12,2.397333381269096e-12,4.752171581331158e-12
China,Activity,Manufacture of gas; distribution of gaseous fuels through mains,6.711496789472318e-13,3.032027347711278e-13,1.6028377840171202e-13,6.575317372561461e-14,2.829547766172908e-13
China,Activity,Manufacture of glass and glass products,1.1262858302585352e-10,3.6363570471395985e-12,1.972375819904788e-12,7.979386906629182e-13,4.675054012461826e-11
China,Activity,Manufacture of machinery and equipment n.e.c. (29),2.480465288719834e-11,1.9823687854848652e-11,1.0620543653547256e-11,4.587272400838638e-12,1.0697253196808183e-11
China,Activity,"Manufacture of medical, precision and optical instruments, watches and clocks (33)",1.919661781927753e-12,3.14472783789656e-12,1.7007254688674546e-12,9.574295361870687e-13,1.0074092704020558e-12
China,Activity,"Manufacture of motor vehicles, trailers and semi-trailers (34)",1.3722659421479508e-11,2.5293466944471378e-12,1.4961860221357506e-12,6.241411709473834e-13,5.766037658592389e-12
China,Activity,Manufacture of office machinery and computers (30),3.085145845673502e-12,2.9393387746023604e-12,1.9659860457508034e-12,9.895618460393818e-13,1.5148470960726732e-12
China,Activity,Manufacture of other non-metallic mineral products n.e.c.,4.192201297673399e-11,2.254714257860763e-12,1.1733150701823174e-12,4.878090759773085e-13,1.7417932297253067e-11
China,Activity,Manufacture of other transport equipment (35),2.806806850681493e-12,1.1447913857546657e-12,6.898040859082533e-13,3.070961549592783e-13,1.2129120461877022e-12
China,Activity,"Manufacture of radio, television and communication equipment and apparatus (32)",2.511349992921834e-12,8.05532514636105e-12,4.15378808273218e-12,2.0065070806041176e-12,1.3148085976910232e-12
China,Activity,Manufacture of rubber and plastic products (25),2.941800334355105e-11,2.7229977144096367e-11,1.3715938106997557e-11,5.859438788617517e-12,1.2682110553385463e-11
China,Activity,Manufacture of textiles (17),7.3989974590236e-12,4.324983168209438e-12,2.4675113001298724e-12,1.0774268254610702e-12,3.2032190549959734e-12
China,Activity,Manufacture of tobacco products (16),2.490778851056173e-14,7.687086704431312e-15,4.1625032811450035e-15,1.6559681519761164e-15,1.042763766458474e-14
China,Activity,Manufacture of wearing apparel; dressing and dyeing of fur (18),1.6206830061676968e-12,6.272581913694768e-13,3.611508641060085e-13,1.6058226731094616e-13,6.945345457489107e-13
China,Activity,"Manufacture of wood and of products of wood and cork, except furniture; manufacture of articles of straw and plaiting materials (20)",2.2204716783742496e-13,1.436718173670613e-13,1.3970195726710676e-13,6.128073001822585e-14,1.077948771308075e-13
China,Activity,"Manure treatment (biogas), storage and land application",0.0,0.0,0.0,0.0,0.0
China,Activity,"Manure treatment (conventional), storage and land application",0.0,0.0,0.0,0.0,0.0
China,Activity,Meat animals nec,3.575216387066649e-11,1.8918406188144966e-12,1.4721535532714666e-12,5.57599817702053e-13,1.4902317694267647e-11
China,Activity,Mining of aluminium ores and concentrates,9.522632079498938e-13,6.574879001052118e-13,3.875753574009015e-13,1.5588369219436034e-13,4.0848311293732113e-13
China,Activity,"Mining of chemical and fertilizer minerals, production of salt, other mining and quarrying n.e.c.",4.879324052118145e-13,2.336581714307161e-13,1.9264352274197564e-13,7.036937436340007e-14,2.1049082625899297e-13
China,Activity,Mining of coal and lignite; extraction of peat (10),3.8638392368927966e-16,7.454235123707817e-17,3.9567388150963647e-17,1.6361831628434186e-17,1.614402435918837e-16
China,Activity,Mining of copper ores and concentrates,5.871300606086442e-12,1.0091895684884029e-11,5.0688231344758014e-12,2.012927599428691e-12,2.518087851034729e-12
China,Activity,Mining of iron ores,6.804310332118405e-13,1.1633103591742077e-12,5.86705774421965e-13,2.390798151773429e-13,2.9540528012190584e-13
China,Activity,"Mining of lead, zinc and tin ores and concentrates",6.906250189870057e-14,9.856827199329934e-14,5.1150107248540695e-14,2.1488062760242502e-14,3.050184347403584e-14
China,Activity,Mining of nickel ores and concentrates,9.579695189676777e-13,1.235068414971964e-12,1.3348084578830207e-12,3.878475121538474e-13,4.1391226393926074e-13
China,Activity,Mining of other non-ferrous metal ores and concentrates,5.497929844373208e-12,6.1581540758697145e-12,7.809926427285933e-12,2.1591066593181797e-12,2.3717258900623576e-12
China,Activity,Mining of precious metal ores and concentrates,6.9950933263282e-11,5.162536003796276e-12,2.6808775375911696e-12,1.0756863987524771e-12,2.9058211912827367e-11
China,Activity,Mining of uranium and thorium ores (12),5.970453295894814e-14,8.950494017514974e-14,4.589060469233724e-14,2.08159037532971e-14,2.6970481154334205e-14
China,Activity,N-fertiliser,5.6715775523481425e-15,2.701941901716574e-15,1.639775890094364e-15,7.84821762730295e-16,2.4554033655757515e-15
China,Activity,Other business activities (74),4.073232941885331e-12,2.4617657809808566e-12,1.2902151452640488e-12,6.205348945892032e-13,1.768661074846025e-12
China,Activity,Other land transport,2.0691542581111754e-11,8.976666400376676e-12,4.8302451527867775e-12,2.133019600416728e-12,8.843212855863653e-12
China,Activity,Other non-ferrous metal production,6.05444096347225e-13,9.211812405775265e-13,1.5048457328872402e-12,3.851097594773636e-13,2.6535199970689157e-13
China,Activity,Other service activities (93),2.3591665178366534e-12,4.407505702532326e-13,2.51562678336309e-13,1.0424883391197668e-13,9.885609098031609e-13
China,Activity,P- and other fertiliser,7.842746776809203e-13,3.171291930678911e-13,1.9253374655426347e-13,8.588969314452846e-14,3.3714847208485387e-13
China,Activity,Paper,3.5079956875142506e-12,1.811756459695255e-12,9.084481718323646e-13,4.0115928082245664e-13,1.4924862456165477e-12
China,Activity,Petroleum Refinery,1.0722596150809009e-11,3.9426815968197854e-12,2.1668577958280506e-12,9.201052285222983e-13,4.539116828005095e-12
China,Activity,Pigs farming,1.8819976070579126e-10,1.1278708795606474e-11,8.453331645838047e-12,3.233803727499505e-12,7.84816203716186e-11
China,Activity,"Plastics, basic",1.6367637037908578e-12,2.0883897831805445e-12,1.0306224683616772e-12,4.4312463078213806e-13,7.142080493010508e-13
China,Activity,Post and telecommunications (64),4.884400608586723e-12,3.203326311315556e-12,1.6713083356999584e-12,8.060982212959844e-13,2.1382267511299344e-12
China,Activity,Poultry farming,1.2815746336558274e-11,4.143086953472058e-12,2.3380963365470433e-12,1.0052036777753001e-12,5.459431157505163e-12
China,Activity,Precious metals production,8.920615271821742e-12,5.955613958368432e-13,2.7746747778131447e-13,1.1808073169383443e-13,3.704835038258157e-12
China,Activity,Private households with employed persons (95),2.4851977491703225e-14,6.7942371841015516e-15,4.099319474250332e-15,1.5985651569353128e-15,1.0432754921358051e-14
China,Activity,Processed rice,1.0346836272579157e-14,4.336321333765976e-15,2.2969219706496572e-15,9.915249343464012e-16,4.388581010194218e-15
China,Activity,Processing of Food products nec,7.365494979177455e-12,1.8561981965039275e-12,1.0506563251384267e-12,4.454687861053314e-13,3.110116616417646e-12
China,Activity,Processing of dairy products,1.2441206444984759e-14,4.225321830037444e-15,2.303346613338726e-15,9.845258205070861e-16,5.265018276402468e-15
China,Activity,Processing of meat cattle,3.461143564509186e-16,1.5118488684218467e-16,8.433293423545222e-17,3.6650178429437416e-17,1.4893427811457247e-16
China,Activity,Processing of meat pigs,1.8495004732603777e-16,7.596891326915116e-17,4.241902367950207e-17,1.8374528582901783e-17,7.932636963074618e-17
China,Activity,Processing of meat poultry,2.2660861612133082e-14,8.702701963877013e-15,4.851722094564845e-15,2.1004105750511873e-15,9.696449554836578e-15
China,Activity,Processing of nuclear fuel,3.548219232903579e-16,2.8973330632572776e-16,1.7464427836720777e-16,7.702686356143932e-17,1.5832563064285927e-16
China,Activity,Processing vegetable oils and fats,2.465854293793016e-14,8.36091545891401e-15,4.553497453433264e-15,1.970503413237909e-15,1.044566843827525e-14
China,Activity,Production of electricity by Geothermal,3.208426566163695e-16,5.59145653186613e-17,3.027916900791313e-17,1.2360937490583236e-17,1.339426091939119e-16
China,Activity,Production of electricity by biomass and waste,4.606283302756322e-13,3.853538272014933e-15,2.6718823088226278e-15,9.581500390110469e-16,1.9101750106574548e-13
China,Activity,Production of electricity by coal,4.9582786531559785e-11,6.6811228820278195e-12,3.613766076271472e-12,1.4730878159059264e-12,2.066405335772004e-11
China,Activity,Production of electricity by gas,1.096368773612817e-12,8.971177195710402e-14,4.865554757083348e-14,1.9814777550198073e-14,4.559779441716029e-13
China,Activity,Production of electricity by hydro,6.166569446098263e-12,6.618084321243712e-13,3.573302406370466e-13,1.4576472966871734e-13,2.567163924133487e-12
China,Activity,Production of electricity by nuclear,2.320855370982074e-12,1.6051524841274384e-13,8.600570744063839e-14,3.521201541998494e-14,9.647155002467835e-13
China,Activity,Production of electricity by petroleum and other oil derivatives,1.9429955204676328e-18,3.253956666410364e-19,1.7500792113908711e-19,7.269863729771979e-20,8.114009636740379e-19
China,Activity,Production of electricity by solar photovoltaic,6.387900093565444e-14,1.2326280645353812e-17,8.025211441037232e-18,3.2332105860482682e-18,2.6481013847729412e-14
China,Activity,Production of electricity by solar thermal,5.693214389970789e-15,2.077096884070088e-18,1.1968449732255715e-18,4.891716971810999e-19,2.3601305709442064e-15
China,Activity,"Production of electricity by tide, wave, ocean",1.2673115504871231e-16,2.112479076706263e-17,1.1463125199207401e-17,4.6729865024844236e-18,5.288958665605295e-17
China,Activity,Production of electricity by wind,9.269358850986595e-13,8.861379813042318e-15,5.566389163749309e-15,2.0155184915850617e-15,3.843595077208691e-13
China,Activity,Production of electricity nec,4.263941097798158e-14,1.708676960525481e-14,9.251735240908596e-15,3.773669261003878e-15,1.7960440242622224e-14
China,Activity,Production of meat products nec,4.047012179755371e-13,1.5345130884453523e-13,8.881512631619572e-14,3.9252546423749445e-14,1.7354675541277296e-13
China,Activity,Production of offshore wind plants,0.0,0.0,0.0,0.0,0.0
China,Activity,Production of onshore wind plants,0.0,0.0,0.0,0.0,0.0
China,Activity,Production of photovoltaic plants,0.0,0.0,0.0,0.0,0.0
China,Activity,Public administration and defence; compulsory social security (75),1.17786392966241e-13,4.9423375245565783e-14,2.6176594533921056e-14,1.1776916581355493e-14,5.0611821508093185e-14
China,Activity,"Publishing, printing and reproduction of recorded media (22)",6.418166282078176e-12,3.762347622690589e-12,1.9411023498243195e-12,8.733372697927719e-13,2.756326731619058e-12
China,Activity,Pulp,8.740207842517201e-15,4.6508686247927284e-15,2.4525009613433033e-15,1.1134029460684805e-15,3.75421177606689e-15
China,Activity,Quarrying of sand and clay,2.3216756132580324e-11,3.1869344789455447e-12,1.7191437322406441e-12,7.302896437151938e-13,9.695619144201681e-12
China,Activity,Quarrying of stone,1.8515192232920003e-11,1.0805651320823928e-12,5.940949711886238e-13,2.4272076091243127e-13,7.697449601744846e-12
China,Activity,Raw milk,4.415118863779262e-12,1.1327753145905842e-12,6.337243668207121e-13,2.6958370632088814e-13,1.86088619950493e-12
China,Activity,Re-processing of ash into clinker,0.0,0.0,0.0,0.0,0.0
China,Activity,Re-processing of secondary aluminium into new aluminium,0.0,0.0,0.0,0.0,0.0
China,Activity,Re-processing of secondary construction material into aggregates,0.0,0.0,0.0,0.0,0.0
China,Activity,Re-processing of secondary copper into new copper,0.0,0.0,0.0,0.0,0.0
China,Activity,Re-processing of secondary glass into new glass,0.0,0.0,0.0,0.0,0.0
China,Activity,"Re-processing of secondary lead into new lead, zinc and tin",0.0,0.0,0.0,0.0,0.0
China,Activity,Re-processing of secondary other non-ferrous metals into new other non-ferrous metals,0.0,0.0,0.0,0.0,0.0
China,Activity,Re-processing of secondary paper into new pulp,1.3638290346927231e-14,5.4370625624484585e-17,2.9667004211568445e-17,1.2096850700622804e-17,5.6546009353134206e-15
China,Activity,Re-processing of secondary plastic into new plastic,0.0,0.0,0.0,0.0,0.0
China,Activity,Re-processing of secondary preciuos metals into new preciuos metals,0.0,0.0,0.0,0.0,0.0
China,Activity,Re-processing of secondary steel into new steel,0.0,0.0,0.0,0.0,0.0
China,Activity,Re-processing of secondary wood material into new wood material,0.0,0.0,0.0,0.0,0.0
China,Activity,Real estate activities (70),3.982681766220414e-13,1.6338203773679244e-13,8.553550049358525e-14,3.771142673336501e-14,1.6986124940369142e-13
China,Activity,"Recreational, cultural and sporting activities (92)",4.676389958887993e-13,1.7940803193724314e-13,9.358752378273303e-14,3.9625398220867604e-14,1.9724576751411186e-13
China,Activity,Recycling of bottles by direct reuse,0.0,0.0,0.0,0.0,0.0
China,Activity,Recycling of waste and scrap,1.562355603191276e-11,4.870817536940892e-12,2.5332011640294804e-12,1.0465310423769488e-12,6.552597535444055e-12
China,Activity,Renting of machinery and equipment without operator and of personal and household goods (71),6.841346777636329e-14,5.5132039061044865e-14,2.7345007983764278e-14,1.1416921582085787e-14,2.915356556324618e-14
China,Activity,Research and development (73),5.4212797659247725e-14,8.84417716390754e-14,4.5326533259355296e-14,2.0541833327442885e-14,2.465357135286826e-14
China,Activity,Retail sale of automotive fuel,6.907798828409776e-13,4.217124470140353e-13,2.4987875957551737e-13,1.1525565892201673e-13,3.1900092144361237e-13
China,Activity,"Retail trade, except of motor vehicles and motorcycles; repair of personal and household goods (52)",5.3339377034204134e-11,2.3201839043290352e-11,1.3121696527401903e-11,6.08344597937824e-12,2.3069547328887417e-11
China,Activity,"Sale, maintenance, repair of motor vehicles, motor vehicles parts, motorcycles, motor cycles parts and accessoiries",4.038262280320029e-11,1.4484541589175473e-11,7.894054513781166e-12,3.3333015320454487e-12,1.7090543066668437e-11
China,Activity,Sea and coastal water transport,2.9373501161585836e-10,5.198727917061754e-12,6.631751992176196e-12,2.1060937937175517e-12,1.2209995107427107e-10
China,Activity,Steam and hot water supply,1.7053799543995195e-13,8.390794970713708e-14,4.444781779382643e-14,1.8623225956284178e-14,7.226561663065602e-14
China,Activity,Sugar refining,1.330368952523718e-15,4.817041226489662e-16,2.593030499514059e-16,1.1010441417477962e-16,5.632627163851984e-16
China,Activity,Supporting and auxiliary transport activities; activities of travel agencies (63),4.649658880771037e-11,2.018157628089376e-11,1.1015618352042385e-11,4.639335421741991e-12,1.9789559418639124e-11
China,Activity,"Tanning and dressing of leather; manufacture of luggage, handbags, saddlery, harness and footwear (19)",2.0457068077632726e-12,1.6499312816338477e-12,9.856108886192991e-13,4.4319380130401643e-13,9.129520178053373e-13
China,Activity,Transmission of electricity,4.183288402088249e-15,1.6232477926858413e-15,8.778926708165536e-16,3.577684957672712e-16,1.7607755181876925e-15
China,Activity,Transport via pipelines,9.437502523590182e-13,3.501994117949143e-13,2.0905039792860455e-13,8.777159074653077e-14,4.0570136600605224e-13
China,Activity,Transport via railways,4.613475390284141e-12,2.6495630050931715e-12,1.3831792692109508e-12,5.821192537718336e-13,1.9633027726592557e-12
China,Activity,"Waste water treatment, food",5.466489783889612e-13,1.0455064566805948e-13,5.773000690934202e-14,2.4176830059347934e-14,2.2894659856134364e-13
