EU27+UK,Activity,Research and development (73),7.443581262744713e-12,1.7526879655409247e-11,1.478857670275733e-11,4.418588258027532e-12,2.064390069366746e-12
EU27+UK,Activity,Retail sale of automotive fuel,5.383089563876908e-12,6.994107052910338e-12,7.637088004447136e-12,3.3774551328265843e-12,8.044240693997466e-12
EU27+UK,Activity,"Retail trade, except of motor vehicles and motorcycles; repair of personal and household goods (52)",1.0097241654062789e-10,1.6489790688282452e-10,1.5696851487645107e-10,5.211498603297168e-11,1.615201786205755e-10
EU27+UK,Activity,"Sale, maintenance, repair of motor vehicles, motor vehicles parts, motorcycles, motor cycles parts and accessoiries",2.98534861504163e-11,4.3233967931304025e-11,4.7483640033342256e-11,2.969378085449379e-11,4.778094040886122e-11
EU27+UK,Activity,Sea and coastal water transport,1.3026570876960075e-11,2.025659378343871e-11,7.830859968144335e-11,2.119527344069035e-12,1.7833676707125112e-12
EU27+UK,Activity,Steam and hot water supply,9.18747021082257e-13,1.0440171380352571e-12,1.0121470667796148e-12,5.815869023864257e-13,3.316192140005068e-13
EU27+UK,Activity,Sugar refining,3.3452657098603583e-13,6.774890701833845e-13,6.766619209627748e-13,1.68766783419704e-13,1.5384171672772605e-13
EU27+UK,Activity,Supporting and auxiliary transport activities; activities of travel agencies (63),5.862219891054353e-11,9.275823434617289e-11,1.2720157270139786e-10,3.257376425403409e-11,2.745414777006108e-11
EU27+UK,Activity,"Tanning and dressing of leather; manufacture of luggage, handbags, saddlery, harness and footwear (19)",7.78511042244559e-13,1.3155507270200443e-12,1.2741770329937658e-12,3.0853848982038364e-13,2.0888647862196712e-13
EU27+UK,Activity,Transmission of electricity,1.108826140680557e-12,1.4743422298881063e-12,1.5242254449624435e-12,9.211010307670174e-13,5.591810060697119e-13
EU27+UK,Activity,Transport via pipelines,6.589624268802454e-13,7.991850743674226e-13,9.514012126627194e-13,5.69576788480258e-13,5.158469417592684e-13
EU27+UK,Activity,Transport via railways,6.0709943858504644e-12,1.1091701835629497e-11,1.2278260940291248e-11,4.198474844018442e-12,4.9396336172467445e-12
EU27+UK,Activity,"Waste water treatment, food",7.606859881500027e-13,8.83699138748438e-13,9.615790574319869e-13,3.6386954195425625e-13,1.8709116013466137e-13
EU27+UK,Activity,"Waste water treatment, other",1.2632888953374942e-12,1.5130122353579905e-12,1.6220580594842975e-12,6.174277172043298e-13,3.097477293919523e-13
EU27+UK,Activity,"Wholesale trade and commission trade, except of motor vehicles and motorcycles (51)",1.4027250665915876e-10,2.771988983226652e-10,2.613007344701277e-10,8.002292450504358e-11,1.3290359850111956e-10
EU27+UK,Activity,"Wool, silk-worm cocoons",2.373999929078329e-14,2.473786772896165e-14,2.3878378855476356e-14,9.954698546672568e-15,7.240555372399646e-15
RoW,Activity,Activities auxiliary to financial intermediation (67),6.932091323269008e-12,6.9900481872384395e-12,6.453990473361107e-12,2.921189785462184e-12,1.669690776268289e-12
RoW,Activity,Activities of membership organisation n.e.c. (91),1.8525083635378354e-12,1.892691777294557e-12,1.692377188435517e-12,4.736712594598378e-13,2.844965015583279e-13
RoW,Activity,Air transport (62),1.3535515034568057e-11,1.6667065608668912e-11,1.6200374116027874e-11,5.9355304864658786e-12,3.924053433957152e-12
RoW,Activity,Aluminium production,4.503990242801744e-11,5.926444803603296e-11,5.0839018370994735e-11,5.143001253823809e-12,3.2869989529961175e-12
RoW,Activity,Animal products nec,1.0317378178632303e-11,1.078874961016199e-11,9.693849774754996e-12,2.358034988176276e-12,1.6568811910915602e-12
RoW,Activity,"Biogasification of food waste, incl. land application",4.452688451500152e-14,4.8570589703550574e-14,4.3728131418594924e-14,1.1544561513581958e-14,6.125139678318559e-15
RoW,Activity,"Biogasification of paper, incl. land application",3.5202905328934486e-14,4.20378897216684e-14,3.618192328629619e-14,7.181537488483497e-15,3.781369521500851e-15
RoW,Activity,"Biogasification of sewage slugde, incl. land application",7.619343322051576e-14,8.492656502499049e-14,7.814288415077413e-14,2.0363942860555315e-14,1.103061757093091e-14
RoW,Activity,Casting of metals,1.0329795987733884e-11,1.2635991592270378e-11,1.0280747031839924e-11,2.656237224434335e-12,1.5251400501021418e-12
RoW,Activity,Cattle farming,1.1351294529061525e-11,1.0622276928903778e-11,9.49263481397417e-12,2.300935969997812e-12,1.3546424290354826e-12
RoW,Activity,Chemicals nec,1.0484480577827937e-10,1.1584683891300978e-10,1.0558190170411817e-10,1.9378880480288698e-11,9.874668768550016e-12
RoW,Activity,"Collection, purification and distribution of water (41)",4.927110866256201e-12,3.665284183165397e-12,3.2442498494971327e-12,8.614653060224084e-13,5.169132193563525e-13
RoW,Activity,"Composting of food waste, incl. land application",8.08273706141684e-14,8.116359087936285e-14,7.626411221941224e-14,2.3147488235296984e-14,1.2854067608750058e-14
RoW,Activity,"Composting of paper and wood, incl. land application",3.618230285525638e-14,3.906756789970988e-14,3.4211300703947784e-14,7.36922017765411e-15,4.221487992970821e-15
RoW,Activity,Computer and related activities (72),6.1456706135007075e-12,7.325519150536328e-12,6.60880804503556e-12,3.016683348241771e-12,1.846938656348949e-12
RoW,Activity,Construction (45),3.4501161799873734e-11,2.4414161178721436e-11,2.5222071022045864e-11,1.0505001306916764e-11,7.302398062822637e-12
RoW,Activity,Copper production,2.492356935389329e-11,7.30666745958119e-11,4.767653816736913e-11,4.742648396593961e-12,3.0452033392270678e-12
RoW,Activity,Cultivation of cereal grains nec,2.994195027576456e-11,2.964525403598556e-11,2.6798478737907488e-11,5.979386164969001e-12,3.7170957411271405e-12
RoW,Activity,Cultivation of crops nec,1.4781351619289404e-10,1.215480977836331e-10,1.0934489059937441e-10,2.273339288457201e-11,1.564237507700853e-11
RoW,Activity,Cultivation of oil seeds,1.0184878527961356e-10,8.577301253075903e-11,7.075592045791358e-11,1.0494500260343883e-11,6.4958206602409335e-12
RoW,Activity,Cultivation of paddy rice,2.999105653750819e-11,2.9017467189356023e-11,2.659322853299891e-11,5.640150453930989e-12,3.4812616235315187e-12
RoW,Activity,Cultivation of plant-based fibers,8.940745522834551e-11,8.231057299222905e-11,6.994720440626195e-11,1.1496462031441139e-11,6.873255172441597e-12
RoW,Activity,"Cultivation of sugar cane, sugar beet",2.4268669555750375e-11,2.4196450877326328e-11,2.187861095087094e-11,4.593761651730752e-12,2.6427614209295972e-12
RoW,Activity,"Cultivation of vegetables, fruit, nuts",7.190887700281893e-11,6.561298770431853e-11,5.806738084302139e-11,1.281703517804366e-11,8.464382411186434e-12
RoW,Activity,Cultivation of wheat,4.451789378654994e-11,4.345333849470053e-11,3.922799652681614e-11,9.066087272895578e-12,5.319998359931077e-12
RoW,Activity,Distribution and trade of electricity,6.710512153618413e-12,6.5981097938502865e-12,5.897689673149856e-12,1.8134999000824362e-12,1.0472332345479695e-12
RoW,Activity,Education (80),4.982125248951557e-13,5.100445564919544e-13,4.602873780758129e-13,2.1329868116963174e-13,1.151725239832079e-13
RoW,Activity,Extra-territorial organizations and bodies,0.0,0.0,0.0,0.0,0.0
RoW,Activity,"Extraction of crude petroleum and services related to crude oil extraction, excluding surveying",1.903914236983041e-10,1.416424490429354e-10,1.3657983382578863e-10,9.495979525959575e-11,4.143850516177343e-11
RoW,Activity,"Extraction of natural gas and services related to natural gas extraction, excluding surveying",1.0672342357706348e-10,7.443059959788038e-11,6.667295254352505e-11,1.0581055586488655e-10,5.491891316453154e-11
RoW,Activity,"Extraction, liquefaction, and regasification of other petroleum and gaseous materials",5.779692919903515e-13,5.272658113667192e-13,4.907001085523768e-13,1.7156793995770336e-13,8.417767368331559e-14
RoW,Activity,"Financial intermediation, except insurance and pension funding (65)",2.139840885734261e-11,2.0674073891293372e-11,1.9189510762813503e-11,9.485372018544628e-12,4.881693011488387e-12
RoW,Activity,"Fishing, operating of fish hatcheries and fish farms; service activities incidental to fishing (05)",4.554870655742338e-11,5.221775625854151e-11,5.0423672809429626e-11,1.2242190425428914e-11,8.347585697924178e-12
RoW,Activity,"Forestry, logging and related service activities (02)",8.306438768212726e-11,5.771426562798892e-11,4.8010061542001916e-11,9.570569591130872e-12,5.966175672890633e-12
RoW,Activity,Health and social work (85),5.659045841255932e-13,5.348702831453304e-13,4.834846376272515e-13,1.7004950692183657e-13,1.0290430401690199e-13
RoW,Activity,Hotels and restaurants (55),2.3717167048999775e-11,2.8035972566768984e-11,2.650018799849577e-11,8.22530016201083e-12,7.602767767953081e-12
RoW,Activity,Incineration of waste: Food,1.5641769301635326e-13,1.4788100122863725e-13,1.3639179353727914e-13,3.830065754311769e-14,2.2021759780136138e-14
RoW,Activity,Incineration of waste: Metals and Inert materials,1.3538025134303283e-13,1.444115780326981e-13,1.5516762543919741e-13,9.483028089948277e-14,2.4191005970448868e-14
RoW,Activity,Incineration of waste: Oil/Hazardous waste,7.587090944806125e-14,7.860979179353265e-14,7.060676020610693e-14,1.8631775841769138e-14,1.0475914951405266e-14
RoW,Activity,Incineration of waste: Paper,1.6666816479457992e-13,1.5730924263351355e-13,1.4550544354230986e-13,4.1558188316986406e-14,2.319790927375951e-14
RoW,Activity,Incineration of waste: Plastic,9.034325817423086e-14,8.778651113069922e-14,7.90815050825289e-14,2.108290915871551e-14,1.2196602784544486e-14
RoW,Activity,Incineration of waste: Textiles,7.840474461028913e-14,6.544530941049508e-14,5.839006220978393e-14,1.2500302019759121e-14,7.263118458303781e-15
RoW,Activity,Incineration of waste: Wood,1.0525362093827811e-13,7.553789260167057e-14,6.779011249781633e-14,1.407335393934852e-14,8.523777846161607e-15
RoW,Activity,Inland water transport,1.0530959665886578e-12,1.042764401118131e-12,1.0170664906257294e-12,3.4746634065670013e-13,2.4904425119320217e-13
RoW,Activity,"Insurance and pension funding, except compulsory social security (66)",4.553614533456998e-12,4.676516474841979e-12,4.476807519196793e-12,2.325170508864603e-12,1.5860266634384046e-12
RoW,Activity,Landfill of waste: Food,1.8410051070238192e-12,1.6481169178655174e-12,1.5415401940693144e-12,4.3528555271433796e-13,2.5822356746758235e-13
RoW,Activity,Landfill of waste: Inert/metal/hazardous,1.0403725852486622e-12,9.0426260433196e-13,8.370674129730635e-13,2.54923828263434e-13,1.3492517188457778e-13
RoW,Activity,Landfill of waste: Paper,8.897108637421267e-13,7.691275919654909e-13,7.208336986648581e-13,1.9559180158940887e-13,1.1318998960954904e-13
RoW,Activity,Landfill of waste: Plastic,7.22149723428582e-13,6.471131463630426e-13,6.042373209336957e-13,1.675419374725388e-13,1.0057147216127087e-13
RoW,Activity,Landfill of waste: Textiles,3.221106773586634e-13,2.9756099538143313e-13,2.7550441992970043e-13,7.389191352265615e-14,4.2683321458975976e-14
RoW,Activity,Landfill of waste: Wood,3.602352688182734e-13,3.327900064269123e-13,3.102593390287021e-13,8.250665778966396e-14,4.877892403206632e-14
RoW,Activity,"Lead, zinc and tin production",5.699041780819846e-12,9.250588589062347e-12,8.981644098868158e-12,1.2897029271879369e-12,8.363534390021739e-13
RoW,Activity,Manufacture of basic iron and steel and of ferro-alloys and first products thereof,8.655281917423791e-11,1.809068656177127e-10,1.581663385182905e-10,2.0887535747030398e-11,1.262902321368186e-11
RoW,Activity,Manufacture of beverages,1.2556872894968279e-12,1.3855443193588944e-12,1.2638872800183556e-12,3.636679157748002e-13,2.5242470520330087e-13
RoW,Activity,"Manufacture of bricks, tiles and construction products, in baked clay",7.75206661347774e-13,7.451643387934537e-13,6.931781854991612e-13,1.5378854055111893e-13,9.728489021550055e-14
RoW,Activity,"Manufacture of cement, lime and plaster",1.0666752410405e-11,4.544122010311845e-12,5.25262623273256e-12,1.516468868221521e-12,1.0083760719853848e-12
RoW,Activity,Manufacture of ceramic goods,9.751555362890959e-12,6.965562535570578e-12,7.302018009622001e-12,1.989260611390695e-12,1.4685419476425436e-12
RoW,Activity,Manufacture of coke oven products,2.807527052824713e-12,3.4625810220597245e-12,3.11797682499763e-12,6.407528560536741e-13,3.524960166339059e-13
RoW,Activity,Manufacture of electrical machinery and apparatus n.e.c. (31),1.325167501455757e-10,1.7141206828450757e-10,1.182960561790947e-10,4.783998944490355e-11,2.7072536644980987e-11
RoW,Activity,"Manufacture of fabricated metal products, except machinery and equipment (28)",1.0555476747845536e-10,1.61371862018399e-10,1.4609677601154082e-10,2.7067229974112032e-11,1.5445854646496627e-11
RoW,Activity,Manufacture of fish products,1.138297623598795e-12,1.4584073186876267e-12,1.364359544252604e-12,3.901928045616894e-13,2.2214427047105533e-13
RoW,Activity,Manufacture of furniture; manufacturing n.e.c. (36),1.5081427448619878e-11,1.6825257987741223e-11,1.465146022314301e-11,4.4305998742021335e-12,2.219081791105787e-12
RoW,Activity,Manufacture of gas; distribution of gaseous fuels through mains,1.4190359938652941e-11,9.491987147901655e-12,8.307314229737345e-12,2.117002935120774e-12,1.1991985928036032e-12
RoW,Activity,Manufacture of glass and glass products,7.64220754486248e-11,2.9203355122434005e-11,2.2025260558684995e-11,2.1764355794971445e-12,1.368513267645837e-12
RoW,Activity,Manufacture of machinery and equipment n.e.c. (29),1.1408708754950523e-10,1.1681467554717938e-10,9.576153487818517e-11,2.5818451613067986e-11,1.4471739376190713e-11
RoW,Activity,"Manufacture of medical, precision and optical instruments, watches and clocks (33)",1.9063238983462904e-11,3.241105972006169e-11,2.0910390536910884e-11,5.303371000184489e-12,3.2495955969926242e-12
RoW,Activity,"Manufacture of motor vehicles, trailers and semi-trailers (34)",4.548292272714805e-11,3.8686455841313756e-11,3.5909482022594826e-11,8.468833885923268e-12,6.251117469101339e-12
RoW,Activity,Manufacture of office machinery and computers (30),4.995890779875936e-12,6.811111704631678e-12,4.7080904095365e-12,1.0147413933704725e-12,6.60699478123914e-13
RoW,Activity,Manufacture of other non-metallic mineral products n.e.c.,6.224245404206686e-11,1.2628237279459795e-11,1.2687540666436955e-11,2.0410674768996813e-12,1.2829831045604705e-12
RoW,Activity,Manufacture of other transport equipment (35),2.1407012284694665e-11,2.6419223954993486e-11,2.4199013783993775e-11,5.527155894777404e-12,4.110680178111993e-12
RoW,Activity,"Manufacture of radio, television and communication equipment and apparatus (32)",3.9493870178073874e-11,7.478698459637712e-11,4.645230226188664e-11,1.0491918099411125e-11,5.651504611320209e-12
RoW,Activity,Manufacture of rubber and plastic products (25),1.2513747415510215e-10,1.4941231507563068e-10,1.2902244106970782e-10,2.4682810706231878e-11,1.606345688050082e-11
RoW,Activity,Manufacture of textiles (17),2.4144638877388148e-11,3.127477843774252e-11,2.7516796367987856e-11,4.4217249372258675e-12,2.9340701390231775e-12
RoW,Activity,Manufacture of tobacco products (16),6.599539896007632e-13,2.9628920869293096e-13,2.4929495599767606e-13,4.598595012485615e-14,3.0160486039395154e-14
RoW,Activity,Manufacture of wearing apparel; dressing and dyeing of fur (18),1.1786898569998885e-12,1.2378092754304608e-12,1.1880461775522617e-12,3.0716722665622703e-13,2.0059336668453706e-13
RoW,Activity,"Manufacture of wood and of products of wood and cork, except furniture; manufacture of articles of straw and plaiting materials (20)",2.1054740435969097e-11,1.7112894397828625e-11,1.7723180131439754e-11,3.7613236373116674e-12,2.462454989217006e-12
RoW,Activity,"Manure treatment (biogas), storage and land application",0.0,0.0,0.0,0.0,0.0
RoW,Activity,"Manure treatment (conventional), storage and land application",0.0,0.0,0.0,0.0,0.0
RoW,Activity,Meat animals nec,9.623556101886536e-12,9.898444782055221e-12,8.801060899632121e-12,2.0827984010677394e-12,1.2269985296003396e-12
RoW,Activity,Mining of aluminium ores and concentrates,1.4713427931318232e-11,1.177746583187562e-11,9.744970114702725e-12,9.103170599880637e-13,5.684035083021473e-13
RoW,Activity,"Mining of chemical and fertilizer minerals, production of salt, other mining and quarrying n.e.c.",2.0314841190301374e-11,5.279995154483401e-11,5.6305513124195927e-11,3.1901167711675425e-12,1.860781376578272e-12
RoW,Activity,Mining of coal and lignite; extraction of peat (10),3.36786650111673e-10,1.134856724249808e-10,1.0317664762663483e-10,4.537718310811656e-11,1.7163185426382353e-11
RoW,Activity,Mining of copper ores and concentrates,4.74611333754672e-11,7.60733547902607e-11,5.27247783722231e-11,5.593695014861415e-12,3.5989986155336093e-12
RoW,Activity,Mining of iron ores,1.9151397604400784e-11,4.376057627415768e-11,3.096894460117142e-11,3.0204144440122756e-12,1.8816023904496293e-12
RoW,Activity,"Mining of lead, zinc and tin ores and concentrates",7.558142111336117e-12,9.690225219076971e-12,8.850167990362904e-12,1.1333354702184573e-12,7.17492970270833e-13
RoW,Activity,Mining of nickel ores and concentrates,1.096441691998987e-11,1.6141934582692636e-11,1.389143930775978e-11,1.7569861364664917e-12,1.077789187339522e-12
RoW,Activity,Mining of other non-ferrous metal ores and concentrates,4.6948799722473856e-11,4.806475505390269e-11,4.4619622526095004e-11,5.712642785866133e-12,3.5297611437789818e-12
RoW,Activity,Mining of precious metal ores and concentrates,7.3053186903205e-11,3.503329442415641e-11,2.8624528997116032e-11,4.459533260489695e-12,2.907220139207318e-12
RoW,Activity,Mining of uranium and thorium ores (12),4.2557463503882847e-13,4.432129712070333e-13,3.953091381216055e-13,1.4690946962851006e-13,8.053958512020068e-14
RoW,Activity,N-fertiliser,2.655727152949851e-13,2.677814442748352e-13,2.389288513162144e-13,8.971990552372352e-14,3.212545311966347e-14
RoW,Activity,Other business activities (74),4.356636715341929e-11,5.135613301384846e-11,4.635059189662195e-11,2.5117275048591184e-11,1.3327778571893483e-11
RoW,Activity,Other land transport,1.2555761547851577e-10,1.359599032125142e-10,1.3345317436189002e-10,4.604572901129032e-11,3.712443203999372e-11
RoW,Activity,Other non-ferrous metal production,2.2225787242317715e-11,3.068863528764101e-11,2.5887241802499525e-11,4.087731280696879e-12,2.4824581611361186e-12
RoW,Activity,Other service activities (93),3.2511764678792107e-12,3.045207019572776e-12,2.719930541359676e-12,7.968266076196032e-13,5.063673661114674e-13
RoW,Activity,P- and other fertiliser,4.880778746275483e-12,4.341456554954177e-12,3.872910799753438e-12,1.2101528156270404e-12,5.349443073253964e-13
RoW,Activity,Paper,1.4155852335823697e-11,1.638140312746633e-11,1.4152822707811686e-11,3.8536931418608975e-12,2.2524654974342164e-12
RoW,Activity,Petroleum Refinery,3.866198382145385e-11,3.224519518699113e-11,3.1089652941222464e-11,1.515011347375116e-11,7.157658481418549e-12
RoW,Activity,Pigs farming,5.60781243458373e-11,5.0188787380790993e-11,4.530854871449782e-11,1.1406530735932663e-11,7.014635034133651e-12
RoW,Activity,"Plastics, basic",1.488126099805537e-11,1.8358237219610393e-11,1.3524096160986896e-11,2.4403427769742795e-12,1.4570347848393164e-12
RoW,Activity,Post and telecommunications (64),3.396707084860302e-11,3.694949267716387e-11,3.4080676489419345e-11,1.518198522715277e-11,8.899008004097491e-12
RoW,Activity,Poultry farming,3.2481851087734016e-11,3.028206171135893e-11,2.7212622762820727e-11,6.752612096348782e-12,4.187456092860101e-12
RoW,Activity,Precious metals production,2.1221200811039446e-11,1.1878140156026884e-11,9.588833457615729e-12,1.4932312576041664e-12,1.0346167088805747e-12
RoW,Activity,Private households with employed persons (95),3.203800575999708e-12,3.0631123546321896e-12,2.7575986955508483e-12,9.409177916176612e-13,5.602132920739933e-13
RoW,Activity,Processed rice,1.1424495605650052e-12,1.1357396969909132e-12,1.0599734711685109e-12,2.1586096341251537e-13,1.353008194039703e-13
RoW,Activity,Processing of Food products nec,4.7863506529692525e-12,4.394692928138524e-12,3.949806837471316e-12,9.871847869614135e-13,6.503718512447566e-13
RoW,Activity,Processing of dairy products,7.601372157274867e-13,9.129124573163725e-13,6.737066343462237e-13,1.3780057386550148e-13,8.92938309514209e-14
RoW,Activity,Processing of meat cattle,3.7013480801224514e-13,3.3646960866974023e-13,3.084447154972056e-13,7.697615108985684e-14,5.137573059000946e-14
RoW,Activity,Processing of meat pigs,1.8551564072347772e-13,1.5082721185291104e-13,1.33549240369362e-13,3.5947654921723945e-14,2.3669313130955226e-14
RoW,Activity,Processing of meat poultry,6.605975918020772e-13,5.059208659460001e-13,4.351601396606716e-13,1.1418420953645583e-13,7.396867639072232e-14
RoW,Activity,Processing of nuclear fuel,3.997243030972037e-13,2.979344787782014e-13,2.1067445374370169e-13,3.184803612408768e-14,1.7442455835385036e-14
RoW,Activity,Processing vegetable oils and fats,6.660686315256913e-12,6.076609540295481e-12,5.169589394576083e-12,9.884415074919962e-13,5.878724264598886e-13
RoW,Activity,Production of electricity by Geothermal,3.577215084248071e-13,1.0252035860491938e-13,8.764444861944116e-14,2.441644207086795e-14,1.3593081634736196e-14
RoW,Activity,Production of electricity by biomass and waste,8.732746729927266e-13,1.8589773349147086e-13,1.608574204014724e-13,4.5107247766043937e-14,2.521983010232827e-14
RoW,Activity,Production of electricity by coal,4.9074996460333294e-11,9.421500293017453e-12,8.108492333681003e-12,2.096844887343441e-12,1.1879364195605246e-12
RoW,Activity,Production of electricity by gas,6.681475871160281e-11,1.5880931874649547e-11,1.3906060839300732e-11,4.495721944316286e-12,2.440221902764045e-12
RoW,Activity,Production of electricity by hydro,2.3652731512039937e-11,6.257003818267398e-12,5.490578243054303e-12,1.5856407977487998e-12,8.665878108523175e-13
RoW,Activity,Production of electricity by nuclear,5.5160008803337996e-12,1.9352919019474685e-12,1.6825572595910062e-12,4.120317912300261e-13,2.3343156194329184e-13
RoW,Activity,Production of electricity by petroleum and other oil derivatives,4.122581755864549e-12,1.5516283227542228e-12,1.3545237079045857e-12,4.594148303558539e-13,2.46420413418098e-13
RoW,Activity,Production of electricity by solar photovoltaic,1.1874483147498014e-14,4.654079638474798e-16,4.1325062837884395e-16,1.1747848314220364e-16,6.342878536414861e-17
RoW,Activity,Production of electricity by solar thermal,5.925134205128484e-16,8.010988781711716e-19,6.74016754785946e-19,1.5807073978396112e-19,9.286309077601437e-20
RoW,Activity,"Production of electricity by tide, wave, ocean",4.80513414355024e-16,4.2480230117658574e-16,3.3501712529979534e-16,6.522600818403334e-17,3.60177664219294e-17
RoW,Activity,Production of electricity by wind,2.601758913749443e-13,3.365733760241371e-14,2.888919154731326e-14,1.0019068756015735e-14,5.503920739487171e-15
RoW,Activity,Production of electricity nec,9.384654674555065e-14,4.7449373326459075e-14,4.054450950983593e-14,9.686606012205417e-15,5.50690700963883e-15
RoW,Activity,Production of meat products nec,1.3523457853376384e-12,1.2696198597333098e-12,1.1302513845633969e-12,2.6822654661986e-13,1.7373068888630773e-13
RoW,Activity,Production of offshore wind plants,0.0,0.0,0.0,0.0,0.0
RoW,Activity,Production of onshore wind plants,0.0,0.0,0.0,0.0,0.0
RoW,Activity,Production of photovoltaic plants,0.0,0.0,0.0,0.0,0.0
RoW,Activity,Public administration and defence; compulsory social security (75),2.248875459089097e-11,2.0809225935538092e-11,1.8663223832777416e-11,6.760850995328725e-12,4.182203659892727e-12
RoW,Activity,"Publishing, printing and reproduction of recorded media (22)",2.2247594624636057e-11,2.4278518892142777e-11,2.1063109692937633e-11,8.429877314773301e-12,4.993245865505685e-12
RoW,Activity,Pulp,5.51930164035511e-12,4.772397483796856e-12,3.703303933040323e-12,8.25819786445012e-13,4.76515973449619e-13
RoW,Activity,Quarrying of sand and clay,2.4381058798886942e-11,2.2499071139989985e-11,2.108768272602505e-11,3.572663426758832e-12,2.2566320538583087e-12
RoW,Activity,Quarrying of stone,4.034168723938426e-11,2.5408135608131996e-11,2.888392320659316e-11,3.2059958549958873e-12,2.0856010641983663e-12
RoW,Activity,Raw milk,2.2909450881150613e-11,2.3517077317845898e-11,1.985554231315966e-11,4.784067919573415e-12,3.002760157664705e-12
RoW,Activity,Re-processing of ash into clinker,8.050557952626678e-15,2.9163498608719597e-15,3.4830867519017572e-15,1.0209645348054838e-15,6.875027608467525e-16
RoW,Activity,Re-processing of secondary aluminium into new aluminium,2.837474221408564e-13,3.7714495885684014e-13,3.237459791028611e-13,3.2777011366037994e-14,2.09454286214597e-14
RoW,Activity,Re-processing of secondary construction material into aggregates,1.4455742442913397e-17,9.831961563401861e-18,1.0225968302181873e-17,4.211802880321465e-18,2.943045815092977e-18
RoW,Activity,Re-processing of secondary copper into new copper,4.461152235661187e-14,1.3347505631643135e-13,8.672737992243312e-14,8.439188410311536e-15,5.4452452427316415e-15
RoW,Activity,Re-processing of secondary glass into new glass,7.466745190810728e-13,2.8305275464548864e-13,2.1339274128420252e-13,2.0638796094235547e-14,1.3028355363859628e-14
RoW,Activity,"Re-processing of secondary lead into new lead, zinc and tin",3.32753304454806e-14,4.8705170239823144e-14,4.690774924632684e-14,6.753235647359895e-15,4.358486725009635e-15
RoW,Activity,Re-processing of secondary other non-ferrous metals into new other non-ferrous metals,1.8936095046530844e-13,2.6864278062726497e-13,2.2705700073489497e-13,3.53968033490473e-14,2.1504361271729712e-14
RoW,Activity,Re-processing of secondary paper into new pulp,1.0828695913959321e-13,8.703653960968034e-14,6.785070668144586e-14,1.5514602392135088e-14,8.93350726865352e-15
RoW,Activity,Re-processing of secondary plastic into new plastic,3.984120556195246e-14,4.948313818029885e-14,3.61320978484398e-14,6.389415714086434e-15,3.843356833430747e-15
