RoW,Activity,Re-processing of secondary preciuos metals into new preciuos metals,5.128337573748349e-18,5.372081608821414e-18,4.96513399944294e-18,1.3788874710657246e-18,7.656182691502032e-19
RoW,Activity,Re-processing of secondary steel into new steel,8.849812056640537e-13,1.852558073686633e-12,1.619788472828632e-12,2.1245975823248237e-13,1.2860512989825858e-13
RoW,Activity,Re-processing of secondary wood material into new wood material,9.026845239085318e-13,7.368767014397306e-13,7.668124763375308e-13,1.625762968472007e-13,1.0679899110603525e-13
RoW,Activity,Real estate activities (70),1.187122830482618e-12,1.1867603299424351e-12,1.173919489554903e-12,4.783449240961398e-13,4.2507386373637065e-13
RoW,Activity,"Recreational, cultural and sporting activities (92)",3.5030679260745782e-12,3.964960527719281e-12,3.601484578363495e-12,1.7123930646202655e-12,9.721543217610684e-13
RoW,Activity,Recycling of bottles by direct reuse,0.0,0.0,0.0,0.0,0.0
RoW,Activity,Recycling of waste and scrap,4.829644165410302e-12,6.179475610625625e-12,5.124187711953684e-12,7.467897524978574e-13,4.557764582704034e-13
RoW,Activity,Renting of machinery and equipment without operator and of personal and household goods (71),2.1499088897858274e-12,2.322479815845827e-12,2.1590163145488918e-12,9.807041177586927e-13,6.602194326441982e-13
RoW,Activity,Research and development (73),1.6975196526338324e-11,2.797013652671271e-11,2.2439228066402194e-11,5.640673993584712e-12,2.8748622304962313e-12
RoW,Activity,Retail sale of automotive fuel,8.207663388977965e-13,7.958068909445732e-13,7.398709937582071e-13,2.4152499389397993e-13,3.996294013431843e-13
RoW,Activity,"Retail trade, except of motor vehicles and motorcycles; repair of personal and household goods (52)",9.340831877047737e-11,8.715503125801214e-11,7.801088231146605e-11,2.5147524491415604e-11,1.5393997061818388e-11
RoW,Activity,"Sale, maintenance, repair of motor vehicles, motor vehicles parts, motorcycles, motor cycles parts and accessoiries",3.907252568265741e-11,3.7633645575940955e-11,3.4889572956208297e-11,1.1106483413024784e-11,7.233507912650849e-12
RoW,Activity,Sea and coastal water transport,2.051610795293194e-10,7.955150147853336e-11,1.6944610890558896e-10,1.4199487605592975e-11,1.1312194405111753e-11
RoW,Activity,Steam and hot water supply,1.4560060035952126e-12,1.4386183602419396e-12,1.2816461432722203e-12,3.7380986222308107e-13,2.058285971366689e-13
RoW,Activity,Sugar refining,1.3438704889390538e-12,1.1565827458905216e-12,1.0125876560799264e-12,2.246873785855291e-13,1.4752838840703407e-13
RoW,Activity,Supporting and auxiliary transport activities; activities of travel agencies (63),8.194339620269854e-11,8.056815246722796e-11,9.356882889947443e-11,2.2353814702975062e-11,1.6854918651810365e-11
RoW,Activity,"Tanning and dressing of leather; manufacture of luggage, handbags, saddlery, harness and footwear (19)",4.220147607177633e-12,5.0143445232952474e-12,4.434683933174068e-12,9.240758144908154e-13,5.763756786965798e-13
RoW,Activity,Transmission of electricity,2.8581738824015357e-12,2.7824508453800123e-12,2.431297460785533e-12,7.405696334387119e-13,4.0464839959052266e-13
RoW,Activity,Transport via pipelines,6.461848562029535e-12,5.496659887203596e-12,5.487638949992602e-12,2.752853578064724e-12,2.6156947644643775e-12
RoW,Activity,Transport via railways,1.3449855313494599e-11,1.4102939310613956e-11,1.3695396020359668e-11,4.119904062686102e-12,3.507130461841829e-12
RoW,Activity,"Waste water treatment, food",4.8184882594714044e-12,4.801415818314373e-12,4.249531114710251e-12,1.0564298617230968e-12,6.368274216192155e-13
RoW,Activity,"Waste water treatment, other",5.439305092765972e-12,5.193386976486023e-12,4.6149616683750415e-12,1.154807670891371e-12,7.002517878414253e-13
RoW,Activity,"Wholesale trade and commission trade, except of motor vehicles and motorcycles (51)",1.3565554284641215e-10,1.3776169483254664e-10,1.1989109705938605e-10,3.622944084808165e-11,4.087881739063713e-11
RoW,Activity,"Wool, silk-worm cocoons",1.904800063715049e-12,2.0833935363801946e-12,1.9274600951863973e-12,5.142937675634744e-13,3.4357158301540227e-13
USA,Activity,Activities auxiliary to financial intermediation (67),7.223659656821186e-13,3.359802748163447e-13,2.7043568701659153e-13,8.362135507280228e-14,5.176786930559325e-14
USA,Activity,Activities of membership organisation n.e.c. (91),4.452614147471624e-13,1.9837002181905427e-13,1.7482907183331595e-13,6.446531429513091e-14,4.233807902156739e-14
USA,Activity,Air transport (62),1.0956352945853111e-12,8.571639741156364e-13,7.974039120171166e-13,2.89568277486353e-13,2.0175293779695754e-13
USA,Activity,Aluminium production,2.286079094283481e-12,6.796081720764843e-13,5.112990296443896e-13,5.481730721965889e-14,3.423440707504081e-14
USA,Activity,Animal products nec,1.254057356896881e-15,1.3004667456629396e-15,1.1680968458270145e-15,2.4652307398896786e-16,1.7361173530127792e-16
USA,Activity,"Biogasification of food waste, incl. land application",0.0,0.0,0.0,0.0,0.0
USA,Activity,"Biogasification of paper, incl. land application",0.0,0.0,0.0,0.0,0.0
USA,Activity,"Biogasification of sewage slugde, incl. land application",3.1145942406003776e-13,1.1280261173634588e-13,1.0486994565874743e-13,2.2085737256678468e-14,1.3047944333738457e-14
USA,Activity,Casting of metals,3.534057288129515e-13,2.298923957989698e-13,1.886346567506714e-13,4.360918494070436e-14,2.689025804076638e-14
USA,Activity,Cattle farming,1.4732765406991994e-14,9.406098498529481e-15,8.359302042353277e-15,2.125863433673788e-15,1.5751412603585367e-15
USA,Activity,Chemicals nec,1.7365124114325715e-11,5.715810105801695e-12,5.224652677340878e-12,1.008534815497876e-12,5.090347590133198e-13
USA,Activity,"Collection, purification and distribution of water (41)",2.228941994332502e-14,5.707778234921765e-15,5.366203965367057e-15,1.2733715459387438e-15,8.391167561732112e-16
USA,Activity,"Composting of food waste, incl. land application",4.7733685198930044e-15,3.1340265138758326e-15,3.239223404988684e-15,1.0995097943280185e-15,5.729440211126371e-16
USA,Activity,"Composting of paper and wood, incl. land application",7.542022255992377e-14,2.3992484814854085e-14,2.425859201866902e-14,5.11002798361336e-15,3.3690579501143473e-15
USA,Activity,Computer and related activities (72),1.7615446370320483e-12,9.583427423163897e-13,8.329669221765389e-13,3.331163211361339e-13,2.2943161448207367e-13
USA,Activity,Construction (45),8.766665538069448e-12,6.791331961874549e-13,6.700898383752867e-13,2.5174761098050046e-13,1.7940109509198255e-13
USA,Activity,Copper production,6.939665002373215e-13,1.038737924229763e-12,6.946125101978148e-13,6.566824948308854e-14,4.3270460100326573e-14
USA,Activity,Cultivation of cereal grains nec,2.7232230040659643e-14,1.7180921423958706e-14,1.4901179141570102e-14,3.0356657759721845e-15,1.881257500209553e-15
USA,Activity,Cultivation of crops nec,3.2746514577899416e-13,1.3581844669971176e-13,1.1502663941471104e-13,2.5928206538942425e-14,1.6157455213189775e-14
USA,Activity,Cultivation of oil seeds,2.2675151171738342e-13,1.533428920909604e-13,8.862547095294345e-14,7.605140556509378e-15,4.799498882951467e-15
USA,Activity,Cultivation of paddy rice,1.1084111315863811e-15,6.830896732410155e-16,6.04566966668656e-16,1.3185546790439496e-16,1.0057751844027848e-16
USA,Activity,Cultivation of plant-based fibers,1.9120685343864015e-14,1.483785267027099e-14,1.1962131462912194e-14,1.8482434873953142e-15,1.1042201747939197e-15
USA,Activity,"Cultivation of sugar cane, sugar beet",3.332881780785474e-16,2.0995731528344064e-16,1.8297250243491933e-16,4.0736555080748284e-17,2.8316427000003275e-17
USA,Activity,"Cultivation of vegetables, fruit, nuts",1.0177956181213538e-13,7.717528598827252e-14,6.858636253899127e-14,1.532638612269509e-14,9.622764251538437e-15
USA,Activity,Cultivation of wheat,9.442843588931309e-15,9.911670096118458e-15,8.982106488065922e-15,1.894079539988448e-15,1.0550162915761932e-15
USA,Activity,Distribution and trade of electricity,6.169528255709939e-13,1.4220551054307908e-13,1.2556706538163377e-13,3.315685393602743e-14,2.128367192262035e-14
USA,Activity,Education (80),8.112229203009078e-14,2.4413190526242638e-14,2.2007306408927095e-14,1.0762219417991148e-14,6.4124996338820666e-15
USA,Activity,Extra-territorial organizations and bodies,0.0,0.0,0.0,0.0,0.0
USA,Activity,"Extraction of crude petroleum and services related to crude oil extraction, excluding surveying",1.2440835577397387e-13,5.178102929245221e-14,5.0782327769177264e-14,2.883018872608394e-14,1.2412118583464778e-14
USA,Activity,"Extraction of natural gas and services related to natural gas extraction, excluding surveying",3.1892152942709135e-14,1.7758801569368625e-14,1.6958476613767015e-14,1.0013223037855655e-14,4.972815889406337e-15
USA,Activity,"Extraction, liquefaction, and regasification of other petroleum and gaseous materials",1.6495851640626587e-16,4.3711865382350345e-17,4.0128413775182314e-17,1.522855523623267e-17,7.220535899101735e-18
USA,Activity,"Financial intermediation, except insurance and pension funding (65)",1.1046988812279415e-12,7.54330617504147e-13,7.002813311586219e-13,3.634584076283119e-13,2.3138367285291006e-13
USA,Activity,"Fishing, operating of fish hatcheries and fish farms; service activities incidental to fishing (05)",5.230525889363178e-14,4.9080336615281283e-14,4.434502352603208e-14,9.88030243922698e-15,7.426017611826235e-15
USA,Activity,"Forestry, logging and related service activities (02)",1.0546669946374568e-12,4.093769465751769e-13,3.354297797534715e-13,6.700726625201237e-14,4.206787521933942e-14
USA,Activity,Health and social work (85),0.0,0.0,0.0,0.0,0.0
USA,Activity,Hotels and restaurants (55),9.068972486793968e-12,6.775320475649056e-12,5.816961702800793e-12,1.534848366700759e-12,1.7159984227263314e-12
USA,Activity,Incineration of waste: Food,3.388957644295366e-14,1.4550680393109217e-14,1.4900305571492085e-14,3.761062258654686e-15,2.239931812206201e-15
USA,Activity,Incineration of waste: Metals and Inert materials,5.368872243293712e-14,3.7088262064091074e-14,4.610398028154869e-14,1.3847116780394395e-14,8.83121503710288e-15
USA,Activity,Incineration of waste: Oil/Hazardous waste,8.10500121032286e-15,5.940718998094081e-15,5.978818762243984e-15,1.935704641574073e-15,9.634419352107793e-16
USA,Activity,Incineration of waste: Paper,4.8016875752188145e-14,1.7227413419775766e-14,1.809503986433012e-14,4.357588362599588e-15,2.6903405763229735e-15
USA,Activity,Incineration of waste: Plastic,8.170837444740606e-14,2.7632054083390743e-14,2.8133965073121968e-14,7.518351395358657e-15,4.529083742516676e-15
USA,Activity,Incineration of waste: Textiles,1.7755305548030608e-14,6.4454709361384044e-15,6.505369987104061e-15,1.2645473910165316e-15,8.31655424861484e-16
USA,Activity,Incineration of waste: Wood,5.6580930653932495e-14,2.0671194630596805e-14,1.9637806949043374e-14,2.7053005917752237e-15,1.8142783174089653e-15
USA,Activity,Inland water transport,4.5029125667562804e-15,3.254327079708831e-15,2.7954387838470464e-15,5.718615209696896e-16,4.248619695247563e-16
USA,Activity,"Insurance and pension funding, except compulsory social security (66)",4.1003434587857124e-13,2.7064407424209806e-13,2.225584601179549e-13,1.0695573714734178e-13,7.078568099649577e-14
USA,Activity,Landfill of waste: Food,5.962435541026559e-14,2.167035646940382e-14,2.164991992889661e-14,4.792604881847517e-15,3.0327464027387567e-15
USA,Activity,Landfill of waste: Inert/metal/hazardous,1.140186802705652e-13,4.6190137446915127e-14,4.488869896185133e-14,1.0228478433995963e-14,6.4161342202157405e-15
USA,Activity,Landfill of waste: Paper,7.644358433681405e-14,2.606869464923762e-14,2.6016866785850595e-14,5.635195481653413e-15,3.552809395228378e-15
USA,Activity,Landfill of waste: Plastic,5.557216135621763e-14,1.729522893609284e-14,1.720708687735747e-14,3.767134578361083e-15,2.493484379549849e-15
USA,Activity,Landfill of waste: Textiles,2.4664515596200777e-14,8.153294177318536e-15,8.449731112628144e-15,1.7440402680893607e-15,1.1551312535004068e-15
USA,Activity,Landfill of waste: Wood,3.2081904683121856e-14,1.1005593433214698e-14,1.144790321999713e-14,2.337503350570191e-15,1.5332787968492286e-15
USA,Activity,"Lead, zinc and tin production",4.795741977112236e-14,1.1229624357211021e-13,1.1192775675026322e-13,1.4096370399749636e-14,9.69240322692195e-15
USA,Activity,Manufacture of basic iron and steel and of ferro-alloys and first products thereof,1.2045414695626638e-12,1.1901317078587898e-12,9.935552046535773e-13,1.2848454899027124e-13,7.899610629720741e-14
USA,Activity,Manufacture of beverages,2.1764296520080817e-14,2.478406920854871e-14,2.0902905738434466e-14,5.928354106626015e-15,3.671745910384818e-15
USA,Activity,"Manufacture of bricks, tiles and construction products, in baked clay",6.611047063001547e-13,3.858971016400417e-14,3.1242863051179166e-14,4.631834383118028e-15,3.0089529920392823e-15
USA,Activity,"Manufacture of cement, lime and plaster",5.046293349037861e-13,7.944410254022878e-14,7.298649937616737e-14,1.8261366873084245e-14,1.2119591276533866e-14
USA,Activity,Manufacture of ceramic goods,4.320513738546084e-14,2.1059251610665677e-14,2.3240005847004573e-14,8.092262947102908e-15,6.934123339449386e-15
USA,Activity,Manufacture of coke oven products,5.870814855119212e-17,5.944153507375061e-17,5.119282227671092e-17,7.32918990637215e-18,4.372315718514953e-18
USA,Activity,Manufacture of electrical machinery and apparatus n.e.c. (31),4.5784761361514515e-12,4.024454850591424e-12,2.7824774174284315e-12,1.0009452914386613e-12,6.096380293520845e-13
USA,Activity,"Manufacture of fabricated metal products, except machinery and equipment (28)",3.4286777485073027e-12,1.909537722455027e-12,1.6494057237332166e-12,3.0585596345026423e-13,1.8118821990950604e-13
USA,Activity,Manufacture of fish products,1.6985605366480282e-14,1.8469068733826453e-14,1.6499519185590005e-14,4.389803337644773e-15,2.3833445019950385e-15
USA,Activity,Manufacture of furniture; manufacturing n.e.c. (36),1.256180203364539e-12,5.247220516223896e-13,4.5346948781633887e-13,1.3340797281715332e-13,6.522858314610531e-14
USA,Activity,Manufacture of gas; distribution of gaseous fuels through mains,9.863383030822814e-13,5.000501843064299e-14,4.304223985582426e-14,1.0963919061053299e-14,6.956000379464942e-15
USA,Activity,Manufacture of glass and glass products,5.049219417800351e-11,8.452013394870153e-13,6.309232385361247e-13,5.006983170257655e-14,3.53924126057574e-14
USA,Activity,Manufacture of machinery and equipment n.e.c. (29),2.1392306803052024e-12,1.4530478136452347e-12,1.2270888791493907e-12,2.9388199493168425e-13,1.7288217142346155e-13
USA,Activity,"Manufacture of medical, precision and optical instruments, watches and clocks (33)",3.399474858733884e-13,4.540118011424594e-13,3.3580951703694827e-13,9.690363802317164e-14,6.086398637773643e-14
USA,Activity,"Manufacture of motor vehicles, trailers and semi-trailers (34)",6.339866613405506e-13,3.3983620554988817e-13,2.956435397370813e-13,6.38867882959094e-14,4.817551424553302e-14
USA,Activity,Manufacture of office machinery and computers (30),5.678406069752902e-14,7.680860261257237e-14,5.977643467942254e-14,1.4151678175153067e-14,9.3996123849265e-15
USA,Activity,Manufacture of other non-metallic mineral products n.e.c.,4.2693304236684264e-12,1.7775864242795552e-13,1.849844345123266e-13,2.6617500691692547e-14,1.7073652099693643e-14
USA,Activity,Manufacture of other transport equipment (35),9.735406747828222e-13,1.0651310746310233e-12,9.430622096803968e-13,1.9136060867939026e-13,1.467680731795343e-13
USA,Activity,"Manufacture of radio, television and communication equipment and apparatus (32)",5.036933168868366e-13,5.282567726754927e-13,3.4546181581073245e-13,8.264450517623581e-14,4.400300554791276e-14
USA,Activity,Manufacture of rubber and plastic products (25),1.5083287942119796e-12,6.626027299650056e-13,5.704181896898029e-13,1.1720542196406103e-13,7.451247997322873e-14
USA,Activity,Manufacture of textiles (17),2.6616448477601075e-13,1.2700430412353466e-13,1.1180920938869693e-13,2.22780082673645e-14,1.3200539441374706e-14
USA,Activity,Manufacture of tobacco products (16),6.302524270572685e-16,5.312020116060572e-16,4.549413676778879e-16,7.914256748560152e-17,5.15933286397835e-17
USA,Activity,Manufacture of wearing apparel; dressing and dyeing of fur (18),6.54385501147855e-15,4.072422084635039e-15,3.733075260937861e-15,1.1069684944412597e-15,7.281333225836187e-16
USA,Activity,"Manufacture of wood and of products of wood and cork, except furniture; manufacture of articles of straw and plaiting materials (20)",0.0,0.0,0.0,0.0,0.0
USA,Activity,"Manure treatment (biogas), storage and land application",0.0,0.0,0.0,0.0,0.0
USA,Activity,"Manure treatment (conventional), storage and land application",0.0,0.0,0.0,0.0,0.0
USA,Activity,Meat animals nec,8.246954900269405e-17,5.88118801076666e-17,5.443303946699355e-17,1.2541336346320187e-17,7.957430829541357e-18
USA,Activity,Mining of aluminium ores and concentrates,0.0,0.0,0.0,0.0,0.0
USA,Activity,"Mining of chemical and fertilizer minerals, production of salt, other mining and quarrying n.e.c.",3.081186892598755e-13,2.9436469705054496e-13,2.829269027545608e-13,3.0546288223487613e-14,1.6959989294182848e-14
USA,Activity,Mining of coal and lignite; extraction of peat (10),1.8463100512179947e-11,2.1730451614712732e-12,2.1588076951186812e-12,8.776948740386901e-13,4.628408216524947e-13
USA,Activity,Mining of copper ores and concentrates,1.1895089793046661e-12,6.891854037295197e-13,4.3189422402193355e-13,4.0047126236859125e-14,2.5911434529728164e-14
USA,Activity,Mining of iron ores,8.411243222202034e-13,5.984089167806321e-13,4.85507587086914e-13,6.781662737959776e-14,4.0804784251002745e-14
USA,Activity,"Mining of lead, zinc and tin ores and concentrates",2.6502822809110325e-14,3.050420097058163e-14,2.955145206810336e-14,3.280219406710872e-15,2.2093853132523464e-15
USA,Activity,Mining of nickel ores and concentrates,0.0,0.0,0.0,0.0,0.0
USA,Activity,Mining of other non-ferrous metal ores and concentrates,5.6573653682223935e-14,6.418130596547319e-14,5.690944844336961e-14,9.414717866109e-15,5.9418603658856966e-15
USA,Activity,Mining of precious metal ores and concentrates,1.0445967735394025e-11,5.592743270718867e-13,4.3688907002643297e-13,6.136777094731524e-14,4.2091105695969634e-14
USA,Activity,Mining of uranium and thorium ores (12),1.8686426705144004e-13,7.501370282595085e-14,6.346664294082442e-14,1.080151491651103e-14,5.6655887815853154e-15
USA,Activity,N-fertiliser,2.517984717485075e-15,7.990688778900734e-16,6.109402921804017e-16,1.751836290168877e-16,7.198795875453469e-17
USA,Activity,Other business activities (74),1.1637094716627325e-11,6.518245589229876e-12,5.763071607590444e-12,2.347655173281588e-12,1.412587628520105e-12
USA,Activity,Other land transport,5.0941651456267235e-12,1.6004124453572608e-12,1.520076275572769e-12,5.365783049379686e-13,4.633870709953417e-13
USA,Activity,Other non-ferrous metal production,3.183645970312071e-13,3.7977392574689154e-13,3.334305015080567e-13,5.1136211527557197e-14,3.215865047182463e-14
USA,Activity,Other service activities (93),2.0756078021571596e-13,7.017386151021143e-14,6.113489389565818e-14,2.074787621778682e-14,1.3555658155165629e-14
USA,Activity,P- and other fertiliser,9.682993965722542e-14,4.2370209576672083e-14,3.691801095590509e-14,8.503594644068272e-15,4.379538760040476e-15
USA,Activity,Paper,1.418765631390217e-12,3.977442728125341e-13,3.295167155027595e-13,8.255070299802591e-14,4.873263265734212e-14
USA,Activity,Petroleum Refinery,4.244565703919692e-13,2.0570371019065266e-13,2.0930342298309964e-13,1.3991503196416656e-13,5.769911267005283e-14
USA,Activity,Pigs farming,2.9043120740244684e-14,1.5065158878241007e-14,1.2133411233242992e-14,2.4005245386193248e-15,1.520508569357135e-15
USA,Activity,"Plastics, basic",4.79924273359396e-13,3.97432974734628e-13,2.985520910396987e-13,5.124530805425944e-14,3.032101943742058e-14
USA,Activity,Post and telecommunications (64),3.932206227348799e-12,2.1650482291430283e-12,2.0632435402772484e-12,8.647579576180035e-13,5.545517124514493e-13
USA,Activity,Poultry farming,1.7230918631140866e-14,1.3487877455997441e-14,1.1556725680730755e-14,2.2003085152250284e-15,1.3358706938878588e-15
USA,Activity,Precious metals production,7.805272770018221e-12,3.1427507576314645e-13,2.536566595525424e-13,3.6322840705409005e-14,2.528108785178293e-14
USA,Activity,Private households with employed persons (95),1.8431084340977637e-16,2.066889407701942e-16,2.1178567408268138e-16,1.1055032497165553e-16,9.594163442116984e-17
USA,Activity,Processed rice,4.651777946554738e-16,4.59771020899326e-16,4.1515975912311234e-16,8.375441222365618e-17,5.0173116239543214e-17
USA,Activity,Processing of Food products nec,2.127988204463561e-13,1.0124322732751587e-13,8.676273218761652e-14,1.8107891059710506e-14,1.0627154481187219e-14
USA,Activity,Processing of dairy products,2.7084982810526234e-14,2.70509178871611e-14,1.6262081216550967e-14,1.95673400932707e-15,1.186006545650962e-15
USA,Activity,Processing of meat cattle,3.016809365425485e-15,1.8476756233167086e-15,1.6385598256312885e-15,3.7909428740076133e-16,3.139209900370342e-16
USA,Activity,Processing of meat pigs,2.344034354417921e-14,1.225212889257354e-14,9.802021621637879e-15,1.8906986492776842e-15,1.1899379139137099e-15
USA,Activity,Processing of meat poultry,1.2352051904108806e-14,9.371404532926571e-15,7.831911810190568e-15,1.4832568121822501e-15,9.166655928478054e-16
USA,Activity,Processing of nuclear fuel,4.986962531746169e-16,5.327078599011735e-16,4.12599719946395e-16,6.57729724311936e-17,3.80776934230295e-17
USA,Activity,Processing vegetable oils and fats,7.299313673689983e-14,3.6239352161931487e-14,3.199233186294212e-14,6.287762683904682e-15,3.5332401732242013e-15
USA,Activity,Production of electricity by Geothermal,1.2625639778044735e-13,1.1261545093235044e-15,9.799982231619802e-16,2.2518163029048407e-16,1.376756728519308e-16
USA,Activity,Production of electricity by biomass and waste,8.763281659028253e-13,8.400373545293197e-15,7.302936506344262e-15,1.6576428789195841e-15,1.015101690743485e-15
USA,Activity,Production of electricity by coal,1.9485230764635068e-11,3.8900984776377425e-13,3.349900739512956e-13,7.633275189762473e-14,4.4619569504565506e-14
USA,Activity,Production of electricity by gas,1.1972325410255107e-11,9.051386672735781e-14,7.845472468219537e-14,1.7954692351920215e-14,1.0497072471725177e-14
USA,Activity,Production of electricity by hydro,2.404226978480413e-12,2.3414264756628447e-14,2.0248333764636845e-14,4.329646041288783e-15,2.674474814806926e-15
USA,Activity,Production of electricity by nuclear,9.886367310208938e-12,7.6491395882219e-14,6.534702589352082e-14,1.6556625203671402e-14,1.0132451204738237e-14
USA,Activity,Production of electricity by petroleum and other oil derivatives,0.0,0.0,0.0,0.0,0.0
USA,Activity,Production of electricity by solar photovoltaic,8.576674527535374e-14,5.890926855253227e-17,5.1116750634453005e-17,1.1673255040196953e-17,7.127287525999861e-18
USA,Activity,Production of electricity by solar thermal,1.93139886738743e-14,6.124438121023835e-17,5.382520594605093e-17,1.202400440929229e-17,7.16507436006507e-18
USA,Activity,"Production of electricity by tide, wave, ocean",0.0,0.0,0.0,0.0,0.0
USA,Activity,Production of electricity by wind,1.409545719853932e-12,5.273717417500698e-15,4.547793877582282e-15,1.0384408607315807e-15,6.265464960851534e-16
USA,Activity,Production of electricity nec,3.6492768537025263e-14,3.288421282768304e-16,2.853824037574312e-16,6.533728210235875e-17,3.994558706010889e-17
USA,Activity,Production of meat products nec,8.251689289903794e-14,4.491474511803125e-14,3.8966594637077e-14,7.863632467425101e-15,4.939570972044061e-15
USA,Activity,Production of offshore wind plants,0.0,0.0,0.0,0.0,0.0
USA,Activity,Production of onshore wind plants,0.0,0.0,0.0,0.0,0.0
USA,Activity,Production of photovoltaic plants,0.0,0.0,0.0,0.0,0.0
USA,Activity,Public administration and defence; compulsory social security (75),1.4450093268128606e-12,1.3273622320624406e-13,1.1536390191933756e-13,4.0015647147899774e-14,2.97316878915012e-14
USA,Activity,"Publishing, printing and reproduction of recorded media (22)",5.137136637874978e-13,3.0171523776985074e-13,2.6453499305510623e-13,1.082710256263456e-13,6.612280473303485e-14
USA,Activity,Pulp,7.363966066709005e-14,4.620152891645351e-14,3.123791122981662e-14,5.821445791534472e-15,3.272765951770127e-15
USA,Activity,Quarrying of sand and clay,4.3770037557491066e-12,5.277987312965891e-13,4.743490481609763e-13,7.52931632966988e-14,5.4041135575585796e-14
USA,Activity,Quarrying of stone,1.1181769117543904e-12,1.5676653711444916e-13,1.6147492972870851e-13,5.460350205631733e-14,2.9520313434873215e-14
USA,Activity,Raw milk,2.982165100864736e-14,2.976055763984631e-14,1.7896881719433684e-14,2.1572022832443317e-15,1.3076763755152775e-15
USA,Activity,Re-processing of ash into clinker,0.0,0.0,0.0,0.0,0.0
USA,Activity,Re-processing of secondary aluminium into new aluminium,0.0,0.0,0.0,0.0,0.0
USA,Activity,Re-processing of secondary construction material into aggregates,0.0,0.0,0.0,0.0,0.0
USA,Activity,Re-processing of secondary copper into new copper,0.0,0.0,0.0,0.0,0.0
USA,Activity,Re-processing of secondary glass into new glass,0.0,0.0,0.0,0.0,0.0
USA,Activity,"Re-processing of secondary lead into new lead, zinc and tin",0.0,0.0,0.0,0.0,0.0
USA,Activity,Re-processing of secondary other non-ferrous metals into new other non-ferrous metals,0.0,0.0,0.0,0.0,0.0
USA,Activity,Re-processing of secondary paper into new pulp,0.0,0.0,0.0,0.0,0.0
USA,Activity,Re-processing of secondary plastic into new plastic,0.0,0.0,0.0,0.0,0.0
USA,Activity,Re-processing of secondary preciuos metals into new preciuos metals,0.0,0.0,0.0,0.0,0.0
USA,Activity,Re-processing of secondary steel into new steel,0.0,0.0,0.0,0.0,0.0
USA,Activity,Re-processing of secondary wood material into new wood material,0.0,0.0,0.0,0.0,0.0
