EU27+UK,Activity,Retail sale of automotive fuel,2.7385737225074393e-12,3.323593278060996e-12,3.620298616826642e-12,2.4929223467246378e-12,3.4322675926759245e-12
EU27+UK,Activity,"Retail trade, except of motor vehicles and motorcycles; repair of personal and household goods (52)",9.254291524929911e-11,1.3522529128020431e-10,1.343441095131407e-10,8.528864717564681e-11,1.0233506733398672e-10
EU27+UK,Activity,"Sale, maintenance, repair of motor vehicles, motor vehicles parts, motorcycles, motor cycles parts and accessoiries",1.5386844079758653e-11,2.116797443806555e-11,2.333411351636835e-11,1.9979661670776856e-11,3.057413640673317e-11
EU27+UK,Activity,Sea and coastal water transport,3.647382028622895e-12,6.564621300928402e-12,2.5210970771642692e-11,4.712928820274842e-12,2.0600284474853253e-12
EU27+UK,Activity,Steam and hot water supply,2.851247125650994e-13,3.2363232874133805e-13,3.1690942880441263e-13,2.85114237001711e-13,2.2930865301706817e-13
EU27+UK,Activity,Sugar refining,1.378867867265644e-13,2.647191577206999e-13,2.6291839377342196e-13,1.2958422095299066e-13,1.0784786125886953e-13
EU27+UK,Activity,Supporting and auxiliary transport activities; activities of travel agencies (63),1.8993554765864816e-11,2.9135724430850234e-11,4.1080387161569485e-11,2.0476096305574795e-11,1.6510085562963296e-11
EU27+UK,Activity,"Tanning and dressing of leather; manufacture of luggage, handbags, saddlery, harness and footwear (19)",2.141931774803531e-13,3.583205567120739e-13,3.375784151598339e-13,1.6412113559902645e-13,1.3748893503676703e-13
EU27+UK,Activity,Transmission of electricity,6.913490460706844e-13,9.608012601682954e-13,9.992755859075182e-13,7.23564894736614e-13,6.081430977468627e-13
EU27+UK,Activity,Transport via pipelines,7.032851383628852e-13,7.435432592953288e-13,8.909068543577261e-13,9.887995289766649e-13,2.240653600954467e-12
EU27+UK,Activity,Transport via railways,1.8636027190552462e-12,3.257479612231271e-12,3.7022329202920625e-12,2.210316193403829e-12,2.2649665763406916e-12
EU27+UK,Activity,"Waste water treatment, food",5.693112537359318e-13,6.813711202332747e-13,7.401587031127114e-13,4.4866103095494514e-13,3.5504775570479327e-13
EU27+UK,Activity,"Waste water treatment, other",1.0723168857742315e-12,1.2613783142160735e-12,1.3491907408594493e-12,8.108148079768498e-13,6.476948637552722e-13
EU27+UK,Activity,"Wholesale trade and commission trade, except of motor vehicles and motorcycles (51)",9.168706148572365e-11,1.771950777461426e-10,1.6851169885233621e-10,9.316162542095705e-11,9.726367972332641e-11
EU27+UK,Activity,"Wool, silk-worm cocoons",1.867218157461397e-15,1.9262124916252027e-15,1.6686181590124099e-15,9.65209131611127e-16,1.0984967346465457e-15
RoW,Activity,Activities auxiliary to financial intermediation (67),4.57119372164355e-12,4.480945886184333e-12,4.2331742457911175e-12,3.1615859534406106e-12,3.0166877078424703e-12
RoW,Activity,Activities of membership organisation n.e.c. (91),1.1965398020335003e-12,1.2164797836325774e-12,1.0958668755829617e-12,5.7632368465209e-13,6.53886132454933e-13
RoW,Activity,Air transport (62),2.1265468414026424e-12,2.447552884614041e-12,2.438978726343248e-12,1.5900393190929051e-12,1.512756946214081e-12
RoW,Activity,Aluminium production,3.4613874401446085e-12,4.330353403548856e-12,3.6330713720804704e-12,1.2000222075168568e-12,1.4598464185049462e-12
RoW,Activity,Animal products nec,6.336727458845528e-14,6.588503700178565e-14,6.009437839987775e-14,3.166855082988016e-14,3.5100256325083086e-14
RoW,Activity,"Biogasification of food waste, incl. land application",9.405841346710371e-14,1.0066735948659328e-13,9.30119551757233e-14,5.0024432233975086e-14,5.095700605340204e-14
RoW,Activity,"Biogasification of paper, incl. land application",4.3453843153728325e-14,4.955431576084152e-14,4.4779115518936976e-14,2.349187317223186e-14,2.3063925762300036e-14
RoW,Activity,"Biogasification of sewage slugde, incl. land application",1.0124897978079439e-13,1.0716199014688908e-13,1.1580266211227153e-13,4.92900908428453e-14,5.157624735510038e-14
RoW,Activity,Casting of metals,1.0065060804750663e-12,1.2418528769419301e-12,1.0138135460756901e-12,4.810515107812597e-13,5.123756334782324e-13
RoW,Activity,Cattle farming,5.440083441870328e-13,4.686866604138965e-13,4.2555228655235126e-13,2.269491484360004e-13,2.7855575705441977e-13
RoW,Activity,Chemicals nec,1.3043514067905018e-11,1.3854599403303158e-11,1.28639199160011e-11,6.950027908372475e-12,6.9772962162638115e-12
RoW,Activity,"Collection, purification and distribution of water (41)",2.682485696163282e-13,1.6503791388332897e-13,1.4616440127435874e-13,7.446686231403367e-14,1.2267859227097714e-13
RoW,Activity,"Composting of food waste, incl. land application",9.163927668174756e-14,8.132457806167901e-14,7.67808291042363e-14,3.8540143339255203e-14,4.6193683230321e-14
RoW,Activity,"Composting of paper and wood, incl. land application",3.846897714778773e-14,4.0772960127817223e-14,3.7240638951992165e-14,1.9364801054610918e-14,2.055553067150642e-14
RoW,Activity,Computer and related activities (72),8.67070859078989e-12,1.0346298675072298e-11,9.516225984655636e-12,6.59969969513133e-12,6.1799922850771095e-12
RoW,Activity,Construction (45),4.9316221725538666e-12,3.1464759721905237e-12,3.4761051875378143e-12,2.1252100262900063e-12,2.974318210797908e-12
RoW,Activity,Copper production,1.7391094715734002e-12,4.69716973827206e-12,2.9981059830965288e-12,1.1006580204456237e-12,8.513773170281042e-13
RoW,Activity,Cultivation of cereal grains nec,1.041607231571714e-12,9.50697409576506e-13,8.701054828225926e-13,4.625995599698459e-13,5.408731039789194e-13
RoW,Activity,Cultivation of crops nec,9.36528245726492e-13,8.218236263244801e-13,7.480575043044824e-13,3.654192941758414e-13,4.640512090941736e-13
RoW,Activity,Cultivation of oil seeds,3.805902093983904e-12,2.885361061943706e-12,2.2661283418343885e-12,1.0729289233437834e-12,1.6670052965512848e-12
RoW,Activity,Cultivation of paddy rice,4.261875324683179e-13,3.8626069697822745e-13,3.4886685178351036e-13,1.814555852471599e-13,2.1648426357262994e-13
RoW,Activity,Cultivation of plant-based fibers,4.825537341339376e-13,5.205390802781485e-13,4.646203399482281e-13,2.2412449145225586e-13,2.4698792830670893e-13
RoW,Activity,"Cultivation of sugar cane, sugar beet",4.2410396233894464e-13,3.906532286807443e-13,3.57048195603969e-13,1.8910896754527131e-13,2.1847327570422055e-13
RoW,Activity,"Cultivation of vegetables, fruit, nuts",8.536411474525685e-12,6.166694537281422e-12,5.308422200800719e-12,2.6077789777151943e-12,3.919588819322752e-12
RoW,Activity,Cultivation of wheat,5.369648275199453e-13,5.058863067108557e-13,4.640824174187018e-13,2.4975892641183774e-13,2.8337623441876136e-13
RoW,Activity,Distribution and trade of electricity,6.693031480097751e-13,6.539383413057535e-13,5.896680377371352e-13,3.137288856573704e-13,3.6838888719088524e-13
RoW,Activity,Education (80),4.581210869979085e-12,4.858242379211689e-12,4.416662208060659e-12,3.3522960752312296e-12,3.0250243271025183e-12
RoW,Activity,Extra-territorial organizations and bodies,0.0,0.0,0.0,0.0,0.0
RoW,Activity,"Extraction of crude petroleum and services related to crude oil extraction, excluding surveying",3.879258308471678e-12,2.896138588239079e-12,2.8508808049229316e-12,3.1914821741823086e-12,2.430117445408009e-12
RoW,Activity,"Extraction of natural gas and services related to natural gas extraction, excluding surveying",5.852302291824865e-12,3.4897467370882283e-12,3.057359109990366e-12,5.189254458484792e-12,4.9527164127930435e-12
RoW,Activity,"Extraction, liquefaction, and regasification of other petroleum and gaseous materials",-2.635238221252155e-12,-2.0851343803938026e-12,-1.9998361007738043e-12,-1.5575353981557394e-12,-1.5244548900642205e-12
RoW,Activity,"Financial intermediation, except insurance and pension funding (65)",1.3305523839708081e-11,1.2742354737587363e-11,1.2100606011106323e-11,8.614271901395005e-12,8.523747001933019e-12
RoW,Activity,"Fishing, operating of fish hatcheries and fish farms; service activities incidental to fishing (05)",3.1562320890954865e-13,3.593436011536239e-13,3.563353018310053e-13,1.706707872507303e-13,1.8105380757667423e-13
RoW,Activity,"Forestry, logging and related service activities (02)",6.497748974064624e-13,4.168367640632933e-13,3.5413806984481806e-13,1.5938262331993758e-13,2.790926703251953e-13
RoW,Activity,Health and social work (85),7.363838916086407e-13,7.402612999628469e-13,6.823863771960646e-13,4.3806561932851143e-13,4.552347780721171e-13
RoW,Activity,Hotels and restaurants (55),3.7647399191558506e-12,4.462728800334929e-12,4.335762026588422e-12,2.482573422742376e-12,2.6181306395641148e-12
RoW,Activity,Incineration of waste: Food,1.5998581648163548e-13,1.8387156349638913e-13,1.7054228165235016e-13,7.594580739013419e-14,8.268489709035705e-14
RoW,Activity,Incineration of waste: Metals and Inert materials,1.2371282328982483e-13,1.272311685256034e-13,1.2838826790859799e-13,6.695786190265028e-14,6.920889399883199e-14
RoW,Activity,Incineration of waste: Oil/Hazardous waste,8.170931749752363e-14,8.43702701640563e-14,7.604729055102902e-14,3.798281037850658e-14,4.263825977110631e-14
RoW,Activity,Incineration of waste: Paper,1.6258678962204972e-13,1.5597206519175234e-13,1.4316721917667156e-13,7.020395390622129e-14,8.360574689371633e-14
RoW,Activity,Incineration of waste: Plastic,1.230502617994233e-13,1.0073905321668411e-13,9.16482781882927e-14,4.6526234212525314e-14,5.994884347581577e-14
RoW,Activity,Incineration of waste: Textiles,6.476286958032086e-14,8.367977861846865e-14,8.70907816103359e-14,3.515911235339961e-14,3.3858431685791083e-14
RoW,Activity,Incineration of waste: Wood,7.786479400208818e-14,8.901791767825186e-14,7.947773727269855e-14,3.7860472984692765e-14,4.06077014669717e-14
RoW,Activity,Inland water transport,2.0121567746163975e-13,1.7105339407820413e-13,1.6505501135067435e-13,9.057878790466487e-14,1.1346601580782868e-13
RoW,Activity,"Insurance and pension funding, except compulsory social security (66)",3.183706477416771e-12,3.2445027911161656e-12,3.245195948344482e-12,2.362647691449615e-12,2.5223640155507254e-12
RoW,Activity,Landfill of waste: Food,8.960113013664754e-13,7.680001524024699e-13,7.413104182281757e-13,3.7103651005783074e-13,4.798722535431234e-13
RoW,Activity,Landfill of waste: Inert/metal/hazardous,4.4377883280689026e-13,3.3345751700147585e-13,3.1050572236396806e-13,1.5349754340057728e-13,2.184101786957675e-13
RoW,Activity,Landfill of waste: Paper,4.3305618663311845e-13,3.6934646762917135e-13,3.5075847996145965e-13,1.7360960022996288e-13,2.2446659771124573e-13
RoW,Activity,Landfill of waste: Plastic,2.5954466871026513e-13,2.2246912540491994e-13,2.1063421391781596e-13,1.0359248948629838e-13,1.3577628948320453e-13
RoW,Activity,Landfill of waste: Textiles,1.4318937578699875e-13,1.316075387945825e-13,1.2388698686732204e-13,6.121251561988477e-14,7.561178739022708e-14
RoW,Activity,Landfill of waste: Wood,1.7321398193195622e-13,1.553512573143984e-13,1.4725801565149645e-13,7.36273669144998e-14,9.143437021349546e-14
RoW,Activity,"Lead, zinc and tin production",3.810721815848588e-13,5.674100741108462e-13,5.557881344542422e-13,2.0995271397288526e-13,1.9855648495802264e-13
RoW,Activity,Manufacture of basic iron and steel and of ferro-alloys and first products thereof,4.3125503679111555e-12,8.848454847225417e-12,7.821487243125514e-12,2.7752518244348577e-12,2.2211884943644747e-12
RoW,Activity,Manufacture of beverages,2.3196354905809405e-13,2.5579117225780316e-13,2.31261051022377e-13,1.226477119344042e-13,1.3467360351020573e-13
RoW,Activity,"Manufacture of bricks, tiles and construction products, in baked clay",1.2631551953699584e-13,9.618517118889356e-14,9.672430755339305e-14,4.481991504103819e-14,6.223075108514317e-14
RoW,Activity,"Manufacture of cement, lime and plaster",1.3676867970781095e-12,6.17258959117172e-13,7.161548048025478e-13,3.4356813676403595e-13,6.305744787129677e-13
RoW,Activity,Manufacture of ceramic goods,9.257807956491406e-13,5.82723334674112e-13,6.370386499884241e-13,3.1311618355999864e-13,4.755445946275165e-13
RoW,Activity,Manufacture of coke oven products,4.277930012265772e-13,5.393600160043696e-13,4.988197251489346e-13,2.1099904813256804e-13,2.163452472043311e-13
RoW,Activity,Manufacture of electrical machinery and apparatus n.e.c. (31),1.1646079007690768e-11,1.5407049099231305e-11,1.0867412503756406e-11,7.247525147759824e-12,6.665648999938963e-12
RoW,Activity,"Manufacture of fabricated metal products, except machinery and equipment (28)",1.2081323942817691e-11,1.905704727640654e-11,1.737201860690214e-11,6.719410184675762e-12,6.198012959887897e-12
RoW,Activity,Manufacture of fish products,1.6295134759935538e-13,2.094976182206759e-13,2.0674976024947035e-13,9.767501676694758e-14,9.421199813457254e-14
RoW,Activity,Manufacture of furniture; manufacturing n.e.c. (36),1.8144511410718195e-12,2.0101484711530538e-12,1.7421056807023568e-12,9.592327093927448e-13,9.900417524908548e-13
RoW,Activity,Manufacture of gas; distribution of gaseous fuels through mains,1.7810343407198327e-12,1.0898887648114932e-12,9.558326290005422e-13,4.928252143797374e-13,8.004514114994642e-13
RoW,Activity,Manufacture of glass and glass products,9.400853046418344e-12,3.678955232070702e-12,2.7478467616496503e-12,8.959098357359201e-13,3.377036318761431e-12
RoW,Activity,Manufacture of machinery and equipment n.e.c. (29),1.1536339946886604e-11,1.2877617783203366e-11,1.0344685592491246e-11,4.580984814931541e-12,5.474768243789621e-12
RoW,Activity,"Manufacture of medical, precision and optical instruments, watches and clocks (33)",2.3187847323137386e-12,4.3809490229705056e-12,2.9159475428370122e-12,1.4038733436712477e-12,1.2895819470312578e-12
RoW,Activity,"Manufacture of motor vehicles, trailers and semi-trailers (34)",3.898701903459795e-12,3.641342558320983e-12,3.3802956735058646e-12,1.5680955827335509e-12,2.0495258729655304e-12
RoW,Activity,Manufacture of office machinery and computers (30),4.0565099382154245e-13,5.40345283618666e-13,4.0249950064540027e-13,2.0366565904176314e-13,2.1550012611577995e-13
RoW,Activity,Manufacture of other non-metallic mineral products n.e.c.,7.707072625318688e-12,1.5214393980194454e-12,1.571064609524015e-12,5.65110618717087e-13,2.7945844399904887e-12
RoW,Activity,Manufacture of other transport equipment (35),1.866303417257153e-12,2.401172930228264e-12,2.2056464986330016e-12,1.025258300540453e-12,1.1389505812286325e-12
RoW,Activity,"Manufacture of radio, television and communication equipment and apparatus (32)",3.9564442165922496e-12,8.357610775988777e-12,5.027676510994704e-12,2.317602978947734e-12,2.0055964861009127e-12
RoW,Activity,Manufacture of rubber and plastic products (25),7.878372402656764e-12,9.232896047069958e-12,8.412372780526155e-12,3.6296524444142393e-12,4.0540695406011684e-12
RoW,Activity,Manufacture of textiles (17),2.2304237776228026e-12,2.760259508797366e-12,2.436784112388019e-12,1.0233172877294073e-12,1.1546257235738712e-12
RoW,Activity,Manufacture of tobacco products (16),1.0122628227765091e-13,5.3783174810983823e-14,4.1841561367210717e-14,1.796766982113314e-14,4.025252200311788e-14
RoW,Activity,Manufacture of wearing apparel; dressing and dyeing of fur (18),2.3126192228610257e-13,2.4884342166699577e-13,2.34550956726762e-13,1.1711372732307568e-13,1.2874733043588293e-13
RoW,Activity,"Manufacture of wood and of products of wood and cork, except furniture; manufacture of articles of straw and plaiting materials (20)",3.2464499857728903e-12,2.395386383586424e-12,2.492626703070821e-12,1.0456536473324734e-12,1.5180795855149615e-12
RoW,Activity,"Manure treatment (biogas), storage and land application",0.0,0.0,0.0,0.0,0.0
RoW,Activity,"Manure treatment (conventional), storage and land application",0.0,0.0,0.0,0.0,0.0
RoW,Activity,Meat animals nec,2.5806947940736604e-12,2.529245441155016e-12,2.291407987272118e-12,1.1994274962508661e-12,1.3727860512049501e-12
RoW,Activity,Mining of aluminium ores and concentrates,1.127169055634885e-12,8.392504438963928e-13,6.287241181094475e-13,2.2303364735442187e-13,4.3609819453705654e-13
RoW,Activity,"Mining of chemical and fertilizer minerals, production of salt, other mining and quarrying n.e.c.",3.152956151924811e-12,5.7462071330424775e-12,6.441349111876677e-12,1.9416443872069595e-12,1.5028648591940328e-12
RoW,Activity,Mining of coal and lignite; extraction of peat (10),1.5300881907456943e-11,6.3340200719408096e-12,5.530486730849995e-12,3.3195655084492226e-12,6.648304437497121e-12
RoW,Activity,Mining of copper ores and concentrates,6.0790134578757e-11,9.865849658883537e-11,6.476296002295228e-11,2.3091973685187014e-11,2.5918541732152692e-11
RoW,Activity,Mining of iron ores,2.813537224313359e-12,7.415614131869246e-12,4.8085444996593524e-12,1.6678164607390688e-12,1.3021371994999612e-12
RoW,Activity,"Mining of lead, zinc and tin ores and concentrates",2.079371613513031e-12,2.878496256029362e-12,2.7325654180435053e-12,9.661531508192661e-13,9.879851696657436e-13
RoW,Activity,Mining of nickel ores and concentrates,1.8011665398863492e-11,2.3457201955974096e-11,2.649110853185558e-11,7.920514782078891e-12,8.258535939074559e-12
RoW,Activity,Mining of other non-ferrous metal ores and concentrates,5.49158111013083e-12,6.876831480361975e-12,7.056572717770792e-12,2.342950339732892e-12,2.5377053708031197e-12
RoW,Activity,Mining of precious metal ores and concentrates,9.293190320467966e-12,2.573998481441917e-12,1.9601968758938578e-12,7.666515398032587e-13,3.385345461213184e-12
RoW,Activity,Mining of uranium and thorium ores (12),5.1755450632291356e-14,5.4131572275300074e-14,4.918447664813891e-14,2.655727360377943e-14,2.7623121891141697e-14
RoW,Activity,N-fertiliser,8.354759701933977e-14,8.075516552397707e-14,7.326905657189267e-14,5.12333082011379e-14,4.357997035046679e-14
RoW,Activity,Other business activities (74),4.778188987955904e-11,5.699939197109234e-11,5.29044971078039e-11,4.1352773404394516e-11,3.433935937615079e-11
RoW,Activity,Other land transport,1.7158273467178282e-11,1.8197633748924224e-11,1.8467486523385503e-11,1.0870700506833361e-11,1.432886791383136e-11
RoW,Activity,Other non-ferrous metal production,1.4810000578936694e-12,1.9325597666430588e-12,1.6767377654386521e-12,6.027345115880933e-13,7.084315843459396e-13
RoW,Activity,Other service activities (93),2.0951326053010997e-12,1.9943401983183582e-12,1.8127377123726319e-12,1.019376650793278e-12,1.1996602051106499e-12
RoW,Activity,P- and other fertiliser,6.555249359451716e-13,5.790561101567659e-13,5.266902789627376e-13,3.498704950994923e-13,3.361961713074978e-13
RoW,Activity,Paper,1.7258299782390683e-12,1.949763792019922e-12,1.687151706026493e-12,8.967350755736825e-13,9.341670471675722e-13
RoW,Activity,Petroleum Refinery,5.402559155858608e-12,4.353754667977656e-12,4.34339740754676e-12,4.0007974129133296e-12,3.490840226912911e-12
RoW,Activity,Pigs farming,1.575848536490583e-12,1.3028688669523867e-12,1.2131453224036328e-12,6.252780450646573e-13,8.11547716373776e-13
RoW,Activity,"Plastics, basic",1.894541991731408e-12,2.1080034801611545e-12,1.655760517272381e-12,7.646818720455469e-13,8.951117686140253e-13
RoW,Activity,Post and telecommunications (64),5.101823272416533e-12,5.461953923514848e-12,5.127791403154312e-12,3.744163426782763e-12,3.5866243272943393e-12
RoW,Activity,Poultry farming,1.1733568278910957e-12,1.0194486952698663e-12,9.476792991361781e-13,5.091207701659923e-13,6.213041515294386e-13
RoW,Activity,Precious metals production,2.715967855836216e-12,1.3919606207395015e-12,1.0800365661688234e-12,4.135608604419382e-13,1.0527904325251198e-12
RoW,Activity,Private households with employed persons (95),3.9701301433072444e-13,3.1352518159515704e-13,2.9660809539472227e-13,1.8745556877665937e-13,2.298493746768145e-13
RoW,Activity,Processed rice,1.7195519172508267e-13,1.5446899589256886e-13,1.3423539978425097e-13,6.905395000934636e-14,8.411914428926286e-14
RoW,Activity,Processing of Food products nec,7.54104700091017e-13,6.476676707958164e-13,5.897525379484863e-13,3.0592640129397597e-13,3.849613199802816e-13
RoW,Activity,Processing of dairy products,1.349465301423262e-13,1.3922383873692737e-13,1.1388732962509538e-13,5.75033429022708e-14,6.863060128756857e-14
RoW,Activity,Processing of meat cattle,3.4200421623406273e-13,2.704563557350504e-13,2.374794708226082e-13,1.2496736048350198e-13,1.7034224565540094e-13
RoW,Activity,Processing of meat pigs,2.4282815696215634e-13,1.8991911663097674e-13,1.7038485518089537e-13,9.465531499812097e-14,1.2468202195953197e-13
RoW,Activity,Processing of meat poultry,3.812210657951536e-13,2.8667894639477485e-13,2.5517418213547357e-13,1.388961409742471e-13,1.8792106113054737e-13
RoW,Activity,Processing of nuclear fuel,2.2717094409291319e-13,1.8928664148793416e-13,1.4675914291237548e-13,6.627463047425857e-14,9.737679537134158e-14
RoW,Activity,Processing vegetable oils and fats,6.078142618049857e-13,5.577557955906317e-13,4.872598892471052e-13,2.4023472725451653e-13,2.9475409686445105e-13
RoW,Activity,Production of electricity by Geothermal,2.867532590568478e-13,6.877355630361414e-14,6.230966815657322e-14,3.327688721121769e-14,1.1069642249093054e-13
RoW,Activity,Production of electricity by biomass and waste,3.838828041889541e-13,6.699012879060068e-14,5.884198077040773e-14,3.1088001670839214e-14,1.4256917201196982e-13
RoW,Activity,Production of electricity by coal,1.0801809048339732e-11,1.6628635381027146e-12,1.4389914435372614e-12,7.146303630347274e-13,3.940745374483702e-12
RoW,Activity,Production of electricity by gas,7.94167940465215e-12,1.2235802281640275e-12,1.0710504764440698e-12,5.609429629645824e-13,2.917365385490939e-12
RoW,Activity,Production of electricity by hydro,2.879112248129307e-12,4.420758526118748e-13,3.9054868964252344e-13,1.984972787378484e-13,1.054422754035825e-12
RoW,Activity,Production of electricity by nuclear,1.7002104674800247e-12,5.183836990315714e-13,4.5100476253181664e-13,2.2103298694958196e-13,6.622657264119893e-13
RoW,Activity,Production of electricity by petroleum and other oil derivatives,5.305935248410069e-13,1.3734117761378158e-13,1.195035865226417e-13,6.345087776960767e-14,2.053468627287482e-13
RoW,Activity,Production of electricity by solar photovoltaic,1.8075280013752753e-12,6.578110677000785e-14,5.973982421969395e-14,3.308171592786947e-14,6.25467878300666e-13
RoW,Activity,Production of electricity by solar thermal,5.212088113243014e-11,4.2421650701945053e-14,3.649534891734642e-14,1.7043208466190342e-14,1.765881845771683e-11
RoW,Activity,"Production of electricity by tide, wave, ocean",6.832102264898963e-18,4.53094376642604e-18,3.6756662098909515e-18,1.7953547629553057e-18,2.944539112841808e-18
RoW,Activity,Production of electricity by wind,5.494313239465288e-13,5.859124179058517e-14,5.1386017028900954e-14,3.058869868462416e-14,1.991071695357672e-13
RoW,Activity,Production of electricity nec,1.304577378328816e-13,6.377709060254314e-14,5.5375138437029104e-14,2.7694831459790085e-14,5.4891635978603425e-14
RoW,Activity,Production of meat products nec,1.2230057455898339e-12,1.0750478962803305e-12,9.647559328467053e-13,5.15560446457353e-13,6.298697140743295e-13
RoW,Activity,Production of offshore wind plants,0.0,0.0,0.0,0.0,0.0
RoW,Activity,Production of onshore wind plants,0.0,0.0,0.0,0.0,0.0
RoW,Activity,Production of photovoltaic plants,0.0,0.0,0.0,0.0,0.0
RoW,Activity,Public administration and defence; compulsory social security (75),7.926020260907215e-12,6.952387338341311e-12,6.365908991128386e-12,3.895961991640878e-12,4.626792950046139e-12
RoW,Activity,"Publishing, printing and reproduction of recorded media (22)",2.490640538077301e-12,2.7115172132585644e-12,2.429395783425694e-12,1.5952662777270018e-12,1.582921097214168e-12
RoW,Activity,Pulp,5.094320455648264e-13,4.212637094652914e-13,3.4217118209577483e-13,1.6785276082710096e-13,2.319635373011856e-13
RoW,Activity,Quarrying of sand and clay,4.826182018309262e-12,3.706616121526205e-12,3.44018962642181e-12,1.4085132237791134e-12,2.1505125093160123e-12
RoW,Activity,Quarrying of stone,9.303832947145445e-12,5.094378576985017e-12,5.764694721685278e-12,1.725583628943422e-12,3.6192759001839358e-12
RoW,Activity,Raw milk,4.602293172450613e-13,4.351362795129648e-13,3.91305216389863e-13,2.0605682423684944e-13,2.4722619373506957e-13
RoW,Activity,Re-processing of ash into clinker,2.9332742504069533e-15,1.2098883849913891e-15,1.4493971420793515e-15,6.956084840038143e-16,1.3402833331593879e-15
RoW,Activity,Re-processing of secondary aluminium into new aluminium,5.193068072339084e-14,6.556504595602994e-14,5.5056690194275896e-14,1.816040004077352e-14,2.193223248647879e-14
RoW,Activity,Re-processing of secondary construction material into aggregates,9.013698880848762e-19,5.444431405495937e-19,6.07741209859018e-19,3.696914935716437e-19,5.341924410510837e-19
RoW,Activity,Re-processing of secondary copper into new copper,1.0875223091511554e-14,3.0506959499236114e-14,1.9351990791013592e-14,7.066527507312466e-15,5.34648007633615e-15
RoW,Activity,Re-processing of secondary glass into new glass,1.3832625940022506e-13,5.374351906706572e-14,4.009920405331455e-14,1.2978654856828859e-14,4.960685396751115e-14
RoW,Activity,"Re-processing of secondary lead into new lead, zinc and tin",7.066606635895492e-15,9.012533381094236e-15,8.757154460775138e-15,3.290089868612254e-15,3.473280495138983e-15
RoW,Activity,Re-processing of secondary other non-ferrous metals into new other non-ferrous metals,2.6851269974196204e-14,3.661513397679874e-14,3.1818635143259624e-14,1.139880088370941e-14,1.295254340597612e-14
RoW,Activity,Re-processing of secondary paper into new pulp,1.4498924721957007e-13,1.0516583306958737e-13,8.585683831038775e-14,4.239383476896083e-14,6.425543898781816e-14
RoW,Activity,Re-processing of secondary plastic into new plastic,7.836813232808191e-15,8.758707218300839e-15,6.833768469268399e-15,3.113023194464668e-15,3.67247210349254e-15
RoW,Activity,Re-processing of secondary preciuos metals into new preciuos metals,0.0,0.0,0.0,0.0,0.0
