RoW,Activity,Re-processing of secondary steel into new steel,1.5305287020215336e-13,3.17418268928292e-13,2.80753585135293e-13,9.925792212322459e-14,7.89121982020835e-14
RoW,Activity,Re-processing of secondary wood material into new wood material,2.036465443435489e-13,1.5128440870517392e-13,1.5794981908619373e-13,6.601721083145349e-14,9.537652870061192e-14
RoW,Activity,Real estate activities (70),1.1948422096831938e-12,1.2712469608566853e-12,1.2809479403012477e-12,8.138030686523866e-13,8.384270225687443e-13
RoW,Activity,"Recreational, cultural and sporting activities (92)",2.3074518046998198e-12,2.6466646484024273e-12,2.459444909233917e-12,1.7536461007168112e-12,1.5802808448908011e-12
RoW,Activity,Recycling of bottles by direct reuse,0.0,0.0,0.0,0.0,0.0
RoW,Activity,Recycling of waste and scrap,8.104343068051311e-13,9.136336333818659e-13,7.593565525484679e-13,2.8953543767627105e-13,3.6199521682567956e-13
RoW,Activity,Renting of machinery and equipment without operator and of personal and household goods (71),2.8505298948337747e-12,2.913565566184363e-12,2.8953871155329266e-12,1.8336490193459853e-12,1.819062229073801e-12
RoW,Activity,Research and development (73),1.6198583590962033e-11,2.684221672127416e-11,2.1435046123982773e-11,1.0869207891177029e-11,9.124728641155437e-12
RoW,Activity,Retail sale of automotive fuel,4.717476629866095e-13,4.278751242564924e-13,4.077059252310001e-13,2.0969170537226844e-13,2.5380048852577557e-13
RoW,Activity,"Retail trade, except of motor vehicles and motorcycles; repair of personal and household goods (52)",2.0573136055324732e-11,1.772115572168668e-11,1.627049490189811e-11,8.735545726002785e-12,1.3299201166079047e-11
RoW,Activity,"Sale, maintenance, repair of motor vehicles, motor vehicles parts, motorcycles, motor cycles parts and accessoiries",9.81596804848075e-12,9.37374905479583e-12,8.953067449942192e-12,4.808452422422391e-12,5.8106210834343895e-12
RoW,Activity,Sea and coastal water transport,1.3060648776674962e-11,5.726188507425862e-12,1.2603393320825627e-11,3.3286396811020335e-12,6.298699547818119e-12
RoW,Activity,Steam and hot water supply,1.4159926769150753e-13,1.36100504355904e-13,1.2256475872937784e-13,6.830732990340273e-14,7.686639351033028e-14
RoW,Activity,Sugar refining,2.1864152773579687e-13,1.8489781739211744e-13,1.6195650484224412e-13,8.373305228450076e-14,1.0815239178104716e-13
RoW,Activity,Supporting and auxiliary transport activities; activities of travel agencies (63),1.1517345430111623e-11,1.1787067061357686e-11,1.5441085837877848e-11,6.827508441933609e-12,7.528203820985082e-12
RoW,Activity,"Tanning and dressing of leather; manufacture of luggage, handbags, saddlery, harness and footwear (19)",6.501089902572909e-13,7.20729870766436e-13,6.194196944528129e-13,2.978116517271354e-13,3.3347377824753133e-13
RoW,Activity,Transmission of electricity,2.945158402787426e-13,2.82993692606988e-13,2.4652156260581494e-13,1.2725479297110828e-13,1.5157231325473584e-13
RoW,Activity,Transport via pipelines,7.200812416392304e-13,6.093028952135229e-13,6.297998642098962e-13,5.442844926095875e-13,1.1299014361361475e-12
RoW,Activity,Transport via railways,1.693297175062492e-12,1.848408666460396e-12,1.8701430486613444e-12,9.90658934656744e-13,2.2118321859051557e-12
RoW,Activity,"Waste water treatment, food",2.02250626143264e-12,2.2507377540516474e-12,2.0067577387816127e-12,1.0017569462097114e-12,1.1237521068633368e-12
RoW,Activity,"Waste water treatment, other",2.4995515032489932e-12,2.3340926251399083e-12,2.090855457948639e-12,1.040291715848469e-12,1.3016020882993433e-12
RoW,Activity,"Wholesale trade and commission trade, except of motor vehicles and motorcycles (51)",2.552254837373488e-11,2.4251439328792623e-11,2.161286068985852e-11,1.205320318609892e-11,2.23571836627911e-11
RoW,Activity,"Wool, silk-worm cocoons",1.1226168826428644e-13,2.3551300600678986e-13,1.8520810547411692e-13,7.552156915281108e-14,6.104112916420872e-14
USA,Activity,Activities auxiliary to financial intermediation (67),8.218765955193635e-13,3.902881666178449e-13,3.2707298940573376e-13,1.990085843158651e-13,3.591229240277329e-13
USA,Activity,Activities of membership organisation n.e.c. (91),3.814550244191308e-13,2.2005449172029903e-13,2.0108600332199174e-13,1.2789281253314256e-13,1.8330540700923364e-13
USA,Activity,Air transport (62),7.663527304530106e-14,4.367130392191451e-14,4.0672731981633746e-14,2.6820189285869318e-14,3.884312843427528e-14
USA,Activity,Aluminium production,3.5633206381174774e-13,9.951584439471023e-14,7.318077369469463e-14,2.616465023556316e-14,1.2721219980093463e-13
USA,Activity,Animal products nec,1.5261328059424703e-14,1.735931082973083e-14,1.5802887395889783e-14,7.926454721342408e-15,8.289370611106103e-15
USA,Activity,"Biogasification of food waste, incl. land application",0.0,0.0,0.0,0.0,0.0
USA,Activity,"Biogasification of paper, incl. land application",0.0,0.0,0.0,0.0,0.0
USA,Activity,"Biogasification of sewage slugde, incl. land application",1.1718120787375729e-13,5.005980777995122e-14,4.480774068412735e-14,2.110151135265367e-14,4.7231188110106414e-14
USA,Activity,Casting of metals,1.747941231939158e-13,1.25833429938186e-13,1.0444025186624611e-13,4.706003489224567e-14,7.649455178805333e-14
USA,Activity,Cattle farming,2.0407890398381954e-14,1.3454499487659522e-14,1.2257228642801692e-14,6.541261559373801e-15,9.538133176538085e-15
USA,Activity,Chemicals nec,8.067027944702105e-12,3.2471045860067504e-12,3.0181872910913203e-12,1.6859199680428419e-12,3.3725036635774788e-12
USA,Activity,"Collection, purification and distribution of water (41)",1.2633939718240829e-14,3.559407711948112e-15,3.267504514417592e-15,1.7494087891088264e-15,5.007461095876158e-15
USA,Activity,"Composting of food waste, incl. land application",1.1279840535654508e-15,6.736049643104112e-16,6.580402622852017e-16,3.051073159515162e-16,4.879708449385277e-16
USA,Activity,"Composting of paper and wood, incl. land application",2.932371637583429e-14,9.574028677349818e-15,8.70761475961733e-15,4.7935877055827665e-15,1.1820121261046661e-14
USA,Activity,Computer and related activities (72),2.2441236177672523e-12,1.3753637940482205e-12,1.2220249882503927e-12,7.695046757399885e-13,1.126845322879582e-12
USA,Activity,Construction (45),1.2916474891989385e-12,1.2144587264468668e-13,1.2863772247114617e-13,9.508261553907847e-14,4.849583589701467e-13
USA,Activity,Copper production,2.3437440697594026e-13,2.273849657319269e-13,1.6096332898534266e-13,6.19646576313164e-14,9.725699620191347e-14
USA,Activity,Cultivation of cereal grains nec,8.51936996854862e-14,5.0778138135194187e-14,4.4149418121023125e-14,2.2829563806185454e-14,3.751659226197378e-14
USA,Activity,Cultivation of crops nec,9.726474259189553e-14,4.345722309236617e-14,3.835005165849405e-14,1.999020549685187e-14,4.0425508209313985e-14
USA,Activity,Cultivation of oil seeds,8.285764168538738e-13,4.588578878828852e-13,2.808406887667911e-13,1.15473672314887e-13,3.1032307900572086e-13
USA,Activity,Cultivation of paddy rice,5.3571067969108493e-14,3.680855891217628e-14,3.351622913337989e-14,1.7912727381910262e-14,2.54924345361224e-14
USA,Activity,Cultivation of plant-based fibers,1.9172743954402448e-13,1.7321600200411754e-13,1.4978571951948112e-13,7.505549481830296e-14,9.193109706634574e-14
USA,Activity,"Cultivation of sugar cane, sugar beet",3.843599920649863e-14,2.045443087268808e-14,1.8471398248713877e-14,9.8009302789705e-15,1.6836383725564592e-14
USA,Activity,"Cultivation of vegetables, fruit, nuts",4.190515360092099e-14,3.337423241824182e-14,3.006706572981763e-14,1.550630860322701e-14,2.0120522461866783e-14
USA,Activity,Cultivation of wheat,8.260545978634173e-14,7.044958907366168e-14,6.422238806649165e-14,3.3956230026349e-14,4.147792388560049e-14
USA,Activity,Distribution and trade of electricity,7.901843975871545e-14,2.120501247555743e-14,1.9049802559867802e-14,1.0206412196533111e-14,3.093579350478973e-14
USA,Activity,Education (80),4.1090934998232814e-13,1.159833731027927e-13,1.067383614637025e-13,7.82433444607038e-14,1.7409182452025654e-13
USA,Activity,Extra-territorial organizations and bodies,0.0,0.0,0.0,0.0,0.0
USA,Activity,"Extraction of crude petroleum and services related to crude oil extraction, excluding surveying",3.0408719435255447e-14,1.854514929508842e-14,1.8491800169893884e-14,2.2990870251393152e-14,1.8073645100506022e-14
USA,Activity,"Extraction of natural gas and services related to natural gas extraction, excluding surveying",5.9322491991784316e-15,3.651017021742577e-15,3.587431367504506e-15,3.81402228498641e-15,3.64163822680024e-15
USA,Activity,"Extraction, liquefaction, and regasification of other petroleum and gaseous materials",-3.2086093797869577e-16,-8.821563799706017e-17,-8.560352077071831e-17,-7.293991241698632e-17,-1.3651434160868106e-16
USA,Activity,"Financial intermediation, except insurance and pension funding (65)",1.907262797780903e-12,1.415106363390252e-12,1.3592418261792379e-12,9.643305260652377e-13,1.117516626778724e-12
USA,Activity,"Fishing, operating of fish hatcheries and fish farms; service activities incidental to fishing (05)",7.206718652307918e-14,6.860379339200485e-14,6.268485908772543e-14,3.084126430622921e-14,3.664078417081286e-14
USA,Activity,"Forestry, logging and related service activities (02)",8.24691105804988e-13,3.505129071111295e-13,3.0864460106779557e-13,1.377023022434674e-13,3.2911830465642973e-13
USA,Activity,Health and social work (85),2.5291670151536565e-14,3.179345979099367e-15,2.823224528340804e-15,2.1669849317493624e-15,9.552323213202674e-15
USA,Activity,Hotels and restaurants (55),2.0091910911350154e-12,1.4058323010124073e-12,1.2669633673372735e-12,6.670071125370537e-13,1.0068365932585205e-12
USA,Activity,Incineration of waste: Food,9.160625039358683e-15,6.648865350261418e-15,6.2923604587610445e-15,2.583487453727219e-15,3.955043142786553e-15
USA,Activity,Incineration of waste: Metals and Inert materials,1.6433812354094222e-14,1.1848349020328189e-14,1.4660580143168233e-14,7.43169016247264e-15,9.010475013562623e-15
USA,Activity,Incineration of waste: Oil/Hazardous waste,9.87917147138176e-16,9.64856126749897e-16,8.888274718460027e-16,3.9513405722762934e-16,4.787470831317102e-16
USA,Activity,Incineration of waste: Paper,1.7105930203802322e-14,7.474879759428835e-15,7.04373201513704e-15,3.5262780641816942e-15,7.152768234030087e-15
USA,Activity,Incineration of waste: Plastic,4.1684075134067495e-14,1.4687110889445225e-14,1.3504023071959717e-14,6.859422576850702e-15,1.6666877101966845e-14
USA,Activity,Incineration of waste: Textiles,1.654694292630873e-15,9.812307973894037e-16,1.0218071909392078e-15,4.009424508801398e-16,6.964819142825591e-16
USA,Activity,Incineration of waste: Wood,4.090494161552328e-15,3.9166229785652675e-15,3.511547106502527e-15,1.448759170211404e-15,1.8904343820617758e-15
USA,Activity,Inland water transport,5.097469979204351e-16,3.572688163709388e-16,2.98859560002367e-16,1.3744007051269195e-16,2.237787322521898e-16
USA,Activity,"Insurance and pension funding, except compulsory social security (66)",6.297604557885516e-13,4.341927847209253e-13,3.873137392305427e-13,2.647915164634505e-13,3.5118631418790797e-13
USA,Activity,Landfill of waste: Food,2.4407240990853393e-14,1.0029449984324735e-14,9.269381946205493e-15,4.702198842869734e-15,1.00609354808735e-14
USA,Activity,Landfill of waste: Inert/metal/hazardous,4.473556588645403e-14,1.50687656826418e-14,1.403807536956606e-14,7.008330908634226e-15,1.785972389339582e-14
USA,Activity,Landfill of waste: Paper,3.1169764078137676e-14,1.1647630207750972e-14,1.069285307556567e-14,5.495692223082735e-15,1.2652867645510313e-14
USA,Activity,Landfill of waste: Plastic,2.2238305350946134e-14,7.368079093211396e-15,6.653029010981706e-15,3.5340257684449453e-15,8.914197857558367e-15
USA,Activity,Landfill of waste: Textiles,5.491883866153004e-15,1.9650206917071944e-15,1.870986035538043e-15,9.745381351657689e-16,2.257322024234427e-15
USA,Activity,Landfill of waste: Wood,8.12198092002346e-15,2.8959939394017543e-15,2.7613784613649556e-15,1.4431913566305933e-15,3.3400733365483526e-15
USA,Activity,"Lead, zinc and tin production",1.2061753616998715e-15,2.3058105385408126e-15,2.3170722146073603e-15,8.312371565861598e-16,6.802886619441426e-16
USA,Activity,Manufacture of basic iron and steel and of ferro-alloys and first products thereof,3.180489406341706e-13,2.5631990692352203e-13,2.2341203649179587e-13,8.436851334661277e-14,1.332071416992722e-13
USA,Activity,Manufacture of beverages,1.6101760305382604e-14,1.798633386539841e-14,1.3916453698957793e-14,6.488041382580891e-15,7.90525865372928e-15
USA,Activity,"Manufacture of bricks, tiles and construction products, in baked clay",2.0316885807298299e-13,1.2332587037382904e-14,1.0323563328548036e-14,3.967141461869802e-15,7.0042119089752e-14
USA,Activity,"Manufacture of cement, lime and plaster",1.4979147797778177e-13,2.8630672403317424e-14,2.8233032992528973e-14,1.3570750694451868e-14,5.6145370444013465e-14
USA,Activity,Manufacture of ceramic goods,9.74612559486927e-14,1.0445166035719726e-14,1.2171378769418409e-14,6.1991156490151076e-15,3.656809675034566e-14
USA,Activity,Manufacture of coke oven products,-2.092727969533339e-16,-2.1303653494786025e-16,-1.825050913825563e-16,-6.631105471333853e-17,-8.970840585119249e-17
USA,Activity,Manufacture of electrical machinery and apparatus n.e.c. (31),2.2087104498467434e-12,1.79631026461192e-12,1.3279579215959532e-12,7.807998636263105e-13,1.0780984649027506e-12
USA,Activity,"Manufacture of fabricated metal products, except machinery and equipment (28)",1.8152499194315737e-12,1.1746692282743888e-12,1.036993628896241e-12,4.26883740807203e-13,7.547279766937456e-13
USA,Activity,Manufacture of fish products,9.33296138827535e-15,1.11668973238388e-14,1.072223195203624e-14,4.862804511828109e-15,5.036087020815314e-15
USA,Activity,Manufacture of furniture; manufacturing n.e.c. (36),5.386642099419993e-13,2.932002678856312e-13,2.6076397854952946e-13,1.4655156122837317e-13,2.421542817695988e-13
USA,Activity,Manufacture of gas; distribution of gaseous fuels through mains,4.8077268197658e-13,4.800008919249374e-14,4.221972846931209e-14,2.3231536319462127e-14,1.7122638794417353e-13
USA,Activity,Manufacture of glass and glass products,1.351174037624923e-11,3.081841722406201e-13,2.2917768530394187e-13,7.033200796150902e-14,4.590076363839659e-12
USA,Activity,Manufacture of machinery and equipment n.e.c. (29),1.1967596875305547e-12,8.912118758988287e-13,7.451536516057426e-13,3.220813977848681e-13,5.171846461225722e-13
USA,Activity,"Manufacture of medical, precision and optical instruments, watches and clocks (33)",1.426521218990025e-13,2.0940323522866864e-13,1.534718769738282e-13,7.39280300426425e-14,7.621872735436687e-14
USA,Activity,"Manufacture of motor vehicles, trailers and semi-trailers (34)",3.2212156049907427e-13,1.7020930666286167e-13,1.4969664965693602e-13,6.633870555359122e-14,1.3769960415548315e-13
USA,Activity,Manufacture of office machinery and computers (30),1.8670635003608638e-14,2.4963975534708787e-14,1.9798040345452822e-14,9.991168608786609e-15,1.0281885663788054e-14
USA,Activity,Manufacture of other non-metallic mineral products n.e.c.,1.4957000532986111e-12,8.178001766195657e-14,9.163580221277009e-14,3.1348127630779765e-14,5.165110812057277e-13
USA,Activity,Manufacture of other transport equipment (35),6.636633467352852e-13,7.465717768823667e-13,6.373837060835294e-13,2.935740773631927e-13,3.581296747305466e-13
USA,Activity,"Manufacture of radio, television and communication equipment and apparatus (32)",1.912506454103973e-13,2.4076433815178667e-13,1.5312178643971478e-13,7.180314337005781e-14,8.672394921218094e-14
USA,Activity,Manufacture of rubber and plastic products (25),5.598714083607229e-13,2.961571773267361e-13,2.6997861824828284e-13,1.2050670778470006e-13,2.3574268921422903e-13
USA,Activity,Manufacture of textiles (17),1.5994713830261935e-13,8.917289109272802e-14,8.009763375376003e-14,4.065499977941811e-14,6.959027919923197e-14
USA,Activity,Manufacture of tobacco products (16),4.1165247281665936e-16,3.8385911827104803e-16,2.77528659257275e-16,1.122488845309271e-16,1.7355820230299526e-16
USA,Activity,Manufacture of wearing apparel; dressing and dyeing of fur (18),2.7481565809439753e-15,1.6216683287443483e-15,1.4832160808945509e-15,7.945260663997826e-16,1.2689968358453987e-15
USA,Activity,"Manufacture of wood and of products of wood and cork, except furniture; manufacture of articles of straw and plaiting materials (20)",4.940649389603772e-13,1.9094769209694752e-13,1.8499714575702558e-13,7.794391024467032e-14,1.9635572443813067e-13
USA,Activity,"Manure treatment (biogas), storage and land application",0.0,0.0,0.0,0.0,0.0
USA,Activity,"Manure treatment (conventional), storage and land application",0.0,0.0,0.0,0.0,0.0
USA,Activity,Meat animals nec,1.6460423236980997e-14,7.15962004866031e-15,6.713790684175478e-15,3.4175363954032028e-15,6.968441924347039e-15
USA,Activity,Mining of aluminium ores and concentrates,-8.389620042954465e-16,-3.5956087718417316e-17,-2.821019145348921e-17,-9.794507634843235e-18,-2.865359148589004e-16
USA,Activity,"Mining of chemical and fertilizer minerals, production of salt, other mining and quarrying n.e.c.",1.9628503723490568e-13,2.4967079191277586e-13,2.749583888324209e-13,9.023853424489348e-14,8.944196214894966e-14
USA,Activity,Mining of coal and lignite; extraction of peat (10),3.080459452276515e-12,2.7540108062437033e-13,2.7567707304695874e-13,1.560975366293596e-13,1.1103775059010422e-12
USA,Activity,Mining of copper ores and concentrates,6.975007229077639e-13,3.8889320883365725e-13,2.7814062890967903e-13,1.0612467686521566e-13,2.658732873009674e-13
USA,Activity,Mining of iron ores,3.696417059234305e-16,1.9492731264158822e-16,1.6710264117630776e-16,6.471584853259762e-17,1.449986127911267e-16
USA,Activity,"Mining of lead, zinc and tin ores and concentrates",-1.802779191675997e-15,-1.7477560173767351e-15,-1.5853810576995476e-15,-5.422638655625921e-16,-7.629775777005539e-16
USA,Activity,Mining of nickel ores and concentrates,0.0,0.0,0.0,0.0,0.0
USA,Activity,Mining of other non-ferrous metal ores and concentrates,1.717746463182772e-16,1.437301511204904e-16,1.3266515322829099e-16,5.512628890723835e-17,7.712399281789491e-17
USA,Activity,Mining of precious metal ores and concentrates,2.1668669657191845e-11,1.229953257176241e-12,1.0276992461939834e-12,3.86715122365035e-13,7.464123697387778e-12
USA,Activity,Mining of uranium and thorium ores (12),1.0879768949327649e-13,5.4269107685200305e-14,4.669058298450544e-14,2.349434125091816e-14,4.5214240296896685e-14
USA,Activity,N-fertiliser,3.9042737147069927e-16,1.0703903531256412e-16,9.329465716826345e-17,5.416860527060234e-17,1.501430323174901e-16
USA,Activity,Other business activities (74),1.7231052179198913e-11,1.0904942087287771e-11,1.0031077509814125e-11,6.266359629609959e-12,8.53987310355316e-12
USA,Activity,Other land transport,3.278787793703592e-13,1.0220641287469265e-13,9.790770362405393e-14,5.984363230345407e-14,1.570868319953108e-13
USA,Activity,Other non-ferrous metal production,-9.9983339704243e-16,-8.425614363432535e-16,-7.72616270968915e-16,-3.1994665581287276e-16,-4.462015633400406e-16
USA,Activity,Other service activities (93),1.2865885216449881e-13,5.495589840576203e-14,4.9767915701539155e-14,3.010226076158605e-14,5.687628525038145e-14
USA,Activity,P- and other fertiliser,5.684192609501889e-14,2.4749932674049516e-14,2.2362543082580404e-14,1.2993300462178544e-14,2.3835246369443542e-14
USA,Activity,Paper,4.985408825462711e-13,1.5936634301875696e-13,1.3676939045172713e-13,6.846835883915806e-14,1.9414251498434388e-13
USA,Activity,Petroleum Refinery,1.6023658890251233e-13,8.92717149757041e-14,8.741069166508705e-14,1.2213553395082817e-13,9.325187179045823e-14
USA,Activity,Pigs farming,2.9604632335850305e-14,1.6155274752311647e-14,1.3949333208022662e-14,7.212713150058449e-15,1.2800492134463733e-14
USA,Activity,"Plastics, basic",4.555777659533061e-14,3.727394390954133e-14,2.9531206186953584e-14,1.444605922787767e-14,2.0296007177621214e-14
USA,Activity,Post and telecommunications (64),5.924495963863277e-13,3.24552477756048e-13,3.059951286070844e-13,2.0751272869542658e-13,2.967786852724339e-13
USA,Activity,Poultry farming,1.641913859956941e-14,1.3306488671052839e-14,1.2147547408130875e-14,6.454222563446117e-15,8.027729091884002e-15
USA,Activity,Precious metals production,2.465316084365038e-12,1.163498326460268e-13,9.792391781711361e-14,3.7972010702109675e-14,8.479740313704549e-13
USA,Activity,Private households with employed persons (95),8.65689956314969e-14,4.218355598424279e-14,3.7841892314560614e-14,3.2641822715341505e-14,4.423184867127781e-14
USA,Activity,Processed rice,7.383414117066252e-17,7.118492437645125e-17,6.577492031292238e-17,3.5161423801158434e-17,3.882664798952748e-17
USA,Activity,Processing of Food products nec,1.4862174569354746e-13,7.994912961734678e-14,7.038337499294901e-14,3.662383970769104e-14,6.435613871083758e-14
USA,Activity,Processing of dairy products,2.0252973309950322e-14,1.451753022787292e-14,1.1577745576397682e-14,5.777634077202322e-15,9.177644771657436e-15
USA,Activity,Processing of meat cattle,2.5838697795862337e-15,1.652438857444347e-15,1.5283915966066332e-15,8.251865272685651e-16,1.2129925964087067e-15
USA,Activity,Processing of meat pigs,8.061008776923156e-15,4.416967725970116e-15,3.779582033016886e-15,1.9484967075648256e-15,3.4777988167173826e-15
USA,Activity,Processing of meat poultry,4.48281087551589e-15,3.9176856657205905e-15,3.598876488352575e-15,1.9318539815398373e-15,2.258106168030605e-15
USA,Activity,Processing of nuclear fuel,-2.774246561675895e-15,-1.6771935026373512e-15,-1.0273964043744575e-15,-3.672037166552014e-16,-1.0150913723617415e-15
USA,Activity,Processing vegetable oils and fats,-2.9395093669625584e-17,-1.7933299486320732e-17,-1.6189780623064388e-17,-8.671514468113913e-18,-1.3266234192128152e-17
USA,Activity,Production of electricity by Geothermal,-6.899986115646906e-14,-3.3353264102605017e-16,-2.9867882838587686e-16,-1.510774795919115e-16,-2.3429385393353176e-14
USA,Activity,Production of electricity by biomass and waste,3.481899700012411e-13,1.7703243548686755e-15,1.5834501423993016e-15,8.050166413161021e-16,1.182427411101851e-13
USA,Activity,Production of electricity by coal,5.675366700571597e-12,7.320507738623225e-14,6.432844528708568e-14,3.2419590534435454e-14,1.934358540406805e-12
USA,Activity,Production of electricity by gas,6.618798798999065e-12,3.0656035663025164e-14,2.692039212292118e-14,1.3531209233014476e-14,2.2467142640307485e-12
USA,Activity,Production of electricity by hydro,9.590921514561868e-13,6.091179223313411e-15,5.380103984445701e-15,2.711489139830773e-15,3.25858976792622e-13
USA,Activity,Production of electricity by nuclear,3.229238436137563e-12,2.319656963677973e-14,2.0371377793383206e-14,1.0257587042406891e-14,1.09754347114803e-12
USA,Activity,Production of electricity by petroleum and other oil derivatives,1.1184948152868932e-14,9.719479839158044e-17,8.776611540610132e-17,4.6718117529502256e-17,3.806640730855351e-15
USA,Activity,Production of electricity by solar photovoltaic,-1.011273006512411e-12,-3.6121821329757304e-16,-3.2531722254742206e-16,-1.6103515345488643e-16,-3.4255171760104014e-13
USA,Activity,Production of electricity by solar thermal,-1.769230744877991e-14,-2.2487283065342667e-17,-2.0113346824619645e-17,-1.0122970240361903e-17,-5.996057903039999e-15
USA,Activity,"Production of electricity by tide, wave, ocean",0.0,0.0,0.0,0.0,0.0
USA,Activity,Production of electricity by wind,1.461674929956326e-12,2.5207091548281274e-15,2.2132715705788325e-15,1.0701643973067281e-15,4.954303213660706e-13
USA,Activity,Production of electricity nec,-1.607660603955432e-14,-8.253584370851355e-17,-7.367494166450809e-17,-3.7325735811993966e-17,-5.460214077377036e-15
USA,Activity,Production of meat products nec,1.5181090277931534e-15,8.795233022243658e-16,7.664893148914349e-16,4.0456272582104087e-16,6.65291563484554e-16
USA,Activity,Production of offshore wind plants,0.0,0.0,0.0,0.0,0.0
USA,Activity,Production of onshore wind plants,0.0,0.0,0.0,0.0,0.0
USA,Activity,Production of photovoltaic plants,0.0,0.0,0.0,0.0,0.0
USA,Activity,Public administration and defence; compulsory social security (75),1.2334512724888433e-12,9.188212339342423e-14,8.159006927359944e-14,4.906801584166666e-14,4.414249661779691e-13
USA,Activity,"Publishing, printing and reproduction of recorded media (22)",1.7149530128607477e-13,1.098395993799621e-13,1.0006653606753158e-13,6.34931310062242e-14,8.593411436881503e-14
USA,Activity,Pulp,5.652282122897863e-15,3.399525475909274e-15,2.5780154019353177e-15,1.2409612649715917e-15,2.3132224425215983e-15
USA,Activity,Quarrying of sand and clay,5.370926630114202e-14,7.22350437973426e-15,6.440123420028983e-15,2.5193709988093785e-15,1.910220652793756e-14
USA,Activity,Quarrying of stone,3.092801693905071e-14,5.901268435907966e-15,7.907490085897105e-15,2.9956057105327495e-15,1.149992051592696e-14
USA,Activity,Raw milk,3.381623137607607e-14,2.4048254764415877e-14,1.918542820802479e-14,9.578274123144433e-15,1.52970101274991e-14
USA,Activity,Re-processing of ash into clinker,0.0,0.0,0.0,0.0,0.0
USA,Activity,Re-processing of secondary aluminium into new aluminium,0.0,0.0,0.0,0.0,0.0
USA,Activity,Re-processing of secondary construction material into aggregates,0.0,0.0,0.0,0.0,0.0
USA,Activity,Re-processing of secondary copper into new copper,0.0,0.0,0.0,0.0,0.0
USA,Activity,Re-processing of secondary glass into new glass,0.0,0.0,0.0,0.0,0.0
USA,Activity,"Re-processing of secondary lead into new lead, zinc and tin",0.0,0.0,0.0,0.0,0.0
USA,Activity,Re-processing of secondary other non-ferrous metals into new other non-ferrous metals,0.0,0.0,0.0,0.0,0.0
USA,Activity,Re-processing of secondary paper into new pulp,0.0,0.0,0.0,0.0,0.0
USA,Activity,Re-processing of secondary plastic into new plastic,0.0,0.0,0.0,0.0,0.0
USA,Activity,Re-processing of secondary preciuos metals into new preciuos metals,0.0,0.0,0.0,0.0,0.0
