Region,,,EU27+UK,EU27+UK,EU27+UK,EU27+UK,EU27+UK
Level,,,Activity,Activity,Activity,Activity,Activity
Item,,,Production of photovoltaic plants,Production of onshore wind plants,Production of offshore wind plants,Production of electricity by wind,Production of electricity by solar photovoltaic
Region,Level,Item,,,,,
China,Activity,Activities auxiliary to financial intermediation (67),2.356204935002233e-12,1.0678878691463744e-12,5.590299879858179e-13,3.4957863977308054e-13,1.308518239692865e-12
China,Activity,Activities of membership organisation n.e.c. (91),1.032366065229842e-14,2.0015014110327148e-15,1.0951196978431265e-15,6.897112111112261e-16,5.680219266223756e-15
China,Activity,Air transport (62),1.1745494785828967e-12,5.420929442028941e-13,3.0450454349452747e-13,1.981122621743169e-13,6.625251874670121e-13
China,Activity,Aluminium production,5.1704456092858766e-12,3.6289751678483925e-12,1.7485673243416993e-12,1.0779104046806482e-12,2.859824834893172e-12
China,Activity,Animal products nec,1.6193154005237063e-14,5.707936109570045e-15,3.989755251034504e-15,2.5671228069839115e-15,9.24362419723729e-15
China,Activity,"Biogasification of food waste, incl. land application",0.0,0.0,0.0,0.0,0.0
China,Activity,"Biogasification of paper, incl. land application",0.0,0.0,0.0,0.0,0.0
China,Activity,"Biogasification of sewage slugde, incl. land application",0.0,0.0,0.0,0.0,0.0
China,Activity,Casting of metals,5.997288650857884e-13,2.1451161946501757e-12,9.620868453416809e-13,5.988724211557102e-13,3.428042295565548e-13
China,Activity,Cattle farming,2.0915775640150437e-14,7.419071157469684e-15,4.538696005194656e-15,2.8466675995862143e-15,1.1728513754733819e-14
China,Activity,Chemicals nec,1.1508638194349578e-11,2.6061179730535813e-12,1.5086011548250339e-12,9.583441816311517e-13,6.357380333562895e-12
China,Activity,"Collection, purification and distribution of water (41)",4.0844060566051655e-13,1.1019790844008894e-13,5.954008472567032e-14,3.5802643424373884e-14,2.2449690336051664e-13
China,Activity,"Composting of food waste, incl. land application",2.855094973601444e-14,5.791543508704881e-15,3.270651914657843e-15,2.002854126421632e-15,1.5712747877749977e-14
China,Activity,"Composting of paper and wood, incl. land application",1.0341315063595453e-14,2.0293861472700557e-15,1.1149271288816136e-15,6.750014675022098e-16,5.678815691050058e-15
China,Activity,Computer and related activities (72),1.0173768126486514e-12,4.953995639232832e-13,2.8322094091305264e-13,1.764437386165894e-13,5.729503199558553e-13
China,Activity,Construction (45),2.4593473110256593e-12,6.902624290877048e-13,4.618934132653965e-13,3.4886320852923057e-13,1.4714556335511724e-12
China,Activity,Copper production,5.583757619727147e-13,2.7364870588022826e-12,1.23821194348242e-12,7.704925469298806e-13,3.2753762910221603e-13
China,Activity,Cultivation of cereal grains nec,2.7404733814273817e-13,6.39309643145637e-14,3.697720017835725e-14,2.2577728117919852e-14,1.5137973544125677e-13
China,Activity,Cultivation of crops nec,1.2737653275918546e-12,3.796643995124033e-13,2.1595193518131536e-13,1.3389868140808317e-13,7.058328931423421e-13
China,Activity,Cultivation of oil seeds,3.9992713576690824e-13,2.9806898269735486e-13,1.5525290457032813e-13,9.73325966635978e-14,2.2526500775204128e-13
China,Activity,Cultivation of paddy rice,2.3192828725848883e-13,7.339979001940268e-14,3.934714435478186e-14,2.4769717740905112e-14,1.2826403378522432e-13
China,Activity,Cultivation of plant-based fibers,3.575305164739841e-13,1.7682220393928387e-13,1.0486272373375512e-13,6.491158452736653e-14,2.0161928636035234e-13
China,Activity,"Cultivation of sugar cane, sugar beet",1.5271064076905292e-13,6.274911659861496e-14,3.390861176187674e-14,2.1093565172176002e-14,8.493538822475445e-14
China,Activity,"Cultivation of vegetables, fruit, nuts",1.400688198923624e-12,4.678871848930544e-13,2.674609486102039e-13,1.6625750218551688e-13,7.801299056874676e-13
China,Activity,Cultivation of wheat,1.8665825737639133e-13,7.055528012844388e-14,3.941880452664782e-14,2.4636912666067625e-14,1.0398522929886345e-13
China,Activity,Distribution and trade of electricity,7.667097833968447e-15,2.9504488988450874e-15,1.6003580057706043e-15,9.549890755538982e-16,4.2288117843401114e-15
China,Activity,Education (80),4.455900820658191e-12,1.8153012682538171e-12,9.441804437411718e-13,5.935194604642484e-13,2.4717695107598364e-12
China,Activity,Extra-territorial organizations and bodies,0.0,0.0,0.0,0.0,0.0
China,Activity,"Extraction of crude petroleum and services related to crude oil extraction, excluding surveying",3.066305335596648e-12,1.153469334348219e-12,6.303440156436662e-13,3.8792289059294567e-13,1.6992688638233335e-12
China,Activity,"Extraction of natural gas and services related to natural gas extraction, excluding surveying",0.0,0.0,0.0,0.0,0.0
China,Activity,"Extraction, liquefaction, and regasification of other petroleum and gaseous materials",0.0,0.0,0.0,0.0,0.0
China,Activity,"Financial intermediation, except insurance and pension funding (65)",1.1145260461849211e-11,3.380798114335199e-12,1.7386163186063733e-12,1.0824907734751998e-12,6.138115623709852e-12
China,Activity,"Fishing, operating of fish hatcheries and fish farms; service activities incidental to fishing (05)",2.1353644800263315e-12,1.3546265133335035e-12,7.175523526080746e-13,4.492322728466325e-13,1.199743819019673e-12
China,Activity,"Forestry, logging and related service activities (02)",1.505559919200983e-12,6.904813083726779e-13,3.7580248798687354e-13,2.3616677559347387e-13,8.400691679767826e-13
China,Activity,Health and social work (85),8.920185648489441e-12,3.3041779936077177e-12,1.6104788904415633e-12,9.88552355953923e-13,4.897062378892961e-12
China,Activity,Hotels and restaurants (55),2.1233380952859288e-11,1.0923704111906118e-11,6.087313296405812e-12,3.798951387923364e-12,1.1958826474425313e-11
China,Activity,Incineration of waste: Food,1.7970185913672717e-13,3.732406486232841e-14,2.0607737564463697e-14,1.262171605128608e-14,9.878484102024697e-14
China,Activity,Incineration of waste: Metals and Inert materials,1.9149756248591076e-14,4.247903562821417e-15,2.5576154287952413e-15,1.5869901777945425e-15,1.0599541486333495e-14
China,Activity,Incineration of waste: Oil/Hazardous waste,3.635165278796077e-14,7.713135667154582e-15,4.3441274206950885e-15,2.6703151181967622e-15,2.002218228363761e-14
China,Activity,Incineration of waste: Paper,1.7242461723962187e-13,3.246114201443994e-14,1.8094876038661616e-14,1.1148034835669951e-14,9.477512881677279e-14
China,Activity,Incineration of waste: Plastic,3.383412161626455e-14,7.688937521275145e-15,4.292673080110792e-15,2.696287756277081e-15,1.866859554315868e-14
China,Activity,Incineration of waste: Textiles,2.96563024566116e-14,6.018928854310512e-15,3.394536577477448e-15,2.0865024291518758e-15,1.632031561785966e-14
China,Activity,Incineration of waste: Wood,3.8324030663810953e-14,7.827415642207766e-15,4.389016365259024e-15,2.716252381724245e-15,2.1097249076145054e-14
China,Activity,Inland water transport,4.623473764023215e-14,2.2772224640375587e-14,1.2046268648541654e-14,7.413318861413063e-15,2.5751504915812355e-14
China,Activity,"Insurance and pension funding, except compulsory social security (66)",2.4843529900766443e-12,1.0360580222417715e-12,5.413988339325785e-13,3.4807480838839527e-13,1.3867658829242006e-12
China,Activity,Landfill of waste: Food,6.949237380081959e-13,1.4525373433522974e-13,7.945609013937783e-14,4.8558135052627857e-14,3.8184411761305087e-13
China,Activity,Landfill of waste: Inert/metal/hazardous,2.1262533342767277e-13,4.115192923609494e-14,2.2854882942750493e-14,1.4103562466822988e-14,1.1690011483545068e-13
China,Activity,Landfill of waste: Paper,2.6859655988974224e-13,5.386847988155148e-14,2.9479204525173194e-14,1.8040615685157318e-14,1.4754670314746315e-13
China,Activity,Landfill of waste: Plastic,2.2438960906898734e-13,4.744372278862502e-14,2.6004511092291508e-14,1.588650317830624e-14,1.2331603032337374e-13
China,Activity,Landfill of waste: Textiles,9.7300072462688e-14,2.0351367982703464e-14,1.1177768339224803e-14,6.834143601122371e-15,5.3474072524098773e-14
China,Activity,Landfill of waste: Wood,1.1955348068359403e-13,2.5170650905608878e-14,1.3805783694110685e-14,8.453038976650956e-15,6.571119329071092e-14
China,Activity,"Lead, zinc and tin production",1.1074807622443945e-13,1.6886004060968087e-13,8.081056272123097e-14,5.042128742449795e-14,6.298616908213273e-14
China,Activity,Manufacture of basic iron and steel and of ferro-alloys and first products thereof,1.1059575055780771e-11,2.6906172908449422e-11,1.2855074126891541e-11,7.929355810777003e-12,6.344676575326092e-12
China,Activity,Manufacture of beverages,9.334692644730912e-14,6.124250063444593e-14,3.2221223271693675e-14,2.0205032846730607e-14,5.256499790654869e-14
China,Activity,"Manufacture of bricks, tiles and construction products, in baked clay",8.806652298265772e-15,5.304356400039075e-15,3.707920076359262e-15,2.4166279126356422e-15,5.262334879056865e-15
China,Activity,"Manufacture of cement, lime and plaster",3.84585236362011e-14,1.1428519535244683e-14,1.1441702080081355e-14,7.987342484391211e-15,2.3832955532700363e-14
China,Activity,Manufacture of ceramic goods,4.041799643915402e-13,4.871284190710248e-13,2.5868886424794217e-13,1.6938049932604926e-13,2.4188905928506557e-13
China,Activity,Manufacture of coke oven products,7.40231065247139e-13,6.430691340361781e-13,3.2046733310930534e-13,1.9463675513795595e-13,4.1151500233442414e-13
China,Activity,Manufacture of electrical machinery and apparatus n.e.c. (31),7.103618120294653e-12,6.43972940617728e-11,2.787665348895586e-11,1.738359059471157e-11,4.166380236996789e-12
China,Activity,"Manufacture of fabricated metal products, except machinery and equipment (28)",7.778417278550154e-12,8.742483591594605e-12,4.638742720707694e-12,2.8367520375006793e-12,4.412523562055889e-12
China,Activity,Manufacture of fish products,3.850146250923466e-13,2.61325689510194e-13,1.3658855822442845e-13,8.544457191913347e-14,2.1631199224828564e-13
China,Activity,Manufacture of furniture; manufacturing n.e.c. (36),4.827408692627041e-12,4.036207573795649e-12,2.0514579990051787e-12,1.3057207338278842e-12,2.7063953580148066e-12
China,Activity,Manufacture of gas; distribution of gaseous fuels through mains,1.0973794943753399e-12,4.734547879681473e-13,2.543230589286107e-13,1.5223101205000756e-13,6.060132798173919e-13
China,Activity,Manufacture of glass and glass products,4.69201194070408e-11,1.504936338269724e-12,8.185493794031575e-13,4.839381023201078e-13,2.555674681335462e-11
China,Activity,Manufacture of machinery and equipment n.e.c. (29),0.0,0.0,0.0,0.0,0.0
China,Activity,"Manufacture of medical, precision and optical instruments, watches and clocks (33)",1.0066367536456166e-12,1.7187507961498317e-12,9.481971732413952e-13,7.064656366551356e-13,6.683428326846188e-13
China,Activity,"Manufacture of motor vehicles, trailers and semi-trailers (34)",8.108251341198341e-12,1.3542681495198348e-12,8.045631886488103e-13,4.796220325329405e-13,4.4589573811807775e-12
China,Activity,Manufacture of office machinery and computers (30),1.4723081062462716e-12,1.301980909748776e-12,8.375968423618348e-13,5.822553054220604e-13,9.12885183266873e-13
China,Activity,Manufacture of other non-metallic mineral products n.e.c.,1.703013135657229e-11,6.295247774258263e-13,3.387546284239717e-13,2.0379175976869929e-13,9.27990767736844e-12
China,Activity,Manufacture of other transport equipment (35),1.4605382495254727e-12,5.411155357960527e-13,3.1764248134240246e-13,1.9696716155721612e-13,8.164585257966493e-13
China,Activity,"Manufacture of radio, television and communication equipment and apparatus (32)",1.8176015162243162e-12,4.408149795666071e-12,2.3998741319853875e-12,1.6631311507772073e-12,1.2023148328699158e-12
China,Activity,Manufacture of rubber and plastic products (25),1.3695750198139024e-11,1.2067772542125133e-11,6.16783566994838e-12,3.842149368997439e-12,7.718009738794168e-12
China,Activity,Manufacture of textiles (17),4.540847340296683e-12,2.425288485851851e-12,1.3588262633779297e-12,8.483505004884853e-13,2.551108166194744e-12
China,Activity,Manufacture of tobacco products (16),1.042260788063572e-14,3.2636408317031698e-15,1.7542656480725545e-15,1.0338501491902998e-15,5.722107183615234e-15
China,Activity,Manufacture of wearing apparel; dressing and dyeing of fur (18),1.4088569330490608e-12,4.956190820543604e-13,2.7573212881697525e-13,1.7165202039017926e-13,7.827711621553961e-13
China,Activity,"Manufacture of wood and of products of wood and cork, except furniture; manufacture of articles of straw and plaiting materials (20)",1.2059719851508227e-13,7.603165405669946e-14,7.545484785001362e-14,4.359928904405205e-14,7.485910274243034e-14
China,Activity,"Manure treatment (biogas), storage and land application",0.0,0.0,0.0,0.0,0.0
China,Activity,"Manure treatment (conventional), storage and land application",0.0,0.0,0.0,0.0,0.0
China,Activity,Meat animals nec,1.1441484778543816e-12,6.02579595944304e-14,4.5603720822195266e-14,2.4898941981209874e-14,6.25571600536829e-13
China,Activity,Mining of aluminium ores and concentrates,9.180160893877062e-14,6.386670113435498e-14,3.707878241211631e-14,2.1608931430916496e-14,5.134322410685672e-14
China,Activity,"Mining of chemical and fertilizer minerals, production of salt, other mining and quarrying n.e.c.",3.9590301028440734e-14,1.6108071328053103e-14,1.2065990762906282e-14,6.784623325200723e-15,2.226300136881401e-14
China,Activity,Mining of coal and lignite; extraction of peat (10),5.622731584405698e-12,2.9653132198989753e-12,1.4775986380847205e-12,9.078303586969655e-13,3.1063998793175085e-12
China,Activity,Mining of copper ores and concentrates,5.318785272512415e-13,9.692038313527533e-13,4.872143234375599e-13,2.8729591535738527e-13,2.984717622943396e-13
China,Activity,Mining of iron ores,6.401816179684019e-14,1.1288108360464334e-13,5.710581374151887e-14,3.442165660277473e-14,3.637013457906964e-14
China,Activity,"Mining of lead, zinc and tin ores and concentrates",3.216106631930355e-14,1.530227270381258e-14,9.823122046369063e-15,5.266407319727993e-15,1.7744883675712415e-14
China,Activity,Mining of nickel ores and concentrates,8.682535333936152e-14,1.1797511651645082e-13,1.2431335919119101e-13,5.372611058613032e-14,4.8938953325981815e-14
China,Activity,Mining of other non-ferrous metal ores and concentrates,5.21068003699705e-13,5.267130758822041e-13,7.531159277071219e-13,2.9599180467162314e-13,2.92379996623141e-13
China,Activity,Mining of precious metal ores and concentrates,6.70198779782366e-12,4.562191694989074e-13,2.2149068900153006e-13,1.3958318892307626e-13,3.654729870285094e-12
China,Activity,Mining of uranium and thorium ores (12),6.991273621230824e-15,8.567527793713908e-15,4.400075572032355e-15,2.8595921945735643e-15,4.0461096946771475e-15
China,Activity,N-fertiliser,1.6940213377412664e-15,5.996344246441979e-16,3.518829019308828e-16,2.535343782496948e-16,9.480890813412057e-16
China,Activity,Other business activities (74),5.001728063517779e-12,2.9829346495949787e-12,1.5669899526897207e-12,1.0466379294945063e-12,2.829296641158957e-12
China,Activity,Other land transport,2.7394700927437846e-12,1.1553853896082608e-12,6.237237208195117e-13,3.90855235886729e-13,1.528489926052423e-12
China,Activity,Other non-ferrous metal production,2.752669219677371e-13,4.2201790697072287e-13,6.747686023772749e-13,2.5625994616964367e-13,1.5664946522614876e-13
China,Activity,Other service activities (93),0.0,0.0,0.0,0.0,0.0
China,Activity,P- and other fertiliser,3.243619023172871e-13,1.3226725565907571e-13,8.159079807454747e-14,5.208345709949357e-14,1.8265557933157866e-13
China,Activity,Paper,1.5670268519922512e-12,7.384756556618424e-13,3.791679246789138e-13,2.428618026588024e-13,8.725328863899805e-13
China,Activity,Petroleum Refinery,5.296406089138535e-12,1.932698776677235e-12,1.0596450580278335e-12,6.506608386361768e-13,2.9352810604726e-12
China,Activity,Pigs farming,6.137721094026985e-12,3.0999393850767555e-13,2.3989150891968843e-13,1.3033375269994928e-13,3.3557501108886794e-12
China,Activity,"Plastics, basic",7.734137003316197e-13,9.398381292945033e-13,4.687627818987294e-13,2.936325963915488e-13,4.3991928333453083e-13
China,Activity,Post and telecommunications (64),6.289064411207975e-13,4.593248396291483e-13,2.403316761251677e-13,1.6349516405724356e-13,3.6060052670602644e-13
China,Activity,Poultry farming,4.04571089065987e-13,1.1886153928838899e-13,6.809715296078325e-14,4.196549628555491e-14,2.245958727900695e-13
China,Activity,Precious metals production,4.2038258452301275e-12,2.753409148107524e-13,1.3288338347702534e-13,8.414936227616337e-14,2.2923118096735374e-12
China,Activity,Private households with employed persons (95),1.908059392884245e-15,7.487974953544441e-16,4.4089958792703506e-16,2.57481472103622e-16,1.0577243434263485e-15
China,Activity,Processed rice,4.479787597703131e-15,1.756791236047002e-15,9.40113347006565e-16,5.897923137151508e-16,2.4853323612497395e-15
China,Activity,Processing of Food products nec,0.0,0.0,0.0,0.0,0.0
China,Activity,Processing of dairy products,6.263541995001131e-15,2.104858287921135e-15,1.1671786592049888e-15,7.213534587866804e-16,3.4734143740961332e-15
China,Activity,Processing of meat cattle,1.0809611373550719e-16,4.469897707325596e-17,2.528139548901491e-17,1.5747451171707558e-17,6.057286746717337e-17
China,Activity,Processing of meat pigs,5.996982447160515e-17,2.2264494647854207e-17,1.2622434229431899e-17,7.845310110164556e-18,3.3461854466455675e-17
China,Activity,Processing of meat poultry,1.1332628879359769e-14,4.080491042086137e-15,2.298282709080844e-15,1.4275067165297955e-15,6.3146838984078535e-15
China,Activity,Processing of nuclear fuel,1.3833704516607917e-16,1.0554053186983893e-16,5.920809041875146e-17,3.6961336302581777e-17,7.894322267546795e-17
China,Activity,Processing vegetable oils and fats,8.87056948259535e-15,3.674398636348578e-15,1.9815485303364877e-15,1.2343082917498077e-15,4.934599721151972e-15
China,Activity,Production of electricity by Geothermal,3.47235192644784e-16,5.74129434982299e-17,3.1279797124195767e-17,1.8620632884427522e-17,1.900575107921143e-16
China,Activity,Production of electricity by biomass and waste,5.469485913074323e-13,3.746205880302623e-15,2.724203696452129e-15,1.3928526840181406e-15,2.976547965618563e-13
China,Activity,Production of electricity by coal,7.809067543071543e-11,9.156010800137333e-12,4.963712877453802e-12,2.9547672982139733e-12,4.265849826697174e-11
China,Activity,Production of electricity by gas,1.3257977666256045e-12,1.0159846084936775e-13,5.53599727860323e-14,3.283982510605215e-14,7.232292417454835e-13
China,Activity,Production of electricity by hydro,7.174096750661187e-12,7.171069625722997e-13,3.8855118908997864e-13,2.3124148892617725e-13,3.916591474254608e-12
China,Activity,Production of electricity by nuclear,2.8107329229076145e-12,1.7340058269110088e-13,9.397084854826751e-14,5.600621043597466e-14,1.5325459383638642e-12
China,Activity,Production of electricity by petroleum and other oil derivatives,0.0,0.0,0.0,0.0,0.0
China,Activity,Production of electricity by solar photovoltaic,7.21396291470302e-14,1.1864797922385847e-17,8.106523491025845e-18,4.6722107448299245e-18,3.925012156913662e-14
China,Activity,Production of electricity by solar thermal,7.042612623563497e-15,2.4540267609548685e-18,1.4446783208538771e-18,8.515969505674336e-19,3.831800204179586e-15
China,Activity,"Production of electricity by tide, wave, ocean",1.521151818106054e-16,2.4386839176046657e-17,1.3289683307570531e-17,7.901257583798033e-18,8.323882780769242e-17
China,Activity,Production of electricity by wind,1.0194709182554436e-12,8.797901692913098e-15,5.156869284921959e-15,2.8539583419009373e-15,5.547893053737797e-13
China,Activity,Production of electricity nec,4.196367199002754e-14,1.6847240942596933e-14,9.1714229023312e-15,5.45400437522939e-15,2.3153210261693843e-14
China,Activity,Production of meat products nec,3.1899760623729213e-13,1.1118892323327195e-13,6.350935095135332e-14,3.970087917277107e-14,1.7774414833149404e-13
China,Activity,Production of offshore wind plants,0.0,0.0,0.0,0.0,0.0
China,Activity,Production of onshore wind plants,0.0,0.0,0.0,0.0,0.0
China,Activity,Production of photovoltaic plants,0.0,0.0,0.0,0.0,0.0
China,Activity,Public administration and defence; compulsory social security (75),6.975587602467855e-13,3.0862118116977603e-13,1.6255769490755336e-13,1.0319742929912687e-13,3.9048729891084743e-13
China,Activity,"Publishing, printing and reproduction of recorded media (22)",2.9760922914527417e-12,1.6223920775605587e-12,8.496078574949711e-13,5.485007097373522e-13,1.6696687317897812e-12
China,Activity,Pulp,3.5508727160105213e-15,1.7085511586826014e-15,9.097188308096525e-16,5.876678396741614e-16,1.987638692346228e-15
China,Activity,Quarrying of sand and clay,1.971707114154289e-12,2.593108412983e-13,1.407751029118398e-13,8.688658048745739e-14,1.0797175062427134e-12
China,Activity,Quarrying of stone,1.6481737978452513e-12,8.348393686632355e-14,4.726042156984358e-14,2.7913344611315463e-14,8.988861728538201e-13
China,Activity,Raw milk,1.203249535294225e-13,3.2673744439897873e-14,1.8342668626078962e-14,1.1286103278157629e-14,6.649024691979738e-14
China,Activity,Re-processing of ash into clinker,0.0,0.0,0.0,0.0,0.0
China,Activity,Re-processing of secondary aluminium into new aluminium,0.0,0.0,0.0,0.0,0.0
China,Activity,Re-processing of secondary construction material into aggregates,0.0,0.0,0.0,0.0,0.0
China,Activity,Re-processing of secondary copper into new copper,0.0,0.0,0.0,0.0,0.0
China,Activity,Re-processing of secondary glass into new glass,0.0,0.0,0.0,0.0,0.0
China,Activity,"Re-processing of secondary lead into new lead, zinc and tin",0.0,0.0,0.0,0.0,0.0
China,Activity,Re-processing of secondary other non-ferrous metals into new other non-ferrous metals,0.0,0.0,0.0,0.0,0.0
China,Activity,Re-processing of secondary paper into new pulp,6.5031042970636494e-15,2.4260674668229306e-17,1.3317959068468378e-17,7.911449532775096e-18,3.53868941825306e-15
China,Activity,Re-processing of secondary plastic into new plastic,0.0,0.0,0.0,0.0,0.0
China,Activity,Re-processing of secondary preciuos metals into new preciuos metals,0.0,0.0,0.0,0.0,0.0
China,Activity,Re-processing of secondary steel into new steel,0.0,0.0,0.0,0.0,0.0
China,Activity,Re-processing of secondary wood material into new wood material,0.0,0.0,0.0,0.0,0.0
China,Activity,Real estate activities (70),5.128804627993928e-13,1.9502507256572498e-13,1.0210941345911003e-13,6.407560360503231e-14,2.85256923921947e-13
China,Activity,"Recreational, cultural and sporting activities (92)",3.6485080643765294e-13,1.3447161622917166e-13,7.074727833285481e-14,4.3426668755821484e-14,2.015287563852875e-13
China,Activity,Recycling of bottles by direct reuse,0.0,0.0,0.0,0.0,0.0
China,Activity,Recycling of waste and scrap,9.899523030949674e-12,3.0683270940116466e-12,1.5772535742361898e-12,9.54827906235113e-13,5.4367191129474984e-12
China,Activity,Renting of machinery and equipment without operator and of personal and household goods (71),8.229777250373662e-14,6.727976074080169e-14,3.340514341743112e-14,2.0568108359370234e-14,4.588228895374236e-14
China,Activity,Research and development (73),6.932129229636216e-14,1.0471417504353672e-13,5.3722570368411966e-14,3.4970628283286807e-14,4.069561611002504e-14
China,Activity,Retail sale of automotive fuel,2.2098049709380464e-13,1.081653454569803e-13,6.628915625612219e-14,4.3143369010622876e-14,1.8031915809758413e-13
China,Activity,"Retail trade, except of motor vehicles and motorcycles; repair of personal and household goods (52)",1.2237348018909186e-11,5.257834289759282e-12,3.0000286921758756e-12,1.9181298265806694e-12,7.490341794378093e-12
China,Activity,"Sale, maintenance, repair of motor vehicles, motor vehicles parts, motorcycles, motor cycles parts and accessoiries",0.0,0.0,0.0,0.0,0.0
China,Activity,Sea and coastal water transport,4.197372435603831e-11,6.803560743638682e-13,8.633272019866536e-13,3.9283797633910647e-13,2.2898609462751832e-11
China,Activity,Steam and hot water supply,1.55907075265426e-13,7.335692565549437e-14,3.920683310842841e-14,2.3869491121203262e-14,8.644185334879179e-14
China,Activity,Sugar refining,4.861577344206528e-16,1.679343080086569e-16,9.192586262697403e-17,5.666541422597182e-17,2.6950252160448626e-16
China,Activity,Supporting and auxiliary transport activities; activities of travel agencies (63),6.163794963852503e-12,2.5670278036279663e-12,1.4060034698278582e-12,8.537430059869603e-13,3.421308825000188e-12
China,Activity,"Tanning and dressing of leather; manufacture of luggage, handbags, saddlery, harness and footwear (19)",1.218272799649651e-12,9.235072370017283e-13,5.669860554944853e-13,3.6253602874273087e-13,7.072362627945726e-13
China,Activity,Transmission of electricity,3.679991458031225e-15,1.4300070660026882e-15,7.738231270491904e-16,4.603929755484794e-16,2.0285346508261517e-15
China,Activity,Transport via pipelines,1.6320620315012692e-13,4.805341392597942e-14,2.888894752563158e-14,1.6938976961077315e-14,9.028734727717916e-14
China,Activity,Transport via railways,6.086384952165735e-13,3.2833573546301484e-13,1.7286879527981297e-13,1.0576996243435217e-13,3.3870242892504506e-13
China,Activity,"Waste water treatment, food",7.538846765228163e-13,1.5429978884064784e-13,8.437241420862635e-14,5.1466769856671914e-14,4.1409343522082875e-13
China,Activity,"Waste water treatment, other",1.4251825985884259e-12,2.906491581976775e-13,1.5865455108609474e-13,9.679411729472245e-14,7.827299550471247e-13
China,Activity,"Wholesale trade and commission trade, except of motor vehicles and motorcycles (51)",8.593906522173049e-12,4.507319110041123e-12,2.537502369374532e-12,1.598755174878222e-12,4.954525418309902e-12
China,Activity,"Wool, silk-worm cocoons",5.7848905218341e-14,2.041664906465931e-14,1.1409223471471091e-14,7.123691873289736e-15,3.217902836470666e-14
