RoW,Activity,Sugar refining,8.61381057885032e-06,6.965115833164948e-06,6.0845930510490005e-06,3.57674056485796e-06,5.061944532110242e-06
RoW,Activity,Supporting and auxiliary transport activities; activities of travel agencies (63),0.0004279691353492555,0.0004502300987541877,0.0005699067837233154,0.0002928754777320693,0.0003548403368205503
RoW,Activity,"Tanning and dressing of leather; manufacture of luggage, handbags, saddlery, harness and footwear (19)",1.0652387405612212e-05,1.1548500961278069e-05,1.0195258790080804e-05,5.767810943015986e-06,6.475343086244946e-06
RoW,Activity,Transmission of electricity,2.9298914747817152e-05,2.7511274030335632e-05,2.426944015774168e-05,1.5212129508539293e-05,1.7877481223769812e-05
RoW,Activity,Transport via pipelines,0.0009072765112256309,0.0007250395998604847,0.0006776322563804086,0.0005819717049613634,0.0008241238987328469
RoW,Activity,Transport via railways,0.00021421094997404607,0.00015459214794722866,0.00014275788282291915,8.641813661216011e-05,0.0001364792962243137
RoW,Activity,"Waste water treatment, food",1.0473956421928855e-06,1.0643947240116108e-06,9.562771973751634e-07,5.4863558043467e-07,6.681871294599313e-07
RoW,Activity,"Waste water treatment, other",1.7169587726420111e-06,1.699526941464944e-06,1.5043932426148057e-06,8.647365560729168e-07,1.1016103369721753e-06
RoW,Activity,"Wholesale trade and commission trade, except of motor vehicles and motorcycles (51)",0.00013418823985609135,0.00013937797493558595,0.00012422720079254018,0.0001121068337041006,0.00020921796420421494
RoW,Activity,"Wool, silk-worm cocoons",6.402898844777533e-05,5.7320469669914424e-05,5.120206010416295e-05,3.021441156567115e-05,3.822268588340648e-05
USA,Activity,Activities auxiliary to financial intermediation (67),9.471148991722349e-06,4.49556912149425e-06,3.929645220892901e-06,2.649733060768918e-06,5.03494723823711e-06
USA,Activity,Activities of membership organisation n.e.c. (91),7.575524059330775e-07,3.873474248519378e-07,3.486941487503881e-07,2.5399934678458654e-07,4.220045046463909e-07
USA,Activity,Air transport (62),0.0004910778077051066,0.00023238389937565594,0.00021844520105170553,0.00015493932292855205,0.00027844801663463403
USA,Activity,Aluminium production,8.086784407658602e-05,1.9371779107225165e-05,1.4516178422785738e-05,6.6060078028251965e-06,3.668950687656389e-05
USA,Activity,Animal products nec,5.887786719492131e-07,6.961246603096588e-07,6.201112393984365e-07,3.4906245098787073e-07,3.758757101476293e-07
USA,Activity,"Biogasification of food waste, incl. land application",0.0,0.0,0.0,0.0,0.0
USA,Activity,"Biogasification of paper, incl. land application",0.0,0.0,0.0,0.0,0.0
USA,Activity,"Biogasification of sewage slugde, incl. land application",9.140752472653902e-07,3.0248002234762536e-07,2.6576786618765535e-07,1.540433310402858e-07,4.4706498468731986e-07
USA,Activity,Casting of metals,3.3976327700195485e-05,2.178398467235083e-05,1.827355398335409e-05,9.929044266343747e-06,1.763013418889487e-05
USA,Activity,Cattle farming,5.921552679353009e-06,4.304440706581543e-06,3.859834438317681e-06,2.282194793054877e-06,3.30867618315817e-06
USA,Activity,Chemicals nec,0.002712621488842831,0.0008992311436073697,0.0008132431053049958,0.0004901660944506985,0.0013177748296416608
USA,Activity,"Collection, purification and distribution of water (41)",3.112450848081767e-07,7.843560855892672e-08,7.316977099706289e-08,4.3478667203330634e-08,1.5042689926158151e-07
USA,Activity,"Composting of food waste, incl. land application",7.372081189672286e-08,6.284024664033255e-08,7.179997270964938e-08,6.283656216705942e-08,5.335728814933032e-08
USA,Activity,"Composting of paper and wood, incl. land application",2.963113400680353e-07,8.300518156804175e-08,7.449183409212723e-08,4.607037937644261e-08,1.452838611801654e-07
USA,Activity,Computer and related activities (72),6.180702042311039e-06,3.663360740294651e-06,3.2846312585033645e-06,2.414880867530074e-06,3.6573964192211694e-06
USA,Activity,Construction (45),1.9247092328963726e-05,2.2651806506112103e-06,2.381776500613683e-06,1.909275040249561e-06,9.188367454071745e-06
USA,Activity,Copper production,7.461570118665366e-05,8.66720572207786e-05,6.406974731996894e-05,2.888419013348807e-05,3.799848590505462e-05
USA,Activity,Cultivation of cereal grains nec,1.4308554893600972e-05,9.588224632985682e-06,8.446951150913765e-06,4.890050136705504e-06,7.870229816261613e-06
USA,Activity,Cultivation of crops nec,1.9431916352591796e-05,8.075786998398092e-06,6.952070015304234e-06,4.035828834476235e-06,9.631727928990465e-06
USA,Activity,Cultivation of oil seeds,3.0391986178082326e-05,2.2512013869728754e-05,1.7674743735006507e-05,9.730299122992714e-06,1.5971793952992896e-05
USA,Activity,Cultivation of paddy rice,1.5873608262716717e-05,8.817162681586091e-06,7.816444203499072e-06,4.649968020458719e-06,8.296911154887447e-06
USA,Activity,Cultivation of plant-based fibers,2.2067198939070096e-05,1.9493760171794762e-05,1.6722410821706833e-05,9.293832024057547e-06,1.2000151158734555e-05
USA,Activity,"Cultivation of sugar cane, sugar beet",4.01048315241833e-06,2.050951828470594e-06,1.7940860623368713e-06,1.0348208250252764e-06,2.091355011416994e-06
USA,Activity,"Cultivation of vegetables, fruit, nuts",2.0106373436664492e-06,1.3376131060322355e-06,1.1784379074254668e-06,6.853680537920092e-07,1.095316588514423e-06
USA,Activity,Cultivation of wheat,1.4184121174275212e-05,1.1910794038574366e-05,1.0754656030030906e-05,6.303396139370515e-06,8.157998964553827e-06
USA,Activity,Distribution and trade of electricity,6.061234463855462e-07,1.5200285285943415e-07,1.376970813606533e-07,8.321191071252991e-08,2.9269932507819925e-07
USA,Activity,Education (80),2.762241492890279e-07,7.60213186154163e-08,6.981108820445173e-08,8.788508397068784e-08,1.526982763244323e-07
USA,Activity,Extra-territorial organizations and bodies,0.0,0.0,0.0,0.0,0.0
USA,Activity,"Extraction of crude petroleum and services related to crude oil extraction, excluding surveying",0.00044540417481564535,0.00029761827080318005,0.0002867757411153424,0.0003306008219930395,0.00029459524872334594
USA,Activity,"Extraction of natural gas and services related to natural gas extraction, excluding surveying",0.00010964861081812436,6.632524340751463e-05,6.24755787519354e-05,6.2989161825176e-05,6.91449571692591e-05
USA,Activity,"Extraction, liquefaction, and regasification of other petroleum and gaseous materials",2.8272404106097343e-10,4.6562253808524614e-11,4.325827231888999e-11,3.528113565553291e-11,1.3430174984085669e-10
USA,Activity,"Financial intermediation, except insurance and pension funding (65)",1.356527513182012e-05,9.690773135922628e-06,9.297897777082383e-06,7.945941574909463e-06,9.145636189292798e-06
USA,Activity,"Fishing, operating of fish hatcheries and fish farms; service activities incidental to fishing (05)",9.37427042128293e-07,7.663204405044923e-07,6.618481740408986e-07,3.712170255758416e-07,5.186260072080717e-07
USA,Activity,"Forestry, logging and related service activities (02)",1.086784314751934e-05,4.406763946466778e-06,3.954077083712777e-06,2.0837316986654486e-06,5.332843751195346e-06
USA,Activity,Health and social work (85),9.92599235401208e-08,1.536715252931414e-08,1.3627270685874388e-08,1.4462352822720586e-08,4.949828415148564e-08
USA,Activity,Hotels and restaurants (55),1.1425435658262666e-05,5.27781648554877e-06,4.636087573655655e-06,3.0278070360786806e-06,6.135823253779417e-06
USA,Activity,Incineration of waste: Food,2.067960521165304e-07,1.1304756652889467e-07,1.0502720375816462e-07,6.119935478926209e-08,1.0918923611188646e-07
USA,Activity,Incineration of waste: Metals and Inert materials,6.566355895188721e-06,5.853888077413701e-06,7.454562493328279e-06,4.442418982017129e-06,4.897104981079247e-06
USA,Activity,Incineration of waste: Oil/Hazardous waste,6.402119191653228e-07,6.271368085100796e-07,6.592505456832591e-07,4.20383570442694e-07,3.9916959837868537e-07
USA,Activity,Incineration of waste: Paper,5.315623863041012e-07,2.404538728599116e-07,2.317056344861653e-07,1.32442181844125e-07,2.751209750076373e-07
USA,Activity,Incineration of waste: Plastic,1.0061127028016714e-05,2.9700323879482176e-06,2.6858586183089625e-06,1.6389981198114152e-06,4.942895164276232e-06
USA,Activity,Incineration of waste: Textiles,1.855179256646439e-06,1.2682447508145237e-06,1.2587688053789555e-06,6.257619173294643e-07,1.0119044099869077e-06
USA,Activity,Incineration of waste: Wood,1.4769600251112018e-07,6.719063931909614e-08,7.224979150629895e-08,6.93320641928354e-08,8.489032552723145e-08
USA,Activity,Inland water transport,2.7087779228567447e-05,2.8575168483081985e-05,2.238422872956766e-05,1.1004213519688589e-05,1.4356224868305506e-05
USA,Activity,"Insurance and pension funding, except compulsory social security (66)",2.793618125392237e-06,2.1540462132068326e-06,2.0294947024781385e-06,1.6179654099533635e-06,1.9248408838897373e-06
USA,Activity,Landfill of waste: Food,2.70510787343622e-07,9.455713795687038e-08,8.886719106027577e-08,5.565839759655794e-08,1.3828400785923736e-07
USA,Activity,Landfill of waste: Inert/metal/hazardous,4.103858869921205e-07,1.6839721488533255e-07,1.5418248366499853e-07,8.907181886117733e-08,2.06711041061708e-07
USA,Activity,Landfill of waste: Paper,3.2474733429115e-07,1.1571099497755764e-07,1.0838755392696629e-07,6.362223190403888e-08,3.417934399348115e-07
USA,Activity,Landfill of waste: Plastic,2.563711286375689e-07,7.916280362184988e-08,7.087045821386147e-08,4.209432482166613e-08,1.2604457246393114e-07
USA,Activity,Landfill of waste: Textiles,1.0156009501015946e-07,3.582878213776924e-08,3.5536282844427975e-08,2.0146079635146123e-08,5.182574510678956e-08
USA,Activity,Landfill of waste: Wood,1.3391889269968577e-07,4.6183871777148534e-08,4.20455490327682e-08,2.5006778991049505e-08,6.718857480997038e-08
USA,Activity,"Lead, zinc and tin production",1.719590536861559e-06,3.0858454719361934e-06,3.123090182190584e-06,1.3594910581323962e-06,1.0651648192879912e-06
USA,Activity,Manufacture of basic iron and steel and of ferro-alloys and first products thereof,0.00012518084523123233,0.00010556344662671482,9.190475967813858e-05,4.364161099928208e-05,6.448261155671647e-05
USA,Activity,Manufacture of beverages,1.0941171553048843e-06,1.2265267130166214e-06,1.2039484525333521e-06,7.190247903516719e-07,7.978324135169021e-07
USA,Activity,"Manufacture of bricks, tiles and construction products, in baked clay",5.423528888524608e-05,3.6960487230518576e-06,3.078394660488392e-06,1.4716963371109928e-06,2.4123743847859128e-05
USA,Activity,"Manufacture of cement, lime and plaster",9.747580380754766e-05,1.493312492324001e-05,1.5056889324084829e-05,8.88769738506364e-06,4.561865826893458e-05
USA,Activity,Manufacture of ceramic goods,2.747628277353351e-05,2.995021113226913e-06,3.561597410411868e-06,2.1149917967642325e-06,1.2981623413506944e-05
USA,Activity,Manufacture of coke oven products,2.0074401807365478e-06,2.075038983022592e-06,1.853282779645681e-06,1.231264629459136e-06,1.197202892808831e-06
USA,Activity,Manufacture of electrical machinery and apparatus n.e.c. (31),3.295740044470034e-05,2.5767201199167243e-05,1.9243672921326228e-05,1.3123282508323956e-05,1.8840683010867403e-05
USA,Activity,"Manufacture of fabricated metal products, except machinery and equipment (28)",2.972844369662738e-05,1.8215318283526973e-05,1.6132860034858607e-05,8.05812507054451e-06,1.4951011414365929e-05
USA,Activity,Manufacture of fish products,1.8876145087391335e-06,1.8680381406382245e-06,1.7705433559238066e-06,9.704673907676807e-07,1.1568467910961601e-06
USA,Activity,Manufacture of furniture; manufacturing n.e.c. (36),5.508404538811794e-05,2.8656896672176333e-05,2.5270113335086216e-05,1.6218676891292454e-05,2.856528769610224e-05
USA,Activity,Manufacture of gas; distribution of gaseous fuels through mains,0.00011190878644805261,1.1361318328666226e-05,9.984591958875196e-06,6.034926876628429e-06,5.0771029486373133e-05
USA,Activity,Manufacture of glass and glass products,0.0038101443717329076,8.386139826323331e-05,6.238589982856963e-05,2.5092118829810784e-05,0.001675114801851721
USA,Activity,Manufacture of machinery and equipment n.e.c. (29),4.051798376614943e-05,2.4659593998158747e-05,2.0986129671587455e-05,1.1235796021960765e-05,2.0726810236100693e-05
USA,Activity,"Manufacture of medical, precision and optical instruments, watches and clocks (33)",7.340003885774965e-06,1.052414034200033e-05,7.606618424351499e-06,4.420402329416568e-06,4.469871243875097e-06
USA,Activity,"Manufacture of motor vehicles, trailers and semi-trailers (34)",3.794906994301504e-05,1.9685448492310732e-05,1.737718155314947e-05,9.252975702402354e-06,1.9831391689817686e-05
USA,Activity,Manufacture of office machinery and computers (30),3.2924599791326793e-06,4.283391804637948e-06,3.416036254342559e-06,2.0200926232565912e-06,2.0685956571629562e-06
USA,Activity,Manufacture of other non-metallic mineral products n.e.c.,0.0003522724356281274,1.8891940483873782e-05,2.2258449966096483e-05,9.25930773307864e-06,0.00015663440452865887
USA,Activity,Manufacture of other transport equipment (35),3.309578903978842e-05,2.8492397737537967e-05,2.491901491822385e-05,1.2779867528583812e-05,1.8642782021489064e-05
USA,Activity,"Manufacture of radio, television and communication equipment and apparatus (32)",1.4152334049411267e-05,1.5408919079382775e-05,1.0155519604368855e-05,6.009498699307728e-06,7.69245591814249e-06
USA,Activity,Manufacture of rubber and plastic products (25),1.1600720615128034e-05,5.546165092098915e-06,4.965954399526147e-06,2.6643465433964377e-06,5.8570380218347134e-06
USA,Activity,Manufacture of textiles (17),3.313407426234736e-05,1.6134664173518695e-05,1.4286508063863692e-05,8.102401581253785e-06,1.6794985422780605e-05
USA,Activity,Manufacture of tobacco products (16),2.3846468722856976e-07,2.7397826487986206e-07,2.1651006346075942e-07,1.112677238122535e-07,1.3296814647226288e-07
USA,Activity,Manufacture of wearing apparel; dressing and dyeing of fur (18),3.1195797734541545e-07,1.7850387678381662e-07,1.5410728537326272e-07,9.357325646461535e-08,1.6973994506526335e-07
USA,Activity,"Manufacture of wood and of products of wood and cork, except furniture; manufacture of articles of straw and plaiting materials (20)",3.966121086203064e-05,1.559463209850881e-05,1.5454818190192574e-05,7.745680538124905e-06,1.9528442029633315e-05
USA,Activity,"Manure treatment (biogas), storage and land application",0.0,0.0,0.0,0.0,0.0
USA,Activity,"Manure treatment (conventional), storage and land application",0.0,0.0,0.0,0.0,0.0
USA,Activity,Meat animals nec,1.1659878510293943e-08,5.5198802691449065e-09,5.1738659969586596e-09,2.969256968346407e-09,6.134879691260812e-09
USA,Activity,Mining of aluminium ores and concentrates,3.4408944360886946e-06,1.3047728590480794e-07,1.0073079878019421e-07,4.309202295708169e-08,1.5167458209227708e-06
USA,Activity,"Mining of chemical and fertilizer minerals, production of salt, other mining and quarrying n.e.c.",9.548857070771215e-05,5.847791680659639e-05,6.05686721208896e-05,2.5111428032331615e-05,4.621893750355252e-05
USA,Activity,Mining of coal and lignite; extraction of peat (10),0.0011530612669302573,8.949814957077383e-05,8.699013570963332e-05,6.035161360109801e-05,0.0005268619200080632
USA,Activity,Mining of copper ores and concentrates,8.317130887435412e-05,4.600764553046334e-05,3.4269129995969664e-05,1.5837377100728537e-05,3.94952859283107e-05
USA,Activity,Mining of iron ores,1.892597831365343e-05,1.081690292455922e-05,9.398730985770573e-06,4.448831127032276e-06,9.266550849759204e-06
USA,Activity,"Mining of lead, zinc and tin ores and concentrates",8.96454146977134e-06,9.781209463383892e-06,9.36188431668665e-06,4.115370054831888e-06,4.828168501739404e-06
USA,Activity,Mining of nickel ores and concentrates,0.0,0.0,0.0,0.0,0.0
USA,Activity,Mining of other non-ferrous metal ores and concentrates,2.6242780667526513e-06,2.620329907300712e-06,2.414942664787621e-06,1.1749156328886804e-06,1.4213793018171626e-06
USA,Activity,Mining of precious metal ores and concentrates,0.002053612633863043,0.00011912940869491602,9.449526004618503e-05,4.495076937001842e-05,0.0009116870344320051
USA,Activity,Mining of uranium and thorium ores (12),1.2490386865779284e-05,5.599352203422352e-06,4.748093262541169e-06,2.6087747349953848e-06,6.100556067296772e-06
USA,Activity,N-fertiliser,5.229920657019454e-06,1.423867904776205e-06,1.1782374735908888e-06,6.910483169872787e-07,2.465804124397752e-06
USA,Activity,Other business activities (74),0.00011601243805088113,6.129407187316971e-05,5.6116588388602864e-05,4.40012075140337e-05,6.746426000784166e-05
USA,Activity,Other land transport,9.740873015128348e-09,2.3843646610463126e-09,2.1761669151058034e-09,1.3806837186106516e-09,4.865979050236941e-09
USA,Activity,Other non-ferrous metal production,1.4037980736479307e-05,1.5368906047824328e-05,1.4051620158892145e-05,6.573490741578191e-06,7.436510840148801e-06
USA,Activity,Other service activities (93),4.6984825802162557e-07,1.9173505698455606e-07,1.7687063787983914e-07,1.2223535038674638e-07,2.4943381180975184e-07
USA,Activity,P- and other fertiliser,3.9086116518118475e-05,1.531690178870146e-05,1.3448334256925404e-05,8.89202885547852e-06,1.9360919145888166e-05
USA,Activity,Paper,0.00031933355521792945,9.243824306793683e-05,7.860667541418256e-05,4.580599987075468e-05,0.0001531202918287711
USA,Activity,Petroleum Refinery,0.0003600011397128562,0.00019368572683002428,0.00018852809375832923,0.0002318391882042378,0.00022931314141736857
USA,Activity,Pigs farming,2.8083103993714756e-06,1.5694583012571944e-06,1.363561927728703e-06,7.967394236010881e-07,1.4700280702524043e-06
USA,Activity,"Plastics, basic",5.306839834779798e-05,4.0687673944437304e-05,3.333341087322474e-05,1.8111959006970475e-05,2.8136208510119147e-05
USA,Activity,Post and telecommunications (64),1.727584744563123e-05,8.644549854276479e-06,7.989452515071473e-06,6.178675130020156e-06,9.92017316588402e-06
USA,Activity,Poultry farming,2.180127948351038e-06,1.449346444150736e-06,1.2998419461011558e-06,7.717815616923711e-07,1.1897155334820877e-06
USA,Activity,Precious metals production,0.0007256874211852588,3.592921517215508e-05,2.8967937234485075e-05,1.3762986672787386e-05,0.00032174365998163525
USA,Activity,Private households with employed persons (95),3.218225092656233e-07,3.9105930698806577e-07,3.3037441351204045e-07,2.058212542752369e-07,2.0439250446608054e-07
USA,Activity,Processed rice,2.3741904827551566e-06,2.1063711876714376e-06,1.920306936848385e-06,1.1259554986987878e-06,1.3788855075601953e-06
USA,Activity,Processing of Food products nec,7.715388167276042e-06,3.738520926493285e-06,3.2831675758684777e-06,1.9374632545530795e-06,3.989370963924847e-06
USA,Activity,Processing of dairy products,8.688994560513864e-06,5.255417992736454e-06,3.93089445385941e-06,2.242981087479938e-06,4.452894859275224e-06
USA,Activity,Processing of meat cattle,1.7100008598611204e-06,1.1989851105833927e-06,1.0938274879731454e-06,6.559075831048101e-07,9.619040438829448e-07
USA,Activity,Processing of meat pigs,6.862075730050926e-07,3.95078701613204e-07,3.420681489853617e-07,1.99909671416735e-07,3.6061476028458645e-07
USA,Activity,Processing of meat poultry,2.7525683402243673e-07,1.7131319571799593e-07,1.5332926846762638e-07,9.429829315052692e-08,1.522342492519092e-07
USA,Activity,Processing of nuclear fuel,7.75712549428245e-09,8.860851865027267e-09,8.56040733310378e-09,4.070657284086123e-09,4.4303980284929485e-09
USA,Activity,Processing vegetable oils and fats,9.10859136848468e-06,5.349702779759889e-06,4.875489667888506e-06,2.86720273329708e-06,4.821013468812856e-06
USA,Activity,Production of electricity by Geothermal,6.770726827621425e-07,3.0446648365293005e-09,2.7365662080349734e-09,1.5732622352311613e-09,2.9757228092659237e-07
USA,Activity,Production of electricity by biomass and waste,0.0,0.0,0.0,0.0,0.0
USA,Activity,Production of electricity by coal,0.09677765703697726,0.001144902870786248,0.0010035984768670921,0.0005746183634918133,0.04262637189172179
USA,Activity,Production of electricity by gas,0.11127521246535386,0.0004980544314841563,0.0004375366216466089,0.0002499196308046856,0.04889509764064543
USA,Activity,Production of electricity by hydro,0.0,0.0,0.0,0.0,0.0
USA,Activity,Production of electricity by nuclear,3.2674520839045394e-05,2.1556305519844235e-07,1.8909145929914674e-07,1.0778443558206513e-07,1.4367174624679778e-05
USA,Activity,Production of electricity by petroleum and other oil derivatives,0.0014341864687474248,6.861737904152471e-06,6.178681309476526e-06,3.6072828048290886e-06,0.0006304068120981739
USA,Activity,Production of electricity by solar photovoltaic,0.0,0.0,0.0,0.0,0.0
USA,Activity,Production of electricity by solar thermal,0.0,0.0,0.0,0.0,0.0
USA,Activity,"Production of electricity by tide, wave, ocean",0.0,0.0,0.0,0.0,0.0
USA,Activity,Production of electricity by wind,0.0,0.0,0.0,0.0,0.0
USA,Activity,Production of electricity nec,9.084825546652394e-06,4.3367601784746965e-08,3.8837028470520345e-08,2.2448696308864232e-08,3.9936993084622394e-06
USA,Activity,Production of meat products nec,2.2975680414873003e-05,1.3221826143064646e-05,1.1324232196815102e-05,6.574509442633039e-06,1.1827593161860392e-05
USA,Activity,Production of offshore wind plants,0.0,0.0,0.0,0.0,0.0
USA,Activity,Production of onshore wind plants,0.0,0.0,0.0,0.0,0.0
USA,Activity,Production of photovoltaic plants,0.0,0.0,0.0,0.0,0.0
USA,Activity,Public administration and defence; compulsory social security (75),2.6019479274677535e-05,1.641980565759453e-06,1.4583856345749302e-06,9.163688853639977e-07,1.1757327512707483e-05
USA,Activity,"Publishing, printing and reproduction of recorded media (22)",2.6212553353302452e-05,1.451288736852552e-05,1.3162560747793367e-05,1.0257244624231499e-05,1.536991554373159e-05
USA,Activity,Pulp,1.3170996443669687e-05,7.73571207602041e-06,5.833101657092286e-06,3.323299777635958e-06,6.611761100587633e-06
USA,Activity,Quarrying of sand and clay,0.00017290703805536192,1.9625679156305436e-05,1.7369442813443773e-05,8.339823174870881e-06,7.799424478839013e-05
USA,Activity,Quarrying of stone,3.1806362498838604e-05,5.471266847441873e-06,6.194831163449795e-06,3.0885343860973785e-06,1.4756199731988107e-05
USA,Activity,Raw milk,1.5089672604163856e-06,9.12237547073001e-07,6.825157155728353e-07,3.895398450861948e-07,7.733413792298541e-07
USA,Activity,Re-processing of ash into clinker,0.0,0.0,0.0,0.0,0.0
USA,Activity,Re-processing of secondary aluminium into new aluminium,0.0,0.0,0.0,0.0,0.0
USA,Activity,Re-processing of secondary construction material into aggregates,0.0,0.0,0.0,0.0,0.0
USA,Activity,Re-processing of secondary copper into new copper,0.0,0.0,0.0,0.0,0.0
USA,Activity,Re-processing of secondary glass into new glass,0.0,0.0,0.0,0.0,0.0
USA,Activity,"Re-processing of secondary lead into new lead, zinc and tin",0.0,0.0,0.0,0.0,0.0
USA,Activity,Re-processing of secondary other non-ferrous metals into new other non-ferrous metals,0.0,0.0,0.0,0.0,0.0
USA,Activity,Re-processing of secondary paper into new pulp,0.0,0.0,0.0,0.0,0.0
USA,Activity,Re-processing of secondary plastic into new plastic,0.0,0.0,0.0,0.0,0.0
USA,Activity,Re-processing of secondary preciuos metals into new preciuos metals,0.0,0.0,0.0,0.0,0.0
USA,Activity,Re-processing of secondary steel into new steel,0.0,0.0,0.0,0.0,0.0
USA,Activity,Re-processing of secondary wood material into new wood material,0.0,0.0,0.0,0.0,0.0
USA,Activity,Real estate activities (70),6.452572447907439e-06,3.8095002679697336e-06,3.614341663936526e-06,2.583987418035908e-06,3.889595854215036e-06
USA,Activity,"Recreational, cultural and sporting activities (92)",3.6817311829577716e-06,1.8846038813427728e-06,1.7293944641892872e-06,1.337755900167274e-06,2.122945002032019e-06
USA,Activity,Recycling of bottles by direct reuse,0.0,0.0,0.0,0.0,0.0
USA,Activity,Recycling of waste and scrap,0.0003124316999260566,0.00010203937755462408,8.715323101460738e-05,4.783118037033907e-05,0.00014957214197275866
USA,Activity,Renting of machinery and equipment without operator and of personal and household goods (71),1.2056987577561236e-05,5.628142383790666e-06,5.134862154262589e-06,3.4557034329647108e-06,6.5081274977732976e-06
USA,Activity,Research and development (73),8.649950070971139e-06,1.865429874719269e-05,1.4175258758491973e-05,6.680818448448088e-06,4.901904520832152e-06
USA,Activity,Retail sale of automotive fuel,2.469651717335516e-07,2.3025452336811375e-07,2.586748108010624e-07,1.887204407621306e-07,2.406657704782571e-07
USA,Activity,"Retail trade, except of motor vehicles and motorcycles; repair of personal and household goods (52)",1.0137451359018803e-06,2.2809189030586196e-07,2.0608673430821874e-07,1.3547832152149893e-07,5.510683519850866e-07
USA,Activity,"Sale, maintenance, repair of motor vehicles, motor vehicles parts, motorcycles, motor cycles parts and accessoiries",1.3635676257007584e-05,2.742598451660992e-06,2.3598521988190394e-06,1.3829781086596582e-06,6.39744999033142e-06
USA,Activity,Sea and coastal water transport,7.660650521446223e-05,8.897972178345447e-05,0.00021745091724739902,6.924033421213329e-05,6.981999435439826e-05
USA,Activity,Steam and hot water supply,0.0003478689573729111,0.0001021266266997021,9.323921577364927e-05,5.908827752582322e-05,0.00017140339684316115
USA,Activity,Sugar refining,5.4905588597231e-07,3.546909121549948e-07,3.1895910504616025e-07,1.8777408407171673e-07,3.22278562675305e-07
USA,Activity,Supporting and auxiliary transport activities; activities of travel agencies (63),4.3521166495501135e-05,1.7749695217575134e-05,2.5070554297145447e-05,1.1783605109955126e-05,2.436700624537458e-05
USA,Activity,"Tanning and dressing of leather; manufacture of luggage, handbags, saddlery, harness and footwear (19)",1.958225525549422e-06,1.705676345469288e-06,1.2688698330650265e-06,6.901731887845316e-07,1.0243962002061569e-06
USA,Activity,Transmission of electricity,1.1068562600411856e-05,2.31218304912312e-06,2.0369154971257824e-06,1.1705853504052196e-06,5.195527110124149e-06
