RoW,Activity,"Sale, maintenance, repair of motor vehicles, motor vehicles parts, motorcycles, motor cycles parts and accessoiries",3.921750252115571e-05,3.709305866219309e-05,3.481856893709795e-05,1.8514027074725033e-05,3.23967525684702e-05
RoW,Activity,Sea and coastal water transport,0.010343661732178523,0.003931945858661637,0.008295809161159573,0.0020705346351662895,0.004057068613004013
RoW,Activity,Steam and hot water supply,0.0037965414036753306,0.003626116174865089,0.003238951199328611,0.0017043063206153505,0.0018474772090646705
RoW,Activity,Sugar refining,9.92706701347539e-06,8.644560293849225e-06,7.650165155175151e-06,3.503426298942314e-06,4.5491432764444095e-06
RoW,Activity,Supporting and auxiliary transport activities; activities of travel agencies (63),0.0007026920386367897,0.0006975942125441665,0.0008600462811989546,0.00035423509228284033,0.00037753959598090783
RoW,Activity,"Tanning and dressing of leather; manufacture of luggage, handbags, saddlery, harness and footwear (19)",1.3671166841998877e-05,1.4317574595761193e-05,1.2245906026422094e-05,5.243255730855972e-06,6.133666515908459e-06
RoW,Activity,Transmission of electricity,3.434780407636494e-05,3.296477004282195e-05,2.8749135781901885e-05,1.563788272729033e-05,1.6684308234001184e-05
RoW,Activity,Transport via pipelines,0.0013014587395583643,0.001160421398496716,0.0011502198571927953,0.000873900280082,0.001000112673041557
RoW,Activity,Transport via railways,0.0001974570056434302,0.0002029262765928907,0.0002001540004183279,0.00010277118389326032,0.00011807259725531238
RoW,Activity,"Waste water treatment, food",1.4031863181784096e-06,1.5002564178356027e-06,1.3332811376496079e-06,6.313063228747537e-07,6.823232278775349e-07
RoW,Activity,"Waste water treatment, other",2.2451443292812794e-06,2.072429326603369e-06,1.8524775096943664e-06,8.741771745700227e-07,1.0403051521572223e-06
RoW,Activity,"Wholesale trade and commission trade, except of motor vehicles and motorcycles (51)",0.0001847422704079703,0.00018138269056560443,0.00015923644052613303,8.159611541694687e-05,0.00012299578066954361
RoW,Activity,"Wool, silk-worm cocoons",5.5248085242714604e-05,5.5530170081595846e-05,4.959631394457873e-05,2.9648409211494522e-05,3.150085005845945e-05
USA,Activity,Activities auxiliary to financial intermediation (67),1.3984983813761418e-05,6.710498698815479e-06,5.423381830212928e-06,2.94474768181221e-06,5.565337970978675e-06
USA,Activity,Activities of membership organisation n.e.c. (91),1.2073620518186414e-06,5.530775437611261e-07,4.935808972375508e-07,2.8823385891234183e-07,5.046865113839044e-07
USA,Activity,Air transport (62),0.0008703449692440153,0.0007854135997397808,0.0006235229195748026,0.0003339666359520603,0.00040929885429450406
USA,Activity,Aluminium production,0.00011173569283387644,3.798667834296456e-05,2.6102741116706207e-05,8.539648748296671e-06,3.7543500037868855e-05
USA,Activity,Animal products nec,8.627277933937282e-07,8.250502532701938e-07,7.47399774979212e-07,3.2981138348623016e-07,3.8960737068522646e-07
USA,Activity,"Biogasification of food waste, incl. land application",0.0,0.0,0.0,0.0,0.0
USA,Activity,"Biogasification of paper, incl. land application",0.0,0.0,0.0,0.0,0.0
USA,Activity,"Biogasification of sewage slugde, incl. land application",1.8085147763282125e-06,6.141626505014495e-07,5.341967631604469e-07,2.1622881156324292e-07,6.4499899815502e-07
USA,Activity,Casting of metals,4.855313882860286e-05,3.357550381411069e-05,2.8036230182413244e-05,1.2160879831992742e-05,1.9658438735395155e-05
USA,Activity,Cattle farming,6.6141355550536555e-06,3.605862058685434e-06,3.2300571386766704e-06,1.5107314425351077e-06,2.6323841383594607e-06
USA,Activity,Chemicals nec,0.003723985421316183,0.001216827245700634,0.0011233386585637571,0.0005137581109050249,0.0013436254490180762
USA,Activity,"Collection, purification and distribution of water (41)",4.446940017646645e-07,1.250175542122713e-07,1.1365043516780881e-07,5.315750513241237e-08,1.611828717718713e-07
USA,Activity,"Composting of food waste, incl. land application",2.4823341802252785e-07,1.4486172225919046e-07,1.4267301303168683e-07,6.288513578530036e-08,9.962941789249858e-08
USA,Activity,"Composting of paper and wood, incl. land application",3.96761227395713e-07,1.2135535891327295e-07,1.1397076267898696e-07,5.175469030122722e-08,1.4560321578061458e-07
USA,Activity,Computer and related activities (72),8.042828157709127e-06,4.367187510401933e-06,3.845974057616066e-06,2.335703260140845e-06,3.6596539032384907e-06
USA,Activity,Construction (45),2.063927169122286e-05,2.549676284772793e-06,2.536529129144721e-06,1.479937513438817e-06,7.309696232037757e-06
USA,Activity,Copper production,0.000108104327515916,0.0001553341921840249,0.00010210731208335371,3.3211144764330214e-05,4.1599199969037036e-05
USA,Activity,Cultivation of cereal grains nec,1.6846043059503606e-05,8.113999282088002e-06,6.9130867074852864e-06,3.057790257879657e-06,6.405796959486396e-06
USA,Activity,Cultivation of crops nec,2.8238352006079632e-05,1.0860504073391288e-05,9.694697723759571e-06,4.485489512859144e-06,1.049275928185229e-05
USA,Activity,Cultivation of oil seeds,7.652440874489968e-05,6.053258409234105e-05,3.436700528052289e-05,1.2031139313801406e-05,2.6807304064840302e-05
USA,Activity,Cultivation of paddy rice,3.2244563624462896e-05,2.062405954018872e-05,1.8553420070981943e-05,8.523053718075811e-06,1.3571467857152796e-05
USA,Activity,Cultivation of plant-based fibers,4.984726514480099e-05,3.257546274596064e-05,2.2451617126833274e-05,8.43183449727448e-06,1.8031678746802897e-05
USA,Activity,"Cultivation of sugar cane, sugar beet",2.3408679815522796e-06,1.4148068245115041e-06,1.2521368536591943e-06,5.730676402085392e-07,9.743233395272378e-07
USA,Activity,"Cultivation of vegetables, fruit, nuts",2.2700890253967494e-06,1.6649236503798864e-06,1.4926629096162624e-06,6.880632354843207e-07,9.833286586895115e-07
USA,Activity,Cultivation of wheat,3.282530402852265e-05,2.7273202387428784e-05,2.4693368951242464e-05,1.1301308854519636e-05,1.4765526427521082e-05
USA,Activity,Distribution and trade of electricity,9.747969265945456e-07,2.199323113560186e-07,1.919547032768242e-07,9.420653638256055e-08,3.485181290258561e-07
USA,Activity,Education (80),2.222674883385756e-07,6.69448011294182e-08,5.985575871453281e-08,4.399413120454603e-08,8.999858956303545e-08
USA,Activity,Extra-territorial organizations and bodies,0.0,0.0,0.0,0.0,0.0
USA,Activity,"Extraction of crude petroleum and services related to crude oil extraction, excluding surveying",0.00035810203507082163,0.00014913038511702288,0.00014356656869606485,0.00010533722981097586,0.00014811334566487157
USA,Activity,"Extraction of natural gas and services related to natural gas extraction, excluding surveying",0.00011773514906592364,6.770030727891667e-05,6.67958434453659e-05,5.1341908064215925e-05,5.478547384344692e-05
USA,Activity,"Extraction, liquefaction, and regasification of other petroleum and gaseous materials",2.6660796048235737e-09,5.414759815385695e-10,5.072225734382365e-10,3.24310858735176e-10,9.607062969661089e-10
USA,Activity,"Financial intermediation, except insurance and pension funding (65)",1.66464905397848e-05,1.0679105778698603e-05,1.0012068462291524e-05,7.3656295086614245e-06,8.824333511491265e-06
USA,Activity,"Fishing, operating of fish hatcheries and fish farms; service activities incidental to fishing (05)",1.0888171096002497e-06,1.0284783521383097e-06,9.628355537876329e-07,4.2712450893122545e-07,5.107387104552051e-07
USA,Activity,"Forestry, logging and related service activities (02)",1.4539463965530789e-05,5.687597347920731e-06,4.849181658858188e-06,2.0682731474146123e-06,5.338006662993881e-06
USA,Activity,Health and social work (85),8.035311847609163e-08,1.9924685519272754e-08,1.8849686796317335e-08,1.648317901668421e-08,3.224952273145584e-08
USA,Activity,Hotels and restaurants (55),2.4890649658258708e-05,1.7875167859659574e-05,1.588256438323567e-05,7.741272332966697e-06,1.1952826389078514e-05
USA,Activity,Incineration of waste: Food,2.8623790664830046e-07,1.7609189920160807e-07,1.7063108688770883e-07,6.425375077352303e-08,1.1068688652960116e-07
USA,Activity,Incineration of waste: Metals and Inert materials,8.13914072592547e-06,6.132895733403445e-06,7.639652066142454e-06,3.3673510256304554e-06,4.085897318865453e-06
USA,Activity,Incineration of waste: Oil/Hazardous waste,1.462017808905551e-06,1.0226833105839998e-06,1.0100944855690696e-06,4.9358833206227e-07,6.648239129059474e-07
USA,Activity,Incineration of waste: Paper,6.438937791790096e-07,2.2232656203996775e-07,2.1503772966879222e-07,1.0158551197138288e-07,2.43377171154912e-07
USA,Activity,Incineration of waste: Plastic,1.789767342162947e-05,6.059478977510784e-06,5.783883633572169e-06,2.4902440117534756e-06,6.576453570834555e-06
USA,Activity,Incineration of waste: Textiles,2.4322866469910316e-06,1.0199138766336587e-06,1.0080490540962e-06,4.3165290211645016e-07,9.35544628371686e-07
USA,Activity,Incineration of waste: Wood,1.968560673459562e-07,8.803867968723235e-08,8.319113153146831e-08,4.056437171767544e-08,7.830296413800037e-08
USA,Activity,Inland water transport,3.8349610534303095e-05,2.718582121261374e-05,2.307499601508748e-05,9.901671353711326e-06,1.5850375956196644e-05
USA,Activity,"Insurance and pension funding, except compulsory social security (66)",3.5146371604212963e-06,2.2273051279935496e-06,1.9501131870774754e-06,1.4162688103633304e-06,1.7942603851486688e-06
USA,Activity,Landfill of waste: Food,3.662657468304905e-07,1.3478724123058235e-07,1.2573611054260063e-07,5.5968630955764175e-08,1.3619487638819714e-07
USA,Activity,Landfill of waste: Inert/metal/hazardous,5.632817414956028e-07,1.726721487841904e-07,1.525431842361827e-07,6.867818123282877e-08,2.0381384306436157e-07
USA,Activity,Landfill of waste: Paper,4.2614035901279047e-07,1.4458531261953357e-07,1.362953046416005e-07,6.108429934333286e-08,1.5745900726542665e-07
USA,Activity,Landfill of waste: Plastic,3.3582894153252864e-07,1.0299030167837262e-07,9.676518677203867e-08,4.2820706174303415e-08,1.2264014370961546e-07
USA,Activity,Landfill of waste: Textiles,1.6397672688859283e-07,5.377166440300449e-08,5.090542840018097e-08,2.2664450286168313e-08,6.049007982486188e-08
USA,Activity,Landfill of waste: Wood,1.8683396207170172e-07,6.065307643843764e-08,5.763934945502136e-08,2.5786302877068547e-08,6.891612274011169e-08
USA,Activity,"Lead, zinc and tin production",2.029439327690811e-06,3.7438033989643715e-06,3.754423404224965e-06,1.2542845879396646e-06,1.0363621417144347e-06
USA,Activity,Manufacture of basic iron and steel and of ferro-alloys and first products thereof,0.00021687055672584785,0.00020936364841674432,0.00017757953820954852,6.396203493547129e-05,8.708796158505744e-05
USA,Activity,Manufacture of beverages,2.092766690758315e-06,2.2714414744355683e-06,1.672648668801846e-06,7.476180726376732e-07,9.076128115113314e-07
USA,Activity,"Manufacture of bricks, tiles and construction products, in baked clay",0.00011750113182595572,6.5036576142611325e-06,5.299262957841292e-06,1.9697252959355016e-06,3.818780393524571e-05
USA,Activity,"Manufacture of cement, lime and plaster",0.00010185819298004038,1.8512643801435392e-05,1.7301871986432258e-05,8.04441670058631e-06,3.5723143279779856e-05
USA,Activity,Manufacture of ceramic goods,6.451775823605081e-06,3.2240224557867977e-06,3.5896145191929543e-06,1.829038042371458e-06,3.088215121555827e-06
USA,Activity,Manufacture of coke oven products,1.663288618842168e-05,1.6698950962495536e-05,1.4450488916459063e-05,5.035557592245718e-06,6.691264293038304e-06
USA,Activity,Manufacture of electrical machinery and apparatus n.e.c. (31),4.238480655608345e-05,3.658490190667594e-05,2.561565284823516e-05,1.5264445863582076e-05,1.9788652453896965e-05
USA,Activity,"Manufacture of fabricated metal products, except machinery and equipment (28)",3.9813279176764795e-05,2.4951374235581173e-05,2.1747742477269096e-05,8.61934741658758e-06,1.5302156289548862e-05
USA,Activity,Manufacture of fish products,2.7010639459422173e-06,3.324238292298475e-06,3.1310747679962535e-06,1.509058624102076e-06,1.3713154173060764e-06
USA,Activity,Manufacture of furniture; manufacturing n.e.c. (36),7.263374124474536e-05,3.1977452543547465e-05,2.7634175799242026e-05,1.4343273424196419e-05,2.748723779391654e-05
USA,Activity,Manufacture of gas; distribution of gaseous fuels through mains,0.0002857404305878986,1.874555203791134e-05,1.6227903181607556e-05,7.70624632131911e-06,9.418929327792323e-05
USA,Activity,Manufacture of glass and glass products,0.009545468675411003,0.00014610032752265825,0.00010978221174769883,3.303550289342591e-05,0.0030620282746728457
USA,Activity,Manufacture of machinery and equipment n.e.c. (29),3.970159550118726e-05,2.9213589325846108e-05,2.5059311234376482e-05,1.0761216128106805e-05,1.623266027243676e-05
USA,Activity,"Manufacture of medical, precision and optical instruments, watches and clocks (33)",9.512522557810718e-06,1.257142077100265e-05,9.266079075786726e-06,4.402793554020354e-06,4.589409212430568e-06
USA,Activity,"Manufacture of motor vehicles, trailers and semi-trailers (34)",5.04282664551056e-05,2.7640851041543955e-05,2.421246306743937e-05,1.0095153810722052e-05,2.0420515342532843e-05
USA,Activity,Manufacture of office machinery and computers (30),8.467016908340166e-06,9.204005397754635e-06,7.089634985988396e-06,3.3362151869609688e-06,3.948572468479548e-06
USA,Activity,Manufacture of other non-metallic mineral products n.e.c.,0.0005748384591300777,2.4688038598855098e-05,2.5666227908642948e-05,8.698984602488773e-06,0.00018650402987442267
USA,Activity,Manufacture of other transport equipment (35),4.651074001722456e-05,4.707594815298053e-05,4.078984047049218e-05,1.6744321022645598e-05,2.131953236943461e-05
USA,Activity,"Manufacture of radio, television and communication equipment and apparatus (32)",2.075398456875817e-05,2.1544344442569097e-05,1.44764580552208e-05,6.848336209909762e-06,8.731489575921076e-06
USA,Activity,Manufacture of rubber and plastic products (25),1.479723792955816e-05,6.605000601104003e-06,5.802340626976416e-06,2.481385471984203e-06,5.590587066017051e-06
USA,Activity,Manufacture of textiles (17),4.4709873174633735e-05,2.14433662033092e-05,1.8947506946682403e-05,8.334218828399898e-06,1.69428122937676e-05
USA,Activity,Manufacture of tobacco products (16),6.250357772906026e-07,3.1047854112263567e-07,2.55517324935542e-07,1.0112065834310726e-07,2.313719426840797e-07
USA,Activity,Manufacture of wearing apparel; dressing and dyeing of fur (18),3.709550478043818e-07,2.3530752137624612e-07,2.1544377803738657e-07,1.0993779398408111e-07,1.6314084280517835e-07
USA,Activity,"Manufacture of wood and of products of wood and cork, except furniture; manufacture of articles of straw and plaiting materials (20)",4.689571958534621e-05,1.592347769293896e-05,1.4745638503666347e-05,6.160245731604301e-06,1.7198436131178457e-05
USA,Activity,"Manure treatment (biogas), storage and land application",0.0,0.0,0.0,0.0,0.0
USA,Activity,"Manure treatment (conventional), storage and land application",0.0,0.0,0.0,0.0,0.0
USA,Activity,Meat animals nec,7.35161424383693e-08,4.993505174284757e-08,4.672275491138645e-08,2.117144791187832e-08,3.105801321834291e-08
USA,Activity,Mining of aluminium ores and concentrates,4.282320201814508e-06,1.6010608008368282e-07,1.23402738451154e-07,3.9057821799701855e-08,1.3791852450692649e-06
USA,Activity,"Mining of chemical and fertilizer minerals, production of salt, other mining and quarrying n.e.c.",9.549046281261605e-05,7.057201130166752e-05,6.552355000149915e-05,2.37323669551587e-05,3.6504690807057406e-05
USA,Activity,Mining of coal and lignite; extraction of peat (10),0.002309256803035139,0.00024212985594346877,0.00024193808705484483,0.00014980105651122384,0.0007963644649565267
USA,Activity,Mining of copper ores and concentrates,7.689508753951558e-05,5.984290376763416e-05,4.1513645227782235e-05,1.3480689344279897e-05,2.757093440250206e-05
USA,Activity,Mining of iron ores,1.629960349909882e-05,9.40763203381471e-06,7.029690490447899e-06,2.6237606625557523e-06,5.900060408477536e-06
USA,Activity,"Mining of lead, zinc and tin ores and concentrates",1.5735609792022796e-05,1.3654500285069881e-05,1.2983947946197852e-05,3.926297094176183e-06,6.010013509012629e-06
USA,Activity,Mining of nickel ores and concentrates,0.0,0.0,0.0,0.0,0.0
USA,Activity,Mining of other non-ferrous metal ores and concentrates,9.224069410756797e-06,1.1724927211811e-05,1.0431274484244577e-05,4.245424560845682e-06,4.382716204635201e-06
USA,Activity,Mining of precious metal ores and concentrates,0.001467599048319011,6.84859811813996e-05,5.565705848478842e-05,2.0254766473923806e-05,0.0004758580619661793
USA,Activity,Mining of uranium and thorium ores (12),2.2452642888945507e-05,8.910313685035168e-06,7.728842295967638e-06,3.282187455965411e-06,8.112695601232477e-06
USA,Activity,N-fertiliser,9.200267869080172e-06,3.1784969549419607e-06,2.4532533569731046e-06,1.1889024036406111e-06,3.3669250265039726e-06
USA,Activity,Other business activities (74),0.00016400342493744485,9.216477889008885e-05,8.260446191673382e-05,5.087765388301991e-05,7.321985015116335e-05
USA,Activity,Other land transport,1.4536481167925693e-08,4.71989276748623e-09,4.4654317012718804e-09,2.465376512004541e-09,5.977628176582667e-09
USA,Activity,Other non-ferrous metal production,1.9951762339588746e-05,2.905143862253953e-05,2.5611483055585088e-05,1.0266283844575891e-05,9.706171761791398e-06
USA,Activity,Other service activities (93),8.076824923697727e-07,2.496778106730655e-07,2.20100476596585e-07,1.2921004868146873e-07,3.120392675308739e-07
USA,Activity,P- and other fertiliser,4.0122387882385316e-05,1.6759662793324768e-05,1.4802894520112105e-05,7.021393849938883e-06,1.4963592476017737e-05
USA,Activity,Paper,0.0005815320307868228,0.0001718346231024661,0.0001451506251663818,6.888985801177366e-05,0.00020939069165904335
USA,Activity,Petroleum Refinery,0.00058910848066672,0.0002895267122642356,0.00029021423943932114,0.00024872080694934975,0.0002674696097417455
USA,Activity,Pigs farming,5.374883343612846e-06,2.8350593261211768e-06,2.438074377678379e-06,1.113548618109425e-06,2.119668475613243e-06
USA,Activity,"Plastics, basic",0.00012971834412809383,0.0001119375196477603,8.519746709407288e-05,3.352087641215105e-05,5.072399454303264e-05
USA,Activity,Post and telecommunications (64),2.311865231030961e-05,1.2328015299454914e-05,1.1298480302924627e-05,7.2504218945721835e-06,1.0564710965335835e-05
USA,Activity,Poultry farming,3.654286258619047e-06,2.5922927764646134e-06,2.23872298546717e-06,1.0148779722532397e-06,1.589178092417704e-06
USA,Activity,Precious metals production,0.0011624625183872638,3.426416684543503e-05,2.87649093767844e-05,1.0569240734523705e-05,0.00037538732545899567
USA,Activity,Private households with employed persons (95),8.096131600482138e-10,1.0280923571237026e-09,1.0692603134546394e-09,7.765739067184602e-10,7.668596300161915e-10
USA,Activity,Processed rice,3.6153006800738865e-06,3.3511055485440588e-06,3.0659902598777327e-06,1.3668400497213401e-06,1.6033083136718186e-06
USA,Activity,Processing of Food products nec,1.0088906306591093e-05,4.761662927781805e-06,4.174099885576673e-06,1.883662155239066e-06,3.831525056177332e-06
USA,Activity,Processing of dairy products,1.2551120020714794e-05,1.2094156457210172e-05,7.530871974784429e-06,2.901949654432337e-06,4.734993778634103e-06
USA,Activity,Processing of meat cattle,1.8781844908319853e-06,9.280472185375609e-07,8.404803670156314e-07,3.8444467175412325e-07,7.348008135415141e-07
USA,Activity,Processing of meat pigs,9.705368525353552e-07,5.181095243208498e-07,4.4636207018917647e-07,2.034025901935832e-07,3.837430515672555e-07
USA,Activity,Processing of meat poultry,8.059131816681288e-07,5.53821151271876e-07,4.7075926942336105e-07,2.162260642890611e-07,3.544560071324125e-07
USA,Activity,Processing of nuclear fuel,6.685751514582637e-09,6.032296087984191e-09,4.318871133285299e-09,1.5875694807870722e-09,2.5404747892207955e-09
USA,Activity,Processing vegetable oils and fats,4.2163406845733395e-05,1.871857652171121e-05,1.6532953609963893e-05,7.3868241866176314e-06,1.5843574176175386e-05
USA,Activity,Production of electricity by Geothermal,6.489983012810405e-07,5.886790621762308e-09,5.123594945709713e-09,2.3300761255026916e-09,2.0851426664266912e-07
USA,Activity,Production of electricity by biomass and waste,0.0,0.0,0.0,0.0,0.0
USA,Activity,Production of electricity by coal,0.10511323780892542,0.002595319645724278,0.0022370987919072167,0.0010142428528592158,0.033973534722525005
USA,Activity,Production of electricity by gas,0.08162714316159429,0.0007457611196298167,0.0006444916745641221,0.00029253852672744986,0.026220618461048294
USA,Activity,Production of electricity by hydro,0.0,0.0,0.0,0.0,0.0
USA,Activity,Production of electricity by nuclear,3.3848529118945366e-05,3.1239405530595e-07,2.614526088396381e-07,1.1842926615659059e-07,1.0874177336565676e-05
USA,Activity,Production of electricity by petroleum and other oil derivatives,0.001461848436510548,2.232882022251804e-05,1.9844847163977032e-05,9.304426709027387e-06,0.0004709807844399908
USA,Activity,Production of electricity by solar photovoltaic,0.0,0.0,0.0,0.0,0.0
USA,Activity,Production of electricity by solar thermal,0.0,0.0,0.0,0.0,0.0
USA,Activity,"Production of electricity by tide, wave, ocean",0.0,0.0,0.0,0.0,0.0
USA,Activity,Production of electricity by wind,0.0,0.0,0.0,0.0,0.0
USA,Activity,Production of electricity nec,1.0151419330400345e-05,9.612353612164507e-08,8.34794185584058e-08,3.795429425100479e-08,3.2624129406051913e-06
USA,Activity,Production of meat products nec,2.8458123413570014e-05,1.308748565825073e-05,1.1071211567933174e-05,4.880756680052428e-06,1.0707610491936102e-05
USA,Activity,Production of offshore wind plants,0.0,0.0,0.0,0.0,0.0
USA,Activity,Production of onshore wind plants,0.0,0.0,0.0,0.0,0.0
USA,Activity,Production of photovoltaic plants,0.0,0.0,0.0,0.0,0.0
USA,Activity,Public administration and defence; compulsory social security (75),2.3166752459717166e-05,2.0746851245193714e-06,1.749045063509008e-06,1.0549857894524006e-06,7.967970205963332e-06
USA,Activity,"Publishing, printing and reproduction of recorded media (22)",4.5652511447069675e-05,2.6813362158924322e-05,2.3819670508238304e-05,1.4696870830736067e-05,2.0729912038560818e-05
USA,Activity,Pulp,3.3802637465086386e-05,2.0407039278055065e-05,1.424365212590316e-05,6.098831922734183e-06,1.2523852334966595e-05
USA,Activity,Quarrying of sand and clay,0.0001707897183430195,2.1195558453671906e-05,1.9073788758069843e-05,7.0728473424076755e-06,5.704352192229397e-05
USA,Activity,Quarrying of stone,5.4656489571565355e-05,8.03614019959122e-06,8.528712044877377e-06,3.9473735160564765e-06,1.8871899606365837e-05
USA,Activity,Raw milk,2.3551023411497953e-06,2.2666191302309357e-06,1.4120334976116589e-06,5.444082417477878e-07,8.88586975954368e-07
USA,Activity,Re-processing of ash into clinker,0.0,0.0,0.0,0.0,0.0
USA,Activity,Re-processing of secondary aluminium into new aluminium,0.0,0.0,0.0,0.0,0.0
USA,Activity,Re-processing of secondary construction material into aggregates,0.0,0.0,0.0,0.0,0.0
USA,Activity,Re-processing of secondary copper into new copper,0.0,0.0,0.0,0.0,0.0
USA,Activity,Re-processing of secondary glass into new glass,0.0,0.0,0.0,0.0,0.0
USA,Activity,"Re-processing of secondary lead into new lead, zinc and tin",0.0,0.0,0.0,0.0,0.0
USA,Activity,Re-processing of secondary other non-ferrous metals into new other non-ferrous metals,0.0,0.0,0.0,0.0,0.0
USA,Activity,Re-processing of secondary paper into new pulp,0.0,0.0,0.0,0.0,0.0
USA,Activity,Re-processing of secondary plastic into new plastic,0.0,0.0,0.0,0.0,0.0
USA,Activity,Re-processing of secondary preciuos metals into new preciuos metals,0.0,0.0,0.0,0.0,0.0
USA,Activity,Re-processing of secondary steel into new steel,0.0,0.0,0.0,0.0,0.0
USA,Activity,Re-processing of secondary wood material into new wood material,0.0,0.0,0.0,0.0,0.0
USA,Activity,Real estate activities (70),9.371400446437925e-06,5.573967019987066e-06,5.086292465142655e-06,3.045639617662221e-06,4.521327996686974e-06
USA,Activity,"Recreational, cultural and sporting activities (92)",4.3999021702099905e-06,2.3736339265019615e-06,2.12973479245351e-06,1.309193358722598e-06,1.9503253004399774e-06
USA,Activity,Recycling of bottles by direct reuse,0.0,0.0,0.0,0.0,0.0
USA,Activity,Recycling of waste and scrap,0.00043384925524173046,0.00014924259064765134,0.00012748123556947,5.5309172580551096e-05,0.0001561301807511536
USA,Activity,Renting of machinery and equipment without operator and of personal and household goods (71),1.815419661067217e-05,7.825636226150374e-06,6.96866831053057e-06,3.800161953009509e-06,7.3286222561943685e-06
USA,Activity,Research and development (73),1.2875699093399208e-05,1.3980997795808097e-05,1.1175977013265512e-05,4.434842452837224e-06,5.34445040843812e-06
USA,Activity,Retail sale of automotive fuel,4.11673277745551e-07,3.2851296438558615e-07,3.4877207568168807e-07,1.83066243124558e-07,3.0042243695832463e-06
USA,Activity,"Retail trade, except of motor vehicles and motorcycles; repair of personal and household goods (52)",2.3360656165265485e-06,4.850636452246317e-07,4.0575742104337234e-07,1.889134871619419e-07,8.57521793773725e-07
USA,Activity,"Sale, maintenance, repair of motor vehicles, motor vehicles parts, motorcycles, motor cycles parts and accessoiries",1.6708923877396312e-05,3.5231421406434072e-06,2.9747603186202883e-06,1.3848502193295202e-06,5.928847873563872e-06
USA,Activity,Sea and coastal water transport,0.0004206753678640139,0.00014402328764099415,0.00030158438658145877,7.18383018238926e-05,0.00016087002987114375
USA,Activity,Steam and hot water supply,0.0006372348324506349,0.00019406580872708066,0.00017575666951834599,8.630158685504199e-05,0.00023360704235755503
USA,Activity,Sugar refining,1.2108764489855987e-06,7.672862752035377e-07,6.78214735656627e-07,3.08788776847008e-07,5.104965734127085e-07
