RoW,Activity,Sea and coastal water transport,0.009718435067366723,0.004487630790331613,0.009492428654888807,0.0030170064318949122,0.004743730306891722
RoW,Activity,Steam and hot water supply,0.0033498429956371036,0.0030847079201709827,0.002761123483323213,0.0016884654718157224,0.0018705507088052813
RoW,Activity,Sugar refining,1.1754568361595179e-05,9.103406262928061e-06,7.80175692607067e-06,4.260736438012725e-06,5.9870727096275665e-06
RoW,Activity,Supporting and auxiliary transport activities; activities of travel agencies (63),0.0006714659459835342,0.0006919793251237492,0.0008463140168674826,0.00042577883150335594,0.0004116974203686953
RoW,Activity,"Tanning and dressing of leather; manufacture of luggage, handbags, saddlery, harness and footwear (19)",1.2831382274655938e-05,1.3614045373504796e-05,1.179141208708377e-05,6.101929606302248e-06,6.866705794469687e-06
RoW,Activity,Transmission of electricity,3.365978039876752e-05,3.145658591140187e-05,2.768274445708324e-05,1.6977570789668538e-05,1.8758942469112958e-05
RoW,Activity,Transport via pipelines,0.0012208537007421835,0.0010154641166754397,0.001022476941250801,0.001134084218249832,0.0009128872510230885
RoW,Activity,Transport via railways,0.00017340983026134868,0.00018689576478567497,0.00018586898379168522,0.00010836503801879795,0.00011741436587096136
RoW,Activity,"Waste water treatment, food",1.2284361113964893e-06,1.3036904941194259e-06,1.1609857458580364e-06,6.494785695891719e-07,6.862599142095853e-07
RoW,Activity,"Waste water treatment, other",1.7363468430834266e-06,1.8000655508722162e-06,1.6094546294458846e-06,9.917325800009423e-07,9.75642614816061e-07
RoW,Activity,"Wholesale trade and commission trade, except of motor vehicles and motorcycles (51)",0.0001853607059928116,0.00017954381443492583,0.00015744072695376084,9.323402372373663e-05,0.00010719714599579543
RoW,Activity,"Wool, silk-worm cocoons",4.972800476507669e-05,4.6262791432049764e-05,4.210372524036541e-05,2.5002408947839997e-05,2.7896801289960665e-05
USA,Activity,Activities auxiliary to financial intermediation (67),1.7341056413805887e-05,7.87160493051383e-06,6.264607962774133e-06,3.930053318455345e-06,8.25819619143271e-06
USA,Activity,Activities of membership organisation n.e.c. (91),1.211850907350019e-06,5.446012841364615e-07,4.915216858427805e-07,3.31217278615274e-07,6.054245103098526e-07
USA,Activity,Air transport (62),0.0008489406465045194,0.0005509642346701423,0.0005096336148900905,0.00035717647905892427,0.00048126315337769016
USA,Activity,Aluminium production,0.00012881103507949071,3.4936920896235e-05,2.5774709785861153e-05,1.0897994821889355e-05,5.461259563930734e-05
USA,Activity,Animal products nec,9.22871976495499e-07,8.741904799275539e-07,7.965662725595349e-07,4.2840285479328074e-07,4.982355194396168e-07
USA,Activity,"Biogasification of food waste, incl. land application",0.0,0.0,0.0,0.0,0.0
USA,Activity,"Biogasification of paper, incl. land application",0.0,0.0,0.0,0.0,0.0
USA,Activity,"Biogasification of sewage slugde, incl. land application",1.7264889541921594e-06,6.023327309117095e-07,5.358724833101627e-07,2.683960521792237e-07,7.727951405516318e-07
USA,Activity,Casting of metals,5.885108445028558e-05,3.547505762803854e-05,2.9474476352850102e-05,1.5479149995446658e-05,2.8370059388484705e-05
USA,Activity,Cattle farming,7.4211033291734415e-06,4.641036321174926e-06,4.172293060051493e-06,2.327677067735933e-06,3.764825177863799e-06
USA,Activity,Chemicals nec,0.0036732060063991152,0.0011034645909000758,0.0010209884538175528,0.0005633200227243714,0.0016471562867861813
USA,Activity,"Collection, purification and distribution of water (41)",4.067966910051203e-07,1.0658922878294431e-07,9.949317536437918e-08,5.504344689273594e-08,1.8273126474298784e-07
USA,Activity,"Composting of food waste, incl. land application",1.092504779255041e-07,6.747854237484853e-08,6.959925500626692e-08,5.2611868731707425e-08,5.7318723847418565e-08
USA,Activity,"Composting of paper and wood, incl. land application",3.8320998440971206e-07,1.1005490711902006e-07,1.0870462884873491e-07,5.858509858945207e-08,1.7373592355125796e-07
USA,Activity,Computer and related activities (72),7.446682729546077e-06,4.00157638317921e-06,3.5574419822035124e-06,2.507821195668495e-06,4.016512291090253e-06
USA,Activity,Construction (45),1.676673378821827e-05,2.3034329996290526e-06,2.4175460189795966e-06,1.684516961679311e-06,7.4884070922554466e-06
USA,Activity,Copper production,0.0001194384582559106,0.00013939758874425296,9.020728436602201e-05,3.887600949638915e-05,5.53127501336696e-05
USA,Activity,Cultivation of cereal grains nec,2.7136247435951247e-05,1.1900559252193246e-05,9.585988952965518e-06,4.991808017551106e-06,1.2337747294536379e-05
USA,Activity,Cultivation of crops nec,2.7243141854415014e-05,9.88038962188911e-06,8.569147194474947e-06,4.639646372600685e-06,1.2358805956534696e-05
USA,Activity,Cultivation of oil seeds,6.339685141053397e-05,4.565626757388247e-05,2.6644726725526048e-05,1.210614915319319e-05,2.7726928608907524e-05
USA,Activity,Cultivation of paddy rice,2.6251646908378543e-05,1.5843912680588495e-05,1.4219974542293395e-05,7.833174490318901e-06,1.3234702806490206e-05
USA,Activity,Cultivation of plant-based fibers,1.8830915821984212e-05,1.455413967597957e-05,1.1836302515820672e-05,5.926010845525704e-06,9.032958420127061e-06
USA,Activity,"Cultivation of sugar cane, sugar beet",2.319233081599575e-06,1.363462697584247e-06,1.1410648647927885e-06,6.157518389111433e-07,1.127298695334526e-06
USA,Activity,"Cultivation of vegetables, fruit, nuts",2.634221870570685e-06,1.8621302755788745e-06,1.642951026954468e-06,8.825421484463646e-07,1.3118213357869886e-06
USA,Activity,Cultivation of wheat,2.1993679244997373e-05,1.7317266313991805e-05,1.5495268398568975e-05,8.4904733437048e-06,1.1241847029288287e-05
USA,Activity,Distribution and trade of electricity,6.413781540150059e-07,1.766371968218768e-07,1.6017585533807178e-07,9.17042978135348e-08,2.9039393214803385e-07
USA,Activity,Education (80),2.7354878298667897e-07,9.860631460878138e-08,9.022754327773295e-08,7.19013650628964e-08,1.3743705621575192e-07
USA,Activity,Extra-territorial organizations and bodies,0.0,0.0,0.0,0.0,0.0
USA,Activity,"Extraction of crude petroleum and services related to crude oil extraction, excluding surveying",0.00037493656905351517,0.00016381123820391306,0.00015954062431064862,0.0001387434095438232,0.00019289550042055558
USA,Activity,"Extraction of natural gas and services related to natural gas extraction, excluding surveying",9.712281032430536e-05,5.4504538628568754e-05,5.4468672745505585e-05,4.2988074802396904e-05,5.10977593365406e-05
USA,Activity,"Extraction, liquefaction, and regasification of other petroleum and gaseous materials",2.8720841075630885e-09,3.989405793177492e-10,3.752129137378107e-10,2.594719077724666e-10,1.2475592061505303e-09
USA,Activity,"Financial intermediation, except insurance and pension funding (65)",1.8674465682785225e-05,1.2450122541212286e-05,1.155808369796267e-05,9.524960797018066e-06,1.1382707314431296e-05
USA,Activity,"Fishing, operating of fish hatcheries and fish farms; service activities incidental to fishing (05)",1.142195822284611e-06,9.851531023626337e-07,9.024346668468189e-07,4.8059203311972e-07,6.120117089243962e-07
USA,Activity,"Forestry, logging and related service activities (02)",1.333532402498244e-05,5.295236810916597e-06,4.585575613735167e-06,2.2710186660923847e-06,6.037383974295031e-06
USA,Activity,Health and social work (85),5.97075145279588e-08,2.1435244272349427e-08,1.946045005004967e-08,1.5641936371331348e-08,3.011383344407049e-08
USA,Activity,Hotels and restaurants (55),2.9369809670625077e-05,2.1821759052908567e-05,1.9562094237042537e-05,1.1047217863991512e-05,1.640724872978453e-05
USA,Activity,Incineration of waste: Food,2.555050244491495e-07,1.6017299537633864e-07,1.5770823192482952e-07,8.427376712125009e-08,1.211817241706022e-07
USA,Activity,Incineration of waste: Metals and Inert materials,6.783171852003617e-06,4.288032255311566e-06,3.881548858762203e-06,3.2034732621985302e-06,3.4059028851845613e-06
USA,Activity,Incineration of waste: Oil/Hazardous waste,1.1882925917215703e-06,6.105868286480827e-07,6.115481435515329e-07,3.4249820000683644e-07,5.877914174074104e-07
USA,Activity,Incineration of waste: Paper,6.932297671343027e-07,2.9825352504858193e-07,2.886198338804709e-07,1.6530181535817042e-07,3.2491075792858555e-07
USA,Activity,Incineration of waste: Plastic,1.1954890409706053e-05,4.07213033010997e-06,4.0820363810851105e-06,2.8623305546903617e-06,5.555043080329203e-06
USA,Activity,Incineration of waste: Textiles,2.3445044799211305e-06,1.0789490400038195e-06,1.0949062704620304e-06,7.016703783349429e-07,1.092314111133813e-06
USA,Activity,Incineration of waste: Wood,1.9567569483169518e-07,8.108340402609806e-08,8.095095302507847e-08,8.387046315828807e-08,9.442275502468348e-08
USA,Activity,Inland water transport,2.524901308982029e-05,1.7963761074294956e-05,1.5871692608443682e-05,8.314240449400081e-06,1.2791347190688139e-05
USA,Activity,"Insurance and pension funding, except compulsory social security (66)",4.234107732488519e-06,2.5553671773386285e-06,2.2720697734912822e-06,1.7926329421641805e-06,2.4148985343561057e-06
USA,Activity,Landfill of waste: Food,3.817387664389812e-07,1.375957100876635e-07,1.3374661254711198e-07,7.215432928387847e-08,1.7473383059047434e-07
USA,Activity,Landfill of waste: Inert/metal/hazardous,5.105503938744823e-07,1.5861154812882902e-07,1.5362983506762332e-07,8.23976171330338e-08,2.3215511478947022e-07
USA,Activity,Landfill of waste: Paper,4.0690945534051573e-07,1.3796838990456543e-07,1.3498956816866778e-07,7.762471765553267e-08,1.86172901680476e-07
USA,Activity,Landfill of waste: Plastic,3.161949472538423e-07,9.6159083754497e-08,9.329400417737797e-08,4.9474145453883154e-08,1.4347071549166123e-07
USA,Activity,Landfill of waste: Textiles,1.4182184940066563e-07,4.622706451603004e-08,4.659334356643865e-08,2.4598151087486425e-08,6.519063903425995e-08
USA,Activity,Landfill of waste: Wood,1.6477802550677193e-07,5.483512500862612e-08,5.533721248175216e-08,2.9081096142245024e-08,7.563145586870853e-08
USA,Activity,"Lead, zinc and tin production",1.790426811165343e-06,3.3320886205745937e-06,3.2259325021416784e-06,1.366815569598756e-06,1.0596215883917895e-06
USA,Activity,Manufacture of basic iron and steel and of ferro-alloys and first products thereof,0.00020483378776471289,0.00017514310956359444,0.0001508204031223446,6.697972749414407e-05,9.80770546535463e-05
USA,Activity,Manufacture of beverages,3.6062477152551296e-06,3.7847480881248276e-06,2.439229403474889e-06,1.2097848413741544e-06,1.7223757145870605e-06
USA,Activity,"Manufacture of bricks, tiles and construction products, in baked clay",6.879688034073772e-05,4.299851293030525e-06,3.5478679668641206e-06,1.6290065209556384e-06,2.8554673850438e-05
USA,Activity,"Manufacture of cement, lime and plaster",0.00013046082145078824,2.2248315238663408e-05,2.222276532513258e-05,1.1729652174375231e-05,5.696486798876243e-05
USA,Activity,Manufacture of ceramic goods,7.775161141012029e-06,3.550835331986605e-06,4.3209323089584376e-06,2.481869424400675e-06,4.330516042227375e-06
USA,Activity,Manufacture of coke oven products,1.183678830133585e-05,1.0954988248609488e-05,9.438300386756793e-06,4.1914598133806535e-06,5.717581285679978e-06
USA,Activity,Manufacture of electrical machinery and apparatus n.e.c. (31),4.364067214643204e-05,3.687263070852743e-05,2.56917208208383e-05,1.678448869064203e-05,2.334854198886422e-05
USA,Activity,"Manufacture of fabricated metal products, except machinery and equipment (28)",3.92728645860944e-05,2.3089508351855435e-05,2.0157193399916694e-05,9.65929661665552e-06,1.8376636637543706e-05
USA,Activity,Manufacture of fish products,3.3483306530266e-06,3.3164088311271834e-06,3.149168535314181e-06,1.7128768655891404e-06,1.8115350880711683e-06
USA,Activity,Manufacture of furniture; manufacturing n.e.c. (36),6.876637653469458e-05,2.9358931470826705e-05,2.600404322302167e-05,1.5512528045751655e-05,3.190363756714439e-05
USA,Activity,Manufacture of gas; distribution of gaseous fuels through mains,0.00018051812931301893,2.3619773575642002e-05,2.084338822550105e-05,1.1540864242368132e-05,7.699950588457224e-05
USA,Activity,Manufacture of glass and glass products,0.00443363767273216,8.213520998477952e-05,6.080136287601537e-05,2.3041735666761414e-05,0.0018192269718784696
USA,Activity,Manufacture of machinery and equipment n.e.c. (29),8.776373186569772e-05,5.126894997317556e-05,4.348836850523646e-05,2.2692197396349492e-05,4.203776933143888e-05
USA,Activity,"Manufacture of medical, precision and optical instruments, watches and clocks (33)",7.90412715261718e-06,7.865109986516448e-06,6.756937374183333e-06,3.860850469681521e-06,4.523617662998239e-06
USA,Activity,"Manufacture of motor vehicles, trailers and semi-trailers (34)",5.010420108054624e-05,2.2127094330939846e-05,1.8863543835535275e-05,9.684296833232042e-06,2.363095798806231e-05
USA,Activity,Manufacture of office machinery and computers (30),7.672841463705084e-06,8.544472500699582e-06,6.538779134599499e-06,3.6890703893785763e-06,4.252096454411086e-06
USA,Activity,Manufacture of other non-metallic mineral products n.e.c.,0.0005368085493179984,2.6748045679276817e-05,2.9749215090856007e-05,1.1849164760375181e-05,0.00022253767554623421
USA,Activity,Manufacture of other transport equipment (35),4.181188000189793e-05,4.419664221242844e-05,3.5873198731538855e-05,1.8387750046489387e-05,2.2926885054613203e-05
USA,Activity,"Manufacture of radio, television and communication equipment and apparatus (32)",2.0570757692240328e-05,2.266830320060862e-05,1.4749415728310715e-05,8.408498814599011e-06,1.0402446741177825e-05
USA,Activity,Manufacture of rubber and plastic products (25),1.2834022421550207e-05,5.550227915920181e-06,4.9388557338157254e-06,2.4998866576824614e-06,5.948670945917791e-06
USA,Activity,Manufacture of textiles (17),3.7848195086887556e-05,1.7234008563320014e-05,1.544342772877395e-05,8.173938147746951e-06,1.7627949718196212e-05
USA,Activity,Manufacture of tobacco products (16),3.3231690359169496e-07,3.454539112391982e-07,2.763796541398032e-07,1.3149120485937998e-07,1.6654734634503702e-07
USA,Activity,Manufacture of wearing apparel; dressing and dyeing of fur (18),2.860935802477838e-07,1.8485332959296536e-07,1.6715949791806613e-07,9.903864358763588e-08,1.4867134858949802e-07
USA,Activity,"Manufacture of wood and of products of wood and cork, except furniture; manufacture of articles of straw and plaiting materials (20)",4.649395103179622e-05,1.7580268810732745e-05,1.6863564494516978e-05,8.001352270056065e-06,2.115416012920941e-05
USA,Activity,"Manure treatment (biogas), storage and land application",0.0,0.0,0.0,0.0,0.0
USA,Activity,"Manure treatment (conventional), storage and land application",0.0,0.0,0.0,0.0,0.0
USA,Activity,Meat animals nec,1.134872247011231e-08,7.006041605333631e-09,6.503386511596915e-09,3.448696198740155e-09,5.6232219632107855e-09
USA,Activity,Mining of aluminium ores and concentrates,3.754583724164482e-06,1.9042602822845194e-07,1.4882124527520103e-07,5.695902138118352e-08,1.5458262702705818e-06
USA,Activity,"Mining of chemical and fertilizer minerals, production of salt, other mining and quarrying n.e.c.",5.93103754409064e-05,4.153933407759601e-05,4.0631007014584556e-05,1.7494010169829872e-05,2.765768962247548e-05
USA,Activity,Mining of coal and lignite; extraction of peat (10),0.0025840426544436502,0.00013948407039468695,0.00014249254899440812,8.726257423992267e-05,0.0010912651550707198
USA,Activity,Mining of copper ores and concentrates,7.125472329649959e-05,4.371511126746538e-05,3.145422082522652e-05,1.3063881881958787e-05,3.138644353919985e-05
USA,Activity,Mining of iron ores,1.398257894796865e-05,9.418135322342814e-06,7.5229262541710195e-06,3.2927928792497427e-06,6.364096149204786e-06
USA,Activity,"Mining of lead, zinc and tin ores and concentrates",1.323845095389505e-05,1.1127453444416454e-05,1.0701480208873059e-05,4.0793844283876126e-06,6.167125997700223e-06
USA,Activity,Mining of nickel ores and concentrates,0.0,0.0,0.0,0.0,0.0
USA,Activity,Mining of other non-ferrous metal ores and concentrates,4.472299725515647e-06,4.7945229790277726e-06,4.228713409432748e-06,1.8770908567061564e-06,2.221030308079505e-06
USA,Activity,Mining of precious metal ores and concentrates,0.0017871839414282202,8.026224502933985e-05,6.370019557894996e-05,2.8644183220489408e-05,0.0007387044985987441
USA,Activity,Mining of uranium and thorium ores (12),1.4250872594997285e-05,5.805843788810842e-06,4.967550888218153e-06,2.504838071136554e-06,6.414236279099344e-06
USA,Activity,N-fertiliser,9.814749169862051e-06,2.496439468978302e-06,2.0553719891907465e-06,1.1956091106819268e-06,4.286319508063509e-06
USA,Activity,Other business activities (74),0.0001718659717856523,9.701464436108484e-05,8.729339328382421e-05,6.086823699890136e-05,9.060525991648215e-05
USA,Activity,Other land transport,1.2342704967021151e-08,3.9374325617316385e-09,3.780479418254231e-09,2.468207482165503e-09,6.1968584873631795e-09
USA,Activity,Other non-ferrous metal production,2.6738543530215943e-05,2.825804318107228e-05,2.5016986031483764e-05,1.10468208338675e-05,1.3126749280212895e-05
USA,Activity,Other service activities (93),7.209523297381846e-07,2.3625288522641183e-07,2.08365720076865e-07,1.3757901885561538e-07,3.407994707834085e-07
USA,Activity,P- and other fertiliser,4.573568460865918e-05,1.7171668050629337e-05,1.523536875023157e-05,8.75173490967092e-06,2.085475279180102e-05
USA,Activity,Paper,0.0004679695866412411,0.00013417671220967493,0.00011350147416040584,6.285844135553946e-05,0.00020863617577679237
USA,Activity,Petroleum Refinery,0.0005150161662654581,0.0002801866127218735,0.0002828192663791376,0.0002815083743387454,0.0002920429334460786
USA,Activity,Pigs farming,4.142388266846135e-06,2.0612288817721547e-06,1.7695800877855693e-06,9.600650109905526e-07,1.956287803365874e-06
USA,Activity,"Plastics, basic",6.424264095893702e-05,4.7094030249642336e-05,3.905763716847821e-05,1.86056259791217e-05,3.045035942614355e-05
USA,Activity,Post and telecommunications (64),2.4245357814155735e-05,1.2907813381003598e-05,1.1918984284832435e-05,8.821300094793144e-06,1.3150527887448077e-05
USA,Activity,Poultry farming,2.512186793808745e-06,1.6523476405692731e-06,1.3680276949823542e-06,7.195705996667007e-07,1.2174177646615326e-06
USA,Activity,Precious metals production,0.0013932184883063093,4.894741398785973e-05,3.9890226805778456e-05,1.807305275457787e-05,0.0005750839367199602
USA,Activity,Private households with employed persons (95),2.0907167155902905e-09,2.765172690784531e-09,2.8475656052905444e-09,2.2719035293598075e-09,2.0134019551055952e-09
USA,Activity,Processed rice,4.059224503637836e-06,3.6219549355431636e-06,3.2768868711208155e-06,1.7914239365330244e-06,2.125416128317554e-06
USA,Activity,Processing of Food products nec,1.2162843305623588e-05,6.11790072899983e-06,5.1917575639699115e-06,2.807984256378441e-06,5.790660323415522e-06
USA,Activity,Processing of dairy products,1.3074544384885802e-05,1.5715026514430477e-05,8.961938339438493e-06,4.219535060689842e-06,6.0117409770187375e-06
USA,Activity,Processing of meat cattle,2.287867460855089e-06,1.4303583080469183e-06,1.2978734120858703e-06,7.23489373187735e-07,1.1687696539241024e-06
USA,Activity,Processing of meat pigs,7.647368250572344e-07,3.849322408047791e-07,3.274543693747136e-07,1.7701369857736179e-07,3.6013884699350934e-07
USA,Activity,Processing of meat poultry,4.4062690124823235e-07,2.621499833882142e-07,2.025426266637018e-07,1.0577597647068477e-07,2.0777190762526137e-07
USA,Activity,Processing of nuclear fuel,9.611826104911846e-09,8.77796169350246e-09,8.739791194723238e-09,3.7150922521470624e-09,4.82890994700676e-09
USA,Activity,Processing vegetable oils and fats,1.2229857001537653e-05,6.7799042221617295e-06,5.939413451711065e-06,3.190376537944179e-06,5.816401784621186e-06
USA,Activity,Production of electricity by Geothermal,8.236063518252308e-07,3.8612429721486504e-09,3.407776919585077e-09,1.8333938347534584e-09,3.3788968327049026e-07
USA,Activity,Production of electricity by biomass and waste,0.0,0.0,0.0,0.0,0.0
USA,Activity,Production of electricity by coal,0.11313013381110892,0.0017514051604142278,0.001520565975159214,0.0008161533364198045,0.04656135631681071
USA,Activity,Production of electricity by gas,0.0733261042860078,0.00042682018985310086,0.0003726194818223368,0.0002003464957619251,0.03009082283323571
USA,Activity,Production of electricity by hydro,0.0,0.0,0.0,0.0,0.0
USA,Activity,Production of electricity by nuclear,2.942006128807212e-05,2.501636069626414e-07,2.183878787131988e-07,1.1749428867908089e-07,1.2083154383821685e-05
USA,Activity,Production of electricity by petroleum and other oil derivatives,0.0023159742758836394,1.1725070388026725e-05,1.0408887897088872e-05,5.928307942137929e-06,0.0009504977761286782
USA,Activity,Production of electricity by solar photovoltaic,0.0,0.0,0.0,0.0,0.0
USA,Activity,Production of electricity by solar thermal,0.0,0.0,0.0,0.0,0.0
USA,Activity,"Production of electricity by tide, wave, ocean",0.0,0.0,0.0,0.0,0.0
USA,Activity,Production of electricity by wind,0.0,0.0,0.0,0.0,0.0
USA,Activity,Production of electricity nec,1.2308851820453127e-05,6.289165062403867e-08,5.536185419529113e-08,2.9981520450213955e-08,5.051679913210055e-06
USA,Activity,Production of meat products nec,2.5202226456152082e-05,1.2558802393117648e-05,1.0803265730932653e-05,5.803927910765551e-06,1.1791116681653972e-05
USA,Activity,Production of offshore wind plants,0.0,0.0,0.0,0.0,0.0
USA,Activity,Production of onshore wind plants,0.0,0.0,0.0,0.0,0.0
USA,Activity,Production of photovoltaic plants,0.0,0.0,0.0,0.0,0.0
USA,Activity,Public administration and defence; compulsory social security (75),1.5875942861943465e-05,2.691458279798774e-06,2.3493152382042206e-06,1.5664091542247427e-06,7.128489757105163e-06
USA,Activity,"Publishing, printing and reproduction of recorded media (22)",3.7735621021253076e-05,2.207500894692068e-05,1.9625588536442917e-05,1.3776972721393511e-05,2.0137904029949086e-05
USA,Activity,Pulp,2.6268782956101205e-05,1.4506626767833544e-05,1.0458062252278685e-05,5.552762034837683e-06,1.2002113058173208e-05
USA,Activity,Quarrying of sand and clay,0.00016550029299131023,1.8655965569710156e-05,1.7035860326701154e-05,7.619475678530193e-06,6.975795898742645e-05
USA,Activity,Quarrying of stone,4.2206016979579074e-05,4.926899221585362e-06,5.717408139819963e-06,2.6257788011100927e-06,1.8001484733634e-05
USA,Activity,Raw milk,2.3714524636759396e-06,2.846807084297286e-06,1.6240876924906877e-06,7.648986954605441e-07,1.0904854209542875e-06
USA,Activity,Re-processing of ash into clinker,0.0,0.0,0.0,0.0,0.0
USA,Activity,Re-processing of secondary aluminium into new aluminium,0.0,0.0,0.0,0.0,0.0
USA,Activity,Re-processing of secondary construction material into aggregates,0.0,0.0,0.0,0.0,0.0
USA,Activity,Re-processing of secondary copper into new copper,0.0,0.0,0.0,0.0,0.0
USA,Activity,Re-processing of secondary glass into new glass,0.0,0.0,0.0,0.0,0.0
USA,Activity,"Re-processing of secondary lead into new lead, zinc and tin",0.0,0.0,0.0,0.0,0.0
USA,Activity,Re-processing of secondary other non-ferrous metals into new other non-ferrous metals,0.0,0.0,0.0,0.0,0.0
USA,Activity,Re-processing of secondary paper into new pulp,0.0,0.0,0.0,0.0,0.0
USA,Activity,Re-processing of secondary plastic into new plastic,0.0,0.0,0.0,0.0,0.0
USA,Activity,Re-processing of secondary preciuos metals into new preciuos metals,0.0,0.0,0.0,0.0,0.0
USA,Activity,Re-processing of secondary steel into new steel,0.0,0.0,0.0,0.0,0.0
USA,Activity,Re-processing of secondary wood material into new wood material,0.0,0.0,0.0,0.0,0.0
USA,Activity,Real estate activities (70),1.0877026412407496e-05,5.937928211704354e-06,5.603474677632831e-06,3.7317853814979006e-06,5.824271475958569e-06
USA,Activity,"Recreational, cultural and sporting activities (92)",4.663668253629245e-06,2.5162776643612467e-06,2.2718009529306246e-06,1.583316118258809e-06,2.442447093775651e-06
USA,Activity,Recycling of bottles by direct reuse,0.0,0.0,0.0,0.0,0.0
USA,Activity,Recycling of waste and scrap,0.0003646800437637787,0.0001180293256989422,0.00010110929609523371,5.2858038622792885e-05,0.00016320828139844602
USA,Activity,Renting of machinery and equipment without operator and of personal and household goods (71),1.6402751602485012e-05,7.082301268538189e-06,6.395005320080104e-06,4.0871480109600285e-06,8.019235430155482e-06
USA,Activity,Research and development (73),1.2426680768522737e-05,1.3215541200218014e-05,1.0709390204745552e-05,5.40483191264086e-06,6.353907205564279e-06
USA,Activity,Retail sale of automotive fuel,5.651990238372339e-07,3.677541392131199e-07,3.78033489639999e-07,2.2119944764766408e-07,2.993813597143076e-07
USA,Activity,"Retail trade, except of motor vehicles and motorcycles; repair of personal and household goods (52)",2.5721424372503757e-06,5.080527943469658e-07,4.305750461022633e-07,2.4726441764090905e-07,1.3002385260660131e-06
USA,Activity,"Sale, maintenance, repair of motor vehicles, motor vehicles parts, motorcycles, motor cycles parts and accessoiries",1.999856280920652e-05,3.8941316071798875e-06,3.318789835349355e-06,1.8299765207132663e-06,8.70280937231178e-06
USA,Activity,Sea and coastal water transport,0.0003462177078807957,0.00014946872657719754,0.0003234346717730825,9.884639203058833e-05,0.00016704018356469375
USA,Activity,Steam and hot water supply,0.00047753724631944096,0.0001386203382891895,0.00012616632922332797,7.378384349306623e-05,0.00021682576520331415
USA,Activity,Sugar refining,8.829639477041194e-07,5.41500059981404e-07,4.51767056378711e-07,2.428705038779093e-07,4.3191388643812586e-07
USA,Activity,Supporting and auxiliary transport activities; activities of travel agencies (63),6.852677238185148e-05,3.007895916937765e-05,3.806396515515097e-05,1.921809555302227e-05,3.4705016518110346e-05
