EU27+UK,Activity,Transmission of electricity,0.0004601888616356858,0.000590034421918568,0.0006230048071471717,0.0005518161882359026,0.0004502457615192924
EU27+UK,Activity,Transport via pipelines,0.0007671806364816226,0.0008238589999297055,0.0009672424970720548,0.0011182304715102547,0.0015209416856232772
EU27+UK,Activity,Transport via railways,0.0004884873063066681,0.0008594012604960444,0.000957028541923206,0.0006512977335235351,0.0007002752199411035
EU27+UK,Activity,"Waste water treatment, food",3.918165618769243e-06,4.996576370047608e-06,5.404984067632253e-06,3.7754164921960496e-06,3.1136427975848553e-06
EU27+UK,Activity,"Waste water treatment, other",8.237450540090222e-06,9.896958098730898e-06,1.0438758700665904e-05,7.128545166245825e-06,6.198000980277786e-06
EU27+UK,Activity,"Wholesale trade and commission trade, except of motor vehicles and motorcycles (51)",0.0005380075980898488,0.0010778961818574526,0.0010242784647020433,0.0006853893187894947,0.0008861553048357879
EU27+UK,Activity,"Wool, silk-worm cocoons",0.00011463162201103528,0.0002712937793521157,0.00025591642459582597,0.00011011379845184556,7.907079103883438e-05
RoW,Activity,Activities auxiliary to financial intermediation (67),5.075233240082328e-05,4.8358338647014206e-05,4.453257893129367e-05,3.2571719412413726e-05,3.5317780653349466e-05
RoW,Activity,Activities of membership organisation n.e.c. (91),5.786368306628892e-06,5.983267734856125e-06,5.389431643747258e-06,3.147671841145427e-06,3.702841260504721e-06
RoW,Activity,Air transport (62),0.0008766280286065437,0.000991267248509728,0.0009571644335754943,0.00070945419223489,0.0007105847481311253
RoW,Activity,Aluminium production,0.0007115807341299219,0.000895207670346679,0.0007786636035823051,0.00032329564219407204,0.0003658991551959791
RoW,Activity,Animal products nec,4.8811289463085575e-06,4.899613428872733e-06,4.445344056858241e-06,2.641369784905657e-06,3.0898325564392653e-06
RoW,Activity,"Biogasification of food waste, incl. land application",6.965417450986519e-08,7.051656487238862e-08,6.262245658522137e-08,3.806634177558613e-08,4.198060282222794e-08
RoW,Activity,"Biogasification of paper, incl. land application",1.0290628755614875e-07,1.0759239379574574e-07,9.282180596501203e-08,5.436545456674281e-08,5.9194712871678737e-08
RoW,Activity,"Biogasification of sewage slugde, incl. land application",5.175204403463792e-07,6.177891652922893e-07,5.629559419405442e-07,3.3225638748484506e-07,3.3286083261329927e-07
RoW,Activity,Casting of metals,0.00018858602220407365,0.00024027118036459624,0.00020076747409581187,0.0001122458758952924,0.00011315806419091592
RoW,Activity,Cattle farming,2.766734113952036e-05,2.1771448724899345e-05,1.8931227456831286e-05,1.1177758948591634e-05,1.5611654253061785e-05
RoW,Activity,Chemicals nec,0.002815094775589649,0.0027008563101884606,0.0024652666387910286,0.0014259536769960883,0.0015909035670839966
RoW,Activity,"Collection, purification and distribution of water (41)",7.701903497717379e-05,5.1245455827793874e-05,4.566151693246965e-05,2.6600783119868584e-05,4.3284059554672765e-05
RoW,Activity,"Composting of food waste, incl. land application",5.516463026451641e-07,6.48600527798687e-07,6.098745873805731e-07,3.7946276171966804e-07,3.773037943423908e-07
RoW,Activity,"Composting of paper and wood, incl. land application",6.767847141532216e-08,6.828004007914314e-08,6.15051748579161e-08,3.6250387676453864e-08,4.05955933396316e-08
RoW,Activity,Computer and related activities (72),1.480279716011582e-05,1.6791526936771136e-05,1.5111988918874063e-05,1.0848388199311913e-05,1.129815829060394e-05
RoW,Activity,Construction (45),0.0001175638104366675,8.439822258820262e-05,8.663630388514668e-05,6.078673066567739e-05,7.969104731345152e-05
RoW,Activity,Copper production,0.0002558823103577123,0.0007797410005742872,0.0004818244768772787,0.0002221790781540354,0.00014534859458564486
RoW,Activity,Cultivation of cereal grains nec,7.828449329411341e-05,6.552122195171995e-05,5.888051648913254e-05,3.469759813997621e-05,4.565359700878686e-05
RoW,Activity,Cultivation of crops nec,5.168735523205194e-05,4.5358770059556934e-05,4.103628605816158e-05,2.30746439798896e-05,3.056290160037626e-05
RoW,Activity,Cultivation of oil seeds,0.00010535003170015076,8.238762765974198e-05,6.4890362025309e-05,3.582461688797354e-05,5.68332884728528e-05
RoW,Activity,Cultivation of paddy rice,6.362045476815096e-05,5.583378628287067e-05,5.044748809736924e-05,2.9323585302034118e-05,3.720382505683378e-05
RoW,Activity,Cultivation of plant-based fibers,1.4473751029381638e-05,1.4388232954868242e-05,1.2747896771798386e-05,7.003285413808158e-06,8.206588372493842e-06
RoW,Activity,"Cultivation of sugar cane, sugar beet",1.0111313557578989e-05,8.885107409354997e-06,8.032016128232053e-06,4.70759868134086e-06,5.858949902856347e-06
RoW,Activity,"Cultivation of vegetables, fruit, nuts",5.0827646421932204e-05,3.2770154149557295e-05,2.72324698435076e-05,1.5193848055668997e-05,2.721430928877174e-05
RoW,Activity,Cultivation of wheat,0.0001298982665132275,0.00011631374037408078,0.00010529946463595017,6.30940862950738e-05,7.733723480424623e-05
RoW,Activity,Distribution and trade of electricity,8.016035730674445e-05,7.652192984020793e-05,6.914144628600672e-05,4.318733250170357e-05,5.164038448299571e-05
RoW,Activity,Education (80),2.5803942607448937e-06,2.6198683272867407e-06,2.368127731526755e-06,1.7545273526087835e-06,1.8193018128953878e-06
RoW,Activity,Extra-territorial organizations and bodies,0.0,0.0,0.0,0.0,0.0
RoW,Activity,"Extraction of crude petroleum and services related to crude oil extraction, excluding surveying",0.004075208809383974,0.002979530603044532,0.0028650058405720424,0.0033270299791208244,0.002793598783674391
RoW,Activity,"Extraction of natural gas and services related to natural gas extraction, excluding surveying",0.012997104026915146,0.007683305216136822,0.006733072882819359,0.013537755933231988,0.012239565919387211
RoW,Activity,"Extraction, liquefaction, and regasification of other petroleum and gaseous materials",0.0005463852865581256,0.0004200897661799774,0.0003943009965058884,0.00032504725630024776,0.0003431248394715725
RoW,Activity,"Financial intermediation, except insurance and pension funding (65)",0.00012996616939050967,0.0001200777071624028,0.00011085414780731682,8.046083579871222e-05,9.146573424629123e-05
RoW,Activity,"Fishing, operating of fish hatcheries and fish farms; service activities incidental to fishing (05)",1.1904678560127351e-05,1.2940645557341033e-05,1.2609396386719117e-05,6.9424431400987505e-06,7.921864080901288e-06
RoW,Activity,"Forestry, logging and related service activities (02)",0.00010331564922118629,6.31440713827523e-05,5.266065614051891e-05,2.774833271628504e-05,5.294466421665334e-05
RoW,Activity,Health and social work (85),2.1783685891165298e-06,2.1083008099492716e-06,1.9113042144602477e-06,1.2699959416293414e-06,1.4500210658728327e-06
RoW,Activity,Hotels and restaurants (55),8.537886193276734e-05,0.00010730832979316378,0.00010397063663936794,6.854790734484733e-05,6.919551496743923e-05
RoW,Activity,Incineration of waste: Food,1.5189515315635228e-06,1.4399505908494674e-06,1.3223105692625893e-06,7.89712667333427e-07,9.239285923921046e-07
RoW,Activity,Incineration of waste: Metals and Inert materials,3.9264837880795753e-05,5.102306445983069e-05,5.503282942156354e-05,3.46710737290562e-05,2.9713070682992365e-05
RoW,Activity,Incineration of waste: Oil/Hazardous waste,2.261709813977396e-05,2.4940218088090405e-05,2.3957460956367245e-05,1.397166881585504e-05,1.4016108401550055e-05
RoW,Activity,Incineration of waste: Paper,2.191244426546475e-06,2.0709805956842855e-06,1.8960090190002805e-06,1.134205419408872e-06,1.3327123727786138e-06
RoW,Activity,Incineration of waste: Plastic,3.768488545804165e-05,3.843295096101181e-05,3.486508969868444e-05,2.114583673776221e-05,2.338979140975484e-05
RoW,Activity,Incineration of waste: Textiles,4.385231782755619e-05,4.499519349351903e-05,4.274937701939543e-05,2.3487859072130656e-05,2.603938553640743e-05
RoW,Activity,Incineration of waste: Wood,7.27312221699568e-07,7.076863918533704e-07,6.460686226180513e-07,4.184547474110377e-07,4.435206414058298e-07
RoW,Activity,Inland water transport,0.00030770783152595687,0.00032788965745396545,0.00030075642199727236,0.00019324900936624085,0.0002240890264808857
RoW,Activity,"Insurance and pension funding, except compulsory social security (66)",1.791292250453702e-05,1.754313435076523e-05,1.6765606791477805e-05,1.1999371443783454e-05,1.361336301236395e-05
RoW,Activity,Landfill of waste: Food,3.329120079501937e-06,2.66371333251671e-06,2.533871085183981e-06,1.5231053620652684e-06,2.099068567569588e-06
RoW,Activity,Landfill of waste: Inert/metal/hazardous,1.6965289658042024e-06,1.468654096276111e-06,1.3742595710226091e-06,8.243633152716814e-07,1.0609768454956539e-06
RoW,Activity,Landfill of waste: Paper,1.9567792577204202e-06,1.5623717872354594e-06,1.4842600476175803e-06,8.706838810973721e-07,5.312353292825525e-06
RoW,Activity,Landfill of waste: Plastic,9.839646529623066e-07,7.87509655378089e-07,7.394800106737824e-07,4.4205267071569235e-07,6.05232101497788e-07
RoW,Activity,Landfill of waste: Textiles,5.978382911727183e-07,5.112909636904558e-07,4.699263743715783e-07,2.8019110663687614e-07,3.6650947403356385e-07
RoW,Activity,Landfill of waste: Wood,6.504043055644165e-07,5.547451502581797e-07,5.110851476113319e-07,3.0538609779487503e-07,3.996429228115884e-07
RoW,Activity,"Lead, zinc and tin production",4.143345522909404e-05,6.053671191533464e-05,5.982539791748118e-05,2.76960507116911e-05,2.495429943204929e-05
RoW,Activity,Manufacture of basic iron and steel and of ferro-alloys and first products thereof,0.0033961884808033655,0.00782988509973615,0.007041576112465809,0.003015630007617104,0.0020392884801440745
RoW,Activity,Manufacture of beverages,1.133462174987762e-05,1.2147555451384516e-05,1.0944869104815914e-05,6.673022798478466e-06,7.75046733829825e-06
RoW,Activity,"Manufacture of bricks, tiles and construction products, in baked clay",4.9798057320719365e-05,3.902129656973525e-05,3.941580858266531e-05,2.1235846115375334e-05,2.880994170769307e-05
RoW,Activity,"Manufacture of cement, lime and plaster",0.0007342957962188875,0.0003334043324266637,0.00039021803792606627,0.00022637794422129728,0.0004066864464465228
RoW,Activity,Manufacture of ceramic goods,0.00017812735697429096,0.0001168634815629473,0.00012585567254570052,7.276668803016458e-05,0.0001072324809291748
RoW,Activity,Manufacture of coke oven products,0.0004328762764116391,0.0005243932937421597,0.00047612974520765664,0.00024835941778038865,0.0002507290285365918
RoW,Activity,Manufacture of electrical machinery and apparatus n.e.c. (31),0.00014602202484711261,0.00017922637978593092,0.00013251552532979826,0.00010265848596102338,9.630336377474977e-05
RoW,Activity,"Manufacture of fabricated metal products, except machinery and equipment (28)",0.0004231049987237407,0.000712316478021636,0.0006573660210157908,0.000305560135964484,0.0002528126422265406
RoW,Activity,Manufacture of fish products,1.147221896728719e-05,1.2818289172358798e-05,1.2229777548925722e-05,6.893671291319011e-06,7.54622870223222e-06
RoW,Activity,Manufacture of furniture; manufacturing n.e.c. (36),0.0001421129497262848,0.00016135739491211074,0.00013732214415318518,8.674697966683738e-05,8.709974764502437e-05
RoW,Activity,Manufacture of gas; distribution of gaseous fuels through mains,0.0006807706077802034,0.0004109403859702364,0.00036317515595453746,0.00021235078501259948,0.000363524583636171
RoW,Activity,Manufacture of glass and glass products,0.002010455287737486,0.0011966935069808663,0.0009022160341613518,0.0003655608801136686,0.0009306871750628004
RoW,Activity,Manufacture of machinery and equipment n.e.c. (29),0.00010811425780455552,0.0001222785894184719,0.00010042024697944391,5.420527928563341e-05,6.154995367549794e-05
RoW,Activity,"Manufacture of medical, precision and optical instruments, watches and clocks (33)",5.4031146663095485e-05,0.00010104662127832227,6.900588491258962e-05,4.109157374974976e-05,3.5286390319504095e-05
RoW,Activity,"Manufacture of motor vehicles, trailers and semi-trailers (34)",6.010339235485769e-05,5.5758308798465826e-05,5.1408765944749845e-05,2.8208589105296336e-05,3.7250890080303635e-05
RoW,Activity,Manufacture of office machinery and computers (30),6.784930038563889e-06,9.05099197854409e-06,6.872853694283371e-06,4.097661559541373e-06,4.217793083841069e-06
RoW,Activity,Manufacture of other non-metallic mineral products n.e.c.,0.0034946927507386928,0.0007585695154510594,0.0008075835621691574,0.00035583811888344614,0.0016166175704790508
RoW,Activity,Manufacture of other transport equipment (35),3.84849431472743e-05,5.061184965815125e-05,4.710231410695441e-05,2.542349110512002e-05,2.6703340148532172e-05
RoW,Activity,"Manufacture of radio, television and communication equipment and apparatus (32)",0.00010766403567766788,0.00025427036892034736,0.0001502014953627064,8.437564125588774e-05,6.497780294814988e-05
RoW,Activity,Manufacture of rubber and plastic products (25),0.00011574222561607444,0.00013607957300470724,0.00012413720059982835,6.470118281161454e-05,6.998593516147305e-05
RoW,Activity,Manufacture of textiles (17),0.00027551900265680176,0.0003376519114446007,0.00029849122526545593,0.00015167506111922013,0.0001672782546821579
RoW,Activity,Manufacture of tobacco products (16),2.8671363042816784e-05,1.7295221074307572e-05,1.3661263488237656e-05,6.928625312640536e-06,1.458465515991488e-05
RoW,Activity,Manufacture of wearing apparel; dressing and dyeing of fur (18),7.014257288121873e-05,7.598851977264644e-05,7.168800930832211e-05,4.140799660426726e-05,4.562950073453808e-05
RoW,Activity,"Manufacture of wood and of products of wood and cork, except furniture; manufacture of articles of straw and plaiting materials (20)",0.0005753949376248798,0.0004218194695381596,0.00044085410084216965,0.00022194722789946724,0.00031994304861627295
RoW,Activity,"Manure treatment (biogas), storage and land application",0.0,0.0,0.0,0.0,0.0
RoW,Activity,"Manure treatment (conventional), storage and land application",0.0,0.0,0.0,0.0,0.0
RoW,Activity,Meat animals nec,1.1694972123415718e-05,1.1249693352720324e-05,1.0095851791960561e-05,5.909324376860203e-06,7.018760859603812e-06
RoW,Activity,Mining of aluminium ores and concentrates,0.00048023648983375726,0.0003535222100886134,0.00025206153323220767,0.00011115558978495323,0.0002277448880194095
RoW,Activity,"Mining of chemical and fertilizer minerals, production of salt, other mining and quarrying n.e.c.",0.0001281909741963963,0.00022146373035498654,0.0002617705838472405,9.330697239097077e-05,6.825938479280475e-05
RoW,Activity,Mining of coal and lignite; extraction of peat (10),0.010368008983504453,0.004645569365510233,0.0039203899924697755,0.0026471112107166192,0.005176695854215246
RoW,Activity,Mining of copper ores and concentrates,0.0011918366021135733,0.0019121090000418087,0.001258779946445659,0.000564015110568345,0.0006069752890765471
RoW,Activity,Mining of iron ores,0.0005356584711912685,0.001255284293272306,0.0008374204519332529,0.0003703762810478593,0.00028756896473935154
RoW,Activity,"Mining of lead, zinc and tin ores and concentrates",0.0003062270414720629,0.00041974155680420664,0.00040386192991772175,0.00017289284875954633,0.00016920059511064936
RoW,Activity,Mining of nickel ores and concentrates,0.0006905243148853905,0.0009437716964969527,0.0008327703599316017,0.00036302227066505483,0.00037293134487655376
RoW,Activity,Mining of other non-ferrous metal ores and concentrates,0.0010018071229135415,0.0012199668228418318,0.0011890037445431577,0.0004917602904461408,0.0005297885617676491
RoW,Activity,Mining of precious metal ores and concentrates,0.002651257687274215,0.0008672241134372445,0.0006839149331177716,0.0003277946571332287,0.0012372226779185274
RoW,Activity,Mining of uranium and thorium ores (12),8.96759468277225e-05,8.527610013427236e-05,7.665079531591307e-05,4.540327428513353e-05,5.231966718511904e-05
RoW,Activity,N-fertiliser,8.01184364018461e-05,7.220186266213101e-05,6.468951958620347e-05,4.5841616231821034e-05,4.679366671641206e-05
RoW,Activity,Other business activities (74),6.410623615781016e-05,7.30824501001682e-05,6.628356314735965e-05,5.0802168830829775e-05,4.8171584040425394e-05
RoW,Activity,Other land transport,8.454363747892717e-05,8.384303845431864e-05,8.070139827516374e-05,5.1645972629871274e-05,6.492875070537503e-05
RoW,Activity,Other non-ferrous metal production,0.0002802483109829846,0.0003508319855371249,0.00030132603889717886,0.00013862100542952428,0.0001517379344820455
RoW,Activity,Other service activities (93),7.025650183895614e-06,6.9180661360285305e-06,6.198265987452839e-06,3.857651689940273e-06,4.641765078779938e-06
RoW,Activity,P- and other fertiliser,0.00022964063042945173,0.0001778063378099908,0.0001599963372283217,0.00011438540768188475,0.00013041195834134626
RoW,Activity,Paper,0.0001311274263808213,0.00014162294514221188,0.0001220152740747418,7.388178799221935e-05,8.17978888484276e-05
RoW,Activity,Petroleum Refinery,0.002449513010854758,0.0019729270027458415,0.0019070018252396624,0.0018530755651865332,0.0016926487733385507
RoW,Activity,Pigs farming,1.7482658086931303e-05,1.4874712537352074e-05,1.3771959000348064e-05,8.163604141595964e-06,1.0767899297756145e-05
RoW,Activity,"Plastics, basic",0.00029967131676064934,0.0003243913757875449,0.00026154844311145287,0.00013705804591766611,0.00016686561738716798
RoW,Activity,Post and telecommunications (64),4.823809894728377e-05,5.1843336898494255e-05,4.75701450425269e-05,3.578602879405526e-05,3.871146657455664e-05
RoW,Activity,Poultry farming,1.0567602802567511e-05,8.995793636491408e-06,8.28805666884338e-06,5.042593912889004e-06,6.553421770948635e-06
RoW,Activity,Precious metals production,0.0003810125775125332,0.00017418530860720767,0.00013356677255905417,6.509509808025598e-05,0.00018266045401699025
RoW,Activity,Private households with employed persons (95),2.4425172095545626e-06,2.947147182532237e-06,2.6197533909137952e-06,1.6992152857433233e-06,1.7184119778003524e-06
RoW,Activity,Processed rice,1.2630272109736984e-05,1.1278520449847123e-05,9.932586634975556e-06,5.726120210255329e-06,7.227035236057985e-06
RoW,Activity,Processing of Food products nec,1.9398738644038518e-05,1.5886956619837127e-05,1.4285470024270669e-05,8.426693315545613e-06,1.1554926618174628e-05
RoW,Activity,Processing of dairy products,1.8376566178223054e-05,1.7541533557702015e-05,1.4156380005245493e-05,8.183849905707316e-06,1.0876849496123538e-05
RoW,Activity,Processing of meat cattle,1.190912392170856e-05,8.073598325815798e-06,6.679511755396789e-06,3.872741937215695e-06,6.449751843602747e-06
RoW,Activity,Processing of meat pigs,6.827440157285038e-06,5.543306160355887e-06,4.948178339844489e-06,3.0684228862788982e-06,4.1412635574093925e-06
RoW,Activity,Processing of meat poultry,4.401711929958494e-06,3.143542372647955e-06,2.710613308230302e-06,1.699296226535507e-06,2.5642258077983875e-06
RoW,Activity,Processing of nuclear fuel,6.013484249377846e-05,4.554376515151391e-05,3.892826835013564e-05,2.084988955697911e-05,3.145520609824206e-05
RoW,Activity,Processing vegetable oils and fats,4.7732379894374526e-05,4.148083678179506e-05,3.5682039621380844e-05,1.9918742228283227e-05,2.664646485005184e-05
RoW,Activity,Production of electricity by Geothermal,1.2448707743492255e-05,2.7197727679138755e-06,2.39662185959349e-06,1.5194960547624358e-06,5.988974723638764e-06
RoW,Activity,Production of electricity by biomass and waste,0.0,0.0,0.0,0.0,0.0
RoW,Activity,Production of electricity by coal,0.0551933054809618,0.008700118354504424,0.0075936081463807295,0.004326863563704657,0.02555614480043846
RoW,Activity,Production of electricity by gas,0.027428218897418304,0.004707194347796053,0.004135559249777695,0.0025950912419654623,0.012893405445426217
RoW,Activity,Production of electricity by hydro,0.0,0.0,0.0,0.0,0.0
RoW,Activity,Production of electricity by nuclear,4.9807355232930774e-06,1.743493034446481e-06,1.5601765163288557e-06,8.595552124030606e-07,2.442331166932613e-06
RoW,Activity,Production of electricity by petroleum and other oil derivatives,0.008351419382390358,0.002436888263665203,0.0021449797596628985,0.0013770915944332578,0.004112589195324934
RoW,Activity,Production of electricity by solar photovoltaic,0.0,0.0,0.0,0.0,0.0
RoW,Activity,Production of electricity by solar thermal,0.0,0.0,0.0,0.0,0.0
RoW,Activity,"Production of electricity by tide, wave, ocean",0.0,0.0,0.0,0.0,0.0
RoW,Activity,Production of electricity by wind,0.0,0.0,0.0,0.0,0.0
RoW,Activity,Production of electricity nec,0.00023952370081444283,0.00012037057353828432,0.00010462166434883139,5.917273268335385e-05,0.00012249888924572699
RoW,Activity,Production of meat products nec,1.7482665590301207e-05,1.4421063772298929e-05,1.268464618504241e-05,7.541052148060173e-06,1.0122861921378556e-05
RoW,Activity,Production of offshore wind plants,0.0,0.0,0.0,0.0,0.0
RoW,Activity,Production of onshore wind plants,0.0,0.0,0.0,0.0,0.0
RoW,Activity,Production of photovoltaic plants,0.0,0.0,0.0,0.0,0.0
RoW,Activity,Public administration and defence; compulsory social security (75),1.674323576688488e-05,1.4708851550810955e-05,1.3732016272509573e-05,8.893369808823095e-06,1.147765137480531e-05
RoW,Activity,"Publishing, printing and reproduction of recorded media (22)",3.548227911028033e-05,3.820800272432025e-05,3.397371990853814e-05,2.4326019409536082e-05,2.611485676897415e-05
RoW,Activity,Pulp,0.00022488153736996525,0.00015520010856910862,0.0001208577930342184,6.959785895859024e-05,0.00011783723797731478
RoW,Activity,Quarrying of sand and clay,0.00024366214244215083,0.0002142972177156926,0.0001980706929566275,9.547280909373673e-05,0.00013144677087610559
RoW,Activity,Quarrying of stone,0.00042147748914621395,0.00021132307406611847,0.00024559369051915786,9.564100785522568e-05,0.00020375804751853474
RoW,Activity,Raw milk,1.1918728416963855e-05,1.0962631607731332e-05,9.728934742193827e-06,5.883486684510256e-06,7.534723491940445e-06
RoW,Activity,Re-processing of ash into clinker,1.8749952610834697e-05,7.327543858128217e-06,8.946411809938057e-06,5.183752670012499e-06,1.0221521503941042e-05
RoW,Activity,Re-processing of secondary aluminium into new aluminium,6.104916726516453e-05,7.764129701532916e-05,6.759030099520899e-05,2.802969482040975e-05,3.1433068653651315e-05
RoW,Activity,Re-processing of secondary construction material into aggregates,3.0840610853963734e-07,2.1050014037613183e-07,2.1813695643079036e-07,1.5287459183931806e-07,2.0632631268549118e-07
RoW,Activity,Re-processing of secondary copper into new copper,1.5521563845793355e-05,4.8947610278404625e-05,3.0035202776247568e-05,1.3805163470916475e-05,8.827589155295823e-06
RoW,Activity,Re-processing of secondary glass into new glass,1.410736405356426e-05,8.363311670614114e-06,6.299400391451155e-06,2.540970339944021e-06,6.52320720134933e-06
RoW,Activity,"Re-processing of secondary lead into new lead, zinc and tin",2.447212476725229e-05,3.2717646874072935e-05,3.215866607729705e-05,1.4817605415402571e-05,1.4334233974829036e-05
RoW,Activity,Re-processing of secondary other non-ferrous metals into new other non-ferrous metals,1.9702744642203037e-05,2.6057607925457883e-05,2.248053362098645e-05,1.0263420984286578e-05,1.07468145398285e-05
RoW,Activity,Re-processing of secondary paper into new pulp,5.603654250601186e-05,3.6182857117589015e-05,2.8287191120372765e-05,1.640236037740599e-05,2.9176064562680546e-05
RoW,Activity,Re-processing of secondary plastic into new plastic,1.0659156532585582e-05,1.1604523425524702e-05,9.318567315990007e-06,4.856328556719136e-06,5.925268678503191e-06
RoW,Activity,Re-processing of secondary preciuos metals into new preciuos metals,0.0,0.0,0.0,0.0,0.0
RoW,Activity,Re-processing of secondary steel into new steel,0.0001896893787798637,0.00043977083477686745,0.0003955888519119652,0.00016909401618146993,0.00011389974234515879
RoW,Activity,Re-processing of secondary wood material into new wood material,1.02148826515902e-05,7.498448093079464e-06,7.860516050748118e-06,3.948189419211941e-06,5.678982188077695e-06
RoW,Activity,Real estate activities (70),2.1528953836890593e-05,2.1889044816422685e-05,2.138931205258604e-05,1.5288009561264876e-05,1.7264254404548974e-05
RoW,Activity,"Recreational, cultural and sporting activities (92)",6.043963292478274e-06,6.587193301206939e-06,5.995538491446749e-06,4.394523564746734e-06,4.45934102009943e-06
RoW,Activity,Recycling of bottles by direct reuse,0.0,0.0,0.0,0.0,0.0
RoW,Activity,Recycling of waste and scrap,0.0007545697469525181,0.0009021090845179409,0.0007612247219079336,0.00035449321646398,0.0004067697929412496
RoW,Activity,Renting of machinery and equipment without operator and of personal and household goods (71),3.408057123984109e-05,3.343388011969192e-05,3.154632480761691e-05,2.3353174128494655e-05,2.4398653332902372e-05
RoW,Activity,Research and development (73),8.277612314781125e-05,0.00010894009455849014,8.898247034985509e-05,5.0970878827583577e-05,5.071664194238786e-05
RoW,Activity,Retail sale of automotive fuel,8.148535064663614e-05,7.953899829112268e-05,7.549609130757954e-05,4.9107501563486743e-05,6.552039458588368e-05
RoW,Activity,"Retail trade, except of motor vehicles and motorcycles; repair of personal and household goods (52)",8.25719493933588e-05,8.249594371497475e-05,7.482940752656746e-05,6.0021601523772246e-05,7.009373085163489e-05
RoW,Activity,"Sale, maintenance, repair of motor vehicles, motor vehicles parts, motorcycles, motor cycles parts and accessoiries",3.2966232671405155e-05,3.196741188565993e-05,2.9756206408063318e-05,1.824815414293316e-05,2.2357405365146424e-05
RoW,Activity,Sea and coastal water transport,0.003829551230701246,0.003448834128484991,0.008334623574676852,0.0027725030976851824,0.004606513341279524
RoW,Activity,Steam and hot water supply,0.0028952099686447674,0.002721607228834849,0.0024322910934487236,0.0015384038093753639,0.001800639136058102
