RoW,Activity,"Sale, maintenance, repair of motor vehicles, motor vehicles parts, motorcycles, motor cycles parts and accessoiries",4.134948630782519e-05,3.9891480122067125e-05,3.729434697711026e-05,1.9909782749609997e-05,1.9652619518198698e-05
RoW,Activity,Sea and coastal water transport,0.009854613695374282,0.004610377527159482,0.009993680205984214,0.0025038608020324284,0.0036906837463951915
RoW,Activity,Steam and hot water supply,0.003857317797660192,0.0037613839770129476,0.003388082331355051,0.0018567433004127918,0.0017701281117463638
RoW,Activity,Sugar refining,1.0053023502738872e-05,8.208718654753899e-06,7.023998195716934e-06,3.3652036609902503e-06,4.193576419389187e-06
RoW,Activity,Supporting and auxiliary transport activities; activities of travel agencies (63),0.0006964329247339319,0.0007378465755534726,0.0009106260395919024,0.000391324380348345,0.00034973416873135634
RoW,Activity,"Tanning and dressing of leather; manufacture of luggage, handbags, saddlery, harness and footwear (19)",9.744892703395638e-06,1.0818121556257624e-05,9.228742874830134e-06,4.205926675420873e-06,4.3377569503261645e-06
RoW,Activity,Transmission of electricity,3.505959682471366e-05,3.383739151952797e-05,2.9504359942802666e-05,1.66353134139151e-05,1.60687862254025e-05
RoW,Activity,Transport via pipelines,0.001320230065853565,0.0011414743635577331,0.0011444912477602065,0.0009686526455510685,0.0007852705209077938
RoW,Activity,Transport via railways,0.00020215519537948457,0.00021270988013684166,0.0002099880572252295,0.00011333528418085673,0.00010616641351221812
RoW,Activity,"Waste water treatment, food",1.326238819858311e-06,1.2904870208747223e-06,1.2111198999113988e-06,5.661502528716789e-07,6.165602229099577e-07
RoW,Activity,"Waste water treatment, other",1.973556381097672e-06,1.8032312492355534e-06,1.6063872370901145e-06,7.967882655274193e-07,8.938961908091329e-07
RoW,Activity,"Wholesale trade and commission trade, except of motor vehicles and motorcycles (51)",0.00018483891370145108,0.00018762613811907264,0.0001648411542903677,8.652478356223025e-05,8.876662031877112e-05
RoW,Activity,"Wool, silk-worm cocoons",5.642322222743594e-05,5.512193726797996e-05,5.031441816175545e-05,2.7231281358679994e-05,2.668954193503049e-05
USA,Activity,Activities auxiliary to financial intermediation (67),1.757882391292112e-05,7.650287812036702e-06,6.052967501034346e-06,3.3902148013171325e-06,6.672735681803198e-06
USA,Activity,Activities of membership organisation n.e.c. (91),1.2941116211595452e-06,5.776893187807527e-07,5.108359788576375e-07,3.1032775106664164e-07,5.189688346534347e-07
USA,Activity,Air transport (62),0.0008650504587592313,0.0007436814616383519,0.0005893893403864588,0.00033626837670639836,0.0003924769183074744
USA,Activity,Aluminium production,0.0001331939662090175,4.365043511408596e-05,3.092594503562771e-05,1.0231672387569052e-05,4.4358140113242824e-05
USA,Activity,Animal products nec,9.389488386921475e-07,7.738191871744244e-07,6.728881295011881e-07,3.0856533554878193e-07,3.9256990117443335e-07
USA,Activity,"Biogasification of food waste, incl. land application",0.0,0.0,0.0,0.0,0.0
USA,Activity,"Biogasification of paper, incl. land application",0.0,0.0,0.0,0.0,0.0
USA,Activity,"Biogasification of sewage slugde, incl. land application",1.9628230519599746e-06,6.815639506685282e-07,6.062743380213615e-07,2.637078852903896e-07,7.015571024362219e-07
USA,Activity,Casting of metals,5.070727013020756e-05,3.3211593648721765e-05,2.67837592348681e-05,1.203613250521242e-05,1.971413400825207e-05
USA,Activity,Cattle farming,5.871824272846981e-06,2.8108512590562307e-06,2.485176857701909e-06,1.2456452488135036e-06,2.246083287563655e-06
USA,Activity,Chemicals nec,0.003442180487404256,0.001029835897011944,0.0009506624482516798,0.0005106078152801659,0.0012409730616524924
USA,Activity,"Collection, purification and distribution of water (41)",7.431710423530209e-07,1.934534715575737e-07,1.7412759310842346e-07,8.88110823295655e-08,2.639839907942105e-07
USA,Activity,"Composting of food waste, incl. land application",1.0529101125197216e-07,6.941261723308703e-08,7.054180782728226e-08,4.139483163638181e-08,5.5421908564764064e-08
USA,Activity,"Composting of paper and wood, incl. land application",4.1946311834679896e-07,1.2311005611183287e-07,1.147180734309839e-07,5.768335369991729e-08,1.5101079486928754e-07
USA,Activity,Computer and related activities (72),8.47341551701354e-06,4.569551992767489e-06,3.987290601514195e-06,2.47804596377739e-06,3.703036599048066e-06
USA,Activity,Construction (45),2.5708283297722095e-05,2.787510274471883e-06,2.8061030602204676e-06,1.7211124674676915e-06,8.87523940679972e-06
USA,Activity,Copper production,0.0001255661170428469,0.00015557845910723082,0.0001042535895741475,3.4968818176294443e-05,4.724791326436428e-05
USA,Activity,Cultivation of cereal grains nec,1.6415267643128236e-05,7.544042390719091e-06,6.317155595557766e-06,3.043433264899888e-06,6.0876272539754715e-06
USA,Activity,Cultivation of crops nec,3.121602293015928e-05,1.0963468560538881e-05,9.686023688977461e-06,4.972622235164688e-06,1.138482547174243e-05
USA,Activity,Cultivation of oil seeds,4.766188000968117e-05,3.853829019988243e-05,2.2126125871074222e-05,8.064616548849243e-06,1.6589295106198487e-05
USA,Activity,Cultivation of paddy rice,3.491719116803802e-05,2.1491859497734972e-05,1.9238074012064775e-05,9.619030744274887e-06,1.4189549390837329e-05
USA,Activity,Cultivation of plant-based fibers,3.955877848536575e-05,2.585563661066282e-05,2.003361230565948e-05,7.937938563874837e-06,1.4619596230355969e-05
USA,Activity,"Cultivation of sugar cane, sugar beet",2.9676567588719747e-06,1.8346335502979147e-06,1.5897733034877921e-06,7.761075329287327e-07,1.182757408057569e-06
USA,Activity,"Cultivation of vegetables, fruit, nuts",2.685980311225974e-06,1.8521372071417181e-06,1.6136521430816763e-06,7.810332893115303e-07,1.0827121469474166e-06
USA,Activity,Cultivation of wheat,2.5949090868150385e-05,2.537828265677563e-05,2.311475507821832e-05,1.1697473574743278e-05,1.1622140285052572e-05
USA,Activity,Distribution and trade of electricity,8.32733870019186e-07,2.220528957482897e-07,1.9417274133837364e-07,9.949792455638947e-08,2.9673009583911913e-07
USA,Activity,Education (80),3.434258783582133e-07,9.671901589831798e-08,8.539480133603619e-08,6.201325407129349e-08,1.31802905517982e-07
USA,Activity,Extra-territorial organizations and bodies,0.0,0.0,0.0,0.0,0.0
USA,Activity,"Extraction of crude petroleum and services related to crude oil extraction, excluding surveying",0.0002925515083642709,0.00012178087761238109,0.00011936543535706859,9.501977187042636e-05,0.0001188011239702621
USA,Activity,"Extraction of natural gas and services related to natural gas extraction, excluding surveying",0.0001019165686820942,5.935022920698761e-05,5.891242948329421e-05,4.130411842375603e-05,4.387049651711352e-05
USA,Activity,"Extraction, liquefaction, and regasification of other petroleum and gaseous materials",2.9436186009352664e-09,5.095005092747169e-10,4.81082382973074e-10,3.1715250881948376e-10,1.0284771759260662e-09
USA,Activity,"Financial intermediation, except insurance and pension funding (65)",1.94816965680106e-05,1.231202064032088e-05,1.1254765489085962e-05,8.402442713306939e-06,9.644320281806382e-06
USA,Activity,"Fishing, operating of fish hatcheries and fish farms; service activities incidental to fishing (05)",9.680893484618394e-07,8.458113810337796e-07,7.661552032025916e-07,3.45313903961728e-07,4.1631046427391467e-07
USA,Activity,"Forestry, logging and related service activities (02)",1.508846980095253e-05,5.7876043889690045e-06,4.8490175575259335e-06,2.128376877086869e-06,5.407048175966881e-06
USA,Activity,Health and social work (85),1.0443504252267935e-07,2.171646164598493e-08,1.9207586684703913e-08,1.4263360702449483e-08,3.865458041610552e-08
USA,Activity,Hotels and restaurants (55),2.819019735476463e-05,1.9543680994531323e-05,1.7139697448165644e-05,8.44149393799834e-06,1.2424587085720607e-05
USA,Activity,Incineration of waste: Food,2.6877877891357804e-07,1.5673298215502936e-07,1.503040124973187e-07,6.086815989853978e-08,1.0125382100545524e-07
USA,Activity,Incineration of waste: Metals and Inert materials,7.197940414778108e-06,5.34514691359297e-06,6.601010706307072e-06,3.0691522988028485e-06,3.500765976466352e-06
USA,Activity,Incineration of waste: Oil/Hazardous waste,8.56569065333803e-07,6.545773640078256e-07,6.362919353520605e-07,2.9837603205294354e-07,4.227698327732595e-07
USA,Activity,Incineration of waste: Paper,7.286984260110982e-07,2.9381213428183806e-07,2.751718304781369e-07,1.299146098142394e-07,2.8421222844686055e-07
USA,Activity,Incineration of waste: Plastic,1.214722110838149e-05,3.954845948495574e-06,3.6468821159783915e-06,2.113110909735508e-06,4.50534192511542e-06
USA,Activity,Incineration of waste: Textiles,2.535264420094323e-06,9.37836550200995e-07,8.506418568345224e-07,3.82923033460558e-07,9.170573813763891e-07
USA,Activity,Incineration of waste: Wood,1.936121189767552e-07,7.517304458973338e-08,7.62545525555029e-08,5.367032273791124e-08,7.584467160733869e-08
USA,Activity,Inland water transport,2.881157991494713e-05,2.413572198258148e-05,2.0145329234963695e-05,8.28620670333883e-06,1.1601670620278969e-05
USA,Activity,"Insurance and pension funding, except compulsory social security (66)",4.769899647810242e-06,2.7632716483575724e-06,2.2912207710964574e-06,1.6326728892121503e-06,2.170960542903741e-06
USA,Activity,Landfill of waste: Food,3.933695252882684e-07,1.4269719881962654e-07,1.3255316855213245e-07,6.577595580032624e-08,1.4893207289840287e-07
USA,Activity,Landfill of waste: Inert/metal/hazardous,5.431964497037037e-07,1.6278469431415267e-07,1.5096238392792723e-07,7.573448605305295e-08,1.9766195595292282e-07
USA,Activity,Landfill of waste: Paper,4.7282312428043315e-07,1.5591842511384484e-07,1.4443584341308312e-07,7.080576816906825e-08,1.755697571629694e-07
USA,Activity,Landfill of waste: Plastic,3.4869720004658385e-07,1.0346382981272758e-07,9.557611362658114e-08,4.642002223057147e-08,1.2503155028280372e-07
USA,Activity,Landfill of waste: Textiles,1.5900773545630852e-07,4.8933099934486214e-08,4.564596555931453e-08,2.2678274136055945e-08,5.757792417438414e-08
USA,Activity,Landfill of waste: Wood,1.7693167060756332e-07,5.607735310543314e-08,5.2906657805335956e-08,2.5622380184109696e-08,6.407810001778382e-08
USA,Activity,"Lead, zinc and tin production",1.9552320208307844e-06,3.4296761567926427e-06,3.4061580430302755e-06,1.2292149538086399e-06,1.0065282178457798e-06
USA,Activity,Manufacture of basic iron and steel and of ferro-alloys and first products thereof,0.00021657819641167277,0.00017944598949030341,0.00015063581095018408,5.714667259565735e-05,8.349912750179116e-05
USA,Activity,Manufacture of beverages,4.7613925409726745e-06,4.397127661158013e-06,2.94919786014271e-06,1.232505564998943e-06,1.837964196372647e-06
USA,Activity,"Manufacture of bricks, tiles and construction products, in baked clay",0.0002066508756011744,1.1280985084644616e-05,9.10977801581582e-06,3.467527212786572e-06,6.669421691483632e-05
USA,Activity,"Manufacture of cement, lime and plaster",7.452053288333807e-05,1.191024522910657e-05,1.1192906574836893e-05,5.435796827807032e-06,2.549153502039745e-05
USA,Activity,Manufacture of ceramic goods,1.3519139345739299e-05,6.574170802526044e-06,7.33275513749913e-06,3.736638855388697e-06,6.089744791543762e-06
USA,Activity,Manufacture of coke oven products,1.2853682939017389e-05,1.3964451127548243e-05,1.1631223519797868e-05,4.361461595837412e-06,5.215424040734576e-06
USA,Activity,Manufacture of electrical machinery and apparatus n.e.c. (31),4.357605972136994e-05,3.8234519905089785e-05,2.6251601422111355e-05,1.5416384378138056e-05,1.9371005732785196e-05
USA,Activity,"Manufacture of fabricated metal products, except machinery and equipment (28)",4.294405871197791e-05,2.4568990266730574e-05,2.108405227578239e-05,8.64308630536153e-06,1.5972590437166416e-05
USA,Activity,Manufacture of fish products,2.8209402472458203e-06,3.401549839606396e-06,3.2119616110777166e-06,1.4792121131937217e-06,1.2963020798814278e-06
USA,Activity,Manufacture of furniture; manufacturing n.e.c. (36),7.43732091014024e-05,3.1280613966570115e-05,2.7201522375658713e-05,1.4580371734416462e-05,2.7504827429734883e-05
USA,Activity,Manufacture of gas; distribution of gaseous fuels through mains,0.0002204366805698178,2.8520023760966544e-05,2.4731304059124925e-05,1.2587201450357792e-05,7.378816857426168e-05
USA,Activity,Manufacture of glass and glass products,0.008344067750380628,0.00014019256828968362,0.00010376393450762034,3.0761234247099134e-05,0.002661958260159784
USA,Activity,Manufacture of machinery and equipment n.e.c. (29),4.824513149886095e-05,3.3530685629229395e-05,2.7488389939483313e-05,1.2052166342868395e-05,1.8774923872707226e-05
USA,Activity,"Manufacture of medical, precision and optical instruments, watches and clocks (33)",8.313723435928374e-06,1.1591785542403872e-05,8.408408616057634e-06,4.082928676549218e-06,3.9188893093927225e-06
USA,Activity,"Manufacture of motor vehicles, trailers and semi-trailers (34)",5.2151919757146614e-05,2.2486857253405423e-05,1.9138589284772663e-05,8.511858615580927e-06,1.948104469806926e-05
USA,Activity,Manufacture of office machinery and computers (30),7.991266712271572e-06,9.678815293851014e-06,7.386400721349121e-06,3.5276079260221284e-06,3.685273415609539e-06
USA,Activity,Manufacture of other non-metallic mineral products n.e.c.,0.0008057265876852946,3.6538983966392186e-05,3.84357300896039e-05,1.3201461035529526e-05,0.0002600013372996532
USA,Activity,Manufacture of other transport equipment (35),4.387983495108327e-05,4.8436886759742426e-05,4.06992584052596e-05,1.6960911482215134e-05,1.9593981852984767e-05
USA,Activity,"Manufacture of radio, television and communication equipment and apparatus (32)",2.323236300279064e-05,2.548187304443855e-05,1.6760128333627236e-05,7.926154511452161e-06,9.468741301105912e-06
USA,Activity,Manufacture of rubber and plastic products (25),1.4746060356048094e-05,6.4312516250024106e-06,5.609175756776249e-06,2.4927110879530844e-06,5.441761569545968e-06
USA,Activity,Manufacture of textiles (17),4.274811708217034e-05,1.9625318501103095e-05,1.7308757109652513e-05,8.450945023115355e-06,1.601808498049826e-05
USA,Activity,Manufacture of tobacco products (16),6.809356749836427e-07,4.6215119149405746e-07,3.813030880468626e-07,1.5487808441755313e-07,2.591207287832298e-07
USA,Activity,Manufacture of wearing apparel; dressing and dyeing of fur (18),3.8363860672219933e-07,2.308853018977743e-07,2.1019864804853558e-07,1.1221111523312945e-07,1.610416453902e-07
USA,Activity,"Manufacture of wood and of products of wood and cork, except furniture; manufacture of articles of straw and plaiting materials (20)",5.077223709444021e-05,1.713025227303105e-05,1.5784766145969634e-05,6.663928887467331e-06,1.8173421384323492e-05
USA,Activity,"Manure treatment (biogas), storage and land application",0.0,0.0,0.0,0.0,0.0
USA,Activity,"Manure treatment (conventional), storage and land application",0.0,0.0,0.0,0.0,0.0
USA,Activity,Meat animals nec,1.274066057479189e-08,7.66901291722652e-09,7.072570872467654e-09,3.438282300874652e-09,5.071012688351049e-09
USA,Activity,Mining of aluminium ores and concentrates,4.255742365915961e-06,1.5112423868048458e-07,1.166952354016411e-07,3.565735893741834e-08,1.3612717856264662e-06
USA,Activity,"Mining of chemical and fertilizer minerals, production of salt, other mining and quarrying n.e.c.",8.481408155054426e-05,5.5383888166072645e-05,5.1233087279553575e-05,2.0939397646155804e-05,3.2097322029126585e-05
USA,Activity,Mining of coal and lignite; extraction of peat (10),0.0024659453302803593,0.00018621693841757347,0.0001848373373049339,0.00011151207340757357,0.000825325193541302
USA,Activity,Mining of copper ores and concentrates,0.00010592850941827957,5.710862995095745e-05,4.067321759785595e-05,1.3515226285508823e-05,3.656589689540189e-05
USA,Activity,Mining of iron ores,2.051123096556102e-05,1.0539358138777524e-05,8.332908339496714e-06,3.1263723503054953e-06,7.292215916085161e-06
USA,Activity,"Mining of lead, zinc and tin ores and concentrates",1.2056608408906733e-05,1.291839787928291e-05,1.40489313864653e-05,4.223859764827909e-06,4.822419312248011e-06
USA,Activity,Mining of nickel ores and concentrates,0.0,0.0,0.0,0.0,0.0
USA,Activity,Mining of other non-ferrous metal ores and concentrates,3.708405074407841e-06,5.5473485176174344e-06,4.806705156684912e-06,2.0309502905968685e-06,1.809150208994563e-06
USA,Activity,Mining of precious metal ores and concentrates,0.0012685337742896659,4.543125836389676e-05,3.419219387618595e-05,1.2875656837106987e-05,0.00040720679195251633
USA,Activity,Mining of uranium and thorium ores (12),1.491347101047378e-05,5.767811352159281e-06,5.108350221571986e-06,2.391586764585096e-06,5.392143486141204e-06
USA,Activity,N-fertiliser,8.459038492312097e-06,2.4370480453253647e-06,1.8925765491532681e-06,1.0688645661253978e-06,2.9337375614167467e-06
USA,Activity,Other business activities (74),0.00018451674947894838,9.939490395606571e-05,8.79667905078969e-05,5.612025954372612e-05,7.847096078716623e-05
USA,Activity,Other land transport,1.4103562955089802e-08,4.154948512210633e-09,3.924772100517627e-09,2.2932431427702897e-09,5.462441718646556e-09
USA,Activity,Other non-ferrous metal production,1.617163148630612e-05,2.8429826613967323e-05,2.4648354082484126e-05,1.0725632142389737e-05,8.546098033259725e-06
USA,Activity,Other service activities (93),8.87698707501248e-07,2.7493355878681857e-07,2.416210400154876e-07,1.4328034306672631e-07,3.323700874606869e-07
USA,Activity,P- and other fertiliser,6.123142331417233e-05,2.3920601294415725e-05,2.0967743301178214e-05,1.1304975987457345e-05,2.253976811796798e-05
USA,Activity,Paper,0.0005568204193626498,0.00016383001489337037,0.00013702240924819142,6.767469224730739e-05,0.00019711239239643112
USA,Activity,Petroleum Refinery,0.0005810677501018189,0.00028979189561182897,0.0002970100965311574,0.0002807336723524758,0.0002590246820058914
USA,Activity,Pigs farming,5.340133358962179e-06,2.7673806385504975e-06,2.317527876825829e-06,1.1307209393983093e-06,2.0347580405308587e-06
USA,Activity,"Plastics, basic",8.744136110549948e-05,6.46127383146527e-05,4.897031747638203e-05,2.1723693574261973e-05,3.354873767068005e-05
USA,Activity,Post and telecommunications (64),2.6396918039063134e-05,1.291917410316187e-05,1.1628037768895993e-05,7.682699011632518e-06,1.1267298368561455e-05
USA,Activity,Poultry farming,4.3902827637426255e-06,2.8287619480428183e-06,2.3323543017828203e-06,1.1029091219446052e-06,1.7546525928374963e-06
USA,Activity,Precious metals production,0.0014594691329278015,3.129543917212521e-05,2.3401696183335883e-05,9.245243525506557e-06,0.00046719901457839666
USA,Activity,Private households with employed persons (95),1.2670034673603492e-09,1.5870697526502405e-09,1.660129765792284e-09,1.199751130380494e-09,1.062260102486618e-09
USA,Activity,Processed rice,4.906101085023056e-06,4.687856685028129e-06,4.2575212930923405e-06,2.1153474396049655e-06,2.17378939081994e-06
USA,Activity,Processing of Food products nec,1.3236040286874434e-05,6.381709453616336e-06,5.405116672535177e-06,2.6626900601970977e-06,5.027871747866334e-06
USA,Activity,Processing of dairy products,1.7805854783690705e-05,1.4972241221813327e-05,1.012489085897192e-05,4.370754420804216e-06,6.893553176151363e-06
USA,Activity,Processing of meat cattle,1.7379399102804986e-06,7.681963915959686e-07,6.906632915623144e-07,3.50725275803516e-07,6.612600154073279e-07
USA,Activity,Processing of meat pigs,1.1338463062401905e-06,5.965039720128276e-07,4.997375281095881e-07,2.441513812056626e-07,4.32918487326893e-07
USA,Activity,Processing of meat poultry,9.725270110280193e-07,6.189971251601631e-07,4.990844994356924e-07,2.3337533523533115e-07,3.8696485978311136e-07
USA,Activity,Processing of nuclear fuel,1.4122973959485397e-08,9.17211285370027e-09,5.345104858371607e-09,1.884303459605704e-09,4.795373935463523e-09
USA,Activity,Processing vegetable oils and fats,1.3157601784150282e-05,6.652287439043789e-06,5.912558515289229e-06,2.909573774702234e-06,5.037330286045435e-06
USA,Activity,Production of electricity by Geothermal,8.749728716741324e-07,4.387976529132224e-09,3.787277636346316e-09,1.8257875083223828e-09,2.791130858638937e-07
USA,Activity,Production of electricity by biomass and waste,0.0,0.0,0.0,0.0,0.0
USA,Activity,Production of electricity by coal,0.12490159894348245,0.0021277202588011576,0.0018071788346190908,0.000871765047541202,0.0400210739158069
USA,Activity,Production of electricity by gas,0.0800271043377985,0.0005164126842254542,0.00043996001361030286,0.00021290501502522731,0.025541239931780115
USA,Activity,Production of electricity by hydro,0.0,0.0,0.0,0.0,0.0
USA,Activity,Production of electricity by nuclear,3.897811669667326e-05,3.224250786655433e-07,2.746073497641638e-07,1.327468846910193e-07,1.2448703699089668e-05
USA,Activity,Production of electricity by petroleum and other oil derivatives,0.0018372590719020205,1.899087215611185e-05,1.6795452646241514e-05,8.6941314323891e-06,0.0005875533039488752
USA,Activity,Production of electricity by solar photovoltaic,0.0,0.0,0.0,0.0,0.0
USA,Activity,Production of electricity by solar thermal,0.0,0.0,0.0,0.0,0.0
USA,Activity,"Production of electricity by tide, wave, ocean",0.0,0.0,0.0,0.0,0.0
USA,Activity,Production of electricity by wind,0.0,0.0,0.0,0.0,0.0
USA,Activity,Production of electricity nec,1.3618263203659682e-05,7.762032603989718e-08,6.688992007541208e-08,3.239088762500911e-08,4.345436586671111e-06
USA,Activity,Production of meat products nec,2.4238591876312915e-05,9.62698968839293e-06,7.96178449666788e-06,3.943025377583022e-06,8.83374923462993e-06
USA,Activity,Production of offshore wind plants,0.0,0.0,0.0,0.0,0.0
USA,Activity,Production of onshore wind plants,0.0,0.0,0.0,0.0,0.0
USA,Activity,Production of photovoltaic plants,0.0,0.0,0.0,0.0,0.0
USA,Activity,Public administration and defence; compulsory social security (75),2.9924162099975468e-05,2.244186053657947e-06,1.912605207288062e-06,1.1748892544416764e-06,1.0064609815498668e-05
USA,Activity,"Publishing, printing and reproduction of recorded media (22)",3.769033255909619e-05,2.119720050700764e-05,1.8628324751432897e-05,1.1882860323095842e-05,1.6270465565627105e-05
USA,Activity,Pulp,1.2810780756275523e-05,7.703971997530504e-06,5.501862585186861e-06,2.529583239085675e-06,4.694331941521406e-06
USA,Activity,Quarrying of sand and clay,0.0001944279214419899,2.0320838866038887e-05,1.8051534223352347e-05,6.909051303990178e-06,6.393875969919259e-05
USA,Activity,Quarrying of stone,4.124802314445044e-05,5.169923224381307e-06,5.794369339984746e-06,2.834885098156088e-06,1.4034928388370908e-05
USA,Activity,Raw milk,3.283993698079197e-06,2.7590966280970382e-06,1.8662818936717658e-06,8.058898362190286e-07,1.2713819881468047e-06
USA,Activity,Re-processing of ash into clinker,0.0,0.0,0.0,0.0,0.0
USA,Activity,Re-processing of secondary aluminium into new aluminium,0.0,0.0,0.0,0.0,0.0
USA,Activity,Re-processing of secondary construction material into aggregates,0.0,0.0,0.0,0.0,0.0
USA,Activity,Re-processing of secondary copper into new copper,0.0,0.0,0.0,0.0,0.0
USA,Activity,Re-processing of secondary glass into new glass,0.0,0.0,0.0,0.0,0.0
USA,Activity,"Re-processing of secondary lead into new lead, zinc and tin",0.0,0.0,0.0,0.0,0.0
USA,Activity,Re-processing of secondary other non-ferrous metals into new other non-ferrous metals,0.0,0.0,0.0,0.0,0.0
USA,Activity,Re-processing of secondary paper into new pulp,0.0,0.0,0.0,0.0,0.0
USA,Activity,Re-processing of secondary plastic into new plastic,0.0,0.0,0.0,0.0,0.0
USA,Activity,Re-processing of secondary preciuos metals into new preciuos metals,0.0,0.0,0.0,0.0,0.0
USA,Activity,Re-processing of secondary steel into new steel,0.0,0.0,0.0,0.0,0.0
USA,Activity,Re-processing of secondary wood material into new wood material,0.0,0.0,0.0,0.0,0.0
USA,Activity,Real estate activities (70),1.2520999533203227e-05,6.331564246605167e-06,5.745729326495482e-06,3.4769859236977436e-06,5.33737037663587e-06
USA,Activity,"Recreational, cultural and sporting activities (92)",4.933518891547849e-06,2.5305576659652915e-06,2.2456005937508452e-06,1.4364875893340093e-06,2.0810391033728823e-06
USA,Activity,Recycling of bottles by direct reuse,0.0,0.0,0.0,0.0,0.0
USA,Activity,Recycling of waste and scrap,0.0004065065583736733,0.00013534030855031184,0.00011362814844313707,5.3323561814473365e-05,0.00014459876601676417
USA,Activity,Renting of machinery and equipment without operator and of personal and household goods (71),1.8873788005935366e-05,7.988503208843164e-06,6.986158201595715e-06,3.961248420100846e-06,7.351067616863745e-06
USA,Activity,Research and development (73),1.4069818595044636e-05,1.492166219752408e-05,1.1894411866490598e-05,4.954370972052076e-06,5.732122684877262e-06
USA,Activity,Retail sale of automotive fuel,5.096101176494474e-07,3.6065895907109776e-07,3.559548274136052e-07,1.9300668808421602e-07,2.5090224218222975e-07
USA,Activity,"Retail trade, except of motor vehicles and motorcycles; repair of personal and household goods (52)",2.535255234692063e-06,4.921594238249713e-07,4.095803598362618e-07,1.9666979387368163e-07,8.64166329034511e-07
USA,Activity,"Sale, maintenance, repair of motor vehicles, motor vehicles parts, motorcycles, motor cycles parts and accessoiries",1.9557500511092813e-05,3.8227294278369464e-06,3.1926674993484976e-06,1.5610699894862169e-06,6.701028470025624e-06
USA,Activity,Sea and coastal water transport,0.000336746558895638,0.00014186546026837617,0.0003114490958404395,7.328902213025758e-05,0.00012253876343382692
USA,Activity,Steam and hot water supply,0.0005842930728137969,0.00016467252789455276,0.00014816545242331104,8.02055808761182e-05,0.00021049530823484915
USA,Activity,Sugar refining,1.482625778771747e-06,9.599035302885621e-07,8.304846991737913e-07,4.0273497557591835e-07,5.955812436502413e-07
