Region,,,EU27+UK,EU27+UK,EU27+UK,EU27+UK,EU27+UK
Level,,,Activity,Activity,Activity,Activity,Activity
Item,,,Production of photovoltaic plants,Production of onshore wind plants,Production of offshore wind plants,Production of electricity by wind,Production of electricity by solar photovoltaic
Region,Level,Item,,,,,
China,Activity,Activities auxiliary to financial intermediation (67),1.7012082913304717e-05,7.718397384330357e-06,4.040104127799208e-06,1.7493860024321528e-06,7.133636062432939e-06
China,Activity,Activities of membership organisation n.e.c. (91),8.053734322586164e-06,1.5624023916996123e-06,8.547689847494069e-07,3.7757425267599516e-07,3.335787353737857e-06
China,Activity,Air transport (62),0.0015038876709930309,0.0006948490094584606,0.0003902756775416586,0.00018146553513239693,0.0006437469702780686
China,Activity,Aluminium production,0.0013669119365492051,0.0009607429494069624,0.0004628695143035035,0.0001923854525966998,0.0005701127790393893
China,Activity,Animal products nec,2.267741088788813e-06,8.001305662174352e-07,5.592453744715522e-07,2.6606660467058525e-07,9.86083092505478e-07
China,Activity,"Biogasification of food waste, incl. land application",0.0,0.0,0.0,0.0,0.0
China,Activity,"Biogasification of paper, incl. land application",0.0,0.0,0.0,0.0,0.0
China,Activity,"Biogasification of sewage slugde, incl. land application",0.0,0.0,0.0,0.0,0.0
China,Activity,Casting of metals,0.001124468500431604,0.004044378200069767,0.001813712184517482,0.0007503820470045854,0.0004898449739493368
China,Activity,Cattle farming,4.063071963894371e-06,1.442564136486196e-06,8.824334434537214e-07,3.962504065748024e-07,1.7257250537781825e-06
China,Activity,Chemicals nec,0.02498051970384332,0.005660745339925852,0.0032765068857308044,0.001482045726289364,0.01040137175707228
China,Activity,"Collection, purification and distribution of water (41)",2.8350811440626857e-05,7.654909659426855e-06,4.135516076091939e-06,1.7040170218195538e-06,1.1726444800267161e-05
China,Activity,"Composting of food waste, incl. land application",1.9076706196376026e-06,3.8722129339420265e-07,2.1865169598691601e-07,9.341112353682337e-08,7.903825649117504e-07
China,Activity,"Composting of paper and wood, incl. land application",5.317522849925453e-07,1.044176128494803e-07,5.735962108466585e-08,2.396036329257368e-08,2.1967508937651725e-07
China,Activity,Computer and related activities (72),3.079556759097926e-05,1.5012585235790244e-05,8.58198522389202e-06,3.767014132577486e-06,1.3154353190979e-05
China,Activity,Construction (45),2.5600197793424938e-05,7.191080271953314e-06,4.811625283058263e-06,2.81174690310532e-06,1.1835788868317701e-05
China,Activity,Copper production,0.00041753482146863916,0.002061652830479045,0.0009327626725189064,0.00038665397653620654,0.00018820020355415822
China,Activity,Cultivation of cereal grains nec,5.251214308301861e-05,1.2258933589063822e-05,7.0897813358274614e-06,3.031433027790276e-06,2.1864153811947377e-05
China,Activity,Cultivation of crops nec,0.00012355618950040455,3.6857859413197125e-05,2.0962637530789215e-05,9.129950719485944e-06,5.166004994758707e-05
China,Activity,Cultivation of oil seeds,7.239040343439466e-05,5.4034735473872984e-05,2.8141969946340785e-05,1.2216660335440214e-05,3.0928876551766636e-05
China,Activity,Cultivation of paddy rice,4.8191017282339175e-05,1.5264078824876834e-05,8.181701710247763e-06,3.595830222211906e-06,2.0096169498948973e-05
China,Activity,Cultivation of plant-based fibers,0.0002377087780259207,0.0001176992786703692,6.97948217974575e-05,3.0584368560745586e-05,0.00010171780653756249
China,Activity,"Cultivation of sugar cane, sugar beet",5.751617261415685e-05,2.3657005068678923e-05,1.2782613783666312e-05,5.532500889312617e-06,2.4166241755562657e-05
China,Activity,"Cultivation of vegetables, fruit, nuts",0.00013292937399065317,4.444295246380653e-05,2.540282930166904e-05,1.1115219027146207e-05,5.595565663101103e-05
China,Activity,Cultivation of wheat,2.03318907069136e-05,7.692578837298527e-06,4.2973938094285305e-06,1.8859790926212523e-06,8.56113534765693e-06
China,Activity,Distribution and trade of electricity,9.326746489303086e-06,3.592532298330077e-06,1.948439843046637e-06,7.946294233345575e-07,3.875521792881888e-06
China,Activity,Education (80),8.871165762977772e-06,3.6175819076791714e-06,1.8813921956841939e-06,8.196236132880731e-07,3.714321401540463e-06
China,Activity,Extra-territorial organizations and bodies,0.0,0.0,0.0,0.0,0.0
China,Activity,"Extraction of crude petroleum and services related to crude oil extraction, excluding surveying",0.0015744459968310264,0.0005928250030248638,0.00032393339652689464,0.00013838995624908528,0.0006583580885705712
China,Activity,"Extraction of natural gas and services related to natural gas extraction, excluding surveying",1.795241184903165e-05,1.1191807056113935e-05,6.002650408700396e-06,2.647260155651954e-06,7.630298903894184e-06
China,Activity,"Extraction, liquefaction, and regasification of other petroleum and gaseous materials",0.0,0.0,0.0,0.0,0.0
China,Activity,"Financial intermediation, except insurance and pension funding (65)",0.0006367595179772567,0.0001933102981146586,9.940092930926622e-05,4.259608291606646e-05,0.00026407279155398367
China,Activity,"Fishing, operating of fish hatcheries and fish farms; service activities incidental to fishing (05)",1.9742169588854522e-06,1.2540829593503882e-06,6.642309981583805e-07,2.888662995299505e-07,8.406792186360439e-07
China,Activity,"Forestry, logging and related service activities (02)",0.00010948807457787944,5.026744094208719e-05,2.7356044204196774e-05,1.203271208828451e-05,4.619941983128755e-05
China,Activity,Health and social work (85),0.0002145914251653133,7.95598807084311e-05,3.877346589828151e-05,1.6061019960456283e-05,8.861753135285514e-05
China,Activity,Hotels and restaurants (55),9.082004860819467e-05,4.677799587974555e-05,2.6065043631783765e-05,1.1408695270639318e-05,3.879789805452361e-05
China,Activity,Incineration of waste: Food,3.907574473921487e-06,8.121351559820494e-07,4.483546577360851e-07,1.9065841474991983e-07,1.6165328861354916e-06
China,Activity,Incineration of waste: Metals and Inert materials,0.00031567753354864645,7.00738394669005e-05,4.218679993719576e-05,1.8603908160281485e-05,0.00013179138930150848
China,Activity,Incineration of waste: Oil/Hazardous waste,0.0004199230019417236,8.91591107593626e-05,5.021012594801365e-05,2.1554876041543246e-05,0.00017417111909963031
China,Activity,Incineration of waste: Paper,3.808148538384986e-06,7.173783283740667e-07,3.998447998531672e-07,1.7182930905013798e-07,1.5751973139764745e-06
China,Activity,Incineration of waste: Plastic,0.00032948156193974074,7.492779444293452e-05,4.18271797967339e-05,1.848387867747466e-05,0.0001369807792275542
China,Activity,Incineration of waste: Textiles,0.00029887903470031716,6.069875031992054e-05,3.422902599449518e-05,1.469749112868735e-05,0.00012382341690435363
China,Activity,Incineration of waste: Wood,9.868633511826698e-07,2.0169124014018133e-07,1.1308081685787715e-07,4.8971797149519435e-08,4.0902943064128775e-07
China,Activity,Inland water transport,0.0016072327058311864,0.0007925041645816162,0.0004191851840747297,0.00017777508731427462,0.0006765680073246386
China,Activity,"Insurance and pension funding, except compulsory social security (66)",1.6519452330174183e-05,6.896014222101608e-06,3.6031852620199262e-06,1.6229467952305107e-06,6.974205497794032e-06
China,Activity,Landfill of waste: Food,2.2454385107234797e-05,4.6965239055588745e-06,2.568784662139497e-06,1.0866638479761357e-06,9.28383418538902e-06
China,Activity,Landfill of waste: Inert/metal/hazardous,6.019990883888167e-06,1.1658559644526233e-06,6.474186031140583e-07,2.786509990688185e-07,2.4908993176020614e-06
China,Activity,Landfill of waste: Paper,8.0456834601704e-06,1.6146406225623197e-06,8.835021671840456e-07,3.7452704907797356e-07,3.325292894975299e-06
China,Activity,Landfill of waste: Plastic,4.807841382784995e-06,1.0172163485936216e-06,5.574871758058369e-07,2.3581492139282e-07,1.9882294086288333e-06
China,Activity,Landfill of waste: Textiles,1.6534362904123967e-06,3.4606162601547824e-07,1.9004943451287318e-07,8.052019347367626e-08,6.837881561363747e-07
China,Activity,Landfill of waste: Wood,2.4793416244608905e-06,5.223422085095303e-07,2.8646617845907047e-07,1.2158472586546973e-07,1.0254937021688255e-06
China,Activity,"Lead, zinc and tin production",4.367016155736865e-05,6.676053339300436e-05,3.194601141150138e-05,1.3493988946585587e-05,1.8897491892999757e-05
China,Activity,Manufacture of basic iron and steel and of ferro-alloys and first products thereof,0.016669767031063758,0.04071693671077405,0.01945155071098056,0.008074401787165513,0.0072964447865118765
China,Activity,Manufacture of beverages,2.349475137324644e-06,1.5435515343054482e-06,8.120239046766778e-07,3.534239703207317e-07,1.0034617105556193e-06
China,Activity,"Manufacture of bricks, tiles and construction products, in baked clay",3.65431415184111e-05,2.2041846292462776e-05,1.5407134498737035e-05,7.458358396744628e-06,1.686757729029642e-05
China,Activity,"Manufacture of cement, lime and plaster",0.0003826832807835744,0.00011383016837982657,0.00011396090623172147,6.297765160285582e-05,0.00018512517530650498
China,Activity,Manufacture of ceramic goods,0.00012845718159374702,0.00015516799658585144,8.23944286056431e-05,3.821801147223652e-05,5.9416016631464586e-05
China,Activity,Manufacture of coke oven products,0.004269092319313641,0.0037149608948710998,0.0018511288478802975,0.0007590881141002666,0.001792593465131574
China,Activity,Manufacture of electrical machinery and apparatus n.e.c. (31),0.00023472806269101768,0.0021564722892069635,0.0009334018476270337,0.00038335756713533606,0.00010581336440047817
China,Activity,"Manufacture of fabricated metal products, except machinery and equipment (28)",0.0037749197089705947,0.004251778078280401,0.0022557825304941053,0.0009486049144156804,0.0016280149772687088
China,Activity,Manufacture of fish products,9.872433107526837e-06,6.710279746946389e-06,3.5069626977988e-06,1.5188050855840168e-06,4.203800103705749e-06
China,Activity,Manufacture of furniture; manufacturing n.e.c. (36),0.000531427414493592,0.0004450562871789974,0.00022618380226102015,9.979651259960106e-05,0.00022565056232489721
China,Activity,Manufacture of gas; distribution of gaseous fuels through mains,0.00856549876100611,0.003699299791963477,0.001986937469330078,0.0008121446019867067,0.003565056129172866
China,Activity,Manufacture of glass and glass products,0.016349063899878596,0.0005244673454470404,0.0002851774517969016,0.0001148014018642979,0.006681291929968371
China,Activity,Manufacture of machinery and equipment n.e.c. (29),0.0007660936574864154,0.0006610492471932561,0.0003571175407111336,0.00015170927939031102,0.00032746480703909996
China,Activity,"Manufacture of medical, precision and optical instruments, watches and clocks (33)",7.045953468064607e-06,1.206754854762262e-05,6.65685757060223e-06,3.7130213469811424e-06,3.7219507629976625e-06
China,Activity,"Manufacture of motor vehicles, trailers and semi-trailers (34)",0.00036507473774573685,6.101188348076938e-05,3.624309091633176e-05,1.5057760588209995e-05,0.0001511067457002555
China,Activity,Manufacture of office machinery and computers (30),7.159239028670011e-05,6.3428925288894e-05,4.08027984729136e-05,2.1263420557189367e-05,3.46603455274807e-05
China,Activity,Manufacture of other non-metallic mineral products n.e.c.,0.0788225147255394,0.0029142728874258714,0.0015677711963319567,0.0006458062749667889,0.032229726969436615
China,Activity,Manufacture of other transport equipment (35),0.00014584228616610555,5.408447535966817e-05,3.174562262053242e-05,1.3916976472810137e-05,6.169049814295577e-05
China,Activity,"Manufacture of radio, television and communication equipment and apparatus (32)",0.00011073457127753662,0.0002696919583576351,0.00014681293920965877,7.406239038344395e-05,5.823396170474445e-05
China,Activity,Manufacture of rubber and plastic products (25),0.0013785291095067117,0.0012167474700535722,0.0006218192006629861,0.00026627923334320507,0.0005893476726235621
China,Activity,Manufacture of textiles (17),0.0005127892916253792,0.00027421385877981905,0.00015362136327070372,6.735479511122703e-05,0.0002183445875951535
China,Activity,Manufacture of tobacco products (16),0.0022332986804854092,0.0006998967999736756,0.00037616791636144615,0.00015030328711477525,0.0009223142586527306
China,Activity,Manufacture of wearing apparel; dressing and dyeing of fur (18),0.00027776555116060345,9.78029530257803e-05,5.440636546673625e-05,2.372137065583221e-05,0.00011654670784885003
China,Activity,"Manufacture of wood and of products of wood and cork, except furniture; manufacture of articles of straw and plaiting materials (20)",0.0003016108089790244,0.00019048171981989718,0.0001890354774339252,8.164120859604987e-05,0.00014622971307905498
China,Activity,"Manure treatment (biogas), storage and land application",0.0,0.0,0.0,0.0,0.0
China,Activity,"Manure treatment (conventional), storage and land application",0.0,0.0,0.0,0.0,0.0
China,Activity,Meat animals nec,8.005372695315602e-05,4.217340646958912e-06,3.191430252794463e-06,1.225227486413281e-06,3.28809709149333e-05
China,Activity,Mining of aluminium ores and concentrates,0.0005721063274201241,0.00039860933278355805,0.00023140014990133032,9.258413951889009e-05,0.00024215213248343116
China,Activity,"Mining of chemical and fertilizer minerals, production of salt, other mining and quarrying n.e.c.",0.000404017452202727,0.00016456209293128857,0.00012326185776605745,4.924641850489571e-05,0.0001722408482081812
China,Activity,Mining of coal and lignite; extraction of peat (10),0.007014882563544503,0.003703772692508608,0.0018453714167743702,0.0007697088273686373,0.0029213112851568003
China,Activity,Mining of copper ores and concentrates,0.0002533706698299597,0.00046315165310712353,0.00023280225725518064,9.15554970706969e-05,0.00010771830122053369
China,Activity,Mining of iron ores,7.31986172346276e-05,0.00012946410532015871,6.548892941166341e-05,2.6655559789607367e-05,3.16306073602888e-05
China,Activity,"Mining of lead, zinc and tin ores and concentrates",0.00039888410896245013,0.00019000994833893398,0.00012196634884423464,4.413964655938038e-05,0.0001658250638569424
China,Activity,Mining of nickel ores and concentrates,0.0002161438337301734,0.0002947115968127785,0.0003105455945476451,8.982242479023968e-05,9.242990835191341e-05
China,Activity,Mining of other non-ferrous metal ores and concentrates,0.0005855122568376768,0.000593746077726198,0.0008490008983501085,0.00022321010108588903,0.000248896562102994
China,Activity,Mining of precious metal ores and concentrates,0.006906311139565029,0.00047029168436877255,0.0002282713586107551,9.820030461277733e-05,0.002826741911373416
China,Activity,Mining of uranium and thorium ores (12),5.116239344586099e-05,6.283853448334496e-05,3.226933925137862e-05,1.4704459317208117e-05,2.2652550385476614e-05
China,Activity,N-fertiliser,1.1197866224876236e-06,3.9673703807972146e-07,2.327966140153395e-07,1.2543083347905413e-07,4.7439882584591067e-07
China,Activity,Other business activities (74),0.0005597477580951459,0.0003342506093978924,0.0001755709452414787,8.35635373220074e-05,0.00024049760099989498
China,Activity,Other land transport,0.00014135470980251218,5.96773593853587e-05,3.221310743315799e-05,1.4086684370722048e-05,5.9642064231076535e-05
China,Activity,Other non-ferrous metal production,0.001639028227327247,0.002525576842469283,0.004038418802001023,0.0010235834420401007,0.0007098487489756336
China,Activity,Other service activities (93),0.00010467578341033635,1.559019494913407e-05,9.12705445946817e-06,3.7842404934360097e-06,4.320775150062978e-05
China,Activity,P- and other fertiliser,0.00013558053059617182,5.5343434917223236e-05,3.4136707557701075e-05,1.5733267935354767e-05,5.790773236417972e-05
China,Activity,Paper,0.0016806566827802206,0.0007928766712213051,0.0004070576545561975,0.00018165722768425583,0.0007071985872622833
China,Activity,Petroleum Refinery,0.003906303848735195,0.0014267546401549504,0.0007821736156129628,0.00033332104734998665,0.0016335387148704015
China,Activity,Pigs farming,0.00014125432232974406,7.136217690454961e-06,5.52195558828778e-06,2.1133932761109928e-06,5.80161178322617e-05
China,Activity,"Plastics, basic",3.243793707954028e-05,3.9505053080782895e-05,1.970199812951457e-05,8.456222584581693e-06,1.4039116866896315e-05
China,Activity,Post and telecommunications (64),5.189963809501035e-06,3.796165880973474e-06,1.986071985923691e-06,9.690543494214057e-07,2.2699816642096685e-06
China,Activity,Poultry farming,5.4756861189826044e-05,1.6100436188056948e-05,9.223255771358208e-06,3.9881602453264184e-06,2.294998984945207e-05
China,Activity,Precious metals production,0.010024705580566517,0.0006568181023602233,0.0003169158469449987,0.00013710393495499444,0.004102810948778026
China,Activity,Private households with employed persons (95),1.7337089091012819e-06,6.810474673653236e-07,4.009737513391403e-07,1.6141231073136007e-07,7.252498836473188e-07
China,Activity,Processed rice,0.00023999728452804285,9.420764456781133e-05,5.0408369221702355e-05,2.2037218857232748e-05,0.00010050269047529607
China,Activity,Processing of Food products nec,4.2666771840325344e-05,9.543725267531446e-06,5.504144299234741e-06,2.34261249582282e-06,1.7741904908591058e-05
China,Activity,Processing of dairy products,1.0392737984382976e-05,3.495534195730627e-06,1.9381428883816187e-06,8.3572520591914e-07,4.349602982679494e-06
China,Activity,Processing of meat cattle,1.494610550851975e-05,6.186635940602713e-06,3.498797481499995e-06,1.532019768461258e-06,6.342302960175049e-06
China,Activity,Processing of meat pigs,9.891409113474415e-07,3.6757577728084864e-07,2.0837103268805721e-07,9.100289964852616e-08,4.173775795128901e-07
China,Activity,Processing of meat poultry,3.254102549458609e-06,1.1727698087718624e-06,6.60485482980755e-07,2.877880146102935e-07,1.370606720383791e-06
China,Activity,Processing of nuclear fuel,6.424041505355104e-06,4.908797805652934e-06,2.7535964729885176e-06,1.207454085025468e-06,2.792253334790138e-06
China,Activity,Processing vegetable oils and fats,6.083480034019094e-07,2.5224375458783785e-07,1.3601797017915717e-07,5.89570847051972e-08,2.5566930253180696e-07
China,Activity,Production of electricity by Geothermal,0.0003902831636909957,6.456783487844568e-05,3.517364792806776e-05,1.430880985715585e-05,0.00016053186919987052
China,Activity,Production of electricity by biomass and waste,0.0,0.0,0.0,0.0,0.0
China,Activity,Production of electricity by coal,0.5810892948346201,0.0681644675910661,0.036948546046318115,0.015012794054736952,0.23838945337881431
China,Activity,Production of electricity by gas,0.01282119305138442,0.0009828832684909599,0.0005354715744995376,0.00021671997260040544,0.0052500574920488225
China,Activity,Production of electricity by hydro,0.0,0.0,0.0,0.0,0.0
China,Activity,Production of electricity by nuclear,8.564186674849157e-06,5.285169001945069e-07,2.863628552358473e-07,1.1655044302024462e-07,3.504687342194982e-06
China,Activity,Production of electricity by petroleum and other oil derivatives,0.0002354086693877699,3.829268836626467e-05,2.029563498308002e-05,8.418294216194762e-06,9.68100524623458e-05
China,Activity,Production of electricity by solar photovoltaic,0.0,0.0,0.0,0.0,0.0
China,Activity,Production of electricity by solar thermal,0.0,0.0,0.0,0.0,0.0
China,Activity,"Production of electricity by tide, wave, ocean",0.0,0.0,0.0,0.0,0.0
China,Activity,Production of electricity by wind,0.0,0.0,0.0,0.0,0.0
China,Activity,Production of electricity nec,0.002480722493412423,0.000996917364822593,0.0005426564350540557,0.00022037884426335974,0.001031282424965995
China,Activity,Production of meat products nec,4.6444656616093115e-06,1.6203272003628039e-06,9.254204940324626e-07,4.0810344642570866e-07,1.9561412091645307e-06
China,Activity,Production of offshore wind plants,0.0,0.0,0.0,0.0,0.0
China,Activity,Production of onshore wind plants,0.0,0.0,0.0,0.0,0.0
China,Activity,Production of photovoltaic plants,0.0,0.0,0.0,0.0,0.0
China,Activity,Public administration and defence; compulsory social security (75),9.093308236879064e-06,4.027329927560063e-06,2.121071190994801e-06,9.398773693802314e-07,3.8535090926291905e-06
China,Activity,"Publishing, printing and reproduction of recorded media (22)",3.4408006034290085e-05,1.87797324267814e-05,9.833527477671637e-06,4.457595198796824e-06,1.462377575536395e-05
China,Activity,Pulp,4.0954898108512555e-06,1.972774780376663e-06,1.0503022366915278e-06,4.78222849401692e-07,1.735435653604802e-06
China,Activity,Quarrying of sand and clay,0.0013056493724344232,0.0001718011654586166,9.325523831278575e-05,3.994889700731434e-05,0.0005373829669472174
China,Activity,Quarrying of stone,0.0004152198500630918,2.103774617126216e-05,1.1907107415228877e-05,4.830523278836549e-06,0.00016997508303358334
China,Activity,Raw milk,0.00018055416176255464,4.906649167567616e-05,2.7542621727701557e-05,1.183214258194615e-05,7.521288540530244e-05
China,Activity,Re-processing of ash into clinker,0.0,0.0,0.0,0.0,0.0
China,Activity,Re-processing of secondary aluminium into new aluminium,0.0,0.0,0.0,0.0,0.0
China,Activity,Re-processing of secondary construction material into aggregates,0.0,0.0,0.0,0.0,0.0
China,Activity,Re-processing of secondary copper into new copper,0.0,0.0,0.0,0.0,0.0
China,Activity,Re-processing of secondary glass into new glass,0.0,0.0,0.0,0.0,0.0
China,Activity,"Re-processing of secondary lead into new lead, zinc and tin",0.0,0.0,0.0,0.0,0.0
China,Activity,Re-processing of secondary other non-ferrous metals into new other non-ferrous metals,0.0,0.0,0.0,0.0,0.0
China,Activity,Re-processing of secondary paper into new pulp,0.001122854291816112,4.181024021235598e-06,2.29074674339059e-06,9.305439527075745e-07,0.00045827428285660223
China,Activity,Re-processing of secondary plastic into new plastic,0.0,0.0,0.0,0.0,0.0
China,Activity,Re-processing of secondary preciuos metals into new preciuos metals,0.0,0.0,0.0,0.0,0.0
China,Activity,Re-processing of secondary steel into new steel,0.0,0.0,0.0,0.0,0.0
China,Activity,Re-processing of secondary wood material into new wood material,0.0,0.0,0.0,0.0,0.0
China,Activity,Real estate activities (70),0.00012886364702387705,4.9046838071071895e-05,2.5676801523806385e-05,1.1174774005277656e-05,5.414407951004567e-05
China,Activity,"Recreational, cultural and sporting activities (92)",2.8623712140533758e-05,1.0559415713457256e-05,5.554866946522826e-06,2.3440959603994826e-06,1.191706059908259e-05
China,Activity,Recycling of bottles by direct reuse,0.0,0.0,0.0,0.0,0.0
China,Activity,Recycling of waste and scrap,1.681778618352334e-05,5.216886412572744e-06,2.681404876478291e-06,1.1026985870060731e-06,6.948507353330542e-06
China,Activity,Renting of machinery and equipment without operator and of personal and household goods (71),0.00016547616429037656,0.00013549561639705158,6.726822078215774e-05,2.812169323616044e-05,6.974681413665163e-05
China,Activity,Research and development (73),1.223093220334319e-05,1.85252979508296e-05,9.503342680631372e-06,4.339482098798709e-06,5.517467695319714e-06
China,Activity,Retail sale of automotive fuel,8.55342171692278e-06,4.1916081682225975e-06,2.568633899477054e-06,1.214534380407082e-06,5.818936710734697e-06
China,Activity,"Retail trade, except of motor vehicles and motorcycles; repair of personal and household goods (52)",5.332409360425534e-05,2.29347973332561e-05,1.3085040513439135e-05,5.955682865995694e-06,2.538928802659492e-05
China,Activity,"Sale, maintenance, repair of motor vehicles, motor vehicles parts, motorcycles, motor cycles parts and accessoiries",8.029898322589668e-06,2.8441513315386973e-06,1.5746025657952058e-06,6.716607869368485e-07,3.4719004150327667e-06
China,Activity,Sea and coastal water transport,0.06711675810491018,0.0010877164394747952,0.0013804303099307447,0.00044218399394404883,0.027486035464072606
China,Activity,Steam and hot water supply,0.016926232732292705,0.007972738055929653,0.004260747886379092,0.0017831103723885368,0.007082290784009003
China,Activity,Sugar refining,5.623731543144167e-07,1.9443436272120644e-07,1.0642124741025345e-07,4.558931097066379e-08,2.352576993568915e-07
China,Activity,Supporting and auxiliary transport activities; activities of travel agencies (63),0.0001250630130278892,5.2137277453197704e-05,2.8553722892358318e-05,1.1970479497348012e-05,5.240679348102175e-05
China,Activity,"Tanning and dressing of leather; manufacture of luggage, handbags, saddlery, harness and footwear (19)",0.00015819097453395397,0.00012011120839885278,7.373684822039015e-05,3.403349318664397e-05,7.032210318603933e-05
China,Activity,Transmission of electricity,0.0002640020307818335,0.00010268676402713477,5.5561654190295785e-05,2.254849788048085e-05,0.00010961567903901722
China,Activity,Transport via pipelines,5.917381472070767e-05,1.7437109332622866e-05,1.048201088456948e-05,4.263085714608712e-06,2.4686608343198743e-05
China,Activity,Transport via railways,0.000777282212793712,0.00041981204651329456,0.0002210094714661119,9.284252710880852e-05,0.000326823669689102
China,Activity,"Waste water treatment, food",2.736415683778952e-05,5.6043378642613385e-06,3.0641526090531244e-06,1.2926252055186169e-06,1.1308409488117518e-05
China,Activity,"Waste water treatment, other",4.9540906427357777e-05,1.0109825742636858e-05,5.517951354376545e-06,2.327414148472867e-06,2.046983188487149e-05
China,Activity,"Wholesale trade and commission trade, except of motor vehicles and motorcycles (51)",2.17910007131508e-05,1.1442548504680474e-05,6.4412895603179e-06,2.863878764800666e-06,9.599368367142108e-06
China,Activity,"Wool, silk-worm cocoons",4.7428928925728026e-05,1.6754303958482105e-05,9.361743923332684e-06,4.102900665686202e-06,1.9931528979002002e-05
EU27+UK,Activity,Activities auxiliary to financial intermediation (67),7.202881783337263e-05,0.00010406189713991109,0.00010904498380478474,0.00011708737973922867,8.379973751306218e-05
