EU27+UK,Activity,Supporting and auxiliary transport activities; activities of travel agencies (63),0.0006990582706490323,0.001112563406589675,0.0015276969644530266,0.0006713801652018681,0.0005386712849869429
EU27+UK,Activity,"Tanning and dressing of leather; manufacture of luggage, handbags, saddlery, harness and footwear (19)",3.6555428426030444e-06,6.014340563684901e-06,5.724542436287436e-06,2.4670086793450042e-06,2.073416760594078e-06
EU27+UK,Activity,Transmission of electricity,0.0004826351419031337,0.0006464684337510943,0.0006732180193199393,0.00046888069948797966,0.00036381710584006816
EU27+UK,Activity,Transport via pipelines,0.0007740280398394021,0.0009288596632141195,0.0010663346426140732,0.001053716744999043,0.0010389999646160564
EU27+UK,Activity,Transport via railways,0.0005242162127480915,0.0009269247546613939,0.0010314336739813677,0.0005596554403495189,0.0005542339102380442
EU27+UK,Activity,"Waste water treatment, food",5.458620540410882e-06,6.281034309626017e-06,6.930391676399686e-06,4.010620875146281e-06,3.144129135715176e-06
EU27+UK,Activity,"Waste water treatment, other",9.758359992944145e-06,1.1838682433680869e-05,1.2616631794265302e-05,7.3380171851460664e-06,5.630908172767195e-06
EU27+UK,Activity,"Wholesale trade and commission trade, except of motor vehicles and motorcycles (51)",0.0006524708902680052,0.0012974186428839935,0.001231994840118672,0.000662661852844409,0.0006093481762291555
EU27+UK,Activity,"Wool, silk-worm cocoons",0.00024241340004699593,0.000236256848832108,0.00023976556902105637,0.00014878817438057388,0.00014904210609287608
RoW,Activity,Activities auxiliary to financial intermediation (67),6.341880422097823e-05,6.334980143510367e-05,5.8932105479180584e-05,4.1304518160904235e-05,3.7417248066077924e-05
RoW,Activity,Activities of membership organisation n.e.c. (91),7.575159992593116e-06,7.556319106281183e-06,6.791648457478258e-06,3.43187207160822e-06,3.759055453613257e-06
RoW,Activity,Air transport (62),0.0011468779049220142,0.0014970881623447962,0.001381390304668149,0.0007904096761924829,0.0007021438778100439
RoW,Activity,Aluminium production,0.0007924706068286685,0.0010642657658217654,0.0009115886551441349,0.0002816259818741821,0.00031817558876862735
RoW,Activity,Animal products nec,4.980622145927022e-06,4.944793879985289e-06,4.452249036307287e-06,2.08617879662228e-06,2.4305596968209375e-06
RoW,Activity,"Biogasification of food waste, incl. land application",7.474057011497867e-08,7.329568935779558e-08,6.670742661996476e-08,3.351025325803132e-08,3.513709052885673e-08
RoW,Activity,"Biogasification of paper, incl. land application",1.13241045282559e-07,1.2992517817055184e-07,1.1179008906219119e-07,4.9138705336382693e-08,5.059090136576559e-08
RoW,Activity,"Biogasification of sewage slugde, incl. land application",7.61186551226195e-07,6.977151194220614e-07,7.708279212742069e-07,3.0211616574005625e-07,3.3687859151464595e-07
RoW,Activity,Casting of metals,0.0002742460606266685,0.00033910543907045244,0.0002777111033959126,0.00012909328602264133,0.00013171897345400777
RoW,Activity,Cattle farming,2.658683785267085e-05,2.4319475405430668e-05,2.177913464050432e-05,1.0443653624036563e-05,1.244340366900086e-05
RoW,Activity,Chemicals nec,0.0031125016397427264,0.003236096360811011,0.002966940569753916,0.001282362046992858,0.0013607118213489232
RoW,Activity,"Collection, purification and distribution of water (41)",7.625210084612575e-05,5.50278239552529e-05,4.8917656111404674e-05,2.4004258586848402e-05,3.358927443380379e-05
RoW,Activity,"Composting of food waste, incl. land application",8.306725948223285e-07,7.53113968964525e-07,7.15142989745528e-07,3.506252889369135e-07,3.923975804403626e-07
RoW,Activity,"Composting of paper and wood, incl. land application",6.669748534609229e-08,7.053693430631702e-08,6.185219630986396e-08,2.764902646263877e-08,3.039790932273341e-08
RoW,Activity,Computer and related activities (72),2.4219188469107145e-05,2.8034780173917528e-05,2.5630433247972132e-05,1.7351736734895794e-05,1.560607437791094e-05
RoW,Activity,Construction (45),9.770812469998636e-05,6.953179112152938e-05,7.417956597990076e-05,4.5434223991239015e-05,5.540147694755959e-05
RoW,Activity,Copper production,0.00017301191043143233,0.0004891904536593133,0.00031967794264706087,0.00010521310438647505,7.747419618376213e-05
RoW,Activity,Cultivation of cereal grains nec,7.081763738325312e-05,6.959308568767531e-05,6.341287130139588e-05,2.9232328534157145e-05,3.3407124973827437e-05
RoW,Activity,Cultivation of crops nec,6.38944844788707e-05,5.733246156156195e-05,5.168051066913135e-05,2.2346476891547888e-05,2.8428485659859506e-05
RoW,Activity,Cultivation of oil seeds,0.00010685954241371015,9.693253994782288e-05,7.476537467478433e-05,3.117003397810326e-05,4.392832615836978e-05
RoW,Activity,Cultivation of paddy rice,9.232502343614504e-05,8.543629526893188e-05,7.782895373913757e-05,3.502713480720283e-05,4.26404480009335e-05
RoW,Activity,Cultivation of plant-based fibers,3.887799715557028e-05,3.3330952451439225e-05,2.7116079762381913e-05,1.0815282986771827e-05,1.5507215231611897e-05
RoW,Activity,"Cultivation of sugar cane, sugar beet",2.0428188971511587e-05,1.9558437276852868e-05,1.7742089743967744e-05,7.971957699645055e-06,9.241815600899165e-06
RoW,Activity,"Cultivation of vegetables, fruit, nuts",5.022308422275361e-05,4.6316508751473426e-05,4.140257346119655e-05,1.8630567588034593e-05,2.2942116118753632e-05
RoW,Activity,Cultivation of wheat,0.0002005705917547264,0.0001934990112837198,0.00017595842028658048,8.16010941215187e-05,9.330169695576073e-05
RoW,Activity,Distribution and trade of electricity,8.854030725827875e-05,8.697560930492475e-05,7.769464088500158e-05,4.080919843433348e-05,4.4393592957235836e-05
RoW,Activity,Education (80),3.8800686142237965e-06,3.9001892833894705e-06,3.5154364480813536e-06,2.4865163797460785e-06,2.285531425100831e-06
RoW,Activity,Extra-territorial organizations and bodies,0.0,0.0,0.0,0.0,0.0
RoW,Activity,"Extraction of crude petroleum and services related to crude oil extraction, excluding surveying",0.004293118215022124,0.0033233862909452534,0.0031774822091327455,0.0029996342085825507,0.002382892955962829
RoW,Activity,"Extraction of natural gas and services related to natural gas extraction, excluding surveying",0.01208798337048687,0.009127648284968854,0.008011153365820015,0.013736641013651437,0.01008212027037851
RoW,Activity,"Extraction, liquefaction, and regasification of other petroleum and gaseous materials",0.0006721485263350227,0.000557269637724125,0.0005222078367659306,0.0003116752951396902,0.0003149381638282681
RoW,Activity,"Financial intermediation, except insurance and pension funding (65)",0.00016002228558286606,0.00015435085076462876,0.00014398928983354417,0.00010545209887333124,9.310065688088348e-05
RoW,Activity,"Fishing, operating of fish hatcheries and fish farms; service activities incidental to fishing (05)",1.556204251541237e-05,1.7509369595880137e-05,1.739177433365839e-05,7.913068825401586e-06,8.122378488692822e-06
RoW,Activity,"Forestry, logging and related service activities (02)",7.573845470546302e-05,5.416505376830059e-05,4.703863808960087e-05,1.9847852172554725e-05,3.0985412760731473e-05
RoW,Activity,Health and social work (85),3.3526439772862417e-06,3.3529834458636266e-06,3.0980040935459938e-06,1.996266411021699e-06,1.8807289825925444e-06
RoW,Activity,Hotels and restaurants (55),8.827199588719555e-05,0.00010583521483900294,0.0001013461661791418,5.374849236235642e-05,5.517922917215399e-05
RoW,Activity,Incineration of waste: Food,4.33532436725023e-06,4.442073090731946e-06,4.169435691013298e-06,1.8404662351147196e-06,2.0227395440964487e-06
RoW,Activity,Incineration of waste: Metals and Inert materials,3.614731298667192e-05,4.271409277314221e-05,4.449874419652615e-05,2.0924232207892344e-05,1.9557892000547244e-05
RoW,Activity,Incineration of waste: Oil/Hazardous waste,2.162207399698692e-05,1.9992338407433817e-05,1.8460641703590926e-05,8.99879194049585e-06,1.0238424601080286e-05
RoW,Activity,Incineration of waste: Paper,3.1095830116319647e-06,2.587392994412827e-06,2.4135179393244914e-06,1.207963869092249e-06,1.4528458232497002e-06
RoW,Activity,Incineration of waste: Plastic,4.229733246454635e-05,3.403753546092391e-05,3.179084062725954e-05,1.4905284231328629e-05,1.8805970703895686e-05
RoW,Activity,Incineration of waste: Textiles,4.211475350479205e-05,4.577170096292399e-05,4.5967004378349275e-05,1.9115367620085783e-05,1.988689020461017e-05
RoW,Activity,Incineration of waste: Wood,9.961671131209291e-07,1.0213635781180123e-06,9.330911389190655e-07,4.444303840790693e-07,4.795181224642482e-07
RoW,Activity,Inland water transport,0.0005904587636295014,0.0005309358589725212,0.0005019921016845921,0.0002831825708497545,0.00031608107473748173
RoW,Activity,"Insurance and pension funding, except compulsory social security (66)",2.4737814641253845e-05,2.5138605957102043e-05,2.4636610007539818e-05,1.814650828495465e-05,1.73674273048446e-05
RoW,Activity,Landfill of waste: Food,5.617775798044303e-06,5.048768331600793e-06,4.76920767583179e-06,2.3878557160344204e-06,2.7271367031541494e-06
RoW,Activity,Landfill of waste: Inert/metal/hazardous,2.329437988819533e-06,1.861162327416007e-06,1.7387797937323386e-06,8.655368821750218e-07,1.0821532906851124e-06
RoW,Activity,Landfill of waste: Paper,2.153192763552983e-06,1.996400791641129e-06,1.9078471190653347e-06,9.482955324866593e-07,1.0596233533099136e-06
RoW,Activity,Landfill of waste: Plastic,1.181511924209825e-06,1.052454649257009e-06,9.960189920695706e-07,4.920119834573081e-07,5.693138954313834e-07
RoW,Activity,Landfill of waste: Textiles,5.713028054862974e-07,5.472463653924771e-07,5.023528334581517e-07,2.486143674249062e-07,2.7757465855620606e-07
RoW,Activity,Landfill of waste: Wood,6.646068432372984e-07,6.146276885850285e-07,5.724420917266411e-07,2.859355590363584e-07,3.237155924589387e-07
RoW,Activity,"Lead, zinc and tin production",3.484117957889718e-05,5.4130439542215896e-05,5.27973178799637e-05,1.8714178520623882e-05,1.707133631002372e-05
RoW,Activity,Manufacture of basic iron and steel and of ferro-alloys and first products thereof,0.0029543890975299437,0.0059313496821315915,0.005166976239184316,0.0017841836220452883,0.001410490719141963
RoW,Activity,Manufacture of beverages,1.068278138984589e-05,1.1710091631896203e-05,1.0257934517310087e-05,5.184192058600967e-06,5.514627447205801e-06
RoW,Activity,"Manufacture of bricks, tiles and construction products, in baked clay",3.7035242595174594e-05,3.216543195630776e-05,3.09752482727012e-05,1.3638920368963556e-05,1.7502456037428387e-05
RoW,Activity,"Manufacture of cement, lime and plaster",0.000640094082434057,0.0002750284159815878,0.0003184910504734933,0.00015082644900644857,0.00027388499779506473
RoW,Activity,Manufacture of ceramic goods,0.0001491169290704101,0.00010020623988448652,0.00010684617918416126,5.0660611155825796e-05,7.217973021382028e-05
RoW,Activity,Manufacture of coke oven products,0.0005821399950057624,0.0006549495015597659,0.0005786684791531546,0.00025152674148747956,0.0002636287303163756
RoW,Activity,Manufacture of electrical machinery and apparatus n.e.c. (31),0.00013252087008215133,0.000178823141367624,0.0001243379773905409,8.026242743678823e-05,7.287149137872699e-05
RoW,Activity,"Manufacture of fabricated metal products, except machinery and equipment (28)",0.00043005463256143365,0.0006543384958124925,0.0005978081597701046,0.0002277016144529031,0.00020452955740878472
RoW,Activity,Manufacture of fish products,1.2707497033619498e-05,1.6702429092902262e-05,1.6508604096839746e-05,8.022408399719977e-06,6.8337735993053835e-06
RoW,Activity,Manufacture of furniture; manufacturing n.e.c. (36),0.00016601922736260094,0.000178993855176281,0.0001548774309315739,8.175068544861534e-05,7.951056037634753e-05
RoW,Activity,Manufacture of gas; distribution of gaseous fuels through mains,0.000847405149672605,0.00047722351809786895,0.00042037735489891835,0.00021209169225828674,0.00034712900589885205
RoW,Activity,Manufacture of glass and glass products,0.001924208964553973,0.0006851724628709386,0.000521328061155925,0.0001685186693962434,0.0006538653561905362
RoW,Activity,Manufacture of machinery and equipment n.e.c. (29),0.00011810764848357658,0.00013401460380889897,0.0001123277666889146,5.1309920518520464e-05,5.450607327134493e-05
RoW,Activity,"Manufacture of medical, precision and optical instruments, watches and clocks (33)",8.287837599057047e-05,0.00014173020269284638,9.361598957540303e-05,4.4491397238798304e-05,4.11608056891075e-05
RoW,Activity,"Manufacture of motor vehicles, trailers and semi-trailers (34)",6.412122941291917e-05,5.65345609871262e-05,5.259743342911225e-05,2.2944263052470285e-05,3.092464958466843e-05
RoW,Activity,Manufacture of office machinery and computers (30),1.709242835901036e-05,1.715627345560162e-05,1.184715722489425e-05,5.40008023600291e-06,7.314305285434657e-06
RoW,Activity,Manufacture of other non-metallic mineral products n.e.c.,0.0032608700824123373,0.0006535560423603691,0.0006588602059351843,0.00023416189462720834,0.0011153465757574364
RoW,Activity,Manufacture of other transport equipment (35),4.1963048946132084e-05,5.100708946664739e-05,4.706643953784514e-05,2.048890636516506e-05,2.219738400543521e-05
RoW,Activity,"Manufacture of radio, television and communication equipment and apparatus (32)",0.00014407250210503339,0.00025476169539973947,0.00016058793403482926,7.465118077543386e-05,6.782372302109757e-05
RoW,Activity,Manufacture of rubber and plastic products (25),0.00018550681334636045,0.00021565855552107,0.0001905550178686964,7.799005890857153e-05,8.68112800340445e-05
RoW,Activity,Manufacture of textiles (17),0.0003290632661079948,0.0003859159629691968,0.00033511668302543276,0.0001276016007985067,0.00014590938163442713
RoW,Activity,Manufacture of tobacco products (16),3.384927872333963e-05,1.2432109384449285e-05,1.0575885806904406e-05,4.437319561927251e-06,1.2394260235531719e-05
RoW,Activity,Manufacture of wearing apparel; dressing and dyeing of fur (18),7.160424448143567e-05,7.584609575292297e-05,7.23760606022316e-05,3.431601679321837e-05,3.657794584960781e-05
RoW,Activity,"Manufacture of wood and of products of wood and cork, except furniture; manufacture of articles of straw and plaiting materials (20)",0.00046702638076082575,0.0003593472550383891,0.0003796942268430354,0.00015323288187989043,0.00020776007302308173
RoW,Activity,"Manure treatment (biogas), storage and land application",0.0,0.0,0.0,0.0,0.0
RoW,Activity,"Manure treatment (conventional), storage and land application",0.0,0.0,0.0,0.0,0.0
RoW,Activity,Meat animals nec,1.3536720105387534e-05,1.3376185693054394e-05,1.2004444396856068e-05,5.627894431933494e-06,6.38120727765862e-06
RoW,Activity,Mining of aluminium ores and concentrates,0.000985908546557111,0.0006762575961692587,0.0005548283870074738,0.00017033311491419426,0.00035149578512372635
RoW,Activity,"Mining of chemical and fertilizer minerals, production of salt, other mining and quarrying n.e.c.",0.0001273494255572842,0.0002796710172255908,0.00027790324380198096,7.596730375065808e-05,5.3880999978740294e-05
RoW,Activity,Mining of coal and lignite; extraction of peat (10),0.014606297926711646,0.0048548510039359075,0.004293142130214179,0.00292238036307833,0.005390243586334734
RoW,Activity,Mining of copper ores and concentrates,0.001113555387145927,0.0017776604830091747,0.0012658458227407228,0.00041356673788018797,0.0004490800099645037
RoW,Activity,Mining of iron ores,0.0007570927035537218,0.0016869715492286075,0.001163922367200965,0.00037587907357981365,0.0003186457293315311
RoW,Activity,"Mining of lead, zinc and tin ores and concentrates",0.00034328431682871665,0.0004238988258150608,0.00039684469977358,0.0001342476744139539,0.00014745985483212873
RoW,Activity,Mining of nickel ores and concentrates,0.00024638552278756715,0.0003888340657692592,0.0003298137568851875,0.00010965858630691995,0.00010657602894781241
RoW,Activity,Mining of other non-ferrous metal ores and concentrates,0.001063525734033328,0.0013636641956256466,0.0012547980597023309,0.00042793606978131003,0.00046093951794225685
RoW,Activity,Mining of precious metal ores and concentrates,0.0015560744324368467,0.0006743806382772666,0.0005451168504846067,0.00019847464220449227,0.000556931111958724
RoW,Activity,Mining of uranium and thorium ores (12),0.00010078801679660515,0.00010463061470523647,9.398215451042366e-05,4.229868127900403e-05,4.528608017237252e-05
RoW,Activity,N-fertiliser,8.881485638008824e-05,8.933950780276465e-05,7.983775625949904e-05,4.6832875583600695e-05,4.07549348839268e-05
RoW,Activity,Other business activities (74),7.829147243879203e-05,9.177044972560761e-05,8.393098860387584e-05,6.37599378248995e-05,5.146487211799297e-05
RoW,Activity,Other land transport,0.00012011140931722638,0.00012982648483979373,0.00012935413614252524,6.943455462424441e-05,7.458584888752245e-05
RoW,Activity,Other non-ferrous metal production,0.00023882603989736222,0.0003916494371238159,0.00032741264523127484,0.00012594889329681312,0.0001148832335101144
RoW,Activity,Other service activities (93),7.362570884667265e-06,6.54513629905591e-06,5.9143634000582164e-06,3.1574155725731794e-06,3.6901700562908585e-06
RoW,Activity,P- and other fertiliser,0.000250254754939434,0.00022145963651227133,0.00019751383791933458,0.0001071628174045164,0.00011055092634970662
RoW,Activity,Paper,0.00015328688849709077,0.00017193794931426518,0.00015052340190439695,7.500511934248558e-05,7.65886111515517e-05
RoW,Activity,Petroleum Refinery,0.0029313761070377435,0.0024366273395427804,0.00237370827850384,0.0017224351885158345,0.0015104294542409539
RoW,Activity,Pigs farming,2.4038800257284795e-05,2.08917408131498e-05,1.9236263586909698e-05,9.152141064154213e-06,1.159142510302385e-05
RoW,Activity,"Plastics, basic",0.0003231860612562004,0.0003706295229661068,0.0002767216754029492,0.00011239063688446746,0.00013662687392623676
RoW,Activity,Post and telecommunications (64),5.220174131124868e-05,5.5518894463791005e-05,5.1677894013554423e-05,3.4693521912827004e-05,3.213361644393622e-05
RoW,Activity,Poultry farming,1.2371019258661498e-05,1.1245096481624722e-05,1.019518870118645e-05,4.983744414463781e-06,5.887711007517135e-06
RoW,Activity,Precious metals production,0.0005003590172752793,0.0002756557488628754,0.00021911275398487455,7.893235351307199e-05,0.0001841257508963919
RoW,Activity,Private households with employed persons (95),1.2581325577533936e-06,1.1788239209544475e-06,1.0901848481933171e-06,5.856724091936673e-07,6.598150744414256e-07
RoW,Activity,Processed rice,1.2172540724856846e-05,1.099428843001921e-05,9.976749785755937e-06,4.349618727756657e-06,5.353311638082329e-06
RoW,Activity,Processing of Food products nec,2.0657037338520793e-05,1.938968817885088e-05,1.7646193031243743e-05,8.363792542707885e-06,9.784653091083705e-06
RoW,Activity,Processing of dairy products,2.253949947252972e-05,2.7214543519277827e-05,2.0690471041038406e-05,9.16748186274653e-06,1.0462973167135781e-05
RoW,Activity,Processing of meat cattle,6.107596159690165e-06,5.569720088995449e-06,5.067507149237645e-06,2.4344395676392532e-06,2.9893051260641023e-06
RoW,Activity,Processing of meat pigs,5.871720242067764e-06,4.944303313490938e-06,4.472378524410761e-06,2.263973300911105e-06,2.8819036842998566e-06
RoW,Activity,Processing of meat poultry,4.770476043351204e-06,3.764656935576139e-06,3.3448949496956717e-06,1.6821860810373514e-06,2.2463546550435482e-06
RoW,Activity,Processing of nuclear fuel,2.2403208638377807e-05,1.868232218248019e-05,1.3805694195837022e-05,5.580635875853746e-06,8.648810103799346e-06
RoW,Activity,Processing vegetable oils and fats,5.80627958156272e-05,4.977865773341282e-05,4.220039456585197e-05,1.7915438241735135e-05,2.420406874147913e-05
RoW,Activity,Production of electricity by Geothermal,1.7807963551999312e-05,5.211317832403569e-06,4.451456590205076e-06,2.299379016631889e-06,6.533426900220417e-06
RoW,Activity,Production of electricity by biomass and waste,0.0,0.0,0.0,0.0,0.0
RoW,Activity,Production of electricity by coal,0.0513955141564954,0.009398524587428184,0.008139940454874305,0.003960975548215572,0.01784118836859596
RoW,Activity,Production of electricity by gas,0.023344582701838923,0.005242289295867162,0.004604265562758569,0.0025354304606365055,0.008377217857142434
RoW,Activity,Production of electricity by hydro,0.0,0.0,0.0,0.0,0.0
RoW,Activity,Production of electricity by nuclear,1.1818885898119131e-05,3.858742154797566e-06,3.3862632342013303e-06,1.6064891239869959e-06,4.338418530156987e-06
RoW,Activity,Production of electricity by petroleum and other oil derivatives,0.008484879685877513,0.00316054650902403,0.002769591168698727,0.0016113379946125256,0.0032990487164817144
RoW,Activity,Production of electricity by solar photovoltaic,0.0,0.0,0.0,0.0,0.0
RoW,Activity,Production of electricity by solar thermal,0.0,0.0,0.0,0.0,0.0
RoW,Activity,"Production of electricity by tide, wave, ocean",0.0,0.0,0.0,0.0,0.0
RoW,Activity,Production of electricity by wind,0.0,0.0,0.0,0.0,0.0
RoW,Activity,Production of electricity nec,0.00036904146445347825,0.00018256287126620506,0.00015602424743789726,7.179287091727781e-05,0.00014322697674392816
RoW,Activity,Production of meat products nec,1.5426456734007065e-05,1.3386252670803648e-05,1.1861768317319545e-05,5.566748509771085e-06,7.268183176632994e-06
RoW,Activity,Production of offshore wind plants,0.0,0.0,0.0,0.0,0.0
RoW,Activity,Production of onshore wind plants,0.0,0.0,0.0,0.0,0.0
RoW,Activity,Production of photovoltaic plants,0.0,0.0,0.0,0.0,0.0
RoW,Activity,Public administration and defence; compulsory social security (75),1.9789347182059607e-05,1.782802935300803e-05,1.608403432438984e-05,9.667387017013595e-06,1.0551571621399213e-05
RoW,Activity,"Publishing, printing and reproduction of recorded media (22)",5.511159111190125e-05,6.028487631704812e-05,5.304571722406462e-05,3.308743073695339e-05,3.1887545493781976e-05
RoW,Activity,Pulp,0.00012829176583516573,0.00010733263936973479,8.482954263234872e-05,3.914056802196621e-05,5.463044818026934e-05
RoW,Activity,Quarrying of sand and clay,0.00018052091350838315,0.00015184302763271608,0.00014207715345055516,5.4873532385926896e-05,7.574388450402014e-05
RoW,Activity,Quarrying of stone,0.0003818429610924191,0.00020209149654889315,0.00023484492350309098,7.092739824947403e-05,0.00014123011718758706
RoW,Activity,Raw milk,1.8930635995684713e-05,1.8806257878290586e-05,1.6223286619841895e-05,7.643013989312273e-06,8.988360841999446e-06
RoW,Activity,Re-processing of ash into clinker,0.00010447182733573189,3.78757676293731e-05,4.543437773598555e-05,2.1488535922243285e-05,4.344625797861377e-05
RoW,Activity,Re-processing of secondary aluminium into new aluminium,0.00040126071983092844,0.0005439818185305428,0.0004661682893090386,0.00014401168323788601,0.00016138504241074319
RoW,Activity,Re-processing of secondary construction material into aggregates,2.7317109246975123e-05,1.848479564732212e-05,1.9901054331318878e-05,1.2083328541975371e-05,1.5185269926076587e-05
RoW,Activity,Re-processing of secondary copper into new copper,0.00010296034934607915,0.00029803487060976606,0.00019395481989683899,6.348228029033398e-05,4.6104763163313466e-05
RoW,Activity,Re-processing of secondary glass into new glass,0.0004862564575470094,0.00017129915795948143,0.00013018974816612658,4.176215867776895e-05,0.00016492619630954528
RoW,Activity,"Re-processing of secondary lead into new lead, zinc and tin",0.00013693932774712603,0.0001897942132891747,0.00018367223613138293,6.522315744566695e-05,6.424723235389093e-05
RoW,Activity,Re-processing of secondary other non-ferrous metals into new other non-ferrous metals,6.814189058777647e-05,0.00011465451611485434,9.607120713969224e-05,3.669062856723071e-05,3.2906898306349e-05
RoW,Activity,Re-processing of secondary paper into new pulp,5.988206931072923e-05,4.560053450484283e-05,3.6270420062014066e-05,1.7004151957110115e-05,2.5064538415293736e-05
RoW,Activity,Re-processing of secondary plastic into new plastic,4.1473603721885215e-05,4.785298482379365e-05,3.539581146006011e-05,1.419347206761148e-05,1.741628847475453e-05
RoW,Activity,Re-processing of secondary preciuos metals into new preciuos metals,0.0,0.0,0.0,0.0,0.0
RoW,Activity,Re-processing of secondary steel into new steel,0.001289630307785547,0.0026143888278109856,0.0022786101845197098,0.0007845862036855799,0.0006165143271691191
RoW,Activity,Re-processing of secondary wood material into new wood material,3.4397796021310414e-05,2.668755926319141e-05,2.8333201410440526e-05,1.1412193492218777e-05,1.5351046723056138e-05
RoW,Activity,Real estate activities (70),2.8461034854532293e-05,2.9635741185312547e-05,2.9091341388896295e-05,1.7894439480825553e-05,1.8602875945951873e-05
RoW,Activity,"Recreational, cultural and sporting activities (92)",8.590979250132221e-06,9.747668679746802e-06,8.938278112635762e-06,6.192016759752119e-06,5.435814396180797e-06
RoW,Activity,Recycling of bottles by direct reuse,0.0,0.0,0.0,0.0,0.0
RoW,Activity,Recycling of waste and scrap,0.0006899416260314446,0.0008490361514976035,0.000705535224180749,0.0002588712363998144,0.0002935213812737348
RoW,Activity,Renting of machinery and equipment without operator and of personal and household goods (71),3.8893448316315524e-05,3.846317939804905e-05,3.6975844341479306e-05,2.5771834528881977e-05,2.3544430463334367e-05
RoW,Activity,Research and development (73),8.5383258006798e-05,0.0001391405955928654,0.00011112858305971513,5.321896240414823e-05,4.329466307353484e-05
RoW,Activity,Retail sale of automotive fuel,9.190771429000063e-05,8.659624542485537e-05,8.221849902484284e-05,4.681790758804955e-05,0.000466164815917094
RoW,Activity,"Retail trade, except of motor vehicles and motorcycles; repair of personal and household goods (52)",0.00011622265208724303,0.00010707201971212738,9.62998076803972e-05,4.98870061172489e-05,7.06031897386201e-05
