EU27+UK,Activity,Supporting and auxiliary transport activities; activities of travel agencies (63),0.0006778908777110431,0.0010595908950764691,0.0014832413011142281,0.0006929059713413164,0.0005506041829274735
EU27+UK,Activity,"Tanning and dressing of leather; manufacture of luggage, handbags, saddlery, harness and footwear (19)",3.4148632247535477e-06,5.780804079620548e-06,5.450013854598201e-06,2.5231582757148265e-06,2.1117329586672946e-06
EU27+UK,Activity,Transmission of electricity,0.00046882201010849095,0.000655461587685934,0.0006820076900747021,0.0005063164449797722,0.0004037167093276002
EU27+UK,Activity,Transport via pipelines,0.0007318021247291182,0.0008683463834216101,0.001004378376680575,0.001053437174115087,0.0012929715352592648
EU27+UK,Activity,Transport via railways,0.000464692310068462,0.0008279773344829187,0.0009298528655182474,0.0005246592124651932,0.0005042807008070377
EU27+UK,Activity,"Waste water treatment, food",4.652486938891458e-06,5.2919436813152306e-06,5.788552297254378e-06,3.33926439192154e-06,2.701199172631123e-06
EU27+UK,Activity,"Waste water treatment, other",8.306606608807236e-06,9.756855193746032e-06,1.0543901788156273e-05,6.126937355477749e-06,4.824183329395312e-06
EU27+UK,Activity,"Wholesale trade and commission trade, except of motor vehicles and motorcycles (51)",0.0005444606603236333,0.0010525368071970791,0.0010053044290602407,0.000541890887320264,0.0005352807446305877
EU27+UK,Activity,"Wool, silk-worm cocoons",0.000129675269853247,0.00015576527947137902,0.00014793547722050907,6.72651450900191e-05,7.173444537535694e-05
RoW,Activity,Activities auxiliary to financial intermediation (67),5.402254549642548e-05,5.5566948404892526e-05,5.244147784457205e-05,3.73680607066247e-05,3.3475769345564856e-05
RoW,Activity,Activities of membership organisation n.e.c. (91),5.8440020030339745e-06,5.6411984460282926e-06,5.105919788631461e-06,2.6910837617685136e-06,2.9769879558724296e-06
RoW,Activity,Air transport (62),0.0010598400024169527,0.0012659975288043205,0.0012527484349324925,0.0007729573947488596,0.0007049865403452312
RoW,Activity,Aluminium production,0.0008086063762412327,0.0009941754292624129,0.000831313557166756,0.00026623517947841523,0.0003238507003406001
RoW,Activity,Animal products nec,4.176413599821997e-06,4.35325933932073e-06,3.945945697413932e-06,1.927294578590419e-06,2.1302510625355377e-06
RoW,Activity,"Biogasification of food waste, incl. land application",9.74759991787529e-08,1.0625854159843174e-07,9.703287139819317e-08,5.101136247175705e-08,4.848197009489622e-08
RoW,Activity,"Biogasification of paper, incl. land application",1.0220930756281558e-07,1.2230872167799726e-07,1.0586296957190775e-07,5.072392452877621e-08,4.8644872174770084e-08
RoW,Activity,"Biogasification of sewage slugde, incl. land application",4.838741028541921e-07,4.61333268972502e-07,4.1864047019016213e-07,2.018249197573942e-07,2.2600141111417292e-07
RoW,Activity,Casting of metals,0.00020167750868893412,0.0002584482239970853,0.00021095568670356253,9.769814781593092e-05,9.764052882297218e-05
RoW,Activity,Cattle farming,2.7582739242396963e-05,2.5036296733437713e-05,2.255276177552408e-05,1.1165251398404009e-05,1.2965786235916359e-05
RoW,Activity,Chemicals nec,0.0026608318225705757,0.0029160097218675933,0.0026942642156351283,0.0012854499592226806,0.0012572874991551262
RoW,Activity,"Collection, purification and distribution of water (41)",8.719897993827513e-05,5.182315795864616e-05,4.639966342981522e-05,2.245091490371596e-05,3.6889400345539426e-05
RoW,Activity,"Composting of food waste, incl. land application",5.446781644848684e-07,5.904736909764713e-07,5.632051176383503e-07,3.1996719278432864e-07,3.015120343134576e-07
RoW,Activity,"Composting of paper and wood, incl. land application",6.216509620570857e-08,6.911432268837228e-08,6.179781390230324e-08,2.917387657040433e-08,2.9857369318543676e-08
RoW,Activity,Computer and related activities (72),1.7281716562310674e-05,2.075243407131078e-05,1.9085205499367927e-05,1.2640985356297154e-05,1.1428794049829197e-05
RoW,Activity,Construction (45),0.00012341767440492659,8.564404292054839e-05,9.233373941968952e-05,5.708747261868666e-05,7.231122550709089e-05
RoW,Activity,Copper production,0.00027445301526646883,0.0009239071673931374,0.0005853467752838388,0.00019600489897559454,0.0001276837354741493
RoW,Activity,Cultivation of cereal grains nec,7.766634470035706e-05,6.571279043202827e-05,5.892359258188776e-05,2.8306109396685097e-05,3.522158207381765e-05
RoW,Activity,Cultivation of crops nec,5.558726992872671e-05,4.783841758919649e-05,4.261612486123739e-05,1.9303108297791292e-05,2.5082502479719154e-05
RoW,Activity,Cultivation of oil seeds,0.00011489007646429883,0.00010416098025052656,7.92021516162304e-05,3.399421394426664e-05,4.78564389830832e-05
RoW,Activity,Cultivation of paddy rice,7.828963005196818e-05,7.311148161670401e-05,6.572144349105271e-05,3.124306283486607e-05,3.611685284398803e-05
RoW,Activity,Cultivation of plant-based fibers,1.3434411784959308e-05,1.4778855491161194e-05,1.313346328992891e-05,5.774601195426073e-06,6.1862756166822054e-06
RoW,Activity,"Cultivation of sugar cane, sugar beet",1.4223000931541014e-05,1.3641318324313937e-05,1.2279217543969028e-05,5.88198465902122e-06,6.592397840773523e-06
RoW,Activity,"Cultivation of vegetables, fruit, nuts",6.941325070430072e-05,4.732165288357278e-05,3.9490436381510316e-05,1.774224059453267e-05,2.8648098442688745e-05
RoW,Activity,Cultivation of wheat,0.00012697960510930177,0.00012354613311981995,0.00011283570213960332,5.571811784818298e-05,6.072908368352054e-05
RoW,Activity,Distribution and trade of electricity,7.958600210052663e-05,7.905392306176348e-05,7.167290712764656e-05,3.7052155050146635e-05,4.021214629994531e-05
RoW,Activity,Education (80),3.337365897934043e-06,3.6716661303589917e-06,3.33577030360462e-06,2.388131504150598e-06,2.0527359060931604e-06
RoW,Activity,Extra-territorial organizations and bodies,0.0,0.0,0.0,0.0,0.0
RoW,Activity,"Extraction of crude petroleum and services related to crude oil extraction, excluding surveying",0.0035531792944476304,0.0028783793208778997,0.00281394398186542,0.003193192985953815,0.0022744284151515063
RoW,Activity,"Extraction of natural gas and services related to natural gas extraction, excluding surveying",0.01034632291051967,0.006487594292146366,0.005701632868488287,0.009959551140702664,0.008535571160217612
RoW,Activity,"Extraction, liquefaction, and regasification of other petroleum and gaseous materials",0.0006009963541809987,0.000490945706182747,0.00048428435703793397,0.0003920111243394197,0.00031389729246972546
RoW,Activity,"Financial intermediation, except insurance and pension funding (65)",0.0001427024520645115,0.00013949725428649207,0.0001308297454504714,9.392590455218335e-05,8.489493185978456e-05
RoW,Activity,"Fishing, operating of fish hatcheries and fish farms; service activities incidental to fishing (05)",1.3786366430082452e-05,1.6029668775019916e-05,1.5713841978941714e-05,7.08633305463538e-06,7.3536100711606135e-06
RoW,Activity,"Forestry, logging and related service activities (02)",8.362346086189134e-05,5.4495924277954485e-05,4.680488776917383e-05,1.9962868396266987e-05,3.410833976679359e-05
RoW,Activity,Health and social work (85),3.1372798461787074e-06,3.1649772611786826e-06,2.9503969594510885e-06,1.9258103771806536e-06,1.803279669714823e-06
RoW,Activity,Hotels and restaurants (55),8.402428964516807e-05,0.00010360211500614599,9.993983341624001e-05,5.4200279339197474e-05,5.605904320650046e-05
RoW,Activity,Incineration of waste: Food,3.928526168021777e-06,3.5471552764578138e-06,3.2920197413550757e-06,1.8640863944838738e-06,1.8902884973491908e-06
RoW,Activity,Incineration of waste: Metals and Inert materials,5.05303330369838e-05,4.123458796406978e-05,4.131093622749276e-05,2.1366888821650776e-05,2.4548163135672667e-05
RoW,Activity,Incineration of waste: Oil/Hazardous waste,2.2007656084722057e-05,2.0511325645203234e-05,1.8446209293176325e-05,9.289377099438178e-06,1.0361105315436525e-05
RoW,Activity,Incineration of waste: Paper,2.838851956574648e-06,2.66754378677606e-06,2.45207272178164e-06,1.2028988790225425e-06,1.3526036267047373e-06
RoW,Activity,Incineration of waste: Plastic,3.437032918287474e-05,3.265172010080412e-05,3.0849397770527876e-05,1.5931403360230803e-05,1.6838590037262505e-05
RoW,Activity,Incineration of waste: Textiles,4.450168810765346e-05,4.9696525134189896e-05,4.4888873375807725e-05,2.0912350813263834e-05,2.135226659311456e-05
RoW,Activity,Incineration of waste: Wood,1.3916767741598783e-06,1.22905590249196e-06,1.1119100882398042e-06,5.769375621225729e-07,6.48033507316546e-07
RoW,Activity,Inland water transport,0.00037346812508234884,0.0004336232060326222,0.00041904355938159857,0.00022852754318750974,0.00022311059133281463
RoW,Activity,"Insurance and pension funding, except compulsory social security (66)",2.115665640710178e-05,2.1979462349428705e-05,2.176635259278066e-05,1.5047742917008563e-05,1.5452032683354965e-05
RoW,Activity,Landfill of waste: Food,3.920847474262936e-06,3.6051851670971368e-06,3.4295529516180717e-06,1.6757154597257785e-06,1.9096848717561476e-06
RoW,Activity,Landfill of waste: Inert/metal/hazardous,1.9027549503260567e-06,1.7364576718343578e-06,1.5990595676056189e-06,7.96714802694805e-07,9.160666140094597e-07
RoW,Activity,Landfill of waste: Paper,2.3098150841129793e-06,1.8892467590578e-06,1.7714959148757324e-06,8.560864670105636e-07,1.0666238607271238e-06
RoW,Activity,Landfill of waste: Plastic,1.0178653894324842e-06,9.132731796479089e-07,8.503336884035056e-07,4.2930885734792525e-07,4.93305243081958e-07
RoW,Activity,Landfill of waste: Textiles,6.26315335077252e-07,6.015472684987534e-07,5.584459414032805e-07,2.7512789196814905e-07,3.0675963396658283e-07
RoW,Activity,Landfill of waste: Wood,7.560295999620523e-07,6.600444329289323e-07,6.175291454427302e-07,3.065680896529146e-07,3.601147304024689e-07
RoW,Activity,"Lead, zinc and tin production",3.656863372119914e-05,5.805225030816212e-05,5.606724110358666e-05,2.0309419089704642e-05,1.795816101660372e-05
RoW,Activity,Manufacture of basic iron and steel and of ferro-alloys and first products thereof,0.002725265014710774,0.006173727421782322,0.005475091347358559,0.0018281724054001797,0.001330335465088635
RoW,Activity,Manufacture of beverages,1.1209309244650155e-05,1.2413524883491024e-05,1.0994017837652005e-05,5.532248518953141e-06,5.999397872678167e-06
RoW,Activity,"Manufacture of bricks, tiles and construction products, in baked clay",4.5874200877906575e-05,3.690739212625131e-05,3.650882096101567e-05,1.6517307808557395e-05,2.1421478708469383e-05
RoW,Activity,"Manufacture of cement, lime and plaster",0.0006992817418943336,0.000299311188874019,0.0003610135038875556,0.00017594990232431857,0.00031027828200819055
RoW,Activity,Manufacture of ceramic goods,0.00016631070735548823,0.00010160878248906629,0.00011433248418252712,5.4696415553451526e-05,8.055186113253242e-05
RoW,Activity,Manufacture of coke oven products,0.0004928223353122891,0.0006205665330818307,0.0005575465752348464,0.00023462558980615522,0.00023196048692247133
RoW,Activity,Manufacture of electrical machinery and apparatus n.e.c. (31),0.0001438440580642403,0.00019391034226842968,0.00013425067377634725,8.57775527460596e-05,7.704478109494234e-05
RoW,Activity,"Manufacture of fabricated metal products, except machinery and equipment (28)",0.0003057509122315501,0.0005194900601384079,0.0004712759002151219,0.00017370404461899465,0.00014889429541979572
RoW,Activity,Manufacture of fish products,1.1249495544962082e-05,1.4597034955621237e-05,1.41085288799581e-05,6.438506565280223e-06,6.111398387030587e-06
RoW,Activity,Manufacture of furniture; manufacturing n.e.c. (36),0.00013010401305978397,0.00015453849178894983,0.00012908887232967138,6.63931671421352e-05,6.341606477285302e-05
RoW,Activity,Manufacture of gas; distribution of gaseous fuels through mains,0.000744005483493722,0.0004276823823906566,0.00037811203086430807,0.00018838800915866298,0.00030897934132880487
RoW,Activity,Manufacture of glass and glass products,0.0023103405423462154,0.0008706002513035261,0.0006580623946294326,0.00020516394560271412,0.0007959916636843874
RoW,Activity,Manufacture of machinery and equipment n.e.c. (29),0.00010802812119111802,0.00012394833258138507,9.860836683561577e-05,4.248158773112556e-05,4.856904529582558e-05
RoW,Activity,"Manufacture of medical, precision and optical instruments, watches and clocks (33)",6.837650915753254e-05,0.00012491929067427678,8.32090479745941e-05,3.76217832287276e-05,3.4383409284219484e-05
RoW,Activity,"Manufacture of motor vehicles, trailers and semi-trailers (34)",4.829883068275271e-05,5.316111774309669e-05,4.897821584870807e-05,2.1899117579977914e-05,2.5432046489555467e-05
RoW,Activity,Manufacture of office machinery and computers (30),1.1636014930278115e-05,1.4130357585835005e-05,9.591008499364703e-06,4.351176272966843e-06,5.222065794194557e-06
RoW,Activity,Manufacture of other non-metallic mineral products n.e.c.,0.003977216438805727,0.0007715012061466945,0.000792959449761223,0.00027387736830399956,0.0013813456673331841
RoW,Activity,Manufacture of other transport equipment (35),4.1793318786726927e-05,5.294756060801964e-05,4.795423561126125e-05,2.1394923162515167e-05,2.270813753570748e-05
RoW,Activity,"Manufacture of radio, television and communication equipment and apparatus (32)",0.00010937468501147811,0.0001336320448047056,9.900643678668018e-05,5.152352955848048e-05,5.271841141940438e-05
RoW,Activity,Manufacture of rubber and plastic products (25),0.00013772979587232283,0.00016663650807546954,0.00014998235377263348,6.201090239208303e-05,6.691351746799974e-05
RoW,Activity,Manufacture of textiles (17),0.0002443535862092259,0.00031098820961018343,0.00027391965771647684,0.00010712847835918302,0.0001151003108206924
RoW,Activity,Manufacture of tobacco products (16),5.30782541861246e-05,2.0793946826931e-05,1.619612263145499e-05,6.43084471797192e-06,1.9263368334950843e-05
RoW,Activity,Manufacture of wearing apparel; dressing and dyeing of fur (18),5.770543896739965e-05,6.254511417816228e-05,5.969287964462395e-05,2.785843166645633e-05,2.973187907123937e-05
RoW,Activity,"Manufacture of wood and of products of wood and cork, except furniture; manufacture of articles of straw and plaiting materials (20)",0.00045857710215693184,0.00035181978329889283,0.0003647556547790565,0.0001490931479037018,0.00020484823356223277
RoW,Activity,"Manure treatment (biogas), storage and land application",0.0,0.0,0.0,0.0,0.0
RoW,Activity,"Manure treatment (conventional), storage and land application",0.0,0.0,0.0,0.0,0.0
RoW,Activity,Meat animals nec,9.303451136139763e-06,9.306778749565686e-06,8.366463271545311e-06,4.08155119810548e-06,4.574656164677863e-06
RoW,Activity,Mining of aluminium ores and concentrates,0.00044416606211260707,0.00041373438550471855,0.00032251363490647307,0.00010109387405136423,0.00016462216476356272
RoW,Activity,"Mining of chemical and fertilizer minerals, production of salt, other mining and quarrying n.e.c.",0.00011918775399999225,0.00025612453248587163,0.0002966858126454938,7.853555014971291e-05,5.2147697395705625e-05
RoW,Activity,Mining of coal and lignite; extraction of peat (10),0.010587685222420809,0.00492208460081981,0.0043523857462363326,0.0025441383140736126,0.00414717907323312
RoW,Activity,Mining of copper ores and concentrates,0.0009625393172303559,0.0017115380011911594,0.0011547699382569343,0.00038422147478066614,0.00039275514944591566
RoW,Activity,Mining of iron ores,0.0006057261562253779,0.0016567952222065095,0.001112374423027982,0.00036136542847012466,0.00026506908653268384
RoW,Activity,"Mining of lead, zinc and tin ores and concentrates",0.00025323104710679365,0.00033859038728928663,0.00032835070696147703,0.000110812530438391,0.00011293487013308227
RoW,Activity,Mining of nickel ores and concentrates,0.00027973763276427734,0.00040098222773637954,0.0004102775016431038,0.00012166970975706034,0.000117920751508124
RoW,Activity,Mining of other non-ferrous metal ores and concentrates,0.0008348439724956199,0.0012456344437767654,0.0011174683120377122,0.0003656829317358803,0.0003605857741484639
RoW,Activity,Mining of precious metal ores and concentrates,0.0017671830992005582,0.000550609784683583,0.0004124405090245426,0.00015449065775346882,0.0006199392502059865
RoW,Activity,Mining of uranium and thorium ores (12),0.00010581922398806248,0.00011516056086013643,0.00010418363063405293,5.007830143677629e-05,4.997232408388288e-05
RoW,Activity,N-fertiliser,7.44612372328423e-05,7.777024189030695e-05,7.017598475309652e-05,3.987310933105366e-05,3.55628357588135e-05
RoW,Activity,Other business activities (74),7.834592144948774e-05,9.440724257391196e-05,8.715007167748342e-05,5.863010908720097e-05,5.256014209724077e-05
RoW,Activity,Other land transport,0.00011302577194105185,0.00012350042264229876,0.00012590702192601227,7.057336181179269e-05,9.223540957031992e-05
RoW,Activity,Other non-ferrous metal production,0.00027648507511833574,0.00043138985490345213,0.0003513802508231434,0.00012112841215754854,0.00011883153603071924
RoW,Activity,Other service activities (93),7.703937115943183e-06,7.614839694100113e-06,6.820508506267633e-06,3.614707632164106e-06,4.041291117232305e-06
RoW,Activity,P- and other fertiliser,0.00023451153200883327,0.00021443345573638186,0.00019106856253787885,0.00011609081051944249,0.00010837388159877929
RoW,Activity,Paper,0.0001244196968224203,0.0001334720671317349,0.00011783432912937886,5.972840859638513e-05,6.219505618460517e-05
RoW,Activity,Petroleum Refinery,0.002348838624860505,0.002092280978524839,0.002073449299027016,0.0021452402769077646,0.0014001174258563797
RoW,Activity,Pigs farming,1.995393182493049e-05,1.812708626710813e-05,1.678281626226711e-05,8.190446074971186e-06,9.622177499850264e-06
RoW,Activity,"Plastics, basic",0.00025567686371980676,0.0002756311779693076,0.00022316097284275267,9.7955394450651e-05,0.00011243409599741511
RoW,Activity,Post and telecommunications (64),4.527774098995479e-05,4.884856659154846e-05,4.6274964134083745e-05,3.2403158288594086e-05,2.9141553963751008e-05
RoW,Activity,Poultry farming,1.149877660935595e-05,1.0339478043495396e-05,9.567013209334014e-06,4.838046436150084e-06,5.565652575725454e-06
RoW,Activity,Precious metals production,0.0004977666791114785,0.0001977640609869222,0.00013963066748522997,5.3033701003028274e-05,0.00017745972921425954
RoW,Activity,Private households with employed persons (95),1.174374463412029e-06,1.132784874207943e-06,1.0385298128607157e-06,5.507055914349474e-07,6.087095577459295e-07
RoW,Activity,Processed rice,1.4351740000984897e-05,1.3130268529060539e-05,1.1320430706048263e-05,5.2717152751139356e-06,6.392130997749615e-06
RoW,Activity,Processing of Food products nec,1.9365529180620654e-05,1.6903201931689798e-05,1.537595521373364e-05,7.50660244109462e-06,9.230969823304284e-06
RoW,Activity,Processing of dairy products,2.0671464324042844e-05,1.683281414918891e-05,1.5002049809588953e-05,7.368605317110529e-06,9.500948044572514e-06
RoW,Activity,Processing of meat cattle,8.066332140719315e-06,6.5553959719790895e-06,5.66510420611628e-06,2.7912016098192908e-06,3.6875304776175266e-06
RoW,Activity,Processing of meat pigs,5.571152812252673e-06,5.045352463842752e-06,4.602534614440426e-06,2.408894911645426e-06,2.785075715736616e-06
RoW,Activity,Processing of meat poultry,4.647634894905953e-06,3.749376050719248e-06,3.343634005759556e-06,1.7513122935971628e-06,2.192995485986623e-06
RoW,Activity,Processing of nuclear fuel,2.0986176746993352e-05,2.2165514917709503e-05,1.641652650363967e-05,6.606870335994051e-06,8.556409428761039e-06
RoW,Activity,Processing vegetable oils and fats,4.9100624903999506e-05,5.102788019483523e-05,4.3067671266087596e-05,1.912009753977187e-05,2.2042488950661616e-05
RoW,Activity,Production of electricity by Geothermal,1.83771745279761e-05,4.944265142918153e-06,4.394293636113004e-06,2.3113359609264133e-06,6.8014614278897225e-06
RoW,Activity,Production of electricity by biomass and waste,0.0,0.0,0.0,0.0,0.0
RoW,Activity,Production of electricity by coal,0.05666401854915139,0.008369226491180479,0.007323908406872688,0.0035258207494830965,0.019730020609219506
RoW,Activity,Production of electricity by gas,0.027806020917947028,0.004263632271896564,0.0037594114374111106,0.0019192140802720462,0.009762573738611894
RoW,Activity,Production of electricity by hydro,0.0,0.0,0.0,0.0,0.0
RoW,Activity,Production of electricity by nuclear,1.0912931812185053e-05,3.293030622157087e-06,2.9035808361431058e-06,1.3575863415380754e-06,4.016908662353475e-06
RoW,Activity,Production of electricity by petroleum and other oil derivatives,0.008157205469362522,0.0021386539976601822,0.0018857083846905473,0.001031142219662368,0.003033917340731802
RoW,Activity,Production of electricity by solar photovoltaic,0.0,0.0,0.0,0.0,0.0
RoW,Activity,Production of electricity by solar thermal,0.0,0.0,0.0,0.0,0.0
RoW,Activity,"Production of electricity by tide, wave, ocean",0.0,0.0,0.0,0.0,0.0
RoW,Activity,Production of electricity by wind,0.0,0.0,0.0,0.0,0.0
RoW,Activity,Production of electricity nec,0.0003105932943167865,0.00014733372234656752,0.00012830537967935938,6.144340569493453e-05,0.00012206953986368637
RoW,Activity,Production of meat products nec,1.2894495562225027e-05,1.2040867630106271e-05,1.0835365573673383e-05,5.413775669851756e-06,6.199400829380418e-06
RoW,Activity,Production of offshore wind plants,0.0,0.0,0.0,0.0,0.0
RoW,Activity,Production of onshore wind plants,0.0,0.0,0.0,0.0,0.0
RoW,Activity,Production of photovoltaic plants,0.0,0.0,0.0,0.0,0.0
RoW,Activity,Public administration and defence; compulsory social security (75),2.9685873429911816e-05,2.6703467936462068e-05,2.476200347014812e-05,1.372455774759272e-05,1.5569996082674726e-05
RoW,Activity,"Publishing, printing and reproduction of recorded media (22)",4.07241130394759e-05,4.542941180288245e-05,4.079305377600039e-05,2.4630395084773585e-05,2.391021151114389e-05
RoW,Activity,Pulp,0.00018109937842990915,0.00014065101487923849,0.00011320293513681386,5.365219582218534e-05,7.722186424363588e-05
RoW,Activity,Quarrying of sand and clay,0.00021273507877865792,0.000162956833529299,0.0001547042712772583,6.080233700751194e-05,8.944875605564737e-05
RoW,Activity,Quarrying of stone,0.00045201675797594895,0.00022657006930678722,0.00027980414797931845,7.878887808780629e-05,0.00016749830668337534
RoW,Activity,Raw milk,1.406242891199749e-05,1.2746965953744343e-05,1.17272389591361e-05,5.884944890312915e-06,6.83209687893957e-06
RoW,Activity,Re-processing of ash into clinker,0.00010523709465554223,3.848729541804782e-05,4.829312132737605e-05,2.3543349882504593e-05,4.561616804099285e-05
RoW,Activity,Re-processing of secondary aluminium into new aluminium,0.0004037630099141487,0.0005018269373106756,0.0004202862732923415,0.00013430655799332906,0.00016197122413473113
RoW,Activity,Re-processing of secondary construction material into aggregates,3.4294515813588755e-05,2.2389667296237037e-05,2.4472052918944385e-05,1.512541396034904e-05,1.9767411964091803e-05
RoW,Activity,Re-processing of secondary copper into new copper,8.115146764635412e-05,0.00028275971596908447,0.00017833684864713265,5.941198624917486e-05,3.7888713275505995e-05
RoW,Activity,Re-processing of secondary glass into new glass,0.00045093918804872235,0.00016867337332942105,0.00012745959572839764,3.946903295599405e-05,0.00015516245061641327
RoW,Activity,"Re-processing of secondary lead into new lead, zinc and tin",0.00013226527011851654,0.00017751458743761803,0.00017071225569570682,6.162653480974758e-05,6.13967735021115e-05
RoW,Activity,Re-processing of secondary other non-ferrous metals into new other non-ferrous metals,7.053766236893335e-05,0.00011395434030337296,9.325959335866377e-05,3.201923965083702e-05,3.056409110961169e-05
RoW,Activity,Re-processing of secondary paper into new pulp,6.545040712326885e-05,4.501791161077427e-05,3.6609319128760806e-05,1.7565591328165787e-05,2.7388097690326e-05
RoW,Activity,Re-processing of secondary plastic into new plastic,3.6070497186251186e-05,3.925848982254726e-05,3.160334579982865e-05,1.372651714274811e-05,1.5814992360493385e-05
RoW,Activity,Re-processing of secondary preciuos metals into new preciuos metals,0.0,0.0,0.0,0.0,0.0
RoW,Activity,Re-processing of secondary steel into new steel,0.001211409670993296,0.0027666653615853395,0.0024533691053418155,0.0008161580045091859,0.0005912428455525784
RoW,Activity,Re-processing of secondary wood material into new wood material,3.503255714291981e-05,2.7053916158855638e-05,2.8204506809263183e-05,1.1489151610388785e-05,1.571478691570475e-05
RoW,Activity,Real estate activities (70),3.416075708905018e-05,3.484067573205038e-05,3.53715640554032e-05,2.046559693218343e-05,2.1532936141373472e-05
RoW,Activity,"Recreational, cultural and sporting activities (92)",6.767755653125367e-06,7.871294834653261e-06,7.29336133545728e-06,4.679065114557049e-06,4.320139872371788e-06
RoW,Activity,Recycling of bottles by direct reuse,0.0,0.0,0.0,0.0,0.0
RoW,Activity,Recycling of waste and scrap,0.000683660870390515,0.0008280572183295487,0.0006829270147477925,0.0002474520855497145,0.00028720612540160157
RoW,Activity,Renting of machinery and equipment without operator and of personal and household goods (71),3.6272228282447424e-05,4.28322920378344e-05,4.1049127202503575e-05,2.4558209775217682e-05,2.247463640701443e-05
RoW,Activity,Research and development (73),7.918260740311289e-05,0.0001332744772518455,0.0001083731617553588,5.250237319815742e-05,4.155934028675936e-05
RoW,Activity,Retail sale of automotive fuel,8.700128285501503e-05,7.808716886256094e-05,7.304416605115846e-05,4.091735194595406e-05,4.4870155996763185e-05
RoW,Activity,"Retail trade, except of motor vehicles and motorcycles; repair of personal and household goods (52)",0.00010896450685193509,0.00010038738020396713,9.209736953369411e-05,5.048440189836378e-05,5.546750227864119e-05
