EU27+UK,Activity,Activities of membership organisation n.e.c. (91),6.031270864900332e-06,9.229272892779745e-06,9.462992709155122e-06,1.6070068423769245e-05,1.3661524889991797e-05
EU27+UK,Activity,Air transport (62),0.0023777167658563664,0.0034324415256539492,0.0035044699401408585,0.0028806567336422855,0.0022589149570481177
EU27+UK,Activity,Aluminium production,0.0014183435372926944,0.0005002589453718803,0.0004565252000264077,0.00017236476835892173,0.0006100424783269924
EU27+UK,Activity,Animal products nec,1.201299580974081e-05,1.941153661851019e-05,2.115557857911876e-05,1.42998703395401e-05,1.1347819768100792e-05
EU27+UK,Activity,"Biogasification of food waste, incl. land application",6.422461862326846e-07,1.0321477960901105e-06,1.1015817246995916e-06,8.423088564663911e-07,4.756243477955454e-07
EU27+UK,Activity,"Biogasification of paper, incl. land application",1.4169751849119388e-07,2.06674546153201e-07,2.1763398500491231e-07,1.560407527852686e-07,9.652336500054692e-08
EU27+UK,Activity,"Biogasification of sewage slugde, incl. land application",4.376340823116473e-06,6.649854682519158e-06,6.885787162913988e-06,4.085216641457381e-06,2.956517866745844e-06
EU27+UK,Activity,Casting of metals,0.0012098480521155076,0.002632022129048927,0.002380745665187246,0.0010706706312828946,0.0008208773584655662
EU27+UK,Activity,Cattle farming,1.36966339603742e-05,2.335405834599373e-05,2.355959049012422e-05,1.3231775023156804e-05,1.005182580730627e-05
EU27+UK,Activity,Chemicals nec,0.0010553222732521237,0.010726168025429885,0.007756452382133346,0.0028668898991502283,0.0006423218488272906
EU27+UK,Activity,"Collection, purification and distribution of water (41)",0.00014083390740280777,0.00011984955104325693,0.00012206109524602485,0.000198237962991469,0.00013385480069374623
EU27+UK,Activity,"Composting of food waste, incl. land application",1.1379849478708495e-05,1.3978361616619142e-05,1.484588166289098e-05,1.2967947655827806e-05,8.02976572768148e-06
EU27+UK,Activity,"Composting of paper and wood, incl. land application",3.241820714631369e-08,3.794518179277656e-08,4.0439248149470076e-08,2.5908158653921334e-08,2.151389164979283e-08
EU27+UK,Activity,Computer and related activities (72),0.0001244027808103286,0.0001903018477851147,0.00018477751647133213,0.0001604029152075732,0.00011151942634259308
EU27+UK,Activity,Construction (45),0.004048719796910792,0.0005734776152627584,0.002100123475309174,0.0008043635499463725,0.001998253598630023
EU27+UK,Activity,Copper production,0.000290139366110238,0.0006587862033782861,0.0005677436883378158,0.00024114230304717895,0.00017275304559967488
EU27+UK,Activity,Cultivation of cereal grains nec,4.6097323091124116e-05,8.438422730207974e-05,8.249191566914914e-05,4.329917699362639e-05,3.2179756273249474e-05
EU27+UK,Activity,Cultivation of crops nec,1.2314100905601475e-05,1.0015667073918422e-05,1.1889931930746024e-05,6.438639528342137e-06,7.328326083365385e-06
EU27+UK,Activity,Cultivation of oil seeds,1.669215348191288e-05,3.515807872559801e-05,3.5642768904259716e-05,1.8018012422581135e-05,1.2095826033419795e-05
EU27+UK,Activity,Cultivation of paddy rice,9.334135555117447e-06,1.966479538213127e-05,1.9984462261165344e-05,9.642711111381677e-06,6.341866038309746e-06
EU27+UK,Activity,Cultivation of plant-based fibers,3.1204768608908025e-06,4.843182808596052e-06,4.6899346807133155e-06,2.3444835668785846e-06,1.9740192244770857e-06
EU27+UK,Activity,"Cultivation of sugar cane, sugar beet",6.723173171781268e-06,1.7310837117853967e-05,1.5983647283297124e-05,7.794850631036548e-06,4.893583867579283e-06
EU27+UK,Activity,"Cultivation of vegetables, fruit, nuts",2.2176007636153505e-05,4.345025556366296e-05,4.3132708744557346e-05,2.1885974996707022e-05,1.5174549562153948e-05
EU27+UK,Activity,Cultivation of wheat,5.6429670025973775e-05,9.593694669108071e-05,9.137554101593145e-05,4.873722371132124e-05,3.798785756334253e-05
EU27+UK,Activity,Distribution and trade of electricity,0.00024166367073952448,0.0003127276347878022,0.0003279054948962537,0.00024633277889994686,0.00020771346593496977
EU27+UK,Activity,Education (80),1.7672477440143975e-05,2.9872406223410495e-05,2.7711611561090492e-05,3.4715646397690164e-05,1.8924891416852016e-05
EU27+UK,Activity,Extra-territorial organizations and bodies,4.190160177616367e-11,4.519613028618726e-12,4.467380563221544e-12,3.0892574184921022e-12,1.844476579914851e-11
EU27+UK,Activity,"Extraction of crude petroleum and services related to crude oil extraction, excluding surveying",0.0006803226741937191,0.0005308603840500595,0.0005554695188592756,0.0015120018666247676,0.0011554915327113406
EU27+UK,Activity,"Extraction of natural gas and services related to natural gas extraction, excluding surveying",0.0031505373187310014,0.002733607849041293,0.002640235354852751,0.003785022745227913,0.00322975410067364
EU27+UK,Activity,"Extraction, liquefaction, and regasification of other petroleum and gaseous materials",0.00010312511737201326,2.1945486187203226e-05,2.9164589120579045e-05,2.1870630434221746e-05,5.107348994383815e-05
EU27+UK,Activity,"Financial intermediation, except insurance and pension funding (65)",0.0003284860649334732,0.0004500064816927012,0.00045771763879416563,0.0006108163565352333,0.00036874950860342606
EU27+UK,Activity,"Fishing, operating of fish hatcheries and fish farms; service activities incidental to fishing (05)",2.543578905615919e-05,2.070697692691304e-05,3.002917260517093e-05,1.4254690207367298e-05,1.5187334638286083e-05
EU27+UK,Activity,"Forestry, logging and related service activities (02)",0.0001365478382162656,0.00010347059600612259,0.00012912539944464883,6.206291085094671e-05,7.435591209458007e-05
EU27+UK,Activity,Health and social work (85),7.521182155378288e-06,1.4457172015707495e-05,1.2906923082343605e-05,1.1719875898666549e-05,7.418380222283553e-06
EU27+UK,Activity,Hotels and restaurants (55),7.213012009418528e-05,9.931941723956133e-05,0.00010197580840160668,6.916737210377852e-05,6.030709211729555e-05
EU27+UK,Activity,Incineration of waste: Food,1.3421818016141199e-05,1.4430016024395616e-05,1.498134965282922e-05,1.0268871038798768e-05,7.97464023051166e-06
EU27+UK,Activity,Incineration of waste: Metals and Inert materials,0.00026571284602276566,0.00034034997782383795,0.00037185291860131604,0.0002671149248948438,0.00017465483479829004
EU27+UK,Activity,Incineration of waste: Oil/Hazardous waste,5.463743516553168e-05,4.825143293672176e-05,5.0900619926474735e-05,3.3700725292457684e-05,3.145435765522924e-05
EU27+UK,Activity,Incineration of waste: Paper,1.2506647030136831e-05,1.374163172395987e-05,1.4251870554469364e-05,9.962113927733967e-06,7.67719800217434e-06
EU27+UK,Activity,Incineration of waste: Plastic,0.00010785003648314709,0.0001246503506069783,0.00013056255666700768,0.00010499388404055407,7.192973420927088e-05
EU27+UK,Activity,Incineration of waste: Textiles,8.794852231611865e-05,9.931894991740426e-05,0.00010247596070858195,7.10780801652096e-05,5.226268876553188e-05
EU27+UK,Activity,Incineration of waste: Wood,5.487808822280282e-06,4.7687278831709205e-06,4.967937350152892e-06,3.4050361635146094e-06,3.1123436906357047e-06
EU27+UK,Activity,Inland water transport,0.0005278864343316225,0.0007697738934281783,0.0009195557111342686,0.000565140718971599,0.00045005403729467047
EU27+UK,Activity,"Insurance and pension funding, except compulsory social security (66)",6.012139218243912e-05,8.01287191923699e-05,9.078078322729817e-05,0.00011667138243560355,0.00010154004344123701
EU27+UK,Activity,Landfill of waste: Food,7.022534015271113e-06,7.91930541751133e-06,8.797834965398917e-06,5.957777109302285e-06,4.573793211600149e-06
EU27+UK,Activity,Landfill of waste: Inert/metal/hazardous,7.637044269475879e-06,1.0994206915220523e-05,1.1634704399645291e-05,7.406373743253398e-06,5.110224413603182e-06
EU27+UK,Activity,Landfill of waste: Paper,4.3713546608908055e-06,5.145380615330583e-06,5.705646495131617e-06,3.8837513389847786e-06,2.859503261423906e-06
EU27+UK,Activity,Landfill of waste: Plastic,1.2898772879216085e-06,1.7597384744840097e-06,1.854817795759394e-06,1.1739672329854695e-06,8.534797085352591e-07
EU27+UK,Activity,Landfill of waste: Textiles,1.123363745008409e-06,1.38619620088302e-06,1.5054304137559398e-06,1.0125277860906252e-06,7.437756651236363e-07
EU27+UK,Activity,Landfill of waste: Wood,1.4722566664384922e-06,2.080091143272082e-06,2.1950135454822875e-06,1.450770274207733e-06,1.0008832513968463e-06
EU27+UK,Activity,"Lead, zinc and tin production",3.340887743818565e-05,9.679578440659206e-05,9.745873530177886e-05,3.762714965821906e-05,2.108002687412267e-05
EU27+UK,Activity,Manufacture of basic iron and steel and of ferro-alloys and first products thereof,0.0024550495879857065,0.00840759984167027,0.007909867047971584,0.0030724873957236067,0.001591401618661918
EU27+UK,Activity,Manufacture of beverages,3.8009539793855076e-05,9.546308360731289e-05,9.490374495964105e-05,4.31821299294545e-05,2.5539273727247863e-05
EU27+UK,Activity,"Manufacture of bricks, tiles and construction products, in baked clay",0.0008075480537788983,0.0002685417317593117,0.0005703189017602194,0.00036286361857114027,0.0005230869470200409
EU27+UK,Activity,"Manufacture of cement, lime and plaster",0.0047562946526408315,0.0012934288595979563,0.002958688699481968,0.001577525093626555,0.0027393776514123332
EU27+UK,Activity,Manufacture of ceramic goods,0.0005573911392891534,0.0003171372663182243,0.00046192182356969623,0.00024309906266986266,0.0003323680225995876
EU27+UK,Activity,Manufacture of coke oven products,0.0012898580948640095,0.002303687353296074,0.002189909633897986,0.0009182149164618983,0.0007408511291974616
EU27+UK,Activity,Manufacture of electrical machinery and apparatus n.e.c. (31),0.001965607289517952,0.002351121530544423,0.0014055971083090052,0.0007132106839733752,0.0009760801413654798
EU27+UK,Activity,"Manufacture of fabricated metal products, except machinery and equipment (28)",0.00046356538677473034,0.004519418167063496,0.004361267758252192,0.0013627370586765885,0.00027000670394592595
EU27+UK,Activity,Manufacture of fish products,3.5920244375342805e-05,8.533093986804122e-05,8.805530984114114e-05,3.8845055847962165e-05,2.3633698029117633e-05
EU27+UK,Activity,Manufacture of furniture; manufacturing n.e.c. (36),0.00022565692519106316,0.000636192992681238,0.0006409999751163054,0.0003129256787814338,0.00013959194127208575
EU27+UK,Activity,Manufacture of gas; distribution of gaseous fuels through mains,0.01030089348520652,0.004197314297692662,0.004397540678585309,0.0353084667032591,0.028552785500967157
EU27+UK,Activity,Manufacture of glass and glass products,0.001501571468598951,0.03682274185979103,0.024841819553458776,0.008074498159932414,0.0007426756203364433
EU27+UK,Activity,Manufacture of machinery and equipment n.e.c. (29),0.0002821014782718264,0.0005271450275826965,0.00044574099955391964,0.00019697186550555288,0.00015389242968208848
EU27+UK,Activity,"Manufacture of medical, precision and optical instruments, watches and clocks (33)",0.0001676567714408161,0.00029865980757211335,0.00025601788103879486,0.00013776437109525982,0.00011142011679256012
EU27+UK,Activity,"Manufacture of motor vehicles, trailers and semi-trailers (34)",9.679862916315828e-05,0.00021505999084368973,0.0001957238022920008,8.59021108268521e-05,6.352534224799421e-05
EU27+UK,Activity,Manufacture of office machinery and computers (30),2.7593944334891027e-05,4.9235974744102916e-05,4.1576815574864794e-05,2.295036449070002e-05,1.8423148794504603e-05
EU27+UK,Activity,Manufacture of other non-metallic mineral products n.e.c.,0.0035206135434337478,0.013731789956836415,0.04203557229652598,0.009296469498044583,0.001731747238294687
EU27+UK,Activity,Manufacture of other transport equipment (35),0.00017615434706724997,0.00038147501960363424,0.00032263777847014465,0.00013599224065386723,0.00010007478436852317
EU27+UK,Activity,"Manufacture of radio, television and communication equipment and apparatus (32)",0.0002945055897463011,0.00045768752148839026,0.0003645296183193315,0.00022735468353429596,0.00017795074514497116
EU27+UK,Activity,Manufacture of rubber and plastic products (25),0.00010804621767623251,0.00017221114940500917,0.0001696075818909486,7.706454325864093e-05,6.502415580470192e-05
EU27+UK,Activity,Manufacture of textiles (17),2.45129674302482e-05,5.3035413918729346e-05,4.834159432077187e-05,2.064195876774516e-05,1.4474008002971796e-05
EU27+UK,Activity,Manufacture of tobacco products (16),2.0719342964361035e-05,2.864835593624789e-05,2.6896572130578304e-05,1.3935168376758399e-05,1.2717130561600922e-05
EU27+UK,Activity,Manufacture of wearing apparel; dressing and dyeing of fur (18),1.5479499033232684e-05,2.8207871686187227e-05,2.872131085694493e-05,1.4879793727090382e-05,1.073523832846841e-05
EU27+UK,Activity,"Manufacture of wood and of products of wood and cork, except furniture; manufacture of articles of straw and plaiting materials (20)",0.0002503227185071741,0.00019555180033860352,0.00025481529137189827,0.00011349334930537785,0.0001362969415706832
EU27+UK,Activity,"Manure treatment (biogas), storage and land application",0.0,0.0,0.0,0.0,0.0
EU27+UK,Activity,"Manure treatment (conventional), storage and land application",0.0,0.0,0.0,0.0,0.0
EU27+UK,Activity,Meat animals nec,6.959997797612722e-06,1.1919035042269016e-05,1.2290666218295154e-05,8.000982249090488e-06,6.105423791940866e-06
EU27+UK,Activity,Mining of aluminium ores and concentrates,0.0001878100413957618,0.0004798855672045655,0.0003838986162981855,0.00012699777158241044,8.56239528470655e-05
EU27+UK,Activity,"Mining of chemical and fertilizer minerals, production of salt, other mining and quarrying n.e.c.",4.445459256450936e-05,0.00023794391829945447,0.00023927687484805093,7.917093864004079e-05,2.6676269247956582e-05
EU27+UK,Activity,Mining of coal and lignite; extraction of peat (10),0.003920371238111914,0.001084084665516828,0.0011460607852627164,0.0008797499381353781,0.0019276046951099805
EU27+UK,Activity,Mining of copper ores and concentrates,0.0005438918877008915,0.0007752220236560357,0.0008502424367382377,0.00031494712766673373,0.00028693494343560175
EU27+UK,Activity,Mining of iron ores,0.00020624996718424706,0.0005403904073429712,0.0005145502931665891,0.00020276605904583425,0.00012474372900193
EU27+UK,Activity,"Mining of lead, zinc and tin ores and concentrates",2.5705498372887384e-05,5.030332602460493e-05,5.284393823170745e-05,1.9937472266442176e-05,1.4543884250111881e-05
EU27+UK,Activity,Mining of nickel ores and concentrates,1.965357704731959e-05,3.832730620102608e-05,4.3509312824975416e-05,2.3294027245661457e-05,1.589205630738657e-05
EU27+UK,Activity,Mining of other non-ferrous metal ores and concentrates,0.00010365376034911369,0.00012824834387142151,0.0001268913431840527,0.00012777236682579653,0.00010846148866127918
EU27+UK,Activity,Mining of precious metal ores and concentrates,0.00021399911459254838,0.00011006503871360582,0.00011838863226743664,5.1033620365646146e-05,0.00010082555866277369
EU27+UK,Activity,Mining of uranium and thorium ores (12),0.00016967232006120274,0.00021039516975906872,0.00022979449960941478,0.00010488619082594692,9.605238608614093e-05
EU27+UK,Activity,N-fertiliser,1.880199488782356e-05,2.294291771158544e-05,2.3908887727108252e-05,3.644429099938614e-05,1.1304641837997856e-05
EU27+UK,Activity,Other business activities (74),0.0011375186548764648,0.0025604800960411533,0.0022601403349487023,0.001385910377686868,0.0008537431873921254
EU27+UK,Activity,Other land transport,0.00025013549572292627,0.0003283558679305337,0.000599431441838328,0.0003854342897898482,0.0002693495003302349
EU27+UK,Activity,Other non-ferrous metal production,0.0001454017443532298,0.00019897119075237984,0.00018627092110094437,0.0001065512958200566,9.782866413534753e-05
EU27+UK,Activity,Other service activities (93),2.570294003923797e-05,3.502811321946624e-05,3.3668928300663014e-05,2.935714023466055e-05,2.5794026241085514e-05
EU27+UK,Activity,P- and other fertiliser,5.0009079601083674e-05,6.719676343567782e-05,6.695981985056937e-05,5.324960255661209e-05,3.100585994836108e-05
EU27+UK,Activity,Paper,0.00024338580720702734,0.0004760928416978402,0.00043244443409378786,0.0002620315266620052,0.00016695924337345995
EU27+UK,Activity,Petroleum Refinery,0.0026408945813227664,0.0027709487728015316,0.0033054897320183504,0.00418537725677952,0.0020746788229344558
EU27+UK,Activity,Pigs farming,1.59134664795437e-05,3.2755404381145926e-05,3.105405961521304e-05,1.6741736968029874e-05,1.1797616013508225e-05
EU27+UK,Activity,"Plastics, basic",0.0010100314208182908,0.0023051244010823145,0.0021340990919008276,0.0010034963735750275,0.0006210556176755816
EU27+UK,Activity,Post and telecommunications (64),0.00031700902189727874,0.00039433051973921453,0.0004016064182623259,0.0005355882138960258,0.00032383956748543145
EU27+UK,Activity,Poultry farming,9.597661175818772e-06,1.7388380491802335e-05,1.782385549962041e-05,9.828390134187778e-06,7.182434737561489e-06
EU27+UK,Activity,Precious metals production,0.00015153441847580294,0.00010539635496973506,9.450095871112329e-05,4.4214139216165275e-05,7.472224277406913e-05
EU27+UK,Activity,Private households with employed persons (95),3.969547829334388e-06,9.202575836158717e-06,7.781573014161123e-06,4.7130291890608436e-06,3.077142671484232e-06
EU27+UK,Activity,Processed rice,2.1742667005133574e-06,3.997540464326705e-06,4.029809195860691e-06,2.1838597952113096e-06,1.6155616440823445e-06
EU27+UK,Activity,Processing of Food products nec,7.155873847764249e-05,0.00017435679172212882,0.00017986846678604983,7.624450452571043e-05,4.650402940187927e-05
EU27+UK,Activity,Processing of dairy products,2.0201310686781246e-05,4.041011180612875e-05,3.8021266208262445e-05,2.1022915641274048e-05,1.4974182328825924e-05
EU27+UK,Activity,Processing of meat cattle,5.934210161291769e-06,1.1945768966584803e-05,1.199460068429276e-05,6.689336778029074e-06,4.660380408626107e-06
EU27+UK,Activity,Processing of meat pigs,1.2017634935375646e-05,2.717993112553215e-05,2.4388032158071285e-05,1.3618902865296683e-05,9.34262969792267e-06
EU27+UK,Activity,Processing of meat poultry,1.8718430786118208e-06,3.9402360323673694e-06,3.7111415188991276e-06,2.054479326543481e-06,1.4374536081351677e-06
EU27+UK,Activity,Processing of nuclear fuel,1.1991026401374924e-05,1.1522601305740621e-05,1.2863345997337921e-05,5.614507281009972e-06,6.477604503562547e-06
EU27+UK,Activity,Processing vegetable oils and fats,3.0345657137765015e-06,5.98777320518835e-06,6.0333756660702285e-06,3.0649650801714202e-06,2.0647574458165718e-06
EU27+UK,Activity,Production of electricity by Geothermal,0.0001371065417337857,1.0407244667895158e-05,1.077254714909748e-05,4.474263108398962e-06,5.7125644522313686e-05
EU27+UK,Activity,Production of electricity by biomass and waste,0.0,0.0,0.0,0.0,0.0
EU27+UK,Activity,Production of electricity by coal,0.2097143524531819,0.03246657049193141,0.033457695157136015,0.02228501239449181,0.09490495167655917
EU27+UK,Activity,Production of electricity by gas,0.03482638724607006,0.007058553964361432,0.007184784734424075,0.005976255381981443,0.01702884772613979
EU27+UK,Activity,Production of electricity by hydro,0.0,0.0,0.0,0.0,0.0
EU27+UK,Activity,Production of electricity by nuclear,0.0001757151499565568,1.987447451517581e-05,1.9985804282829365e-05,1.3586645215789549e-05,7.755776929882933e-05
EU27+UK,Activity,Production of electricity by petroleum and other oil derivatives,0.004741725163341936,0.001261084574074134,0.0012428419140035635,0.001261885084931247,0.002581229713197369
EU27+UK,Activity,Production of electricity by solar photovoltaic,0.0,0.0,0.0,0.0,0.0
EU27+UK,Activity,Production of electricity by solar thermal,0.0,0.0,0.0,0.0,0.0
EU27+UK,Activity,"Production of electricity by tide, wave, ocean",0.0,0.0,0.0,0.0,0.0
EU27+UK,Activity,Production of electricity by wind,0.0,0.0,0.0,0.0,0.0
EU27+UK,Activity,Production of electricity nec,0.0008013361369520729,0.0004582798434613149,0.0004737303419461302,0.00032875831440136715,0.00046573764435634305
EU27+UK,Activity,Production of meat products nec,1.2948319696917346e-06,2.3377916109938523e-06,2.3604508762189023e-06,1.2862631119546525e-06,9.212001979188869e-07
EU27+UK,Activity,Production of offshore wind plants,0.0,0.0,0.0,0.0,0.0
EU27+UK,Activity,Production of onshore wind plants,0.0,0.0,0.0,0.0,0.0
EU27+UK,Activity,Production of photovoltaic plants,0.0,0.0,0.0,0.0,0.0
EU27+UK,Activity,Public administration and defence; compulsory social security (75),7.693194786225785e-05,0.00010329932774658907,0.0001020787773996771,0.00013611193653397443,0.00016436983711367112
EU27+UK,Activity,"Publishing, printing and reproduction of recorded media (22)",0.00025906115542077623,0.0004869116440873465,0.00045918842095637216,0.00041487890365384493,0.000263557348586498
EU27+UK,Activity,Pulp,0.00014688124050647736,0.000220337386326864,0.00020183618010699136,0.00011996429932853772,9.275831307875638e-05
EU27+UK,Activity,Quarrying of sand and clay,0.00023140621239047183,0.00048002675747455426,0.0004724089779264483,0.00018220103645647857,0.00013694875191573675
EU27+UK,Activity,Quarrying of stone,0.00027317000793222924,0.0005148781515126027,0.0007156698655240421,0.00023006472389014695,0.0001575962577240942
EU27+UK,Activity,Raw milk,1.27693115924058e-05,2.481538863922725e-05,2.440713713788466e-05,1.2823665931887002e-05,9.158818021477336e-06
EU27+UK,Activity,Re-processing of ash into clinker,0.001400707703722724,0.0004153144311541798,0.0008977350404896811,0.0004739394955485472,0.0008071554707595524
EU27+UK,Activity,Re-processing of secondary aluminium into new aluminium,0.0017704798975455187,0.0006317297247503298,0.0005758862655734857,0.00021936067403950215,0.0007631888665447424
EU27+UK,Activity,Re-processing of secondary construction material into aggregates,0.0010724245355850964,0.0001531375506300193,0.0005595836956785444,0.00021482415148623278,0.0005302246680710676
EU27+UK,Activity,Re-processing of secondary copper into new copper,0.00016235307467530222,0.0003781942456162454,0.0003267834041787402,0.00013765750681546027,9.669906863350813e-05
EU27+UK,Activity,Re-processing of secondary glass into new glass,0.0006699962065647484,0.016397696085052184,0.011062964348720035,0.0035959863650619458,0.00033136339931618406
EU27+UK,Activity,"Re-processing of secondary lead into new lead, zinc and tin",6.610792763027787e-05,0.00018490857703809362,0.00018852664904821868,7.370642664610937e-05,4.231892443827445e-05
EU27+UK,Activity,Re-processing of secondary other non-ferrous metals into new other non-ferrous metals,2.8709227806432056e-05,4.013634716435588e-05,3.786095884809386e-05,2.1780076757666583e-05,1.921701655704966e-05
EU27+UK,Activity,Re-processing of secondary paper into new pulp,7.148276824164064e-05,0.00012240490110120803,0.00011214089602331554,6.615926414101032e-05,4.6866017507177e-05
EU27+UK,Activity,Re-processing of secondary plastic into new plastic,0.0002143056408263323,0.0004796644614820993,0.0004472363998145549,0.00021684152193763258,0.00013551675410331562
EU27+UK,Activity,Re-processing of secondary preciuos metals into new preciuos metals,5.1006334782131914e-05,6.235719734693289e-05,5.955394846579165e-05,3.190540026473629e-05,2.5962789962229114e-05
EU27+UK,Activity,Re-processing of secondary steel into new steel,0.0017995753530877176,0.00627896676230782,0.00591551832932732,0.002298188827651916,0.0011727940633330348
EU27+UK,Activity,Re-processing of secondary wood material into new wood material,0.00015209020757405537,0.00012369927396339793,0.000158952675273269,7.001401957635277e-05,8.255151795154948e-05
EU27+UK,Activity,Real estate activities (70),0.00013403979587038513,0.00017886540218853332,0.0001844356476804673,0.000147275259661946,0.00012997082875240433
EU27+UK,Activity,"Recreational, cultural and sporting activities (92)",3.2154115684857965e-05,5.601826412142102e-05,5.270434086589907e-05,4.0673897170323786e-05,2.648904007147905e-05
EU27+UK,Activity,Recycling of bottles by direct reuse,0.0018351346537380006,0.0023063599438135855,0.002234316600004513,0.0023126319399680976,0.0019185042190931765
EU27+UK,Activity,Recycling of waste and scrap,0.001958548703169759,0.003587453196688723,0.0030938739467120933,0.0012150512204596087,0.0010157189740736114
EU27+UK,Activity,Renting of machinery and equipment without operator and of personal and household goods (71),0.00019503051784066904,0.0002483693600702931,0.00028442974310616904,0.00023675482398977316,0.00020919467001171948
EU27+UK,Activity,Research and development (73),5.7253625199823683e-05,0.00013063593851402448,0.00011106408243286356,6.785862324890832e-05,3.968538978618558e-05
EU27+UK,Activity,Retail sale of automotive fuel,0.00018224806726135185,0.00021860265528903357,0.00023963289051309419,0.0001751338858099966,0.0002070292197858993
EU27+UK,Activity,"Retail trade, except of motor vehicles and motorcycles; repair of personal and household goods (52)",0.0002736601673913157,0.00043969111021903857,0.00042456445952694064,0.00025186892481613083,0.0003114425964235685
EU27+UK,Activity,"Sale, maintenance, repair of motor vehicles, motor vehicles parts, motorcycles, motor cycles parts and accessoiries",0.0001715146687973766,0.00024452791462998847,0.0002664508697878667,0.00023233862195883682,0.0003153995643472197
EU27+UK,Activity,Sea and coastal water transport,0.014758105888362067,0.02624159162526697,0.09976774786656419,0.02361217044162662,0.008480733317178957
EU27+UK,Activity,Steam and hot water supply,0.015533123586354893,0.01750696319628734,0.017191344840979887,0.014533684819791755,0.011873258814472746
EU27+UK,Activity,Sugar refining,2.4285940235331886e-06,4.842111510772696e-06,4.8440792770707146e-06,2.5892842940544743e-06,1.8315393312673308e-06
EU27+UK,Activity,Supporting and auxiliary transport activities; activities of travel agencies (63),0.0006961537251027064,0.0011014716481128658,0.0015031239447881107,0.0008063662760434513,0.000578057081839479
