EU27+UK,Activity,Activities of membership organisation n.e.c. (91),7.249224256725124e-06,1.0970270023044606e-05,1.1007074864570236e-05,2.7738516190880056e-05,1.7521863903168194e-05
EU27+UK,Activity,Air transport (62),0.0022829454109187823,0.0035298771940497965,0.003506508399012297,0.002755229586378255,0.0021462518983536697
EU27+UK,Activity,Aluminium production,0.0015744327712625898,0.0005595449010041565,0.0005084642299371475,0.00019227148207981952,0.0006767261324294762
EU27+UK,Activity,Animal products nec,1.5749078326465567e-05,2.6716394052002982e-05,2.863998102889463e-05,1.884027624809947e-05,1.6605624070923405e-05
EU27+UK,Activity,"Biogasification of food waste, incl. land application",9.583197534590317e-07,1.566780720447291e-06,1.6594159684895334e-06,1.229088953058959e-06,7.377637017754186e-07
EU27+UK,Activity,"Biogasification of paper, incl. land application",3.3492424590377566e-07,5.051145062598125e-07,5.232816270884457e-07,3.62522470830602e-07,2.368840623630401e-07
EU27+UK,Activity,"Biogasification of sewage slugde, incl. land application",4.7873685663196e-06,7.126467739941318e-06,7.414881291478772e-06,4.469485038350279e-06,3.3245604865585267e-06
EU27+UK,Activity,Casting of metals,0.0013062842665017465,0.0028929530864493644,0.0026187503785397525,0.0011689717949073233,0.0009001468542005275
EU27+UK,Activity,Cattle farming,1.57066720768903e-05,2.5082088957257076e-05,2.5401382477048662e-05,1.8849990504509053e-05,1.4034450891639282e-05
EU27+UK,Activity,Chemicals nec,0.0010560780353698841,0.010701763449442072,0.007743436512572607,0.002802092759907215,0.0006181441804515922
EU27+UK,Activity,"Collection, purification and distribution of water (41)",0.0001443296148774014,0.00012561865850811607,0.00012828883301137725,0.0001933628651015801,0.00012838770889384292
EU27+UK,Activity,"Composting of food waste, incl. land application",1.369182074833304e-05,1.563114673696007e-05,1.6536746077346505e-05,1.4262834749849465e-05,9.600531107157866e-06
EU27+UK,Activity,"Composting of paper and wood, incl. land application",4.0122375131999276e-08,4.817044993255802e-08,5.071131786275945e-08,3.366065933437006e-08,2.8561443037108585e-08
EU27+UK,Activity,Computer and related activities (72),0.00013382345502236658,0.00021124366860877597,0.00020472704627415926,0.00017451269496765592,0.00012568702005994744
EU27+UK,Activity,Construction (45),0.004083781385917787,0.0005613980448273102,0.002108116160483918,0.0007932804117207972,0.002030522414535697
EU27+UK,Activity,Copper production,0.0003057912109964099,0.0007399770243128468,0.0006375167954287692,0.00026527816176960143,0.0001838734936220129
EU27+UK,Activity,Cultivation of cereal grains nec,5.2999738010118944e-05,0.00010406739443289493,0.0001017145248859825,5.4769488239026584e-05,4.3983462017737574e-05
EU27+UK,Activity,Cultivation of crops nec,1.282165625582773e-05,1.251832585994234e-05,1.4370429489514021e-05,7.886671884642661e-06,8.358537627084408e-06
EU27+UK,Activity,Cultivation of oil seeds,1.6745391574424347e-05,3.447978221990655e-05,3.514470853479638e-05,1.7844368755292324e-05,1.3188153710177216e-05
EU27+UK,Activity,Cultivation of paddy rice,1.2457956077514133e-05,2.854696884808377e-05,2.853600921456042e-05,1.352265594156327e-05,9.016581770650158e-06
EU27+UK,Activity,Cultivation of plant-based fibers,4.395934590201217e-06,5.890602371823739e-06,5.3735047857253806e-06,2.658028342690117e-06,2.605971034072309e-06
EU27+UK,Activity,"Cultivation of sugar cane, sugar beet",7.443718469092411e-06,2.0363449231884054e-05,1.8576197162038597e-05,8.7436249767169e-06,5.665502933184648e-06
EU27+UK,Activity,"Cultivation of vegetables, fruit, nuts",2.435695427211085e-05,4.7935735076612536e-05,4.737226259255102e-05,2.4396075309113798e-05,1.780907690488614e-05
EU27+UK,Activity,Cultivation of wheat,5.286055376054812e-05,9.6385834407051e-05,9.200745397611634e-05,4.946093752213047e-05,4.05504262681369e-05
EU27+UK,Activity,Distribution and trade of electricity,0.00023413928957396205,0.0002984541478214936,0.000314116005764163,0.00023388343896056836,0.00019217159590225784
EU27+UK,Activity,Education (80),2.0088154685787875e-05,3.54368903722979e-05,3.2693251212547665e-05,3.9921461439587576e-05,2.2839569079640327e-05
EU27+UK,Activity,Extra-territorial organizations and bodies,1.0213640310804338e-10,1.1148602292090324e-11,1.0943494913173022e-11,7.662513436328536e-12,4.4492809366848255e-11
EU27+UK,Activity,"Extraction of crude petroleum and services related to crude oil extraction, excluding surveying",0.0006733253513258081,0.0005472082016136986,0.0005783670076847448,0.0015879669268064822,0.0010311705813619665
EU27+UK,Activity,"Extraction of natural gas and services related to natural gas extraction, excluding surveying",0.0037708566334538497,0.0033580147682015457,0.003330245959356253,0.004471254728395753,0.0034799690605812864
EU27+UK,Activity,"Extraction, liquefaction, and regasification of other petroleum and gaseous materials",7.713996480604236e-05,2.509060864157176e-05,2.9344916707740274e-05,3.3425450020976185e-05,4.512431100097456e-05
EU27+UK,Activity,"Financial intermediation, except insurance and pension funding (65)",0.0003510362392423439,0.0004671424053087161,0.00048158234620527705,0.0006321892886419898,0.0004068177289001565
EU27+UK,Activity,"Fishing, operating of fish hatcheries and fish farms; service activities incidental to fishing (05)",2.574975762818121e-05,2.2706015457455586e-05,3.2495702302721695e-05,1.5318324145632957e-05,1.596081689883331e-05
EU27+UK,Activity,"Forestry, logging and related service activities (02)",0.0001506970185309938,0.00011891437554021223,0.00014675485268504133,7.080481264839406e-05,8.425786662211914e-05
EU27+UK,Activity,Health and social work (85),9.106446915186037e-06,1.7448957469775007e-05,1.5716511589299057e-05,1.4372079083678907e-05,9.428220662947135e-06
EU27+UK,Activity,Hotels and restaurants (55),8.728557264530767e-05,0.00011913519452911687,0.0001235440731715353,8.155006622463841e-05,7.428626484259099e-05
EU27+UK,Activity,Incineration of waste: Food,1.4070016778959023e-05,1.5188496794220708e-05,1.5791468970223778e-05,1.0983433138463604e-05,8.58198874195368e-06
EU27+UK,Activity,Incineration of waste: Metals and Inert materials,0.0002638964727659588,0.000330291238095794,0.0003708808767493517,0.0002622094560968206,0.00018107785111405405
EU27+UK,Activity,Incineration of waste: Oil/Hazardous waste,6.18036366824023e-05,5.6555023449566165e-05,5.941007064342885e-05,4.0136581132670966e-05,3.69301882814729e-05
EU27+UK,Activity,Incineration of waste: Paper,1.2543220565963663e-05,1.3582525058321484e-05,1.4221510463628635e-05,1.0304360331415228e-05,7.962871374473065e-06
EU27+UK,Activity,Incineration of waste: Plastic,0.00012620374245308021,0.00012952003909187957,0.00013451689712759053,0.00010151776388620486,7.837074945581025e-05
EU27+UK,Activity,Incineration of waste: Textiles,9.919286400039327e-05,0.00010972915043706197,0.0001142270597101395,7.720872147632413e-05,6.121575160379396e-05
EU27+UK,Activity,Incineration of waste: Wood,5.772400604258742e-06,5.044149216789369e-06,5.272740799288572e-06,3.6285614113791105e-06,3.392799424862343e-06
EU27+UK,Activity,Inland water transport,0.0006489513204862657,0.0009222638858574217,0.0011179955472682887,0.0006703887658448916,0.0005836698586572053
EU27+UK,Activity,"Insurance and pension funding, except compulsory social security (66)",6.240172907941212e-05,8.465899349390059e-05,9.494080676307796e-05,0.00012659208733441956,0.00011806551021132827
EU27+UK,Activity,Landfill of waste: Food,7.726906552574036e-06,9.143609793926497e-06,1.006304214558071e-05,6.591383101755894e-06,5.093979674833684e-06
EU27+UK,Activity,Landfill of waste: Inert/metal/hazardous,9.292535733607731e-06,1.2554664919180962e-05,1.3289120426664124e-05,8.519287195884534e-06,6.250940505248948e-06
EU27+UK,Activity,Landfill of waste: Paper,5.737141442834691e-06,6.835572447903087e-06,7.518876584334437e-06,5.049787552519403e-06,3.91077267975242e-06
EU27+UK,Activity,Landfill of waste: Plastic,1.9218480172181732e-06,2.4981182741209528e-06,2.662907417401291e-06,1.6867731555067413e-06,1.3081362091633795e-06
EU27+UK,Activity,Landfill of waste: Textiles,1.7787558044437216e-06,2.1690863370364783e-06,2.3625378821741384e-06,1.5784958799476158e-06,1.2225453636165854e-06
EU27+UK,Activity,Landfill of waste: Wood,2.32952691506164e-06,2.9768033452504606e-06,3.2194451860424205e-06,2.111299734743582e-06,1.5880833165255064e-06
EU27+UK,Activity,"Lead, zinc and tin production",4.001788563595567e-05,0.00010460302178222038,0.00010764336010206697,4.2097608702961205e-05,2.5471758204922936e-05
EU27+UK,Activity,Manufacture of basic iron and steel and of ferro-alloys and first products thereof,0.0025482947418090885,0.008399909174797441,0.007879183319846269,0.003079708379963561,0.0016622820305069428
EU27+UK,Activity,Manufacture of beverages,3.7742498077788885e-05,9.625707781402997e-05,9.323470970123515e-05,4.337879395580356e-05,2.708068175794985e-05
EU27+UK,Activity,"Manufacture of bricks, tiles and construction products, in baked clay",0.0009283046560446542,0.00028831118999374635,0.0006337415337858409,0.0003985909330458216,0.0005882689310312732
EU27+UK,Activity,"Manufacture of cement, lime and plaster",0.004755699849278997,0.0012335011376058333,0.0029149093058422225,0.0015508002602485711,0.0027784397967528193
EU27+UK,Activity,Manufacture of ceramic goods,0.0004380331699227323,0.00024295075636257475,0.0003560535241014636,0.00018770291098649722,0.00026613385471045974
EU27+UK,Activity,Manufacture of coke oven products,0.0013834439152965589,0.0025755549398317258,0.0024441390375502447,0.001027512960769128,0.000795848332747705
EU27+UK,Activity,Manufacture of electrical machinery and apparatus n.e.c. (31),0.00207202938123303,0.002479206106216009,0.0014824820062909493,0.0007546926519359173,0.0010428803215866464
EU27+UK,Activity,"Manufacture of fabricated metal products, except machinery and equipment (28)",0.0005087728637486563,0.0049695820493994534,0.004800799645714471,0.001496363842437832,0.0003038016992139744
EU27+UK,Activity,Manufacture of fish products,3.6313064173395326e-05,7.948908485393483e-05,8.150934407710318e-05,3.7907731705522495e-05,2.4983304968113366e-05
EU27+UK,Activity,Manufacture of furniture; manufacturing n.e.c. (36),0.0002268213523281157,0.0006489931184366829,0.0006530841326375382,0.0003072875972328587,0.00014396932091141542
EU27+UK,Activity,Manufacture of gas; distribution of gaseous fuels through mains,0.010440756081058114,0.004797287083965424,0.005071191103160308,0.039044115667138134,0.025108380578372672
EU27+UK,Activity,Manufacture of glass and glass products,0.0021740698045054495,0.05439953837121235,0.03667729581704101,0.011884087707336176,0.0010902644238796372
EU27+UK,Activity,Manufacture of machinery and equipment n.e.c. (29),0.0003159136609404874,0.0006004387972490613,0.0005111314931567999,0.00022914566776448042,0.0001792288327530452
EU27+UK,Activity,"Manufacture of medical, precision and optical instruments, watches and clocks (33)",0.00017614557639809714,0.00032248788043024655,0.00027000377389942767,0.00014974992119392498,0.00011775965720571676
EU27+UK,Activity,"Manufacture of motor vehicles, trailers and semi-trailers (34)",0.00010625036552369891,0.0002527100180343117,0.0002338443103652456,0.00010128055104147182,7.52793056347506e-05
EU27+UK,Activity,Manufacture of office machinery and computers (30),3.420773225408436e-05,6.029577690837583e-05,5.0747160056098536e-05,2.7647357338123797e-05,2.2857030010577107e-05
EU27+UK,Activity,Manufacture of other non-metallic mineral products n.e.c.,0.004507213899756921,0.01716998352694718,0.05227865366031209,0.011544242868093678,0.002222311089437416
EU27+UK,Activity,Manufacture of other transport equipment (35),0.0001935363300439178,0.0004226540482329075,0.0003617636841859201,0.0001522154466385893,0.00011336378764641469
EU27+UK,Activity,"Manufacture of radio, television and communication equipment and apparatus (32)",0.0003372088816296545,0.0005193670176542929,0.00040904166063945304,0.00024761721331859575,0.00020413392516285865
EU27+UK,Activity,Manufacture of rubber and plastic products (25),0.00010637819888175842,0.00017156710197536678,0.00016864779223584796,7.60648597454805e-05,6.48621897385675e-05
EU27+UK,Activity,Manufacture of textiles (17),2.8016540913560373e-05,6.536872296057555e-05,5.927699223036616e-05,2.5213975242879506e-05,1.7411021728343866e-05
EU27+UK,Activity,Manufacture of tobacco products (16),2.2846989841589215e-05,2.9692669146724646e-05,2.7955545492452518e-05,1.4670718649058758e-05,1.442377129699508e-05
EU27+UK,Activity,Manufacture of wearing apparel; dressing and dyeing of fur (18),1.857793795123291e-05,3.734711087648079e-05,3.6711923312744825e-05,1.8475321351068153e-05,1.327031476198382e-05
EU27+UK,Activity,"Manufacture of wood and of products of wood and cork, except furniture; manufacture of articles of straw and plaiting materials (20)",0.0003367158197969384,0.00026614397608675953,0.00034588926487841125,0.00015449633530456328,0.0001879560190317097
EU27+UK,Activity,"Manure treatment (biogas), storage and land application",6.845045021965467e-07,1.5696297583831388e-06,1.5690696811778502e-06,7.423915654472757e-07,4.940089437269436e-07
EU27+UK,Activity,"Manure treatment (conventional), storage and land application",7.01736075801487e-07,1.6091432906203852e-06,1.6085691141483186e-06,7.610803759118392e-07,5.064450218652365e-07
EU27+UK,Activity,Meat animals nec,7.328184612557178e-06,1.2982045333770855e-05,1.3368624397762425e-05,8.54807826582659e-06,6.988287079270811e-06
EU27+UK,Activity,Mining of aluminium ores and concentrates,0.00023192636893774594,0.00020778581366647823,0.00018104667796855003,6.58185813475198e-05,0.00010370616148217706
EU27+UK,Activity,"Mining of chemical and fertilizer minerals, production of salt, other mining and quarrying n.e.c.",4.709253896346697e-05,0.0002556826908704616,0.0002453631894910215,8.234635358027735e-05,2.886235307325693e-05
EU27+UK,Activity,Mining of coal and lignite; extraction of peat (10),0.005145508229431513,0.0014354930351171836,0.0015200589037424536,0.0011032119552948434,0.0024839163355761863
EU27+UK,Activity,Mining of copper ores and concentrates,0.0005769571719349893,0.0009035324846743951,0.0009422402924364561,0.00035200592909920633,0.00031030363949970357
EU27+UK,Activity,Mining of iron ores,0.00025649885960815936,0.0006658217905089284,0.0006306339955942184,0.0003683793750528942,0.0002211751661710912
EU27+UK,Activity,"Mining of lead, zinc and tin ores and concentrates",2.0427662088078196e-05,4.03524405171325e-05,4.189252388583178e-05,1.6200688881376843e-05,1.1976645159165844e-05
EU27+UK,Activity,Mining of nickel ores and concentrates,2.0502838493742952e-05,4.609297222822795e-05,5.108660138369782e-05,2.6204748211421444e-05,1.6298289397972494e-05
EU27+UK,Activity,Mining of other non-ferrous metal ores and concentrates,0.00010993711303003993,0.0001343078139771806,0.00013548462417287377,0.00013603163318410142,0.00010467482136394293
EU27+UK,Activity,Mining of precious metal ores and concentrates,0.00014978565905621587,0.00014264536815745805,0.00016784615321843805,7.120750381364977e-05,8.095280585857412e-05
EU27+UK,Activity,Mining of uranium and thorium ores (12),0.00014370831176898778,0.0001875687494116531,0.00019361714413270877,0.00010659080618277003,9.039013257944851e-05
EU27+UK,Activity,N-fertiliser,2.357828203324101e-05,2.7931621004205715e-05,2.869407257045457e-05,4.288776955612884e-05,1.4939956041288074e-05
EU27+UK,Activity,Other business activities (74),0.0012274579329704651,0.002809498055768148,0.0024740776183154183,0.001504204662973718,0.0009740995167492939
EU27+UK,Activity,Other land transport,0.0003094827582116888,0.0004186197303821611,0.0007694521618004163,0.0004309027419973828,0.0003309524461077542
EU27+UK,Activity,Other non-ferrous metal production,0.00016059515001889707,0.00019499958353150093,0.00018310744817987457,0.00010632378037381199,0.000106614300624824
EU27+UK,Activity,Other service activities (93),2.2418243747918504e-05,2.955847286799121e-05,2.8731361166491628e-05,2.5588637807481563e-05,2.324112164866893e-05
EU27+UK,Activity,P- and other fertiliser,5.7000586869622306e-05,8.014763705635961e-05,7.899960308766658e-05,5.8432485942176085e-05,3.7153946546730666e-05
EU27+UK,Activity,Paper,0.00024891902451593866,0.0004885283045655601,0.00044421262606120216,0.0002678018943825968,0.00017370899477512058
EU27+UK,Activity,Petroleum Refinery,0.002997199512814036,0.00305476003599446,0.0036860760469572826,0.004531536816100301,0.0024434945006773395
EU27+UK,Activity,Pigs farming,1.7258393997814598e-05,3.4463490316866974e-05,3.2835811267862824e-05,1.839186550859697e-05,1.3540456618017271e-05
EU27+UK,Activity,"Plastics, basic",0.001102414848887012,0.002272810239958959,0.0020842118493528804,0.0009977555413314008,0.000681369244537438
EU27+UK,Activity,Post and telecommunications (64),0.00031253428878213595,0.0004079951023233849,0.0004144624550014774,0.000476508189867361,0.0003247786739805433
EU27+UK,Activity,Poultry farming,1.1238193737640251e-05,2.029337624939079e-05,2.0604093193663105e-05,1.180426099759185e-05,9.263173325979116e-06
EU27+UK,Activity,Precious metals production,0.00015246495143321053,0.00012780692446030692,0.0001144537134810843,5.276828637071877e-05,7.736643117838493e-05
EU27+UK,Activity,Private households with employed persons (95),3.5948946550978025e-06,7.437198045901111e-06,6.529045207555924e-06,3.5825815420252627e-06,2.4037854931971075e-06
EU27+UK,Activity,Processed rice,2.3328442316392515e-06,4.6720083834061285e-06,5.0132781723361255e-06,2.587783229484096e-06,2.016995509358132e-06
EU27+UK,Activity,Processing of Food products nec,7.71651111590124e-05,0.00018201678763365574,0.00018744059587917457,8.009168944135213e-05,5.214937269378802e-05
EU27+UK,Activity,Processing of dairy products,2.385653529954655e-05,6.631670528851026e-05,6.397287640666374e-05,2.9083254894468148e-05,1.853642834119784e-05
EU27+UK,Activity,Processing of meat cattle,5.950976824270773e-06,1.1786597193185677e-05,1.1934074868790066e-05,6.671255002433303e-06,5.190458547576295e-06
EU27+UK,Activity,Processing of meat pigs,1.1893869154361885e-05,2.6166483766219276e-05,2.3859642429863762e-05,1.3710616834190484e-05,9.970465961367851e-06
EU27+UK,Activity,Processing of meat poultry,1.9757474274052453e-06,4.0950944648982134e-06,3.860643397452955e-06,2.1554164137884965e-06,1.7186170640073504e-06
EU27+UK,Activity,Processing of nuclear fuel,5.359745385913538e-06,5.747105587262711e-06,4.860940712764619e-06,2.556534457678766e-06,2.980928688151501e-06
EU27+UK,Activity,Processing vegetable oils and fats,3.324453385137636e-06,6.390069301598699e-06,6.44937555376635e-06,3.3130421474638e-06,2.4127382357047637e-06
EU27+UK,Activity,Production of electricity by Geothermal,0.00014260469588925863,1.0960038087007925e-05,1.1271643250021954e-05,4.6560150152339275e-06,5.929015888975874e-05
EU27+UK,Activity,Production of electricity by biomass and waste,0.0,0.0,0.0,0.0,0.0
EU27+UK,Activity,Production of electricity by coal,0.23663489071158206,0.03845276718915808,0.03968465182119599,0.02733226242094594,0.10678660720486746
EU27+UK,Activity,Production of electricity by gas,0.042686943026296977,0.008754198334155711,0.008943804383394099,0.007473266307970516,0.02043519330407319
EU27+UK,Activity,Production of electricity by hydro,0.0,0.0,0.0,0.0,0.0
EU27+UK,Activity,Production of electricity by nuclear,0.00016452854131051605,1.8876433443894814e-05,1.8868668807838612e-05,1.2964801581879132e-05,7.191361161144117e-05
EU27+UK,Activity,Production of electricity by petroleum and other oil derivatives,0.005810417730104494,0.001635745428038009,0.0016424053374931944,0.0016906862398417002,0.0031205168684585163
EU27+UK,Activity,Production of electricity by solar photovoltaic,0.0,0.0,0.0,0.0,0.0
EU27+UK,Activity,Production of electricity by solar thermal,0.0,0.0,0.0,0.0,0.0
EU27+UK,Activity,"Production of electricity by tide, wave, ocean",0.0,0.0,0.0,0.0,0.0
EU27+UK,Activity,Production of electricity by wind,0.0,0.0,0.0,0.0,0.0
EU27+UK,Activity,Production of electricity nec,0.0007985536570354637,0.0004557710739682087,0.0004728945967965966,0.0003601700265915326,0.0004711374607855419
EU27+UK,Activity,Production of meat products nec,1.0852476328561453e-06,1.9831941380481945e-06,1.995086770995763e-06,1.090538844224192e-06,8.208081954979798e-07
EU27+UK,Activity,Production of offshore wind plants,0.0,0.0,0.0,0.0,0.0
EU27+UK,Activity,Production of onshore wind plants,0.0,0.0,0.0,0.0,0.0
EU27+UK,Activity,Production of photovoltaic plants,0.0,0.0,0.0,0.0,0.0
EU27+UK,Activity,Public administration and defence; compulsory social security (75),8.748077901240787e-05,0.00011830351046560994,0.0001171711761798652,0.00016569202638518524,0.00020255743133467083
EU27+UK,Activity,"Publishing, printing and reproduction of recorded media (22)",0.00028403739327831714,0.0005473894891078148,0.0005141564135555568,0.00044474311439879534,0.0003008228786830176
EU27+UK,Activity,Pulp,0.00015892137376817485,0.00024338516599977056,0.00022288620408319782,0.0001315496952325226,0.00010327014326628499
EU27+UK,Activity,Quarrying of sand and clay,0.0002760502926740139,0.000532179102702469,0.0005308566544298386,0.00020622068412802923,0.00016542453692047011
EU27+UK,Activity,Quarrying of stone,0.0003374533488073109,0.0006215417797212991,0.0008660434934764382,0.00027740197645045146,0.00019670847462603598
EU27+UK,Activity,Raw milk,1.5250886984925923e-05,3.504539891958738e-05,3.4564344719131925e-05,1.7076352187105526e-05,1.1613269482372946e-05
EU27+UK,Activity,Re-processing of ash into clinker,0.001482167475379531,0.0004169753014825767,0.0009357176623633594,0.0004923289991752058,0.0008666013297407136
EU27+UK,Activity,Re-processing of secondary aluminium into new aluminium,0.001786819935483962,0.0006436121088127146,0.0005846176266682347,0.00022325437702166108,0.0007695324972327243
EU27+UK,Activity,Re-processing of secondary construction material into aggregates,0.0012513042394811384,0.00018046044753794634,0.0006544236544474371,0.00024650893259394916,0.0006240190534762994
EU27+UK,Activity,Re-processing of secondary copper into new copper,0.00015854060382323882,0.0003881633465432284,0.00033486057991264484,0.00013898850067934465,9.531417354842451e-05
EU27+UK,Activity,Re-processing of secondary glass into new glass,0.0008724708878845427,0.02179430603338583,0.014695041699734679,0.004761614676348012,0.0004376740116753218
EU27+UK,Activity,"Re-processing of secondary lead into new lead, zinc and tin",7.453924991946461e-05,0.0001834432792233311,0.00019078604507159072,7.647377333086874e-05,4.805113766515749e-05
EU27+UK,Activity,Re-processing of secondary other non-ferrous metals into new other non-ferrous metals,3.3562897334634754e-05,4.2933193735189265e-05,4.048447830358716e-05,2.2929317006797542e-05,2.2233022620827648e-05
EU27+UK,Activity,Re-processing of secondary paper into new pulp,6.728023129474603e-05,0.00011991350879159745,0.00010969410390564191,6.431945764267468e-05,4.569921167684928e-05
EU27+UK,Activity,Re-processing of secondary plastic into new plastic,0.00025617698285942606,0.0005147186418655489,0.0004770574403782876,0.0002512951049247522,0.00017460692920443497
EU27+UK,Activity,Re-processing of secondary preciuos metals into new preciuos metals,6.0109730746471244e-05,8.073120386679876e-05,7.50993423895825e-05,3.34398610600961e-05,3.062083523703566e-05
EU27+UK,Activity,Re-processing of secondary steel into new steel,0.0019270469776573556,0.006479486716463948,0.006085332659144362,0.0023781552650490472,0.0012625406952909953
EU27+UK,Activity,Re-processing of secondary wood material into new wood material,0.0002001804503511036,0.00016516878500816656,0.00021154787672629207,9.312222118523681e-05,0.00011144563270514116
EU27+UK,Activity,Real estate activities (70),0.0001395883938591306,0.00018243886069350523,0.00019087295345727808,0.00015414158620881071,0.00014822783501800305
EU27+UK,Activity,"Recreational, cultural and sporting activities (92)",3.8108415715447324e-05,6.936260071732985e-05,6.480343747949952e-05,4.939915287546374e-05,3.357220447401009e-05
EU27+UK,Activity,Recycling of bottles by direct reuse,0.0017706844540106193,0.0024805729240519325,0.002405698013994539,0.0024772971430392725,0.0017606333868599546
EU27+UK,Activity,Recycling of waste and scrap,0.0020502416465837964,0.0036955159245159984,0.0031925241147358367,0.0012595444691833777,0.0010723527274809953
EU27+UK,Activity,Renting of machinery and equipment without operator and of personal and household goods (71),0.0002106657103800947,0.00027043399976597735,0.00030888080618770284,0.00026762891671328217,0.00025270828622857045
EU27+UK,Activity,Research and development (73),6.328092858117292e-05,0.00014273201875580966,0.0001197768846789674,7.323583070454604e-05,4.4454790241053636e-05
EU27+UK,Activity,Retail sale of automotive fuel,0.0002719032335753132,0.00034504674880185955,0.0003821307948716432,0.000275394096150953,0.0004576579941854574
EU27+UK,Activity,"Retail trade, except of motor vehicles and motorcycles; repair of personal and household goods (52)",0.0002864311422254213,0.00046276510051224004,0.00044816592304803074,0.000275810931231083,0.0006936620330852472
EU27+UK,Activity,"Sale, maintenance, repair of motor vehicles, motor vehicles parts, motorcycles, motor cycles parts and accessoiries",0.00018380727172409626,0.00026358353807778677,0.00029068214526686414,0.00026278644781299094,0.0004036932797672999
EU27+UK,Activity,Sea and coastal water transport,0.01709072587550894,0.026084739916485706,0.10116744495659201,0.023495820885672983,0.009530558277756333
EU27+UK,Activity,Steam and hot water supply,0.01889928854918535,0.020876784307022875,0.020386074028955,0.01846721922097769,0.01510581964492155
EU27+UK,Activity,Sugar refining,2.6443542112788852e-06,5.235193412651966e-06,5.364759632603884e-06,2.8478232853625154e-06,2.221665978687048e-06
EU27+UK,Activity,Supporting and auxiliary transport activities; activities of travel agencies (63),0.0007009608933353004,0.0011126605900676247,0.0015277980608719517,0.0007816260376916681,0.0006010100334182914
