EU27+UK,Activity,Activities of membership organisation n.e.c. (91),5.3681679013008145e-06,7.795055669928275e-06,7.624671404207466e-06,2.4176881251578018e-05,1.1360201669834437e-05
EU27+UK,Activity,Air transport (62),0.002419793579591969,0.003524902717500475,0.003642300374942799,0.003278270173746543,0.002954707126734829
EU27+UK,Activity,Aluminium production,0.0012664793784420132,0.00044219617681960004,0.00040173233663736666,0.0001642793899310914,0.0005846653145002324
EU27+UK,Activity,Animal products nec,1.1739038879313713e-05,1.7859452569936465e-05,1.8808343137083018e-05,1.3152879525770152e-05,1.3712969673912314e-05
EU27+UK,Activity,"Biogasification of food waste, incl. land application",6.864540581220221e-07,1.0568000666429164e-06,1.1296309667600861e-06,9.365320145300601e-07,6.26397485516043e-07
EU27+UK,Activity,"Biogasification of paper, incl. land application",1.43270021314667e-07,2.052787520731172e-07,2.14479546827607e-07,1.6666196888944323e-07,1.175234234269112e-07
EU27+UK,Activity,"Biogasification of sewage slugde, incl. land application",3.7685693907176884e-06,6.036375127628455e-06,6.217613838373534e-06,3.907263967680619e-06,3.0551139739065247e-06
EU27+UK,Activity,Casting of metals,0.0011875667608758683,0.0025398117092733552,0.0022953193858306683,0.0011229731069953039,0.0008668866983632456
EU27+UK,Activity,Cattle farming,1.6228176442232662e-05,1.9830889622849727e-05,1.9883264092031178e-05,2.0350875372890792e-05,1.7738913721453987e-05
EU27+UK,Activity,Chemicals nec,0.0008992363412409989,0.008918950084197604,0.0064592518334747545,0.002580375838941418,0.000605048282027887
EU27+UK,Activity,"Collection, purification and distribution of water (41)",0.00011386050453119759,8.981152004767614e-05,9.163097151968065e-05,0.00016562312073916207,0.00011367032738958323
EU27+UK,Activity,"Composting of food waste, incl. land application",9.9875075927785e-06,1.2828013370549281e-05,1.355910275433263e-05,1.135059606107699e-05,8.11462603902512e-06
EU27+UK,Activity,"Composting of paper and wood, incl. land application",4.147790053110851e-08,4.348290586894946e-08,4.61023674941398e-08,3.3497481295224384e-08,3.0750150065811696e-08
EU27+UK,Activity,Computer and related activities (72),0.00012361063897110177,0.00019109460388351993,0.00018530055592886322,0.00016598067724406547,0.00012119309624498017
EU27+UK,Activity,Construction (45),0.0036451819061281464,0.0005175602396567088,0.0018881166048884041,0.000845793483340112,0.001938183377722416
EU27+UK,Activity,Copper production,0.00022115378638163182,0.0005347916968285934,0.0004643324505771154,0.0002122509032330133,0.00014456293742961035
EU27+UK,Activity,Cultivation of cereal grains nec,4.4417736451218244e-05,7.780267675239039e-05,7.561331074993457e-05,4.53861813169502e-05,3.981840866687078e-05
EU27+UK,Activity,Cultivation of crops nec,1.0619128990683438e-05,8.817412508305575e-06,1.0432108409769637e-05,6.3454740982482166e-06,7.446271201474467e-06
EU27+UK,Activity,Cultivation of oil seeds,1.6581921090687784e-05,3.376921064569048e-05,3.373969671977964e-05,1.923706355407613e-05,1.5735040455409413e-05
EU27+UK,Activity,Cultivation of paddy rice,5.27870865043176e-05,1.2051312245897494e-05,1.220079155830631e-05,7.981571637660635e-06,2.666524341498373e-05
EU27+UK,Activity,Cultivation of plant-based fibers,2.1741236125948058e-06,3.01157460898609e-06,2.8428969600501472e-06,1.5997847520569836e-06,1.8143686598125713e-06
EU27+UK,Activity,"Cultivation of sugar cane, sugar beet",4.77824046221729e-06,9.542960006231724e-06,9.16228822971915e-06,5.6266712584867225e-06,4.782760357522338e-06
EU27+UK,Activity,"Cultivation of vegetables, fruit, nuts",2.6053112633899518e-05,3.69899770816827e-05,3.669906890884944e-05,2.0869344665903622e-05,1.95938194774226e-05
EU27+UK,Activity,Cultivation of wheat,4.615217318359135e-05,8.296539725371517e-05,7.885866654360138e-05,4.772914097579966e-05,4.175370603629699e-05
EU27+UK,Activity,Distribution and trade of electricity,0.00020918056757594154,0.0002598030431208199,0.0002756143575243805,0.00023546664556889046,0.00020154032007936332
EU27+UK,Activity,Education (80),1.6126176183963124e-05,2.7453567351726468e-05,2.5745860911271036e-05,3.4034217219166414e-05,1.8571463690672887e-05
EU27+UK,Activity,Extra-territorial organizations and bodies,0.0,0.0,0.0,0.0,0.0
EU27+UK,Activity,"Extraction of crude petroleum and services related to crude oil extraction, excluding surveying",0.000621726861237139,0.0004675939258692482,0.0004910441639026544,0.0014499496263367297,0.0010333959364375754
EU27+UK,Activity,"Extraction of natural gas and services related to natural gas extraction, excluding surveying",0.0022539182215649835,0.0019738990603564936,0.0019468263688113886,0.0027052978353906453,0.002213926734186868
EU27+UK,Activity,"Extraction, liquefaction, and regasification of other petroleum and gaseous materials",1.4892374347438631e-05,3.8335634879285576e-06,4.772209908081011e-06,5.247726034119384e-06,8.873401431976215e-06
EU27+UK,Activity,"Financial intermediation, except insurance and pension funding (65)",0.00033944316694488655,0.0004255435170450705,0.0004458853560811266,0.0005682405146985524,0.00038839637451207115
EU27+UK,Activity,"Fishing, operating of fish hatcheries and fish farms; service activities incidental to fishing (05)",2.2319308686200042e-05,1.8795639797363288e-05,2.6038661436486546e-05,1.4503961643475223e-05,1.587771335337604e-05
EU27+UK,Activity,"Forestry, logging and related service activities (02)",0.0001253994863817122,9.639312129463544e-05,0.00011874736852451611,6.215009005945789e-05,7.469849196538508e-05
EU27+UK,Activity,Health and social work (85),7.236882148230489e-06,1.2962012786758142e-05,1.1952638753756809e-05,1.2089564737009261e-05,8.103679419219587e-06
EU27+UK,Activity,Hotels and restaurants (55),8.239739754497852e-05,0.00011991942029113314,0.0001247742762874659,8.8477131614617e-05,7.854769770542392e-05
EU27+UK,Activity,Incineration of waste: Food,1.7177601395009552e-05,1.3318392630577663e-05,1.378179204498248e-05,9.443624650393511e-06,1.0463744758552748e-05
EU27+UK,Activity,Incineration of waste: Metals and Inert materials,0.000266046478851666,0.00032170484505676845,0.0003507516123215099,0.0002777092655482541,0.00019723862433072787
EU27+UK,Activity,Incineration of waste: Oil/Hazardous waste,5.916999970807926e-05,4.7901334882448806e-05,5.0687369331941763e-05,3.440561969312214e-05,3.691619791964658e-05
EU27+UK,Activity,Incineration of waste: Paper,1.3707100724097861e-05,1.2701247740959348e-05,1.3183278169947528e-05,9.245735569106288e-06,8.938892729177855e-06
EU27+UK,Activity,Incineration of waste: Plastic,0.00010426113656201072,0.00012262141855654433,0.00012760347837323193,0.00010113385516670155,7.679177746987905e-05
EU27+UK,Activity,Incineration of waste: Textiles,9.026582503460401e-05,0.00010237778750005246,0.0001067786643380858,6.793962705868253e-05,6.027873992180421e-05
EU27+UK,Activity,Incineration of waste: Wood,5.146431066496983e-06,4.389472179343012e-06,4.561468225589145e-06,3.0890452590006073e-06,3.2455192703512022e-06
EU27+UK,Activity,Inland water transport,0.0004471136373642198,0.000751889645407369,0.0008625222499130294,0.0005366561430711456,0.0005139382425899408
EU27+UK,Activity,"Insurance and pension funding, except compulsory social security (66)",5.7512811617855254e-05,7.621794228482428e-05,8.530544430216823e-05,0.0001098691718832823,0.00010139936818017315
EU27+UK,Activity,Landfill of waste: Food,6.222740277336834e-06,7.2069477801155485e-06,7.91629686619569e-06,5.641045414034717e-06,4.8337520265091935e-06
EU27+UK,Activity,Landfill of waste: Inert/metal/hazardous,7.313206084745204e-06,1.0801893553397873e-05,1.1489050528182261e-05,7.49807060255805e-06,5.7571578720604165e-06
EU27+UK,Activity,Landfill of waste: Paper,4.4290799021611605e-06,4.925544884315265e-06,5.433826683828554e-06,3.8296455750657005e-06,1.7294323186533075e-05
EU27+UK,Activity,Landfill of waste: Plastic,1.1183519834563082e-06,1.4789206481905448e-06,1.5602062911610593e-06,1.0505591755742883e-06,8.936526900369204e-07
EU27+UK,Activity,Landfill of waste: Textiles,1.123382115871628e-06,1.400008499670376e-06,1.4963688514950414e-06,1.0927348346786812e-06,9.167493024010138e-07
EU27+UK,Activity,Landfill of waste: Wood,1.3986566360699786e-06,1.8837240761707419e-06,1.9872448249315505e-06,1.4018008576177857e-06,1.1207220793714268e-06
EU27+UK,Activity,"Lead, zinc and tin production",3.197460870134533e-05,8.386839856379658e-05,8.482772113906066e-05,3.626789816652526e-05,2.177774675353714e-05
EU27+UK,Activity,Manufacture of basic iron and steel and of ferro-alloys and first products thereof,0.0022238783535742782,0.007257876403854008,0.006811241229989272,0.0028673145207035802,0.0015353635057517466
EU27+UK,Activity,Manufacture of beverages,3.3191926896969254e-05,7.602048947009349e-05,7.577783269592522e-05,3.8067708512541415e-05,2.720968261497707e-05
EU27+UK,Activity,"Manufacture of bricks, tiles and construction products, in baked clay",0.0007140732364531319,0.0002357061455468554,0.0004993220973628983,0.00037941529737717125,0.000506503154578911
EU27+UK,Activity,"Manufacture of cement, lime and plaster",0.003792671715497609,0.0011408864176167717,0.0024574736292205337,0.0014906649209500936,0.002376040652071675
EU27+UK,Activity,Manufacture of ceramic goods,0.00048063704747553036,0.0003017363523272642,0.00041611858397899194,0.00024533523066956023,0.00032075537265410434
EU27+UK,Activity,Manufacture of coke oven products,0.001207213680500538,0.0036613643707077816,0.0030764166453976192,0.0012600517442112155,0.0007466717037065395
EU27+UK,Activity,Manufacture of electrical machinery and apparatus n.e.c. (31),0.0017785175342567964,0.002127515340969216,0.001274072369257871,0.0006853956565825169,0.0009403304606628764
EU27+UK,Activity,"Manufacture of fabricated metal products, except machinery and equipment (28)",0.0004078890211285428,0.00397641498798479,0.0038490789177160825,0.0012815615994770696,0.0002519307406610857
EU27+UK,Activity,Manufacture of fish products,2.5280440343696634e-05,5.972444091037794e-05,6.013877797921518e-05,2.9392949165394244e-05,2.001086210387884e-05
EU27+UK,Activity,Manufacture of furniture; manufacturing n.e.c. (36),0.00016709103869401402,0.0004999944090017626,0.0004994138211607053,0.00025675306212018717,0.00011242712581219286
EU27+UK,Activity,Manufacture of gas; distribution of gaseous fuels through mains,0.011388961509632483,0.004438623982228662,0.004717840544056851,0.041952693575559134,0.030613947990929192
EU27+UK,Activity,Manufacture of glass and glass products,0.0013728078100631808,0.03438058152916801,0.023198204867473007,0.008074385510184356,0.0007316848193276873
EU27+UK,Activity,Manufacture of machinery and equipment n.e.c. (29),0.00023854931165065226,0.0004528427336329174,0.0003846239238902755,0.0001759154872150742,0.0001384115401173845
EU27+UK,Activity,"Manufacture of medical, precision and optical instruments, watches and clocks (33)",0.00017057754098605212,0.0003176591133220987,0.00026621745154609757,0.00015355909049884602,0.00012094841457961892
EU27+UK,Activity,"Manufacture of motor vehicles, trailers and semi-trailers (34)",9.782931237124259e-05,0.00022056956326213758,0.00020076196483767488,9.289700109794742e-05,6.85738314502078e-05
EU27+UK,Activity,Manufacture of office machinery and computers (30),2.1695212670162698e-05,3.8857805455604616e-05,3.243179926194636e-05,1.836155207171977e-05,1.5242680593570963e-05
EU27+UK,Activity,Manufacture of other non-metallic mineral products n.e.c.,0.0029010788134580614,0.011781475910160306,0.03603037674771898,0.008530467072791382,0.0015424335940737108
EU27+UK,Activity,Manufacture of other transport equipment (35),0.00014842217538015996,0.0003338864910904372,0.0002872487361373647,0.000126499706533615,9.03658854017815e-05
EU27+UK,Activity,"Manufacture of radio, television and communication equipment and apparatus (32)",0.0002747695389693844,0.00043151965210982474,0.0003433995632255825,0.00021385666598730085,0.00017672071378864402
EU27+UK,Activity,Manufacture of rubber and plastic products (25),9.616023274306763e-05,0.00015433465874284787,0.0001521711260505699,7.496415376084323e-05,6.285550134366375e-05
EU27+UK,Activity,Manufacture of textiles (17),2.5554067704374936e-05,5.256909486126497e-05,4.788792448283052e-05,2.2160828325995144e-05,1.697838810921745e-05
EU27+UK,Activity,Manufacture of tobacco products (16),2.8126577807800444e-05,3.95748543555145e-05,3.713397050648946e-05,2.0936471205076152e-05,2.0941863374453837e-05
EU27+UK,Activity,Manufacture of wearing apparel; dressing and dyeing of fur (18),1.463687711352302e-05,3.0139070080216834e-05,2.9265574912908914e-05,1.573415709154707e-05,1.1966672915594486e-05
EU27+UK,Activity,"Manufacture of wood and of products of wood and cork, except furniture; manufacture of articles of straw and plaiting materials (20)",0.00021078882532831348,0.0001702729833513735,0.0002194412748158751,0.00010635217792547978,0.00012475622250167148
EU27+UK,Activity,"Manure treatment (biogas), storage and land application",0.0,0.0,0.0,0.0,0.0
EU27+UK,Activity,"Manure treatment (conventional), storage and land application",0.0,0.0,0.0,0.0,0.0
EU27+UK,Activity,Meat animals nec,5.825633880199965e-06,1.0345661024181593e-05,1.0504580044493243e-05,7.105699631976259e-06,6.021599583023938e-06
EU27+UK,Activity,Mining of aluminium ores and concentrates,0.00010675467581615186,0.00020191777597532645,0.00017703285191047747,6.352167880159598e-05,5.3128388726388904e-05
EU27+UK,Activity,"Mining of chemical and fertilizer minerals, production of salt, other mining and quarrying n.e.c.",3.46666795319512e-05,0.00017794394380796707,0.00018151524054654076,6.440084752117684e-05,2.332824184000211e-05
EU27+UK,Activity,Mining of coal and lignite; extraction of peat (10),0.0034399124097530503,0.0010086150361387901,0.0010364207106271944,0.0008239872685500834,0.0018345000837724113
EU27+UK,Activity,Mining of copper ores and concentrates,0.00022640127747549775,0.0003222514026163126,0.00035079005892846873,0.00014337841676704657,0.00013033895665057242
EU27+UK,Activity,Mining of iron ores,0.00015509748063324038,0.0003798582281808059,0.00036275602208989024,0.00023393518264982785,0.00015007941418943837
EU27+UK,Activity,"Mining of lead, zinc and tin ores and concentrates",2.3573134471767508e-05,5.151607564086039e-05,5.3161845755714806e-05,2.2216713061858466e-05,1.5342609229861603e-05
EU27+UK,Activity,Mining of nickel ores and concentrates,1.197058340821178e-05,2.292272409944787e-05,2.3592884781170317e-05,1.1003087030325317e-05,8.094908792455987e-06
EU27+UK,Activity,Mining of other non-ferrous metal ores and concentrates,0.00020019326246227954,0.0002699129656000831,0.00027049649848272646,0.0002514385074601193,0.00020021266485968091
EU27+UK,Activity,Mining of precious metal ores and concentrates,0.00013703081993676536,0.00011964283980535955,0.00013113372942913476,5.747469154389098e-05,7.463104119173418e-05
EU27+UK,Activity,Mining of uranium and thorium ores (12),7.900750584754335e-05,4.9836573339958526e-05,5.254224854324545e-05,0.00023145149401942018,0.0001709686093192219
EU27+UK,Activity,N-fertiliser,1.9517906300953383e-05,2.463883742962119e-05,2.5310355407123514e-05,4.2490929915368085e-05,1.409224471748865e-05
EU27+UK,Activity,Other business activities (74),0.0010350129397439579,0.0023013904895467707,0.002040777462063759,0.0013785656778137602,0.000836013017900349
EU27+UK,Activity,Other land transport,0.00023485130020323643,0.0003070499572467613,0.0005526653284643878,0.00038177474014606974,0.0002922448145153026
EU27+UK,Activity,Other non-ferrous metal production,0.0001306328949307365,0.00014545663568151375,0.00013760752586157874,8.585271426915298e-05,8.88153539654071e-05
EU27+UK,Activity,Other service activities (93),2.221650734679946e-05,3.1701013542853024e-05,3.10061667886193e-05,3.108266799886768e-05,2.6495240161231223e-05
EU27+UK,Activity,P- and other fertiliser,6.441662432217524e-05,6.755336236110233e-05,6.787404546872234e-05,6.140375391406484e-05,4.624926778252729e-05
EU27+UK,Activity,Paper,0.00020694254237800492,0.00039053921588950703,0.00035343616181300445,0.00022884117364471503,0.000153244030270936
EU27+UK,Activity,Petroleum Refinery,0.002414436979105009,0.0024601528157219776,0.0029786263723751306,0.004253896352767571,0.0021839156666795963
EU27+UK,Activity,Pigs farming,1.4522312522137644e-05,2.9266713222187423e-05,2.690847507832656e-05,1.6153884814191546e-05,1.3120084712983964e-05
EU27+UK,Activity,"Plastics, basic",0.0008401322165802805,0.001723293226528002,0.0016088228575912929,0.0008627453215496443,0.000571224366960927
EU27+UK,Activity,Post and telecommunications (64),0.0003093066867465003,0.0003781150684650059,0.0003878875049740467,0.0005200635511341137,0.00034698332336218835
EU27+UK,Activity,Poultry farming,1.0508818235150001e-05,1.7996678197437423e-05,1.8169961310060765e-05,1.1608848344980923e-05,1.0879002618420805e-05
EU27+UK,Activity,Precious metals production,0.00012855660872048214,0.00010972681478421953,9.980932905130941e-05,4.882737395637281e-05,7.006585058776326e-05
EU27+UK,Activity,Private households with employed persons (95),4.646290672501158e-06,9.7879938436735e-06,8.222430203070611e-06,4.626427304806068e-06,3.248631356230639e-06
EU27+UK,Activity,Processed rice,2.950638776659424e-06,5.103518660816903e-06,5.1179698372470115e-06,3.0520060344442402e-06,3.0437392242890336e-06
EU27+UK,Activity,Processing of Food products nec,5.6055515765630553e-05,0.0001302358679967505,0.00013253962614275333,6.284855951120018e-05,4.405846032486292e-05
EU27+UK,Activity,Processing of dairy products,2.0476655069836833e-05,5.2697013899214184e-05,5.220256454885057e-05,2.6092034967485244e-05,1.8040251263663118e-05
EU27+UK,Activity,Processing of meat cattle,5.644848949476872e-06,1.1093390293211133e-05,1.1120525363453953e-05,6.753824954518666e-06,6.072722180534888e-06
EU27+UK,Activity,Processing of meat pigs,1.2515446813958414e-05,2.8554246837954358e-05,2.5145038171617465e-05,1.4941302981034658e-05,1.2000327997400018e-05
EU27+UK,Activity,Processing of meat poultry,1.8615890047374106e-06,3.7347453385803645e-06,3.5327725881571597e-06,2.178160490949201e-06,2.085475584409779e-06
EU27+UK,Activity,Processing of nuclear fuel,9.603898410838084e-06,1.0288804887221411e-05,1.0717451363129948e-05,5.3849521723779764e-06,5.95533754759102e-06
EU27+UK,Activity,Processing vegetable oils and fats,2.803865746098633e-06,5.208297605409106e-06,5.241471118126204e-06,2.819300023737801e-06,2.325528464999876e-06
EU27+UK,Activity,Production of electricity by Geothermal,1.3042257812894617e-05,8.891421946520524e-07,9.35800245864173e-07,4.285717610632132e-07,5.830699103218851e-06
EU27+UK,Activity,Production of electricity by biomass and waste,0.0,0.0,0.0,0.0,0.0
EU27+UK,Activity,Production of electricity by coal,0.18876381204267653,0.028617593172501017,0.029523002046333586,0.023887966445221617,0.0928886186858913
EU27+UK,Activity,Production of electricity by gas,0.03105871132219341,0.005428942914739905,0.005573713711612871,0.00540985802451398,0.01612443573126338
EU27+UK,Activity,Production of electricity by hydro,0.0,0.0,0.0,0.0,0.0
EU27+UK,Activity,Production of electricity by nuclear,0.00014034080959377226,1.4553615530582778e-05,1.4843845377063262e-05,1.1508975396201366e-05,6.631504243482866e-05
EU27+UK,Activity,Production of electricity by petroleum and other oil derivatives,0.004669503389756592,0.0012248456641884902,0.0012387192337251357,0.0013469021694298767,0.002706961081566053
EU27+UK,Activity,Production of electricity by solar photovoltaic,0.0,0.0,0.0,0.0,0.0
EU27+UK,Activity,Production of electricity by solar thermal,0.0,0.0,0.0,0.0,0.0
EU27+UK,Activity,"Production of electricity by tide, wave, ocean",0.0,0.0,0.0,0.0,0.0
EU27+UK,Activity,Production of electricity by wind,0.0,0.0,0.0,0.0,0.0
EU27+UK,Activity,Production of electricity nec,0.0007498909668791936,0.0004130552752614853,0.0004310356881044323,0.00034871780913496803,0.0004811671192714467
EU27+UK,Activity,Production of meat products nec,1.261055471723332e-06,2.2892301802032666e-06,2.213610018407931e-06,1.2660908998020927e-06,1.0668919840719472e-06
EU27+UK,Activity,Production of offshore wind plants,0.0,0.0,0.0,0.0,0.0
EU27+UK,Activity,Production of onshore wind plants,0.0,0.0,0.0,0.0,0.0
EU27+UK,Activity,Production of photovoltaic plants,0.0,0.0,0.0,0.0,0.0
EU27+UK,Activity,Public administration and defence; compulsory social security (75),8.816934174882932e-05,0.00011135976616605875,0.00011242602415542984,0.00015641507200974742,0.00017635086249256037
EU27+UK,Activity,"Publishing, printing and reproduction of recorded media (22)",0.00022638789016049202,0.0004280421997086445,0.00040488643723534816,0.00038409885036953546,0.00026038313126567784
EU27+UK,Activity,Pulp,0.00013711757749093072,0.00020240560372047033,0.000185321826768441,0.00011828515544524875,9.655701517580732e-05
EU27+UK,Activity,Quarrying of sand and clay,0.00017558064103145017,0.0003808477273009695,0.0003690812726017384,0.0001581216142531317,0.00011620727385075108
EU27+UK,Activity,Quarrying of stone,0.00026157199701655866,0.0005729935755243366,0.0007554191200165092,0.00026821692021114204,0.00016803672427790383
EU27+UK,Activity,Raw milk,1.2079215316432919e-05,2.5977216828483508e-05,2.587368970560186e-05,1.3856425549317912e-05,1.0385760200879864e-05
EU27+UK,Activity,Re-processing of ash into clinker,0.0011236771153611018,0.0003635711571385271,0.0007458104267986171,0.00044908472744895745,0.0007046102100969944
EU27+UK,Activity,Re-processing of secondary aluminium into new aluminium,0.0014501923100817221,0.0005138652709414298,0.00046630500759194257,0.00019275667266102227,0.000671025574054138
EU27+UK,Activity,Re-processing of secondary construction material into aggregates,0.0004788917282315615,6.85643873244367e-05,0.000250024225229636,0.0001120498268049555,0.0002558609455508881
EU27+UK,Activity,Re-processing of secondary copper into new copper,0.00018636880075572157,0.000456598806710662,0.00039673214636368464,0.0001799445089397401,0.00012130782529722746
EU27+UK,Activity,Re-processing of secondary glass into new glass,0.0006219273973545207,0.0155775420702476,0.010510794173658355,0.003658614876296547,0.00033210325330061826
EU27+UK,Activity,"Re-processing of secondary lead into new lead, zinc and tin",4.2029671330313836e-05,0.00010714985326306657,0.00010978011830685897,4.812026876052503e-05,2.940793636724617e-05
EU27+UK,Activity,Re-processing of secondary other non-ferrous metals into new other non-ferrous metals,1.1837098742040511e-06,1.6403676945410306e-06,1.565535298419179e-06,8.834940589886586e-07,8.024437036122075e-07
EU27+UK,Activity,Re-processing of secondary paper into new pulp,4.9075128792700057e-05,8.378395502432765e-05,7.671245692132649e-05,4.823538263353765e-05,3.564988891066702e-05
EU27+UK,Activity,Re-processing of secondary plastic into new plastic,0.00020285148703300403,0.0004152161184256752,0.00038942781603821256,0.00021444407387131298,0.00014400677224853722
EU27+UK,Activity,Re-processing of secondary preciuos metals into new preciuos metals,3.0443927342953396e-07,4.131255137452626e-07,3.892145933892295e-07,2.0047439113317972e-07,1.6688371517210447e-07
EU27+UK,Activity,Re-processing of secondary steel into new steel,0.001414969952303583,0.004676439956660892,0.004394285526285111,0.001858214198772403,0.0009855318381007813
EU27+UK,Activity,Re-processing of secondary wood material into new wood material,0.00011905490711983773,9.958236021039069e-05,0.00012678891042439984,6.114424830459945e-05,7.049902748285512e-05
EU27+UK,Activity,Real estate activities (70),0.00018023898624977566,0.00021892231871656237,0.00023455329783514406,0.0001865810781310414,0.00019459468761725177
EU27+UK,Activity,"Recreational, cultural and sporting activities (92)",2.8299199215436324e-05,4.8604598848105765e-05,4.6229863764223105e-05,3.593813564127852e-05,2.525657708634567e-05
EU27+UK,Activity,Recycling of bottles by direct reuse,0.0009086969009175141,0.0013023112996880188,0.0012643347987419918,0.0014223881757926475,0.0010725183799433567
EU27+UK,Activity,Recycling of waste and scrap,0.002109072479314112,0.0035522639466887386,0.0030822964587183714,0.0013201791832874773,0.0011832429212755395
EU27+UK,Activity,Renting of machinery and equipment without operator and of personal and household goods (71),0.00019935174830932627,0.0002704165653175245,0.0003002508347027087,0.0002513673368336759,0.0002230630813002849
EU27+UK,Activity,Research and development (73),5.571229739169419e-05,0.00012440775268243574,0.00010674995747651396,7.02635714841822e-05,4.2176358969051916e-05
EU27+UK,Activity,Retail sale of automotive fuel,0.00015307087841874665,0.0001900404126054977,0.0002079116254776935,0.0001594786188293619,0.00026688287763592164
EU27+UK,Activity,"Retail trade, except of motor vehicles and motorcycles; repair of personal and household goods (52)",0.0002864098858152569,0.00046540037051478117,0.0004576088102947481,0.00032428369185169786,0.0011866159509867408
EU27+UK,Activity,"Sale, maintenance, repair of motor vehicles, motor vehicles parts, motorcycles, motor cycles parts and accessoiries",0.00018209232060749744,0.0002562849256483107,0.0002781421802063792,0.00025014469099599946,0.00035429058887293473
EU27+UK,Activity,Sea and coastal water transport,0.009202771036691657,0.0238329147449839,0.09089052947210251,0.02304772615891857,0.009072264093764066
EU27+UK,Activity,Steam and hot water supply,0.014108692732550254,0.016010390670951478,0.01592134630766707,0.014742269718110386,0.011882652152343657
EU27+UK,Activity,Sugar refining,2.34148298125199e-06,4.536289509869534e-06,4.511502739215646e-06,2.6314558362598227e-06,2.4790615719880404e-06
EU27+UK,Activity,Supporting and auxiliary transport activities; activities of travel agencies (63),0.0006898742370614223,0.0010815296532849547,0.0014711181333865026,0.0008718737197622876,0.00071508995758132
EU27+UK,Activity,"Tanning and dressing of leather; manufacture of luggage, handbags, saddlery, harness and footwear (19)",2.860533833024413e-06,4.615643224742963e-06,4.359500577592213e-06,2.5046850876692095e-06,2.1444349665298803e-06
