RoW,Activity,Sea and coastal water transport,0.010355009089552995,0.003932459762587855,0.008296342147710273,0.0026106445278607075,0.004972254353418118
RoW,Activity,Steam and hot water supply,0.003801794996219613,0.0036263646618331824,0.003239209204928319,0.001973235211570275,0.0021838546336227513
RoW,Activity,Sugar refining,9.93979093338395e-06,8.645154326026277e-06,7.650781736563497e-06,4.140838242353064e-06,5.428256660341952e-06
RoW,Activity,Supporting and auxiliary transport activities; activities of travel agencies (63),0.0007038841663247501,0.0006976522882906881,0.0008601066263045815,0.000418279148520403,0.0004398931555164367
RoW,Activity,"Tanning and dressing of leather; manufacture of luggage, handbags, saddlery, harness and footwear (19)",1.3691089670208833e-05,1.4318524642975096e-05,1.2246892670839548e-05,6.276903834804308e-06,7.345377141073377e-06
RoW,Activity,Transmission of electricity,3.439495866273846e-05,3.296699749687377e-05,2.87514484852837e-05,1.804654583916857e-05,1.972739744093583e-05
RoW,Activity,Transport via pipelines,0.001303256274141168,0.0011605063929903728,0.0011503081068242305,0.0009658684565052375,0.0011154217785261315
RoW,Activity,Transport via railways,0.00019776172986411437,0.0002029409317182533,0.00020016922333121478,0.00011880252193953158,0.00013558100432272863
RoW,Activity,"Waste water treatment, food",1.4053054072298334e-06,1.5003580116139192e-06,1.3333866591879714e-06,7.422188696911464e-07,8.067231038505637e-07
RoW,Activity,"Waste water treatment, other",2.2481700245010975e-06,2.072571813748481e-06,1.8526254385114465e-06,1.0279466930179372e-06,1.2391924076516587e-06
RoW,Activity,"Wholesale trade and commission trade, except of motor vehicles and motorcycles (51)",0.0001850013247881715,0.00018139496967613022,0.0001592491906983602,9.490385565624754e-05,0.00013936559768026457
RoW,Activity,"Wool, silk-worm cocoons",5.5327687650400144e-05,5.5533959386170346e-05,4.96002490444034e-05,3.376651592719871e-05,3.639723912109434e-05
USA,Activity,Activities auxiliary to financial intermediation (67),1.3996287786419032e-05,6.710971468549014e-06,5.42387107336925e-06,3.4128030311614757e-06,6.800966974613371e-06
USA,Activity,Activities of membership organisation n.e.c. (91),1.2083470192971105e-06,5.531188577126632e-07,4.936236543217498e-07,3.292309227401831e-07,6.113656469927939e-07
USA,Activity,Air transport (62),0.0008714345311711584,0.000785464251496494,0.0006235754882690907,0.0003881632366477249,0.00048636302056450037
USA,Activity,Aluminium production,0.00011180554284861605,3.798933027434493e-05,2.61054773957217e-05,1.0950450723241753e-05,4.740700852322744e-05
USA,Activity,Animal products nec,8.63931174337626e-07,8.251072448222909e-07,7.474589516128108e-07,3.9154313416244754e-07,4.660500298198018e-07
USA,Activity,"Biogasification of food waste, incl. land application",0.0,0.0,0.0,0.0,0.0
USA,Activity,"Biogasification of paper, incl. land application",0.0,0.0,0.0,0.0,0.0
USA,Activity,"Biogasification of sewage slugde, incl. land application",1.809734420523825e-06,6.14210471908535e-07,5.342461555343924e-07,2.610329691373264e-07,8.046845274714333e-07
USA,Activity,Casting of metals,4.8604144665668155e-05,3.357779187897078e-05,2.8038602604143734e-05,1.454950025597867e-05,2.395335023053075e-05
USA,Activity,Cattle farming,6.620198582866104e-06,3.6061250723291252e-06,3.230329599142137e-06,1.7786424231511704e-06,3.2170770701290642e-06
USA,Activity,Chemicals nec,0.0037264950743203145,0.0012169256196068886,0.001123440263233428,0.0006059015265827104,0.0016724395789748346
USA,Activity,"Collection, purification and distribution of water (41)",4.449686200190033e-07,1.2502792292338083e-07,1.1366113177408091e-07,6.253298756494546e-08,2.0043694558635599e-07
USA,Activity,"Composting of food waste, incl. land application",2.484822006394386e-07,1.4487276091009683e-07,1.4268445527138104e-07,7.431868024614068e-08,1.2158249203262477e-07
USA,Activity,"Composting of paper and wood, incl. land application",3.9702049752609306e-07,1.2136539372262808e-07,1.1398112296020039e-07,6.104502592088192e-08,1.806322808981946e-07
USA,Activity,Computer and related activities (72),8.050127890366938e-06,4.367503325407823e-06,3.8463011915269406e-06,2.6567482440267417e-06,4.370612672076767e-06
USA,Activity,Construction (45),2.06484359295654e-05,2.549960583185735e-06,2.536820373664548e-06,1.6825317693314765e-06,9.130030748665689e-06
USA,Activity,Copper production,0.0001082840948274998,0.0001553429269466638,0.00010211638757913358,4.28279686990745e-05,5.1190305759476666e-05
USA,Activity,Cultivation of cereal grains nec,1.6859976866698622e-05,8.114586217018922e-06,6.913694218778864e-06,3.642200481493576e-06,7.894348125273638e-06
USA,Activity,Cultivation of crops nec,2.8259022048909707e-05,1.0861340194514487e-05,9.69556213069879e-06,5.290668265714082e-06,1.298680513612603e-05
USA,Activity,Cultivation of oil seeds,7.66001980754167e-05,6.053593731296654e-05,3.437048082897691e-05,1.5497104878521108e-05,3.357452205017494e-05
USA,Activity,Cultivation of paddy rice,3.227766882179027e-05,2.0625536820519914e-05,1.8554951599027623e-05,1.0059476277398413e-05,1.6423426331706807e-05
USA,Activity,Cultivation of plant-based fibers,4.989375469966344e-05,3.257748869594624e-05,2.24537161104321e-05,1.0502603888609866e-05,2.2438543783637054e-05
USA,Activity,"Cultivation of sugar cane, sugar beet",2.3431602436133892e-06,1.4149079626304664e-06,1.2522416734334195e-06,6.773949245992487e-07,1.1813201155399403e-06
USA,Activity,"Cultivation of vegetables, fruit, nuts",2.272659927370826e-06,1.665040863675911e-06,1.4927844969299738e-06,8.118285394744063e-07,1.1842159985895617e-06
USA,Activity,Cultivation of wheat,3.286633441004336e-05,2.72751092819984e-05,2.4695347998707884e-05,1.3341274339461655e-05,1.767199608357575e-05
USA,Activity,Distribution and trade of electricity,9.753300287552115e-07,2.1995125270939165e-07,1.9197420430431945e-07,1.1028589215481137e-07,4.345359352096812e-07
USA,Activity,Education (80),2.2240909543200093e-07,6.695022266986501e-08,5.986135418464942e-08,4.896245295961939e-08,1.0962047374691599e-07
USA,Activity,Extra-territorial organizations and bodies,0.0,0.0,0.0,0.0,0.0
USA,Activity,"Extraction of crude petroleum and services related to crude oil extraction, excluding surveying",0.00035838553588049733,0.0001491421637208493,0.0001435787553764601,0.00011693595442411734,0.00017975053189316412
USA,Activity,"Extraction of natural gas and services related to natural gas extraction, excluding surveying",0.00011785201606566882,6.77054807621477e-05,6.680120574069783e-05,5.6691465479362225e-05,6.519715899972912e-05
USA,Activity,"Extraction, liquefaction, and regasification of other petroleum and gaseous materials",2.6674977510173886e-09,5.415255926398655e-10,5.07273623108865e-10,3.65697748750644e-10,1.1959487555278987e-09
USA,Activity,"Financial intermediation, except insurance and pension funding (65)",1.6663941914176667e-05,1.0679888262923626e-05,1.0012879785139113e-05,8.182231138501651e-06,1.0296832601094004e-05
USA,Activity,"Fishing, operating of fish hatcheries and fish farms; service activities incidental to fishing (05)",1.0903460405364777e-06,1.028550839307943e-06,9.629108222003557e-07,5.056953970546181e-07,6.072185604759517e-07
USA,Activity,"Forestry, logging and related service activities (02)",1.4550033585744728e-05,5.688023836295969e-06,4.849622542417548e-06,2.4781035933497465e-06,6.622118582595964e-06
USA,Activity,Health and social work (85),8.040025157090438e-08,1.9926422233528964e-08,1.8851477011057672e-08,1.8015683199287423e-08,3.934139310011617e-08
USA,Activity,Hotels and restaurants (55),2.491828896026142e-05,1.7876422834005124e-05,1.5883866047443134e-05,9.062622404188133e-06,1.415524256640897e-05
USA,Activity,Incineration of waste: Food,2.865335402611896e-07,1.7610510970057311e-07,1.7064478300399022e-07,7.800671643677289e-08,1.36004733449335e-07
USA,Activity,Incineration of waste: Metals and Inert materials,8.150258616683615e-06,6.133420478350364e-06,7.640196882688334e-06,3.934479205171693e-06,4.806971245884137e-06
USA,Activity,Incineration of waste: Oil/Hazardous waste,1.4636913713005292e-06,1.0227597794684258e-06,1.0101738126137865e-06,5.744540106581206e-07,7.942101266824993e-07
USA,Activity,Incineration of waste: Paper,6.443494573112381e-07,2.2234476721272804e-07,2.1505654368756155e-07,1.1892961981285494e-07,3.0023994421601617e-07
USA,Activity,Incineration of waste: Plastic,1.791013336347947e-05,6.059973676026374e-06,5.784394779555899e-06,2.958959452440623e-06,8.156922916381813e-06
USA,Activity,Incineration of waste: Textiles,2.4342415591494645e-06,1.0199954915664618e-06,1.008133508493978e-06,5.123376522672702e-07,1.1504420779401173e-06
USA,Activity,Incineration of waste: Wood,1.9701791992747574e-07,8.80454849084277e-08,8.319817495402076e-08,4.733042398924266e-08,9.569715556392082e-08
USA,Activity,Inland water transport,3.839092680092575e-05,2.7187685041578465e-05,2.3076928850843473e-05,1.185515809537411e-05,1.9243146055484562e-05
USA,Activity,"Insurance and pension funding, except compulsory social security (66)",3.5181789946704616e-06,2.227462487756548e-06,1.9502763059503092e-06,1.5794127957735914e-06,2.1050934721048047e-06
USA,Activity,Landfill of waste: Food,3.665312411899984e-07,1.347979428136944e-07,1.25747172986501e-07,6.624296152523283e-08,1.6854279709791545e-07
USA,Activity,Landfill of waste: Inert/metal/hazardous,5.636425825354191e-07,1.7268599682606004e-07,1.5255747761684946e-07,8.139726858088351e-08,2.5354148170706605e-07
USA,Activity,Landfill of waste: Paper,4.264360262832535e-07,1.4459703622028082e-07,1.36307417539921e-07,7.217928914430087e-08,1.9508926583454603e-07
USA,Activity,Landfill of waste: Plastic,3.360487486785649e-07,1.0299881487783447e-07,9.677397627743936e-08,5.070728543984451e-08,1.5228980042212603e-07
USA,Activity,Landfill of waste: Textiles,1.6408846887689423e-07,5.377606399731325e-08,5.0909973107008225e-08,2.680198279240565e-08,7.496914825249555e-08
USA,Activity,Landfill of waste: Wood,1.869607280321824e-07,6.065805894711349e-08,5.764449602869271e-08,3.0464731237579645e-08,8.54132373704811e-08
USA,Activity,"Lead, zinc and tin production",2.0346380753265563e-06,3.744067674419383e-06,3.7546982892252424e-06,1.5532527638270117e-06,1.2171986450056508e-06
USA,Activity,Manufacture of basic iron and steel and of ferro-alloys and first products thereof,0.0002171656597614712,0.0002093775679013302,0.00017759398988237242,7.89995285801327e-05,0.00010630076735589322
USA,Activity,Manufacture of beverages,2.095688991396423e-06,2.2715798975680523e-06,1.672792399782183e-06,8.975715092918797e-07,1.0930453829147416e-06
USA,Activity,"Manufacture of bricks, tiles and construction products, in baked clay",0.00011754256565186723,6.5046856297061765e-06,5.3003057135580335e-06,2.425826481900254e-06,4.8546513606882494e-05
USA,Activity,"Manufacture of cement, lime and plaster",0.00010190978240241677,1.8514396719793978e-05,1.7303673880636504e-05,9.457365901550113e-06,4.470952397565758e-05
USA,Activity,Manufacture of ceramic goods,6.457915673164636e-06,3.2242914214685586e-06,3.589893221008149e-06,2.105024262489258e-06,3.658652234412915e-06
USA,Activity,Manufacture of coke oven products,1.665645836930549e-05,1.6700070165534925e-05,1.4451651105133308e-05,6.249844296375087e-06,8.165193512087157e-06
USA,Activity,Manufacture of electrical machinery and apparatus n.e.c. (31),4.2433356165671234e-05,3.658712054653604e-05,2.5617954421839804e-05,1.761086960256786e-05,2.3539653082822284e-05
USA,Activity,"Manufacture of fabricated metal products, except machinery and equipment (28)",3.9853006878863255e-05,2.4953135136355502e-05,2.1749567707103568e-05,1.044185725119293e-05,1.8823057592059705e-05
USA,Activity,Manufacture of fish products,2.705781314793307e-06,3.3244689504668417e-06,3.131314461065033e-06,1.7640001448914527e-06,1.6110529624411972e-06
USA,Activity,Manufacture of furniture; manufacturing n.e.c. (36),7.269079479631928e-05,3.1979816913453434e-05,2.763662190248825e-05,1.6666696133466602e-05,3.39040072557274e-05
USA,Activity,Manufacture of gas; distribution of gaseous fuels through mains,0.00028584511546992834,1.874826784396253e-05,1.6230663900626493e-05,9.07029428539406e-06,0.00011938139246178991
USA,Activity,Manufacture of glass and glass products,0.009548414629786197,0.00014616074463330854,0.00010984285617907802,4.2816125651316335e-05,0.0039033610538141117
USA,Activity,Manufacture of machinery and equipment n.e.c. (29),3.974576224966531e-05,2.921559551164243e-05,2.506139207935073e-05,1.2874078604738824e-05,1.9745638126142783e-05
USA,Activity,"Manufacture of medical, precision and optical instruments, watches and clocks (33)",9.52809690298998e-06,1.2572175955132906e-05,9.26686367858227e-06,5.2331670562902384e-06,5.433263345348775e-06
USA,Activity,"Manufacture of motor vehicles, trailers and semi-trailers (34)",5.047422483526406e-05,2.7642841600392418e-05,2.4214525032681728e-05,1.2120386426022622e-05,2.4878284559085227e-05
USA,Activity,Manufacture of office machinery and computers (30),8.479104003440339e-06,9.204579948766279e-06,7.090231621317758e-06,3.960039820187994e-06,4.698917838686461e-06
USA,Activity,Manufacture of other non-metallic mineral products n.e.c.,0.0005750379060735247,2.469288884048172e-05,2.5671142743301288e-05,1.0718945136270003e-05,0.00023717946096073067
USA,Activity,Manufacture of other transport equipment (35),4.657712328916191e-05,4.7079103533966205e-05,4.0793117133925166e-05,2.01702393872804e-05,2.54412993356494e-05
USA,Activity,"Manufacture of radio, television and communication equipment and apparatus (32)",2.078085636841528e-05,2.15456012327451e-05,1.4477762612807985e-05,8.19850825590254e-06,1.0569520750472442e-05
USA,Activity,Manufacture of rubber and plastic products (25),1.4809037850134995e-05,6.605491998807091e-06,5.802849083956215e-06,2.9661983915619406e-06,6.897913019501899e-06
USA,Activity,Manufacture of textiles (17),4.47472947864609e-05,2.1444948189307408e-05,1.8949144561291385e-05,9.91388750666731e-06,2.0893658308226814e-05
USA,Activity,Manufacture of tobacco products (16),6.255560093334992e-07,3.105004966932701e-07,2.555400514504909e-07,1.230148508352607e-07,2.8660278960359646e-07
USA,Activity,Manufacture of wearing apparel; dressing and dyeing of fur (18),3.7133666364163546e-07,2.3532455840629204e-07,2.1546144091072234e-07,1.2766277396117145e-07,1.9595130101878164e-07
USA,Activity,"Manufacture of wood and of products of wood and cork, except furniture; manufacture of articles of straw and plaiting materials (20)",4.6928059612859796e-05,1.5924756989847252e-05,1.4746960185786828e-05,7.368402563706183e-06,2.1339470650230777e-05
USA,Activity,"Manure treatment (biogas), storage and land application",0.0,0.0,0.0,0.0,0.0
USA,Activity,"Manure treatment (conventional), storage and land application",0.0,0.0,0.0,0.0,0.0
USA,Activity,Meat animals nec,7.359640386569388e-08,4.993868288939788e-08,4.67265207880645e-08,2.49849888782983e-08,3.7562402351456103e-08
USA,Activity,Mining of aluminium ores and concentrates,4.28374158150178e-06,1.6013867003078454e-07,1.2343566079219959e-07,4.992281779378887e-08,1.7566696018420198e-06
USA,Activity,"Mining of chemical and fertilizer minerals, production of salt, other mining and quarrying n.e.c.",9.560102492596069e-05,7.057707480175206e-05,6.552880307819975e-05,2.9095514966742482e-05,4.49559811044514e-05
USA,Activity,Mining of coal and lignite; extraction of peat (10),0.002310230217272766,0.00024215880896722984,0.00024196769728351199,0.0001690960957020078,0.0010000131089633216
USA,Activity,Mining of copper ores and concentrates,7.697640784251585e-05,5.984655718369303e-05,4.1517433491518684e-05,1.7298734913274384e-05,3.4373148938592516e-05
USA,Activity,Mining of iron ores,1.6314023699826125e-05,9.40825152964953e-06,7.030332062616429e-06,3.2501428319943325e-06,7.340729848287418e-06
USA,Activity,"Mining of lead, zinc and tin ores and concentrates",1.5756444156461498e-05,1.3655478487874316e-05,1.2984963429171908e-05,4.979877462283452e-06,7.403800880131937e-06
USA,Activity,Mining of nickel ores and concentrates,0.0,0.0,0.0,0.0,0.0
USA,Activity,Mining of other non-ferrous metal ores and concentrates,9.24012947460456e-06,1.1725712174415307e-05,1.0432090186165156e-05,5.1128207327760785e-06,5.2013929359937155e-06
USA,Activity,Mining of precious metal ores and concentrates,0.0014681026855502414,6.849805822918336e-05,5.566928759236686e-05,2.505061576344874e-05,0.0006052332637210623
USA,Activity,Mining of uranium and thorium ores (12),2.246921184974378e-05,8.910985861431224e-06,7.72953727218245e-06,3.93109311462033e-06,1.0095798043323428e-05
USA,Activity,N-fertiliser,9.206284135743631e-06,3.178729877356815e-06,2.4534938362704174e-06,1.4046034086895538e-06,4.179195670598397e-06
USA,Activity,Other business activities (74),0.00016415695066850235,9.217147582616647e-05,8.261140045765496e-05,5.77277137486694e-05,8.771920421828481e-05
USA,Activity,Other land transport,1.4546329129151086e-08,4.720279604647914e-09,4.465831268808636e-09,2.8284060693965393e-09,7.261167810865649e-09
USA,Activity,Other non-ferrous metal production,1.9990517201026795e-05,2.90533573813262e-05,2.5613477581647996e-05,1.240328158477548e-05,1.1478702657183803e-05
USA,Activity,Other service activities (93),8.082018860453278e-07,2.4969777653806905e-07,2.201210856197536e-07,1.475768878564824e-07,3.8334394673884313e-07
USA,Activity,P- and other fertiliser,4.015314750387723e-05,1.6760927263354627e-05,1.48042023920369e-05,8.255725133377326e-06,1.8507847888750863e-05
USA,Activity,Paper,0.0005818919447636864,0.0001718482259590629,0.00014516465864541445,8.120173248414399e-05,0.00026072408583267034
USA,Activity,Petroleum Refinery,0.0005896369890407161,0.00028954950525244205,0.00029023784724335327,0.00027183552091315295,0.0003195421552189855
USA,Activity,Pigs farming,5.379620244361285e-06,2.8352626053090086e-06,2.4382848945294706e-06,1.3189172798231564e-06,2.5947292683939815e-06
USA,Activity,"Plastics, basic",0.0001298723576409695,0.00011194460824529807,8.520482204668783e-05,4.105451840303935e-05,6.220623037898596e-05
USA,Activity,Post and telecommunications (64),2.3139733432506507e-05,1.2328928505665618e-05,1.1299426272093896e-05,8.179640214447792e-06,1.2608363791785013e-05
USA,Activity,Poultry farming,3.6582559476670547e-06,2.592472177273708e-06,2.2389090374081885e-06,1.2031473957420786e-06,1.91248493991167e-06
USA,Activity,Precious metals production,0.0011628406410814523,3.427258909582665e-05,2.8773404026911127e-05,1.3017369491219838e-05,0.00047785449392213935
USA,Activity,Private households with employed persons (95),8.111452930836843e-10,1.0281679914750402e-09,1.0693389288260603e-09,8.606616041384954e-10,8.387689484330402e-10
USA,Activity,Processed rice,3.620245229349855e-06,3.3513389703258774e-06,3.0662326113540816e-06,1.6191488222707833e-06,1.9236026237492104e-06
USA,Activity,Processing of Food products nec,1.0097236466635381e-05,4.762013631452198e-06,4.1744628783829875e-06,2.2327082490431046e-06,4.722995374675302e-06
USA,Activity,Processing of dairy products,1.2565992062416284e-05,1.2094840687980213e-05,7.531581908366573e-06,3.6289452038942464e-06,5.8459643338773225e-06
USA,Activity,Processing of meat cattle,1.879803782048214e-06,9.28116274561102e-07,8.405518690928634e-07,4.538733411959869e-07,9.00789318309753e-07
USA,Activity,Processing of meat pigs,9.71399731938775e-07,5.181466449672237e-07,4.4640051515368416e-07,2.409755160257504e-07,4.69527501012322e-07
USA,Activity,Processing of meat poultry,8.067626343012574e-07,5.538592854159104e-07,4.707988103040479e-07,2.560574050069901e-07,4.2574665517785977e-07
USA,Activity,Processing of nuclear fuel,6.6937440988576575e-09,6.032664442978567e-09,4.319253342581986e-09,1.9794055940842422e-09,3.1322987061854838e-09
USA,Activity,Processing vegetable oils and fats,4.219698590521624e-05,1.8719974309274507e-05,1.653439990533712e-05,8.765413946206205e-06,1.956866384263907e-05
USA,Activity,Production of electricity by Geothermal,6.491949945807401e-07,5.890700284819228e-09,5.1275117429024135e-09,2.7611365368611773e-09,2.6571510203299426e-07
USA,Activity,Production of electricity by biomass and waste,0.0,0.0,0.0,0.0,0.0
USA,Activity,Production of electricity by coal,0.10514692257802614,0.0025960533758021005,0.002237837899413709,0.001202743081776137,0.04323869647357387
USA,Activity,Production of electricity by gas,0.08165188442517271,0.0007462529830637077,0.0006449844407177834,0.000346907401287223,0.033415000056744616
USA,Activity,Production of electricity by hydro,0.0,0.0,0.0,0.0,0.0
USA,Activity,Production of electricity by nuclear,3.38587853453935e-05,3.125978363746509e-07,2.6165675663197654e-07,1.4076063210026362e-07,1.385748791278105e-05
USA,Activity,Production of electricity by petroleum and other oil derivatives,0.001462302003183086,2.2338205158938346e-05,1.9854272471219537e-05,1.0958519178909812e-05,0.000599828398806576
USA,Activity,Production of electricity by solar photovoltaic,0.0,0.0,0.0,0.0,0.0
USA,Activity,Production of electricity by solar thermal,0.0,0.0,0.0,0.0,0.0
USA,Activity,"Production of electricity by tide, wave, ocean",0.0,0.0,0.0,0.0,0.0
USA,Activity,Production of electricity by wind,0.0,0.0,0.0,0.0,0.0
USA,Activity,Production of electricity nec,1.0154500342283479e-05,9.618493171929719e-08,8.354093590786171e-08,4.4982466177363546e-08,4.1571316026073595e-06
USA,Activity,Production of meat products nec,2.8480911279405236e-05,1.308843589664989e-05,1.1072194832396713e-05,5.8192676999210214e-06,1.3221906865113388e-05
USA,Activity,Production of offshore wind plants,0.0,0.0,0.0,0.0,0.0
USA,Activity,Production of onshore wind plants,0.0,0.0,0.0,0.0,0.0
USA,Activity,Production of photovoltaic plants,0.0,0.0,0.0,0.0,0.0
USA,Activity,Public administration and defence; compulsory social security (75),2.317582385028934e-05,2.074937421599508e-06,1.7493023507202272e-06,1.2034928711309952e-06,1.0010700904407112e-05
USA,Activity,"Publishing, printing and reproduction of recorded media (22)",4.569640305012928e-05,2.6815289889187413e-05,2.3821668161776678e-05,1.667871490689488e-05,2.4766494131745015e-05
USA,Activity,Pulp,3.383265837638473e-05,2.0408330378097403e-05,1.424498927611193e-05,7.405364725583049e-06,1.5511608281351105e-05
USA,Activity,Quarrying of sand and clay,0.0001708640610198808,2.1197829016135234e-05,1.9076113354966952e-05,8.652482759751157e-06,7.210612742017806e-05
USA,Activity,Quarrying of stone,5.468275643137386e-05,8.037002957078895e-06,8.529597812542395e-06,4.613630768996826e-06,2.3693329366328426e-05
USA,Activity,Raw milk,2.357890919936298e-06,2.2667474085958837e-06,1.412166594200041e-06,6.806909103595279e-07,1.0970495236028361e-06
USA,Activity,Re-processing of ash into clinker,0.0,0.0,0.0,0.0,0.0
USA,Activity,Re-processing of secondary aluminium into new aluminium,0.0,0.0,0.0,0.0,0.0
USA,Activity,Re-processing of secondary construction material into aggregates,0.0,0.0,0.0,0.0,0.0
USA,Activity,Re-processing of secondary copper into new copper,0.0,0.0,0.0,0.0,0.0
USA,Activity,Re-processing of secondary glass into new glass,0.0,0.0,0.0,0.0,0.0
USA,Activity,"Re-processing of secondary lead into new lead, zinc and tin",0.0,0.0,0.0,0.0,0.0
USA,Activity,Re-processing of secondary other non-ferrous metals into new other non-ferrous metals,0.0,0.0,0.0,0.0,0.0
USA,Activity,Re-processing of secondary paper into new pulp,0.0,0.0,0.0,0.0,0.0
USA,Activity,Re-processing of secondary plastic into new plastic,0.0,0.0,0.0,0.0,0.0
USA,Activity,Re-processing of secondary preciuos metals into new preciuos metals,0.0,0.0,0.0,0.0,0.0
USA,Activity,Re-processing of secondary steel into new steel,0.0,0.0,0.0,0.0,0.0
USA,Activity,Re-processing of secondary wood material into new wood material,0.0,0.0,0.0,0.0,0.0
USA,Activity,Real estate activities (70),9.380597555970417e-06,5.5743730311413694e-06,5.086713262270035e-06,3.4646200297401653e-06,5.350024911679749e-06
USA,Activity,"Recreational, cultural and sporting activities (92)",4.403909545744813e-06,2.3738074652855004e-06,2.1299145556616044e-06,1.4857323411915414e-06,2.3392677557735454e-06
USA,Activity,Recycling of bottles by direct reuse,0.0,0.0,0.0,0.0,0.0
USA,Activity,Recycling of waste and scrap,0.0004341421204492162,0.00014925407813416817,0.00012749310056975845,6.607564327946951e-05,0.00019443767345594349
USA,Activity,Renting of machinery and equipment without operator and of personal and household goods (71),1.816843470989703e-05,7.826225973146022e-06,6.969278435370954e-06,4.379456223381533e-06,8.93243073089377e-06
USA,Activity,Research and development (73),1.2894389084912412e-05,1.3981888516005132e-05,1.1176902031204233e-05,5.403567322952513e-06,6.485625086098612e-06
USA,Activity,Retail sale of automotive fuel,4.1221333585950004e-07,3.285382806244215e-07,3.487983556723695e-07,2.1030471030253998e-07,3.0406863303468834e-06
USA,Activity,"Retail trade, except of motor vehicles and motorcycles; repair of personal and household goods (52)",2.3372818151661072e-06,4.851056633199854e-07,4.058006386469223e-07,2.234628604472346e-07,1.0636340186790701e-06
USA,Activity,"Sale, maintenance, repair of motor vehicles, motor vehicles parts, motorcycles, motor cycles parts and accessoiries",1.671770383758084e-05,3.5234471323234924e-06,2.9750740769556853e-06,1.6372263493353767e-06,7.403119257168931e-06
USA,Activity,Sea and coastal water transport,0.00042110142551938503,0.0001440422393698929,0.0003016040325449347,9.150350461714722e-05,0.00019807530205532206
USA,Activity,Steam and hot water supply,0.0006376450513235057,0.0001940815850228669,0.0001757729542480702,0.00010082062281754052,0.00028986426762470693
USA,Activity,Sugar refining,1.2121017473675383e-06,7.673407671961461e-07,6.782712234688116e-07,3.6532379750193203e-07,6.175881646920575e-07
USA,Activity,Supporting and auxiliary transport activities; activities of travel agencies (63),9.200000924102284e-05,3.938441268556138e-05,4.661306339238259e-05,2.2667726709236378e-05,4.543330807808247e-05
