EU27+UK,Activity,Activities auxiliary to financial intermediation (67),7.617459229709002e-05,0.00011046286763163218,0.00011426170728199108,0.00012077409929547648,7.73633198884135e-05
EU27+UK,Activity,Activities of membership organisation n.e.c. (91),7.897770245723344e-06,1.192073195437645e-05,1.198549716548568e-05,2.9558217561769775e-05,1.6162389659444534e-05
EU27+UK,Activity,Air transport (62),0.0023543456287596614,0.00358446435730366,0.0035677904374786765,0.0026711891962108683,0.0018493168631502127
EU27+UK,Activity,Aluminium production,0.0016475422225112205,0.0005875236052679581,0.0005348239523896374,0.00015865235240223013,0.0005572272159847084
EU27+UK,Activity,Animal products nec,1.318127764133157e-05,2.2177552931333598e-05,2.3790108286010344e-05,1.376041401652367e-05,1.0738644193511576e-05
EU27+UK,Activity,"Biogasification of food waste, incl. land application",7.095382451762677e-07,1.137455386428903e-06,1.2096334241725168e-06,8.375549714231068e-07,4.4882837198146914e-07
EU27+UK,Activity,"Biogasification of paper, incl. land application",1.6176378543163095e-07,2.4181069527010954e-07,2.518497606328807e-07,1.572976604566072e-07,9.260914351549841e-08
EU27+UK,Activity,"Biogasification of sewage slugde, incl. land application",4.774462196781317e-06,7.066935435264879e-06,7.322719316244067e-06,3.950124719159775e-06,2.749252760282363e-06
EU27+UK,Activity,Casting of metals,0.0013230585225951362,0.002865526395457215,0.002591108737154807,0.0009644334795752368,0.0007665287534100377
EU27+UK,Activity,Cattle farming,1.4675987230332738e-05,2.529766619230546e-05,2.554424133430456e-05,1.2594497143164673e-05,9.001684006358934e-06
EU27+UK,Activity,Chemicals nec,0.0010839382605394865,0.011684865454410227,0.008459351331068092,0.002365955961984178,0.0005601099669577396
EU27+UK,Activity,"Collection, purification and distribution of water (41)",0.00014709868496113688,0.00012424503002486472,0.00012715199541056286,0.00019429573577289794,0.00011301469601263382
EU27+UK,Activity,"Composting of food waste, incl. land application",1.2364003670930073e-05,1.5114353612491334e-05,1.6078286482135423e-05,1.3361785725471004e-05,7.596587549300103e-06
EU27+UK,Activity,"Composting of paper and wood, incl. land application",3.552230548275232e-08,4.4079752379263286e-08,4.590529358581513e-08,2.7215155825533817e-08,2.0375535050413923e-08
EU27+UK,Activity,Computer and related activities (72),0.00013735739883975252,0.0002171656146679521,0.00020972817041650305,0.00016464963491079297,0.00010898362312446983
EU27+UK,Activity,Construction (45),0.004269520539736591,0.0005859083909550293,0.0022029406558775424,0.0007004332755523076,0.0017127744224207306
EU27+UK,Activity,Copper production,0.00030398981442310985,0.000712208761487985,0.0006212252806223831,0.00021019993549348836,0.00015169209568568568
EU27+UK,Activity,Cultivation of cereal grains nec,5.264721836884917e-05,9.61126629023756e-05,9.412648261981656e-05,4.182461904133255e-05,3.0929771039198615e-05
EU27+UK,Activity,Cultivation of crops nec,1.4042668676176869e-05,1.1636852451025255e-05,1.3684916557280258e-05,6.409417712972033e-06,6.934148327239164e-06
EU27+UK,Activity,Cultivation of oil seeds,1.8185451899979506e-05,3.74913155962566e-05,3.770546258271832e-05,1.6229484891447276e-05,1.1089579715952255e-05
EU27+UK,Activity,Cultivation of paddy rice,1.1510306257779487e-05,2.5031885417444656e-05,2.5147031769677467e-05,1.0247902162584047e-05,6.6135740182142e-06
EU27+UK,Activity,Cultivation of plant-based fibers,1.2036894768289939e-05,5.462510450779828e-06,5.147705103851973e-06,2.330539129604072e-06,4.571592059534338e-06
EU27+UK,Activity,"Cultivation of sugar cane, sugar beet",7.72724221202e-06,2.0751241724363455e-05,1.8969570094852034e-05,7.649511812300589e-06,4.74196152890472e-06
EU27+UK,Activity,"Cultivation of vegetables, fruit, nuts",2.3531535332368128e-05,4.6592464649391205e-05,4.6041650069857714e-05,2.0287296053236194e-05,1.3803691280058881e-05
EU27+UK,Activity,Cultivation of wheat,5.648813887437375e-05,9.741799876245548e-05,9.298659469416291e-05,4.3562809690924796e-05,3.3109914545115125e-05
EU27+UK,Activity,Distribution and trade of electricity,0.0002468202181518165,0.00031414511178777624,0.00032855873931304807,0.0002350093533961864,0.0001736875829601787
EU27+UK,Activity,Education (80),2.36586796557019e-05,3.579172691081079e-05,3.3072542804697496e-05,3.9945962088166375e-05,2.155355854384735e-05
EU27+UK,Activity,Extra-territorial organizations and bodies,1.0608667036865388e-10,1.1522549369493111e-11,1.1380493170471062e-11,7.579892909346646e-12,3.662691601788038e-11
EU27+UK,Activity,"Extraction of crude petroleum and services related to crude oil extraction, excluding surveying",0.0007789280749789675,0.0006044499662274729,0.0006326826048991626,0.0018572927847952444,0.0010762025452692359
EU27+UK,Activity,"Extraction of natural gas and services related to natural gas extraction, excluding surveying",0.0036090913831693444,0.0032124890284406663,0.0031156227232817923,0.00425505405726772,0.0029265039332960503
EU27+UK,Activity,"Extraction, liquefaction, and regasification of other petroleum and gaseous materials",5.74569516046147e-05,1.9167781598399366e-05,2.252252166956112e-05,2.494613912117873e-05,2.8256356508539695e-05
EU27+UK,Activity,"Financial intermediation, except insurance and pension funding (65)",0.000356491098130394,0.0004912766455783496,0.0005000979790856639,0.0006352357665758117,0.0003645207275059019
EU27+UK,Activity,"Fishing, operating of fish hatcheries and fish farms; service activities incidental to fishing (05)",2.6679167267376978e-05,2.3071008508609243e-05,3.3942804699862356e-05,1.3685608166208922e-05,1.326589919805932e-05
EU27+UK,Activity,"Forestry, logging and related service activities (02)",0.00014315566040528434,0.00011373653205823523,0.00013979860928810015,5.7902552239046087e-05,6.46946922604351e-05
EU27+UK,Activity,Health and social work (85),8.40380733550636e-06,1.756167897420833e-05,1.549377787732531e-05,1.2727015760497073e-05,7.553433705348306e-06
EU27+UK,Activity,Hotels and restaurants (55),8.349378710765494e-05,0.00010977835569548781,0.00011410496546518542,6.877104353754233e-05,5.8458051103293684e-05
EU27+UK,Activity,Incineration of waste: Food,1.6013850073311077e-05,1.4835566544784654e-05,1.5456308666733743e-05,9.804170125418825e-06,7.63151895623651e-06
EU27+UK,Activity,Incineration of waste: Metals and Inert materials,0.0002466181900455478,0.0002964008732008216,0.0003370445320895556,0.0002229789790124543,0.00014037400165219988
EU27+UK,Activity,Incineration of waste: Oil/Hazardous waste,3.8124662065960374e-05,3.6917030209694974e-05,3.8937875441796194e-05,2.398294161060829e-05,1.901016429450376e-05
EU27+UK,Activity,Incineration of waste: Paper,1.2272958757285854e-05,1.3624410778586683e-05,1.4133538250911335e-05,9.18386677101355e-06,6.439706785062979e-06
EU27+UK,Activity,Incineration of waste: Plastic,9.597626793398852e-05,0.00011139565444619727,0.0001168856309900973,8.774813288019368e-05,5.418207469260165e-05
EU27+UK,Activity,Incineration of waste: Textiles,9.167211868042998e-05,9.095587904209233e-05,9.361360735029636e-05,5.721676610895355e-05,4.37679664867876e-05
EU27+UK,Activity,Incineration of waste: Wood,5.877843796603866e-06,4.857082368030634e-06,5.083874009793456e-06,3.204405900282589e-06,2.752092672489504e-06
EU27+UK,Activity,Inland water transport,0.0005785374109648041,0.0009645615131210533,0.001105804896326904,0.000551719165673513,0.00042638004089833265
EU27+UK,Activity,"Insurance and pension funding, except compulsory social security (66)",6.245768268026705e-05,8.437057184831997e-05,9.140307003639654e-05,0.00011894496112954164,0.00010351835615909504
EU27+UK,Activity,Landfill of waste: Food,7.71878939553656e-06,8.496171530594429e-06,9.499886680652746e-06,5.86987818211512e-06,4.244890976827974e-06
EU27+UK,Activity,Landfill of waste: Inert/metal/hazardous,8.490634941089586e-06,1.1837859109280569e-05,1.2643479184025473e-05,7.379905126274267e-06,4.837323040083098e-06
EU27+UK,Activity,Landfill of waste: Paper,5.733544777913002e-06,6.29544668292951e-06,6.958974067666118e-06,4.25787494737708e-06,3.1453024468319494e-06
EU27+UK,Activity,Landfill of waste: Plastic,1.4653733623156292e-06,1.848725238913536e-06,1.9747161080873824e-06,1.132091680388082e-06,7.981084635331406e-07
EU27+UK,Activity,Landfill of waste: Textiles,1.2974459200238747e-06,1.5276211475177905e-06,1.683124122814781e-06,1.0267552726603448e-06,7.125950713637647e-07
EU27+UK,Activity,Landfill of waste: Wood,1.692238073766913e-06,2.3515954253664653e-06,2.475804683395639e-06,1.5069196444968662e-06,9.692167725914965e-07
EU27+UK,Activity,"Lead, zinc and tin production",3.806344961696993e-05,9.687893891321581e-05,9.886491967979638e-05,3.0888914939238745e-05,1.9818977013122307e-05
EU27+UK,Activity,Manufacture of basic iron and steel and of ferro-alloys and first products thereof,0.0026131191437586635,0.008309235926127074,0.007790910486270659,0.00246459828987194,0.0014229783847770174
EU27+UK,Activity,Manufacture of beverages,3.924294258500129e-05,0.00010062855410344852,9.882423673595782e-05,3.768079335994642e-05,2.2369384539480975e-05
EU27+UK,Activity,"Manufacture of bricks, tiles and construction products, in baked clay",0.0008829525986827826,0.0002763278612051909,0.0006065497239569374,0.0003484617317629428,0.0004667703830026413
EU27+UK,Activity,"Manufacture of cement, lime and plaster",0.00484239677990654,0.0012779238156886495,0.002985315432448479,0.0014066628157135403,0.0023297686308891333
EU27+UK,Activity,Manufacture of ceramic goods,0.0003979537622907083,0.00022762911157928083,0.0003299239154050688,0.0001520344747487532,0.00020010415428324413
EU27+UK,Activity,Manufacture of coke oven products,0.0013397692901205365,0.00240574638446088,0.002305689857424716,0.0008285154104894852,0.0006603079307448879
EU27+UK,Activity,Manufacture of electrical machinery and apparatus n.e.c. (31),0.002153011301076477,0.0025890168772939796,0.0015469972469332046,0.0006403065368945007,0.0008710590684048562
EU27+UK,Activity,"Manufacture of fabricated metal products, except machinery and equipment (28)",0.0004923586713077324,0.005005525829206623,0.004832564507843007,0.0011150584611914472,0.00024306873274322158
EU27+UK,Activity,Manufacture of fish products,4.1320884714915956e-05,9.667158064859414e-05,9.879910590161318e-05,3.727973469779191e-05,2.3010009323491738e-05
EU27+UK,Activity,Manufacture of furniture; manufacturing n.e.c. (36),0.0002492993055376728,0.0007130595122252989,0.0007184016585581131,0.0002926215243127506,0.00012995243471703615
EU27+UK,Activity,Manufacture of gas; distribution of gaseous fuels through mains,0.012740095513123812,0.005353370230842046,0.005667163725199829,0.0451015641786361,0.026117704493467026
EU27+UK,Activity,Manufacture of glass and glass products,0.002043296548361006,0.052937758235668604,0.03568724118601244,0.008198676733843217,0.0008232357519748821
EU27+UK,Activity,Manufacture of machinery and equipment n.e.c. (29),0.00032719615538405336,0.0006141479392751663,0.0005221546976911987,0.00019002409360324997,0.00014906572794756451
EU27+UK,Activity,"Manufacture of medical, precision and optical instruments, watches and clocks (33)",0.0001855377524995208,0.00034199337285257446,0.00028601246909497303,0.00013688560926441526,0.0001033094578068031
EU27+UK,Activity,"Manufacture of motor vehicles, trailers and semi-trailers (34)",0.00011170141431981571,0.0002498724587383274,0.00022676886720860635,8.157768653801914e-05,6.22176602668573e-05
EU27+UK,Activity,Manufacture of office machinery and computers (30),3.242734328396186e-05,5.7958273170312816e-05,4.8635660235120974e-05,2.2501643605314036e-05,1.774786935474025e-05
EU27+UK,Activity,Manufacture of other non-metallic mineral products n.e.c.,0.004046479803745934,0.015613282497333002,0.0474787489711597,0.0075685089931417015,0.0016091008357419314
EU27+UK,Activity,Manufacture of other transport equipment (35),0.00019913426787123903,0.0004520959702536677,0.00038781063026264924,0.00012976276839884277,9.411321735700379e-05
EU27+UK,Activity,"Manufacture of radio, television and communication equipment and apparatus (32)",0.0003537164580851127,0.0005468191300390456,0.00043216868281342876,0.00022493687652028804,0.0001741422457750036
EU27+UK,Activity,Manufacture of rubber and plastic products (25),9.59842481514196e-05,0.00016294696759881799,0.00015820555678819836,5.975250844791655e-05,4.860417273726062e-05
EU27+UK,Activity,Manufacture of textiles (17),2.8405222164706506e-05,6.316068308085192e-05,5.742295548630109e-05,1.9838556254684606e-05,1.4028199531055427e-05
EU27+UK,Activity,Manufacture of tobacco products (16),2.412161955297537e-05,3.178073920751186e-05,2.9884922346141064e-05,1.3373193185076304e-05,1.2211476351884882e-05
EU27+UK,Activity,Manufacture of wearing apparel; dressing and dyeing of fur (18),1.8469169334321995e-05,3.5029549260202655e-05,3.5057234138560326e-05,1.5488814569325536e-05,1.0900816900040699e-05
EU27+UK,Activity,"Manufacture of wood and of products of wood and cork, except furniture; manufacture of articles of straw and plaiting materials (20)",0.0002785694144259072,0.0002178882715942392,0.00028494457120526286,0.00010791860001097724,0.00012550735883024654
EU27+UK,Activity,"Manure treatment (biogas), storage and land application",5.571611510737376e-07,1.2126064315383322e-06,1.21823641799553e-06,4.952874944278155e-07,3.1960477556206294e-07
EU27+UK,Activity,"Manure treatment (conventional), storage and land application",6.304541926233252e-07,1.3721215258674301e-06,1.3784921218063475e-06,5.604412238975227e-07,3.6164791882424763e-07
EU27+UK,Activity,Meat animals nec,7.3742973386396676e-06,1.3078066491439842e-05,1.3426439317440695e-05,7.528701244480377e-06,5.661203041836207e-06
EU27+UK,Activity,Mining of aluminium ores and concentrates,0.00017231164812195075,0.0004241920597046268,0.00034063544275841456,8.369275304140946e-05,6.272470190265199e-05
EU27+UK,Activity,"Mining of chemical and fertilizer minerals, production of salt, other mining and quarrying n.e.c.",4.2288597426063494e-05,0.00021796147874866687,0.00021599478433326525,5.545829150101219e-05,2.1359951601703398e-05
EU27+UK,Activity,Mining of coal and lignite; extraction of peat (10),0.004373769230794171,0.0012053715709678316,0.0012758255873058094,0.000950703276621549,0.001722639460890201
EU27+UK,Activity,Mining of copper ores and concentrates,0.0005543191511889993,0.0007840592360770069,0.0008577698215048257,0.0002597912449124613,0.00024322373582087928
EU27+UK,Activity,Mining of iron ores,0.0002733366339159462,0.0006071688839568208,0.000581557241890938,0.0004176660576445538,0.00024734501887397497
EU27+UK,Activity,"Mining of lead, zinc and tin ores and concentrates",2.2734606547788493e-05,4.514584981434265e-05,4.727148899520593e-05,1.461933599452519e-05,1.0826682390900535e-05
EU27+UK,Activity,Mining of nickel ores and concentrates,2.0279802200526066e-05,4.367303173594752e-05,5.7390163636195276e-05,2.361481180500412e-05,1.3951788949454595e-05
EU27+UK,Activity,Mining of other non-ferrous metal ores and concentrates,0.00010106365057928366,0.00011691203442149156,0.00012069562996694295,0.00016709208153306435,0.00010823283919487475
EU27+UK,Activity,Mining of precious metal ores and concentrates,0.00017905541103595027,0.00011789909960409846,0.00013154973292987503,4.837478863299126e-05,7.169408653137581e-05
EU27+UK,Activity,Mining of uranium and thorium ores (12),0.00013580397378302325,0.00019175209926278392,0.00019496655017969255,9.307305748598018e-05,7.134924337555717e-05
EU27+UK,Activity,N-fertiliser,2.4998711237439e-05,3.125119537730375e-05,3.1925288848968544e-05,4.482612812730467e-05,1.2777596302511607e-05
EU27+UK,Activity,Other business activities (74),0.0012952363456386756,0.002938350491059588,0.002585174470549103,0.0013725439518669968,0.0008504795853354299
EU27+UK,Activity,Other land transport,0.00025100429537214226,0.0003333406583866179,0.000611452482724394,0.000317054829910303,0.0002287242562430356
EU27+UK,Activity,Other non-ferrous metal production,0.00013083051241394178,0.00020841763345432038,0.00019573316855865425,9.817402610426435e-05,8.289886928040716e-05
EU27+UK,Activity,Other service activities (93),2.5076302250174635e-05,3.3833351528153306e-05,3.2706221896447744e-05,2.6267900507488646e-05,2.204075937077474e-05
EU27+UK,Activity,P- and other fertiliser,5.2423304704455165e-05,6.886468351789843e-05,6.818838383706511e-05,4.9279300955482656e-05,2.698712392885185e-05
EU27+UK,Activity,Paper,0.000266662410138463,0.0005384794095004686,0.00048557780999425,0.0002532950149900853,0.00015333931720250895
EU27+UK,Activity,Petroleum Refinery,0.002643067418414174,0.002740917360064906,0.0032376237573148977,0.004037257218412099,0.001782133571401541
EU27+UK,Activity,Pigs farming,1.6625190755333754e-05,3.407597242452979e-05,3.199333671886978e-05,1.5315107306428915e-05,1.0434460774542863e-05
EU27+UK,Activity,"Plastics, basic",0.0010488671473637028,0.0022530952031340817,0.0020512266797307705,0.0008277449138705973,0.0005344534457098932
EU27+UK,Activity,Post and telecommunications (64),0.00031906703015293107,0.0004055783210949591,0.00041278286185715335,0.0004604273473539668,0.00028076419882567595
EU27+UK,Activity,Poultry farming,9.868418170987708e-06,1.7644144356910583e-05,1.8038122994601966e-05,8.893467293414942e-06,6.282330707920668e-06
EU27+UK,Activity,Precious metals production,0.0001448686341555434,0.00010253491431764311,9.28301035378388e-05,3.700866813893763e-05,5.8269831388682935e-05
EU27+UK,Activity,Private households with employed persons (95),4.784375139947937e-06,9.239829097626976e-06,8.07254220321015e-06,4.77397838201542e-06,3.036889593515023e-06
EU27+UK,Activity,Processed rice,2.140201709517476e-06,4.1030758091352495e-06,4.069424326073928e-06,1.9486000142856624e-06,1.370677740340205e-06
EU27+UK,Activity,Processing of Food products nec,7.195893923144936e-05,0.00017381890266504238,0.00017698355117902521,6.300822892892359e-05,3.9659625735678964e-05
EU27+UK,Activity,Processing of dairy products,2.6934408497990978e-05,7.456883859852411e-05,7.311517284106216e-05,2.716981235215312e-05,1.6424478486379134e-05
EU27+UK,Activity,Processing of meat cattle,5.5485066907514095e-06,1.1489320170415108e-05,1.1708585278667562e-05,5.423567449385181e-06,3.6886401619454307e-06
EU27+UK,Activity,Processing of meat pigs,1.1284012254229541e-05,2.6020053958408e-05,2.337112198193289e-05,1.1174127694864489e-05,7.420817551678345e-06
EU27+UK,Activity,Processing of meat poultry,2.0787734459934392e-06,4.654117668843212e-06,4.3718062664378575e-06,1.987533363060932e-06,1.3603225018456969e-06
EU27+UK,Activity,Processing of nuclear fuel,6.873014552083603e-06,9.69313374785506e-06,8.624700355132902e-06,3.910464621434943e-06,3.301615862351349e-06
EU27+UK,Activity,Processing vegetable oils and fats,3.0205391204437307e-06,5.626859584956956e-06,5.583788101374355e-06,2.437601655592261e-06,1.658924962733409e-06
EU27+UK,Activity,Production of electricity by Geothermal,0.000143086830014063,1.1283571283990737e-05,1.157217474152265e-05,3.914124968345304e-06,4.6563222715784306e-05
EU27+UK,Activity,Production of electricity by biomass and waste,0.0,0.0,0.0,0.0,0.0
EU27+UK,Activity,Production of electricity by coal,0.2314890644123341,0.039352983575142005,0.04018415171378134,0.02779348151887233,0.08446167176655844
EU27+UK,Activity,Production of electricity by gas,0.03575164193695866,0.007269547826190952,0.007568084610545211,0.006206417255257303,0.013883083809641771
EU27+UK,Activity,Production of electricity by hydro,0.0,0.0,0.0,0.0,0.0
EU27+UK,Activity,Production of electricity by nuclear,0.00018040727352466353,2.055441401043028e-05,2.0648521502329015e-05,1.3443756148463057e-05,6.250743967069164e-05
EU27+UK,Activity,Production of electricity by petroleum and other oil derivatives,0.0049476607018539235,0.0013692914112444956,0.0013285881030559422,0.0013958057975984326,0.0021689891557933904
EU27+UK,Activity,Production of electricity by solar photovoltaic,0.0,0.0,0.0,0.0,0.0
EU27+UK,Activity,Production of electricity by solar thermal,0.0,0.0,0.0,0.0,0.0
EU27+UK,Activity,"Production of electricity by tide, wave, ocean",0.0,0.0,0.0,0.0,0.0
EU27+UK,Activity,Production of electricity by wind,0.0,0.0,0.0,0.0,0.0
EU27+UK,Activity,Production of electricity nec,0.0008676118638291449,0.0004974550924818901,0.000514050682846871,0.0003631609018695924,0.0004186269104588464
EU27+UK,Activity,Production of meat products nec,1.1487641341733047e-06,2.123371832467826e-06,2.1019201361438808e-06,9.937917739673724e-07,6.907409670373184e-07
EU27+UK,Activity,Production of offshore wind plants,0.0,0.0,0.0,0.0,0.0
EU27+UK,Activity,Production of onshore wind plants,0.0,0.0,0.0,0.0,0.0
EU27+UK,Activity,Production of photovoltaic plants,0.0,0.0,0.0,0.0,0.0
EU27+UK,Activity,Public administration and defence; compulsory social security (75),8.972401201961823e-05,0.00012032183957866075,0.00011907968027343873,0.00015273599062241071,0.00018011081408882536
EU27+UK,Activity,"Publishing, printing and reproduction of recorded media (22)",0.00029359286527092486,0.0005626340724734415,0.0005279683011203465,0.0004245563150089471,0.000266401097170763
EU27+UK,Activity,Pulp,0.0001511237413420283,0.00024300385940936642,0.0002207376265344601,0.00011393336569218325,8.080844195191437e-05
EU27+UK,Activity,Quarrying of sand and clay,0.00025261531596886417,0.0005208093744402421,0.0005132202465532649,0.00015668830894922264,0.0001248016882198016
EU27+UK,Activity,Quarrying of stone,0.00028765519249599034,0.0005421024965446164,0.0007486955699940577,0.0001859231395691214,0.00013804942106734829
EU27+UK,Activity,Raw milk,1.5690200599474064e-05,3.668983900461021e-05,3.641206706533244e-05,1.4664667093438409e-05,9.406198263721009e-06
EU27+UK,Activity,Re-processing of ash into clinker,0.0014116791684935463,0.00040805253851513705,0.0009004542305244669,0.00041779549436212995,0.0006797772028944338
EU27+UK,Activity,Re-processing of secondary aluminium into new aluminium,0.0018118054446745427,0.0006536635628461539,0.000594612142734854,0.00017873871535420592,0.0006142315529017162
EU27+UK,Activity,Re-processing of secondary construction material into aggregates,0.0012196935103257912,0.00017246005440810973,0.0006353217770698449,0.00020222305933420415,0.0004901240784404972
EU27+UK,Activity,Re-processing of secondary copper into new copper,0.00015818474511392235,0.0003793859721329683,0.00033184625024310045,0.00011150937382491618,7.909482790145118e-05
EU27+UK,Activity,Re-processing of secondary glass into new glass,0.000846649769088506,0.021913254182081485,0.014773454108839342,0.0033940297117133677,0.00034109893544362574
EU27+UK,Activity,"Re-processing of secondary lead into new lead, zinc and tin",7.20838146698939e-05,0.00017129802437374907,0.00017771808917342973,5.78425663154408e-05,3.819853056661721e-05
EU27+UK,Activity,Re-processing of secondary other non-ferrous metals into new other non-ferrous metals,2.88655660674117e-05,4.722123556881821e-05,4.4509768654967526e-05,2.2232115877543777e-05,1.823309229581731e-05
EU27+UK,Activity,Re-processing of secondary paper into new pulp,7.033068156734743e-05,0.00012951171302705625,0.00011766070007352276,6.021881614840168e-05,3.9391138408525576e-05
EU27+UK,Activity,Re-processing of secondary plastic into new plastic,0.00022096219209782303,0.00048000713170868174,0.0004406453250658481,0.00018647086271977615,0.00011961849501355367
EU27+UK,Activity,Re-processing of secondary preciuos metals into new preciuos metals,6.144120467076521e-05,7.869009091311114e-05,7.375151952584085e-05,3.038433570967902e-05,2.5164168069168037e-05
EU27+UK,Activity,Re-processing of secondary steel into new steel,0.0018807403078977354,0.006134403220177427,0.005760873785556927,0.001818779223028314,0.001029222464363218
EU27+UK,Activity,Re-processing of secondary wood material into new wood material,0.00016734653366116804,0.00013719283096405655,0.00017654292631528976,6.617808379136057e-05,7.544968540913994e-05
EU27+UK,Activity,Real estate activities (70),0.00014356396774663723,0.00018481983111085228,0.00019395209359306025,0.00014050359070484145,0.00012299842440323616
EU27+UK,Activity,"Recreational, cultural and sporting activities (92)",3.7538228377064e-05,6.715050574243345e-05,6.261716978178255e-05,4.35007911629357e-05,2.729379922261351e-05
EU27+UK,Activity,Recycling of bottles by direct reuse,0.0015206775557760532,0.0023846988828461857,0.002311803341857056,0.0022901016037128134,0.0014253842315352528
EU27+UK,Activity,Recycling of waste and scrap,0.002046715048855287,0.0034672942725877042,0.002996521951215929,0.0009451664807225798,0.0008575238720146596
EU27+UK,Activity,Renting of machinery and equipment without operator and of personal and household goods (71),0.0002222063443733032,0.00028672851040285164,0.0003217544627119076,0.00025327124198758265,0.00022226536734009424
EU27+UK,Activity,Research and development (73),6.648444336747173e-05,0.0001526940032854393,0.00012907427501794764,6.82686908187103e-05,3.932882472409505e-05
EU27+UK,Activity,Retail sale of automotive fuel,0.0001873670935446864,0.00023764381392372145,0.00025929393639632773,0.00017259430823536744,0.0001938449398354391
EU27+UK,Activity,"Retail trade, except of motor vehicles and motorcycles; repair of personal and household goods (52)",0.000278180892988277,0.00042169340061991566,0.00040856819745926665,0.00022168183324953553,0.00021414464542338164
EU27+UK,Activity,"Sale, maintenance, repair of motor vehicles, motor vehicles parts, motorcycles, motor cycles parts and accessoiries",0.00018330659039888158,0.00025896351385481663,0.00028462864416715775,0.00023843155327540799,0.0003290430059615204
EU27+UK,Activity,Sea and coastal water transport,0.01541501573572437,0.02707981615691286,0.10372957240100857,0.018132520334342053,0.006919941626578389
EU27+UK,Activity,Steam and hot water supply,0.018838939365323694,0.02038161639429451,0.019850391250180125,0.017131151344661064,0.012697452680889676
EU27+UK,Activity,Sugar refining,2.5470791757681887e-06,5.270694006353604e-06,5.223682343101629e-06,2.3588783101901977e-06,1.6282829296268712e-06
