EU27+UK,Activity,Activities auxiliary to financial intermediation (67),7.187604422811268e-05,0.00010405426120370289,0.00010903704452211179,0.00010853440878525978,7.740856206366562e-05
EU27+UK,Activity,Activities of membership organisation n.e.c. (91),7.233610185879686e-06,1.0969488403786875e-05,1.1006262164643062e-05,2.6862231132760156e-05,1.687855299261156e-05
EU27+UK,Activity,Air transport (62),0.0022779639960997687,0.003529627514037642,0.003506248782684937,0.002475098464152538,0.0019436367728255053
EU27+UK,Activity,Aluminium production,0.0015733260042890603,0.0005595007838249003,0.0005084186404581871,0.000150324513844335,0.0005377873183638205
EU27+UK,Activity,Animal products nec,1.571014388179627e-05,2.6714420281714465e-05,2.863792815391699e-05,1.6610966265216025e-05,1.5206308266481157e-05
EU27+UK,Activity,"Biogasification of food waste, incl. land application",9.560424145642747e-07,1.5666656665369403e-06,1.6592963132016777e-06,1.099399007813852e-06,6.526476958843514e-07
EU27+UK,Activity,"Biogasification of paper, incl. land application",3.3419180510012124e-07,5.050777866766075e-07,5.232434460068229e-07,3.213192554739737e-07,2.071584328206798e-07
EU27+UK,Activity,"Biogasification of sewage slugde, incl. land application",4.776991000057678e-06,7.125947926572611e-06,7.414340799854409e-06,3.886497160814106e-06,2.8996971108958066e-06
EU27+UK,Activity,Casting of metals,0.0013025709999627477,0.0028927627605405187,0.0026185523733645725,0.0009526355309181635,0.0007839175179020361
EU27+UK,Activity,Cattle farming,1.5671038556294624e-05,2.5080296283741228e-05,2.5399518296265103e-05,1.683426726799119e-05,1.2639993579651441e-05
EU27+UK,Activity,Chemicals nec,0.001045001963618545,0.010701165512946198,0.007742813712970287,0.002102789109363984,0.0005214221799354019
EU27+UK,Activity,"Collection, purification and distribution of water (41)",0.00014413106892370909,0.0001256092745085348,0.0001282790897279962,0.00018321176336922004,0.00011561793624717082
EU27+UK,Activity,"Composting of food waste, incl. land application",1.366790599865496e-05,1.5629977145221852e-05,1.6535530665748394e-05,1.2969927597056289e-05,8.38739389313068e-06
EU27+UK,Activity,"Composting of paper and wood, incl. land application",4.0049483543269425e-08,4.8166867912510445e-08,5.0707595075545e-08,2.9689296457953452e-08,2.5005518215428693e-08
EU27+UK,Activity,Computer and related activities (72),0.0001335302571393845,0.00021122896703357327,0.00020471175948691466,0.00015801423780524308,0.00011380956307453903
EU27+UK,Activity,Construction (45),0.004080659867776903,0.0005612698208597894,0.002107983538247584,0.0006681903005585984,0.0016700557830064168
EU27+UK,Activity,Copper production,0.0003048755552568478,0.0007399299180487367,0.0006374677842825021,0.00021162129696549966,0.00015664925315856342
EU27+UK,Activity,Cultivation of cereal grains nec,5.2858395737153375e-05,0.00010406018471546173,0.00010170702512200359,4.6597149044369634e-05,3.927088003711153e-05
EU27+UK,Activity,Cultivation of crops nec,1.2801059247424829e-05,1.2517329481455056e-05,1.436939435709052e-05,6.792704418798651e-06,7.223113176376118e-06
EU27+UK,Activity,Cultivation of oil seeds,1.6697645143596815e-05,3.44773343999374e-05,3.514216193692251e-05,1.5061669756974902e-05,1.1698148248169085e-05
EU27+UK,Activity,Cultivation of paddy rice,1.2419285912198653e-05,2.8544974590998615e-05,2.8533934195698337e-05,1.1247932030587495e-05,7.906997996520265e-06
EU27+UK,Activity,Cultivation of plant-based fibers,4.387832398303552e-06,5.890203536739877e-06,5.373090259827727e-06,2.2153818085143917e-06,2.21633306888205e-06
EU27+UK,Activity,"Cultivation of sugar cane, sugar beet",7.417979327731141e-06,2.0362112811991017e-05,1.8574806401956304e-05,7.213420738689733e-06,5.001619972929421e-06
EU27+UK,Activity,"Cultivation of vegetables, fruit, nuts",2.4291449173069204e-05,4.7932391542109595e-05,4.736878449413877e-05,2.0604690564051554e-05,1.5643140360878406e-05
EU27+UK,Activity,Cultivation of wheat,5.273029848951782e-05,9.637923298423936e-05,9.200058802688967e-05,4.2006046072701044e-05,3.585387693295305e-05
EU27+UK,Activity,Distribution and trade of electricity,0.00023369196394616856,0.000298432036845201,0.0003140930225913874,0.00020928192094249955,0.00017141304546527248
EU27+UK,Activity,Education (80),2.0040980892199257e-05,3.5434509618357835e-05,3.269077530703213e-05,3.7239515529522656e-05,2.1055572428148587e-05
EU27+UK,Activity,Extra-territorial organizations and bodies,1.0209298207014452e-10,1.114730103951543e-11,1.094216371359703e-11,6.784405056430671e-12,3.548927193194744e-11
EU27+UK,Activity,"Extraction of crude petroleum and services related to crude oil extraction, excluding surveying",0.0006724317867222906,0.0005471662213976498,0.0005783234268704971,0.001542733309632685,0.0009716082969873169
EU27+UK,Activity,"Extraction of natural gas and services related to natural gas extraction, excluding surveying",0.003765653999628274,0.0033577687546943653,0.0033299905236377795,0.004205047301807545,0.003146331818709282
EU27+UK,Activity,"Extraction, liquefaction, and regasification of other petroleum and gaseous materials",7.708318718364083e-05,2.508830679264971e-05,2.9342536828627668e-05,3.1204547049565635e-05,3.8316077529307366e-05
EU27+UK,Activity,"Financial intermediation, except insurance and pension funding (65)",0.00035034865922100016,0.0004671083244837246,0.00048154691863244855,0.0005942061145874344,0.00037568943972647123
EU27+UK,Activity,"Fishing, operating of fish hatcheries and fish farms; service activities incidental to fishing (05)",2.57065258655225e-05,2.27039117589011e-05,3.249351646151628e-05,1.3000062810221236e-05,1.3679904696806377e-05
EU27+UK,Activity,"Forestry, logging and related service activities (02)",0.0001504847065043781,0.00011890430217594647,0.0001467443926184208,5.9880684945156395e-05,7.0923020095708e-05
EU27+UK,Activity,Health and social work (85),9.083753641480247e-06,1.744780626367853e-05,1.5715314226033107e-05,1.3071317941807155e-05,8.619045342313825e-06
EU27+UK,Activity,Hotels and restaurants (55),8.711029408275238e-05,0.00011912648319154813,0.0001235350170031976,7.182550958644095e-05,6.654470809745477e-05
EU27+UK,Activity,Incineration of waste: Food,1.4046776511081566e-05,1.5187368322921989e-05,1.5790296498015646e-05,9.741524352444037e-06,7.335797792116681e-06
EU27+UK,Activity,Incineration of waste: Metals and Inert materials,0.00026338143076737157,0.00033026571943257314,0.0003708543499376307,0.00023377561465040471,0.0001576773515067422
EU27+UK,Activity,Incineration of waste: Oil/Hazardous waste,6.1713856751196e-05,5.655074330255655e-05,5.940562564859195e-05,3.548058654300164e-05,3.146039718194006e-05
EU27+UK,Activity,Incineration of waste: Paper,1.2522369290364679e-05,1.3581511732425783e-05,1.422045760447195e-05,9.188584073114546e-06,6.8518644486139746e-06
EU27+UK,Activity,Incineration of waste: Plastic,0.00012600385523791444,0.00012951038844055373,0.0001345068716042046,9.093489541264146e-05,6.719572302521954e-05
EU27+UK,Activity,Incineration of waste: Textiles,9.902557058719641e-05,0.000109721004985441,0.00011421859608161157,6.822920559603447e-05,5.2428994635186334e-05
EU27+UK,Activity,Incineration of waste: Wood,5.764337792994364e-06,5.043767195044325e-06,5.27234412614824e-06,3.2146453022404997e-06,2.882036233441185e-06
EU27+UK,Activity,Inland water transport,0.0006474730319256295,0.0009221894869460993,0.0011179181799850979,0.0005867142142187814,0.0005260531220972757
EU27+UK,Activity,"Insurance and pension funding, except compulsory social security (66)",6.227134697810375e-05,8.465248662638296e-05,9.49340416502995e-05,0.00011931037806194976,0.00011252922723724072
EU27+UK,Activity,Landfill of waste: Food,7.71268836355845e-06,9.14291003016642e-06,1.006231485541428e-05,5.814842589410994e-06,4.409105718029684e-06
EU27+UK,Activity,Landfill of waste: Inert/metal/hazardous,9.27382120170914e-06,1.25537345207519e-05,1.328815319199606e-05,7.480481359972887e-06,5.426745814491925e-06
EU27+UK,Activity,Landfill of waste: Paper,5.726526971025764e-06,6.835049711781962e-06,7.518333277023122e-06,4.469472161008789e-06,3.4022417840965975e-06
EU27+UK,Activity,Landfill of waste: Plastic,1.9180879778774662e-06,2.497931926168262e-06,2.6627137062598272e-06,1.4791036012724727e-06,1.137716983434892e-06
EU27+UK,Activity,Landfill of waste: Textiles,1.7754185104427448e-06,2.1689217170275603e-06,2.362366777115741e-06,1.3955625740724933e-06,1.064863518827783e-06
EU27+UK,Activity,Landfill of waste: Wood,2.3249978351264617e-06,2.9765790389637206e-06,3.219212020636671e-06,1.8614332163716256e-06,1.381523051791132e-06
EU27+UK,Activity,"Lead, zinc and tin production",3.9875373960963975e-05,0.00010459560960441234,0.00010763564623092907,3.360247539453817e-05,2.190127123875974e-05
EU27+UK,Activity,Manufacture of basic iron and steel and of ferro-alloys and first products thereof,0.0025376571169560794,0.008399351231689388,0.007878602554831554,0.0024372552035205972,0.0014343841127860786
EU27+UK,Activity,Manufacture of beverages,3.7615742740189954e-05,9.625050800828674e-05,9.322787303867257e-05,3.586376035708783e-05,2.3715821730855577e-05
EU27+UK,Activity,"Manufacture of bricks, tiles and construction products, in baked clay",0.0009274028165397041,0.0002882714679855632,0.0006337003677499603,0.000357668144516634,0.0005062638553801443
EU27+UK,Activity,"Manufacture of cement, lime and plaster",0.0047514491186337665,0.001233317958015885,0.0029147195819616964,0.0013651445883162622,0.002358454281678718
EU27+UK,Activity,Manufacture of ceramic goods,0.0004375163336269182,0.0002429269920616221,0.00035602886749239334,0.00016246363589490537,0.00022740749190557007
EU27+UK,Activity,Manufacture of coke oven products,0.001379983364673617,0.002575379334166238,0.002443956389673086,0.00082905759125419,0.0006729146457571121
EU27+UK,Activity,Manufacture of electrical machinery and apparatus n.e.c. (31),0.0020691774532560826,0.002479071301750499,0.0014823420402682813,0.0006088600049017561,0.0008595539766163919
EU27+UK,Activity,"Manufacture of fabricated metal products, except machinery and equipment (28)",0.0005026604553797747,0.0049692512861326315,0.004800455110556863,0.0011090405274193883,0.00025694025022389595
EU27+UK,Activity,Manufacture of fish products,3.6203271559406484e-05,7.948343277255497e-05,8.150346334560747e-05,3.14672371928787e-05,2.1750033705331735e-05
EU27+UK,Activity,Manufacture of furniture; manufacturing n.e.c. (36),0.00022595525860616034,0.0006489478976968194,0.0006530370671135098,0.0002553481917807881,0.00012371189508056312
EU27+UK,Activity,Manufacture of gas; distribution of gaseous fuels through mains,0.010431593143304208,0.00479689423373308,0.005070784276392081,0.0386475129707692,0.024186393937496147
EU27+UK,Activity,Manufacture of glass and glass products,0.0021208495200581,0.054396634435594095,0.03667427041628882,0.008468800189991663,0.0008807695328292912
EU27+UK,Activity,Manufacture of machinery and equipment n.e.c. (29),0.00031515575734165273,0.0006004004749356391,0.0005110916374153537,0.0001859271839709114,0.00015116757882874796
EU27+UK,Activity,"Manufacture of medical, precision and optical instruments, watches and clocks (33)",0.0001757402345199879,0.00032246746139408695,0.00026998253970878904,0.00012677250731821924,0.00010211928735899194
EU27+UK,Activity,"Manufacture of motor vehicles, trailers and semi-trailers (34)",0.00010592423088903734,0.000252693211551119,0.0002338268235723019,8.211858547574464e-05,6.581723423288105e-05
EU27+UK,Activity,Manufacture of office machinery and computers (30),3.413136087473686e-05,6.029194056308586e-05,5.074317082835019e-05,2.3337520720598087e-05,1.982044776895503e-05
EU27+UK,Activity,Manufacture of other non-metallic mineral products n.e.c.,0.004456747334237327,0.017167255871310717,0.05227581250950352,0.008352171110649422,0.0018084228618562388
EU27+UK,Activity,Manufacture of other transport equipment (35),0.00019300970003440057,0.00042262714351297057,0.00036173569606339097,0.00012169111476870795,9.615151973872933e-05
EU27+UK,Activity,"Manufacture of radio, television and communication equipment and apparatus (32)",0.0003365610387140212,0.0005193349751949442,0.0004090083537155995,0.00021195202197644706,0.00017423610079945535
EU27+UK,Activity,Manufacture of rubber and plastic products (25),0.00010613884887318394,0.00017155506993351538,0.00016863528048441238,6.254193524053291e-05,5.5418483481113675e-05
EU27+UK,Activity,Manufacture of textiles (17),2.7932992449978183e-05,6.536442599917674e-05,5.927252153823093e-05,2.0320269436680085e-05,1.4916858564745648e-05
EU27+UK,Activity,Manufacture of tobacco products (16),2.2805252403085723e-05,2.9690616745407395e-05,2.7953412400950596e-05,1.2394318398734135e-05,1.2398832962879781e-05
EU27+UK,Activity,Manufacture of wearing apparel; dressing and dyeing of fur (18),1.8527176048823747e-05,3.7344516708867106e-05,3.670922466279709e-05,1.5531614019086794e-05,1.1618003329843191e-05
EU27+UK,Activity,"Manufacture of wood and of products of wood and cork, except furniture; manufacture of articles of straw and plaiting materials (20)",0.0003362268625040126,0.00026612066695542124,0.00034586505804111873,0.00012914129636787383,0.00015815580751228045
EU27+UK,Activity,"Manure treatment (biogas), storage and land application",6.823783654982916e-07,1.5695201067056137e-06,1.5689555888009882e-06,6.173156810189865e-07,4.3304219868139295e-07
EU27+UK,Activity,"Manure treatment (conventional), storage and land application",6.995564161813335e-07,1.6090308785943947e-06,1.6084521496337518e-06,6.328558572498626e-07,4.4394351269273734e-07
EU27+UK,Activity,Meat animals nec,7.309798954506396e-06,1.298111211980499e-05,1.3367653753902375e-05,7.493281633804467e-06,6.3370812954444715e-06
EU27+UK,Activity,Mining of aluminium ores and concentrates,0.0002316248634098473,0.0002077716991238985,0.0001810320266156776,5.064591563397462e-05,8.319212490023207e-05
EU27+UK,Activity,"Mining of chemical and fertilizer minerals, production of salt, other mining and quarrying n.e.c.",4.677324247389453e-05,0.0002556656309611571,0.00024534542430947395,6.250367090574433e-05,2.4608918918161502e-05
EU27+UK,Activity,Mining of coal and lignite; extraction of peat (10),0.0051421725055236156,0.0014353643282057182,0.001519926035214536,0.0009843974050764183,0.0020299371959507004
EU27+UK,Activity,Mining of copper ores and concentrates,0.0005756485220663858,0.0009034666496337146,0.0009421718313603069,0.00027798038510241577,0.0002590807824839111
EU27+UK,Activity,Mining of iron ores,0.0002556348371054037,0.0006657769994926939,0.0006305873850280795,0.0003171387940784289,0.00019830661832307615
EU27+UK,Activity,"Mining of lead, zinc and tin ores and concentrates",2.0370931035390558e-05,4.034953773483882e-05,4.188950410426524e-05,1.2904460147606815e-05,1.0159508046468543e-05
EU27+UK,Activity,Mining of nickel ores and concentrates,2.04362790988176e-05,4.608952969540237e-05,5.108301919544332e-05,2.227160386819996e-05,1.4471182298507398e-05
EU27+UK,Activity,Mining of other non-ferrous metal ores and concentrates,0.00010973916806000333,0.00013429809704902524,0.00013547452565187723,0.00012526561218171315,9.493203522430827e-05
EU27+UK,Activity,Mining of precious metal ores and concentrates,0.00014954660335682904,0.0001426338142157299,0.00016783415015631106,5.852906135021047e-05,6.768903904274738e-05
EU27+UK,Activity,Mining of uranium and thorium ores (12),0.0001434312240532165,0.0001875550390701011,0.00019360289261195,9.1326649524035e-05,7.764823647702957e-05
EU27+UK,Activity,N-fertiliser,2.3536492617498435e-05,2.7929573526110162e-05,2.8691944785968112e-05,4.062189849734188e-05,1.2850641127102197e-05
EU27+UK,Activity,Other business activities (74),0.0012239191139563719,0.0028093164855081134,0.0024738887175284356,0.0012976998275771028,0.0008648669812209073
EU27+UK,Activity,Other land transport,0.00030859787249017513,0.0004185743557260096,0.0007694049558984882,0.0003793145643126777,0.0003034138239060123
EU27+UK,Activity,Other non-ferrous metal production,0.00016031834656042546,0.00019498606852237898,0.0001830934042839082,9.139917916525674e-05,9.238634130112753e-05
EU27+UK,Activity,Other service activities (93),2.2376068773025754e-05,2.955639184011144e-05,2.8729198142098044e-05,2.3275667476250063e-05,2.12537666684695e-05
EU27+UK,Activity,P- and other fertiliser,5.688646282424816e-05,8.01419668927968e-05,7.89937085208024e-05,5.210402835253558e-05,3.209855005989133e-05
EU27+UK,Activity,Paper,0.0002482820866969212,0.0004884959223552685,0.000444178943747481,0.00023116620394296241,0.00015158501855674447
EU27+UK,Activity,Petroleum Refinery,0.002992068456700896,0.0030545097264555736,0.0036858159475085628,0.0042552676934557235,0.0021779689384994467
EU27+UK,Activity,Pigs farming,1.721235078028443e-05,3.4461141631219544e-05,3.2833368092986446e-05,1.5729543645038263e-05,1.2005884568071937e-05
EU27+UK,Activity,"Plastics, basic",0.0010994538221685668,0.002272659117160961,0.0020840546448328994,0.0008264003561876855,0.0005833385500056167
EU27+UK,Activity,Post and telecommunications (64),0.00031193693996444213,0.0004079655744260775,0.0004144317623024487,0.0004436533878765358,0.00029706961805856603
EU27+UK,Activity,Poultry farming,1.1209751851552688e-05,2.0291931559110212e-05,2.0602590533140495e-05,1.0170664752819664e-05,8.264427608980963e-06
EU27+UK,Activity,Precious metals production,0.0001522741523079239,0.0001277980531005844,0.00011444450634179024,4.327502513139638e-05,6.388333546287952e-05
EU27+UK,Activity,Private households with employed persons (95),3.5854418216457207e-06,7.436716402539196e-06,6.528544200838545e-06,3.036980339675637e-06,2.084183753119272e-06
EU27+UK,Activity,Processed rice,2.3261550352718954e-06,4.671665307843547e-06,5.01292124908568e-06,2.1976814969934074e-06,1.809406154700372e-06
EU27+UK,Activity,Processing of Food products nec,7.691481890468585e-05,0.00018200384291126284,0.00018742712603681937,6.53026031648431e-05,4.527288902424083e-05
EU27+UK,Activity,Processing of dairy products,2.3770044272263906e-05,6.631220222057969e-05,6.396818994294852e-05,2.391933129493083e-05,1.640737069937899e-05
EU27+UK,Activity,Processing of meat cattle,5.934652599047411e-06,1.1785762700950783e-05,1.1933206760569041e-05,5.724160438792795e-06,4.661160176887462e-06
EU27+UK,Activity,Processing of meat pigs,1.1860121398939597e-05,2.616475423487592e-05,2.385784312108157e-05,1.1744874773947535e-05,8.912205572808446e-06
EU27+UK,Activity,Processing of meat poultry,1.9703311538310154e-06,4.094817599025424e-06,3.8603553788730886e-06,1.8412002858582865e-06,1.5428891198069468e-06
EU27+UK,Activity,Processing of nuclear fuel,5.35183224329745e-06,5.746727405963896e-06,4.860547941540098e-06,2.1444928475620453e-06,2.506533125293986e-06
EU27+UK,Activity,Processing vegetable oils and fats,3.315591030223822e-06,6.389617256200489e-06,6.448905322944423e-06,2.800649900018642e-06,2.117138726124128e-06
EU27+UK,Activity,Production of electricity by Geothermal,0.00014254924449988963,1.0958505811978037e-05,1.1270081116401425e-05,3.7660227149722503e-06,4.6721022436965746e-05
EU27+UK,Activity,Production of electricity by biomass and waste,0.0,0.0,0.0,0.0,0.0
EU27+UK,Activity,Production of electricity by coal,0.2365174349805195,0.03844882533467847,0.039680601639764,0.024203052405798113,0.08592099493132348
EU27+UK,Activity,Production of electricity by gas,0.042663550563002924,0.008753366014564277,0.008942947429274858,0.006765606216324807,0.016670460164370262
EU27+UK,Activity,Production of electricity by hydro,0.0,0.0,0.0,0.0,0.0
EU27+UK,Activity,Production of electricity by nuclear,0.00016445721173438034,1.88742611810289e-05,1.886644510679071e-05,1.146039917405622e-05,5.740960451554028e-05
EU27+UK,Activity,Production of electricity by petroleum and other oil derivatives,0.005806703892783463,0.0016356030007340498,0.0016422583331032272,0.0015599563015340802,0.00260789199680098
EU27+UK,Activity,Production of electricity by solar photovoltaic,0.0,0.0,0.0,0.0,0.0
EU27+UK,Activity,Production of electricity by solar thermal,0.0,0.0,0.0,0.0,0.0
EU27+UK,Activity,"Production of electricity by tide, wave, ocean",0.0,0.0,0.0,0.0,0.0
EU27+UK,Activity,Production of electricity by wind,0.0,0.0,0.0,0.0,0.0
EU27+UK,Activity,Production of electricity nec,0.0007977468586655969,0.0004557351984180878,0.00047285740740437345,0.0003229529663861859,0.0004005838161519524
EU27+UK,Activity,Production of meat products nec,1.0824867001809388e-06,1.9830538375712008e-06,1.9949408392765395e-06,9.318532250995663e-07,7.243566187780286e-07
EU27+UK,Activity,Production of offshore wind plants,0.0,0.0,0.0,0.0,0.0
EU27+UK,Activity,Production of onshore wind plants,0.0,0.0,0.0,0.0,0.0
EU27+UK,Activity,Production of photovoltaic plants,0.0,0.0,0.0,0.0,0.0
EU27+UK,Activity,Public administration and defence; compulsory social security (75),8.731089526317882e-05,0.00011829509791546724,0.00011716243139793766,0.00015632157142938705,0.00019480053604758188
EU27+UK,Activity,"Publishing, printing and reproduction of recorded media (22)",0.00028330907891840483,0.0005473524549714306,0.0005141178923919732,0.00040284032613790966,0.0002755770572896734
EU27+UK,Activity,Pulp,0.00015859256695354324,0.00024336877303883424,0.00022286916093064768,0.00011321568079664851,8.917174177493097e-05
EU27+UK,Activity,Quarrying of sand and clay,0.000275317462991052,0.0005321417352337152,0.0005308177839980489,0.0001638727583628091,0.0001408800955481578
EU27+UK,Activity,Quarrying of stone,0.0003363962916292702,0.0006214872334251299,0.000865986737412544,0.00021516320801029298,0.00016664949048905735
EU27+UK,Activity,Raw milk,1.5203800479134512e-05,3.5042971491411576e-05,3.4561819008015544e-05,1.4308097822645008e-05,1.0255016108307252e-05
EU27+UK,Activity,Re-processing of ash into clinker,0.0014808069832700412,0.0004169162478094577,0.0009356564865958145,0.000432148363403104,0.0007356959248769221
EU27+UK,Activity,Re-processing of secondary aluminium into new aluminium,0.001785554150294419,0.0006435615058492602,0.0005845653303423213,0.00017501768385259876,0.00061184785766172
EU27+UK,Activity,Re-processing of secondary construction material into aggregates,0.0012503373903995736,0.0001804205872051248,0.0006543824224426838,0.0002075054537706384,0.0005135655640817541
EU27+UK,Activity,Re-processing of secondary copper into new copper,0.00015806047744801015,0.00038813862708255976,0.0003348348603807685,0.00011081912973159845,8.119764446874024e-05
EU27+UK,Activity,Re-processing of secondary glass into new glass,0.0008511479073191966,0.021793142571747734,0.01469382957344372,0.0033932891494501704,0.0003536139559566999
EU27+UK,Activity,"Re-processing of secondary lead into new lead, zinc and tin",7.428644134920592e-05,0.00018343016816301893,0.00019077240126817168,6.147132463828366e-05,4.14048895083123e-05
EU27+UK,Activity,Re-processing of secondary other non-ferrous metals into new other non-ferrous metals,3.3502343387818165e-05,4.293022047340347e-05,4.048138826051658e-05,1.9634552173170843e-05,1.925858809680169e-05
EU27+UK,Activity,Re-processing of secondary paper into new pulp,6.712155328702334e-05,0.00011990549758694368,0.0001096857724407241,5.529270769754752e-05,3.972393026772426e-05
EU27+UK,Activity,Re-processing of secondary plastic into new plastic,0.00025550045888098066,0.0005146841596843482,0.000477021571632543,0.0002122263224560717,0.00015183069290539337
EU27+UK,Activity,Re-processing of secondary preciuos metals into new preciuos metals,5.999756602824412e-05,8.072567455001616e-05,7.50935953387427e-05,2.7297779122394517e-05,2.5292480902048446e-05
EU27+UK,Activity,Re-processing of secondary steel into new steel,0.001918846671334949,0.00647905621290717,0.006084884536938302,0.0018821918388476095,0.0010901486771730947
EU27+UK,Activity,Re-processing of secondary wood material into new wood material,0.00019988206365987134,0.0001651545041799802,0.00021153304441974568,7.754849246691119e-05,9.372652395883726e-05
EU27+UK,Activity,Real estate activities (70),0.0001393168996723928,0.00018242541414988792,0.00019085897581929643,0.00013916238819944193,0.0001358504293919328
EU27+UK,Activity,"Recreational, cultural and sporting activities (92)",3.801578579921628e-05,6.935791167474768e-05,6.47985606775219e-05,4.4107503014137304e-05,3.018678647635686e-05
EU27+UK,Activity,Recycling of bottles by direct reuse,0.001767181865778897,0.002480399127110194,0.0024055173445367947,0.002283474602273609,0.0016036054706379886
EU27+UK,Activity,Recycling of waste and scrap,0.002045508659934281,0.0036952774315640847,0.0031922760991104394,0.0009911238877751266,0.0008903019420592571
EU27+UK,Activity,Renting of machinery and equipment without operator and of personal and household goods (71),0.00021024142104805472,0.0002704129059762224,0.0003088588772517356,0.0002440772565098383,0.00023402343659265637
EU27+UK,Activity,Research and development (73),6.310560466471438e-05,0.00014272304948233238,0.00011976755392992772,6.305189444062824e-05,3.882579508524816e-05
EU27+UK,Activity,Retail sale of automotive fuel,0.0002713705435429777,0.0003450203447143429,0.0003821033473775425,0.0002459662690563908,0.00043354682104423546
EU27+UK,Activity,"Retail trade, except of motor vehicles and motorcycles; repair of personal and household goods (52)",0.0002857910721327297,0.0004627329452085934,0.0004481324862510807,0.00023968507189005912,0.0006682356584740498
EU27+UK,Activity,"Sale, maintenance, repair of motor vehicles, motor vehicles parts, motorcycles, motor cycles parts and accessoiries",0.00018340832797135003,0.0002635635524637839,0.00029066136456013653,0.00024037027095744737,0.0003873808103556582
EU27+UK,Activity,Sea and coastal water transport,0.0169936676435334,0.02607958366398468,0.10116207623137202,0.017516915750620362,0.00799333325275395
EU27+UK,Activity,Steam and hot water supply,0.018868528586235934,0.02087529364875949,0.020384525323385735,0.01682873637347338,0.013432052796127867
EU27+UK,Activity,Sugar refining,2.63705199818417e-06,5.234819936570283e-06,5.364371107126808e-06,2.4238296527455986e-06,1.986452367800838e-06
