RoW,Activity,Sea and coastal water transport,0.010374855313094945,0.0039333804551356134,0.008297297632542725,0.0035943933274630462,0.006391866309837349
RoW,Activity,Steam and hot water supply,0.003811091181372103,0.0036268131691628938,0.0032396751259652808,0.002464847891724364,0.002706194816644337
RoW,Activity,Sugar refining,9.962246036767359e-06,8.646225262645292e-06,7.651893930747702e-06,5.306107537389964e-06,6.792869165705065e-06
RoW,Activity,Supporting and auxiliary transport activities; activities of travel agencies (63),0.0007060040237235347,0.0006977572453652115,0.0008602157279537786,0.000535175773301871,0.0005368273232795795
RoW,Activity,"Tanning and dressing of leather; manufacture of luggage, handbags, saddlery, harness and footwear (19)",1.3726409330124268e-05,1.4320241078120987e-05,1.2248676069337366e-05,8.166860598276882e-06,9.227478881441051e-06
RoW,Activity,Transmission of electricity,3.447838389700303e-05,3.297101790523907e-05,2.87556248715254e-05,2.2450201367576795e-05,2.4452642420438934e-05
RoW,Activity,Transport via pipelines,0.001306435474641903,0.0011606597272504433,0.001150467393113523,0.001133904435903298,0.0012944758649217748
RoW,Activity,Transport via railways,0.00019830260091952687,0.00020296741218789736,0.00020019674192061384,0.0001480941955581697,0.00016278448133104088
RoW,Activity,"Waste water treatment, food",1.4090658042615037e-06,1.5005416171791303e-06,1.3335774499231578e-06,9.449762868475039e-07,9.99985511213698e-07
RoW,Activity,"Waste water treatment, other",2.2535190993619076e-06,2.072828890718347e-06,1.8528924708943028e-06,1.3090425793063208e-06,1.5479915713208746e-06
RoW,Activity,"Wholesale trade and commission trade, except of motor vehicles and motorcycles (51)",0.00018545995542344442,0.0001814171390736902,0.000159272221935194,0.00011923301873251118,0.0001647870332786566
RoW,Activity,"Wool, silk-worm cocoons",5.546873191680058e-05,5.554080297843146e-05,4.960735934910193e-05,4.129457799535167e-05,4.400213244553887e-05
USA,Activity,Activities auxiliary to financial intermediation (67),1.4015815316419449e-05,6.711814758473202e-06,5.424744542320996e-06,4.268866076233091e-06,8.715652161673618e-06
USA,Activity,Activities of membership organisation n.e.c. (91),1.2100489005785527e-06,5.531925415307713e-07,4.936999805446931e-07,4.04176384107205e-07,7.766759626456407e-07
USA,Activity,Air transport (62),0.0008733565388287117,0.0007855555768785669,0.0006236703230303029,0.00048729559629278127,0.0006059740160006666
USA,Activity,Aluminium production,0.00011192416259042522,3.799401232621472e-05,2.6110314246899457e-05,1.5363486334614827e-05,6.268082654303058e-05
USA,Activity,Animal products nec,8.660609965189369e-07,8.25210117596262e-07,7.475658215379096e-07,5.043833593611864e-07,5.847579585466533e-07
USA,Activity,"Biogasification of food waste, incl. land application",0.0,0.0,0.0,0.0,0.0
USA,Activity,"Biogasification of paper, incl. land application",0.0,0.0,0.0,0.0,0.0
USA,Activity,"Biogasification of sewage slugde, incl. land application",1.811816004178607e-06,6.142951385135669e-07,5.343337007646082e-07,3.429491934252266e-07,1.052004683487847e-06
USA,Activity,Casting of metals,4.8693453893283584e-05,3.3581902062588196e-05,2.8042867219090552e-05,1.8917483301383437e-05,3.061452459054718e-05
USA,Activity,Cattle farming,6.630742167988851e-06,3.606595801190872e-06,3.2308176203528794e-06,2.2683913201093477e-06,4.123455812456559e-06
USA,Activity,Chemicals nec,0.0037307773519892756,0.0012170997404381803,0.0011236203023364307,0.0007743192966209135,0.0021817039484431184
USA,Activity,"Collection, purification and distribution of water (41)",4.454341519846508e-07,1.2504619635692083e-07,1.1368000614862813e-07,7.967068317727396e-08,2.6122065278240194e-07
USA,Activity,"Composting of food waste, incl. land application",2.4891660032259195e-07,1.4489255429462632e-07,1.4270498695424432e-07,9.520978788599915e-08,1.5562431793779097e-07
USA,Activity,"Composting of paper and wood, incl. land application",3.974618786286993e-07,1.2138312807379307e-07,1.1399945355373666e-07,7.802430443666842e-08,2.3488087188312566e-07
USA,Activity,Computer and related activities (72),8.062816279811817e-06,4.368068442406709e-06,3.846887029900798e-06,3.243677362428014e-06,5.472689694238003e-06
USA,Activity,Construction (45),2.0663488896576836e-05,2.550448497893621e-06,2.537321053292478e-06,2.0527118470743785e-06,1.1946950866951048e-05
USA,Activity,Copper production,0.00010860442074773334,0.00015535875511678204,0.00010213283997797967,6.043542013446427e-05,6.609918697687126e-05
USA,Activity,Cultivation of cereal grains nec,1.6884075628317658e-05,8.115633701619722e-06,6.914779386563867e-06,4.710789023610709e-06,1.0201110049619743e-05
USA,Activity,Cultivation of crops nec,2.8294496738909487e-05,1.0862825572123975e-05,9.69709931662376e-06,6.76259495522773e-06,1.685039124642143e-05
USA,Activity,Cultivation of oil seeds,7.673273440446862e-05,6.05419633649785e-05,3.437673129867191e-05,2.184788152243904e-05,4.406789813466586e-05
USA,Activity,Cultivation of paddy rice,3.233555798497977e-05,2.0628188278589347e-05,1.8557702334423707e-05,1.2868033422342862e-05,2.0846262182711275e-05
USA,Activity,Cultivation of plant-based fibers,4.9974749540116985e-05,3.258112061197395e-05,2.2457481889076625e-05,1.429307845936524e-05,2.9270419221503075e-05
USA,Activity,"Cultivation of sugar cane, sugar beet",2.3471598761674574e-06,1.4150892957866048e-06,1.2524297453896352e-06,8.681192684075416e-07,1.5022761805365545e-06
USA,Activity,"Cultivation of vegetables, fruit, nuts",2.2771749357054342e-06,1.6652516875311436e-06,1.49300332450825e-06,1.038073007216929e-06,1.4958745823678464e-06
USA,Activity,Cultivation of wheat,3.293867072761208e-05,2.727854524898892e-05,2.469891597035252e-05,1.7070167948554716e-05,2.2183063368833273e-05
USA,Activity,Distribution and trade of electricity,9.762246073676784e-07,2.1998438955880452e-07,1.9200836786978173e-07,1.3968400605434827e-07,5.676970705909952e-07
USA,Activity,Education (80),2.2264974106489399e-07,6.695979378424346e-08,5.987124404139212e-08,5.8044908270170335e-08,1.400065514710572e-07
USA,Activity,Extra-territorial organizations and bodies,0.0,0.0,0.0,0.0,0.0
USA,Activity,"Extraction of crude petroleum and services related to crude oil extraction, excluding surveying",0.0003588743862914587,0.0001491631429370452,0.00014360048156874606,0.00013813136184927274,0.00022877118218953457
USA,Activity,"Extraction of natural gas and services related to natural gas extraction, excluding surveying",0.00011805598349680005,6.771475511442759e-05,6.681082549599152e-05,6.646597141945479e-05,8.134160735390523e-05
USA,Activity,"Extraction, liquefaction, and regasification of other petroleum and gaseous materials",2.669871039716835e-09,5.416121883548827e-10,5.07362857502726e-10,4.413397850580194e-10,1.5600989155039675e-09
USA,Activity,"Financial intermediation, except insurance and pension funding (65)",1.669448252014919e-05,1.068129309295645e-05,1.0014337379409314e-05,9.674662554680203e-06,1.2580573023335396e-05
USA,Activity,"Fishing, operating of fish hatcheries and fish farms; service activities incidental to fishing (05)",1.0930522887892705e-06,1.0286816758633723e-06,9.630467456007507e-07,6.492928544049368e-07,7.570472015427823e-07
USA,Activity,"Forestry, logging and related service activities (02)",1.4568167940151227e-05,5.688781433740114e-06,4.850406512794124e-06,3.2274758195848268e-06,8.61133168223277e-06
USA,Activity,Health and social work (85),8.047980967325887e-08,1.9929473468366386e-08,1.8854626306056644e-08,2.08164514014216e-08,5.032167069311755e-08
USA,Activity,Hotels and restaurants (55),2.4966790489774354e-05,1.787867926460754e-05,1.588620791890309e-05,1.1478174570868307e-05,1.7571816431469937e-05
USA,Activity,Incineration of waste: Food,2.8705049839407543e-07,1.7612881571278248e-07,1.7066937739769176e-07,1.0313777839757876e-07,1.7526862181702668e-07
USA,Activity,Incineration of waste: Metals and Inert materials,8.169897912154915e-06,6.1343660543014785e-06,7.641179120961543e-06,4.969586722378345e-06,5.926596265951854e-06
USA,Activity,Incineration of waste: Oil/Hazardous waste,1.4666306990320527e-06,1.022897288958898e-06,1.0103165494961162e-06,7.222074763980361e-07,9.94949532881778e-07
USA,Activity,Incineration of waste: Paper,6.451295481208285e-07,2.223770536384897e-07,2.150899449624039e-07,1.5062351876956105e-07,3.883194172442171e-07
USA,Activity,Incineration of waste: Plastic,1.7931440766052083e-05,6.060850443290704e-06,5.785301667306943e-06,3.815526184893828e-06,1.0604939639661447e-05
USA,Activity,Incineration of waste: Textiles,2.437615252388804e-06,1.0201409176485302e-06,1.0082841312787688e-06,6.597613959601891e-07,1.4834323650114053e-06
USA,Activity,Incineration of waste: Wood,1.9729765171497964e-07,8.805762224519985e-08,8.321074830975778e-08,5.96957525893215e-08,1.2265185235291696e-07
USA,Activity,Inland water transport,3.8463346724645144e-05,2.719103474877709e-05,2.3080404872745016e-05,1.5427132754493518e-05,2.4505665058650932e-05
USA,Activity,"Insurance and pension funding, except compulsory social security (66)",3.5243676469555762e-06,2.2277448318450483e-06,1.950569191391698e-06,1.8776777597767628e-06,2.5871022113553196e-06
USA,Activity,Landfill of waste: Food,3.6698653488374336e-07,1.3481694338594698e-07,1.2576683438825298e-07,8.502113525831206e-08,2.1865238304377943e-07
USA,Activity,Landfill of waste: Inert/metal/hazardous,5.642560697283449e-07,1.7271045198776777e-07,1.525827489318035e-07,1.0465006783741898e-07,3.3054976890764044e-07
USA,Activity,Landfill of waste: Paper,4.2694153893020905e-07,1.4461781225601074e-07,1.3632890655495627e-07,9.245636819222774e-08,2.533749392191541e-07
USA,Activity,Landfill of waste: Plastic,3.3642299237264017e-07,1.0301386127002848e-07,9.678952883869816e-08,6.512098746481524e-08,1.982076218477069e-07
USA,Activity,Landfill of waste: Textiles,1.6427927396918928e-07,5.3783854397740063e-08,5.091802928671235e-08,3.436354023804919e-08,9.739481517815367e-08
USA,Activity,Landfill of waste: Wood,1.8717711793760008e-07,6.0666879647267e-08,5.765361721985906e-08,3.9014647194328594e-08,1.1096424181085179e-07
USA,Activity,"Lead, zinc and tin production",2.043975429578077e-06,3.744547507033971e-06,3.755197512386743e-06,2.0994668420324593e-06,1.4992096004548775e-06
USA,Activity,Manufacture of basic iron and steel and of ferro-alloys and first products thereof,0.00021768765223071184,0.00020940269146483922,0.00017762008731793586,0.00010649576108470339,0.00013613271770586302
USA,Activity,Manufacture of beverages,2.100865681092149e-06,2.271830005826546e-06,1.6730522278401073e-06,1.171960215185262e-06,1.3810080289797756e-06
USA,Activity,"Manufacture of bricks, tiles and construction products, in baked clay",0.00011760864168180099,6.506384895761248e-06,5.302032361944365e-06,3.2601345324996646e-06,6.457092757784351e-05
USA,Activity,"Manufacture of cement, lime and plaster",0.00010199571595274117,1.8517444686871275e-05,1.7306811722032333e-05,1.2039830379871629e-05,5.861893479395831e-05
USA,Activity,Manufacture of ceramic goods,6.468605107872801e-06,3.224772836839714e-06,3.590392438261795e-06,2.609007773025295e-06,4.543041185981914e-06
USA,Activity,Manufacture of coke oven products,1.6698207772542767e-05,1.6702091289394813e-05,1.4453750878976562e-05,8.469957899388329e-06,1.0454252079780506e-05
USA,Activity,Manufacture of electrical machinery and apparatus n.e.c. (31),4.251874191983583e-05,3.6591116531650624e-05,2.562210235123909e-05,2.1905549376384426e-05,2.935931548960335e-05
USA,Activity,"Manufacture of fabricated metal products, except machinery and equipment (28)",3.992239195511847e-05,2.4956293966783973e-05,2.1752844288750096e-05,1.3773902714386774e-05,2.4282719830388295e-05
USA,Activity,Manufacture of fish products,2.71418537676581e-06,3.3248864406546104e-06,3.131748472425274e-06,2.229920467944321e-06,1.9838191129529547e-06
USA,Activity,Manufacture of furniture; manufacturing n.e.c. (36),7.278916223671555e-05,3.198402892390432e-05,2.764098360783389e-05,2.0914758655326467e-05,4.384634748909688e-05
USA,Activity,Manufacture of gas; distribution of gaseous fuels through mains,0.000286012972697711,1.8752794379433584e-05,1.623527358058001e-05,1.1564584489901968e-05,0.00015835431157963856
USA,Activity,Manufacture of glass and glass products,0.009553013889802177,0.00014625654509098,0.00010993910713864345,6.0724072976583344e-05,0.005204648779326539
USA,Activity,Manufacture of machinery and equipment n.e.c. (29),3.9823282661523895e-05,2.9219203321998387e-05,2.5065136537195055e-05,1.6737267053649535e-05,2.5195312587493316e-05
USA,Activity,"Manufacture of medical, precision and optical instruments, watches and clocks (33)",9.555822518426184e-06,1.2573543393290884e-05,9.268284980749826e-06,6.752595908994167e-06,6.744860257872553e-06
USA,Activity,"Manufacture of motor vehicles, trailers and semi-trailers (34)",5.0554128438450865e-05,2.7646403982613627e-05,2.4218218140052412e-05,1.582298096222783e-05,3.1788493385441695e-05
USA,Activity,Manufacture of office machinery and computers (30),8.500527286318537e-06,9.20561818609985e-06,7.091310289491802e-06,5.1012665090497735e-06,5.864277829669982e-06
USA,Activity,Manufacture of other non-metallic mineral products n.e.c.,0.0005753551369832711,2.4700870777839148e-05,2.5679244731778336e-05,1.4409550313176204e-05,0.0003155701711266366
USA,Activity,Manufacture of other transport equipment (35),4.669472345569615e-05,4.708480226476267e-05,4.0799037769923535e-05,2.6433898805385705e-05,3.184276881176568e-05
USA,Activity,"Manufacture of radio, television and communication equipment and apparatus (32)",2.0828350536635883e-05,2.1547870329594437e-05,1.4480119230645482e-05,1.0670263802187419e-05,1.3422789498259612e-05
USA,Activity,Manufacture of rubber and plastic products (25),1.4829399910266364e-05,6.606367798333038e-06,5.803756123718235e-06,3.852539900611025e-06,8.923612760587943e-06
USA,Activity,Manufacture of textiles (17),4.481205221026966e-05,2.1447772138119542e-05,1.895207036566877e-05,1.2801770632452818e-05,2.7016380891808362e-05
USA,Activity,Manufacture of tobacco products (16),6.264561927158015e-07,3.105396939274194e-07,2.5558066080430964e-07,1.6305514141886905e-07,3.7219403460613426e-07
USA,Activity,Manufacture of wearing apparel; dressing and dyeing of fur (18),3.720039912509128e-07,2.353551358926275e-07,2.1549316363261346e-07,1.6006095158547476e-07,2.468343327715709e-07
USA,Activity,"Manufacture of wood and of products of wood and cork, except furniture; manufacture of articles of straw and plaiting materials (20)",4.698333194034421e-05,1.592702365910181e-05,1.4749304490110979e-05,9.576609628226648e-06,2.7753439258626065e-05
USA,Activity,"Manure treatment (biogas), storage and land application",0.0,0.0,0.0,0.0,0.0
USA,Activity,"Manure treatment (conventional), storage and land application",0.0,0.0,0.0,0.0,0.0
USA,Activity,Meat animals nec,7.373711713712507e-08,4.994520784433616e-08,4.673329223746272e-08,3.195472652203998e-08,4.765185203321225e-08
USA,Activity,Mining of aluminium ores and concentrates,4.2859875197197165e-06,1.6019168476375577e-07,1.2348929910001974e-07,6.980491291612649e-08,2.340574457340728e-06
USA,Activity,"Mining of chemical and fertilizer minerals, production of salt, other mining and quarrying n.e.c.",9.579534433464442e-05,7.058618471544297e-05,6.553825981490587e-05,3.889771971032424e-05,5.806859970735768e-05
USA,Activity,Mining of coal and lignite; extraction of peat (10),0.002311819465090291,0.00024220817984935649,0.00024201827717092078,0.00020435171104896596,0.001315127816950887
USA,Activity,Mining of copper ores and concentrates,7.711894136067722e-05,5.985312661482176e-05,4.152425002025031e-05,2.42872839795235e-05,4.49233447337665e-05
USA,Activity,Mining of iron ores,1.6339069484147166e-05,9.409360052628382e-06,7.031481036542221e-06,4.396237425683642e-06,9.573771546030442e-06
USA,Activity,"Mining of lead, zinc and tin ores and concentrates",1.579324501571278e-05,1.3657242381407019e-05,1.298679550637085e-05,6.905273277101311e-06,9.567650497854902e-06
USA,Activity,Mining of nickel ores and concentrates,0.0,0.0,0.0,0.0,0.0
USA,Activity,Mining of other non-ferrous metal ores and concentrates,9.268745227328042e-06,1.1727133281086163e-05,1.0433567518555555e-05,6.698482575145827e-06,6.474326323625574e-06
USA,Activity,Mining of precious metal ores and concentrates,0.001468902589763642,6.851788663938976e-05,5.5689399404772366e-05,3.3823701508094396e-05,0.0008053633061045071
USA,Activity,Mining of uranium and thorium ores (12),2.2497665867376796e-05,8.912180515656134e-06,7.730773691475226e-06,5.117509804099322e-06,1.3167938628146912e-05
USA,Activity,N-fertiliser,9.216532720884146e-06,3.1791418594699026e-06,2.4539196758203076e-06,1.7992120785266726e-06,5.4371433297515985e-06
USA,Activity,Other business activities (74),0.00016442421864315651,9.218346842305891e-05,8.26238352909395e-05,7.02497771759356e-05,0.00011019740752796658
USA,Activity,Other land transport,1.4563138030261822e-08,4.720964400106986e-09,4.466539381067715e-09,3.4918638952730313e-09,9.249127826223986e-09
USA,Activity,Other non-ferrous metal production,2.0059764133484978e-05,2.9056835270271644e-05,2.5617094053848767e-05,1.6310038346447404e-05,1.4236772879278454e-05
USA,Activity,Other service activities (93),8.090852004266722e-07,2.497330427088826e-07,2.2015753047061166e-07,1.8115515126821897e-07,4.93767475531871e-07
USA,Activity,P- and other fertiliser,4.0206097368889604e-05,1.6763177680225498e-05,1.4806532296503657e-05,1.05122888686378e-05,2.3999042186025633e-05
USA,Activity,Paper,0.000582502302609411,0.00017187220897053114,0.0001451894311521984,0.00010371516016105687,0.0003402127152159691
USA,Activity,Petroleum Refinery,0.0005905546669251096,0.0002895902549090027,0.00029028008765827074,0.00031406673481229055,0.00040025791316383285
USA,Activity,Pigs farming,5.3878417082262785e-06,2.8356260845457164e-06,2.438661626082993e-06,1.6944136598552277e-06,3.3310632836321475e-06
USA,Activity,"Plastics, basic",0.00013014353006257542,0.00011195737931187733,8.521808087250116e-05,5.483746772315414e-05,8.002356441747842e-05
USA,Activity,Post and telecommunications (64),2.3176380440005487e-05,1.233056251828139e-05,1.1301120250934436e-05,9.878086355910096e-06,1.5776333826495885e-05
USA,Activity,Poultry farming,3.6652161505891504e-06,2.5927946314318764e-06,2.239243665036291e-06,1.5473704900637844e-06,2.413981797228451e-06
USA,Activity,Precious metals production,0.0011634361530455954,3.428620188992077e-05,2.8787153406736584e-05,1.749558896822667e-05,0.0006363500522176236
USA,Activity,Private households with employed persons (95),8.138792697262283e-10,1.028304943969392e-09,1.0694813294944897e-09,1.0142632249485466e-09,9.506389350046252e-10
USA,Activity,Processed rice,3.6289902393767333e-06,3.3517601641328137e-06,3.0666701396958443e-06,2.080324681242812e-06,2.4209385079112575e-06
USA,Activity,Processing of Food products nec,1.0111640757747663e-05,4.762639408976982e-06,4.175111158884426e-06,2.8708450097606646e-06,6.104471302644301e-06
USA,Activity,Processing of dairy products,1.2592196634556193e-05,1.2096074550928538e-05,7.53286288872464e-06,4.960385550519318e-06,7.569888123225745e-06
USA,Activity,Processing of meat cattle,1.8826103738966039e-06,9.282396440254006e-07,8.406797163957292e-07,5.807842796677586e-07,1.158049491978474e-06
USA,Activity,Processing of meat pigs,9.72898063112062e-07,5.182130359793849e-07,4.464693309521274e-07,3.0967327688010256e-07,6.024953561890956e-07
USA,Activity,Processing of meat poultry,8.082501156205016e-07,5.539277875616542e-07,4.708698875041036e-07,3.2888900728437826e-07,5.363159471365347e-07
USA,Activity,Processing of nuclear fuel,6.707823992411117e-09,6.033328360516947e-09,4.319942638436659e-09,2.6965032833462757e-09,4.050679402500281e-09
USA,Activity,Processing vegetable oils and fats,4.2254924676324326e-05,1.872246536427052e-05,1.6536979789406152e-05,1.1285702717663501e-05,2.5340662395313528e-05
USA,Activity,Production of electricity by Geothermal,6.495010939577284e-07,5.896850733504171e-09,5.1336775756488455e-09,3.550121810442561e-09,3.5418568786823275e-07
USA,Activity,Production of electricity by biomass and waste,0.0,0.0,0.0,0.0,0.0
USA,Activity,Production of electricity by coal,0.10519984354948145,0.0025972333361404193,0.0022390280707173357,0.0015475315603835184,0.05756973245351054
USA,Activity,Production of electricity by gas,0.08169038813827476,0.0007470267892822613,0.000645760191905127,0.0004464238815137612,0.04454230650224797
USA,Activity,Production of electricity by hydro,0.0,0.0,0.0,0.0,0.0
USA,Activity,Production of electricity by nuclear,3.387474584848293e-05,3.129183867596157e-07,2.6197809986236536e-07,1.8164282168565694e-07,1.8471671768841837e-05
USA,Activity,Production of electricity by petroleum and other oil derivatives,0.0014630107264712285,2.235311656149479e-05,1.986926294332819e-05,1.3984328901091136e-05,0.0007991179437268435
USA,Activity,Production of electricity by solar photovoltaic,0.0,0.0,0.0,0.0,0.0
USA,Activity,Production of electricity by solar thermal,0.0,0.0,0.0,0.0,0.0
USA,Activity,"Production of electricity by tide, wave, ocean",0.0,0.0,0.0,0.0,0.0
USA,Activity,Production of electricity by wind,0.0,0.0,0.0,0.0,0.0
USA,Activity,Production of electricity nec,1.0159296300021379e-05,9.628157755289914e-08,8.363784095734006e-08,5.7845925435566715e-08,5.54096474284478e-06
USA,Activity,Production of meat products nec,2.852024901435236e-05,1.3090129984701339e-05,1.1073949411101534e-05,7.535389499717566e-06,1.7117855976893755e-05
USA,Activity,Production of offshore wind plants,0.0,0.0,0.0,0.0,0.0
USA,Activity,Production of onshore wind plants,0.0,0.0,0.0,0.0,0.0
USA,Activity,Production of photovoltaic plants,0.0,0.0,0.0,0.0,0.0
USA,Activity,Public administration and defence; compulsory social security (75),2.319050199608002e-05,2.0753631669439666e-06,1.7497373042944021e-06,1.475077124923061e-06,1.3171161304703813e-05
USA,Activity,"Publishing, printing and reproduction of recorded media (22)",4.5772917141811215e-05,2.6818744517583536e-05,2.3825250777708258e-05,2.030172727269482e-05,3.102495141168581e-05
USA,Activity,Pulp,3.388482419139557e-05,2.0410641638993608e-05,1.4247384944965423e-05,9.796776031951836e-06,2.014270433674063e-05
USA,Activity,Quarrying of sand and clay,0.00017098591933613314,2.1201717840403065e-05,1.9080101565800628e-05,1.1540217908144999e-05,9.541437483828951e-05
USA,Activity,Quarrying of stone,5.472626720410739e-05,8.03849553793145e-06,8.531132616790701e-06,5.8306223566674365e-06,3.1155372366121894e-05
USA,Activity,Raw milk,2.3628042501063814e-06,2.2669787273423445e-06,1.412406745516189e-06,9.30282279268373e-07,1.420525605463796e-06
USA,Activity,Re-processing of ash into clinker,0.0,0.0,0.0,0.0,0.0
USA,Activity,Re-processing of secondary aluminium into new aluminium,0.0,0.0,0.0,0.0,0.0
USA,Activity,Re-processing of secondary construction material into aggregates,0.0,0.0,0.0,0.0,0.0
USA,Activity,Re-processing of secondary copper into new copper,0.0,0.0,0.0,0.0,0.0
USA,Activity,Re-processing of secondary glass into new glass,0.0,0.0,0.0,0.0,0.0
USA,Activity,"Re-processing of secondary lead into new lead, zinc and tin",0.0,0.0,0.0,0.0,0.0
USA,Activity,Re-processing of secondary other non-ferrous metals into new other non-ferrous metals,0.0,0.0,0.0,0.0,0.0
USA,Activity,Re-processing of secondary paper into new pulp,0.0,0.0,0.0,0.0,0.0
USA,Activity,Re-processing of secondary plastic into new plastic,0.0,0.0,0.0,0.0,0.0
USA,Activity,Re-processing of secondary preciuos metals into new preciuos metals,0.0,0.0,0.0,0.0,0.0
USA,Activity,Re-processing of secondary steel into new steel,0.0,0.0,0.0,0.0,0.0
USA,Activity,Re-processing of secondary wood material into new wood material,0.0,0.0,0.0,0.0,0.0
USA,Activity,Real estate activities (70),9.396644979314634e-06,5.575100920670671e-06,5.087468211406602e-06,4.230456807172119e-06,6.634958990793644e-06
USA,Activity,"Recreational, cultural and sporting activities (92)",4.410875978600945e-06,2.374117999119871e-06,2.1302364833247946e-06,1.8084480686519327e-06,2.942185107738208e-06
USA,Activity,Recycling of bottles by direct reuse,0.0,0.0,0.0,0.0,0.0
USA,Activity,Recycling of waste and scrap,0.0004346420195919707,0.00014927441885184792,0.00012751413310084438,8.576194978007145e-05,0.00025376828604836205
USA,Activity,Renting of machinery and equipment without operator and of personal and household goods (71),1.8192978217339445e-05,7.82727638783755e-06,6.970366166694868e-06,5.438459018663751e-06,1.1417408508209796e-05
USA,Activity,Research and development (73),1.2927528265064869e-05,1.3983498187970903e-05,1.117857448082567e-05,7.175420502145255e-06,8.258134351529442e-06
USA,Activity,Retail sale of automotive fuel,4.1316655184551456e-07,3.2858390174024476e-07,3.4884573852658223e-07,2.600561351886402e-07,3.097290636585115e-06
USA,Activity,"Retail trade, except of motor vehicles and motorcycles; repair of personal and household goods (52)",2.3393135859860868e-06,4.851789157237878e-07,4.058760929034825e-07,2.866437307822196e-07,1.3826781819057263e-06
USA,Activity,"Sale, maintenance, repair of motor vehicles, motor vehicles parts, motorcycles, motor cycles parts and accessoiries",1.6732384130882964e-05,3.5239792040320746e-06,2.9756222389104684e-06,2.098727594077667e-06,9.685206536415123e-06
USA,Activity,Sea and coastal water transport,0.00042184399271382323,0.00014407613451535356,0.0003016391936387566,0.00012732242549340087,0.0002557694115547934
USA,Activity,Steam and hot water supply,0.0006383426972497489,0.00019410944954162876,0.0001758017504145348,0.00012736078042956936,0.00037698526519601926
USA,Activity,Sugar refining,1.214243052929924e-06,7.674385453261589e-07,6.783726545052491e-07,4.686780029912291e-07,7.836575571118951e-07
USA,Activity,Supporting and auxiliary transport activities; activities of travel agencies (63),9.214052981689523e-05,3.9390624387434545e-05,4.6619501546390955e-05,2.908415186189626e-05,5.802573868167165e-05
