EU27+UK,Activity,Supporting and auxiliary transport activities; activities of travel agencies (63),0.0007164305448861942,0.001136094945922197,0.001548844712655451,0.0006975099894867783,0.000500415022752312
EU27+UK,Activity,"Tanning and dressing of leather; manufacture of luggage, handbags, saddlery, harness and footwear (19)",3.0555612347423733e-06,5.374830135748353e-06,5.1187710207424e-06,2.3854362574920467e-06,1.7670049892725896e-06
EU27+UK,Activity,Transmission of electricity,0.00048721269252991807,0.0006436142756974985,0.0006719262139597824,0.0005036209219863928,0.00035706831417248224
EU27+UK,Activity,Transport via pipelines,0.000814257170896567,0.0009211002885505629,0.001063823185876515,0.0012154492335571367,0.0008225295623726135
EU27+UK,Activity,Transport via railways,0.00046174362807553676,0.0008271680421616386,0.0009231008265279095,0.0005045774423123663,0.00041062097298141445
EU27+UK,Activity,"Waste water treatment, food",5.4365361460415495e-06,5.726280937014508e-06,6.507994042672276e-06,3.829932529662087e-06,2.9405960180882994e-06
EU27+UK,Activity,"Waste water treatment, other",9.765128310241686e-06,1.0990336642757466e-05,1.195526105250719e-05,7.169656377528753e-06,5.287683906220717e-06
EU27+UK,Activity,"Wholesale trade and commission trade, except of motor vehicles and motorcycles (51)",0.0005969888375155193,0.0011840950376673072,0.0011232458841601057,0.0005366464626389995,0.0004542732188362981
EU27+UK,Activity,"Wool, silk-worm cocoons",0.000258076984124968,0.00027398335460792565,0.0002762938003668849,0.00015944031723026783,0.00014350468285137286
RoW,Activity,Activities auxiliary to financial intermediation (67),6.408589828695898e-05,6.343263390540198e-05,5.886673072127866e-05,4.374716275739475e-05,3.550487441270803e-05
RoW,Activity,Activities of membership organisation n.e.c. (91),3.141061213177862e-06,3.1459804867144564e-06,2.819264134278508e-06,1.4950568515019426e-06,1.4602825003436477e-06
RoW,Activity,Air transport (62),0.001185714321502559,0.0015522595945708499,0.0014411553008078556,0.0008715465067807273,0.0006849408949691938
RoW,Activity,Aluminium production,0.0009165088467604818,0.0012244637806830116,0.0010483454273759326,0.0003266515252717816,0.0003586546914306495
RoW,Activity,Animal products nec,5.437866956992099e-06,5.526187041051109e-06,4.998512957162048e-06,2.493378941343702e-06,2.497468034115438e-06
RoW,Activity,"Biogasification of food waste, incl. land application",8.920690836183494e-08,7.65911291266873e-08,6.991037395892669e-08,3.498873455956e-08,3.812463724786145e-08
RoW,Activity,"Biogasification of paper, incl. land application",1.130752330274843e-07,1.1577808187606275e-07,1.0122110645308212e-07,5.16797117434046e-08,4.9992875436826835e-08
RoW,Activity,"Biogasification of sewage slugde, incl. land application",7.217802868198662e-07,5.773657579041358e-07,5.323284553479028e-07,2.7172211548144077e-07,3.0790511956628413e-07
RoW,Activity,Casting of metals,0.0002806473374308977,0.00033612883536195874,0.000275368330861545,0.00013668735157203063,0.0001288361433424544
RoW,Activity,Cattle farming,2.9167335374779882e-05,2.666045098330505e-05,2.3842973870208787e-05,1.2161546527216057e-05,1.2773768074550531e-05
RoW,Activity,Chemicals nec,0.00329392307447127,0.003378765732958194,0.003108462411210785,0.0015351411344322673,0.0014642118956678337
RoW,Activity,"Collection, purification and distribution of water (41)",7.361482621400355e-05,5.430408382827353e-05,4.829440691684862e-05,2.5051966858887933e-05,3.1043060732713584e-05
RoW,Activity,"Composting of food waste, incl. land application",6.551605246830248e-07,6.849261868092296e-07,6.505937086395053e-07,3.635372091215319e-07,3.4785517202871103e-07
RoW,Activity,"Composting of paper and wood, incl. land application",4.9765093148430833e-08,5.09426942851838e-08,4.554216719757996e-08,2.206242299783669e-08,2.215457487626135e-08
RoW,Activity,Computer and related activities (72),2.277315004377228e-05,2.6974128986152193e-05,2.459145130092826e-05,1.7134273939227973e-05,1.3768439486323521e-05
RoW,Activity,Construction (45),0.00012275631069078827,8.880243755570259e-05,9.241270462389219e-05,6.147819216041534e-05,6.389470803389744e-05
RoW,Activity,Copper production,0.0001839307006167026,0.0005290792742323283,0.00034415709493462515,0.00011559505132733017,8.085818102794728e-05
RoW,Activity,Cultivation of cereal grains nec,8.019730035816432e-05,7.71353435811815e-05,7.008228274006352e-05,3.497426288960062e-05,3.5635660503780176e-05
RoW,Activity,Cultivation of crops nec,6.421682997539067e-05,5.3797054599807084e-05,4.830991875488569e-05,2.224387854638472e-05,2.686385046421169e-05
RoW,Activity,Cultivation of oil seeds,0.00011666621352700672,0.0001123891346910446,8.38593294482947e-05,3.6285152925353325e-05,4.6204499861773284e-05
RoW,Activity,Cultivation of paddy rice,0.00010154187379081172,9.528715475481837e-05,8.658070192246372e-05,4.207161873177028e-05,4.436108559771736e-05
RoW,Activity,Cultivation of plant-based fibers,3.59394703850503e-05,3.0438116177954005e-05,2.5392731042580092e-05,1.0589067241661152e-05,1.423421344977655e-05
RoW,Activity,"Cultivation of sugar cane, sugar beet",1.9134807497109994e-05,1.8314381637635666e-05,1.659805281042982e-05,8.176748345743478e-06,8.395812661687857e-06
RoW,Activity,"Cultivation of vegetables, fruit, nuts",5.847642303142797e-05,4.93459990832446e-05,4.3257933837740306e-05,2.0541637615769345e-05,2.451351707032331e-05
RoW,Activity,Cultivation of wheat,0.00016888474581781623,0.00016070464758054738,0.00014610863165264937,7.488935031582718e-05,7.538311019503397e-05
RoW,Activity,Distribution and trade of electricity,8.634847327493782e-05,8.480989431294115e-05,7.609348757700017e-05,4.229207650063796e-05,4.046063903456826e-05
RoW,Activity,Education (80),3.4369837287813525e-06,3.6703389858193965e-06,3.3013697789223296e-06,2.4553050893585153e-06,1.9200212149863647e-06
RoW,Activity,Extra-territorial organizations and bodies,0.0,0.0,0.0,0.0,0.0
RoW,Activity,"Extraction of crude petroleum and services related to crude oil extraction, excluding surveying",0.004449900052448133,0.003590421682275771,0.003396783201617216,0.0034060515237913053,0.0023880285268458247
RoW,Activity,"Extraction of natural gas and services related to natural gas extraction, excluding surveying",0.009615583647602559,0.007270964816113223,0.006359852905122536,0.010298262918405481,0.007332472542533345
RoW,Activity,"Extraction, liquefaction, and regasification of other petroleum and gaseous materials",0.0007140425767973164,0.000608235797675587,0.0005718098212397885,0.0003813944849939206,0.00032973408440409123
RoW,Activity,"Financial intermediation, except insurance and pension funding (65)",0.00016070564671567022,0.00015685314078491076,0.00014590845832840083,0.00011075371992317815,8.792520324708928e-05
RoW,Activity,"Fishing, operating of fish hatcheries and fish farms; service activities incidental to fishing (05)",1.4490728356824355e-05,1.6922236272331278e-05,1.6414417272908506e-05,7.678886092594664e-06,6.967140980058641e-06
RoW,Activity,"Forestry, logging and related service activities (02)",0.00011977806976321661,7.848654777460765e-05,6.36421399576257e-05,2.7463110181080925e-05,4.562675947817673e-05
RoW,Activity,Health and social work (85),3.5463089338925723e-06,3.626131930128694e-06,3.3119850894102615e-06,2.030930995779758e-06,1.805314412372009e-06
RoW,Activity,Hotels and restaurants (55),8.982079646779432e-05,0.00010686409926361778,0.0001026482304135095,5.6136594505836506e-05,5.125473554154877e-05
RoW,Activity,Incineration of waste: Food,4.3930235087140855e-06,4.525819669949217e-06,4.243313897702537e-06,1.9974566942219825e-06,1.9627211456469877e-06
RoW,Activity,Incineration of waste: Metals and Inert materials,4.129359907871875e-05,4.208933159780621e-05,4.466098872699356e-05,2.286163402162772e-05,2.279163337435627e-05
RoW,Activity,Incineration of waste: Oil/Hazardous waste,1.9118681207366197e-05,2.1102851002745007e-05,1.987472413552172e-05,9.496393889734597e-06,9.553644760484957e-06
RoW,Activity,Incineration of waste: Paper,3.5582340869044803e-06,3.4280899574118877e-06,3.1460081734324873e-06,1.5478578441818207e-06,1.7135954444783307e-06
RoW,Activity,Incineration of waste: Plastic,3.249787396634011e-05,3.3042168826764803e-05,3.0390264745899532e-05,1.618482477459722e-05,1.5016690249919357e-05
RoW,Activity,Incineration of waste: Textiles,6.090498783707453e-05,4.684954446716921e-05,4.2043724423134134e-05,1.9333524118012546e-05,2.4584499938684316e-05
RoW,Activity,Incineration of waste: Wood,1.11040640882018e-06,9.631170439231395e-07,8.909983643056472e-07,5.177934423145087e-07,4.936998278565981e-07
RoW,Activity,Inland water transport,0.0004765853424568966,0.0006848393254149263,0.0006223913534591696,0.00029455794295340403,0.00024791045797680926
RoW,Activity,"Insurance and pension funding, except compulsory social security (66)",2.4106365561012894e-05,2.4542184766894286e-05,2.3756714738461634e-05,1.8410323890914392e-05,1.5507572185031712e-05
RoW,Activity,Landfill of waste: Food,5.678042435567709e-06,4.855190703332158e-06,4.621714675092555e-06,2.5077351567278747e-06,2.628173500598298e-06
RoW,Activity,Landfill of waste: Inert/metal/hazardous,1.8898493798639236e-06,1.625846538394518e-06,1.5332866896737506e-06,8.483025737279248e-07,8.798751156984745e-07
RoW,Activity,Landfill of waste: Paper,2.3098254078541716e-06,1.911204407811473e-06,1.7961302185015703e-06,9.722755150594738e-07,1.0663251203127501e-06
RoW,Activity,Landfill of waste: Plastic,1.0579442810503899e-06,9.019212533456284e-07,8.554802225402027e-07,4.5932320975283754e-07,4.7619912919821646e-07
RoW,Activity,Landfill of waste: Textiles,5.780581831898405e-07,5.289735822779642e-07,4.929371485440852e-07,2.606542627648759e-07,2.6250809661600033e-07
RoW,Activity,Landfill of waste: Wood,6.762845186299363e-07,6.051143255423981e-07,5.635608930403312e-07,3.0006120561941977e-07,3.043542527619987e-07
RoW,Activity,"Lead, zinc and tin production",3.9172849030471014e-05,5.9681402431621806e-05,5.8471549191276145e-05,2.1114837184946345e-05,1.8423720862863555e-05
RoW,Activity,Manufacture of basic iron and steel and of ferro-alloys and first products thereof,0.0031695167626640446,0.0061671882762855575,0.005374166946478597,0.0019331050809709297,0.0014596712784736396
RoW,Activity,Manufacture of beverages,1.184941286705377e-05,1.3022065628276788e-05,1.1527817709550118e-05,6.091674135997711e-06,5.654431954795329e-06
RoW,Activity,"Manufacture of bricks, tiles and construction products, in baked clay",5.051323298497303e-05,4.478247158349748e-05,4.510029706458453e-05,2.006361689255681e-05,2.2328854948939098e-05
RoW,Activity,"Manufacture of cement, lime and plaster",0.0007089863939435308,0.000303633029048869,0.00035472185930317967,0.00018298778793452347,0.00029495491132638176
RoW,Activity,Manufacture of ceramic goods,0.00015766408483758868,0.0001114891599833262,0.00011658353936769378,5.756038680960564e-05,7.323230515032658e-05
RoW,Activity,Manufacture of coke oven products,0.0005270912474517898,0.0006016306472502506,0.0005473734640513544,0.00024641285302485995,0.0002342901158309522
RoW,Activity,Manufacture of electrical machinery and apparatus n.e.c. (31),0.00016703648274630356,0.0002264318680603316,0.0001569349309513454,0.00010316846731341736,8.728761744640404e-05
RoW,Activity,"Manufacture of fabricated metal products, except machinery and equipment (28)",0.0004770235971481978,0.0007301970387232979,0.0006676154561268112,0.00026344420019772016,0.0002186726354753539
RoW,Activity,Manufacture of fish products,1.297541354502195e-05,1.712993081715718e-05,1.705112113126016e-05,8.442384105222233e-06,6.489930352203297e-06
RoW,Activity,Manufacture of furniture; manufacturing n.e.c. (36),0.0002173957485930812,0.00023053012061053548,0.0002001535599559436,0.00011197910687012337,9.907626309755084e-05
RoW,Activity,Manufacture of gas; distribution of gaseous fuels through mains,0.000760849065874014,0.0005039530877048254,0.0004427298231933747,0.00023139801898390517,0.0003101514473827
RoW,Activity,Manufacture of glass and glass products,0.0020515444544103533,0.0008063865475397361,0.0006070751187302698,0.00019688493726260597,0.000689617888614754
RoW,Activity,Manufacture of machinery and equipment n.e.c. (29),0.00013886680623349215,0.0001442041997974391,0.00011727867060813547,5.656673949440293e-05,6.007653238657339e-05
RoW,Activity,"Manufacture of medical, precision and optical instruments, watches and clocks (33)",7.295939980824508e-05,0.00013470820759808934,9.020500741043314e-05,4.417454807145721e-05,3.625256668194295e-05
RoW,Activity,"Manufacture of motor vehicles, trailers and semi-trailers (34)",6.962411825773134e-05,5.636686431285768e-05,5.1659670604745516e-05,2.3891226900528137e-05,3.0245772798900213e-05
RoW,Activity,Manufacture of office machinery and computers (30),1.4846791682777638e-05,1.7297307348043335e-05,1.2143675536415298e-05,5.695464850403385e-06,6.462915085159274e-06
RoW,Activity,Manufacture of other non-metallic mineral products n.e.c.,0.003620504927878014,0.0006984528462296732,0.0007102895541255093,0.0002661276541970146,0.0012246113625648371
RoW,Activity,Manufacture of other transport equipment (35),4.03206733004694e-05,5.500911624625488e-05,4.902796055609167e-05,2.1888493815879106e-05,2.050760093344109e-05
RoW,Activity,"Manufacture of radio, television and communication equipment and apparatus (32)",0.00013962931176833034,0.00026497674884825954,0.00016608627775064212,7.660753108691499e-05,6.371156520828192e-05
RoW,Activity,Manufacture of rubber and plastic products (25),0.00018972513196181787,0.00022150432603418026,0.0001955074204518839,8.1142452445665e-05,8.431513288847641e-05
RoW,Activity,Manufacture of textiles (17),0.00026791201745648274,0.00032017228650131976,0.00028293615942245605,0.00011500242772086397,0.00011603644387931504
RoW,Activity,Manufacture of tobacco products (16),4.2325691132893366e-05,1.8315030889945387e-05,1.506242836698522e-05,6.158610179462613e-06,1.5137559767592331e-05
RoW,Activity,Manufacture of wearing apparel; dressing and dyeing of fur (18),7.902995874544895e-05,8.235651800474589e-05,7.879317670823751e-05,3.881873549730383e-05,3.766598634581448e-05
RoW,Activity,"Manufacture of wood and of products of wood and cork, except furniture; manufacture of articles of straw and plaiting materials (20)",0.0005076372166294892,0.0003946018913315173,0.0004072701114736979,0.00017303738367656013,0.00021584162001072287
RoW,Activity,"Manure treatment (biogas), storage and land application",0.0,0.0,0.0,0.0,0.0
RoW,Activity,"Manure treatment (conventional), storage and land application",0.0,0.0,0.0,0.0,0.0
RoW,Activity,Meat animals nec,1.3512695178123543e-05,1.3400453019004675e-05,1.2051251188147427e-05,6.1207368441273895e-06,6.0590828216131e-06
RoW,Activity,Mining of aluminium ores and concentrates,0.0007451952714608774,0.0005678264730637975,0.00047646165912381354,0.0001487546859800785,0.0002654002112991384
RoW,Activity,"Mining of chemical and fertilizer minerals, production of salt, other mining and quarrying n.e.c.",0.00011484364768787771,0.0002606049710446836,0.0002624982349101603,7.423708573447995e-05,4.8412030846639164e-05
RoW,Activity,Mining of coal and lignite; extraction of peat (10),0.015458840087008218,0.004852266827684347,0.004259223149921645,0.003022212777403275,0.005606503879656815
RoW,Activity,Mining of copper ores and concentrates,0.0010115465957638834,0.0016080730482190846,0.0011490156150720206,0.0003815978215497952,0.0004002565460379761
RoW,Activity,Mining of iron ores,0.000712385564601565,0.0015954721250583345,0.0010933536211263036,0.0003649876575889194,0.00029565462072371777
RoW,Activity,"Mining of lead, zinc and tin ores and concentrates",0.0002979574452142437,0.0003814551940624124,0.00035994375980182475,0.0001257446405942774,0.00012628818200672727
RoW,Activity,Mining of nickel ores and concentrates,0.00023995373049959807,0.0004027991117270464,0.0003280041049998636,0.00011242575870319271,0.00010185220984503727
RoW,Activity,Mining of other non-ferrous metal ores and concentrates,0.0010180298792889988,0.0012816168716627508,0.0011724706621244366,0.0004034600989580567,0.00042301200075918444
RoW,Activity,Mining of precious metal ores and concentrates,0.0012410484589137688,0.0004885596173763332,0.00038471955094244135,0.00015072956000364293,0.00043480677702143774
RoW,Activity,Mining of uranium and thorium ores (12),0.00010859251001941924,0.0001158681369566912,0.00010424051637162507,5.125980958804557e-05,4.87850527195951e-05
RoW,Activity,N-fertiliser,8.989519010255374e-05,8.754770270148993e-05,7.841095481382439e-05,4.965692254662631e-05,4.020810544196966e-05
RoW,Activity,Other business activities (74),8.250952661565693e-05,9.973200212639192e-05,9.097096333541223e-05,7.281240288176475e-05,5.180607722972423e-05
RoW,Activity,Other land transport,0.00011813293667651303,0.0001265198863639945,0.00012746904135915263,7.343999353076359e-05,6.71286049817829e-05
RoW,Activity,Other non-ferrous metal production,0.00022999860030985565,0.0004493271789016776,0.00035157344238900877,0.00013917166508991717,0.00011175044966366684
RoW,Activity,Other service activities (93),8.685069953720478e-06,7.927941671746602e-06,7.140459781773943e-06,3.944700863559584e-06,4.029271642147315e-06
RoW,Activity,P- and other fertiliser,0.00023855168965348985,0.00021467690298150534,0.00019156624124692524,0.00011464155791391188,0.0001040689037953806
RoW,Activity,Paper,0.00015791684007840321,0.00018732815245043024,0.00016245304530244985,8.292996918560232e-05,7.502648236005734e-05
RoW,Activity,Petroleum Refinery,0.0030914244878153005,0.0025981552484614554,0.0025499007636284408,0.0020632963774914804,0.0015515114535741416
RoW,Activity,Pigs farming,2.0093825212857613e-05,1.7889348291404094e-05,1.618934934943475e-05,8.262639944190548e-06,8.839793237362119e-06
RoW,Activity,"Plastics, basic",0.0003272597436824543,0.0003793043986578948,0.0002798975391910459,0.00011836342091721602,0.00013421193955878783
RoW,Activity,Post and telecommunications (64),5.1789063376499444e-05,5.637966762528091e-05,5.230758513793364e-05,3.670772869502992e-05,2.9319061174044893e-05
RoW,Activity,Poultry farming,1.6330639521383852e-05,1.5445424915698437e-05,1.40621383542256e-05,7.247803806423486e-06,7.347242488413496e-06
RoW,Activity,Precious metals production,0.0005090870271904043,0.00020529571869859516,0.00015269038284029276,5.967888797234658e-05,0.00017858496170226936
RoW,Activity,Private households with employed persons (95),1.1522598074425285e-06,1.0927532582863147e-06,1.0141258969067594e-06,5.798481538539356e-07,5.516356134264655e-07
RoW,Activity,Processed rice,1.3222434394622806e-05,1.1754978162842899e-05,1.0578001789755369e-05,5.011757791556714e-06,5.640894514440796e-06
RoW,Activity,Processing of Food products nec,2.459839001688373e-05,2.2527431472155364e-05,2.0204763502342853e-05,1.0057615114598919e-05,1.0801371370577088e-05
RoW,Activity,Processing of dairy products,2.239058354035454e-05,2.552272437884163e-05,1.8814585652041175e-05,8.603815488504428e-06,9.417612712506958e-06
RoW,Activity,Processing of meat cattle,7.202810620003487e-06,6.046886306843693e-06,5.3581070349164315e-06,2.697260330740046e-06,3.1106402944439645e-06
RoW,Activity,Processing of meat pigs,6.768732465637664e-06,5.848812962374562e-06,5.28824968006801e-06,2.7765557972325176e-06,2.9971306368958604e-06
RoW,Activity,Processing of meat poultry,5.646801537913218e-06,4.745130861345277e-06,4.223285489662662e-06,2.1990149764312716e-06,2.446722543455672e-06
RoW,Activity,Processing of nuclear fuel,2.8929562550186572e-05,3.3529460205887914e-05,2.7879246422996007e-05,1.1907713852749244e-05,1.2145347874904338e-05
RoW,Activity,Processing vegetable oils and fats,4.5380289125379565e-05,4.791849221538632e-05,4.003662219432679e-05,1.8258822942993102e-05,1.9366119102797958e-05
RoW,Activity,Production of electricity by Geothermal,1.601762518239642e-05,4.078912903129506e-06,3.467168755349064e-06,1.9844735956394644e-06,5.685271873629354e-06
RoW,Activity,Production of electricity by biomass and waste,0.0,0.0,0.0,0.0,0.0
RoW,Activity,Production of electricity by coal,0.052747620563597476,0.009165363541192248,0.007917433007333694,0.0040385379360889165,0.01795458981095749
RoW,Activity,Production of electricity by gas,0.023590955672753596,0.005020462152498456,0.004424421912408628,0.0026473582253405286,0.008296022704027756
RoW,Activity,Production of electricity by hydro,0.0,0.0,0.0,0.0,0.0
RoW,Activity,Production of electricity by nuclear,1.2303161557984083e-05,3.5106909420747368e-06,3.0820911576747597e-06,1.5526662020572725e-06,4.357509599186051e-06
RoW,Activity,Production of electricity by petroleum and other oil derivatives,0.008418279518415393,0.0028450842435280444,0.00247486507601508,0.0013734644330976023,0.003090682738282789
RoW,Activity,Production of electricity by solar photovoltaic,0.0,0.0,0.0,0.0,0.0
RoW,Activity,Production of electricity by solar thermal,0.0,0.0,0.0,0.0,0.0
RoW,Activity,"Production of electricity by tide, wave, ocean",0.0,0.0,0.0,0.0,0.0
RoW,Activity,Production of electricity by wind,0.0,0.0,0.0,0.0,0.0
RoW,Activity,Production of electricity nec,0.0003493107747498988,0.00016182285186264813,0.00013558378255332083,6.595102730479796e-05,0.00012985917176745832
RoW,Activity,Production of meat products nec,1.7675371907178217e-05,1.5701949903579807e-05,1.3908498006889951e-05,6.994464901620855e-06,7.700985760586583e-06
RoW,Activity,Production of offshore wind plants,0.0,0.0,0.0,0.0,0.0
RoW,Activity,Production of onshore wind plants,0.0,0.0,0.0,0.0,0.0
RoW,Activity,Production of photovoltaic plants,0.0,0.0,0.0,0.0,0.0
RoW,Activity,Public administration and defence; compulsory social security (75),1.9727820461431897e-05,1.7574162154965048e-05,1.6363718134628474e-05,1.0022062328557896e-05,9.906779939214068e-06
RoW,Activity,"Publishing, printing and reproduction of recorded media (22)",5.237125428777457e-05,5.856549688577431e-05,5.178548911276799e-05,3.4039522519821706e-05,2.8605947555359058e-05
RoW,Activity,Pulp,0.00014120667967552973,0.00011613041904289369,9.15326991146694e-05,4.419491311380143e-05,5.6779778752600715e-05
RoW,Activity,Quarrying of sand and clay,0.00017971178073743742,0.0001572608275696538,0.00014572667175437025,5.924887719989325e-05,7.346648074059702e-05
RoW,Activity,Quarrying of stone,0.0004360607087777842,0.0002144979522772468,0.00025928986482508205,8.088622091151427e-05,0.00015734990289187825
RoW,Activity,Raw milk,1.7919967820094292e-05,1.7834993624642582e-05,1.528074049582883e-05,7.724697592913689e-06,7.970697218402548e-06
RoW,Activity,Re-processing of ash into clinker,0.00011240994308711284,4.067400669552558e-05,4.916571559940099e-05,2.536604462638041e-05,4.555385847970892e-05
RoW,Activity,Re-processing of secondary aluminium into new aluminium,0.0004949547307620088,0.0006676166019630654,0.0005717527475953845,0.00017802048668162692,0.00019400134365665068
RoW,Activity,Re-processing of secondary construction material into aggregates,3.334546843239046e-05,2.3094464209379123e-05,2.4245092685562495e-05,1.603387948119961e-05,1.7121262159834454e-05
RoW,Activity,Re-processing of secondary copper into new copper,9.541494430119669e-05,0.0002833690674742095,0.00018340648474464473,6.116601162951951e-05,4.203994639914088e-05
RoW,Activity,Re-processing of secondary glass into new glass,0.0005368188350164848,0.0002082625240653703,0.00015638880757280153,5.007933653766198e-05,0.00018001477551067395
RoW,Activity,"Re-processing of secondary lead into new lead, zinc and tin",0.00013790846824296717,0.00019401288866393286,0.00018848495704480253,6.822568609918404e-05,6.296134316144232e-05
RoW,Activity,Re-processing of secondary other non-ferrous metals into new other non-ferrous metals,6.363735657608924e-05,0.0001268823628622353,9.982016480520655e-05,3.924549038899555e-05,3.103688406223232e-05
RoW,Activity,Re-processing of secondary paper into new pulp,6.241199060000674e-05,4.717761015789909e-05,3.735687102896979e-05,1.8263028777481894e-05,2.4792098645962447e-05
RoW,Activity,Re-processing of secondary plastic into new plastic,4.0186344286410915e-05,4.680512488989935e-05,3.424746837720556e-05,1.427074205391397e-05,1.6383104425214043e-05
RoW,Activity,Re-processing of secondary preciuos metals into new preciuos metals,0.0,0.0,0.0,0.0,0.0
RoW,Activity,Re-processing of secondary steel into new steel,0.0014095813942020961,0.0027781726668177965,0.002422693000115166,0.0008672617916508971,0.0006501633530936682
RoW,Activity,Re-processing of secondary wood material into new wood material,3.391350105780634e-05,2.6355654790406975e-05,2.73712145165586e-05,1.1553522357858717e-05,1.4440577496696533e-05
RoW,Activity,Real estate activities (70),2.989605037230451e-05,3.154951329043101e-05,3.0755950639616606e-05,1.9384787688295546e-05,1.721410771293913e-05
RoW,Activity,"Recreational, cultural and sporting activities (92)",8.650517184701795e-06,9.869898416602953e-06,9.059076275893671e-06,6.604826711418552e-06,5.051785280055163e-06
RoW,Activity,Recycling of bottles by direct reuse,0.0,0.0,0.0,0.0,0.0
RoW,Activity,Recycling of waste and scrap,0.0007041579507657937,0.0008937586969503589,0.0007358969950368058,0.0002822416510438966,0.00029408707413484204
RoW,Activity,Renting of machinery and equipment without operator and of personal and household goods (71),3.9344540914416524e-05,4.3145215755305604e-05,4.0484800556216554e-05,2.7501631080171874e-05,2.1818629571066426e-05
RoW,Activity,Research and development (73),0.00011441877720140161,0.00018001538008885539,0.00014510123167173534,7.571948258123785e-05,5.658382276245052e-05
RoW,Activity,Retail sale of automotive fuel,9.319375250526649e-05,8.755032714857906e-05,8.032133461838845e-05,4.548260703170478e-05,4.530631422219358e-05
RoW,Activity,"Retail trade, except of motor vehicles and motorcycles; repair of personal and household goods (52)",0.00012149548923646363,0.00010757426511453088,9.716022623314417e-05,5.1348954197813743e-05,5.4397198864472206e-05
