RoW,Activity,"Sale, maintenance, repair of motor vehicles, motor vehicles parts, motorcycles, motor cycles parts and accessoiries",3.7314776449962785e-05,3.585480404740909e-05,3.4233939012954445e-05,1.7866223728272848e-05,2.0542813184092004e-05
RoW,Activity,Sea and coastal water transport,0.008698901567927884,0.004092798390470802,0.008636460613789693,0.0022576230866334732,0.003731645587436431
RoW,Activity,Steam and hot water supply,0.002945165282437189,0.002929484304856149,0.002624979303473417,0.0014142134570763435,0.0014697685727773145
RoW,Activity,Sugar refining,1.2223628036652555e-05,1.0215003901514313e-05,8.472328743967223e-06,3.926289086043915e-06,5.3881340733666225e-06
RoW,Activity,Supporting and auxiliary transport activities; activities of travel agencies (63),0.0006168317698615263,0.0006573577147241676,0.0008355554792754612,0.00035872438040581995,0.00036125376788514226
RoW,Activity,"Tanning and dressing of leather; manufacture of luggage, handbags, saddlery, harness and footwear (19)",1.2050277280917741e-05,1.380462209886275e-05,1.1818497496304905e-05,5.306269353857701e-06,5.735587275131842e-06
RoW,Activity,Transmission of electricity,2.9497037908481806e-05,2.8886930455059044e-05,2.5359312276843977e-05,1.3057273680949472e-05,1.4350914834081095e-05
RoW,Activity,Transport via pipelines,0.0010178484524849454,0.0009656999664384178,0.0009848783411810745,0.0008577637315923075,0.002204421582999314
RoW,Activity,Transport via railways,0.00016058067856098776,0.00018454085433197123,0.00018639084474328808,9.410313091283944e-05,0.000105546841299346
RoW,Activity,"Waste water treatment, food",1.2283417061472175e-06,1.1665056160853991e-06,1.0391893241230186e-06,4.982249957490252e-07,5.829814929847365e-07
RoW,Activity,"Waste water treatment, other",1.6743462976938622e-06,1.72848225939912e-06,1.5574960674866974e-06,7.602853923820591e-07,8.294514424159726e-07
RoW,Activity,"Wholesale trade and commission trade, except of motor vehicles and motorcycles (51)",0.000163603904515041,0.00016618507312202477,0.00014764935277724575,7.659007437616102e-05,8.679525368414632e-05
RoW,Activity,"Wool, silk-worm cocoons",4.6858264087317055e-05,4.959169313056807e-05,4.540774120296545e-05,2.3417938676455398e-05,2.5206998304768877e-05
USA,Activity,Activities auxiliary to financial intermediation (67),9.841532956987566e-06,4.7618111629763295e-06,3.892966197077178e-06,2.146925799277627e-06,4.029921991339725e-06
USA,Activity,Activities of membership organisation n.e.c. (91),1.136198424769893e-06,5.870748905613783e-07,5.291632584778845e-07,3.094017970670354e-07,4.995049642465361e-07
USA,Activity,Air transport (62),0.0008759416642817375,0.000496722175624759,0.0004586740009072217,0.0002867319615442969,0.00042030208114022713
USA,Activity,Aluminium production,7.933307396494106e-05,2.3248453156080865e-05,1.6820738494773392e-05,5.79309029681377e-06,2.7268008742585683e-05
USA,Activity,Animal products nec,1.0024574161019671e-06,1.057310942518549e-06,9.567696206495163e-07,4.4569197764337535e-07,4.8964946864374e-07
USA,Activity,"Biogasification of food waste, incl. land application",0.0,0.0,0.0,0.0,0.0
USA,Activity,"Biogasification of paper, incl. land application",0.0,0.0,0.0,0.0,0.0
USA,Activity,"Biogasification of sewage slugde, incl. land application",1.196495003594136e-06,4.521790047973105e-07,4.091501974639722e-07,1.8307212599539828e-07,4.5274199542705686e-07
USA,Activity,Casting of metals,3.554731323472398e-05,2.6048175344347242e-05,2.1392534904353115e-05,9.224042062580971e-06,1.478838079858861e-05
USA,Activity,Cattle farming,7.681468625944244e-06,5.0459295747277506e-06,4.555413244695362e-06,2.2258386582048267e-06,3.3684972404714185e-06
USA,Activity,Chemicals nec,0.0021664522882440303,0.0008034485992913169,0.0007485529207827363,0.00037115347134889046,0.0008260788021409313
USA,Activity,"Collection, purification and distribution of water (41)",3.625165152552277e-07,1.0241789847917965e-07,9.285603368695428e-08,4.5748748696406356e-08,1.3582887342956615e-07
USA,Activity,"Composting of food waste, incl. land application",6.80152249105833e-08,5.2571610591309555e-08,5.381271316591912e-08,3.418977840747304e-08,3.5596633639857804e-08
USA,Activity,"Composting of paper and wood, incl. land application",3.2276353843755e-07,1.0491441253937283e-07,9.735614986463045e-08,4.9039352769198256e-08,1.2342770312138352e-07
USA,Activity,Computer and related activities (72),6.832810677536574e-06,3.993828095989322e-06,3.5382188242255614e-06,2.105754703975039e-06,3.200860831368853e-06
USA,Activity,Construction (45),2.0745864034395262e-05,2.263980887762809e-06,2.3592665266507427e-06,1.543048121950855e-06,7.532844863643211e-06
USA,Activity,Copper production,7.407287795461812e-05,8.814039325714696e-05,6.0709105766827755e-05,2.1272170360099975e-05,2.9228097793510332e-05
USA,Activity,Cultivation of cereal grains nec,3.191420363116419e-05,1.3409745987878344e-05,1.0345681931596712e-05,4.519489458535976e-06,1.1840659980386843e-05
USA,Activity,Cultivation of crops nec,2.3417959338438438e-05,1.0054992118733873e-05,8.726606968919606e-06,4.109193384867394e-06,9.019267996063022e-06
USA,Activity,Cultivation of oil seeds,5.2786254873808886e-05,3.9094969595606585e-05,2.4182404081876937e-05,9.23480149030011e-06,1.939234673635104e-05
USA,Activity,Cultivation of paddy rice,2.359640299007544e-05,1.5246825727098204e-05,1.3760825079867616e-05,6.709459422051608e-06,1.0346186606303843e-05
USA,Activity,Cultivation of plant-based fibers,1.6800342323317935e-05,1.4716513797390792e-05,1.2263707262658191e-05,5.404989005387787e-06,7.1287294243728995e-06
USA,Activity,"Cultivation of sugar cane, sugar beet",5.934639164511248e-06,2.9588608822939598e-06,2.6279148206948997e-06,1.2509080570819895e-06,2.3865197148771345e-06
USA,Activity,"Cultivation of vegetables, fruit, nuts",3.3804309969693077e-06,2.602142815806891e-06,2.3098911360435974e-06,1.0772278750142317e-06,1.4763818643062535e-06
USA,Activity,Cultivation of wheat,1.4607256687075415e-05,1.3168277906730377e-05,1.1973124579632587e-05,5.752116762344603e-06,6.754630629501794e-06
USA,Activity,Distribution and trade of electricity,6.950223685864491e-07,1.8374653039097434e-07,1.635798770682072e-07,8.080799556662117e-08,2.582608218327154e-07
USA,Activity,Education (80),3.666307148906563e-07,1.0339689223362987e-07,9.39353425872726e-08,6.47562638787855e-08,1.4768792556820504e-07
USA,Activity,Extra-territorial organizations and bodies,0.0,0.0,0.0,0.0,0.0
USA,Activity,"Extraction of crude petroleum and services related to crude oil extraction, excluding surveying",0.00020300694530684004,0.00011257720682814535,0.00011099095418059304,0.00011490344710973225,0.00010161052590190301
USA,Activity,"Extraction of natural gas and services related to natural gas extraction, excluding surveying",9.64290854698171e-05,5.455384157427414e-05,5.343621815752603e-05,4.838025723846042e-05,4.6608906065341826e-05
USA,Activity,"Extraction, liquefaction, and regasification of other petroleum and gaseous materials",5.169818929762779e-10,1.1134361436707554e-10,1.0567483550484156e-10,8.13295310667071e-11,1.9413809311599176e-10
USA,Activity,"Financial intermediation, except insurance and pension funding (65)",1.6602405147205957e-05,1.1005640807956202e-05,1.0332148078417443e-05,7.472638578329777e-06,8.975081360520763e-06
USA,Activity,"Fishing, operating of fish hatcheries and fish farms; service activities incidental to fishing (05)",1.0653318672545227e-06,1.0043690901830722e-06,9.098603816014525e-07,4.1490410128536904e-07,5.055357205830942e-07
USA,Activity,"Forestry, logging and related service activities (02)",1.2604061844773558e-05,5.294186100274911e-06,4.68627551736359e-06,1.9787353477017717e-06,4.780547891168114e-06
USA,Activity,Health and social work (85),1.4201153729754889e-07,2.543009097557955e-08,2.407485012546389e-08,2.0476028283913506e-08,5.4746439956710416e-08
USA,Activity,Hotels and restaurants (55),2.4341676443192567e-05,1.6919921612163397e-05,1.5072603741249239e-05,7.508275409524384e-06,1.1835058122926696e-05
USA,Activity,Incineration of waste: Food,2.3455803527162176e-07,1.0433351313279144e-07,9.760540530913453e-08,6.151512361468747e-08,9.4529915894703e-08
USA,Activity,Incineration of waste: Metals and Inert materials,6.210554541934493e-06,4.318811732287766e-06,5.340874081609614e-06,2.576740617585108e-06,3.1661536171760834e-06
USA,Activity,Incineration of waste: Oil/Hazardous waste,8.438736963788655e-07,5.080628336131968e-07,4.894036006625092e-07,2.771909378910737e-07,3.745055652263715e-07
USA,Activity,Incineration of waste: Paper,6.707739664091042e-07,2.682487670472608e-07,2.4880822751856224e-07,1.2240686754702173e-07,2.625687931546151e-07
USA,Activity,Incineration of waste: Plastic,9.450654069409967e-06,3.2606068048517038e-06,3.137726126568105e-06,1.7589627067226166e-06,3.732553199541788e-06
USA,Activity,Incineration of waste: Textiles,1.5857244923491142e-06,7.097710829476581e-07,6.676426000173554e-07,3.113760760139598e-07,6.304604391074435e-07
USA,Activity,Incineration of waste: Wood,1.610436500880214e-07,6.708485633829548e-08,6.645596881478836e-08,4.840201859870638e-08,6.937746387211903e-08
USA,Activity,Inland water transport,2.8197534263972053e-05,2.1249232718459215e-05,1.8062264672203558e-05,7.700569957718667e-06,1.1970875093282489e-05
USA,Activity,"Insurance and pension funding, except compulsory social security (66)",4.7209568054622895e-06,2.9157147416341815e-06,2.5607381624997143e-06,1.5865853869004402e-06,2.3656438535526246e-06
USA,Activity,Landfill of waste: Food,2.926369764076439e-07,1.1663374696236729e-07,1.0929271350005214e-07,5.053597569285195e-08,1.134465417173671e-07
USA,Activity,Landfill of waste: Inert/metal/hazardous,4.31912062498212e-07,1.5626810232287647e-07,1.432528245471374e-07,6.769588582178866e-08,1.6515136122326857e-07
USA,Activity,Landfill of waste: Paper,3.6741606886710733e-07,1.3000693133300017e-07,1.2110481780079164e-07,5.611556130330753e-08,1.3971022663760974e-07
USA,Activity,Landfill of waste: Plastic,2.6319750831088135e-07,8.577721038950938e-08,7.888736616454708e-08,3.847247093195736e-08,9.983512055029001e-08
USA,Activity,Landfill of waste: Textiles,1.1953605822601408e-07,4.109455881620386e-08,3.814701189827229e-08,1.8447813178508747e-08,4.587493321745592e-08
USA,Activity,Landfill of waste: Wood,1.5122367193209285e-07,5.102795109295568e-08,4.748031713168044e-08,2.305556527524314e-08,5.7869391079818663e-08
USA,Activity,"Lead, zinc and tin production",2.0971236217335384e-06,4.672692664909752e-06,4.661643162734863e-06,1.5235117472518913e-06,1.1068981613541463e-06
USA,Activity,Manufacture of basic iron and steel and of ferro-alloys and first products thereof,0.0001375113424773431,0.00012360761603478823,0.00010671614754210267,3.8736765652294126e-05,5.558425492436278e-05
USA,Activity,Manufacture of beverages,4.597306079074432e-06,4.430813959716026e-06,2.985383270817951e-06,1.2525685011556782e-06,1.9219310122850855e-06
USA,Activity,"Manufacture of bricks, tiles and construction products, in baked clay",5.974363833640999e-05,3.785738401540236e-06,3.16249587398206e-06,1.1805064479503152e-06,1.9889967662340646e-05
USA,Activity,"Manufacture of cement, lime and plaster",0.00012041574982542491,2.3839405616606983e-05,2.3399705137065753e-05,1.0775979941281203e-05,4.3508292359401666e-05
USA,Activity,Manufacture of ceramic goods,2.780568508022538e-05,3.022244316195309e-06,3.4210314172125103e-06,1.6886736333956313e-06,1.00096874682637e-05
USA,Activity,Manufacture of coke oven products,1.1146924860878811e-05,1.0263925589784593e-05,8.757663469098643e-06,2.986776347219303e-06,4.392860274589417e-06
USA,Activity,Manufacture of electrical machinery and apparatus n.e.c. (31),3.82691634062914e-05,3.3813469080943064e-05,2.3996114419479918e-05,1.3328857155585346e-05,1.7616051503569773e-05
USA,Activity,"Manufacture of fabricated metal products, except machinery and equipment (28)",2.8507203704790303e-05,1.9280887581300566e-05,1.692485335311706e-05,6.6377810784397375e-06,1.1344158204516355e-05
USA,Activity,Manufacture of fish products,3.106194949439068e-06,3.3336524090176462e-06,3.0296238729268763e-06,1.3619976126026433e-06,1.5323188436176073e-06
USA,Activity,Manufacture of furniture; manufacturing n.e.c. (36),5.6266728301414416e-05,3.150838234473831e-05,2.7589963629163175e-05,1.394652568818638e-05,2.2617829814172173e-05
USA,Activity,Manufacture of gas; distribution of gaseous fuels through mains,0.00017660196009215256,1.8828201691015567e-05,1.655474053953218e-05,8.222784333307097e-06,6.045707954256031e-05
USA,Activity,Manufacture of glass and glass products,0.0036025396698388516,7.862778675363855e-05,5.870551303613766e-05,1.7272972369755135e-05,0.001181390446002119
USA,Activity,Manufacture of machinery and equipment n.e.c. (29),3.118849521121781e-05,2.3224160159256696e-05,1.920564301352186e-05,7.943449909365331e-06,1.276456476497151e-05
USA,Activity,"Manufacture of medical, precision and optical instruments, watches and clocks (33)",8.15106961686904e-06,1.1826436212734045e-05,8.672197595972116e-06,3.910804929233466e-06,4.001121588733929e-06
USA,Activity,"Manufacture of motor vehicles, trailers and semi-trailers (34)",4.2360629831423785e-05,2.5747062721474372e-05,2.2445736957782765e-05,9.564045009174292e-06,1.7851154234470457e-05
USA,Activity,Manufacture of office machinery and computers (30),5.820399981898963e-06,7.027945442060162e-06,5.231726342072558e-06,2.406825264277665e-06,2.738084116244183e-06
USA,Activity,Manufacture of other non-metallic mineral products n.e.c.,0.00042988788710171636,2.3067813526150025e-05,2.574844668576447e-05,8.529290783096121e-06,0.00014312415671859948
USA,Activity,Manufacture of other transport equipment (35),4.330963465075679e-05,4.433926859037205e-05,3.723010175383736e-05,1.577455495855605e-05,2.045932999863321e-05
USA,Activity,"Manufacture of radio, television and communication equipment and apparatus (32)",1.4830389797574933e-05,1.1631927041462298e-05,8.995083417368905e-06,4.620708443482281e-06,6.415692553613308e-06
USA,Activity,Manufacture of rubber and plastic products (25),1.0956389672095989e-05,5.714825113056682e-06,5.11576580922573e-06,2.1916761354893386e-06,4.358292803031059e-06
USA,Activity,Manufacture of textiles (17),3.475427644683231e-05,1.8761287216465467e-05,1.6816691874672855e-05,7.756586558100058e-06,1.3914706103071743e-05
USA,Activity,Manufacture of tobacco products (16),8.913708984375428e-07,8.935476471132759e-07,7.129868462357612e-07,2.7371361065211055e-07,3.709565828276455e-07
USA,Activity,Manufacture of wearing apparel; dressing and dyeing of fur (18),3.5655891809641104e-07,2.1874579871082494e-07,1.9565675734742942e-07,9.740410213273004e-08,1.5528491211815252e-07
USA,Activity,"Manufacture of wood and of products of wood and cork, except furniture; manufacture of articles of straw and plaiting materials (20)",4.573246241702029e-05,1.7588689928571256e-05,1.7073557892704595e-05,6.8413014665561534e-06,1.730350624974723e-05
USA,Activity,"Manure treatment (biogas), storage and land application",0.0,0.0,0.0,0.0,0.0
USA,Activity,"Manure treatment (conventional), storage and land application",0.0,0.0,0.0,0.0,0.0
USA,Activity,Meat animals nec,1.2235796279361565e-08,6.056517477885768e-09,5.684837032045283e-09,2.6472188858164345e-09,4.990612809451267e-09
USA,Activity,Mining of aluminium ores and concentrates,3.2615725896094794e-06,1.0861180884841942e-07,8.442750210250516e-08,2.791960917589841e-08,1.0730590198784336e-06
USA,Activity,"Mining of chemical and fertilizer minerals, production of salt, other mining and quarrying n.e.c.",6.92528966809118e-05,4.38388901984269e-05,4.3941611747940965e-05,1.470015619954806e-05,2.615519424282076e-05
USA,Activity,Mining of coal and lignite; extraction of peat (10),0.0009590161458025277,8.549383575877548e-05,8.426073064397015e-05,4.657810182056965e-05,0.00033237541593781174
USA,Activity,Mining of copper ores and concentrates,5.556102113654342e-05,4.2958595047706365e-05,3.3362420219153755e-05,1.1698349541020325e-05,2.1192554796364885e-05
USA,Activity,Mining of iron ores,1.4826627303253223e-05,7.21103329924294e-06,6.189881138264964e-06,2.317754446149642e-06,5.50129647041157e-06
USA,Activity,"Mining of lead, zinc and tin ores and concentrates",8.799564835805562e-06,8.76714408276034e-06,8.833201055043303e-06,2.7664302453919596e-06,3.5730287112645216e-06
USA,Activity,Mining of nickel ores and concentrates,0.0,0.0,0.0,0.0,0.0
USA,Activity,Mining of other non-ferrous metal ores and concentrates,3.225541636374104e-06,3.5501773442741074e-06,3.2013313890306423e-06,1.248461922908619e-06,1.4315321906835317e-06
USA,Activity,Mining of precious metal ores and concentrates,0.0014173497137546852,8.147809656321811e-05,6.504692983365324e-05,2.4379228399843487e-05,0.00047085658866987
USA,Activity,Mining of uranium and thorium ores (12),1.0427095769202188e-05,5.369031062302676e-06,4.693666619253508e-06,2.0585878828429676e-06,4.024397012275143e-06
USA,Activity,N-fertiliser,8.472104453104453e-06,2.485609895761848e-06,2.1539447992079413e-06,1.3179879416349311e-06,3.0880051652638977e-06
USA,Activity,Other business activities (74),0.0001394778437882401,8.596324664526758e-05,7.78922451656163e-05,4.5338496395848605e-05,6.509410823735306e-05
USA,Activity,Other land transport,1.1748696920278496e-08,3.627358970727662e-09,3.45022112708787e-09,1.9542673828531656e-09,5.22508495913135e-09
USA,Activity,Other non-ferrous metal production,1.653140090388219e-05,1.8984870102079955e-05,1.7022158725460405e-05,6.431093681761893e-06,7.16389771521568e-06
USA,Activity,Other service activities (93),9.680754251701895e-07,3.4180628557696325e-07,3.0992041592270717e-07,1.6845208618436665e-07,3.9090035039755866e-07
USA,Activity,P- and other fertiliser,4.1429321693531276e-05,1.7860907747487605e-05,1.5885730271263956e-05,8.197510515867466e-06,1.6043554133822004e-05
USA,Activity,Paper,0.0004339824239890138,0.00013070813562079736,0.000112480230444242,5.328994225691704e-05,0.00016025144487206297
USA,Activity,Petroleum Refinery,0.00041398574536862843,0.0002472581340905619,0.00024329352100029315,0.00026231867653811534,0.0002159403574661453
USA,Activity,Pigs farming,4.3341330406415344e-06,2.4442973188632276e-06,2.15132185626741e-06,1.0350591836696605e-06,1.8070439460558978e-06
USA,Activity,"Plastics, basic",4.810129746050889e-05,4.018425134469781e-05,3.3424836282001904e-05,1.4325689360752517e-05,1.998570204458338e-05
USA,Activity,Post and telecommunications (64),2.4577263690877465e-05,1.2612757170757373e-05,1.1674783645477106e-05,7.404936153719938e-06,1.131026641091863e-05
USA,Activity,Poultry farming,3.54987556111184e-06,2.6914990022033133e-06,2.417563167768416e-06,1.1738632463424385e-06,1.6205807411419012e-06
USA,Activity,Precious metals production,0.0008521982140517995,3.966577179457001e-05,3.2769438185155015e-05,1.2413013533777638e-05,0.00028259138913181965
USA,Activity,Private households with employed persons (95),2.566180558177865e-09,3.0005497357842116e-09,3.1402051239598596e-09,2.3649511751746767e-09,2.349065153009113e-09
USA,Activity,Processed rice,3.3872474055947686e-06,3.421326026476702e-06,3.1589904587743135e-06,1.5173861151449413e-06,1.603515095444851e-06
USA,Activity,Processing of Food products nec,1.1984298397713525e-05,6.351427046584156e-06,5.471857841448127e-06,2.604414525113693e-06,4.885412599966039e-06
USA,Activity,Processing of dairy products,1.4603929270273831e-05,7.900173694497117e-06,6.855496332103851e-06,3.280534372739562e-06,6.104706147077303e-06
USA,Activity,Processing of meat cattle,2.311695432668968e-06,1.4923654162425672e-06,1.3608715886382497e-06,6.681381283748431e-07,1.0194356268544938e-06
USA,Activity,Processing of meat pigs,8.30294626713605e-07,4.7560511192340854e-07,4.178812569843971e-07,2.0112584333084377e-07,3.4767216992534005e-07
USA,Activity,Processing of meat poultry,7.066839693547777e-07,5.55424046195211e-07,5.003801053696801e-07,2.436642513033126e-07,3.312263631424978e-07
USA,Activity,Processing of nuclear fuel,1.0789503331231026e-08,9.486452850228271e-09,5.7102477300580675e-09,2.0094954651116666e-09,3.894251797734942e-09
USA,Activity,Processing vegetable oils and fats,9.810439588295089e-06,6.433547360733701e-06,5.858850413052564e-06,2.8072498065985067e-06,4.14833614039387e-06
USA,Activity,Production of electricity by Geothermal,6.888586445155996e-07,3.469017978116871e-09,3.0748255711180534e-09,1.4418959617572902e-09,2.258126118873548e-07
USA,Activity,Production of electricity by biomass and waste,0.0,0.0,0.0,0.0,0.0
USA,Activity,Production of electricity by coal,0.10490775019025342,0.0015654701137297533,0.0013569023943612926,0.0006264828211519811,0.034523087024299945
USA,Activity,Production of electricity by gas,0.10557547930099688,0.0005336372350604431,0.0004645954233672192,0.00021522341240896598,0.034601615788680457
USA,Activity,Production of electricity by hydro,0.0,0.0,0.0,0.0,0.0
USA,Activity,Production of electricity by nuclear,3.25077587262579e-05,2.554565512124068e-07,2.2223155800267005e-07,1.0314447541795923e-07,1.0666902883924295e-05
USA,Activity,Production of electricity by petroleum and other oil derivatives,0.0017275812786482795,1.8883418292971084e-05,1.6907402194575857e-05,8.205975191415415e-06,0.0005678972398701983
USA,Activity,Production of electricity by solar photovoltaic,0.0,0.0,0.0,0.0,0.0
USA,Activity,Production of electricity by solar thermal,0.0,0.0,0.0,0.0,0.0
USA,Activity,"Production of electricity by tide, wave, ocean",0.0,0.0,0.0,0.0,0.0
USA,Activity,Production of electricity by wind,0.0,0.0,0.0,0.0,0.0
USA,Activity,Production of electricity nec,9.912997729815956e-06,5.299085650914478e-08,4.68444335623069e-08,2.201123353964102e-08,3.2499220364680263e-06
USA,Activity,Production of meat products nec,2.2258860607699375e-05,1.3070941942336034e-05,1.1423881404863694e-05,5.450049898338857e-06,9.079376871827325e-06
USA,Activity,Production of offshore wind plants,0.0,0.0,0.0,0.0,0.0
USA,Activity,Production of onshore wind plants,0.0,0.0,0.0,0.0,0.0
USA,Activity,Production of photovoltaic plants,0.0,0.0,0.0,0.0,0.0
USA,Activity,Public administration and defence; compulsory social security (75),3.715017837661944e-05,2.9248215939459594e-06,2.5803105796938102e-06,1.459143861240105e-06,1.2834371858678188e-05
USA,Activity,"Publishing, printing and reproduction of recorded media (22)",3.829548798348943e-05,2.4190065068735868e-05,2.1687462799184715e-05,1.2772167907147396e-05,1.8070662811133627e-05
USA,Activity,Pulp,1.6282710542304814e-05,9.671412031872557e-06,7.2575088180574915e-06,3.2872721255405877e-06,6.316410226685722e-06
USA,Activity,Quarrying of sand and clay,0.00014516766092520958,1.935938099505006e-05,1.7457759776331966e-05,6.47126361131884e-06,4.961053466703724e-05
USA,Activity,Quarrying of stone,3.078396803644424e-05,5.931799934181885e-06,6.932245359819331e-06,2.6366520794769782e-06,1.0901168589985743e-05
USA,Activity,Raw milk,2.962699774521137e-06,1.5934647567186756e-06,1.3828072710796348e-06,6.619145177148742e-07,1.2369841555333108e-06
USA,Activity,Re-processing of ash into clinker,0.0,0.0,0.0,0.0,0.0
USA,Activity,Re-processing of secondary aluminium into new aluminium,0.0,0.0,0.0,0.0,0.0
USA,Activity,Re-processing of secondary construction material into aggregates,0.0,0.0,0.0,0.0,0.0
USA,Activity,Re-processing of secondary copper into new copper,0.0,0.0,0.0,0.0,0.0
USA,Activity,Re-processing of secondary glass into new glass,0.0,0.0,0.0,0.0,0.0
USA,Activity,"Re-processing of secondary lead into new lead, zinc and tin",0.0,0.0,0.0,0.0,0.0
USA,Activity,Re-processing of secondary other non-ferrous metals into new other non-ferrous metals,0.0,0.0,0.0,0.0,0.0
USA,Activity,Re-processing of secondary paper into new pulp,0.0,0.0,0.0,0.0,0.0
USA,Activity,Re-processing of secondary plastic into new plastic,0.0,0.0,0.0,0.0,0.0
USA,Activity,Re-processing of secondary preciuos metals into new preciuos metals,0.0,0.0,0.0,0.0,0.0
USA,Activity,Re-processing of secondary steel into new steel,0.0,0.0,0.0,0.0,0.0
USA,Activity,Re-processing of secondary wood material into new wood material,0.0,0.0,0.0,0.0,0.0
USA,Activity,Real estate activities (70),1.1166240507535097e-05,6.140988703609942e-06,5.70286031036419e-06,3.2953389023805002e-06,5.253095921763406e-06
USA,Activity,"Recreational, cultural and sporting activities (92)",4.298142766926164e-06,2.5050556628845767e-06,2.2730217560043332e-06,1.3305035114574502e-06,1.980271158525976e-06
USA,Activity,Recycling of bottles by direct reuse,0.0,0.0,0.0,0.0,0.0
USA,Activity,Recycling of waste and scrap,0.00026901923557259876,0.00010238056532991,8.935737847031359e-05,3.992685761584591e-05,0.00010110021255140828
USA,Activity,Renting of machinery and equipment without operator and of personal and household goods (71),1.5231724938194036e-05,7.311750625931608e-06,6.540327725899301e-06,3.498989552662768e-06,6.415367335407176e-06
USA,Activity,Research and development (73),1.0112737802109852e-05,1.319296858257868e-05,1.0561374360366302e-05,4.26524322008187e-06,4.499069586207494e-06
USA,Activity,Retail sale of automotive fuel,2.3094004354147182e-07,1.4238737560714242e-07,1.497193574326507e-07,8.569393903087474e-08,1.1279396875322091e-07
USA,Activity,"Retail trade, except of motor vehicles and motorcycles; repair of personal and household goods (52)",2.6634786621187116e-06,4.7445773858984577e-07,4.033300333527191e-07,2.0175834164225648e-07,9.398451279823583e-07
USA,Activity,"Sale, maintenance, repair of motor vehicles, motor vehicles parts, motorcycles, motor cycles parts and accessoiries",1.8828104878595422e-05,3.90791491113938e-06,3.3441149870436833e-06,1.5745993497925806e-06,6.711788580424845e-06
USA,Activity,Sea and coastal water transport,0.00024445649942820576,0.00011052969449695075,0.00022595256357156907,5.763938966768534e-05,0.00010279547580268341
USA,Activity,Steam and hot water supply,0.00041312186111064684,0.00013090008104885717,0.00011968406634138357,6.142180202261884e-05,0.00015744013497453885
USA,Activity,Sugar refining,8.821904965222157e-07,5.538600322928238e-07,4.799154634943442e-07,2.2465428067195908e-07,3.8103423931880387e-07
