RoW,Activity,Sea and coastal water transport,0.013759927049031678,0.0053060287929089685,0.011297605218386079,0.004866135756751659,0.00836072405636832
RoW,Activity,Steam and hot water supply,0.004444764267974247,0.004359038756369949,0.0038836225578595196,0.0028503104243434198,0.0030807290486920495
RoW,Activity,Sugar refining,1.1061731316776459e-05,9.457186276867069e-06,8.280278652960727e-06,5.523553173615013e-06,7.321176270824237e-06
RoW,Activity,Supporting and auxiliary transport activities; activities of travel agencies (63),0.0007161261491937112,0.0006981471528371141,0.0008107581630841538,0.0005213128784115071,0.0005419169955741399
RoW,Activity,"Tanning and dressing of leather; manufacture of luggage, handbags, saddlery, harness and footwear (19)",1.1789549163324448e-05,1.3887660709576515e-05,1.2282939237234366e-05,8.007019806164717e-06,8.113905650164234e-06
RoW,Activity,Transmission of electricity,3.822270843275136e-05,3.693919040713834e-05,3.227937528311549e-05,2.4211700290298192e-05,2.6501415852403625e-05
RoW,Activity,Transport via pipelines,0.0016456475280462242,0.0013900924574585265,0.001387823079333915,0.0012853601700613762,0.0015710176078543546
RoW,Activity,Transport via railways,0.00020547177102677588,0.00021369610557205675,0.00020752489972166113,0.0001513978901506934,0.0001667198631710506
RoW,Activity,"Waste water treatment, food",1.9003309520189035e-06,1.879469541752477e-06,1.663534693169967e-06,1.1511077192346229e-06,1.2997907667297708e-06
RoW,Activity,"Waste water treatment, other",2.6627327794844227e-06,2.523981075736954e-06,2.2429921952926487e-06,1.5542452671170048e-06,1.812280527775471e-06
RoW,Activity,"Wholesale trade and commission trade, except of motor vehicles and motorcycles (51)",0.00019712724160199458,0.00019868324047762803,0.0001729208874934808,0.000129402270266261,0.00016791714186518828
RoW,Activity,"Wool, silk-worm cocoons",4.93967901159745e-05,5.3584035467602875e-05,4.957543767420758e-05,3.4852936677216724e-05,3.6143116191456985e-05
USA,Activity,Activities auxiliary to financial intermediation (67),1.807376214608126e-05,8.37188344928285e-06,6.739364116702534e-06,5.182396265991876e-06,1.128029894917107e-05
USA,Activity,Activities of membership organisation n.e.c. (91),1.3734036951990813e-06,6.093572412027344e-07,5.370782819009193e-07,4.365011806108162e-07,8.89195802194303e-07
USA,Activity,Air transport (62),0.0008523031403645526,0.0006625872784177248,0.0006164161421739431,0.0004921639725353692,0.0006270713978379777
USA,Activity,Aluminium production,0.00013669840785565153,4.051420543460922e-05,3.0485170298947694e-05,1.7674141085298972e-05,7.760164407206697e-05
USA,Activity,Animal products nec,6.533964365971743e-07,6.723193674434581e-07,6.03917294587873e-07,3.937607244126353e-07,4.5095695156324156e-07
USA,Activity,"Biogasification of food waste, incl. land application",0.0,0.0,0.0,0.0,0.0
USA,Activity,"Biogasification of paper, incl. land application",0.0,0.0,0.0,0.0,0.0
USA,Activity,"Biogasification of sewage slugde, incl. land application",2.2267330675709993e-06,8.035213785583415e-07,7.470460537678642e-07,4.826324374622439e-07,1.323784337675584e-06
USA,Activity,Casting of metals,5.24199873467668e-05,3.3921931118326704e-05,2.7836665711362787e-05,1.9138691510652785e-05,3.294439603841124e-05
USA,Activity,Cattle farming,6.989366315800576e-06,4.438667111932017e-06,3.944920279604712e-06,2.749581143081298e-06,4.60678365264449e-06
USA,Activity,Chemicals nec,0.004465625786481415,0.0014648581783252416,0.0013390509034140324,0.0008451798018869966,0.002598861954683302
USA,Activity,"Collection, purification and distribution of water (41)",6.062494062714242e-07,1.5478645815087344e-07,1.455290618010258e-07,9.764684456565035e-08,3.5785562603150525e-07
USA,Activity,"Composting of food waste, incl. land application",2.3249437613703085e-07,1.5176441479086093e-07,1.568575616517966e-07,1.190612766269678e-07,1.562601040767609e-07
USA,Activity,"Composting of paper and wood, incl. land application",6.382185731968149e-07,2.023271554874899e-07,2.0457157361876008e-07,1.2958502014128989e-07,3.8118640295354243e-07
USA,Activity,Computer and related activities (72),9.615070039044273e-06,5.206421192678241e-06,4.525598692225388e-06,3.829661181481107e-06,6.561108349712022e-06
USA,Activity,Construction (45),1.0652667345106005e-05,8.239899538164911e-07,8.130289815296129e-07,6.519659871161842e-07,6.105621651711583e-06
USA,Activity,Copper production,0.0001309006868094502,0.00019414297495847017,0.00012984630248575932,7.678967167261955e-05,8.045817153473285e-05
USA,Activity,Cultivation of cereal grains nec,1.81889936637889e-05,1.1415748638391185e-05,9.901665942353976e-06,6.440849376810644e-06,1.1304491099642166e-05
USA,Activity,Cultivation of crops nec,1.8635011663310878e-05,7.699139906950603e-06,6.521059397077876e-06,4.409636377903852e-06,1.1216574160207518e-05
USA,Activity,Cultivation of oil seeds,9.632810591848396e-05,6.483555299277196e-05,3.748122520546509e-05,2.3124914997150297e-05,5.527831189993899e-05
USA,Activity,Cultivation of paddy rice,3.242020571622336e-05,1.9876736408167384e-05,1.759291472105388e-05,1.1637317162378861e-05,2.0847537904895507e-05
USA,Activity,Cultivation of plant-based fibers,4.966199566517541e-05,3.831121280994242e-05,3.088911991453508e-05,1.8967930320010562e-05,3.0304197874438755e-05
USA,Activity,"Cultivation of sugar cane, sugar beet",2.4140944442808504e-06,1.5128500650889954e-06,1.318498121403748e-06,8.815283883592557e-07,1.5384812362592248e-06
USA,Activity,"Cultivation of vegetables, fruit, nuts",2.000599228889245e-06,1.5078173825501963e-06,1.3400869854812708e-06,8.927100870401369e-07,1.293911089627571e-06
USA,Activity,Cultivation of wheat,3.9412288923153924e-05,4.104350630120153e-05,3.719602277071922e-05,2.4192311597341392e-05,2.6156645875937058e-05
USA,Activity,Distribution and trade of electricity,1.0708487836288347e-06,2.461507755957874e-07,2.1736625637749616e-07,1.538478353266618e-07,6.287417283093612e-07
USA,Activity,Education (80),3.088605509434788e-07,9.26501234529188e-08,8.352444081298983e-08,7.76155330137943e-08,1.9505235721882455e-07
USA,Activity,Extra-territorial organizations and bodies,0.0,0.0,0.0,0.0,0.0
USA,Activity,"Extraction of crude petroleum and services related to crude oil extraction, excluding surveying",0.00029203175612006445,0.00012105329862683553,0.00011872047864819671,0.00011810666333013745,0.0001904343545836343
USA,Activity,"Extraction of natural gas and services related to natural gas extraction, excluding surveying",0.00011137709780999014,6.171229869528003e-05,5.893278264503831e-05,6.0204774145489786e-05,7.884280698786362e-05
USA,Activity,"Extraction, liquefaction, and regasification of other petroleum and gaseous materials",7.383591671494876e-10,1.9506878199617422e-10,1.7908626816669743e-10,1.4628663023639935e-10,4.403437164330305e-10
USA,Activity,"Financial intermediation, except insurance and pension funding (65)",1.83702249123412e-05,1.2472614402399901e-05,1.1579380634848233e-05,1.1053252077329615e-05,1.3979675851669425e-05
USA,Activity,"Fishing, operating of fish hatcheries and fish farms; service activities incidental to fishing (05)",1.2837070198731322e-06,1.195909688688983e-06,1.0805804723071928e-06,7.162181989929038e-07,8.905701861353299e-07
USA,Activity,"Forestry, logging and related service activities (02)",1.942380677318756e-05,7.511882769672504e-06,6.155601201623097e-06,4.040424977029146e-06,1.1508591135753034e-05
USA,Activity,Health and social work (85),9.176801287410013e-08,2.6688996149919422e-08,2.3591474780515948e-08,2.0946151727197058e-08,5.702221326967017e-08
USA,Activity,Hotels and restaurants (55),3.068769544257462e-05,2.279162643208808e-05,1.956918089905594e-05,1.3939344169398457e-05,2.273505356996186e-05
USA,Activity,Incineration of waste: Food,5.499205551818327e-07,2.3511184676939776e-07,2.407603253321115e-07,1.621208255585869e-07,3.401656954571698e-07
USA,Activity,Incineration of waste: Metals and Inert materials,1.1552382992718268e-05,7.927894438543803e-06,9.85422131530235e-06,6.859919758318804e-06,8.273419739805462e-06
USA,Activity,Incineration of waste: Oil/Hazardous waste,1.917212381727653e-06,1.3965176372944966e-06,1.4054812587535628e-06,1.0501562634717764e-06,1.2862759240844327e-06
USA,Activity,Incineration of waste: Paper,1.0381482122760292e-06,3.7105545376590674e-07,3.8973674484591205e-07,2.5652407141934507e-07,6.31784436456805e-07
USA,Activity,Incineration of waste: Plastic,1.7533971914607964e-05,5.908267887245708e-06,6.0155774491918685e-06,4.14474018290791e-06,1.0660275359986743e-05
USA,Activity,Incineration of waste: Textiles,4.201905895076588e-06,1.5196256022868968e-06,1.5337522234808103e-06,9.470137508242612e-07,2.518704296773299e-06
USA,Activity,Incineration of waste: Wood,1.0715229219254132e-06,3.9002093005441444e-07,3.705347432494843e-07,2.1116229011680244e-07,6.265282434020146e-07
USA,Activity,Inland water transport,1.5344312169074276e-05,1.102597984719701e-05,9.471896946018431e-06,6.184796150374843e-06,9.921523437082256e-06
USA,Activity,"Insurance and pension funding, except compulsory social security (66)",4.6126526787739225e-06,3.0285548192991113e-06,2.490693671589638e-06,2.332335047173531e-06,3.341711899605639e-06
USA,Activity,Landfill of waste: Food,6.184151317191917e-07,2.239189288688744e-07,2.2370947929290915e-07,1.4449451152269945e-07,3.7316854520709025e-07
USA,Activity,Landfill of waste: Inert/metal/hazardous,9.407401981119121e-07,3.795826033306426e-07,3.688951743418049e-07,2.4217718167425766e-07,5.727273254825088e-07
USA,Activity,Landfill of waste: Paper,6.943226109283586e-07,2.3592553707466916e-07,2.3545839754294677e-07,1.5099639228255016e-07,4.159419591906184e-07
USA,Activity,Landfill of waste: Plastic,5.73318053193818e-07,1.7782404127450015e-07,1.76919477806489e-07,1.1394920229996699e-07,3.425379668538655e-07
USA,Activity,Landfill of waste: Textiles,3.5564063873207603e-07,1.1714367263346068e-07,1.2140155628311337e-07,7.595838491132917e-08,2.1317737416245005e-07
USA,Activity,Landfill of waste: Wood,4.2118548863123946e-07,1.4395726583751225e-07,1.4974110508735173e-07,9.328048604056731e-08,2.528673695921104e-07
USA,Activity,"Lead, zinc and tin production",5.22341197025412e-06,1.202903837131972e-05,1.1989681300528248e-05,6.604676151305145e-06,3.926615569735228e-06
USA,Activity,Manufacture of basic iron and steel and of ferro-alloys and first products thereof,0.00025629714186969584,0.0002514047409733942,0.000209896643966238,0.00012230038460824162,0.00015837449013217164
USA,Activity,Manufacture of beverages,2.111881366152643e-06,2.385364207308516e-06,2.0119707365408662e-06,1.4790375214748164e-06,1.5208520378330547e-06
USA,Activity,"Manufacture of bricks, tiles and construction products, in baked clay",0.0002570842084412186,1.4987934728125343e-05,1.2137189061949538e-05,7.36745997141347e-06,0.00014326693212094471
USA,Activity,"Manufacture of cement, lime and plaster",0.00010665312155735084,1.6752840722752474e-05,1.539196668851111e-05,1.0581871164292001e-05,6.15065664671194e-05
USA,Activity,Manufacture of ceramic goods,1.8045904016799774e-05,8.754032708596564e-06,9.660188550678938e-06,7.330507612800529e-06,1.2856825411120784e-05
USA,Activity,Manufacture of coke oven products,1.6752997538396387e-05,1.6835721864673543e-05,1.450041336657867e-05,8.571888532696812e-06,1.0499869381486646e-05
USA,Activity,Manufacture of electrical machinery and apparatus n.e.c. (31),4.3969725055032464e-05,3.841424635012486e-05,2.656352880791053e-05,2.25598904703752e-05,3.0124670025488147e-05
USA,Activity,"Manufacture of fabricated metal products, except machinery and equipment (28)",3.776269800648701e-05,2.093124934675896e-05,1.8081120112992362e-05,1.144342070886409e-05,2.2860396538799814e-05
USA,Activity,Manufacture of fish products,5.667899519683758e-06,6.113345415896139e-06,5.4617062107854105e-06,3.866238723540786e-06,3.922188309278147e-06
USA,Activity,Manufacture of furniture; manufacturing n.e.c. (36),7.311012492465663e-05,3.0419657311715113e-05,2.6290888758515365e-05,1.9495009696924062e-05,4.419369659727043e-05
USA,Activity,Manufacture of gas; distribution of gaseous fuels through mains,0.000277146595628141,1.4035355989446592e-05,1.2083103766824925e-05,8.490056816514528e-06,0.000155138714598276
USA,Activity,Manufacture of glass and glass products,0.009666518851248848,0.00016190148792311304,0.00012095513436512234,6.694652427660324e-05,0.005349734851990337
USA,Activity,Manufacture of machinery and equipment n.e.c. (29),3.548363071210793e-05,2.3970791724072003e-05,2.0244767521611535e-05,1.3984928039928063e-05,2.2466671735729376e-05
USA,Activity,"Manufacture of medical, precision and optical instruments, watches and clocks (33)",8.030910949310133e-06,1.0632176807508773e-05,7.865073350692358e-06,6.011823619717072e-06,5.864975598000368e-06
USA,Activity,"Manufacture of motor vehicles, trailers and semi-trailers (34)",4.418669383839646e-05,2.3575513599628607e-05,2.0511132631228168e-05,1.3585254345821795e-05,2.7766912022832135e-05
USA,Activity,Manufacture of office machinery and computers (30),8.815655952400513e-06,1.181700180341382e-05,9.197579128088767e-06,6.463798406059277e-06,6.319682297378974e-06
USA,Activity,Manufacture of other non-metallic mineral products n.e.c.,0.001016860687205148,4.230147165029027e-05,4.401874170109618e-05,2.4765699392211013e-05,0.0005661110556952291
USA,Activity,Manufacture of other transport equipment (35),3.989240299559849e-05,4.329417529750705e-05,3.833464118691677e-05,2.477326652171606e-05,2.8018566490079904e-05
USA,Activity,"Manufacture of radio, television and communication equipment and apparatus (32)",2.1819437345988565e-05,2.2727808620786386e-05,1.4865857209577298e-05,1.1014590125323165e-05,1.395521228601673e-05
USA,Activity,Manufacture of rubber and plastic products (25),1.790199159332372e-05,7.832541019706518e-06,6.743347061925561e-06,4.406710553515251e-06,1.0776340803652919e-05
USA,Activity,Manufacture of textiles (17),4.677792902433777e-05,2.2224791493116107e-05,1.9567023312353313e-05,1.2591678800139658e-05,2.8167309686279177e-05
USA,Activity,Manufacture of tobacco products (16),3.614661753230504e-07,3.0269611604164016e-07,2.59258858932734e-07,1.614863951057402e-07,2.2921855607395737e-07
USA,Activity,Manufacture of wearing apparel; dressing and dyeing of fur (18),2.8746277443156907e-07,1.779523986142454e-07,1.631313068119995e-07,1.1976737203574237e-07,1.9071604617630208e-07
USA,Activity,"Manufacture of wood and of products of wood and cork, except furniture; manufacture of articles of straw and plaiting materials (20)",8.920903615880607e-05,2.9047204997268802e-05,2.6014423881960265e-05,1.6906510730209562e-05,5.2922982394656854e-05
USA,Activity,"Manure treatment (biogas), storage and land application",0.0,0.0,0.0,0.0,0.0
USA,Activity,"Manure treatment (conventional), storage and land application",0.0,0.0,0.0,0.0,0.0
USA,Activity,Meat animals nec,6.796361211175869e-08,4.8182990423557123e-08,4.4597321832343356e-08,2.9726335382003566e-08,4.408836814689551e-08
USA,Activity,Mining of aluminium ores and concentrates,2.6296705815181588e-06,1.7292737530971594e-07,1.3779746908005378e-07,8.074479287375436e-08,1.463451756840425e-06
USA,Activity,"Mining of chemical and fertilizer minerals, production of salt, other mining and quarrying n.e.c.",4.175815182112154e-05,3.959477176374571e-05,3.805720198775322e-05,2.0487009046818825e-05,2.5366562836657053e-05
USA,Activity,Mining of coal and lignite; extraction of peat (10),0.0016327651751349365,0.0001917989346853744,0.00019054402987011648,0.00015849069059602647,0.0009433248221873351
USA,Activity,Mining of copper ores and concentrates,7.369383509742718e-05,4.2511020046464895e-05,2.6646181523751748e-05,1.6100394788677134e-05,4.233479237205991e-05
USA,Activity,Mining of iron ores,4.939830693533342e-06,3.49493681360451e-06,2.835820108029909e-06,1.6960968219897152e-06,2.9690289869351246e-06
USA,Activity,"Mining of lead, zinc and tin ores and concentrates",1.9542551339992213e-06,2.2295682648719466e-06,2.159976311296572e-06,1.1667299790805255e-06,1.2418930285798254e-06
USA,Activity,Mining of nickel ores and concentrates,0.0,0.0,0.0,0.0,0.0
USA,Activity,Mining of other non-ferrous metal ores and concentrates,5.76376963290378e-06,6.484590946404984e-06,5.750197265947453e-06,3.4991675220367214e-06,3.786735618523419e-06
USA,Activity,Mining of precious metal ores and concentrates,0.0009359753182175906,5.005440840601556e-05,3.911198269188913e-05,2.3694054240307257e-05,0.0005211088008855716
USA,Activity,Mining of uranium and thorium ores (12),6.12762928288005e-06,2.4505384675756796e-06,2.0734956746974384e-06,1.2880485170078246e-06,3.5722183918858044e-06
USA,Activity,N-fertiliser,3.44904625775859e-05,1.091062450629677e-05,8.343043191027211e-06,6.308080680180742e-06,2.0047621725005496e-05
USA,Activity,Other business activities (74),0.00019323111978699543,0.0001077125468557861,9.52392813587689e-05,8.103148486791153e-05,0.00013015112041879804
USA,Activity,Other land transport,1.6256187427915658e-05,5.089982238851008e-06,4.8346347330052854e-06,3.795402752186291e-06,1.0458991706220857e-05
USA,Activity,Other non-ferrous metal production,2.980793162044531e-05,3.52515971558904e-05,3.09517297520558e-05,1.851235247189305e-05,1.946407585846109e-05
USA,Activity,Other service activities (93),1.025974096010531e-06,3.45682271307334e-07,3.011776166409012e-07,2.3651907485745442e-07,6.338744503913344e-07
USA,Activity,P- and other fertiliser,4.5193496322619585e-05,1.9695553901183265e-05,1.7162328619484315e-05,1.1607018830901254e-05,2.7017127203914627e-05
USA,Activity,Paper,0.0007944517961917266,0.00022204915574059714,0.00018397841516522363,0.00012973178128446508,0.00046633624833014245
USA,Activity,Petroleum Refinery,0.0008092658111489558,0.0003903904615205911,0.00039722203275692556,0.0004330375000061995,0.0005568119955453564
USA,Activity,Pigs farming,6.053251855762191e-06,3.1260845244607213e-06,2.5179930343619937e-06,1.6557248567790533e-06,3.6615637330820456e-06
USA,Activity,"Plastics, basic",9.391158138938713e-05,7.730243113017988e-05,5.8076948151952795e-05,3.742841639755074e-05,5.7811923510795796e-05
USA,Activity,Post and telecommunications (64),2.5335598242460765e-05,1.3881224022357463e-05,1.322888137449278e-05,1.1253078407958024e-05,1.755954668431023e-05
USA,Activity,Poultry farming,2.5664107910320174e-06,1.9966885261965197e-06,1.7109317940839737e-06,1.0936661738052575e-06,1.6164566808030888e-06
USA,Activity,Precious metals production,0.001537115749846274,6.183889164225138e-05,4.992568779142718e-05,3.0080769013290272e-05,0.0008545823665877469
USA,Activity,Private households with employed persons (95),3.506025750988169e-10,3.8969551743567057e-10,3.9930430695528054e-10,3.7644624819590623e-10,3.7465902396882995e-10
USA,Activity,Processed rice,6.405795321588128e-06,6.283961657589095e-06,5.674512833101974e-06,3.642193138047928e-06,4.226953638023875e-06
USA,Activity,Processing of Food products nec,1.3104614062543557e-05,6.208280857158667e-06,5.320736528329103e-06,3.4983575954075993e-06,7.895451996930239e-06
USA,Activity,Processing of dairy products,1.414748053794883e-05,1.404010019796373e-05,8.442232905303462e-06,5.4174621782909635e-06,8.43650762926598e-06
USA,Activity,Processing of meat cattle,2.378801605183992e-06,1.4494288055406546e-06,1.2854616791261823e-06,8.669156496650181e-07,1.5611742242208656e-06
USA,Activity,Processing of meat pigs,1.627685430029772e-06,8.4702100203545e-07,6.777103430119851e-07,4.4310185814530856e-07,9.819994939515816e-07
USA,Activity,Processing of meat poultry,6.051086610629122e-07,4.563918213827134e-07,3.814492045205809e-07,2.450896297995692e-07,3.79141572004977e-07
USA,Activity,Processing of nuclear fuel,4.467576784760178e-09,4.736866995059614e-09,3.6692624400245283e-09,2.298333900483304e-09,2.8083796872891664e-09
USA,Activity,Processing vegetable oils and fats,4.05730233825777e-05,2.0054431749488112e-05,1.7705290996360635e-05,1.1337511696317295e-05,2.4382826834908596e-05
USA,Activity,Production of electricity by Geothermal,6.016470722435797e-07,5.380167652532001e-09,4.684783962380346e-09,3.164343480543652e-09,3.3320255551924686e-07
USA,Activity,Production of electricity by biomass and waste,0.0,0.0,0.0,0.0,0.0
USA,Activity,Production of electricity by coal,0.1401201069302184,0.0027979907974011557,0.0024102512681154985,0.0016283564543024059,0.07776886054710135
USA,Activity,Production of electricity by gas,0.0736078658489346,0.0005583345584609959,0.0004843040781058921,0.00032695456407180246,0.04074959945885407
USA,Activity,Production of electricity by hydro,0.0,0.0,0.0,0.0,0.0
USA,Activity,Production of electricity by nuclear,3.830038260277242e-05,2.972781132158894e-07,2.541707456877482e-07,1.7840749387269723e-07,2.1208902606588542e-05
USA,Activity,Production of electricity by petroleum and other oil derivatives,0.002304721715864696,2.1064576342393417e-05,1.829350766588834e-05,1.236560869220922e-05,0.0012764913032374749
USA,Activity,Production of electricity by solar photovoltaic,0.0,0.0,0.0,0.0,0.0
USA,Activity,Production of electricity by solar thermal,0.0,0.0,0.0,0.0,0.0
USA,Activity,"Production of electricity by tide, wave, ocean",0.0,0.0,0.0,0.0,0.0
USA,Activity,Production of electricity by wind,0.0,0.0,0.0,0.0,0.0
USA,Activity,Production of electricity nec,1.1289234919078385e-05,1.0198492140069885e-07,8.856163719066087e-08,5.978670754093288e-08,6.25222067690329e-06
USA,Activity,Production of meat products nec,1.3152052948479952e-05,7.125248151741614e-06,6.182066889091718e-06,4.0091683107590916e-06,8.05369384953367e-06
USA,Activity,Production of offshore wind plants,0.0,0.0,0.0,0.0,0.0
USA,Activity,Production of onshore wind plants,0.0,0.0,0.0,0.0,0.0
USA,Activity,Production of photovoltaic plants,0.0,0.0,0.0,0.0,0.0
USA,Activity,Public administration and defence; compulsory social security (75),3.8244227878090064e-05,3.5072173176213504e-06,3.0485458361951674e-06,2.4178620032255366e-06,2.192409410481866e-05
USA,Activity,"Publishing, printing and reproduction of recorded media (22)",4.0751284681779056e-05,2.3815254575485646e-05,2.0881853232610872e-05,1.7835940879773474e-05,2.7744549423810657e-05
USA,Activity,Pulp,3.4881902948414146e-05,2.178157676239577e-05,1.4729608270630524e-05,1.002736223541467e-05,2.082495357724213e-05
USA,Activity,Quarrying of sand and clay,0.00016936955615914174,2.0383796080212057e-05,1.8320971040429303e-05,1.0985475095085191e-05,9.570361381023581e-05
USA,Activity,Quarrying of stone,4.671263541535641e-05,6.5349812389740185e-06,6.731165966479655e-06,5.103610098991154e-06,2.7050089486582143e-05
USA,Activity,Raw milk,2.41111243690312e-06,2.3909243039595566e-06,1.4381198503515664e-06,9.230430074896916e-07,1.4379561406022815e-06
USA,Activity,Re-processing of ash into clinker,0.0,0.0,0.0,0.0,0.0
USA,Activity,Re-processing of secondary aluminium into new aluminium,0.0,0.0,0.0,0.0,0.0
USA,Activity,Re-processing of secondary construction material into aggregates,0.0,0.0,0.0,0.0,0.0
USA,Activity,Re-processing of secondary copper into new copper,0.0,0.0,0.0,0.0,0.0
USA,Activity,Re-processing of secondary glass into new glass,0.0,0.0,0.0,0.0,0.0
USA,Activity,"Re-processing of secondary lead into new lead, zinc and tin",0.0,0.0,0.0,0.0,0.0
USA,Activity,Re-processing of secondary other non-ferrous metals into new other non-ferrous metals,0.0,0.0,0.0,0.0,0.0
USA,Activity,Re-processing of secondary paper into new pulp,0.0,0.0,0.0,0.0,0.0
USA,Activity,Re-processing of secondary plastic into new plastic,0.0,0.0,0.0,0.0,0.0
USA,Activity,Re-processing of secondary preciuos metals into new preciuos metals,0.0,0.0,0.0,0.0,0.0
USA,Activity,Re-processing of secondary steel into new steel,0.0,0.0,0.0,0.0,0.0
USA,Activity,Re-processing of secondary wood material into new wood material,0.0,0.0,0.0,0.0,0.0
USA,Activity,Real estate activities (70),1.0414345606362434e-05,5.907971853178076e-06,5.385160720330555e-06,4.4847104335452144e-06,7.705448888512813e-06
USA,Activity,"Recreational, cultural and sporting activities (92)",5.031703728700408e-06,2.6751972149375186e-06,2.379842330447109e-06,2.019595678538032e-06,3.3778836084923533e-06
USA,Activity,Recycling of bottles by direct reuse,0.0,0.0,0.0,0.0,0.0
USA,Activity,Recycling of waste and scrap,0.00037360774645594174,0.00011472865724989127,9.547100022773117e-05,6.33189055180073e-05,0.00021857249683658635
USA,Activity,Renting of machinery and equipment without operator and of personal and household goods (71),2.0545287695999115e-05,8.898982187633756e-06,7.854601284139293e-06,6.080776612901019e-06,1.323300272470524e-05
USA,Activity,Research and development (73),1.4232537272331558e-05,1.687597497913601e-05,1.3356561937940735e-05,8.37457304962889e-06,9.109476072135183e-06
USA,Activity,Retail sale of automotive fuel,5.09556627308133e-07,4.432194776667745e-07,4.350331231283816e-07,3.0804317859093596e-07,6.008538700582405e-07
USA,Activity,"Retail trade, except of motor vehicles and motorcycles; repair of personal and household goods (52)",6.282656948870346e-07,2.7542650040981993e-07,2.518067396508572e-07,1.9595148357776288e-07,3.9620539640977336e-07
USA,Activity,"Sale, maintenance, repair of motor vehicles, motor vehicles parts, motorcycles, motor cycles parts and accessoiries",1.9553388632132288e-05,4.015875119940944e-06,3.3580223601530725e-06,2.325079005709177e-06,1.131240547944338e-05
USA,Activity,Sea and coastal water transport,0.0009022941258081611,0.00030354058014435875,0.0006792827437978001,0.0002796295105093375,0.0005383679795729762
USA,Activity,Steam and hot water supply,0.0004912332906718225,0.00015415811141672513,0.00013879606237233392,0.00010038290962767124,0.00029449063946028296
USA,Activity,Sugar refining,1.2227164938163993e-06,7.975261772470132e-07,6.957964769888344e-07,4.625519186154306e-07,7.82931018429644e-07
USA,Activity,Supporting and auxiliary transport activities; activities of travel agencies (63),6.067924693045833e-05,3.3152828766684854e-05,3.403469059017435e-05,2.4711771034835372e-05,4.1433323748484816e-05
